created_at,full_text,screen_name,location,description,followers_count,friends_count,statuses_count,verified,full_retweet_text
2020-04-03 07:19:55+00:00,"RT @SkyNews: Last night saw a host of celebrities including Phoebe Waller-Bridge, Daniel Craig and Elton John join in on the #ClapforCarers…",beingpt,India,YO! Beyotch!!,141,693,12917,False,"Last night saw a host of celebrities including Phoebe Waller-Bridge, Daniel Craig and Elton John join in on the #ClapforCarers as the show of support swept the country for the second Thursday in a row

#COVID19: https://t.co/NtSLGVC4M0 https://t.co/KvMnYwJU0a"
2020-04-03 07:19:57+00:00,"RT @123telugu: Shah Rukh wins hearts with his Corona relief initiatives

https://t.co/65fCAihlN5

#ShahRukhKhan #coronavirus",MeSamruddhi,India,"One day I’ll get what I deserve : a better quality of life, or death.",1706,1243,126576,False,"Shah Rukh wins hearts with his Corona relief initiatives

https://t.co/65fCAihlN5

#ShahRukhKhan #coronavirus"
2020-04-03 07:19:58+00:00,"RT @BiharKaLal: Every word said in the video is true
If Muz|ims will not follow lockdown &amp; spread Corona by spitting on people they should…",bhuvan_luthra,"New Delhi, India",No Value Mentioned,158,1841,48108,False,"Every word said in the video is true
If Muz|ims will not follow lockdown &amp; spread Corona by spitting on people they should get ready to face warth of innocent civilians https://t.co/wGLfSfXOHa"
2020-04-03 07:19:58+00:00,"RT @ANI: Armed Forces running 6 quarantine facilities.1737 ppl have been handled at these centres, of which 403 have been released so far.…",mvgirish9999,"Chittoor, India","I never prove to be good enough for Everyone........!!
 But I'm the best for them who Understands Me ❤️!!",438,258,29626,False,"Armed Forces running 6 quarantine facilities.1737 ppl have been handled at these centres, of which 403 have been released so far. 3 positive COVID19 cases were referred to Safdarjung Hospital in Delhi.15 other facilities being kept ready as standby if required:Ministry of Defence https://t.co/DlwNlFJu8r"
2020-04-03 07:19:58+00:00,"Why invite loneliness when you can build a video-conferencing app for better work management.
Hire our stellar developers to build an app with customized features. https://t.co/UUxH8e7SoH #videoconferencing #videoconferenceapp #workfromhome #wfhtips #socialdistanacing #covid19 https://t.co/MrFPc6THcx",CMARIXTechLabs,"Ahmedabad, Gujarat, India","CMARIX is a leading technology #outsourcing company in India with expertise in #MobileAppdevelopment, custom #software & Websites. We make outsourcing simple!",6763,7439,8571,False,No Value Mentioned
2020-04-03 07:19:59+00:00,"RT @ABPNews: Coronavirus: Shah Rukh Khan To Donate To PM-CARES Fund &amp; Maha CM Relief Fund; Announces Several Initiatives

#ShahRukhKhan #SR…",paragt99,"Guwahati, India","Here to  love & support
#SRK ❤️
#SRKIAN🙏

# भारत माता की जय 🇮🇳♥️",908,294,4169,False,"Coronavirus: Shah Rukh Khan To Donate To PM-CARES Fund &amp; Maha CM Relief Fund; Announces Several Initiatives

#ShahRukhKhan #SRK #SRKDonatesForCovid #COVID #COVID19 #Coronavirus 

https://t.co/y2iXwuTu8W"
2020-04-03 07:20:01+00:00,"RT @HinduJagrutiOrg: The whole world is struggling to contain Coronavirus pandemic. India too is fighting against it and Police, Administra…",1Somashekhar,India,🙏ll है श्रीकृष्ण सभी साधकोंक रक्षा कीजिये ll🙏,73,58,9158,False,"The whole world is struggling to contain Coronavirus pandemic. India too is fighting against it and Police, Administration, Govt agencies are working day &amp; night for this purpose. Still some fanatic jihadis are spreading Corona due to their irresponsible behavior!

 #corona_jihad https://t.co/dtLL3HORjn"
2020-04-03 07:20:01+00:00,RT @bainjal: Diyar bhakts a Bjp leader just pointed out to me the claimed educational levels of of Modi &amp; Sonia Gandhi are the same. So wha…,ShreyasKW,"Mumbai, India","Never Give Up😎
Happiness is my choice 😊
Music Lover🎶🎵
Crazy for cricket 🏏
Big fan of  #Virat_Kohli🙂",827,75,5807,False,Diyar bhakts a Bjp leader just pointed out to me the claimed educational levels of of Modi &amp; Sonia Gandhi are the same. So what makes your god Modi asking us to light candles in a pandemic high level science?
2020-04-03 07:20:01+00:00,RT @Vikram_Sood: And we will retweet each time.,imsleepyguy,India,"logic is greater than feelings (wrt politics) India, Messi, FC Barcelona above everyone else.",432,674,88082,False,And we will retweet each time. https://t.co/L2zLH9aqBw
2020-04-03 07:20:01+00:00,RT @Yusuffali_MA: I have humbly contributed INR 25 Crores to #PMCaresFund    to support all relief works in India’s fight against #COVIDー19…,ErshadK63582069,India,Human | Engineer |,265,1260,35260,False,I have humbly contributed INR 25 Crores to #PMCaresFund    to support all relief works in India’s fight against #COVIDー19 @narendramodi @PMOIndia #IndiaFightsCorona
2020-04-03 07:20:02+00:00,"RT @sapnamadan: This guy was infected with coronavirus. He coughed intentionally 
on other person while in queue for train ticket in Thaila…",LakshamRamBhakt,"Ayodhya, India","मैं मनुष्य हु , कोई भगवान नही।
प्रभु श्री राम का सेवक हु 
भक्त हु 
ॐ श्री रामदूताय नमः 🙏 जय श्री राम 🙏",2088,1420,76469,False,"This guy was infected with coronavirus. He coughed intentionally 
on other person while in queue for train ticket in Thailand, later dropped dead in the carriage after vomiting and convulsing during the journey.
Instant Karma!

 https://t.co/ukEpiupNOv"
2020-04-03 07:20:04+00:00,"A controversial Israeli cyber-security company is marketing software that uses mobile phone data to monitor and predict the spread of the coronavirus.

https://t.co/mJo1jfY0dx",RaktimBanerjee,India,Explorer 🌐 • Tech junkie • Passionate music 🎶 lover • Travel fanatic 🚐 • Web trailblazer 💻 • #MUFC ⚽ fan • Typical Indian 🇮🇳 • ⌚ GMT + 05:30 • ♑,1246,1432,25498,False,No Value Mentioned
2020-04-03 07:20:04+00:00,"RT @idr_online: #Gender | While health emergencies are often seen as gender-neutral, @SohiniBee, CEO of @INBreakthrough, explains why our r…",snagesh2,"Dehradun, Uttarakhand, India",Childhood Disabilities | Disability in Global Health | Latika Roy Foundation | Atlantic Fellow | Women in Global Health India,1036,5000,7269,False,"#Gender | While health emergencies are often seen as gender-neutral, @SohiniBee, CEO of @INBreakthrough, explains why our response to the #COVIDー19 pandemic must prioritise women.

@SEWABharat @EkjutIndia @BreakthroughUS @ndvh 

https://t.co/oIWmiPKzSL"
2020-04-03 07:20:06+00:00,Not fair ..Sir 🙏 @ShashiTharoor https://t.co/63JMxW8voY,Shalini50251722,India,Professor Of HRM& OB Authored : “HR Initiatives In Building Inclusive & Accessible Workplaces” Emerald Publishing(2/12/2019),101,328,1271,False,No Value Mentioned
2020-04-03 07:20:07+00:00,"RT @TheQuint: LIVE | 172 new positive #COVID19 cases reported in UP on 3 April, of which 42 persons had attended the #TablighiJamaat event…",VijayMi98897381,"Beera ,Banda U.P. India","proud ,Of India ,मै हर बार मोदी जी को ही वोट दूगां जी,",299,3345,57201,False,"LIVE | 172 new positive #COVID19 cases reported in UP on 3 April, of which 42 persons had attended the #TablighiJamaat event in Delhi.

Follow for updates: https://t.co/y4v8fvGwRu"
2020-04-03 07:20:07+00:00,"RT @Ethirajans: 200 Villages isolated themselves in Tiruvallur District, TN.

Village Panchayat level WhatsApp Groups have been formed with…",rramasubramaian,"Chennai, India",No Value Mentioned,121,1041,2990,False,"200 Villages isolated themselves in Tiruvallur District, TN.

Village Panchayat level WhatsApp Groups have been formed with public as members, any need, if shared, will be delivered at doorstep.

Outsiders are completely prohibited.

#COVIDー19 #JanataCurfew
@narendramodi"
2020-04-03 07:20:08+00:00,"RT @KhaledBeydoun: “That man is not from me who sleeps contentedly while his neighbor sleeps hungry.”

~ Prophet Muhammad (PBUH)

Don’t hoa…",ShahidA28985860,India,No Value Mentioned,225,841,42480,False,"“That man is not from me who sleeps contentedly while his neighbor sleeps hungry.”

~ Prophet Muhammad (PBUH)

Don’t hoard food and leave nothing for others during this pandemic."
2020-04-03 07:20:08+00:00,"RT @airtelnews: Bharti Enterprises and its companies Bharti Airtel, Bharti Infratel and others are contributing a sum of over Rs 100 crore…",S_APANDEY,India,Follow me & Follow Back,1114,1595,1313,False,"Bharti Enterprises and its companies Bharti Airtel, Bharti Infratel and others are contributing a sum of over Rs 100 crore for India’s fight against #COVID19. https://t.co/bdz7SOyaSF"
2020-04-03 07:20:09+00:00,Need similar laws here too. https://t.co/HRfwdmul3V,CaRajShukla,"New Delhi, India","Malice towards none, eager to share views and opinion on multiple subjects, news buff, foodie, loves travel.",72,136,3362,False,No Value Mentioned
2020-04-03 07:20:09+00:00,RT @VarunKumarIPSTN: Don’t know who’s the artist but this is very powerful. #CoronavirusOutbreak #CoronaStopKaroNa #CoronaOutbreak #corona…,najeebimrankhan,"Hyderabad, India",No Value Mentioned,36,123,4730,False,Don’t know who’s the artist but this is very powerful. #CoronavirusOutbreak #CoronaStopKaroNa #CoronaOutbreak #corona #Police #cops #StayHomeStaySafe #StayHomeSaveLives #StayHomeIndia https://t.co/8tzq9URIoo
2020-04-03 07:20:09+00:00,"RT @Chellaney: Tablighi Jamaat's gathering in Kuala Lumpur at February-end spread COVID-19 to six ASEAN nations, prompting Indonesia to ban…",OfficeOfSA,"New Delhi, India","Content, Social media, Analysis, PoV, RTs not endorsements, Believe in: 
कृते प्रतिकृतिं कुर्याद्विंसिते प्रतिहिंसितम्।
तत्र दोषं न पश्यामि शठे शाठ्यं समाचरेत्॥",580,1676,76398,False,"Tablighi Jamaat's gathering in Kuala Lumpur at February-end spread COVID-19 to six ASEAN nations, prompting Indonesia to ban a similar gathering. Yet, despite knowing this, India allowed Tablighis to congregate in New Delhi for 18 days. Has no lesson be learned from Shaheen Bagh?"
2020-04-03 07:20:09+00:00,"RT @rameshsrivats: Notice period for various things -
Women's day social media initiative - 5 days.
Bang plates - 4 days.
Light candles - 2…",TweetOfGandhi_,India,Not so Witty.,52178,1708,22949,False,"Notice period for various things -
Women's day social media initiative - 5 days.
Bang plates - 4 days.
Light candles - 2 days.
Watch video announcing above - 12 hours.
Twenty-one day lockdown - 4 hours."
2020-04-03 07:20:10+00:00,@DilipSriBjp @rajnathsingh  You plead with Muslim clerics but a Hindu priest is beaten up. https://t.co/AAw61g2Wf5,SudeepIndian,India,Follow my FB Page and tweets if you want to keep yourself updated about defense related news,111,246,11633,False,No Value Mentioned
2020-04-03 07:20:10+00:00,"RT @nsitharaman: Let’s defeat #Corona together. Let Ma Bharati win. Remember on Sunday, 5 April, give 9 minutes standing out of homes, eith…",rajiwana,india,No Value Mentioned,134,405,21837,False,"Let’s defeat #Corona together. Let Ma Bharati win. Remember on Sunday, 5 April, give 9 minutes standing out of homes, either in your balcony or outside the doorway, keep a light in your hand&amp; remember we are all together in this fight. Social distancing to be respected. @PMOIndia"
2020-04-03 07:20:10+00:00,"RT @pragsrats: Those who say that people blame the whole community, find me one person who would blame this man.

These people always get a…",agneepankh,"Pune, India",Cogito Ergo Sum!,223,988,13024,False,"Those who say that people blame the whole community, find me one person who would blame this man.

These people always get appreciated. Nobody has a problem with religion. The divide is not religious.

Questioning why the whole community is making it religious. https://t.co/18B0Lm8DNQ"
2020-04-03 07:20:10+00:00,"RT @manickamtagore: Finally , Government and Ministries have acknowledged that Darkness has spread while they were busy wasting time on org…",C_Sreeraja,"Virudhunagar, India","President, Virudhunagar (East) District​ Congress Committee",612,152,5222,False,"Finally , Government and Ministries have acknowledged that Darkness has spread while they were busy wasting time on organising election events for Trump ...#Covid_19india https://t.co/v7SKRcJa38"
2020-04-03 07:20:11+00:00,"RT @TheCitizen_in: #Covid19: In #India, we are also having to deal with police brutality as people are beaten up and lathi charged by cops…",HarisAly,Indian lives in UAE,Muslim indian socialist tableeghi grad desi Business boy... Do Dare Be Rare....!!,136,188,1094,False,"#Covid19: In #India, we are also having to deal with police brutality as people are beaten up and lathi charged by cops for trying to purchase essentials, like milk and water. URMILA PULLAT writes. 
 https://t.co/GMJlo4kmSM"
2020-04-03 07:20:12+00:00,Due to coronavirus Pandemic @DeraSachaSauda followers are helping the needy in every way at the state level all over the country #SelflessServiceByDSSVolunteers,babluinsan4,"Mawana, India","Msc math's Bed...
member of ssj green s welfare force🌾🌾
follow me on twitter",142,236,16051,False,No Value Mentioned
2020-04-03 07:20:12+00:00,"RT @ShashiTharoor: This is no accident: the PM spoke on Ram Navami at 9 am for 9 mins, asked us to light diyas &amp; candles on 5/4 at 9 pm for…",shaansitive,"New Delhi, India","The reverse side also has a reverse side.

------",285,816,23128,False,"This is no accident: the PM spoke on Ram Navami at 9 am for 9 mins, asked us to light diyas &amp; candles on 5/4 at 9 pm for 9 mins. He is invoking all the auspicious elements Hinduism associates with number 9. Back to Ram Bharose?! #COVID19 must be more serious than we thought!"
2020-04-03 07:20:13+00:00,It looks like he is worried abt his bussiness. There r lots way to read news. TV channels and online news papers. Its upto individual . https://t.co/ZWmjDRprjC,gracesapna,India,"I just love being creative-- whether it is photography, graphic designing, or something new! Web/graphic designer,blogger. Running a boutique.",232,199,22764,False,No Value Mentioned
2020-04-03 07:20:13+00:00,"RT @WIONews: #COVID19Pandemic | A couple in Chhattisgarh has named their newborn twins as 'Corona' and 'Covid'! 

https://t.co/uzNGqc6PcZ",madhuee444,"Eluru, India",sarcastic......🤔🤔🤔🤔🤔,48,96,5309,False,"#COVID19Pandemic | A couple in Chhattisgarh has named their newborn twins as 'Corona' and 'Covid'! 

https://t.co/uzNGqc6PcZ"
2020-04-03 07:20:14+00:00,RT @listenshahid: Let's recognize efforts of these soldiers on foot &amp; wheels helping every1 to #StayAtHome. PDS ration home-delivered to 75…,gangulyrahul,"New Delhi, India","Responsible citizen of India, Foodie, Adventure & travel junkie, photographer!!",164,684,14574,False,"Let's recognize efforts of these soldiers on foot &amp; wheels helping every1 to #StayAtHome. PDS ration home-delivered to 75,216 families in 6 days, 1.85 Lakh familes more to go. People turning up at some depots are discouraged. #Srinagar https://t.co/VXVX80gZKJ"
2020-04-03 07:20:14+00:00,"RT @Sumra_tweets: Hospital in Bisha, #Saudiarabia 🇸🇦celebrates the recovery of the first person in town with Coronavirus as she leaves the…",syedyusuf007,"Hyderabad ,India",♥♥محمد ﷺ♥♥,990,1185,15213,False,"Hospital in Bisha, #Saudiarabia 🇸🇦celebrates the recovery of the first person in town with Coronavirus as she leaves the hospital after  13 days Treatment and Then being discharged 👏🏼👏🏼👏🏼
Alhumdulillah https://t.co/9N7eYnAZPA"
2020-04-03 07:20:14+00:00,"RT @ShashiTharoor: This is no accident: the PM spoke on Ram Navami at 9 am for 9 mins, asked us to light diyas &amp; candles on 5/4 at 9 pm for…",MathewTopsy,"Mumbai, India",Banker I Policy Wonk I Design buff,87,1008,1320,False,"This is no accident: the PM spoke on Ram Navami at 9 am for 9 mins, asked us to light diyas &amp; candles on 5/4 at 9 pm for 9 mins. He is invoking all the auspicious elements Hinduism associates with number 9. Back to Ram Bharose?! #COVID19 must be more serious than we thought!"
2020-04-03 07:20:14+00:00,"7 new cases of #coronavirus have been detected in ahmedabad today. #Covid19 tally reaches to 38 in Ahmedabad, 95 in state.",HarfanMaulaa,"Ahmedabad, Gujarat, India",No nonsense tweets. CEO @MeDigit. Fellow at @ProFellows Cricket. Movies. Music. Motorcycles. Marketing. Entrepreneurship.,989,626,8039,False,No Value Mentioned
2020-04-03 07:20:15+00:00,"Religious leaders should disseminate message of social distancing: PM Modi to states
 https://t.co/uhLhoLahiw

via NaMo App https://t.co/abvp2hzijk",bhaveshkaria143,India,always ready to fight for 🇮🇳    कर्मणयेवाधिकारस्ते मा फलेषु कदाचन। मा कर्मफलहेतुर्भूर्मा ते सङ्गोऽस्त्वकर्मणि।,245,426,20692,False,No Value Mentioned
2020-04-03 07:20:17+00:00,"See piyali the whole pandemic has affected people's mental health. So they come here to distract themselves. If you have problem with people tweeting about any actor,show or couple then mute the word. Aur sabka apna acc unki marzi woh jo kare. Take care of yourself 💞 https://t.co/hHd5dsraAb",Shaily07895401,"New Delhi, India",Shivikaforever❤,283,55,15546,False,No Value Mentioned
2020-04-03 07:20:17+00:00,China has won an undeclared third world war without firing a single missile. https://t.co/K7iHyyESzP,abhiarnav11,"Gurgaon, India","Software Engineer, Techie, Startups. 
An atom of Stardust in infinite universe.",151,1226,838,False,No Value Mentioned
2020-04-03 07:20:18+00:00,"RT @johnrobertsFox: Peter Navarro just now at the daily COVID-19 briefing:  ""One of the things this crisis has taught us is that we are ove…",jmo911,"Indiana, USA","I tweet because I can, it’s only a phase.....#KAG2020 #Gramma #PackerFan and searching for some #truth in a world of #lies",136,346,4113,False,"Peter Navarro just now at the daily COVID-19 briefing:  ""One of the things this crisis has taught us is that we are overdependent on a global supply chain."""
2020-04-03 07:20:18+00:00,RT @kentbuse: ‘Corona coup’ - ‘How this crisis reshapes our world is not a foregone conclusion. It depends on us. But we can’t let those wh…,snagesh2,"Dehradun, Uttarakhand, India",Childhood Disabilities | Disability in Global Health | Latika Roy Foundation | Atlantic Fellow | Women in Global Health India,1036,5000,7269,False,‘Corona coup’ - ‘How this crisis reshapes our world is not a foregone conclusion. It depends on us. But we can’t let those who want to shut down and disempower us gain the upper hand. Who seizes this moment will write the future.’ ⁦@ClaireProvost⁩  https://t.co/KgMXZD7X28
2020-04-03 07:20:18+00:00,RT @republic: 'WHO? Call it China Health Organisation!': Japan makes big allegations amid Coronavirus https://t.co/E4aL1LWUUo,jsvirdi_1954,India,Consulting Engineer. RTs are not endorsements.,130,449,44759,False,'WHO? Call it China Health Organisation!': Japan makes big allegations amid Coronavirus https://t.co/E4aL1LWUUo
2020-04-03 07:20:18+00:00,RT @BLSTG: The best release date for #Master is definitely Diwali 2020.. Coronavirus has just started in India and might take until June fo…,venkysrg,"Tiruchirapalli, India",You will know me soon,310,1548,76328,False,The best release date for #Master is definitely Diwali 2020.. Coronavirus has just started in India and might take until June for this issue to get solved.. People need atleast 3 months to back to normal economy and life.. Diwali 2020 is the best date as of now
2020-04-03 07:20:18+00:00,RT @PplOfIndia: I could never imagine even in the wildest of my dreams that Muslims could go to the extent of spreading #COVID to protest a…,k_bhairav,India,No Value Mentioned,1018,272,133371,False,"I could never imagine even in the wildest of my dreams that Muslims could go to the extent of spreading #COVID to protest against the CAA.  #TablighiJamat 
@_sabanaqvi @khanumarfa @Shehla_Rashid @zainabsikander"
2020-04-03 07:20:19+00:00,Financial companies are forcing to sign this agreement for claiming moratorium of laon is this right/legal if yes then y this julma the poor have to die any how today or tomorrow.. This way or that then y not die of corona or this lock down is to save the rich @nsitharaman https://t.co/HwnHD4G5Tl,rahul___yadav,"Maharashtra, India",Government and Politics #law student #future advocate,32,141,167,False,No Value Mentioned
2020-04-03 07:20:20+00:00,Please Start Singhasan Battisi and Vikram Betaal Sweet Memory of childhood. Thanks Doordarshan https://t.co/ntLzHtRhis,rohilla_vinod,India,My imagine,0,37,77,False,No Value Mentioned
2020-04-03 07:20:21+00:00,RT @TarekFatah: Muslim man wipes his nose and mucous on currency notes to spread #coronavirus pandemic. He claims there is no cure for #COV…,chaand007,India,No Value Mentioned,34,46,587,False,"Muslim man wipes his nose and mucous on currency notes to spread #coronavirus pandemic. He claims there is no cure for #COVID19 because it is disease sent by Allah to destroy infidels. 
 https://t.co/g0TRlOgkIf"
2020-04-03 07:20:22+00:00,"RT @ShashiTharoor: This is no accident: the PM spoke on Ram Navami at 9 am for 9 mins, asked us to light diyas &amp; candles on 5/4 at 9 pm for…",CineSankalpRaj,"Mumbai, India","Citizen | Writer,Director,Poet, Storyteller | Supervising Producer@ Dice Media |Ex. Associate Producer @Taxi Films | Ex. Creativ Director @YourQuote",174,276,3744,False,"This is no accident: the PM spoke on Ram Navami at 9 am for 9 mins, asked us to light diyas &amp; candles on 5/4 at 9 pm for 9 mins. He is invoking all the auspicious elements Hinduism associates with number 9. Back to Ram Bharose?! #COVID19 must be more serious than we thought!"
2020-04-03 07:20:22+00:00,"RT @alluarjun_ajay: #HappyBirthdayBabyBoyAlluAyaan smile smile smile.....  @alluarjun @AllusnehaArjun 
Have a blast  and stay home stay saf…",AkshithGundu,"Hyderabad, India","Die hard fan of 🅰️🅰️
@AAArmyHyd",591,562,18503,False,"#HappyBirthdayBabyBoyAlluAyaan smile smile smile.....  @alluarjun @AllusnehaArjun 
Have a blast  and stay home stay safe our all #alluarjun army will bless you where ever we are my blessings will be there with you #AlluArjunArmy @Santhosh_777 https://t.co/8tC7DCsskw"
2020-04-03 07:20:22+00:00,RT @VaniKola: @Chirag_Gandhi7 @TVMohandasPai @sumant_sinha @ShereenBhan @vikramchandra @thePHFI Supporting startups along the recovery jour…,VijayMi98897381,"Beera ,Banda U.P. India","proud ,Of India ,मै हर बार मोदी जी को ही वोट दूगां जी,",299,3345,57201,False,"@Chirag_Gandhi7 @TVMohandasPai @sumant_sinha @ShereenBhan @vikramchandra @thePHFI Supporting startups along the recovery journey is important. They contribute to our economy and innovation. Temporary measures for survival are managing cashflows - debt, working capital, rentals, fixed costs so on by the adverse effect of lockdown. (1/2)"
2020-04-03 07:20:22+00:00,"Do you agree?

#COVID19Pandemic #Corona https://t.co/RknoylZ5YP",sameerp19,India,"#Inventor, #Startup Entrepreneur, Speaker l
Aim 2 build India as Economic Super Power l Student of Human, Hindutva, Law & Life l Views r persnl, RT nt Endorsmnt",598,403,2882,False,No Value Mentioned
2020-04-03 07:20:22+00:00,RT @SaketGokhale: He’ll ask people to bang utensils &amp; light candles to periodically check whether there’s unflinching control over the floc…,nsadaf,India,bol ke lab azaad hain tere,234,1136,37671,False,"He’ll ask people to bang utensils &amp; light candles to periodically check whether there’s unflinching control over the flock. 

Then he’ll use all available instruments &amp; the media to vilify a minority community &amp; unleash the flock upon them. 

Fascism 101 aided by a pandemic."
2020-04-03 07:20:22+00:00,RT @Joydas: Lighting up Diya and Candles will generate Carbon Monoxide - CO. That will cancel the CO from the word CORONA. What is left is…,KamalKishor31,"New Delhi, India",No Value Mentioned,30,96,12743,False,Lighting up Diya and Candles will generate Carbon Monoxide - CO. That will cancel the CO from the word CORONA. What is left is just RONA which is harmless. This is a brilliant master stroke by Narendra Modi
2020-04-03 07:20:23+00:00,"RT @IamSyedZaker: On the Instructions Of AIMIM Party President Barrister @asadowaisi

@aimim_national Jubille Hilla and Solapur Incharge @a…",MohdRasheedudd1,"Hyderabad, India","Branch General Secretary At AIMIM Ibtedai Committee Owaisi Colony, Santosh Nagar Division, Yakutpura Constituency.",42,36,909,False,"On the Instructions Of AIMIM Party President Barrister @asadowaisi

@aimim_national Jubille Hilla and Solapur Incharge @anwarsadatsaad2 today Distribution Ration Kit's to 500 ( Five hundred ) family's who have been affected due to #Lockdown at Jubille Hills and Allapur Places. https://t.co/q46mjg5oEW"
2020-04-03 07:20:25+00:00,"@CPBlr Sir, How can I go to command hospital to get medicines for my grandparents during this lockdown? I need to get the medicines by Monday. The KSP ePass app doesn’t work too. Please suggest. Thank you.",sachinambiar,"Bangalore,India.",No Value Mentioned,43,56,14,False,No Value Mentioned
