created_at,full_text,screen_name,location,description,followers_count,friends_count,statuses_count,verified,full_retweet_text
2020-01-30 21:03:50+00:00,RT @the_hindu: Just in | #WHO declares international emergency over #coronavirus. AFP,Vasuja1n,India,"kvian,student of animal and plant science.",27,77,7463,False,Just in | #WHO declares international emergency over #coronavirus. AFP
2020-01-30 21:03:55+00:00,"RT @GappistanRadio: Coronavirus confirmed case detected in the country, a very very densely populated country, how is that not the biggest…",AshwaniChowdhry,"Lucknow, India",A proud Indian. National interest supreme.,359,854,178106,False,"Coronavirus confirmed case detected in the country, a very very densely populated country, how is that not the biggest story tonight"
2020-01-30 21:03:56+00:00,"RT @PIB_India: Advisory to recess the symptoms of respiratory tract in possible Corona virus infected cases

Read the detailed advisory:

h…",AzharMd496,"Hyderabad, India","ke aap umr guzar dijiye, umr guzar di gayi, uske visal ke liye, apne kamal ke liye, halat-e-dil ke thi kharab, aur kharab kee gaayi. (Jaun Eliya)",48,732,4886,False,"Advisory to recess the symptoms of respiratory tract in possible Corona virus infected cases

Read the detailed advisory:

https://t.co/hApX41NPx7"
2020-01-30 21:03:59+00:00,"RT @RT_com: Declaration of international health emergency over #coronavirus outbreak is ‘not a vote of no confidence in #China,’ but made o…",selberan,"INDIA,KERALA,KOLLAM.UAE",YOU ARE LOOKING GOOD,733,4973,87241,False,"Declaration of international health emergency over #coronavirus outbreak is ‘not a vote of no confidence in #China,’ but made out of concern for other countries with ‘weaker’ healthcare systems – #WHO Director-General Tedros Adhanom Ghebreyesuss

DETAILS: https://t.co/RQXE66NUpt https://t.co/kR1tEAJ7VU"
2020-01-30 21:04:11+00:00,"RT @RT_com: Western media has taken advantage of #coronavirus epidemic to let their anti - #China flag fly in all its biased glory 

Op-Ed…",selberan,"INDIA,KERALA,KOLLAM.UAE",YOU ARE LOOKING GOOD,733,4973,87241,False,"Western media has taken advantage of #coronavirus epidemic to let their anti - #China flag fly in all its biased glory 

Op-Ed by Helen Buyniski

https://t.co/efMl6A8RAa"
2020-01-30 21:04:21+00:00,"RT @UNICEF: The novel #coronavirus is officially a public health emergency of international concern, @WHO has declared.

#2019nCov is sprea…",Vasuja1n,India,"kvian,student of animal and plant science.",27,77,7463,False,"The novel #coronavirus is officially a public health emergency of international concern, @WHO has declared.

#2019nCov is spreading fast and time is not on our side. We're working with partners to help protect children and halt the virus now.

https://t.co/9IXITMxbmD"
2020-01-30 21:04:21+00:00,"RT @RT_com: First case of direct transmission of #coronavirus confirmed in #US – #CDC

https://t.co/PW7D4SdGfc https://t.co/lcqaRQGrJO",selberan,"INDIA,KERALA,KOLLAM.UAE",YOU ARE LOOKING GOOD,733,4973,87241,False,"First case of direct transmission of #coronavirus confirmed in #US – #CDC

https://t.co/PW7D4SdGfc https://t.co/lcqaRQGrJO"
2020-01-30 21:04:24+00:00,RT @karthickselvaa: #WHO (World Health organization) declares international emergency over #coronavirus - AFP,featherlytouch,India,Art and peace loving human.,222,1039,43168,False,#WHO (World Health organization) declares international emergency over #coronavirus - AFP
2020-01-30 21:04:40+00:00,"That video of a woman eating a bat was filmed in Palau, a Pacific island nation, not China. Sensitivity to MSG isn't real. (No one's gotten headaches from eating tomatoes or Parmesan cheese and guess what's in them? MSG.)

Don't use Asian people as scapegoats for your racism. https://t.co/8Bv8Gg4rDs",NewChurchDOC,"Indianapolis, IN","We are a ministry that trains, equips, assists and multiplies emerging and affiliating congregations and leaders of the Christian Church (Disciples of Christ).",293,616,792,False,No Value Mentioned
2020-01-30 21:04:40+00:00,"Really heartbreaking to see these doctor
A big salute to u guys 
God bless u🙏🙏🙏🙏
My prayers to the doctors and the patients who are effected by Corona virus
#coronavirus 
#CoronavirusWho 
#coronaviruschina https://t.co/xJPB46r1vn",MB_Hariharan,India chennai,"Humanitarian,proud indian🇮🇳,cricket lover",4,16,25,False,No Value Mentioned
2020-01-30 21:04:42+00:00,"Those are just the greatest photos I've ever seen! Great pictures of the bigliest ,tallest, widest wall ever!!  Just like the Great Wall of China. The best part is: Mexico is paying for it !!! Wow, thank you so much Mexico!! https://t.co/6gvps6UP5V",tjnfortw,"Fort Wayne, Indiana ",No Value Mentioned,2,10,226,False,No Value Mentioned
2020-01-30 21:04:47+00:00,RT @PDChina: #BREAKING: World Health Organization (@WHO) has declared a public health #emergency over the global outbreak of novel #coronar…,selberan,"INDIA,KERALA,KOLLAM.UAE",YOU ARE LOOKING GOOD,733,4973,87241,False,#BREAKING: World Health Organization (@WHO) has declared a public health #emergency over the global outbreak of novel #coronarvirus. #2019nCoV https://t.co/6ReawWFmrk
2020-01-30 21:04:51+00:00,"RT @mknid: Kerala news channels are of another league. It's only hours, but the reportage on Corona has been extensive yet measured. Anchor…",AnmolAlphonso,"Mumbai, India","Journalist, Ex-intern @IndiaSpend @FactCheckIndia @IndianExpress, @TOIMumbai, @mid_day, Alumnus @stpaulsice, Liberal, opinionated. (PS: views are personal)",851,4321,28153,False,"Kerala news channels are of another league. It's only hours, but the reportage on Corona has been extensive yet measured. Anchors are so calm, without spreading any panic. Manorama has even started a live ask-a-doctor pgm where callers are highlighting fake Whatsapp fwds."
2020-01-30 21:04:57+00:00,RT @WHO: LIVE: Press conference on the Emergency Committee meeting on #2019nCoV https://t.co/hTQam7RWc9,selberan,"INDIA,KERALA,KOLLAM.UAE",YOU ARE LOOKING GOOD,733,4973,87241,False,LIVE: Press conference on the Emergency Committee meeting on #2019nCoV https://t.co/hTQam7RWc9
2020-01-30 21:04:57+00:00,"RT @ScholarlyGamer: Today I wrote a short article on #PlagueInc, discussing concerns amidst people using it as a source of information on c…",RADarnell,"Indiana, USA","Just a madman with a box, sorting things out one day at a time. Lover of games, comics, Japan, and all other things geek.  Stream Mon, Wed, Fri @ 6pm CST.",353,491,35604,False,"Today I wrote a short article on #PlagueInc, discussing concerns amidst people using it as a source of information on coronavirus. 

It felt nice to dig back into my academic roots and do some research, focusing on linkages between gaming and education.

https://t.co/Rg59WOoge1"
2020-01-30 21:04:59+00:00,"NIV will play important role in combating Novel Coronavirus. vaccine breakthrough will be done by our indian doctors and scientists....
#coronavirusindia #CoronavirusWho #coronarvirus #coronaviruschina #coronaviruswuhan 
#pib",Svayampelaseva,india,"passionate for Indian army. proud indian 
||worst for anti-nationals||
love for HindKiSena
military enthusiast",45,211,1744,False,No Value Mentioned
2020-01-30 21:04:59+00:00,Chinese New Year 2020: The Year of the Coronavirus https://t.co/U7iPPumrrp,RealAlisonPoole,"Indiana, USA","33 yr old. Lawyer. Lesbian. No DM's.  Jewish. ""Love thy neighbor, keep the hedge.""-Swiss Proverb",6033,3128,189335,False,No Value Mentioned
2020-01-30 21:05:15+00:00,"RT @DrTedros: In many ways, #China is actually setting a new standard for outbreak response. Our greatest concern is the potential for the…",selberan,"INDIA,KERALA,KOLLAM.UAE",YOU ARE LOOKING GOOD,733,4973,87241,False,"In many ways, #China is actually setting a new standard for outbreak response. Our greatest concern is the potential for the virus to spread to countries with weaker health systems, and which are ill-prepared to deal with it. #2019nCoV
https://t.co/GdUQZGvzkd"
2020-01-30 21:05:17+00:00,RT @ABC: BREAKING: World Health Organization declares the coronavirus a public health emergency of international concern—only the sixth tim…,nezforeva,India,"allhamdulilah 😊 for everything.
being introvert is not a hobby that I own ..it's something I inherited 😂",1314,1806,1752,False,BREAKING: World Health Organization declares the coronavirus a public health emergency of international concern—only the sixth time such an emergency has been declared. https://t.co/cxD1zD8zvv https://t.co/yScAgxTxov
2020-01-30 21:05:18+00:00,"RT @DrTedros: I am declaring a public health emergency of international concern over the global outbreak of #2019nCoV, not because of what…",selberan,"INDIA,KERALA,KOLLAM.UAE",YOU ARE LOOKING GOOD,733,4973,87241,False,"I am declaring a public health emergency of international concern over the global outbreak of #2019nCoV, not because of what is happening in #China, but because of what is happening in other countries.
https://t.co/HNrxyGeoBA"
2020-01-30 21:05:18+00:00,@Fateemah_bints 😂😂😂 so you have been planning it before the coronavirus outbreak?,akeula_trendy,"Indiana, USA | | festac town",Creative Director ✂️ @AkeulaWears | Entrepreneur | Teacher | social media strategist | Life Coach | Thinker🙂 @DrJoeAbah's PA✨ DM IS OPEN FOR BIZ,22759,6977,286518,False,No Value Mentioned
2020-01-30 21:05:21+00:00,"RT @latimes: Coronavirus was just declared an international ""public health emergency"" by the World Health Organization. 

Here are some of…",makeman149,"New Delhi, India",totally fake,99,586,8078,False,"Coronavirus was just declared an international ""public health emergency"" by the World Health Organization. 

Here are some of the key questions scientists want answered, and what is known at this time. https://t.co/pISEDbYDsh"
2020-01-30 21:05:25+00:00,RT @WHO: @DrTedros @WHOWPRO @WHOSEARO @pahowho @WHO_Europe @WHOEMRO @WHOAFRO @UN_News_Centre @UN @UNGeneva The full statement by @DrTedros…,selberan,"INDIA,KERALA,KOLLAM.UAE",YOU ARE LOOKING GOOD,733,4973,87241,False,@DrTedros @WHOWPRO @WHOSEARO @pahowho @WHO_Europe @WHOEMRO @WHOAFRO @UN_News_Centre @UN @UNGeneva The full statement by @DrTedros on IHR Emergency Committee on new #coronavirus 👉 https://t.co/4Ui8D6Mke8 https://t.co/92rihQmclE
2020-01-30 21:05:25+00:00,"The corona virus won't last long. It's made in China 🇨🇳

Stay Strong!",sato_crypto,"Bengaluru, India","Blockchain enthusiast || Crypto Investor || Algo Trader || Absolutely_Obsessed_with_BITCOIN ||  Jai Hind - ""Long live India"" 🇮🇳",360,1832,1559,False,No Value Mentioned
2020-01-30 21:05:28+00:00,RT @SpringerNature: We’re committed to supporting the global response to the #coronavirus by enabling access to the latest available resear…,suvimal_sindhu,"Kanpur, India","farmer @ Hajipur, Bihar, India",174,648,1661,False,"We’re committed to supporting the global response to the #coronavirus by enabling access to the latest available research, evidence, and data on our dedicated page. All content is free and will continually be updated.
https://t.co/lrjLr05d7t https://t.co/IftR9LjRko"
2020-01-30 21:05:30+00:00,RT @WHO: @DrTedros @WHOWPRO @WHOSEARO @pahowho @WHO_Europe @WHOEMRO @WHOAFRO Full statement on the meeting of the International Health Regu…,selberan,"INDIA,KERALA,KOLLAM.UAE",YOU ARE LOOKING GOOD,733,4973,87241,False,@DrTedros @WHOWPRO @WHOSEARO @pahowho @WHO_Europe @WHOEMRO @WHOAFRO Full statement on the meeting of the International Health Regulations Emergency Committee on the #2019nCoV 👉 https://t.co/Ia5pFPn3Qi https://t.co/YhlPG2YwOJ
2020-01-30 21:05:31+00:00,Coronavirus: World Health Organisation declares global emergency | T-10 NEWS https://t.co/2AMqXOFvUL https://t.co/cTRHawpwba,T10WorldNews,India,"We bring to you the exclusive news acrossthe globe. Keep following us formore.
To be a part of the team write to us at admin@t-10.in",87,21,9117,False,No Value Mentioned
2020-01-30 21:05:33+00:00,RT @WHO: @DrTedros @WHOWPRO @WHOSEARO @pahowho @WHO_Europe @WHOEMRO @WHOAFRO WHO can hold countries to account when they needlessly exceed…,selberan,"INDIA,KERALA,KOLLAM.UAE",YOU ARE LOOKING GOOD,733,4973,87241,False,"@DrTedros @WHOWPRO @WHOSEARO @pahowho @WHO_Europe @WHOEMRO @WHOAFRO WHO can hold countries to account when they needlessly exceed these global standards. This is critical to ensuring the international response is evidence-based, measured  &amp; balanced to protect human health in ways that are neither over-reactive nor under-reactive.

- Dr Houssin https://t.co/HaRMNXpmOb"
2020-01-30 21:05:35+00:00,"RT @WHO: @DrTedros @WHOWPRO @WHOSEARO @pahowho @WHO_Europe @WHOEMRO @WHOAFRO What does Public Health Emergency of Intl Concern means?
WHO i…",selberan,"INDIA,KERALA,KOLLAM.UAE",YOU ARE LOOKING GOOD,733,4973,87241,False,"@DrTedros @WHOWPRO @WHOSEARO @pahowho @WHO_Europe @WHOEMRO @WHOAFRO What does Public Health Emergency of Intl Concern means?
WHO issues temporary recommendations. These are non-binding but practically &amp; politically significant measures that can address travel, trade, quarantine, screening, treatment. WHO can also set global standards of practice"
2020-01-30 21:05:37+00:00,"((i’ve never been overseas, by the way, and i’m pretty unsure i haven’t been in contact with anyone who’s been to china - but i also work in a grocery store so who knows!!))",mallowmikaela,"Indiana, USA",♡ i write screenplays & bake bread ♡ ♡ SW-5380-8238-9610 ♡ currently obsessed with animal crossing,40,85,427,False,No Value Mentioned
2020-01-30 21:05:38+00:00,RT @WHO: @DrTedros @WHOWPRO @WHOSEARO @pahowho @WHO_Europe @WHOEMRO @WHOAFRO The Committee emphasized that the declaration of a public heal…,selberan,"INDIA,KERALA,KOLLAM.UAE",YOU ARE LOOKING GOOD,733,4973,87241,False,"@DrTedros @WHOWPRO @WHOSEARO @pahowho @WHO_Europe @WHOEMRO @WHOAFRO The Committee emphasized that the declaration of a public health emergency shld be seen in the spirit of support &amp; appreciation for 🇨🇳 , its people &amp; the actions.
🇨🇳 has taken on the frontlines of this outbreak, with transparency, and, it is to be hoped, with success
-Dr Houssin"
2020-01-30 21:05:40+00:00,"RT @WHO: @DrTedros @WHOWPRO @WHOSEARO @pahowho @WHO_Europe @WHOEMRO @WHOAFRO ""[We must:]
-share data, knowledge &amp; experience with WHO &amp; the…",selberan,"INDIA,KERALA,KOLLAM.UAE",YOU ARE LOOKING GOOD,733,4973,87241,False,"@DrTedros @WHOWPRO @WHOSEARO @pahowho @WHO_Europe @WHOEMRO @WHOAFRO ""[We must:]
-share data, knowledge &amp; experience with WHO &amp; the world.
The only way we will defeat this outbreak is for all countries to work together in a spirit of solidarity &amp; cooperation. We are all in this together, &amp; we can only stop it together""-@DrTedros #2019nCov"
2020-01-30 21:05:43+00:00,"RT @WHO: @DrTedros @WHOWPRO @WHOSEARO @pahowho @WHO_Europe @WHOEMRO @WHOAFRO ""[We must:] 
-accelerate the development of vaccines, therapeu…",selberan,"INDIA,KERALA,KOLLAM.UAE",YOU ARE LOOKING GOOD,733,4973,87241,False,"@DrTedros @WHOWPRO @WHOSEARO @pahowho @WHO_Europe @WHOEMRO @WHOAFRO ""[We must:] 
-accelerate the development of vaccines, therapeutics &amp; diagnostics;
-combat the spread of rumours &amp; misinformation. 
-review preparedness plans, identify gaps &amp; evaluate the resources needed to identify, isolate &amp; care for cases, &amp; prevent transmission""-@DrTedros"
2020-01-30 21:05:46+00:00,"RT @WHO: @DrTedros @WHOWPRO @WHOSEARO @pahowho @WHO_Europe @WHOEMRO @WHOAFRO ""We must support countries with weaker health systems""-@DrTedr…",selberan,"INDIA,KERALA,KOLLAM.UAE",YOU ARE LOOKING GOOD,733,4973,87241,False,"@DrTedros @WHOWPRO @WHOSEARO @pahowho @WHO_Europe @WHOEMRO @WHOAFRO ""We must support countries with weaker health systems""-@DrTedros #2029nCoV"
2020-01-30 21:05:48+00:00,"RT @SCMPNews: From beauty regimens to homemade carnival games, residents stuck at home found ways to entertain themselves amid the coronavi…",Ayisha_A_Khan,"Mumbai, India",#WorldWideHandsomeDay💜,109,295,30731,False,"From beauty regimens to homemade carnival games, residents stuck at home found ways to entertain themselves amid the coronavirus lockdown https://t.co/rTFfRAsEjM"
2020-01-30 21:05:53+00:00,RT @PDChina: Chinese Premier Li Keqiang on Thursday stressed speeding up the development of #vaccine and medicine against #pneumonia caused…,selberan,"INDIA,KERALA,KOLLAM.UAE",YOU ARE LOOKING GOOD,733,4973,87241,False,Chinese Premier Li Keqiang on Thursday stressed speeding up the development of #vaccine and medicine against #pneumonia caused by the novel #coronavirus https://t.co/JB5zmOUkL2
2020-01-30 21:05:58+00:00,"RT @FinalOverdrive: ""World Health Organization declares coronavirus outbreak a public health emergency""  https://t.co/2S4R81zx32",VanComrade,India (she/her),"Anticapitalist. Atheist. Transhumanist, some flavor of Anarchist, Xenofeminist. 'FALC Parasite'. Materialist. Fascists, Imperialists and Theocrats fuck off",440,1023,17562,False,"""World Health Organization declares coronavirus outbreak a public health emergency""  https://t.co/2S4R81zx32"
2020-01-30 21:05:58+00:00,RT @PDChina: When nurses fighting in the frontline of #coronavirus outbreak in #Wuhan take off their masks... #EverydayHero https://t.co/ns…,selberan,"INDIA,KERALA,KOLLAM.UAE",YOU ARE LOOKING GOOD,733,4973,87241,False,When nurses fighting in the frontline of #coronavirus outbreak in #Wuhan take off their masks... #EverydayHero https://t.co/nsiDd39sRB
2020-01-30 21:06:03+00:00,"RT @PDChina: The 1st human-to-human #transmission of novel #coronavirus in the U.S. has been confirmed in Chicago, which is the sixth confi…",selberan,"INDIA,KERALA,KOLLAM.UAE",YOU ARE LOOKING GOOD,733,4973,87241,False,"The 1st human-to-human #transmission of novel #coronavirus in the U.S. has been confirmed in Chicago, which is the sixth confirmed case of 2019-nCoV  in the country, U.S. Centers for Disease Control and Prevention announced Thursday https://t.co/CmVX3YZoT6"
2020-01-30 21:06:07+00:00,"RT @PDChina: Marking the 1st cured elderly patient in C China's Hubei Province, a 78-year-old man diagnosed with the novel #coronavirus #pn…",selberan,"INDIA,KERALA,KOLLAM.UAE",YOU ARE LOOKING GOOD,733,4973,87241,False,"Marking the 1st cured elderly patient in C China's Hubei Province, a 78-year-old man diagnosed with the novel #coronavirus #pneumonia was discharged from a hospital in Wuhan on Wed https://t.co/IKni9cYhQV"
2020-01-30 21:06:08+00:00,RT @BBCWorld: Coronavirus declared global health emergency https://t.co/BVVhaFIjid,syedfareesahmed,"Hyderabad, India",No Value Mentioned,77,353,9896,False,Coronavirus declared global health emergency https://t.co/BVVhaFIjid
2020-01-30 21:06:10+00:00,RT @PDChina: The Yangtze River rises from the Qinghai-Tibet Plateau and eventually reaches Yuantuojiao in east China's Jiangsu Province. A…,selberan,"INDIA,KERALA,KOLLAM.UAE",YOU ARE LOOKING GOOD,733,4973,87241,False,The Yangtze River rises from the Qinghai-Tibet Plateau and eventually reaches Yuantuojiao in east China's Jiangsu Province. A large amount of sediment carried by the Yangtze River has been deposited at the popular stopover for migratory birds. #AmazingChina https://t.co/NLDeR4bzjd
2020-01-30 21:06:14+00:00,"RT @cjwerleman: Arab leaders have failed Palestinians in their hour of need, the same way they’ve betrayed 8 million Muslims in Kashmir and…",AnsariK786,India,देश सेवा करने के लिए कोई राजनैतिक पार्टी ज्वाइन करना जरूरी है क्या ??,9713,1107,81223,False,"Arab leaders have failed Palestinians in their hour of need, the same way they’ve betrayed 8 million Muslims in Kashmir and 13 million Muslims in China.

My latest for @TRTworld. https://t.co/Vew4aTs4hu"
2020-01-30 21:06:15+00:00,"RT @PDChina: The construction of 2nd makeshift hospital, Leishenshan, for #coronavirus patients in #Wuhan, the epicenter of #outbreak, is 4…",selberan,"INDIA,KERALA,KOLLAM.UAE",YOU ARE LOOKING GOOD,733,4973,87241,False,"The construction of 2nd makeshift hospital, Leishenshan, for #coronavirus patients in #Wuhan, the epicenter of #outbreak, is 40% completed.1,600 beds are planned in Leishenshan Hospital. https://t.co/KI3DVu3wua"
2020-01-30 21:06:16+00:00,This flu and coronavirus is crazy....they shut my kids school down for the Rest of the week because of it...,_KurtRamon,Chicago ✈️ Indiana,Husband|Father|Lover Of Christ|Realtor    A man after God’s own heart!,6809,456,156273,False,No Value Mentioned
2020-01-30 21:06:18+00:00,"RT @UNICEF: Here are five ways to protect yourself, your children and your community from #coronavirus.

via @WHO https://t.co/WxtBl5IfCF",ZufishanWarsi,"New Delhi, India",dead🤫,22,111,1099,False,"Here are five ways to protect yourself, your children and your community from #coronavirus.

via @WHO https://t.co/WxtBl5IfCF"
2020-01-30 21:06:19+00:00,RT @madhukishwar: Why is no TV channel discussing historic #BodoAccord &amp;letting the nation get to know two young heroes who made it possibl…,AshwaniChowdhry,"Lucknow, India",A proud Indian. National interest supreme.,359,854,178106,False,"Why is no TV channel discussing historic #BodoAccord &amp;letting the nation get to know two young heroes who made it possible.
We're sick of needless attention to #ShaheenBaghJamiaJehadis day after day.
Please Ignore the demonic forces &amp;focus on good people https://t.co/H5cbsIcGK9"
2020-01-30 21:06:21+00:00,"We have to be very careful, since medical wastes of neighbouring states are being dumped in TN...!!! Also pl ensure no such wastes from China are dumped here in Chennai, media reports a ship is waiting in our port..!!! @Vijayabaskarofl @OfficeOfOPS @CMOTamilNadu @sumanthraman https://t.co/b54kNE5KVa",kpattabiraman,Chennai India,"Law Grad.Cost Acct,Tax Professional working in MNC.Change should always begin within.Opinions r purely personal n RTs not endorsements.Interest-Current affairs!",145,211,1973,False,No Value Mentioned
2020-01-30 21:06:22+00:00,"https://t.co/W51K1b7PPs
https://t.co/mop2vk9Tp6
Worth remembering.
[Whistleblower - source 1 &amp; 2 NSC]
Q",WWG1WGA7777,"Indiana, USA",#TRUMP2020Landslide!🇺🇸#MAGA  @POTUS the GREATEST PRESIDENT in history! MAKING HISTORY! #FBTS ONLY #AmericaFirst #QAnon #NRA #LTC #UnitedWeStand #TrustGod,7282,7461,6443,False,No Value Mentioned
2020-01-30 21:06:23+00:00,RT @PDChina: #SouthKorea has decided to offer 5 million U.S. dollars worth of medical supplies to #China to help fight the novel #coronavir…,selberan,"INDIA,KERALA,KOLLAM.UAE",YOU ARE LOOKING GOOD,733,4973,87241,False,"#SouthKorea has decided to offer 5 million U.S. dollars worth of medical supplies to #China to help fight the novel #coronavirus outbreak, the country's foreign ministry said Thursday https://t.co/MGIjPqrcBs"
2020-01-30 21:06:26+00:00,RT @NaseerGiyas: Three patient suspected of having the new coronavirus have tested negative and discharged from the hospital in Hyderabad #…,syedsulaiman92,"Hyderabad, India","BE ' Civil
AIMIM Party & Asaduddin Owaisi's Official Social Media Administrator
| My Inspiration @asadowaisi & #AkbaruddinOwaisi
SC: syed.sulaiman92",13944,1199,40079,False,Three patient suspected of having the new coronavirus have tested negative and discharged from the hospital in Hyderabad #coronavirusindia #coronavirus
2020-01-30 21:06:28+00:00,RT @vichalhey: If only the @WHO would take over from @MoHmv and tell us what to do! Currently the Maldivian people do not trust @presidency…,Honest_Nasheed,State Of India - Maldives 🇮🇳,"Maldives Most Corrupt President, @Amnesty Prisoner For Terrorism, @UN Champion of Corruption, @Newsweek 10 Corrupt Leaders, Mini BJP Leader (MDP), A Parody",735,301,3983,False,If only the @WHO would take over from @MoHmv and tell us what to do! Currently the Maldivian people do not trust @presidencymv @ibusolih to be transparent about this. @WHOMaldives #coronavirus
2020-01-30 21:06:30+00:00,"RT @sriniv_venkat: There we go! WHO declares PHEIC for #nCoV2019. The sixth such announcement (previous ones included the H1N1 (2009), Ebol…",just_kmh,"Mumbai, India","tweets random song lyrics, always in crying hours for Arjun Arohi, cricket fanatic.
The most choosy person ever! 
@rushellll 's partnerbff
[fan account]",1039,45,84312,False,"There we go! WHO declares PHEIC for #nCoV2019. The sixth such announcement (previous ones included the H1N1 (2009), Ebola in West Africa (2014), Polio (2014), Zika (2016) and Ebola in DRC (2019). https://t.co/ly7nGxuQOW"
2020-01-30 21:06:54+00:00,RT @globaltimesnews: China needs to prepare for economic consequences of virus. #nCoV2019 #NovelCoronavirus https://t.co/HINlptXVzg https:/…,selberan,"INDIA,KERALA,KOLLAM.UAE",YOU ARE LOOKING GOOD,733,4973,87241,False,China needs to prepare for economic consequences of virus. #nCoV2019 #NovelCoronavirus https://t.co/HINlptXVzg https://t.co/BZGt1tcgsh
2020-01-30 21:06:54+00:00,RT @hindustanse: @AAOLion @Sarita25148177 @Sunitagupta__ @Trip326 @jeetensingh @DS__Rajput @Rajendr76194898 @RajendraRai1234 @RamsaBJYM @Ra…,SortedEagle,India,No Value Mentioned,4576,2667,76265,False,"@AAOLion @Sarita25148177 @Sunitagupta__ @Trip326 @jeetensingh @DS__Rajput @Rajendr76194898 @RajendraRai1234 @RamsaBJYM @RaiSahab20 @AvinaashKTC @manji_ahir @SaundiD @GeetaNatha @barotchetan99 @SintuTi87593664 @_sujyoti1 @nileshpandit25 @raj41353104 @SMehta1950 @DeepsUnique3434 @_vaidya_ @IRBMishra @RanuC6 @8swadeshi @Latarai5 @PihuShah30 @ParmarA03 @krishnpria @yourcharan1967 @simbamara @INCIndia @Sriya3333 @ReallySwara #Mind_it.....#BreakingNews
Coronavirus declared a global health emergency by WHO
""The main reason for this declaration is not what is happening in China but what is happening in other countries,"" 
The concern is that it could spread to countries with weaker health systems."
