created_at,full_text,screen_name,location,description,followers_count,friends_count,statuses_count,verified,full_retweet_text
2020-02-19 17:37:31+00:00,"RT @TeamSidharthFC: 7. No offense to supporters from different part of the World, but that's what REALITY is.
People loving Dangal in China…",FarzinMirza,India,"Queenie💕

#SidharthShukla is Love❤️
Stanning 💕",546,226,43751,False,"7. No offense to supporters from different part of the World, but that's what REALITY is.
People loving Dangal in China won't decide, that it will get Filmfare here or not.
&amp; A guy who did nothing othr than fighting, how can some1 think that he would win O_o

#SidharthShuklaFever"
2020-02-19 17:37:40+00:00,"RT @IndoPac_Info: #China expells three Wall Street Journal reporters over ‘sick man of Asia’ article

Foreign ministry says opinion piece w…",A31X64Vijay,INDIA. (Bharat),"Dreaming for a Strong, Powerful & Glorious 'Great-INDIA' (Akhand Bharat) ... in a Beautiful WORLD !!! .. RTs are Not Endorsements !",4106,4979,379393,False,"#China expells three Wall Street Journal reporters over ‘sick man of Asia’ article

Foreign ministry says opinion piece was ‘racially discriminatory and malicious slander’ but #US newspaper refused to apologize
https://t.co/kTJYXb9u5O"
2020-02-19 17:37:47+00:00,"RT @SecPompeo: The United States condemns the move by China to expel three @WSJ journalists. Mature, responsible countries understand that…",TekendraSharma,"New Delhi, India",#Law #Philosophy #GlobalPolitics #Diplomacy #Humanity #WomenRights #ChildRights #books #Dendrophile #CLCian #Lawyer #Coffee #Agra,293,3090,124,False,"The United States condemns the move by China to expel three @WSJ journalists. Mature, responsible countries understand that a free press reports facts and expresses opinions. China should not restrict #freespeech. https://t.co/szm0ujq2Ua"
2020-02-19 17:37:54+00:00,@MoHFW_INDIA Why they were allowed to enter India when all e visas were cancelled ? This should not be done https://t.co/TeAwgddxto,imhc87,"New Delhi, India",No Value Mentioned,96,536,5767,False,No Value Mentioned
2020-02-19 17:37:59+00:00,RT @imhc87: @MoHFW_INDIA Why they were allowed to enter India when all e visas were cancelled ? This should not be done https://t.co/TeAwgd…,RT_Himachal,"Himachal Pradesh, India","A tweet bot,
retweets, #himachal , #himachalPradesh made by @paharihacker",4292,5,481505,False,@MoHFW_INDIA Why they were allowed to enter India when all e visas were cancelled ? This should not be done https://t.co/TeAwgddxto
2020-02-19 17:38:04+00:00,South Korea reports 20 new cases of coronavirus    https://t.co/d4SjLvZFdp,Sutathu,India,https://t.co/JIww4lJ6X4 collects News from different source and automatically create videos to give the best experience.,9,5,14237,False,No Value Mentioned
2020-02-19 17:38:17+00:00,Better grab the Corona beer. I heard that stops the virus https://t.co/QVsvTQOxpE,TheJapanaholic1,Indiana,"18 M, my last name is pronounced Fry. I do love Anime/Manga. Certified Japanaholic. I also like racing and Metal music. I plan on moving to Japan in 2021",453,2094,12741,False,No Value Mentioned
2020-02-19 17:38:19+00:00,"#coronaWARNStobeVEG

Avoid non vegiterian foods as it has high risk to be infected not only for Corona ... It has capacity to generate so many viruses .... Veg foods are always more healthy and testy also you need not to kill an innocent animal or bird for your foods .... So plz",dhananj73102901,"Patna, India",संपूर्ण स्वराज्य @ हिंदी हिंदू हिंदुस्तान # हिंदुस्तान पाकिस्तान का बंटवारा धर्म के आधार पर  तो धर्मनिरपेक्षता का ठेका हिंदुस्तान के हिंदुओं ने ही क्यों ली है।,155,711,5475,False,No Value Mentioned
2020-02-19 17:38:22+00:00,"RT @PoliticalKida: Students, who were air-lifted from Wuhan during Corona Virus evacuation, are full of praise for the Modi Government, Thi…",branded_chaddi,India,just chill,250,560,134965,False,"Students, who were air-lifted from Wuhan during Corona Virus evacuation, are full of praise for the Modi Government, This is the slap on those faces who are making kids abuse Modi &amp; Shah in Shaheen bagh. https://t.co/GFSuhTbEg7"
2020-02-19 17:38:23+00:00,RT @rvaidya2000: Just asking:--So many pastors are doing miracle cure in India of many diseases due to the grace of Jesus--why not go to Ch…,AnsuPHP,"Chambal Region, India",There are a lot of dots to connect & disconnect .,472,1290,23130,False,Just asking:--So many pastors are doing miracle cure in India of many diseases due to the grace of Jesus--why not go to China and cure all corona patients :))) RT  #hallelujah
2020-02-19 17:38:25+00:00,"RT @thebetterindia: Thanking India for its help in tackling #coronavirus , Chinese Ambassador Sun Weidong has said,

“I am deeply touched b…",IndiaSTS,"New Delhi, India","Centre for Studies in #SciencePolicy, #SSS, Jawaharlal Nehru University| #JNU #NewDelhi #India| Global #ThinkTank| #Innovation #SDG9 #SDGs| tweets by @AannuuppK",1807,645,8361,False,"Thanking India for its help in tackling #coronavirus , Chinese Ambassador Sun Weidong has said,

“I am deeply touched by the kindness of Indian friends. All these reminded me of the time when Dr Kotnis saved many lives.""

Here's the story of Dr Kotnis. 

https://t.co/Hujn5mGGMj"
2020-02-19 17:38:29+00:00,"RT @ArindamRERN: Anti HK gang's logic #UnitedByAsim

This spread                Then what this
Love                             Spread!!!!!…",SAsimfangirl,India,I m Here for Asim only ❤️❤️,217,289,8527,False,"Anti HK gang's logic #UnitedByAsim

This spread                Then what this
Love                             Spread!!!!!!
                                     Corona??? https://t.co/O6Fd6d2bcj"
2020-02-19 17:38:35+00:00,"Diagnostics &amp; drugs- one is incomplete without d other. Shuld b the focus of Govts to make this ""package"" available. True for most endemic conditions, but cant deny dat necessity is the mother of invention! For outbreaks/emergencies, special attention is expected &amp; also necesary! https://t.co/QWt7J82pwC",Almas_Kiran,"Andaman and Nicobar, India","❤ Public Health | Cats | Stories | Seaside
🏠Port Blair/New Delhi


⚠️ Personal Account",400,255,8774,False,No Value Mentioned
2020-02-19 17:38:39+00:00,"RT @PoliticalKida: Students, who were air-lifted from Wuhan during Corona Virus evacuation, are full of praise for the Modi Government, Thi…",Abhijit42089572,"Himachal Pradesh, India","जिएंगे तो भी भारत के लिये, ओर मरेंगे तो भी भारत के लिए।",93,834,6631,False,"Students, who were air-lifted from Wuhan during Corona Virus evacuation, are full of praise for the Modi Government, This is the slap on those faces who are making kids abuse Modi &amp; Shah in Shaheen bagh. https://t.co/GFSuhTbEg7"
2020-02-19 17:38:41+00:00,Coronavirus Is Devastating Chinese Tourism Around Asia https://t.co/kWtU00alVP,hindupride202,India,Om Namah Shivaya,1705,745,46658,False,No Value Mentioned
2020-02-19 17:38:53+00:00,"@ImranKhanPTI @FATFWatch #Karma killing the students staying back at #Wuhan , see the plight https://t.co/5zgA9LaEY7",saksena_amit,India,"Banker by profession, PhD Student, #हर हर महादेव ❤️ Indian by heart. #savesabrimala",796,702,20768,False,No Value Mentioned
2020-02-19 17:38:58+00:00,RT @rvaidya2000: Just asking:--So many pastors are doing miracle cure in India of many diseases due to the grace of Jesus--why not go to Ch…,SRIDHAR0520,INDIA,Support Fair news reporting ! Dislike Whiners! RT not endorsement. BHARAT MATA KI JAI!!!,459,623,54535,False,Just asking:--So many pastors are doing miracle cure in India of many diseases due to the grace of Jesus--why not go to China and cure all corona patients :))) RT  #hallelujah
2020-02-19 17:39:00+00:00,"RT @PoliticalKida: Students, who were air-lifted from Wuhan during Corona Virus evacuation, are full of praise for the Modi Government, Thi…",praveen_taj,india,"जाने कितने झूले थे फाँसी पर, कितनों ने गोली खायी थी ख़बरदार जो झूठ बोला कि चरखे से आजादी आयी थी......",428,397,123163,False,"Students, who were air-lifted from Wuhan during Corona Virus evacuation, are full of praise for the Modi Government, This is the slap on those faces who are making kids abuse Modi &amp; Shah in Shaheen bagh. https://t.co/GFSuhTbEg7"
2020-02-19 17:39:02+00:00,"RT @thebetterindia: Thanking India for its help in tackling #coronavirus , Chinese Ambassador Sun Weidong has said,

“I am deeply touched b…",awaknis,"Pune, India","Technology, Healthcare, Education, Politics. Hopelessly Optimistic. Experimental Liquorist. Gators and Patriots Fan.",89,435,423,False,"Thanking India for its help in tackling #coronavirus , Chinese Ambassador Sun Weidong has said,

“I am deeply touched by the kindness of Indian friends. All these reminded me of the time when Dr Kotnis saved many lives.""

Here's the story of Dr Kotnis. 

https://t.co/Hujn5mGGMj"
2020-02-19 17:39:13+00:00,RT @Paul_Sacca: @ewarren Are you prepared to bomb China and India to stop climate change?,Duzaman,Indiana,Sports. Politics. Chess. Gambling,178,695,4225,False,@ewarren Are you prepared to bomb China and India to stop climate change?
2020-02-19 17:39:19+00:00,"RT @business: Japan is emerging as one of the riskiest places for the spread of the coronavirus, prompting criticism of Shinzo Abe’s govern…",alpeshtwitting,"Mumbai, India","Consultant, entrepreneur, author of three books. My latest books 'Chalta Hai India' by Bloomsbury and 'Winning Like Yuvraj' by Rupa Publications.",684,3128,96396,False,"Japan is emerging as one of the riskiest places for the spread of the coronavirus, prompting criticism of Shinzo Abe’s government https://t.co/Y9OGPR5qfW"
2020-02-19 17:39:23+00:00,"RT @PoliticalKida: Students, who were air-lifted from Wuhan during Corona Virus evacuation, are full of praise for the Modi Government, Thi…",gopikrishnanu19,"Kerala, India",#NaMo follower🙏🙏🙏🙏,251,1367,20232,False,"Students, who were air-lifted from Wuhan during Corona Virus evacuation, are full of praise for the Modi Government, This is the slap on those faces who are making kids abuse Modi &amp; Shah in Shaheen bagh. https://t.co/GFSuhTbEg7"
2020-02-19 17:39:25+00:00,RT @TarekFatah: Pakistani doctors at Karachi Airport invoking #CoronaVirus scare to extort bribes from passengers arriving from overseas.…,India2024,"New Delhi, India, New York","If I would not allow you to say that to me in person then I won't allow it on twitter.
I support everyone who support India & dislike everyone who demean India.",470,437,36598,False,"Pakistani doctors at Karachi Airport invoking #CoronaVirus scare to extort bribes from passengers arriving from overseas. 

The whole country is rotten to the core. Unheard of blackmail to harass passengers by threatening to label them as carriers of virus unless they pay money. https://t.co/VihHE9V9we"
2020-02-19 17:39:33+00:00,"RT @SecPompeo: The United States condemns the move by China to expel three @WSJ journalists. Mature, responsible countries understand that…",AlmeidaRich,India,Academic background in Science. Work experience in Pharmaceutical Selling.,211,553,18171,False,"The United States condemns the move by China to expel three @WSJ journalists. Mature, responsible countries understand that a free press reports facts and expresses opinions. China should not restrict #freespeech. https://t.co/szm0ujq2Ua"
2020-02-19 17:39:54+00:00,@BucketheadCase @Proletarian1917 She is discussing economic impact on our country due to shutting down several production facilities in China,caviswanadh,"Vishakhapatnam, India",Chartered Accountant and father of 7 year old,45,164,2511,False,No Value Mentioned
2020-02-19 17:40:21+00:00,breaking news communist China acquires Srilanka island https://t.co/9zV1P7RumA,prempink,South India,I openly tweeting man without hiding anything. unmarried native language Tamil other Language I know English I am Aries ♈ Blood 🩸 type 🅾️ O+,363,1627,49175,False,No Value Mentioned
2020-02-19 17:40:24+00:00,"RT @SecPompeo: The United States condemns the move by China to expel three @WSJ journalists. Mature, responsible countries understand that…",daaktardush,"New Delhi, India",Narcissist. . .loud . . .spontaneous ...crazy about  dogs. . .Ex-Actor and doctor by profession !!!,294,179,185234,False,"The United States condemns the move by China to expel three @WSJ journalists. Mature, responsible countries understand that a free press reports facts and expresses opinions. China should not restrict #freespeech. https://t.co/szm0ujq2Ua"
2020-02-19 17:40:26+00:00,RT @FinMinIndia: To address the issue of contractors going in default of contract obligations on account of delays in input shipments from…,GVenkat2019,India🇮🇳🇮🇳🇮🇳,"CA Aspirant, Trying to be a - good son to my parents, good citizen of India & good human being. Very passionate with driving cars. Partner - Akshaya Industrie👍",62,223,1348,False,"To address the issue of contractors going in default of contract obligations on account of delays in input shipments from China on account of #CoronaVirus. 
#CoronavirusOutbreak (1/2) https://t.co/aHtltpqEIw"
2020-02-19 17:40:28+00:00,"RT @FinMinIndia: Dept. of Expenditure vide its O.M. dated 19.2.2020 has advised Ministries, disruption of supply chain due to spread of Cor…",GVenkat2019,India🇮🇳🇮🇳🇮🇳,"CA Aspirant, Trying to be a - good son to my parents, good citizen of India & good human being. Very passionate with driving cars. Partner - Akshaya Industrie👍",62,223,1348,False,"Dept. of Expenditure vide its O.M. dated 19.2.2020 has advised Ministries, disruption of supply chain due to spread of Corona Virus in China or any other country would be considered as a case of natural calamitiy and Force Majeure Clause may be invoked in appropriate cases (2/2)"
2020-02-19 17:40:33+00:00,Countries evacuating nationals from coronavirus-hit areas https://t.co/7eKq4jyzTY https://t.co/2lNxq4SFI0,BMICalculatorIN,India,Calculate your Body Mass Index with our free BMI Calculator or visit our Health Advice section: http://t.co/jIuCW41mte,21,40,9662,False,No Value Mentioned
2020-02-19 17:40:38+00:00,RT @WHO: Q&amp;A on a future for the world’s children with @HelenClarkNZ https://t.co/uB6bcYMh0K,SandeepKumawat_,"Rajasthan, India","अयं बन्धुरयं नेति गणना लघुचेतसाम्।
उदारचरितानां तु वसुधैव कुटुम्बकम्॥
""For those with a generous heart, the (entire) earth is the family.""",143,2068,12326,False,Q&amp;A on a future for the world’s children with @HelenClarkNZ https://t.co/uB6bcYMh0K
2020-02-19 17:40:39+00:00,"RT @MarioIli7: Age, Sex, Existing Conditions of #CORONAVIRUS Cases and Deaths https://t.co/JerYW6SUhB",drritesh6,India,Proud Indian... Social Thinker ... Pulmonologist & Intensivist.             “ मेरा  एक ही सपना की मेरा भारत हो विश्वगुरु “,74,169,572,False,"Age, Sex, Existing Conditions of #CORONAVIRUS Cases and Deaths https://t.co/JerYW6SUhB"
2020-02-19 17:40:40+00:00,"RT @NileshShah68: Freedom of Press in China 
https://t.co/6Xvi9gMrAR",nandyorama,"Bangalore, India",No Value Mentioned,39,162,568,False,"Freedom of Press in China 
https://t.co/6Xvi9gMrAR"
2020-02-19 17:40:45+00:00,RT @enricomolinari: This bacteria-killing #robot can sanitize our hotel bed! TY @StartupSelfieCo via @enricomolinari #coronavirus #robot #m…,2601Manish,India,Proprietor at English Academy. Founder https://t.co/mX0TBhkRV3 Influencer #Blockchain #Cryptocurrencies #AI #IoT #Fintech #BigData #AR #VR #XR #MR & Authored 5 Books,2682,1672,251908,False,"This bacteria-killing #robot can sanitize our hotel bed! TY @StartupSelfieCo via @enricomolinari #coronavirus #robot #marketing #ehealth

@spendharkar @LoriMoreno @loveGoldenHeart @JolaBurnett @bynsny @vanillaweb @annemariayritys @YuHelenYu @avrohomg @MiaD @tgravel @sarbjeetjohal https://t.co/aFI6EcRtQI"
2020-02-19 17:40:51+00:00,"How an outbreak that hardly existed a month back is potentially disrupting the global order with far reaching consequences if remain unabated. Also it makes us ponder how fragile and vulnerable interdependence is n solidifies arguement in favor of de-globalisation 
#Coronavirus https://t.co/IOwzp9ot2c",sat__s,"Kolkata, India","A reluctant Banker, avid observer of Indian Economy,Politics,International Relations,Striving hard to say NO to almost every disgusting stuff",26,243,158,False,No Value Mentioned
2020-02-19 17:40:53+00:00,"RT @charliekirk11: Facts:

Mike Bloomberg said China’s dictator, Xi Jinping, is “not a dictator”

Joe Biden says that China is “not a threa…",FitnessSuccess,"Indiana, USA",Real Estate Investor,229,705,13232,False,"Facts:

Mike Bloomberg said China’s dictator, Xi Jinping, is “not a dictator”

Joe Biden says that China is “not a threat”

Bernie Sanders said China has done more to address extreme poverty “than any country in history”

Why are Democrats so friendly to America’s greatest enemy?"
2020-02-19 17:41:01+00:00,RT @DamienKlassen: Can you believe there has been a 95% fall in reported #COVID19 cases in China since the end of January? Channelling Boja…,RightEyeGuy,Southern Indiana,Conservatarian Motorcycle Chocolate #savedbygrace #teaparty #NRA #TCOT #2A #indiana #cos #molonlabe #CruzCrew Eph 2:8. I don't believe in CAGW.,7964,8433,29959,False,Can you believe there has been a 95% fall in reported #COVID19 cases in China since the end of January? Channelling Bojack: No. I literally cannot believe it. https://t.co/TL1T89bm9S
2020-02-19 17:41:05+00:00,RT @NewsMobileIndia: Embassy of India in Japan: Altogether 7 Indian nationals (crew members onboard Diamond Princess) are receiving treatme…,shwetaa_9,"New Delhi, India",Born|raised|transferred| Fact-checker @NewsMobileIndia,31,591,28663,False,"Embassy of India in Japan: Altogether 7 Indian nationals (crew members onboard Diamond Princess) are receiving treatment in hospitals in Japan, after testing positive for COVID-19 over last few days. Their health conditions are improving."
2020-02-19 17:41:07+00:00,"RT @CNN: A study has found that the novel coronavirus is more contagious than the related viruses which cause SARS and MERS.

While Covid-1…",RNikethan,Chennai (India),No Value Mentioned,3988,2976,772,False,"A study has found that the novel coronavirus is more contagious than the related viruses which cause SARS and MERS.

While Covid-19, is not as fatal on a case-by-case basis, its greater spread has already led to more deaths than its related coronaviruses. https://t.co/8SSvOzMtXf"
2020-02-19 17:41:08+00:00,"@ProfGoat @Mike_Pence “CDC found a number of reasons why suicide rates among farmers &amp; those who live in rural areas in general are higher than their urban counterparts. Access to mental health is more sporadic, rural populations tend to earn less, and overall health factors tend to be lower.”",erica_strahm,"Westfield, Indiana",No Value Mentioned,56,81,443,False,No Value Mentioned
2020-02-19 17:41:14+00:00,"@timesofindia #India (@narendramodi Goverment) should take advantage of the #slowdown in #China now,and use this opportunity with #USA ( @realDonaldTrump  Goverment) to it's mutual advantage!",tweet2GAURANG,India,"This is my space to air my political &social views which are personal&may or may not subscribe with yours.Retweets,not endorsement!",269,61,8721,False,No Value Mentioned
2020-02-19 17:41:15+00:00,"RT @globaltimesnews: Hermes, GUCCI, or Givenchy? Frontline medics in #Wuhan made several fashionable bags by themselves. With such a wide r…",IndiasBigdebate,India,"Welcome All who would like to debate on Important Issues concerning India. Follow us with your concern & We will fight 4 Your Right! Jai Hind!

#indiasbigdebate",1214,216,270641,False,"Hermes, GUCCI, or Givenchy? Frontline medics in #Wuhan made several fashionable bags by themselves. With such a wide range of choices, it might be tough to pick one! Getting engrossed in such unique activities would help reduce the stress of the frontline medics. https://t.co/Dl3IaZs8EJ"
2020-02-19 17:41:15+00:00,"RT @KiranKS: China accounts for 70% of Asian bond issuances. But since Corona Virus in China, Indian companies have become hot for global i…",Harshgo69703413,"sirsa, India",students,35,70,3609,False,"China accounts for 70% of Asian bond issuances. But since Corona Virus in China, Indian companies have become hot for global investors. 

In just 2 weeks, Indian companies received bids for $11 billion in the Dollar bond market, while they had lined up for just $1.55 bn issues."
2020-02-19 17:41:20+00:00,"RT @JaskiratSB: ‘Peace is obtained when you achieve parity.'
In his book, ‘Watershed 1967: India’s forgotten victory over China’, army vete…",MJsaidso,"MUMBAI,INDIA",Work hard and be humble,122,809,2037,False,"‘Peace is obtained when you achieve parity.'
In his book, ‘Watershed 1967: India’s forgotten victory over China’, army veteran @iProbal  talks about the events leading up to the 1967 battles of Nathu La and Cho La pass and the ones that followed.

https://t.co/exDAAFYcbu"
2020-02-19 17:41:25+00:00,"RT @TeamSidharthFC: 7. No offense to supporters from different part of the World, but that's what REALITY is.
People loving Dangal in China…",ZameerEmmikkc,"Hyderabad, India","#Photoshop.Ps Touch #Editor 

.Big fan of this real hero's 
1.@emraanhashmi 
2.@sidharth_shukla
3.@akshaykumar
4.@iamsrk
📎https://t.co/EuZonqT0QG",1296,435,33774,False,"7. No offense to supporters from different part of the World, but that's what REALITY is.
People loving Dangal in China won't decide, that it will get Filmfare here or not.
&amp; A guy who did nothing othr than fighting, how can some1 think that he would win O_o

#SidharthShuklaFever"
2020-02-19 17:41:30+00:00,"Only heard of #USA or developed nations assist the way #India is doing now. 
Indian foreign policy evolution speaks volumes about precedents set by former MEA Late @SushmaSwaraj ji &amp; how her legacy is carried on by @DrSJaishankar. 
India’s rise as a global power is inevitable! https://t.co/KctY4BQu68",DhillonSanya,"New Delhi, India",Public Policy & Communications | Election Management| MPP| English Literature JMC Delhi| Former research at @BrookingsIndia|,6583,1926,1862,False,No Value Mentioned
2020-02-19 17:41:31+00:00,"RT @WSJ: China expels three Wall Street Journal journalists in Beijing, a rare expulsion of multiple reporters from the same organization h…",pburavalli,"United States, India","Chairman/CEO @MyIndMakers Founder @VOB_USA

धर्मो रक्षति रक्षितः
(Dharma Saves those who save Dharma)",2838,684,23083,False,"China expels three Wall Street Journal journalists in Beijing, a rare expulsion of multiple reporters from the same organization https://t.co/y0ngQEgID9"
2020-02-19 17:41:35+00:00,"Coronavirus outbreak to have limited impact on India, says RBI Governor https://t.co/ddcnvoBqTT",promotionsmast,"Gandhinagar, India",promotionsmast,857,2648,30574,False,No Value Mentioned
2020-02-19 17:41:35+00:00,Coronavirus outbreak: Govt recommends ban on export of 12 drug formulations https://t.co/dl5teBBLhk,promotionsmast,"Gandhinagar, India",promotionsmast,857,2648,30574,False,No Value Mentioned
2020-02-19 17:41:38+00:00,RT @BNODesk: BREAKING: The 2 preliminary positive cases of coronavirus in central Iran have died - state media,gillksharp1,Hong Kong / India / UK,Viewing 🌍 Affairs 360 degrees. Retweets are not an endorsement : Simply food for thought 🤔,1680,3538,18866,False,BREAKING: The 2 preliminary positive cases of coronavirus in central Iran have died - state media
2020-02-19 17:41:49+00:00,RT @SuriyaFansClub: • Please do Sanitize your hands and be aware of personal hygiene. Let's take as much as care possible for #Coronavirus…,Smileselvam1,"Tamil Nadu, India",🕴I mAkE tHe RuLEs⚠️ I dOn't FoLlOw ThE rUlES❎ i BreAK THe ruLEs 🚫,79,123,4040,False,• Please do Sanitize your hands and be aware of personal hygiene. Let's take as much as care possible for #Coronavirus - @Suriya_offl #Suriya https://t.co/E5oG5Hmc8U
2020-02-19 17:41:53+00:00,"Coronavirus outbreak latest: Six Chinese nationals put under surveillance in Shimla  
https://t.co/j3r6UPYfCk",Uditgupta_ug,"Jaora, India",https://t.co/ZJBw54W97D,26,18,22437,False,No Value Mentioned
2020-02-19 17:42:02+00:00,RT @HelenBranswell: Important re: understanding #COVID19 numbers out of China &amp; why they may drop in coming days.,Equateall,India,"Educationist, Startup / Product Consultant, Mentor, Career Coach.
eTestZone: India's Largest Performance Rewards for IIT JEE / NEET / CET. Open to ALL students.",7750,1123,256715,False,Important re: understanding #COVID19 numbers out of China &amp; why they may drop in coming days. https://t.co/jWyl6wVpFY
