created_at,full_text,screen_name,location,description,followers_count,friends_count,statuses_count,verified,full_retweet_text
2020-03-09 23:59:27+00:00,"RT @AamAadmiParty: In wake of a recent coronavirus outbreak, Delhi government has decided to disinfect all the DTC and Cluster buses.

Our…",IamAnnaShetty,India,"तू खुद की खोज में निकल
तू किस लिए हताश है,
तू चल तेरे वजूद की
समय को भी तलाश है।
🇮🇳सत्यमेव जयते!!!🇮🇳",554,69,75215,False,"In wake of a recent coronavirus outbreak, Delhi government has decided to disinfect all the DTC and Cluster buses.

Our government is making every possible effort to keep the citizens safe and healthy. https://t.co/Yyo9ukwFWL"
2020-03-09 23:59:35+00:00,"RT @JimSTruthBTold: Hillary might be Biden’s VP running mate.  

Coronavirus and the economic/market downturn might lead to Biden/Clinton w…",BFrey0,"Indiana, USA","I love our country, our flag, our president and the spirit of the people who support President Trump. God bless America.",797,1022,32464,False,"Hillary might be Biden’s VP running mate.  

Coronavirus and the economic/market downturn might lead to Biden/Clinton winning the election. 

Is this a good thing?"
2020-03-09 23:59:39+00:00,"RT @alvarezzzy: Dr. @MGottliebMD follows after Dr. @TChanMD, both their works combined covers hundreds of academic faculty's  work, sharing…",EP_Dr_Dolly,India,Emergency Physician #FOAMED | Educator @aliemfac #Facubator20 #MedEd| Foodie | Music artist @Utsargbhajan | Photographer |,287,737,1372,False,"Dr. @MGottliebMD follows after Dr. @TChanMD, both their works combined covers hundreds of academic faculty's  work, sharing his ideas on how to disseminate #WellnessResearch. Dr. @crsemcccf presents on his behalf, thanks to #COVID19 travel challenges. 

#CORDWellnessFellowship20 https://t.co/qh102vHgxa"
2020-03-09 23:59:48+00:00,"RT @realDonaldTrump: So last year 37,000 Americans died from the common Flu. It averages between 27,000 and 70,000 per year. Nothing is shu…",manniac_1096,"Indiana, USA",🙏🏻🇺🇸#2a #maga #q 🏴‍☠️🥃🎸🌊🍀,20,216,518,False,"So last year 37,000 Americans died from the common Flu. It averages between 27,000 and 70,000 per year. Nothing is shut down, life &amp; the economy go on. At this moment there are 546 confirmed cases of CoronaVirus, with 22 deaths. Think about that!"
2020-03-09 23:59:51+00:00,RT @anthonydragons: aiiight that’s it! This shit has gone tooo far now!,tarynkraus_,"Indiana, USA",📍I N D Y | Just say yikes and move on 🦋🌈🌻,398,276,19625,False,aiiight that’s it! This shit has gone tooo far now! https://t.co/hFrHqlxqZb
2020-03-09 23:59:53+00:00,you the man @BernieSanders https://t.co/rsvgZqqN3r,daveyisalright,"Indianapolis, IN","Roofis is my pup. 

Drums for Setting Color.

Xbox: MrStayPufffft

WASHINGTON CAPITALS.",536,111,2195,False,No Value Mentioned
2020-03-09 23:59:55+00:00,Days until Idiocracy is no longer satire: maybe 600? https://t.co/7okh7eQnEg,MillerTimePod,"Indianapolis, IN",Guy at The Fieldhouse @FieldhouseEtc // 2x Area 55 Perfect Attendance Co-Champion // 2x Pacers Baby Race Coach (1 Finals 1 Title) // #TendyTime // #ReggieStatue,6666,3664,42168,False,No Value Mentioned
