created_at,full_text,screen_name,location,description,followers_count,friends_count,statuses_count,verified,full_retweet_text
2020-05-07 22:04:20+00:00,RT @thehill: JUST IN: White House shelved CDC reopening guidance: report https://t.co/SZ2Ztyv073 https://t.co/mV4ywbT2jC,BrarSukhie,"Washington, DC/Punjab, India","Oak Grove, St Bede's, Rajindera College, Cornell.  IAS/Asian Dev Bank/ World Bank. Lover of books, movies, music, a host of other stuff, serious and non-serious",606,201,14278,False,JUST IN: White House shelved CDC reopening guidance: report https://t.co/SZ2Ztyv073 https://t.co/mV4ywbT2jC
2020-05-07 22:04:20+00:00,"Re-Up: Allow Returnees Only If They Test Negative For #COVID19 At Source: Orissa HC To Govt

https://t.co/p5Y4Aa6c2u https://t.co/D5guS0Kqav",otvnews,"Bhubaneshwar, India","If something on Odisha is not on https://t.co/tklvVwUTgF, it is unlikely to be elsewhere...

Join us on telegram:  https://t.co/Hu7tZ0QKiH",520970,278,150984,True,No Value Mentioned
2020-05-07 22:04:21+00:00,RT @sardesairajdeep: ‘We will never return to Gujarat..’ strong words from migrant labour in a city with arguably the highest proportion of…,saurabhmarwah,India,No Value Mentioned,624,1392,30556,False,‘We will never return to Gujarat..’ strong words from migrant labour in a city with arguably the highest proportion of migrants in the country. Why has Surat become a conflict zone. Watch here.. https://t.co/vEqsvz0uRw
2020-05-07 22:04:24+00:00,"RT @vijayanpinarayi: #COVID19 Update | May 7

No new cases and 5 recoveries today. 
Active cases down to 25. 

📍 Hotspots count is down at…",manithemariner,"Coimbatore, India",Marine Engineer @ Synergy group,48,327,693,False,"#COVID19 Update | May 7

No new cases and 5 recoveries today. 
Active cases down to 25. 

📍 Hotspots count is down at 33
👥16,693 under observation
🧪 35,171 samples tested; 34,519 -ve
🔎 3,035 samples covered in sentinel surveillance. https://t.co/wofsQIWsCn"
2020-05-07 22:04:30+00:00,RT @INCIndia: Gujarat Govt has completely failed in controlling the spread of the Coronavirus in the State. The inefficiency of BJP &amp; the s…,Riyas24476139,"Kerala, India",Indian national congress,36,144,316,False,"Gujarat Govt has completely failed in controlling the spread of the Coronavirus in the State. The inefficiency of BJP &amp; the so called Gujarat Model has been exposed completely.

#BJPFailsGujarat https://t.co/aeQzWuWm7P"
2020-05-07 22:04:34+00:00,"@IndiGo6E my PNR AK3M3D, PNFMGN and SIKU8M got cancelled due to Covid-19. R these bookings elligible for refund? These bookings r not even seen in my account on Indigo mobile app. @DGCAIndia @MoCA_GoI",ajaykumar_fri,"Jorhat, Assam, India","Scientist,
Forest and Environmental Economics,
Rain Forest Research Institute, Jorhat, Assam",91,155,164,False,No Value Mentioned
2020-05-07 22:04:37+00:00,RT @dwnews: Italians are celebrating the simple things that make life beautiful as the country begins to loosen its nearly two-month-long #…,BharatPatriot1,"USA, Israel, India, EU","Bharatiya, Patriot, OSINT, Independent Defence Analyst-Global, FakeNews buster, Malicious-Troll Buster, Historically Accurate, Politically Correct & Neutral",2616,100,33525,False,Italians are celebrating the simple things that make life beautiful as the country begins to loosen its nearly two-month-long #COVID19 lockdown. https://t.co/seJW9sKDfz
2020-05-07 22:04:40+00:00,RT @NPR: Nine states appear to be doing enough coronavirus testing to meet a minimum threshold to make it safe to relax social distancing m…,Just_Christoph,NE Indiana,"Retro gaming enthusiast, baseball and hockey fanatic that lives and dies by Porsche Motorsport.",59,403,2794,False,"Nine states appear to be doing enough coronavirus testing to meet a minimum threshold to make it safe to relax social distancing measures.

That’s according to a new analysis by the Harvard Global Health Institute for NPR.

Most states aren't even close.
https://t.co/mN5iVy36W7"
2020-05-07 22:04:50+00:00,RT @_sabanaqvi: Will.never return to city again...says this worker.  https://t.co/JgkEdfjOLT,MDABDULBARIK1,"Guwahati, India",Advocate Gauhati High Court,59,116,3406,False,Will.never return to city again...says this worker.  https://t.co/JgkEdfjOLT
2020-05-07 22:04:53+00:00,"RT @yojudenz: Llama Antibodies Could Help Us Defeat COVID-19, Scientists Say https://t.co/jBYxumf7tY",RobertBradleyJ2,"Indiana, USA",Retired/married/conservative/deplorable/nationalist/Harley rider/👌/Patriot/KAG/1A/2A/🇺🇸🥃/#Trump2020/cult45/GoBears!,13234,13773,132626,False,"Llama Antibodies Could Help Us Defeat COVID-19, Scientists Say https://t.co/jBYxumf7tY"
2020-05-07 22:05:07+00:00,Simple rules for a coronavirus world: https://t.co/ZQIVFFrWX0,LawLiberty,Indianapolis,Law & Liberty focuses on law in the classical liberal tradition.,6328,380,33973,False,No Value Mentioned
2020-05-07 22:05:08+00:00,"RT @MattGertz: All three Fox primetime shows last night covered the Texas salon owner who was jailed for violating stay-at-home orders.

No…",therealEBiggers,"Indianapolis, IN",Aspiring psychic...Black market Egyptian cotton smuggler...I moonlight as Hafþór Júlíus Björnsson’s left pectoral on weekends...Eyepatch bejeweler...,34,186,7605,False,"All three Fox primetime shows last night covered the Texas salon owner who was jailed for violating stay-at-home orders.

None mentioned Ahmaud Arbery, the Georgia man who was shot and killed while jogging, video of which emerged yesterday. https://t.co/4kKci74m21"
2020-05-07 22:05:15+00:00,RT @benshapiro: Did...did the Chinese communist authoritarian state write this tweet?,Mag7Maga,"Indiana, USA",#WWG1WGA. Trump2020,847,1802,17811,False,Did...did the Chinese communist authoritarian state write this tweet? https://t.co/gGQhu5jLxa
2020-05-07 22:05:18+00:00,"RT @chintan20: According to Rajdeep , now Covid has religion in Gujarat and Gujarat government is sending Corona Virus to minority dominate…",ParthPa07241800,India,"Honored to be followed by @TcGehlotOffice, @Mohsinrazabjpup ,@Shehzad_Ind, @OfficeOf_MM ,@OfficeOfRKSingh and @VijayGoelOffice",2790,4616,978057,False,"According to Rajdeep , now Covid has religion in Gujarat and Gujarat government is sending Corona Virus to minority dominated area so social fabric at risk . 

Kya aadmi hai yeh https://t.co/q4w6dD3S14"
2020-05-07 22:05:26+00:00,"On the 13th day of November 2012, this Twitter user @dotNoso predicted ""Kobe is going to end up dying in a helicopter crash."" #coronavirus https://t.co/0K1tEV8wsH",icareall_rf7,India,Future Predictions,218,321,101,False,No Value Mentioned
2020-05-07 22:05:34+00:00,"Local SEOs we want to hear from you. How has COVID-19 impacted your marketing efforts? Let us know in this quick survey!

Your responses will help fellow marketers better understand how to navigate these challenging times.

Just click the link 👇https://t.co/SUKsdt9cPt …",RSSeoSolution,"Jaipur, Rajasthan, India","Complete Digital Marketing Expert (SEO, SEM, SMO, PPC etc.) since 2004. Save upto 50% SEO Cost n budget for SEO https://t.co/eYCM96eqiM",2012,2996,97814,False,No Value Mentioned
2020-05-07 22:05:51+00:00,"RT @DavidCGrabowski: Private equity owned nursing homes and COVID? As I told @mattgoldstein26, ""we are all of a sudden seeing how risky it…",KenzieMintusPhD,"Indianapolis, IN","Associate Professor of Sociology at IUPUI. Research interests include health, aging, and disability.",1396,2272,2614,False,"Private equity owned nursing homes and COVID? As I told @mattgoldstein26, ""we are all of a sudden seeing how risky it is to have ownership split between the real estate side that has the most valuable asset and the operator, who is left with much less."" https://t.co/u9PSy9foMd"
2020-05-07 22:05:57+00:00,RT @khalidmostwil: Very good,khalidmostwil,"Deoband, India",enjoy,9,776,2916,False,Very good https://t.co/oPhryIBaMu
2020-05-07 22:06:03+00:00,"RT @spectatorindex: JUST IN: Worldwide coronavirus death toll reaches 270,000",karan_cfc,"New Delhi, India",Chelsea through & through 💙 #KTBFFH,890,4667,145719,False,"JUST IN: Worldwide coronavirus death toll reaches 270,000"
2020-05-07 22:06:05+00:00,RT @WOWOpatmiller: .@RepJimBanks joins to discuss his new bill to prevent Chinese predatory acquisitions of American companies weakened by…,RepJimBanks,Indiana's 3rd District,U.S. Congressman (IN-03),37095,1594,6322,True,.@RepJimBanks joins to discuss his new bill to prevent Chinese predatory acquisitions of American companies weakened by the economic fallout of COVID-19 and returning to work https://t.co/WrP6wpAtmv
2020-05-07 22:06:07+00:00,"RT @meganamram: I used 6,000 N95 masks to spell out ""THANK U HEROES!!!!!"" on the beach then lit them on fire so nurses all over the world c…",prerana_1096,"Bangalore, India ",No Value Mentioned,102,292,15088,False,"I used 6,000 N95 masks to spell out ""THANK U HEROES!!!!!"" on the beach then lit them on fire so nurses all over the world could see ♥️"
2020-05-07 22:06:10+00:00,"RT @desimojito: Uddhav Thackeray has failed to handle Covid crisis. Bring in Army to save Mumbai

Imagine the ground reality if this articl…",AvinashGajbhi17,"Maharashtra, India",nothing,163,104,10717,False,"Uddhav Thackeray has failed to handle Covid crisis. Bring in Army to save Mumbai

Imagine the ground reality if this article is coming from naxal Print 

https://t.co/wwWrBXrjrM"
2020-05-07 22:06:11+00:00,"RT @JPNadda: Today had an elaborate discussion with national office bearers of @BJP4India on COVID-19 crises management.

Reviewed the ongo…",HarishDixit20,"Delhi, India",🇮🇳 India First | Spoke Person @BJYMDelhiState & Political Strategist | Businessman | जय हिंद ! जय भारत ! भारत माता की जय ! ॐ रां रां ॐ रां रां परशुहस्ताय नम:।,2614,4997,10021,False,"Today had an elaborate discussion with national office bearers of @BJP4India on COVID-19 crises management.

Reviewed the ongoing relief programs like Feed the Needy &amp; distribution of face covers etc. &amp; emphasized on pro-active response to the fast changing volatile situation. https://t.co/nbPa3UBoCB"
2020-05-07 22:06:15+00:00,RT @NBCNews: A Pentagon memo that says a COVID-19 diagnosis “permanently” disqualifies recruits from joining the military is actually “inte…,prasadmahavir,"New Delhi, India",There's nothing special about me.,528,5000,56523,False,"A Pentagon memo that says a COVID-19 diagnosis “permanently” disqualifies recruits from joining the military is actually “interim guidance” and recruits who recover from the disease may still be able to get a waiver that lets them sign up, officials say. https://t.co/jIa52nio11"
2020-05-07 22:06:19+00:00,"RT @GregAbbott_TX: Throwing Texans in jail whose biz's shut down through no fault of their own is wrong.

I am eliminating jail for violati…",dbickers2,"Indiana, USA","I pounce on here when Im just killing the tick to the tock. #Straight #JazzMusic #ExoticFood #AmericanGentleman #Drummer #Indy500 ,The 1 true #God",188,722,8289,False,"Throwing Texans in jail whose biz's shut down through no fault of their own is wrong.

I am eliminating jail for violating an order, retroactive to April 2, superseding local orders.

Criminals shouldn’t be released to prevent COVID-19 just to put business owners in their place."
2020-05-07 22:06:26+00:00,"RT @sagarikaghose: Kerala : 500 #COVID19 cases, 4 deaths. Gujarat: 5804 cases, 319 deaths. Which model of public health would you choose? #…",userlamest,"New Delhi, India",yes we may,94,618,11111,False,"Kerala : 500 #COVID19 cases, 4 deaths. Gujarat: 5804 cases, 319 deaths. Which model of public health would you choose? #KeralaModel"
2020-05-07 22:06:32+00:00,"RT @Physio_Sohail: Don't u feel ashamed @ArvindKejriwal , @AtishiAAP , @CMODelhi , @msisodia your shameless @DelhiPolice beats up a man bec…",usay_umair,India,No Value Mentioned,48,361,1009,False,"Don't u feel ashamed @ArvindKejriwal , @AtishiAAP , @CMODelhi , @msisodia your shameless @DelhiPolice beats up a man because he is a muslim but stands quietly infront of people by liquor without following social distancing...
@IndiasMuslims @MucotoApp @GulbargaTemper1 https://t.co/symDjXHJ6n"
2020-05-07 22:06:34+00:00,"RT @GregAnswers: #COVID19 has very low overall death rate by my calculations! The News Agency is all hype! Basic Math! 264,000 confirm deat…",RDavid55688217,"Bbsr City, India",Author || Entrepreneur || Christ Lover,4967,4389,55853,False,"#COVID19 has very low overall death rate by my calculations! The News Agency is all hype! Basic Math! 264,000 confirm deaths world?/ 1,500,000,000 or 2% of world now best low guess have had #coronavirus asymptomatic by Antigen test  = .00016 or .16 % about same as regular flu!! https://t.co/fSH02VSosy"
2020-05-07 22:06:38+00:00,"RT @jitenderkhalsa: In Delhi , Doubling time of COVID-19 is now 11 days. There was a time when it was 4-4.5 days. If doubling time reaches…",CBMANTRI123456,"odisha, india",Waiting for an honest & strong politician to lead our country.,500,311,306125,False,"In Delhi , Doubling time of COVID-19 is now 11 days. There was a time when it was 4-4.5 days. If doubling time reaches 20 days, It will be more comfortable. About four days ago, it was 13 days, but now it has decreased as thousands of pending reports are coming"
2020-05-07 22:06:45+00:00,"RT @OpIndia_com: Even after 40 days of strict lockdown, India has not seen a declining trend, crisis may hit peak in June-July: AIIMS direc…",Iwant2beNo1,"New Delhi, India",wife of my husband.,10,621,164,False,"Even after 40 days of strict lockdown, India has not seen a declining trend, crisis may hit peak in June-July: AIIMS director
https://t.co/DWHh41BwGY"
2020-05-07 22:06:52+00:00,"RT @AliVelshi: After learning one of his valets was infected, Trump became “lava level mad” at his staff and said he doesn’t feel they are…",SAndrewsw,"Indiana, USA",I'm just me 😊✌trump despiser Dem till the end 🌊🌊🌊 No DM'S❗🚫 #resist #BLM #VoteForJoe,1006,1797,18492,False,"After learning one of his valets was infected, Trump became “lava level mad” at his staff and said he doesn’t feel they are doing all they can to protect him from the virus, according to a person close to the White House. https://t.co/JPcoHwATeY"
2020-05-07 22:06:58+00:00,Salon owner Shelley Luther released from jail after Texas governor changes coronavirus orders https://t.co/RVEwR93WKp,therexoxer,India,RT != Endorsement,870,2,16414,False,No Value Mentioned
2020-05-07 22:07:02+00:00,"RT @aravosis: Per CDC guidelines, Trump has to be quarantined for 14 days now.",ReiterG,"Indianapolis, Indiana","Proud Indy resident & big fan of community development, transit and affordable housing. Mass Ave.",328,587,1450,False,"Per CDC guidelines, Trump has to be quarantined for 14 days now."
2020-05-07 22:07:06+00:00,"RT @SidrahDP: We are in the midst of a global pandemic. Yet, Kashmiris are being singled out, denied the right to call their loved ones, th…",zhrashidi,India🇮🇳 بھارت,"आम नागरिक। Proud Indian। Critics
हमारा संविधान इजाज़त देता है #सवाल_सत्ता_से 
RT not endorsement",970,442,14032,False,"We are in the midst of a global pandemic. Yet, Kashmiris are being singled out, denied the right to call their loved ones, the right to call a doctor &amp; seek medical help. There may be someone who needs emergency consultation. This brutal,continued collective punishment must stop."
2020-05-07 22:07:13+00:00,RT @muwnge: Sorry to disturb your scrolling but I just wanted to wish you personal growth and happiness for the remainder of this pandemic.,kamkamlee18,"Indianapolis, IN",🧚🏼‍♀️🕸🌟🌀⛱,431,538,10862,False,Sorry to disturb your scrolling but I just wanted to wish you personal growth and happiness for the remainder of this pandemic.
2020-05-07 22:07:13+00:00,"RT @EmeraldRobinson: Stories the media won’t cover today:

The Imperial College's coronavirus model code is defective.

Dr. Fauci's NIH gav…",HoosierHappy,Indiana,Found happiness in the Hoosier state and realized the sunshine in Cali wasn't worth the rats in the palm trees!,248,921,7807,False,"Stories the media won’t cover today:

The Imperial College's coronavirus model code is defective.

Dr. Fauci's NIH gave grant money to a level 4 bioweapons lab in China.

DOJ Prosecutor Brandon Van Grack just withdrew from the Gen. Flynn case."
2020-05-07 22:07:15+00:00,RT @SafetyPinDaily: Official U.S. coronavirus death toll may be missing many thousands || Via nbcnews https://t.co/ie5co75oG5,Dr_Rajesh369,"Lucknow, India","MBBS frm KGMU,
MS Orthopaedics BHU Varanasi,
MCh Orthopedic,
Ex Ast. Professor Govt Medical College,
Social Activist, 
Freelancer Orthopedic Surgeon in Lucknow",752,4619,18654,False,Official U.S. coronavirus death toll may be missing many thousands || Via nbcnews https://t.co/ie5co75oG5
2020-05-07 22:07:18+00:00,"RT @doamuslims: Muslim Man Attacked By #Delhi Police And Mob

If you're a Muslim, you cannot go out and buy essential food for your family…",Maaz56622595,"New Delhi, India","INDIAN 🇮🇳

RTs not endorsement 😉",354,1147,14650,False,"Muslim Man Attacked By #Delhi Police And Mob

If you're a Muslim, you cannot go out and buy essential food for your family during #coronavirus lockdown! You risk being brutally attacked like Imran 👇

#India #Islamophobia #Islamophobia_In_India #StopTargetingMuslim https://t.co/tHthCgflrF"
2020-05-07 22:07:18+00:00,"RT @PiyushGoyal: Under PM @NarendraModi ji's visionary leadership, India has launched clinical research studies  involving AYUSH interventi…",saadhyudu2011,"Guntur, Andhrapradesh.India.","Bjp leader.Iam supporting Narendra modiji, Amitshaji,Yogiji,SwaatchBharat.Bharat https://t.co/IJIqV1jbD6 nation,one https://t.co/2ay6HXQviA.Newideas.Jaihind.Mann ki B",2540,5002,251855,False,"Under PM @NarendraModi ji's visionary leadership, India has launched clinical research studies  involving AYUSH interventions for COVID-19

With efforts of @DrHarshVardhan ji &amp; @ShripadyNaik ji, our traditional Ayurveda knowledge will help fight COVID-19

https://t.co/OiKF7uv95e https://t.co/hfVGZgzCW4"
2020-05-07 22:07:26+00:00,"RT @robbystarbuck: It’s tremendously ironic that the party who organized a scheme to spy on Trump, investigated his kids, tried to throw ev…",AnarchyLives,"Indianapolis, Indiana","Proud Independent Conservative. Think for yourself. 2nd Amendment, USAF Veteran, Former Law Enforcement #PJNET #MAGA #TRUMP #BACKTHEBLUE #WWG1WGA",5878,6064,22502,False,"It’s tremendously ironic that the party who organized a scheme to spy on Trump, investigated his kids, tried to throw everyone he knew in prison and spent all of January on impeachment instead of coronavirus is now trying to accuse Trump of starting a Banana Republic. 😂"
2020-05-07 22:07:26+00:00,Coronavirus updates LIVE: Ceferin welcomes Bundesliga return https://t.co/cTz1QQvWWz,eRocketNews,India,https://t.co/lt0Puv1hBI,28,0,19882,False,No Value Mentioned
2020-05-07 22:07:27+00:00,RT @LouiseMensch: Time for @RepJerryNadler and the House to #ImpeachBarr,tammylively,Indiana ,"Wife, mom, mamaw, radio personality. Opinions here are my own. I love my country and pray we survive the criminal in the White House. 🌊 🌊 🌊",4161,4146,35078,True,Time for @RepJerryNadler and the House to #ImpeachBarr https://t.co/c3cnKiZfi9
2020-05-07 22:07:34+00:00,"RT @ImJitenderSati: The @ArvindKejriwal Govt started online classes of English courses due to Corona virus lock down ..

Parents are also t…",CBMANTRI123456,"odisha, india",Waiting for an honest & strong politician to lead our country.,500,311,306125,False,"The @ArvindKejriwal Govt started online classes of English courses due to Corona virus lock down ..

Parents are also taking part in English course online classes along with students

Even lockdown could not stop Delhi Education Revolution

#KejriwalShowsTheWay https://t.co/YvskZW25FR"
2020-05-07 22:07:35+00:00,"RT @KarenChristensn: 1)R.I.P. Todd Christensen 😥
My husband died on May 1st and his Dr called me less than 2 hours ago &amp; said it was the co…",mostlyataloss,indiana,Not who you think.,490,847,34703,False,"1)R.I.P. Todd Christensen 😥
My husband died on May 1st and his Dr called me less than 2 hours ago &amp; said it was the coronavirus. He was an avid MAGA that believed in the conspiracies promoted by Fox News &amp; others, refused to go to the hospital because he said""the flu is worse""."
2020-05-07 22:07:39+00:00,RT @DiamondandSilk: This needs to be investigated.  What's really going on here? https://t.co/z2nlJklfgB,JaneEat40045260,Central Indiana,"Patriot...Loves the Lord Jesus Christ...Happy being a mom to 2 sons, sister, daughter, and friend. Thankful and blessed. TRUMP 2020! KAG!! MAGA!!✝️",6685,7281,51066,False,This needs to be investigated.  What's really going on here? https://t.co/z2nlJklfgB
2020-05-07 22:07:43+00:00,"RT @David_Leavitt: If Republicans think it's ""her choice"" for the Dallas salon owner released by Texas Supreme Court to endanger her life a…",TheAntiTwitler,"Indianapolis, IN",#Indy🏳️‍🌈~ Here to make myself 😡 • Dog Dad|Fish Dad|Dad Bod • #Biden2020 • Vote - Your life depends on it ✊🏻✊🏼✊🏽✊🏾✊🏿       I poke bears & bees & Qs.,1891,1862,29147,False,"If Republicans think it's ""her choice"" for the Dallas salon owner released by Texas Supreme Court to endanger her life and others amid the coronavirus pandemic then they should shut the fuck up about every woman choosing abortion because it's ""her choice."""
2020-05-07 22:07:50+00:00,"RT @jsolomonReports: Doctors find hydroxychloroquin success rate at 91%, urge Arizona governor to make drug available | Just The News https…",AnarchyLives,"Indianapolis, Indiana","Proud Independent Conservative. Think for yourself. 2nd Amendment, USAF Veteran, Former Law Enforcement #PJNET #MAGA #TRUMP #BACKTHEBLUE #WWG1WGA",5878,6064,22502,False,"Doctors find hydroxychloroquin success rate at 91%, urge Arizona governor to make drug available | Just The News https://t.co/c96rHoT0lU"
2020-05-07 22:07:52+00:00,"RT @DDNational: PLEASE RETWEET
#IndiaFightsCorona
 
#IndiaFightsCoronavirus #StayAtHomeSaveLives #StayHomeStaySafe #StayHome #COVID2019 #CO…",Dineshsoniapn,"Indore, India",दैनिक प्रजा लहर  न्यूज़ एंड ए पी एन न्यूज़  ब्यूरो हेड इंदौर,45,952,2240,False,"PLEASE RETWEET
#IndiaFightsCorona
 
#IndiaFightsCoronavirus #StayAtHomeSaveLives #StayHomeStaySafe #StayHome #COVID2019 #COVID19 https://t.co/EOxDt0mlof"
2020-05-07 22:07:54+00:00,"RT @atti_cus: ‘Delhi court orders FIR against 2 women for ‘communal remarks’ against Muslims

 https://t.co/ggqiPnEHX4",ibbu_mama,"New Delhi, India","Let Love & Peace thrive. 
Proud Indian Muslim.
Electrical Engineer.",410,1592,17477,False,"‘Delhi court orders FIR against 2 women for ‘communal remarks’ against Muslims

 https://t.co/ggqiPnEHX4"
2020-05-07 22:07:58+00:00,RT @jenroy1212: I wept in my car as I drove through London this evening. So many people out &amp; about. I’d just finished a 12hr day (ICU Dr)…,iamadwoy,"Assam, India","|Bong|
|Memer|
|Single (since 2000 & forever)|
|Philosophically Inclined|
|Tagore Admirer|
|Silchar, Assam|",944,1962,23936,False,"I wept in my car as I drove through London this evening. So many people out &amp; about. I’d just finished a 12hr day (ICU Dr) on a Covid ICU. Patients fighting for their lives. One sadly died. The UK lockdown is a joke. Is &gt;30,000 deaths not enough?! #extendlockdown"
2020-05-07 22:08:02+00:00,"RT @ScottGottliebMD: Daily positive cases of covid19 as a percent of total daily tests continues to fall nationally, a very good sign as co…",RMB0193,Indiana,No Value Mentioned,81,1682,37118,False,"Daily positive cases of covid19 as a percent of total daily tests continues to fall nationally, a very good sign as covid testing expands. Declining positivity could be a leading indicator of an epidemic starting to decline. 10% is still high but it's coming down at a steady pace https://t.co/xVP56dxUmV"
2020-05-07 22:08:04+00:00,"@Shyamal54460965 Please feel free to connect with us incase any assistance required. We would like to keep you informed that due to several travel restrictions and district lockdowns imposed by the government to control the widespread of COVID-19, we are working with limited staff, please",Yatra_Care,"Gurugram, India",Official customer support account of https://t.co/YIU1InWE0U,794,0,72694,False,No Value Mentioned
2020-05-07 22:08:05+00:00,RT @thehifiindy: @jblampin spoke with @WTHRcom about the pandemic shutdown's effect on independent music venues &amp; re-opening plans earlier…,mokbpresents,"Indianapolis, IN","#MOKBPresents 👊 Bringing the best live music to Indy since '08 | Follow us for show announces, updates & contests | Our rooms: @thehifiindy @lofiindy",7092,2619,8836,False,"@jblampin spoke with @WTHRcom about the pandemic shutdown's effect on independent music venues &amp; re-opening plans earlier this week - check it out in full below👇

https://t.co/KxmvmJYqWj"
2020-05-07 22:08:13+00:00,"RT @Reuters: Understanding COVID-19: Here is a look at @ReutersGraphics survey of intensive care beds, ventilators, testing and essential p…",808s_and_Tweets,"Indianapolis, IN","We can turn tragedy into triumph
❤ F.C.Y ❤",211,528,5959,False,"Understanding COVID-19: Here is a look at @ReutersGraphics survey of intensive care beds, ventilators, testing and essential personnel across the African continent https://t.co/KGu1W3uW3r by @khoureld @DG_Lewis @McNeill_Tweets &amp; Samuel Granados https://t.co/EoIaPTD2dd"
