created_at,full_text,screen_name,location,description,followers_count,friends_count,statuses_count,verified,full_retweet_text
2020-01-24 03:26:54+00:00,"RT @BloombergTV: Singapore PM Lee Hsien Loong says of novel coronavirus outbreak, ""It is an example of why countries need to work together.…",jetairways2020,"Mumbai, India","India’s 🇮🇳 best premium airline based at @CSMIA_Official & @DelhiAirport’s, presently defunct, expected to resume operations early 2020 follow for live news.",573,1020,3148,False,"Singapore PM Lee Hsien Loong says of novel coronavirus outbreak, ""It is an example of why countries need to work together. You may wish to be deglobalized but the virus is not going to be deglobalized and it is going to come to you."" https://t.co/b5vnZ9vGM6 https://t.co/o1BI0maaKf"
2020-01-24 03:28:14+00:00,"New Tumblr post: ""Coronavirus Outbreak: Videos Show Chinese City on Edge"" https://t.co/5wK0mcU3of IFTTT, Technology, Techie Thrills, Best app development company in usa, top app development company",ecartxpertandy,India,"Top startup booster company helping #ventures, #startups, #founders #scientist #innovation #Cofounders #business to accelerate business innovation globally.",1428,1879,5654,False,No Value Mentioned
2020-01-24 03:23:48+00:00,RT @DrTedros: I am not declaring the new #coronavirus outbreak a public health emergency of international concern today. The Emergency Comm…,GeorgeInstIN,"New Delhi, India","The George Institute for Global Health, India, established in 2007 to improve the health of all Indians.",2632,1375,5799,False,"I am not declaring the new #coronavirus outbreak a public health emergency of international concern today. The Emergency Committee was divided over whether the outbreak represents a PHEIC. This is an emergency in China, but it has not yet become a global health emergency. https://t.co/16knaV4lMZ"
2020-01-24 03:24:09+00:00,"RT @business: Singapore PM Lee Hsien Loong says of novel coronavirus outbreak, ""It is an example of why countries need to work together. Yo…",NatosiaC,"Indianapolis, IN","Forex trader,Singer",252,580,234,False,"Singapore PM Lee Hsien Loong says of novel coronavirus outbreak, ""It is an example of why countries need to work together. You may wish to be deglobalized but the virus is not going to be deglobalized and it is going to come to you."" https://t.co/RycwWQTqpJ https://t.co/EcM8riSqri"
2020-01-24 03:24:50+00:00,"Dubai International Airport in 2018 served over 89 million passengers, including more foreign passengers than any other airport worldwide for the fifth year in a row.
https://t.co/6VeykCnaBS",dt_next,"Chennai, India",English language newspaper by the Daily Thanthi Group,5577,408,113027,True,No Value Mentioned
2020-01-24 03:22:37+00:00,"RT @ani_digital: India closely monitoring situation evolving in China following Coronavirus outbreak

Read @ANI story | https://t.co/kE55fS…",vishuadhana08,"New Delhi, India",Budding journalist | Wondering about everything| Read to survive.,81,1286,585,False,"India closely monitoring situation evolving in China following Coronavirus outbreak

Read @ANI story | https://t.co/kE55fSLm6q https://t.co/yaWkckEjxY"
2020-01-24 03:17:11+00:00,"Coronavirus Outbreak in China: Death Toll Rises to 25, Indian Embassy in Beijing Opens Two Hotline Numbers for Indians
#CoronavirusOutbreak  #coronavirus #CoronavirusChina #ChinaPneumonia #ChinaVirus #China #Beijing @EOIBeijing @MEAIndia
https://t.co/4lJwenwTJY",latestly,"Mumbai, India","https://t.co/U4rHOvEUQR focuses on the What, When, Who and How of a trending story, and helps readers with analyses that go beyond the domain of news. https://t.co/OCtmVDjYfd",57594,340,103652,True,No Value Mentioned
2020-01-24 03:18:08+00:00,"Chinese New Year is the largest human migration on earth, with about 400 Million people returning to their home in the mainland; thermal imaging passengers from just China at 7 main airports wouldn't cut it if there's a major outbreak.

1/3

https://t.co/7ls4lXOlP6

#coronavirus",heavyinfo,"Coimbatore, India","Startup Coach @hit_startup, Ideator @needgap, Toolchain Builder @startuptoolchn // Previously - CEO: Timebender Technologies",303,43,2153,False,No Value Mentioned
2020-01-24 03:18:09+00:00,"Perhaps, because WHO has not yet announced this outbreak as a global emergency things are being taken slow; But, WHO is making its call based on the information it receives from China and so that's there.

3/3

#WHO #outbreak #coronavirus #global #emergency",heavyinfo,"Coimbatore, India","Startup Coach @hit_startup, Ideator @needgap, Toolchain Builder @startuptoolchn // Previously - CEO: Timebender Technologies",303,43,2153,False,No Value Mentioned
2020-01-24 03:14:25+00:00,#China’s #Coronavirus outbreak has resulted in the death of 25 people till now with confirmed cases rising sharply to 830. https://t.co/T60iBoJ2ap,Outlookindia,"New Delhi, India",The fully loaded news magazine from India,214868,51,355676,True,No Value Mentioned
2020-01-24 03:15:06+00:00,RT @sidhant: Just in: India responds to emergency request by Maldives for supply of Measles vaccine to contain the outbreak in the Island c…,shivesh77_kumar,INDIA,TRUE BHARTIYE 🇮🇳🇮🇳🇮🇳BJP MEMBER from Bangalore north,351,2151,80562,False,"Just in: India responds to emergency request by Maldives for supply of Measles vaccine to contain the outbreak in the Island country; Supplies 30,000 doses of Measles and Rubella (MR) within 72 hours of the request. https://t.co/ZoZyeDq68I"
2020-01-24 03:15:47+00:00,"RT @ani_digital: India closely monitoring situation evolving in China following Coronavirus outbreak

Read @ANI story | https://t.co/kE55fS…",CrazyThakare,"Maharashtra, India",No Value Mentioned,13733,337,179553,False,"India closely monitoring situation evolving in China following Coronavirus outbreak

Read @ANI story | https://t.co/kE55fSLm6q https://t.co/yaWkckEjxY"
2020-01-24 03:11:23+00:00,"RT @business: Singapore PM Lee Hsien Loong says of novel coronavirus outbreak, ""It is an example of why countries need to work together. Yo…",ss_gurprit,"Gurgaon, India","REVIVE THE WORLD ECONOMY 
JOBS/WORK FOR ALL &
HUMANITY ABOVE EVERYTHING",206,194,7087,False,"Singapore PM Lee Hsien Loong says of novel coronavirus outbreak, ""It is an example of why countries need to work together. You may wish to be deglobalized but the virus is not going to be deglobalized and it is going to come to you."" https://t.co/RycwWQTqpJ https://t.co/EcM8riSqri"
2020-01-24 03:09:26+00:00,"RT @desertfox61I: India closely monitoring situation evolving in China following #Coronavirus outbreak 

https://t.co/ct9OG0mCm9",A31X64Vijay,INDIA. (Bharat),"Dreaming for a Strong, Powerful & Glorious 'Great-INDIA' (Akhand Bharat) ... in a Beautiful WORLD !!! .. RTs are Not Endorsements !",4104,4966,378187,False,"India closely monitoring situation evolving in China following #Coronavirus outbreak 

https://t.co/ct9OG0mCm9"
2020-01-24 03:07:37+00:00,"India closely monitoring situation evolving in China following #Coronavirus outbreak 

https://t.co/ct9OG0mCm9",desertfox61I,India,"Once a Soldier Always a Soldier
RT not endorsements",12044,2734,440768,False,No Value Mentioned
2020-01-24 03:07:51+00:00,"RT @ani_digital: India closely monitoring situation evolving in China following Coronavirus outbreak

Read @ANI story | https://t.co/kE55fS…",iPraneet,India,‘Kuch nasha matrabhoomi ki shaan ka hai.’ 🇮🇳,318,2006,12647,False,"India closely monitoring situation evolving in China following Coronavirus outbreak

Read @ANI story | https://t.co/kE55fSLm6q https://t.co/yaWkckEjxY"
2020-01-24 03:08:14+00:00,RT @DrTedros: I am not declaring the new #coronavirus outbreak a public health emergency of international concern today. The Emergency Comm…,tksuma,India,"Prof of Internal Medicine, Head of Filariasis research unit, the WHO collaborating centre for MMDP in LF now, focusing mainly on capacity building, patient care",110,244,240,False,"I am not declaring the new #coronavirus outbreak a public health emergency of international concern today. The Emergency Committee was divided over whether the outbreak represents a PHEIC. This is an emergency in China, but it has not yet become a global health emergency. https://t.co/16knaV4lMZ"
2020-01-24 03:04:28+00:00,RT @nowthisnews: A Chinese city of 11 million people has been quarantined after a mysterious — and deadly — coronavirus outbreak https://t.…,TrollBhakts,"Hyderabad, India",Facebook Page Hacked By IT cell 😒 follow us on Facebook  @troll bhakts 2.0,193,74,753,False,A Chinese city of 11 million people has been quarantined after a mysterious — and deadly — coronavirus outbreak https://t.co/dEuwdLPqNr
2020-01-24 03:04:32+00:00,"RT @ani_digital: India closely monitoring situation evolving in China following Coronavirus outbreak

Read @ANI story | https://t.co/kE55fS…",ANI,India,"Asian News International. Multi-media news agency, content for information platforms: TV, Internet, broadband, newspapers, mobiles https://t.co/PjGRhL4qvg",3715728,0,390103,True,"India closely monitoring situation evolving in China following Coronavirus outbreak

Read @ANI story | https://t.co/kE55fSLm6q https://t.co/yaWkckEjxY"
2020-01-24 03:04:42+00:00,Snakes behind the outbreak of Coronavirus? | World Economic Forum #caronavirus ⁦@WIONews⁩ ⁦@WSJopinion⁩ ⁦@TimesNow⁩ ⁦@TimesNowHindi⁩ ⁦@Suntimes⁩ ⁦@BBCWorld⁩ ⁦@BBCHindi⁩  https://t.co/AX7eeAHBcm,drjknanda,"Bhubaneshwar, India","Prof. J.K.Nanda, Ph.D., D.Litt. 
https://t.co/UxwiUZOSzl",946,851,33968,False,No Value Mentioned
2020-01-24 03:06:18+00:00,"RT @ani_digital: India closely monitoring situation evolving in China following Coronavirus outbreak

Read @ANI story | https://t.co/kE55fS…",MrRohitt,"Kanpur, India",#Engineer #Naturelover #Teacher #Vegetarian #Hindu #Nationfirstalways #Activist #Exsecular,19235,6063,70861,False,"India closely monitoring situation evolving in China following Coronavirus outbreak

Read @ANI story | https://t.co/kE55fSLm6q https://t.co/yaWkckEjxY"
2020-01-24 03:02:35+00:00,"India closely monitoring situation evolving in China following Coronavirus outbreak

Read @ANI story | https://t.co/kE55fSLm6q https://t.co/yaWkckEjxY",ani_digital,India,"Asian News International.Multi-media news agency,content for information platforms:TV,Internet,broadband,newspapers,mobiles https://t.co/QrqluPvffc",72278,0,25816,True,No Value Mentioned
2020-01-24 03:01:33+00:00,"New post (Coronavirus outbreak: Death toll in China mounts to 25, infections spread) has been published on ApzWeb - https://t.co/2Sz2sGlPMe",Vsplusonline,INDIA,Web Hosting India | Web Hosting Space Unlimited | Free Domain Registration | Top Hosting India | Unlimited Domains | Reseller | VPS | Dedicated Server,148,32,37897,False,No Value Mentioned
2020-01-24 03:01:38+00:00,"Coronavirus outbreak: Death toll in China mounts to 25, infections spread https://t.co/2Sz2sGlPMe",Vsplusonline,INDIA,Web Hosting India | Web Hosting Space Unlimited | Free Domain Registration | Top Hosting India | Unlimited Domains | Reseller | VPS | Dedicated Server,148,32,37897,False,No Value Mentioned
2020-01-24 03:01:51+00:00,RT @SputnikInt: URGENT: Ten cities of China's province of Hubei suspend transport connection over coronavirus outbreak https://t.co/8RDRjqd…,ram38001,"Chennai , India ","Shri Ramakrishna Mission Swami Vivekanada College , Mylapore ,Chennai  , Madras Law College....",566,1528,28347,False,URGENT: Ten cities of China's province of Hubei suspend transport connection over coronavirus outbreak https://t.co/8RDRjqdUod https://t.co/vxgfSRinaz
2020-01-24 03:54:56+00:00,"@colorblind07 @IndoPac_Info @charliechancat Those viruses can infect humans in unique cases &amp; then start human to human propagation.
So antigenic drifts &amp; shifts is very natural to viruses.

Currently another such epidemic is going on in China only. But no cases in humans yet...👇
https://t.co/9fgSMEWPbQ",dr_gsharma,India,"Right for 'Left'.
Learn, Unlearn, Relearn...Unlearn!
Just passing by...",126,130,6012,False,No Value Mentioned
2020-01-24 03:56:53+00:00,RT @SadhguruJV: This world has witnessed many epidemics. Let’s create a new one – an Epidemic of #Meditation. Cultivating the quality of me…,LaviSpirit,"Chennai, India",No Value Mentioned,14,26,1733,False,This world has witnessed many epidemics. Let’s create a new one – an Epidemic of #Meditation. Cultivating the quality of meditativeness will bring clarity of vision &amp; unleash the limitless human potential. -Sg #WEF2020 @wef @Davos https://t.co/N814xDi8ls
2020-01-24 03:57:52+00:00,"Due to rising cases of #coronavirus epidemic in China, Indian Embassy opens hotlines for assistance  

#China #CoronavirusOutbreak

https://t.co/2nvtFiCJDN",NewsNationTV,"Noida, India",Latest and Breaking news alerts from India and the world. Retweets are not endorsements.,179124,455,289403,True,No Value Mentioned
2020-01-24 03:59:26+00:00,RT @SadhguruJV: This world has witnessed many epidemics. Let’s create a new one – an Epidemic of #Meditation. Cultivating the quality of me…,sudhan_h,Chennai - India,No Value Mentioned,233,107,5893,False,This world has witnessed many epidemics. Let’s create a new one – an Epidemic of #Meditation. Cultivating the quality of meditativeness will bring clarity of vision &amp; unleash the limitless human potential. -Sg #WEF2020 @wef @Davos https://t.co/N814xDi8ls
2020-01-24 03:46:59+00:00,RT @SadhguruJV: This world has witnessed many epidemics. Let’s create a new one – an Epidemic of #Meditation. Cultivating the quality of me…,poonkothai288,"Chennai, India",No Value Mentioned,367,255,19556,False,This world has witnessed many epidemics. Let’s create a new one – an Epidemic of #Meditation. Cultivating the quality of meditativeness will bring clarity of vision &amp; unleash the limitless human potential. -Sg #WEF2020 @wef @Davos https://t.co/N814xDi8ls
2020-01-24 03:47:46+00:00,RT @SadhguruJV: This world has witnessed many epidemics. Let’s create a new one – an Epidemic of #Meditation. Cultivating the quality of me…,preethi_yaksha,"Chennai, India",Into Conscious Living🧘‍♀️,227,380,5807,False,This world has witnessed many epidemics. Let’s create a new one – an Epidemic of #Meditation. Cultivating the quality of meditativeness will bring clarity of vision &amp; unleash the limitless human potential. -Sg #WEF2020 @wef @Davos https://t.co/N814xDi8ls
2020-01-24 03:51:03+00:00,RT @SadhguruJV: This world has witnessed many epidemics. Let’s create a new one – an Epidemic of #Meditation. Cultivating the quality of me…,pravin0405,"Panaji, India",Nothing,28,20,3621,False,This world has witnessed many epidemics. Let’s create a new one – an Epidemic of #Meditation. Cultivating the quality of meditativeness will bring clarity of vision &amp; unleash the limitless human potential. -Sg #WEF2020 @wef @Davos https://t.co/N814xDi8ls
2020-01-24 03:51:39+00:00,RT @SadhguruJV: This world has witnessed many epidemics. Let’s create a new one – an Epidemic of #Meditation. Cultivating the quality of me…,PranPiku,INDIA ,"🇮🇳Proud INDIAN🇮🇳INDIA FIRST is my religion,CONSTITUTION is my holy book🇮🇳VIEWS EXPRESSED ARE PURELY PERSONAL🇮🇳RT's aren't endorsement. No DM.",341,1741,3366,False,This world has witnessed many epidemics. Let’s create a new one – an Epidemic of #Meditation. Cultivating the quality of meditativeness will bring clarity of vision &amp; unleash the limitless human potential. -Sg #WEF2020 @wef @Davos https://t.co/N814xDi8ls
2020-01-24 03:53:44+00:00,RT @miltsdad: Core principle making America great has been the First Amendment.  The 1A does not allow anything to be said.  It is limited…,kzhwang,"Indiana, USA",I wear pearls and a red shirt.,518,2916,5171,False,Core principle making America great has been the First Amendment.  The 1A does not allow anything to be said.  It is limited when the public safety is threatened.  The 2A is  similarly limited. The epidemic of gun violence threatens us. Join @MomsDemand- we are PRO 2A
2020-01-24 03:38:10+00:00,"Epidemics and Markets. Take a look-
#coronavirus #Epidemic https://t.co/qpNowbmp19",SahilKapoor,"Mumbai, India","Avid learner of Markets, Economics, Sports. First time dad. 'Kitabikida', Always reading!",3233,79,7920,False,No Value Mentioned
2020-01-24 03:40:42+00:00,RT @SadhguruJV: This world has witnessed many epidemics. Let’s create a new one – an Epidemic of #Meditation. Cultivating the quality of me…,MAHENDRAR18,"Hanur, India",No Value Mentioned,22,27,780,False,This world has witnessed many epidemics. Let’s create a new one – an Epidemic of #Meditation. Cultivating the quality of meditativeness will bring clarity of vision &amp; unleash the limitless human potential. -Sg #WEF2020 @wef @Davos https://t.co/N814xDi8ls
2020-01-24 03:40:47+00:00,"RT @IYC: IYC National In-charge Shri @Allavaru, National President Shri @srinivasiyc and National Spokesperson Shri @pandey_amrish launched…",chiragsingh512,"Indore, India","Spokesperson , Indian Youth Congress (MP)

                           Founder , Vriskh Foundation",213,415,2131,False,"IYC National In-charge Shri @Allavaru, National President Shri @srinivasiyc and National Spokesperson Shri @pandey_amrish launched the National Register for Unemployed at AICC headquarters to combat the job crisis that has become an epidemic in the country.

#NaukariKiBaat https://t.co/jQOImeftLu"
2020-01-24 03:41:20+00:00,RT @SadhguruJV: This world has witnessed many epidemics. Let’s create a new one – an Epidemic of #Meditation. Cultivating the quality of me…,KishanVarma08,"Pune, India",No Value Mentioned,52,160,2468,False,This world has witnessed many epidemics. Let’s create a new one – an Epidemic of #Meditation. Cultivating the quality of meditativeness will bring clarity of vision &amp; unleash the limitless human potential. -Sg #WEF2020 @wef @Davos https://t.co/N814xDi8ls
2020-01-24 03:30:11+00:00,RT @SadhguruJV: This world has witnessed many epidemics. Let’s create a new one – an Epidemic of #Meditation. Cultivating the quality of me…,GauriJournalist,"Bihar/Delhi (बिहार, आरा )India","सेवा के लिए प्रतिबद्ध हूँ ,हरदम उपलब्ध हूँ।, 8920215318
Inner Empowerment of Media Professional, ब्यूरो चीफ,(दिल्लीNCR)
इंडो- नेपाल पत्रकार महासंघ",178,4962,3915,False,This world has witnessed many epidemics. Let’s create a new one – an Epidemic of #Meditation. Cultivating the quality of meditativeness will bring clarity of vision &amp; unleash the limitless human potential. -Sg #WEF2020 @wef @Davos https://t.co/N814xDi8ls
2020-01-24 03:31:19+00:00,RT @SadhguruJV: This world has witnessed many epidemics. Let’s create a new one – an Epidemic of #Meditation. Cultivating the quality of me…,vinvelithalayan,"Chennai, India",Retweets are not paid endorsements.,173,507,2873,False,This world has witnessed many epidemics. Let’s create a new one – an Epidemic of #Meditation. Cultivating the quality of meditativeness will bring clarity of vision &amp; unleash the limitless human potential. -Sg #WEF2020 @wef @Davos https://t.co/N814xDi8ls
2020-01-24 03:31:21+00:00,RT @SadhguruJV: This world has witnessed many epidemics. Let’s create a new one – an Epidemic of #Meditation. Cultivating the quality of me…,chauhanrohit10,"Delhi , India","Air Force Veteran | Nationalist and follower of Sanatan Dharma | All Tweets-Retweets are personal opinions and convey no disrespect to anybody.
Jai Hind 🇮🇳",176,553,26616,False,This world has witnessed many epidemics. Let’s create a new one – an Epidemic of #Meditation. Cultivating the quality of meditativeness will bring clarity of vision &amp; unleash the limitless human potential. -Sg #WEF2020 @wef @Davos https://t.co/N814xDi8ls
2020-01-24 03:31:49+00:00,RT @SadhguruJV: This world has witnessed many epidemics. Let’s create a new one – an Epidemic of #Meditation. Cultivating the quality of me…,AdityaS96840515,"New Delhi, India",Sadhguru,59,98,2383,False,This world has witnessed many epidemics. Let’s create a new one – an Epidemic of #Meditation. Cultivating the quality of meditativeness will bring clarity of vision &amp; unleash the limitless human potential. -Sg #WEF2020 @wef @Davos https://t.co/N814xDi8ls
2020-01-24 03:32:33+00:00,RT @SadhguruJV: This world has witnessed many epidemics. Let’s create a new one – an Epidemic of #Meditation. Cultivating the quality of me…,GyanveerSingh8,India,"Proud Indian I support my Armed forces Nation first unapologetically right unabashedly a Modi Fan
RTs not endorsement
Cogito Ergo Sum I think therefore I am",990,695,142283,False,This world has witnessed many epidemics. Let’s create a new one – an Epidemic of #Meditation. Cultivating the quality of meditativeness will bring clarity of vision &amp; unleash the limitless human potential. -Sg #WEF2020 @wef @Davos https://t.co/N814xDi8ls
2020-01-24 03:34:01+00:00,RT @SadhguruJV: This world has witnessed many epidemics. Let’s create a new one – an Epidemic of #Meditation. Cultivating the quality of me…,imbalapranam,"Chennai, India",orthopaedic surgeon; seeker of truth; volunteer of life,245,121,2157,False,This world has witnessed many epidemics. Let’s create a new one – an Epidemic of #Meditation. Cultivating the quality of meditativeness will bring clarity of vision &amp; unleash the limitless human potential. -Sg #WEF2020 @wef @Davos https://t.co/N814xDi8ls
2020-01-24 03:36:09+00:00,RT @SadhguruJV: This world has witnessed many epidemics. Let’s create a new one – an Epidemic of #Meditation. Cultivating the quality of me…,shikhasharmabjp,"Noida, India","मंत्री, भाजपा, बिसरख मंडल
हर जिम्मेदारी के लिए तैयार🙏
Animal Lover, Nature Lover, Proud to be an Indian",112,154,1364,False,This world has witnessed many epidemics. Let’s create a new one – an Epidemic of #Meditation. Cultivating the quality of meditativeness will bring clarity of vision &amp; unleash the limitless human potential. -Sg #WEF2020 @wef @Davos https://t.co/N814xDi8ls
2020-01-24 03:36:11+00:00,RT @SadhguruJV: This world has witnessed many epidemics. Let’s create a new one – an Epidemic of #Meditation. Cultivating the quality of me…,SoumyaranjanD18,"Dhenkanal, India",No Value Mentioned,50,358,5321,False,This world has witnessed many epidemics. Let’s create a new one – an Epidemic of #Meditation. Cultivating the quality of meditativeness will bring clarity of vision &amp; unleash the limitless human potential. -Sg #WEF2020 @wef @Davos https://t.co/N814xDi8ls
2020-01-24 03:24:01+00:00,RT @SadhguruJV: This world has witnessed many epidemics. Let’s create a new one – an Epidemic of #Meditation. Cultivating the quality of me…,DeviThiru2,"Chennai, India",No Value Mentioned,7,7,1973,False,This world has witnessed many epidemics. Let’s create a new one – an Epidemic of #Meditation. Cultivating the quality of meditativeness will bring clarity of vision &amp; unleash the limitless human potential. -Sg #WEF2020 @wef @Davos https://t.co/N814xDi8ls
2020-01-24 03:25:23+00:00,RT @SadhguruJV: This world has witnessed many epidemics. Let’s create a new one – an Epidemic of #Meditation. Cultivating the quality of me…,q7K7oGmbVx37JfS,"Tirukkoyilur, India",இயற்கையை நேசிப்பவன்.,9,1,1975,False,This world has witnessed many epidemics. Let’s create a new one – an Epidemic of #Meditation. Cultivating the quality of meditativeness will bring clarity of vision &amp; unleash the limitless human potential. -Sg #WEF2020 @wef @Davos https://t.co/N814xDi8ls
2020-01-24 03:27:56+00:00,How come the WORLD BODY UNO is silent on this epidemic which is threatening to go out of control? Is the UNO afraid of CHINA?? - https://t.co/Bs7GmRMv0V,vajapeyam,India,"When will Indians in general get out of ""DYNASTY POLITICS SYNDROME"",if at all they can? 😡😔😕😬",3226,4309,269015,False,No Value Mentioned
2020-01-24 03:28:23+00:00,RT @SadhguruJV: This world has witnessed many epidemics. Let’s create a new one – an Epidemic of #Meditation. Cultivating the quality of me…,RaviiRaghu,"Coimbatore, India",..,1205,1452,9708,False,This world has witnessed many epidemics. Let’s create a new one – an Epidemic of #Meditation. Cultivating the quality of meditativeness will bring clarity of vision &amp; unleash the limitless human potential. -Sg #WEF2020 @wef @Davos https://t.co/N814xDi8ls
2020-01-24 03:28:46+00:00,"RT @rameshlaus: Due to the #Coronovirus epidemic in #China , #China has cancelled all the release plans of local movies for the #ChineseNew…",ThalapathyMoviz,"Mysore, India",Always at the Movies. Even when I'm at work...!!,51,906,35913,False,"Due to the #Coronovirus epidemic in #China , #China has cancelled all the release plans of local movies for the #ChineseNewYear weekend..

A huge loss to the Global Box office in 2020.."
2020-01-24 03:29:20+00:00,"RT @AnantBhan: What can help us reduce the Caesarian epidemic?
Non-clinical interventions to reduce unnecessary caesarean sections: @WHO re…",KPrafful05,"Pune, India","Keen on health finance/economics and pharmaceutical industry issues /
Tweets on healthcare sector/ #Tissian /#Doctor + #MPH/",630,2394,4172,False,"What can help us reduce the Caesarian epidemic?
Non-clinical interventions to reduce unnecessary caesarean sections: @WHO recommendations
#MNCH #womenshealth 
https://t.co/n2iKpOK1xR https://t.co/c5YKoAm29u"
