created_at,full_text,screen_name,location,description,followers_count,friends_count,statuses_count,verified,full_retweet_text
2020-04-04 14:22:11+00:00,"RT @kakar_harsha: This is the relationship dubbed as higher than the mountains, deeper than the seas, all weather, all encompassing. Wonder…",uaprabhu,"Shimoga, India","Social activists and nationalist, RT is not endorsement,Promise to follow back instantly",792,3686,41495,False,"This is the relationship dubbed as higher than the mountains, deeper than the seas, all weather, all encompassing. Wonder if @ImranKhanPTI or @SMQureshiPTI or @OfficialDGISPR will comment. They can only do so once China sanctions or if Kashmir is not in their dreams https://t.co/RLjZA1bITs"
2020-04-04 14:22:12+00:00,"@khanumarfa @RanaAyyub 
Your take pls https://t.co/EEH6VrN1Rz",Vishal_DCP,"Ranchi, India","Tweets/Views are personal, not  official/of Deptt/of Govt. as per CCS Conduct rule 8 (3) of CCS (Conduct) rules 1964",79,586,2912,False,No Value Mentioned
2020-04-04 14:22:13+00:00,We are are facing a trouble here please solve this hope after seeing image you will see complete video no one taking this corona virus threat seriously even administration .@ArvindKejriwal sir please save us.  https://t.co/h5brRIVzcg https://t.co/emgRgoC7L1 https://t.co/yB2FSV0RLd,Shayeeque1,"New Delhi, India",No Value Mentioned,1,17,51,False,No Value Mentioned
2020-04-04 14:22:13+00:00,"RT @SWATANTRANAVEN1: #टीवी_देखना_बंद_करो #टीवी_देखना_बंद_करो #टीवी_देखना_बंद_करो #टीवी_देखना_बंद_करो #टीवी_देखना_बंद_करो
these are more dan…",ram_jai_jai_ram,India,"Real name is Sanath Shetty.proud hindu always.🚩🚩🚩🚩🇮🇳🇮🇳🇮🇳🇮🇳🇮🇳🙏🙏🙏🙏😊😊
But i dont need hindutva to protect my religion.",8,167,1158,False,"#टीवी_देखना_बंद_करो #टीवी_देखना_बंद_करो #टीवी_देखना_बंद_करो #टीवी_देखना_बंद_करो #टीवी_देखना_बंद_करो
these are more dangerous than covid-19 https://t.co/wcGVnD1ETI"
2020-04-04 14:22:13+00:00,"RT @ImranKhanPTI: We have locked down educational institutions, Malls, marriage halls, restaurants &amp; other places where public congregates.…",tiwariabhi14,"Mumbai, India",vasudhave kutumbkam means the world is our family,57,187,6237,False,"We have locked down educational institutions, Malls, marriage halls, restaurants &amp; other places where public congregates. But, to stop the devastation of the lockdown we have kept our agri sector open &amp; now we are opening up our construction sector."
2020-04-04 14:22:13+00:00,"RT @ZoramthangaCM: This tiny bundle contains Rs. 333/- in cash and coins; 
7-year-old Rommel Lalmuansanga from Kolasib Venglai donated his…",francis_clobo,"Malda, (West Bengal) India","Security Commissioner,  Railway Protection Force | BE | MPA | Student always | Views Personal|",325,21,924,False,"This tiny bundle contains Rs. 333/- in cash and coins; 
7-year-old Rommel Lalmuansanga from Kolasib Venglai donated his entire savings to his Village Level Task Forces in this war against the dreaded Covid-19 pandemic
May the good Lord bless you abundantly
You are a Hero!
#Hero https://t.co/YfGbG9CHDI"
2020-04-04 14:22:14+00:00,"RT @narendramodi: Had an extensive telephone conversation with President @realDonaldTrump. We had a good discussion, and agreed to deploy t…",NithyaAndham,"Vellore, India",No Value Mentioned,23,536,311,False,"Had an extensive telephone conversation with President @realDonaldTrump. We had a good discussion, and agreed to deploy the full strength of the India-US partnership to fight COVID-19."
2020-04-04 14:22:16+00:00,Another one... https://t.co/0oHPUQtzOF,slaterjoe,Indiana,"Christ follower, husband to an awesome woman and father to 3 amazing young men, HS track and xc coach, Non-profit Executive",133,347,1865,False,No Value Mentioned
2020-04-04 14:22:16+00:00,"RT @iwelsh: I know I use the word evil more than most people are comfortable with, but Neera is evil. Sorry. Just... evil. It's a word that…",Abhijit_A_,India,"Mapped tools, techniques for ecological industrial transition. Ideology is luxury not afforded. Leverage tech, focus brute force change. Adjacent possible ways.",1219,876,29635,False,"I know I use the word evil more than most people are comfortable with, but Neera is evil. Sorry. Just... evil. It's a word that exists to be used for the appropriate people. https://t.co/JUAKBGUWqJ"
2020-04-04 14:22:17+00:00,RT @HFWOdisha: Latest update on #COVID19 has been provided below. Till now 1395 samples have been tested &amp; 20 cases have been tested positi…,AdmBhadrak,"Bhadrak, India",Government and Public Utilities,4455,58,1605,False,"Latest update on #COVID19 has been provided below. Till now 1395 samples have been tested &amp; 20 cases have been tested positive. For any health assistance, call 104 Health Helpline. #coronavirus #OdishaFightsCorona https://t.co/Hj0381DHT9"
2020-04-04 14:22:17+00:00,"RT @narendramodi: Had an extensive telephone conversation with President @realDonaldTrump. We had a good discussion, and agreed to deploy t…",PankajIcloud,"Delhi, India",Bachelors IN Political Science @ University of Delhi,13,112,444,False,"Had an extensive telephone conversation with President @realDonaldTrump. We had a good discussion, and agreed to deploy the full strength of the India-US partnership to fight COVID-19."
2020-04-04 14:22:19+00:00,"@raftaarmusic Hello bhai,
An effort by us people of J&amp;k to aware everyone about Corona Pandemic.
Kindly check ""Saare bolo cheese"".
#IndiaFightsCorona 
https://t.co/CjanXZqYAR",officialparryg,"Mumbai, India",Join : https://t.co/B7ZbyYgF3i,237,52,1239,False,No Value Mentioned
2020-04-04 14:22:19+00:00,Coronavirus: Spain’s daily death toll falls for second day in a row #Coronavirus https://t.co/LDdnlhx2AN,ravinan30310294,India,Optimization the only aim . so like only if it is at least good. Tweets are mostly self created not aimed to harm anyone. RT doesn't mean endorsement.,1074,321,50488,False,No Value Mentioned
2020-04-04 14:22:20+00:00,"RT @himantabiswa: While there was a discussion on possible deductions, we've decide to release full salary of Assam Govt employees for Marc…",farzibanda,India.,22/7,149,470,49466,False,"While there was a discussion on possible deductions, we've decide to release full salary of Assam Govt employees for March. However, my humble request that in view of the lockdown, each one of you take care of at least 5 needy families. That will be best #Bihu gift you can give."
2020-04-04 14:22:20+00:00,RT @Joydas: Fruits and vegetables stocked for Lockdown https://t.co/ZgBajnAvme,DsFarooqshaikh,"Thane, India",Civil Engineer and proprietor of Mistry enterprises,297,962,40918,False,Fruits and vegetables stocked for Lockdown https://t.co/ZgBajnAvme
2020-04-04 14:22:21+00:00,RT @itisprashanth: Charge her for 100 test kits .,Mohamed48798582,"Bengaluru, India",Engineer ...,86,1291,21325,False,Charge her for 100 test kits . https://t.co/2abgbSBx5A
2020-04-04 14:22:23+00:00,"RT @RahulGandhi: India is simply not testing enough to fight the #Covid19 virus. 

Making people clap &amp; shining torches in the sky isn't go…",MEETHAL96360489,"Jaipur, India","इंसानियत से बड़ा कोई धर्म नहीं, देश से बड़ा कोई मजहब नहीं ......( जय जवान जय किसान)",352,274,6131,False,"India is simply not testing enough to fight the #Covid19 virus. 

Making people clap &amp; shining torches in the sky isn't going to solve the problem. https://t.co/yMlYbiixxW"
2020-04-04 14:22:26+00:00,"RT @narendramodi: Had an extensive telephone conversation with President @realDonaldTrump. We had a good discussion, and agreed to deploy t…",VJ_Naidu040,Hyderbad India ,"Global FMCG strategist. international business expertise,passion for sports. Market insights into fifty plus countries.RT’s are not endorsements. love Dubai",1432,4617,11049,False,"Had an extensive telephone conversation with President @realDonaldTrump. We had a good discussion, and agreed to deploy the full strength of the India-US partnership to fight COVID-19."
2020-04-04 14:22:26+00:00,"RT @himantabiswa: In fight against COVID-19,Doctors and Nurses are our main backbone.After their duties for 7days,they are to b mandatorily…",rsarkar272,"Lumding,Hojai,  Assam,India","A proud INDIAN🇮🇳🙏,A Teacher📝🖋,A Singer🎤🎼🎧,A Guitarist🎸.",145,990,4492,False,"In fight against COVID-19,Doctors and Nurses are our main backbone.After their duties for 7days,they are to b mandatorily put in quarantine for 14days.We have made arrangements in Taj Vivanta,Guwahati for their comfortable stay.Similar arrangements have been made for other places"
2020-04-04 14:22:27+00:00,"RT @narendramodi177: WHO Praises PM @NarendraModi's Efforts &amp; Initiatives To Contain Coronavirus Says That India Can Do It, Must Watch #Mod…",singhanubhav15,"Ayodhya, India",Jai Shri Ram.,89,277,937,False,"WHO Praises PM @NarendraModi's Efforts &amp; Initiatives To Contain Coronavirus Says That India Can Do It, Must Watch #ModiTheWorldLeader
https://t.co/mMImIp64W7"
2020-04-04 14:22:29+00:00,Peeps: please #STAYHOME! (I know everyone doesn't have that luxury - but for the rest of us...) https://t.co/fUARHR9Sa7,ErinLAlbert,"Indianapolis, IN","💊#Pharmacy & #PBM consultant for @apexbenefits, excuse me while I fight 4 #SanditonSeason2, podcaster #TheEdutainer. Opinions are mine; RT ≠ E.",3793,3549,27926,False,No Value Mentioned
2020-04-04 14:22:30+00:00,Making the best of our #wedding @TheDASguy #ourcoronawedding #coronavirus #COVID2019 #CoronavirusPandemic https://t.co/OXcgqoyucw,RaleighMalik,"Indianapolis, IN",Scientist; self-proclaimed nerd; ENTJ; triathlete; fast-talker; @BucknellU Alum; @IUMedResearch Alum; opinions/views are my own,1332,4872,2092,False,No Value Mentioned
2020-04-04 14:22:30+00:00,"@dmgbnagar Dear Sir, We have power cuts whole day,Whtevr info I get,it is due to degrade material used either by contractor or respective officer. In this lockdown and specially NOIDA where 24 hour power is mndtry it become very difficult for residents. Pls do the needful sec 93",Ashisht2802,"New Delhi, India",Motivational Speaker|Indian|Entrepreneur|Strategist|Standup Artist|,53,120,93,False,No Value Mentioned
2020-04-04 14:22:30+00:00,"RT @JainSiddharth_: To support @narendramodi Ji’s efforts to beat #COVID19

INOX Group commits INR 5 Cr towards various relief measures:

I…",VijaySh19798203,"Indore, India",Hard Work,3,12,63,False,"To support @narendramodi Ji’s efforts to beat #COVID19

INOX Group commits INR 5 Cr towards various relief measures:

INR 2 Cr to #PMCARES 
INR 2 Cr to State, Armed Forces, Police &amp; Local Authorities
INR 1 Cr for PPE and Meals for stranded workers

#JaiHind 🇮🇳
#IndiaFightsCorona https://t.co/Yo5OvjGdUm"
2020-04-04 14:22:30+00:00,"RT @ArvindKejriwal: Along with experts, Manish ji and I will be interacting live with parents and children of Delhi

Children have so many…",drbdkhanalbi,"Agra, India","प्रदेश सचिव अल्पसंख्यक प्रकोष्ठ आप उत्तर प्रदेश,
अध्यक्ष सर्व समाज शिक्षा स्वस्थ सुधार सेबा समिति (गैर राजनैतिक संगठन)/",405,625,23428,False,"Along with experts, Manish ji and I will be interacting live with parents and children of Delhi

Children have so many questions about Corona. How should parents address them? Join us at 3 pm today for a session on #ParentingInLockdown https://t.co/SbYaGosw2k"
2020-04-04 14:22:31+00:00,"RT @INCIndia: From launching helpline numbers and providing food, our party has been at the forefront of this battle against the effects of…",peoplesvoice_s,"New Delhi, India","ప్రజలపక్షాన ,ప్రజల  కష్టాలను, నష్టలను, వారిని ఆ బాధల నుండి విముక్తి చేయడానికె ఈ వేదిక...People's Voice",73,272,3617,False,"From launching helpline numbers and providing food, our party has been at the forefront of this battle against the effects of Coronvirus pandemic on the vulnerable sections.

#कांग्रेस_के_सिपाही https://t.co/ycN5YlA1LV"
2020-04-04 14:22:31+00:00,"He will talk about food for lakhs of hungry people.
He will thank all the people who have helped the govt by donating some ammount.
He will talk about the new test centres that are about to open.
He will talk about the ways how state and central govt is fighting against covid19. https://t.co/XYhgMAk4tC",achaudharipatil,India,No Value Mentioned,85,333,6154,False,No Value Mentioned
2020-04-04 14:22:31+00:00,"RT @ZeeNewsEnglish: India's COVID-19 cases rise to 3,072 with 75 deaths

Tap for live updates

https://t.co/quGevJgQHX",rj_foryou,India,"PROUD BRAMHAN 💪
YE ❤ MANGE MORE AAHA !
CREATIVE #Contest Player
GADGET IS MY FIRST LOVE 😍
YOUTUBER !
UNSUCCESSFUL LIFE",2754,1772,169806,False,"India's COVID-19 cases rise to 3,072 with 75 deaths

Tap for live updates

https://t.co/quGevJgQHX"
2020-04-04 14:22:32+00:00,"RT @narendramodi: Had an extensive telephone conversation with President @realDonaldTrump. We had a good discussion, and agreed to deploy t…",sreekanth2323,"Kadapa, India",Indian.I Care for Our Mother Land,197,1096,51047,False,"Had an extensive telephone conversation with President @realDonaldTrump. We had a good discussion, and agreed to deploy the full strength of the India-US partnership to fight COVID-19."
2020-04-04 14:22:32+00:00,"RT @AartiTikoo: The most famous Indian fangirl of the Chinese Communisty Party, bashes US &amp; India over #WuhanCoronaVirus in her latest rant…",raj_shiva77,"Patna, India","student of graduation from anurag narayan college(patna), i always run my goals and my dreams..",138,69,15527,False,"The most famous Indian fangirl of the Chinese Communisty Party, bashes US &amp; India over #WuhanCoronaVirus in her latest rant in foreign press. Not a word against People’s Liberation Army. President Xi Jinping should now make her his official spokesperson. She is doing a great job."
2020-04-04 14:22:33+00:00,"RT @Spotboye: Sweet Gesture ❤️

@sidharth_shukla wished a fan from Pakistan a speedy recovery after he learnt about her contracting COVID-1…",vaishalipande15,"Allahabad, India","Lil classy, more sassy🔥❤
#NatureLover #LoveDancing #LovePoetry #foodie #23yearsofMine😎😜
Biggest fan of Katrina Kaif❤ and Prabhas😍 and Johnny Depp♥️♥️",300,440,17822,False,"Sweet Gesture ❤️

@sidharth_shukla wished a fan from Pakistan a speedy recovery after he learnt about her contracting COVID-19!

#SidharthShukla | #BiggBoss13 | #Coronavirus | #Covid19 | #BhulaDunga | @Siddians 

https://t.co/eF1TfATrAi"
2020-04-04 14:22:33+00:00,"RT @TarekFatah: China screws Pakistan!

Pakistani media is complaining that masks supplied by China are made out of female undergarments (b…",Vinod1228,India,"🇮🇳Nationalist | Blogger | Supporter - RSS & BJP🇮🇳
⛳⛳हर हर महादेव⛳⛳
अकाल मृत्यु वो मरे जो कार्य करे चंडाल का। 
काल उसका क्या करे जो भक्त हो महाकाल का।।",175,94,1433,False,"China screws Pakistan!

Pakistani media is complaining that masks supplied by China are made out of female undergarments (bras) instead of the #N95 masks which Pakistan had ordered to fight #coronavirus. 

 https://t.co/4UcdY8HgAA"
2020-04-04 14:22:33+00:00,"RT @narendramodi: Had an extensive telephone conversation with President @realDonaldTrump. We had a good discussion, and agreed to deploy t…",ShivamPatelJat7,"Indore, India",Carpediem!!,386,540,19707,False,"Had an extensive telephone conversation with President @realDonaldTrump. We had a good discussion, and agreed to deploy the full strength of the India-US partnership to fight COVID-19."
2020-04-04 14:22:34+00:00,RT @narendramodi: India is united in defeating COVID-19. This unity will be manifested tomorrow evening. #IndiaFightsCorona,AnIndividual2,India ,No Value Mentioned,175,264,20106,False,India is united in defeating COVID-19. This unity will be manifested tomorrow evening. #IndiaFightsCorona https://t.co/RfjzTZldou
2020-04-04 14:22:34+00:00,RT @rwac48: Indians are fighting against coronavirus and BJP IT cell is fighting against Indians https://t.co/N4vBXSgYCM,NitinSingh1031,India,"Ek Aam Hindustani, Banker by profession, Human by Choice, Jabra fan of Shahrukh...My views are mine only...believe in Jiyo aur Jeene Do...",117,948,1167,False,Indians are fighting against coronavirus and BJP IT cell is fighting against Indians https://t.co/N4vBXSgYCM
2020-04-04 14:22:34+00:00,"RT @narendramodi: Had an extensive telephone conversation with President @realDonaldTrump. We had a good discussion, and agreed to deploy t…",RG83T4TWT,"Ahmadabad City, India",No Value Mentioned,91,25,25753,False,"Had an extensive telephone conversation with President @realDonaldTrump. We had a good discussion, and agreed to deploy the full strength of the India-US partnership to fight COVID-19."
2020-04-04 14:22:35+00:00,RT @ShehnazGilll123: Together we can fight #COVID19 please guys stay home and stay safe. It’s very important not only for yourself but also…,hemangi_sutar,"Mumbai, India",I am IPS officer,179,167,51388,False,Together we can fight #COVID19 please guys stay home and stay safe. It’s very important not only for yourself but also for your loved ones.
2020-04-04 14:22:35+00:00,"RT @narendramodi: Had an extensive telephone conversation with President @realDonaldTrump. We had a good discussion, and agreed to deploy t…",rsarkar272,"Lumding,Hojai,  Assam,India","A proud INDIAN🇮🇳🙏,A Teacher📝🖋,A Singer🎤🎼🎧,A Guitarist🎸.",145,990,4492,False,"Had an extensive telephone conversation with President @realDonaldTrump. We had a good discussion, and agreed to deploy the full strength of the India-US partnership to fight COVID-19."
2020-04-04 14:22:36+00:00,"RT @RahulGandhi: India is simply not testing enough to fight the #Covid19 virus. 

Making people clap &amp; shining torches in the sky isn't go…",VartiaPal,"Fatehabad, India","State Secretary, Haryana pardesh congress committee",402,88,1568,False,"India is simply not testing enough to fight the #Covid19 virus. 

Making people clap &amp; shining torches in the sky isn't going to solve the problem. https://t.co/yMlYbiixxW"
2020-04-04 14:22:37+00:00,RT @MamtaDa04223531: @We were foolish as we were understanding ourselves to be superior than God but now a pandemic disease has shown us ou…,Sonu24121141,"Sonipat, India",Must Read Anmol Life Changing Book (Gyan Ganga) . 100% follow 🔙.,280,0,19454,False,"@We were foolish as we were understanding ourselves to be superior than God but now a pandemic disease has shown us our capability.
Only Saint Rampal Ji Maharaj can cure this.
Must watch sadhna TV at 7:30pm.
#GodMorningSaturday https://t.co/8CvaspVP96"
2020-04-04 14:22:37+00:00,"Now the situation in which USA is very worse than India, still we have the hope to defeat COVID-19.
#IndiaFightsCorona 
#StayHomeStaySafe https://t.co/9ULN0Ky3zh",BhagyadharPra17,"Chennai, India","#ଗାଁ ପୁଅ ଚେନ୍ନଇ ରେ ରହୁଚି,  ସହରିଆ ହାବ ଭାବ ଶିଖୁଚି 😀",29,182,87,False,No Value Mentioned
2020-04-04 14:22:38+00:00,"RT @MittalResham: Press release as DNO North Goa addressing about Free #LPG Refill to PMUY customers for 3 months, Ex- Gratia amount of Rs.…",iammohitdhawan,"Mumbai, India","B. Tech (Civil Engg) IIT-BHU & EMBA - SPJIMR-Mumbai, General Manager LPG Sales, HPCL-Mumbai. Views personal",1703,554,2605,False,"Press release as DNO North Goa addressing about Free #LPG Refill to PMUY customers for 3 months, Ex- Gratia amount of Rs. 5 lac Insurance of OMC #LPGWarriors and uninterrupted supply during Lockdown @HPCL @lenpale @iammohitdhawan @anujjain1906 @Rg03Goel @d_bashis https://t.co/tWdpyy7Xwz"
2020-04-04 14:22:39+00:00,"RT @WHOWPRO: We all need to fight #COVID19.
Anyone can get infected and spread the disease to others.
Some young, healthy people have becom…",Gargkeshav90,"Hyderabad, India",#freemind#freelife,77,263,116,False,"We all need to fight #COVID19.
Anyone can get infected and spread the disease to others.
Some young, healthy people have become seriously sick, and some have even died.

Low risk isn't no risk. https://t.co/585OnotaMS"
2020-04-04 14:22:40+00:00,@Sanjana__55 Stay home baba! ❤ and sm is shit or we are making it so anyway,desiipotato,Assam/ India ,ᴵᵗ'ˢ ᵃˡʷᵃʸˢ ᵃᵇᵒᵘᵗ ᵗʰᵉ ˢᵗᵃʳˢ ᵃⁿᵈ ᵗʰᵉ ᵐᵒᵒⁿ,6866,812,89815,False,No Value Mentioned
2020-04-04 14:22:41+00:00,RT @ETimesTV: Bigg Boss 13 winner Sidharth Shukla sends prayer for a Pakistani fan who tested positive for coronavirus; Netizens hail him a…,deepakk18432436,"New Delhi, India",No Value Mentioned,677,764,24026,False,Bigg Boss 13 winner Sidharth Shukla sends prayer for a Pakistani fan who tested positive for coronavirus; Netizens hail him as 'the real hero' https://t.co/1s6CHm6tmS
2020-04-04 14:22:42+00:00,"RT @narendramodi: Had an extensive telephone conversation with President @realDonaldTrump. We had a good discussion, and agreed to deploy t…",saurabhsri114,"Lucknow, India","I am just a mirror for you. You are good, I am best💯
You are bad, I am the worst.✌",349,114,18720,False,"Had an extensive telephone conversation with President @realDonaldTrump. We had a good discussion, and agreed to deploy the full strength of the India-US partnership to fight COVID-19."
2020-04-04 14:22:42+00:00,"RT @ggreenwald: This happened literally on the same day the head of the Democratic Party’s all-but-official think tank, @neeratanden, spent…",Jamin37045676,"Indiana, USA",Wants Dario Hunter to be the Green nominee.,208,882,2364,False,"This happened literally on the same day the head of the Democratic Party’s all-but-official think tank, @neeratanden, spent all day on Twitter viciously attacking anyone who advocates Medicare for All.

The Democratic establishment is rotted &amp; a supreme impediment to progress. https://t.co/h1cJJTZHnt"
2020-04-04 14:22:44+00:00,RT @Javedakhtarjadu: Maharashtra Govt under leadership of CM Uddhav Thackray needs to be congratulated for handling the Covid 19 with clear…,Er_Naeem_SrK,"Gorakhpur, India","Jabra fan of @iamsrk ❣️❣️
#KinG_KhaN😘",141,310,1630,False,Maharashtra Govt under leadership of CM Uddhav Thackray needs to be congratulated for handling the Covid 19 with clear directives. My salute .
2020-04-04 14:22:44+00:00,RT @Leopard212: In other news: The Pentagon has issued strict advisory against the use and proliferation of TikTok by American Service Pers…,Kannan506,India,Read Captain Ajit Vadakayil blogs,412,698,53502,False,"In other news: The Pentagon has issued strict advisory against the use and proliferation of TikTok by American Service Personnel and Troops.

Oh, TikTok was banned in India, briefly, by the Madras High Court.
Revoked after the Communist Dictatorship called China paid Huge bucks https://t.co/wllMBbrSvr"
2020-04-04 14:22:45+00:00,RT @Javedakhtarjadu: Maharashtra Govt under leadership of CM Uddhav Thackray needs to be congratulated for handling the Covid 19 with clear…,sameer_merchant,India,youth,38,297,954,False,Maharashtra Govt under leadership of CM Uddhav Thackray needs to be congratulated for handling the Covid 19 with clear directives. My salute .
2020-04-04 14:22:45+00:00,"RT @TheOliveKnife: Post Corona for me...

Social Distancing a must for a year atleast

Secular Distancing, a Lifestyle change for me for re…",DrGPradhanFC,"US, India, RSA ","Fan acc, A drop in the ocean of 1.25B Indians, I am what my followers made me @Comments w/o Prejudice in National Interest. Founder @DPFLive & Ex CIO Timetunnel",10618,4,5398,False,"Post Corona for me...

Social Distancing a must for a year atleast

Secular Distancing, a Lifestyle change for me for rest of my life"
2020-04-04 14:22:45+00:00,RT @sowmyamani10: 17 people from #trichy who travelled to the #NizamuddinMarkaz test positive for #Corona. 1 man from Perambalur also tests…,xpresstn,"Chennai, India",Follow us for all Tamil Nadu related news and stories. Official account of @NewIndianXpress for Tamil Nadu bureau.,5789,141,12053,True,17 people from #trichy who travelled to the #NizamuddinMarkaz test positive for #Corona. 1 man from Perambalur also tests positive. Total positive cases in MGMGH Tiruchy is now 19. #coronaupdatesindia @xpresstn
2020-04-04 14:22:46+00:00,RT @Queen_of_boon: Thanks for sharing ji...👍🏻🙏🏻,HiteshGngr18,India,🏊🏊People like you makes people like me like people like you.🏊🏊,699,677,140630,False,Thanks for sharing ji...👍🏻🙏🏻 https://t.co/Bnvlz9jYB7
2020-04-04 14:22:46+00:00,RT @noconversion: Not a SINGLE christian PASTOR has gone to any hospital to do MIRACLE Cure ...#Coronavirus has   exposed #Christian  FRAUD,vinod_sevak,"Bengaluru, India",|| Dharmo Rakshati Rakshitaha ||,502,427,17200,False,Not a SINGLE christian PASTOR has gone to any hospital to do MIRACLE Cure ...#Coronavirus has   exposed #Christian  FRAUD
