created_at,full_text,screen_name,location,description,followers_count,friends_count,statuses_count,verified,full_retweet_text
2020-04-03 07:42:18+00:00,RT @JoyAnnReid: I didn't see it so let me just get this straight: Jared Kushner -- who has exactly about as many qualifications for dealing…,Heavenlyfran,"Indianapolis, IN","small business owner of HeavenlyTyes.  specializing in custom totes. Avid Reader, seamstress,",259,540,26590,False,I didn't see it so let me just get this straight: Jared Kushner -- who has exactly about as many qualifications for dealing with a pandemic as he did for concocting Mideast peace -- was on hand to brief the American people about the #COVID19Pandemic but Dr. Fauci wasn't? Ok then. https://t.co/I94u3dYCAB
2020-04-03 07:42:18+00:00,"@BJP4India @narendramodi Outrage of @realDonaldTrump #ChineseVirus19 
https://t.co/2ihGrDCURJ",apslodhi03,"Guna, India",https://t.co/IQyJLmK5Fx,3,93,129,False,No Value Mentioned
2020-04-03 07:42:19+00:00,"RT @ShashiTharoor: Listened to the Pradhan Showman. Nothing about how to ease people’s pain, their burdens, their financial anxieties. No v…",shekhar_mrigank,"Patna, India","learner, entrepreneur, works as Director of Square One Associates a real estate firm.",97,258,5648,False,"Listened to the Pradhan Showman. Nothing about how to ease people’s pain, their burdens, their financial anxieties. No vision of the future or sharing the issues he is weighing in deciding about the post-lockdown. Just a feel-good moment curated by India’s Photo-Op PrimeMinister!"
2020-04-03 07:42:19+00:00,"RT @ShashiTharoor: This is no accident: the PM spoke on Ram Navami at 9 am for 9 mins, asked us to light diyas &amp; candles on 5/4 at 9 pm for…",farirf07,"Bharuch, India","LOVE TO BE IDENTIFIED AS INDIAN. Engineer, trying to learn INVESTMENT MANTRAS from MARKET GURUS",154,607,3178,False,"This is no accident: the PM spoke on Ram Navami at 9 am for 9 mins, asked us to light diyas &amp; candles on 5/4 at 9 pm for 9 mins. He is invoking all the auspicious elements Hinduism associates with number 9. Back to Ram Bharose?! #COVID19 must be more serious than we thought!"
2020-04-03 07:42:20+00:00,RT @TheJaggi: Only those who don't know India will think Ramayan has no appeal and especially during a lockdown when they also have the tim…,skm2506,"Gurgaon, India","AI Professional, Country first, Salute Indian force, working towards making our country 21st century super power and world Guru.
All RT&Tweets are my personal.",77,571,10848,False,Only those who don't know India will think Ramayan has no appeal and especially during a lockdown when they also have the time to watch it. https://t.co/HBJkHM6HPV
2020-04-03 07:42:21+00:00,"RT @ANI: #WATCH PM Modi: I request all of you to switch off all the lights of your house on 5th April at 9 PM for 9 minutes, and just light…",munesh2515,"Agra, India","'Humanity' is the ceiling of four walls ( religions ), don't follow back if u think I m  wrong.",5,26,43,False,"#WATCH PM Modi: I request all of you to switch off all the lights of your house on 5th April at 9 PM for 9 minutes, and just light a candle, 'diya', or mobile's flashlight, to mark our fight against #coronavirus https://t.co/wpNiEJurBm"
2020-04-03 07:42:22+00:00,"RT @ShashiTharoor: This is no accident: the PM spoke on Ram Navami at 9 am for 9 mins, asked us to light diyas &amp; candles on 5/4 at 9 pm for…",KalimullahGazi,"Kolkata, India",An IT Professional..Like INC ideologies. #WithCongress always.,94,433,13638,False,"This is no accident: the PM spoke on Ram Navami at 9 am for 9 mins, asked us to light diyas &amp; candles on 5/4 at 9 pm for 9 mins. He is invoking all the auspicious elements Hinduism associates with number 9. Back to Ram Bharose?! #COVID19 must be more serious than we thought!"
2020-04-03 07:42:23+00:00,"RT @VinayDokania: Has NASA announced on Whatsapp how switching off lights &amp; lighting candles,diyas will generate cosmic energy to create a…",jainanil1968,"Indiana, USA",Maine kiya,2243,1919,530182,False,"Has NASA announced on Whatsapp how switching off lights &amp; lighting candles,diyas will generate cosmic energy to create a kinetic wavelength and a spectrum of Bipolar molecular rays resulting in formation of a complex current in the air to demolish the #Covid19

#ModiVideoMessage"
2020-04-03 07:42:23+00:00,"@shantanu0308 @VodafoneIN https://t.co/2UXwul9tiy
This was the complaint.",Abhi_journo,"Varanasi, India","ख़बरनवीस
Tweets & Thoughts are personal.",1084,1434,5028,False,No Value Mentioned
2020-04-03 07:42:24+00:00,RT @TeamMissMalini: Stay safe from the fake news! ✌🏻 #COVIDー19 #StayHomeSaveLives https://t.co/BpEdqV4ulO,Preety12207497,Indian,huge fan of shehnaaz Gill 💕,53,137,29367,False,Stay safe from the fake news! ✌🏻 #COVIDー19 #StayHomeSaveLives https://t.co/BpEdqV4ulO
2020-04-03 07:42:24+00:00,It was a great support and strength to all the people 🙏 Thanks for the tips Ma'am  👍 https://t.co/b9PUl9AFst,Janakir04120667,"Hyderabad, India","This is where i can have enough privacy
#Hitman fan",37,257,472,False,No Value Mentioned
2020-04-03 07:42:24+00:00,"RT @RatanSharda55: Thanks @Aabhas24 for converting the thread into an article. 
How WHO and its Chief compromised war against Chinese Virus…",BPROUDINDIAN,"New Delhi, India","परम वैभवंनेतमेतत् स्वराष्ट्रम्
          समर्था भवत्वाषिसाते भृषम्
PROUD -INDIAN, PROUD- HINDU",1396,3529,49671,False,"Thanks @Aabhas24 for converting the thread into an article. 
How WHO and its Chief compromised war against Chinese Virus which has left more than 28,000 dead: https://t.co/eZTXDqGOSU via @eOrganiser"
2020-04-03 07:42:24+00:00,How COVID-19 Will Hit India | The New Yorker https://t.co/IzOB3N5RTK,rakeshbjuneja,"Mumbai, India","C.E.O, Optimystix Entertainment India Pvt Ltd. #EpicIQChallenge #CrimePatrolSatark #TeraKyaHogaAlia #BaalVeerReturns #RisingStar3 #LadiesSpecial #ComedyCircus",4005,232,8793,False,No Value Mentioned
2020-04-03 07:42:24+00:00,RT @Pun_Starr: Waiting for a 'scientific' explanation from IT cell on how lighting candles at 9 pm on 5th April is a masterstroke that will…,Prashu377,"Bengaluru, India",No Value Mentioned,19,91,402,False,Waiting for a 'scientific' explanation from IT cell on how lighting candles at 9 pm on 5th April is a masterstroke that will rid us of Coronavirus.
2020-04-03 07:42:25+00:00,RT @Bhuvan_Bam: Ek jagah ikatthe na ho. Please. Maintain social distancing.,abheeshek14,"New Delhi, India",No Value Mentioned,216,111,16698,False,Ek jagah ikatthe na ho. Please. Maintain social distancing.
2020-04-03 07:42:25+00:00,"RT @rahul_jk: Did you know ? When all lights from a candle is focused at 32 degree angle at 9pm for 9 mins , it causes coronavirus to ask i…",sumapsen,"Cochin, India",No Value Mentioned,1374,4947,31225,False,"Did you know ? When all lights from a candle is focused at 32 degree angle at 9pm for 9 mins , it causes coronavirus to ask itself ""main iss lodu desh mein kya kar raha hoon Bhenchod and self immolate""."
2020-04-03 07:42:27+00:00,"RT @dongtent: cannes is creating a separate coronavirus category for 2020.

the Covid Lions recognize those in the ad industry being respon…",luvkalla,"Mumbai, India","writing, reading, faffing, ranting, filming",72,1216,1676,False,"cannes is creating a separate coronavirus category for 2020.

the Covid Lions recognize those in the ad industry being responsible citizens. with all the privileges we are afforded, it’s the least we can do.

first up, the “i convinced client NOT to separate their logo!” lion: https://t.co/wCzz8okuj7"
2020-04-03 07:42:29+00:00,"RT @davidfrawleyved: While India unites to fight the coronavirus, anti-India forces seek to weaponize the virus and use it to divide the co…",PankajJ09218952,"Mumbai, India",No Value Mentioned,94,80,11180,False,"While India unites to fight the coronavirus, anti-India forces seek to weaponize the virus and use it to divide the country. But if the virus wins, nobody wins. What kind of people would regard a pandemic virus as an ally?"
2020-04-03 07:42:30+00:00,Stop Peeping into Kingfisher Calendars... https://t.co/etpiVxcR0a,Gaonka6hhora,India,देश और विदेश में सरकार बनाने के लिए यहाँ संपर्क करे।,439,101,124820,False,No Value Mentioned
2020-04-03 07:42:31+00:00,"RT @ARanganathan72: Dr Zakiya Sayed. An inspiration in these troubled times.

The difference between the great and the ordinary is simply t…",vikasthakur12,India,Indian RT not endorsement,641,2239,41771,False,"Dr Zakiya Sayed. An inspiration in these troubled times.

The difference between the great and the ordinary is simply this: that the great think they are ordinary and the ordinary think they are great. https://t.co/VSE5XbCL8Q"
2020-04-03 07:42:31+00:00,"RT @amitmalviya: #9Baje9Minute

5Apr, 9 minutes at 9pm!

Prime Minister urges 130 crore Indians to light a lamp, diya, torch or even phone…",patelklk,"Bengaluru, India",No Value Mentioned,14,215,702,False,"#9Baje9Minute

5Apr, 9 minutes at 9pm!

Prime Minister urges 130 crore Indians to light a lamp, diya, torch or even phone light from our balconies or at our doors to dispel the darkness of #Corona and invoke our collective strength.

But maintain social distancing at all cost..."
2020-04-03 07:42:31+00:00,RT @sambitswaraj: If You all from @INCIndia don’t want to light a candle to stand in solidarity with India ..if that’s too much of a pain f…,iamuditsingh7,"Maharashtra,India,Earth","Jo bhara nahi hai bhavo se, behti jisme rasdhaar nahi, woh hriday nahi hai patthar hai, jisme swadesh ka pyar nahi🇮🇳🕉️",158,459,1804,False,If You all from @INCIndia don’t want to light a candle to stand in solidarity with India ..if that’s too much of a pain for you Congress people ..so be it ..stay in darkness..but at least don’t forget to put off that “TUBELIGHT”!! https://t.co/RytAF1WmSq
2020-04-03 07:42:32+00:00,"RT @sardesairajdeep: Mental well being also a challenge in corona times: here is another good initiative friends. Maharashtra govt, BMC and…",johnsonindia,"Mumbai, India",Purpose driven person who enjoys being an emerging Maritime Theorist and a Life Navigator! Views personal. RTs not endorsement,444,506,6484,False,"Mental well being also a challenge in corona times: here is another good initiative friends. Maharashtra govt, BMC and Mpower 1on1 have created a free helpline to support you at this difficult time. Call 1800-120-820050 to speak to a mental health professional. #LetsTalk1on1 https://t.co/jq2v0wBIye"
2020-04-03 07:42:32+00:00,"RT @VoiceOfAxom: @Shehla_Rashid Next time Modi Ji will says “On Sunday at 9pm, go out in your balcony and start inhaling/breathing more oxy…",lakshmitaru,India,"#trustworthy #नमस्ते_सदा_वत्सले_मातृभुमे
RT are not Endorsement
सत्यमेव जयते! धर्मो रक्षति रक्षितः। विराट हिन्दू!",510,598,20031,False,"@Shehla_Rashid Next time Modi Ji will says “On Sunday at 9pm, go out in your balcony and start inhaling/breathing more oxygen for 10mins. It will increase your immunity &amp; help fight COVID19” 

What will you do then? 🤔"
2020-04-03 07:42:32+00:00,"RT @Rajput_Ramesh: Dear @Uppolice this guy is from UP and he is insulting Hindu Gods and Goddesses
Please take necessary action",CaptAssamRegt,India,"With NATURE to live:
With NATION to live with self-respect",780,1612,139302,False,"Dear @Uppolice this guy is from UP and he is insulting Hindu Gods and Goddesses
Please take necessary action https://t.co/9vtOyYHKqt"
2020-04-03 07:42:33+00:00,"@Krraj9304 Hi, in purview of COVID-19, we are currently operating at reduced strength. We might take a little longer than usual to respond back. While we are doing all we can to ensure that our services are running, we encourage you to use #AirtelThanks app for service requests.",Airtel_Presence,INDIA,The official customer support page for Airtel India.,431046,80196,2907997,True,No Value Mentioned
2020-04-03 07:42:33+00:00,"RT @DeepaAthlete: Enabled 5.7 lacs contribution towards PMs National Relief Fund for the rehabilitation during Natural Calamities, forseein…",HariKishanAbvp,"Jaipur, India","#राष्ट्रहित_सर्वोपरि

#RSS_SVYAMSEVAK_JAI_SRI_RAM 
         #VANDE_MATRAM                                    #BHARAT_MATA_KI_JAI",2503,394,202659,False,"Enabled 5.7 lacs contribution towards PMs National Relief Fund for the rehabilitation during Natural Calamities, forseeing the #COVID19 situation in other countries.The situation since has escalated. Offering food to needy &amp; staying home itself is a great contribution!
@PMOIndia https://t.co/tvwKgeWz6Y"
2020-04-03 07:42:34+00:00,"RT @SumitkadeI: Salman Khan giving basic salary to 25000 workers in mumbai is a huge contribution. Our superstars, many bollywood &amp; Indian…",AmarJassal,"Bengaluru, India","Straight Edge ✌️
Caffeine addict ☕
Workout enthusiast 💪
Seeking for related solutions? Let's connect. 
Insta username - straightedge_singh",2064,252,92627,False,"Salman Khan giving basic salary to 25000 workers in mumbai is a huge contribution. Our superstars, many bollywood &amp; Indian film personalities doing so much to fight corona pandemic..  DESERVES HUGE RESPECT. 

कुछ फिल्मी नक्सली पूरे बॉलीवुड के नुमाइंदे नहीं हैं।"
2020-04-03 07:42:35+00:00,"RT @MoHFW_INDIA: #IndiaFightsCorona:

As we observe the lockdown, it is important for us to be kind to ourselves and protect our mental hea…",j_ashwani,India,"@Bjp4mp आई टी ,वेबसाइट एवं सोशल मीडिया प्रबंधन विभाग . प्रदेश कार्यसमिति सदस्य ,जबलपुर संभाग प्रभारी, मध्यप्रदेश",3546,1751,139988,False,"#IndiaFightsCorona:

As we observe the lockdown, it is important for us to be kind to ourselves and protect our mental health. 
To get help on concerns related to mental health you may call NIMHANS 08046110007. 

#HealthForAll #CoronaOutbreak #SwasthaBharat #Lockdown21 https://t.co/SCEdjPUJHu"
2020-04-03 07:42:35+00:00,"RT @abhishek_70007: 🙏 Thank You Hon. PM Shri. @narendramodi ji for interacting with us.
We will follow your directions to fight with corona…",surajmishra1992,India,Proud Indian | Cyber Security | Information Technology 👨🏼‍💻 वसुधैव कुटुम्बकम्,125,1689,5808,False,"🙏 Thank You Hon. PM Shri. @narendramodi ji for interacting with us.
We will follow your directions to fight with corona together as Team India.

@PMOIndia
@KirenRijiju 
@IndiaSports 
@WeAreTeamIndia"
2020-04-03 07:42:35+00:00,Great Makal Thalaivar #mkstalin #mkstalin_thenextcm2021 #DmkCares https://t.co/WH15oMl5v1,kmanicandoit,"Chennai, India",பிறப்பொக்கும் எல்லா உயிர்க்கும் சிறப்பொவ்வா  செய்தொழில் வேற்றுமை யான்,309,610,2318,False,No Value Mentioned
2020-04-03 07:42:36+00:00,"RT @theholy_monk: Good morning Friends ❣️
Hope all of you are safe 🙏

The King of the Kings, Lord Ramchandra ki jai. 🙌👌👍
After reading this…",MausamMishraBJD,"Orissa, India",Entrepreneur Philanthropist Traveller,708,652,11897,False,"Good morning Friends ❣️
Hope all of you are safe 🙏

The King of the Kings, Lord Ramchandra ki jai. 🙌👌👍
After reading this I am overjoyed...
Bhagwan Ramchandra hamari Raksha Karen iss Coronavirus se... https://t.co/HZU4bHdkvk"
2020-04-03 07:42:36+00:00,"#MissionHolyWeek Day 8 in our #GoodFightOfFaith feels like we R at THE END.. like #muchprayers R of no use as the WHOLE #WORLD IS bowing down to a #corona.. Yet, God does NOT need too much #time to crush the #Leviathan, provided WE WANT THAT also.. #RETURN 2God
03042020IST1311(2)",PariWriting,"Bangalore, India","Faith worker.. I have made Abba-God weep in crucifying pain.. Yet, HE makes me rejoice, awed in HIS #LOVE :) Mama who does not count her cubs.. #muchprayers ALL",234,32,24933,False,No Value Mentioned
2020-04-03 07:42:36+00:00,RT @ANI: Till now 161 people have been tested positive for #CoronaVirus in Andhra Pradesh.140 of them are those who attended the Tablighi J…,HARI_Megafan,"Nellore, India","Doctor, Born Megafan",59,85,20368,False,"Till now 161 people have been tested positive for #CoronaVirus in Andhra Pradesh.140 of them are those who attended the Tablighi Jamaat event in Delhi, and their contacts: Chief Minister's Office https://t.co/UXrtZZk4sF"
2020-04-03 07:42:36+00:00,"RT @arjunmodhwadia: Dear Amit Shah ji,

Pl don’t teach us national interest. @INCIndia &amp; it’s workers have been living &amp; dying for it since…",chirag_raval87,"Nadiad, India",Hello everyone ..My self adv chirag raval,193,705,1644,False,"Dear Amit Shah ji,

Pl don’t teach us national interest. @INCIndia &amp; it’s workers have been living &amp; dying for it since 135 yrs.

WHO advised on 30th Jan,

@RahulGandhi warned on 12&amp;18th feb.

PM announced lock down on 24th March 8PM!

Who failed in timely action?

#Covid19 https://t.co/N3dd7gzlsd"
2020-04-03 07:42:37+00:00,RT @IndiaPostOffice: @uttamkumardash5 Post Office and its staff including Postmen are providing essential services to the people across the…,Bhattacharyya31,INDIA,"BHARAT MAATA KI JAY🇮🇳
VANDE MAATARAM 🇮🇳
JAI HIND 🇮🇳
PROUD HINDU 🇮🇳 AHAM BRAHMASMI
अहिंसा परमो धर्मः धर्म हिंसा तथैव च: ",538,1476,99260,False,@uttamkumardash5 Post Office and its staff including Postmen are providing essential services to the people across the country during the lockdown period ensure all safety precautions related to COVID-19. Thank you.
2020-04-03 07:42:38+00:00,RT @SaketGokhale: He’ll ask people to bang utensils &amp; light candles to periodically check whether there’s unflinching control over the floc…,tausif_bbsr,India,Eternal vigilance is the price of Liberty,12,158,4284,False,"He’ll ask people to bang utensils &amp; light candles to periodically check whether there’s unflinching control over the flock. 

Then he’ll use all available instruments &amp; the media to vilify a minority community &amp; unleash the flock upon them. 

Fascism 101 aided by a pandemic."
2020-04-03 07:42:39+00:00,"RT @RedChilliesEnt: Whilst we stay safe at home,many r working for our safety &amp; fending for themselves. Here's our little contribution to e…",Vipul37788318,"Gujarat, India",No Value Mentioned,61,418,5494,False,"Whilst we stay safe at home,many r working for our safety &amp; fending for themselves. Here's our little contribution to ensure their health &amp; well being! Separate but together,we will overcome! @iamsrk @PMOIndia @narendramodi @OfficeofUT @AUThackeray @MamataOfficial @ArvindKejriwal https://t.co/7MI2KT7770"
2020-04-03 07:42:39+00:00,RT @realTuckFrumper: GOP governor should be polygraphed on his claim he didn’t know asymptomatic people could spread COVID-19: Ex-prosecuto…,floetfre,"Indiana, USA","“When I despair, I remember that all through history the way of truth and love have always won......Think of it--always.”  ― Mahatma Gandhi",7246,6768,10966,False,GOP governor should be polygraphed on his claim he didn’t know asymptomatic people could spread COVID-19: Ex-prosecutor https://t.co/1EN6BwsRVh
2020-04-03 07:42:39+00:00,RT @ChintanIndia: Many thanks to the @AAPDelhi @ArvindKejriwal @AAPVolunteers for making sure that the poorest in Delhi do not go without f…,abhinandita_m,"New Delhi, India",Advisor  - Delhi government,7481,409,5696,True,"Many thanks to the @AAPDelhi @ArvindKejriwal @AAPVolunteers for making sure that the poorest in Delhi do not go without food during #COVID19 outbreak. Making this a priority, teams from Chintan and Delhi govt. came together and provided food packets to #wastepicking communities. https://t.co/bOX3POA5MB"
2020-04-03 07:42:40+00:00,The second phase of human trials for a potential #COVID19 #coronavirus #vaccine may start in the spring. https://t.co/BPuPjMwF4a,alokrsrivastav,"Patna , Bihar , India","Freelancer @ Activity & Communication Coordination.
Trade Union Activist.
State General Secretary @ INTUC, Bihar.
Retweets/Likes are not endorsement.",407,2261,11147,False,No Value Mentioned
2020-04-03 07:42:40+00:00,"RT @LMKMovieManiac: Stylish Star @alluarjun celebrates his son #AlluAyaan 's 6th birthday at home, during this lockdown time.

#HappyBirthd…",GouseJilaniAA,"Bezawada , Andhra , INDIA.","Student | Movie Lover | Fan of AlluArjun , MS Dhoni & Suriya",13436,952,142874,False,"Stylish Star @alluarjun celebrates his son #AlluAyaan 's 6th birthday at home, during this lockdown time.

#HappyBirthdayAlluAyaan 👍🙂 https://t.co/gA3xBIpF9C"
2020-04-03 07:42:40+00:00,"Let us abuse Corona collectively.
He may feel offended and leave.
@_garrywalia @manoj2367 @ashutosh83B @ArvindKejriwal @rssurjewala @SanjayAzadSln @pappuyadavjapl",drrrahul,India,No Value Mentioned,46,296,1493,False,No Value Mentioned
2020-04-03 07:42:41+00:00,"RT @AlamSabah: #Italy had reported its first case of #Coronavirus on Jan 30 while #Pakistan reported its case on 26 Feb.

It only took 29 d…",nealnifty,"Mumbai, India",Breaking bones and passing stones,183,287,101581,False,"#Italy had reported its first case of #Coronavirus on Jan 30 while #Pakistan reported its case on 26 Feb.

It only took 29 days for Pakistan to confirm its 1000th case. Whereas, Italy had confirmed just over 600 cases in the first 29 days after the confirmation of the first case. https://t.co/zbne1fjXeM"
2020-04-03 07:42:42+00:00,"RT @ANI: Till date, 125 #COVID19 cases have been confirmed in the state; this includes 3 deaths &amp; 11 discharges: Government of Karnataka",RealManash,"Saharsa, India",😊🙏#बिहारी  #राष्ट्रहित_सरवोपरि #देशभक्त #सनातनधर्म🙏   #सदस्य -भारतीय जनता पार्टी #Student Of Patliputra University.,782,559,39360,False,"Till date, 125 #COVID19 cases have been confirmed in the state; this includes 3 deaths &amp; 11 discharges: Government of Karnataka https://t.co/pfqRNCFPx7"
2020-04-03 07:42:42+00:00,@ndtvfeed I request you to take immediate action against Hindustan Coca-cola Beverages PVT LTD. In Rayagada Odisha they are supplying more than 2 persons and suppling carbonated Softdrinks in name of Suppling Kinley Water. These people are helping to spread of coronavirus. https://t.co/AhQWMlTatM,ramanjain8,"Muniguda, India",I want to be optimistic.I want to see all happy .I want to do best for the nation.Want to be good citizen .Jai Hind Jai Bharat.Jai Jawan Jai Kisan,2,89,539,False,No Value Mentioned
2020-04-03 07:42:42+00:00,RT @EurekaSiete: @FatherBluechi *ahem*,FatherBluechi,"Indianapolis, IN",PSN/Live: Haremgawdblue | Nintendo Dev | GGG founder | Twitch Affiliate | FGC lover |,1026,1153,59774,False,@FatherBluechi *ahem* https://t.co/k8QlFKhH4E
2020-04-03 07:42:42+00:00,"I just did my part in the war against coronavirus. Join me, in supporting those who need a helping hand at this critical hour. https://t.co/eiKp6GjZ71",pavansaip914,"Hyderabad, India",liturdesignstudio/Accor/Novotel/Hospitality Industry / Family man /Pawan Kalyan follower /,27,686,4818,False,No Value Mentioned
2020-04-03 07:42:42+00:00,RT @Divyanshu_AdvN: Which Whatsup group is most interesting &amp; fun during lockdown ; #LockdownLessons #WhatsApp If any other group mention i…,Divyanshu_AdvN,"Mumbai, India",Adventure I Photography I Vegetarian Food lover I Entrepreneur I Started running l Travel l Live Life,504,347,3380,False,Which Whatsup group is most interesting &amp; fun during lockdown ; #LockdownLessons #WhatsApp If any other group mention in your comments. @BhaavnaArora looking forward for your interest group too ;) #groupchat #COVIDー19
2020-04-03 07:42:43+00:00,"RT @Abhiman81998518: @narendramodi 100% Guaranteed Cure even for the incurable diseases like coronavirus free of cost
If name initiation is…",Abhishrajpoot,"New Delhi, India","जीव हमारी जाति है ,, मानव धर्म हमारा।।
सनातन धर्म ही सत्य है।",653,396,37323,False,"@narendramodi 100% Guaranteed Cure even for the incurable diseases like coronavirus free of cost
If name initiation is taken from Saint RampalJi  then even the biggest diseases may be cured
It is a request toModi ji please pray to SaintRampalJiMaharaj so that our India may be saved from Corona https://t.co/3LaqdQh9Bu"
2020-04-03 07:42:44+00:00,"Coronavirus update: Destruction by Corona in Italy, nearly 14,000 people killed https://t.co/rO6yX2CbR7 via @Digital World",shivaaysharma03,"Chennai, India","I am Blogger and I like  to write an article related to Bollywood, and latest updated event in India and others",25,333,823,False,No Value Mentioned
2020-04-03 07:42:46+00:00,"@mahabank Cares!

Bank of Maharashtra started Payment of Rs.500/- to Women Beneficiaries under PMGKP through Branches, Business Correspondents &amp; ATMs while observing all precautions of Social Distancing &amp; Sanitization.

#mahabank

@DFS_India
@nsitharaman 
@nsitharamanoffc https://t.co/nQoSiHvQA8",mahabank,"Pune, India",Welcome to Bank of Maharashtra's official Twitter Account! Thanks for visiting us!,5520,7,1377,False,No Value Mentioned
