created_at,full_text,screen_name,location,description,followers_count,friends_count,statuses_count,verified,full_retweet_text
2020-02-07 17:40:34+00:00,"RT @mvmeet: This is pathetic!

Lakhs are suffering in Wuhan bcoz of Coronavirus

But Christian organisations are urging their missionaries…",jayantsharmaa,"Madhya Pradesh, India","Senior Physics Faculty,In Education Industry,motivator, poet & writer..
A Proud Hindu,indian,nationalist and Modi bhakt....",505,436,52926,False,"This is pathetic!

Lakhs are suffering in Wuhan bcoz of Coronavirus

But Christian organisations are urging their missionaries to use the 'opportunity' of coronavirus outbreak to spread message of Jesus Christ,

And help build the 'Kingdom of Christ in China'

Where is humanity? https://t.co/eoK4yGMmge"
2020-02-07 17:40:34+00:00,RT @akuleh31: Are stranded civilians of an enemy Nation above our martyrs that we lost in Pulwama? Is it easy or desired we forget and forg…,BhakthLokesh,India,"Honored to be a Bhakth/Sanghi, Nationalist, Respects My Military, National Flag, Anthem,VandeMatharam, RSS,   Hang Rapists ,
🌹A Diehard Fan @narendramodi 🕉️🔯",802,983,279042,False,Are stranded civilians of an enemy Nation above our martyrs that we lost in Pulwama? Is it easy or desired we forget and forgive the gruesome and heinous attack on our forces?? Do we need to be benevolent even in the face of injustice and brutal inhumanity inflicted on our own?? https://t.co/dwJLrvNBtg
2020-02-07 17:40:35+00:00,"RT @sushantsareen: We never learn. If we think a good gesture to an enemy will change their attitude &amp; behaviour, then we neither know the…",UnabashedIndian,India,"#Indian #AwareCitizen #Dalit but don't support many of the new-age, Anti-Indian, Anarchist Dalit leaders. Respect for our Indian culture, history and diversity.",85,337,15080,False,"We never learn. If we think a good gesture to an enemy will change their attitude &amp; behaviour, then we neither know the enemy nor have we learnt anything from our history. https://t.co/ETgFYnco3V"
2020-02-07 17:40:37+00:00,"RT @AskAnshul: India becomes 2nd largest crude steel producer

India has surpassed Japan in terms of annual steel production, becoming the…",Raje248109921,"New Delhi, India",No Value Mentioned,92,178,1200,False,"India becomes 2nd largest crude steel producer

India has surpassed Japan in terms of annual steel production, becoming the  2nd largest producer of crude steel in the world, after China

In 2019, India produced 111.2 mn tonnes whereas Japan produced 99.3 mn tonnes of crude steel"
2020-02-07 17:40:38+00:00,"RT @selinawangtv: Outpouring of emotions on Chinese social media over the death of Dr. Li Wenliang, who warned China early on of the #coron…",it_is_rovin,India,Check out my website if you are ready to consume quality content.  #follow4follow,1109,2022,536,False,"Outpouring of emotions on Chinese social media over the death of Dr. Li Wenliang, who warned China early on of the #coronavirus, and was reprimanded for rumor-mongering. His death deepens people's frustrations, fears, and anger. See some images circulating on WeChat @QuickTake https://t.co/ZuHuvFrNvm"
2020-02-07 17:40:41+00:00,RT @spectatorindex: BREAKING: Singapore announces three more cases of coronavirus in people who have not been to China,RamchandaniGP,आर्यावर्त - भारत - India. ,Warrior - of a different kind - for a better world.,1407,604,232901,False,BREAKING: Singapore announces three more cases of coronavirus in people who have not been to China
2020-02-07 17:40:45+00:00,RT @LiYuan6: The Chinese public have staged what amounts to an online revolt last night after the death of Dr. Li Wenliang.Government offic…,nirmalmatella,"New Delhi, India","Humanitarian, Social worker, Meditator, full time faculty at Art of living, India.",2434,217,7616,False,"The Chinese public have staged what amounts to an online revolt last night after the death of Dr. Li Wenliang.Government officials,biz figures &amp; ordinary folks,have posted numerous messages expressing their grief and anger. It's sth I haven't seen in years https://t.co/zge4rVysB2 https://t.co/uL4JVd89u1"
2020-02-07 17:40:49+00:00,RT @drharshvardhan: Universal thermal screening has been made mandatory for all flights from #Singapore and #Thailand besides #HongKong and…,PtAshokkiradoo,"Kolkata, India🇮🇳",#Astrologer,3811,2606,135612,False,"Universal thermal screening has been made mandatory for all flights from #Singapore and #Thailand besides #HongKong and #China &amp; these flights will be parked at earmarked aero-bridges to facilitate screening.
#NovelCoronavirus #nCoV #nCoV1 @WHO #RajyaSabha  
@MoHFW_INDIA https://t.co/VMxT1ryPUI"
2020-02-07 17:40:55+00:00,RT @RealCandaceO: Everyone is worried about the Coronavirus in China when we have a full-fledged Trump Derangement Syndrome outbreak here i…,JeffSchapker,"Mount Vernon, Indiana ",Thank God for President #Trump! #KAG #NRA Life Member #MAGA #BoycottNFL #VoterID #JobNotMobs,10164,9805,53867,False,"Everyone is worried about the Coronavirus in China when we have a full-fledged Trump Derangement Syndrome outbreak here in the States, w/ no known vaccine or cure on the horizon. 

This is what it looks like, stage 4. 
Be sure to wash your hands as much as possible this season. https://t.co/5F487ETvQX"
2020-02-07 17:40:55+00:00,"RT @AAPSonline: Li Wenliang, Chinese doctor who sounded alarm on coronavirus, dead from disease at 34 https://t.co/MDXYFQ5Hhg via @nypost",josekammca,Kerala India,"Blessed 36 yrs with wife.A daughter& a son&3 grands; Follows Bible & CCC, Faith in God's mercy &grace through Jesus,Holy Spirit ,&Church. Humble catechist.",2201,3700,38990,False,"Li Wenliang, Chinese doctor who sounded alarm on coronavirus, dead from disease at 34 https://t.co/MDXYFQ5Hhg via @nypost"
2020-02-07 17:40:55+00:00,RT @ANI: EAM Dr S Jaishankar in Rajya Sabha: We were prepared to bring back not only our people but also those from all our neighbourhood w…,green_mgoyal,"Ghaziabad, India",No Value Mentioned,31,84,3448,False,EAM Dr S Jaishankar in Rajya Sabha: We were prepared to bring back not only our people but also those from all our neighbourhood who would have liked to. This was an offer which was made to all our neighbours but only 7 nationals of Maldives chose to avail the offer. #Coronavirus https://t.co/S2lquD7ykm
2020-02-07 17:40:58+00:00,"RT @GovMikeHuckabee: Proving he doesn't hold grudges, @realDonaldTrump just announced he's sending a delegation immediately to China consis…",Trm20061,Indiana USA,"God, family, MAGA, SUPER Conservative, ANTI-Democrat",240,213,18560,False,"Proving he doesn't hold grudges, @realDonaldTrump just announced he's sending a delegation immediately to China consisting of Mitt Romney, Nancy Pelosi, Adam Schiff, and Jerry Nadler."
2020-02-07 17:41:13+00:00,RT @DrSJaishankar: Many Indian crew &amp; some Indian passengers are onboard the cruise ship #DiamondPrincess quarantined off Japan due to #Cor…,RatnaniHitesh,"Pune, India","Software Engineer | Wanna be Chef| Proud Indian| ગરવી ગુજરાતી
•Views are strictly Personal•RTs NOT Endorsements•
Followed by PM Shri @narendramodi",1159,1051,106524,False,"Many Indian crew &amp; some Indian passengers are onboard the cruise ship #DiamondPrincess quarantined off Japan due to #Coronavirus. None have tested positive, as per the latest information provided by our Embassy @IndianEmbTokyo. We are closely following the developments."
2020-02-07 17:41:14+00:00,"RT @raovsingh: #coronaviruschina a heart rending video of a chinese couple detained, stuffed into a metal container and deported to an unkn…",syedmohdmurtaza,"New Delhi, India","Ph.D. Scholar in Academy of International Studies, JMI ▪Central Asia▪Iran▪Eastern Europe▪ Defence & Aviation▪ MA & UGC NET in Defence Studies▪ Proud Yezdi Owner",1384,433,17340,False,"#coronaviruschina a heart rending video of a chinese couple detained, stuffed into a metal container and deported to an unknown destination..Scared and heartbroken Woman crying . What a humanitarian disaster..@justbarundas @Live_Samay #CoronavirusOutbreak #Corona #CoronavirusWho https://t.co/hTwtm9fBD5"
2020-02-07 17:41:19+00:00,"RT @Rancho119: Aamir Khan has been the only actor to have received the tremendous love and appreciation for his films in China. 
The actor…",kgotame123,"Mumbai, India","Die hard fan of two living legends Amitabh Bacchhan, Aamir Khan n Darling Prabhas",1513,1313,42360,False,"Aamir Khan has been the only actor to have received the tremendous love and appreciation for his films in China. 
The actor has made it possible to resonate the mindset of the two nations, which is a rare phenomenon."
2020-02-07 17:41:24+00:00,"RT @BJP4India: India was ready to bring back not only its own people but also from neighbouring countries.

The offer was made to everyone…",shanisi13028883,"Maharashtra, India",I I like my self,38,98,223,False,"India was ready to bring back not only its own people but also from neighbouring countries.

The offer was made to everyone including people of Pakistan. People from Maldives chose to avail it: EAM @DrSJaishankar on India’s evacuation efforts in China after Coronavirus outbreak https://t.co/O0IeTanFSK"
2020-02-07 17:41:25+00:00,"RT @janisfrayer: Scolded for warning of #coronavirus in #Wuhan, Li Wenliang told @Caixin, ‘A healthy society should have more than one voic…",Jeeveshu,India,Stand-Up Comic/Actor/Host/Voice Over Artist Bookings : +919811239932 query@jeeveshu.com,17865,535,19461,True,"Scolded for warning of #coronavirus in #Wuhan, Li Wenliang told @Caixin, ‘A healthy society should have more than one voice.’ That phrase creating a social media earthquake rarely seen here, with posts about lies, fury &amp; free speech. Predictably, #China censors busy too. @NBCNews https://t.co/tj2irFx0EE"
2020-02-07 17:41:25+00:00,China designs 30 disinfection robots to control novel coronavirus https://t.co/4AonqEnC06,fpjindia,India,The voice of #Mumbai. The Free Press Journal is one of the oldest English daily newspapers from Mumbai with a heritage of more than 90 years.,11630,512,185472,True,No Value Mentioned
2020-02-07 17:41:27+00:00,RT @k_satyarthi: When 166000 survivors of child sexual abuse are awaiting justice &amp; just 10000 cases are disposed off annually while only 1…,bhavani_aalla,"Khammam, Telangana- India","People's First, Never Materiallist, Farmer, Farming is my life Ambition,Interested in Agriculture which doesn't harm the NATURE, &Retweets aren't Endorsements.",16,43,1261,False,"When 166000 survivors of child sexual abuse are awaiting justice &amp; just 10000 cases are disposed off annually while only 1% get compensation, today’s direction by Hon’ble Supreme Court is a shot in the arm for all who are fighting this moral epidemic &amp; ray of hope for children."
2020-02-07 17:41:28+00:00,@Anirudh_Astro This is what world is doing on coronavirus,IndianNewsViews,India,https://t.co/Dhudik6wM5,577,548,33951,False,No Value Mentioned
2020-02-07 17:41:31+00:00,RT @LiYuan6: The Chinese public have staged what amounts to an online revolt last night after the death of Dr. Li Wenliang.Government offic…,Jeeveshu,India,Stand-Up Comic/Actor/Host/Voice Over Artist Bookings : +919811239932 query@jeeveshu.com,17865,535,19461,True,"The Chinese public have staged what amounts to an online revolt last night after the death of Dr. Li Wenliang.Government officials,biz figures &amp; ordinary folks,have posted numerous messages expressing their grief and anger. It's sth I haven't seen in years https://t.co/zge4rVysB2 https://t.co/uL4JVd89u1"
2020-02-07 17:41:35+00:00,"RT @Raajkml1: @SunoRishi @OpIndia_com Corona virus is the second dangerous virus in the world.

@OpIndia_com maintaining its top position v…",AshuInnaya,india,No Value Mentioned,40,42,1866,False,"@SunoRishi @OpIndia_com Corona virus is the second dangerous virus in the world.

@OpIndia_com maintaining its top position very strongly 😋😂"
2020-02-07 17:41:39+00:00,"@activecitizen18 @twiiit_sam @BholaNath_BSF @TVMohandasPai @SwarajyaMag @DrSJaishankar if India helps Pakistani students in China, there will be 1000% revolt in Pakistan....So India should not help otherwise Pakistan will remain no more.",WriterSinha,"Mumbai, India",नमस्ते सदा वत्सले मातृभूमे।त्वया हिन्दुभूमे सुखंवर्धितोहम।महामंगले पुण्यभूमे त्वदर्थे पतत्वेष कायो नमस्ते नमस्ते।,476,1540,5391,False,No Value Mentioned
2020-02-07 17:41:42+00:00,RT @jandrusk: Implementing transparent proxies be like....#infosec #cybersecurity #netsec https://t.co/FaR2DCaXJU,sectest9,"Hyderabad, India",News Hub! Get the latest Security News & Updates!,30298,1,1755429,False,Implementing transparent proxies be like....#infosec #cybersecurity #netsec https://t.co/FaR2DCaXJU
2020-02-07 17:41:42+00:00,"RT @JackPosobiec: The Chinese doctor who was detained by the police for sounding the alarm on the Wuhan coronavirus has died

The governmen…",josekammca,Kerala India,"Blessed 36 yrs with wife.A daughter& a son&3 grands; Follows Bible & CCC, Faith in God's mercy &grace through Jesus,Holy Spirit ,&Church. Humble catechist.",2201,3700,38990,False,"The Chinese doctor who was detained by the police for sounding the alarm on the Wuhan coronavirus has died

The government claimed he was posting illegal disinformation on social media 
https://t.co/rtLbzvulXr"
2020-02-07 17:41:46+00:00,"@Nigel__DSouza Doomsday is coming , To save the world drop dozens of nuclear bombs on china.",dot_dot35,"New Delhi, India",No Value Mentioned,174,526,7158,False,No Value Mentioned
2020-02-07 17:41:46+00:00,RT @LiYuan6: The Chinese public have staged what amounts to an online revolt last night after the death of Dr. Li Wenliang.Government offic…,Amrita_Dutt,India,"Global Citizen
Humanist
I am What I am",2874,2772,323467,False,"The Chinese public have staged what amounts to an online revolt last night after the death of Dr. Li Wenliang.Government officials,biz figures &amp; ordinary folks,have posted numerous messages expressing their grief and anger. It's sth I haven't seen in years https://t.co/zge4rVysB2 https://t.co/uL4JVd89u1"
2020-02-07 17:41:49+00:00,RT @EricCheungwc: Portraits of late Chinese doctor Li Wenliang - who was silenced by authorities after warning of the #NovelCoronavirus - c…,Amrita_Dutt,India,"Global Citizen
Humanist
I am What I am",2874,2772,323467,False,Portraits of late Chinese doctor Li Wenliang - who was silenced by authorities after warning of the #NovelCoronavirus - circulating on Chinese social media platforms after his death last night: https://t.co/WWvJUDiLtT
2020-02-07 17:41:53+00:00,3 admitted in Karnataka's Udupi govt hospital for suspected novel coronavirus infection | Mangaluru News - Times of India #corononavirus #nCoV  https://t.co/slaGruhLxi,KevinMTOI,"Mangalore, India","Journo with the Times of India, Mangaluru. Covers education, crime & others. Views expressed are personal. RT not endorsement, kevin.medonsa@timesgroup.com",699,621,4881,False,No Value Mentioned
2020-02-07 17:41:55+00:00,"RT @BJP4India: India was ready to bring back not only its own people but also from neighbouring countries.

The offer was made to everyone…",Ashutos66233938,"prayagraj, India","राष्ट्रीय स्वयंसेवक संघ
।। तृतीय वर्ष प्रशिक्षित, नागपुर - 2012",325,571,5933,False,"India was ready to bring back not only its own people but also from neighbouring countries.

The offer was made to everyone including people of Pakistan. People from Maldives chose to avail it: EAM @DrSJaishankar on India’s evacuation efforts in China after Coronavirus outbreak https://t.co/O0IeTanFSK"
2020-02-07 17:41:57+00:00,"RT @MajorPoonia: #CoronaVirus का क़ुदरती इलाज !
Camel Mutra is secular and Gau Mutra is communal but It becomes KUDARATI Vaccine when they…",I_am_Shabd,"Haryana, India",civil engineer,186,917,776,False,"#CoronaVirus का क़ुदरती इलाज !
Camel Mutra is secular and Gau Mutra is communal but It becomes KUDARATI Vaccine when they drink after mixing both to treat Corona Virus outbreak https://t.co/BK0zP1yTB8"
2020-02-07 17:42:01+00:00,RT @ihucash: Is it on tour?,KyaaMaslaHai,India,No Value Mentioned,434,326,33367,False,Is it on tour? https://t.co/PNwFacMEMI
2020-02-07 17:42:01+00:00,"RT @AskAnshul: India becomes 2nd largest crude steel producer

India has surpassed Japan in terms of annual steel production, becoming the…",sundarmail,"Chennai, India","Interested in Development of Bharat, Infrastructure, Politics, Economics, Global IT Trends and Transformational use of IT for development",1765,4954,89702,False,"India becomes 2nd largest crude steel producer

India has surpassed Japan in terms of annual steel production, becoming the  2nd largest producer of crude steel in the world, after China

In 2019, India produced 111.2 mn tonnes whereas Japan produced 99.3 mn tonnes of crude steel"
2020-02-07 17:42:02+00:00,"RT @realDonaldTrump: ....he will be successful, especially as the weather starts to warm &amp; the virus hopefully becomes weaker, and then gon…",loveleshsharma,"Mhow, India",No Value Mentioned,216,265,2248,False,"....he will be successful, especially as the weather starts to warm &amp; the virus hopefully becomes weaker, and then gone. Great discipline is taking place in China, as President Xi strongly leads what will be a very successful operation. We are working closely with China to help!"
2020-02-07 17:42:03+00:00,"RT @RealJamesWoods: When we speak of heroic whistle-blowers, it is men like Dr. Li Wenliang, who literally sacrificed his life to save the…",flowersranda9,"Indiana, USA","Hard working conservative, 
🇺🇸#TRUMP2020🇺🇸, MAGA, KAG, Christian, father, grandfather (Papaw)",792,762,27616,False,"When we speak of heroic whistle-blowers, it is men like Dr. Li Wenliang, who literally sacrificed his life to save the world. Then, of course, there are those other kinds of whistle-blowers, like deep state Democrats, for example,  slithering in the swamp. https://t.co/maRkqHR5H0"
2020-02-07 17:42:06+00:00,RT @LiYuan6: The Chinese public have staged what amounts to an online revolt last night after the death of Dr. Li Wenliang.Government offic…,NaMoTeaParty,"New Delhi, India","Jaha 4 Yaar Mil Jaye .a movement to network over cup of tea to discuss #NaMoMantra & #BharatFirst ,yes also followed by our @narendramodi Ji",5307,785,2754,False,"The Chinese public have staged what amounts to an online revolt last night after the death of Dr. Li Wenliang.Government officials,biz figures &amp; ordinary folks,have posted numerous messages expressing their grief and anger. It's sth I haven't seen in years https://t.co/zge4rVysB2 https://t.co/uL4JVd89u1"
2020-02-07 17:42:10+00:00,RT @LiYuan6: The Chinese public have staged what amounts to an online revolt last night after the death of Dr. Li Wenliang.Government offic…,imjkzone,"Mumbai, India",A practising secular. There have always been #TheGoodTheBadAndTheUgly in all regions and religions. #OverAndOut,2475,2095,14153,False,"The Chinese public have staged what amounts to an online revolt last night after the death of Dr. Li Wenliang.Government officials,biz figures &amp; ordinary folks,have posted numerous messages expressing their grief and anger. It's sth I haven't seen in years https://t.co/zge4rVysB2 https://t.co/uL4JVd89u1"
2020-02-07 17:42:17+00:00,RT @aarohi_vns: They will use Ebola experience,abhish1212,"Gwalior, India",No Value Mentioned,283,1053,97913,False,They will use Ebola experience https://t.co/TBReWFspow
2020-02-07 17:42:20+00:00,"@mass_ave @CBSNews There are probably herds of pangolins roaming the palatial estates of Hamilton County just waiting to burrow under the fence to bite unsuspecting pets and toddlers to infect them with that deadly Chinese coronavirus -- take action NOW, Gov. Holcomb!!!",Wilson46201,"Indianapolis, IN 46201","My country -- right or wrong, my country! When right, keep it right. When wrong, set it right !",810,666,139496,False,No Value Mentioned
2020-02-07 17:42:21+00:00,"RT @BJP4India: India was ready to bring back not only its own people but also from neighbouring countries.

The offer was made to everyone…",Milan_sha_rma,"Jaipur, India",Its great to be a HUMAN in this World.....,33,201,6518,False,"India was ready to bring back not only its own people but also from neighbouring countries.

The offer was made to everyone including people of Pakistan. People from Maldives chose to avail it: EAM @DrSJaishankar on India’s evacuation efforts in China after Coronavirus outbreak https://t.co/O0IeTanFSK"
2020-02-07 17:42:22+00:00,RT @TOIMangalore: 3 admitted in Karnataka's Udupi govt hospital for suspected novel coronavirus infection https://t.co/ebSdH8SS2B,Shudraism,South & Central India,"Anthropologist by fluke. 
Too left for the right; too right for the left.
“Knowledge is not for knowing: knowledge is for cutting""
 - Michel Foucault",7593,2060,55120,False,3 admitted in Karnataka's Udupi govt hospital for suspected novel coronavirus infection https://t.co/ebSdH8SS2B
2020-02-07 17:42:24+00:00,RT @cnnbrk: Four passengers on a Royal Caribbean cruise ship docked near New York City were taken to a hospital for further evaluation for…,bharat2004,India,Barry from Boston,559,492,65014,False,"Four passengers on a Royal Caribbean cruise ship docked near New York City were taken to a hospital for further evaluation for the coronavirus, New Jersey Gov. Phil Murphy says https://t.co/Ms51D0E3uR https://t.co/rpKppWgBGa"
2020-02-07 17:42:24+00:00,"RT @ThePrintScience: Coronavirus spread not just an epidemic, pseudoscience has made it a ‘misinfo-demic’ too | @Neurophysik writes https:/…",daaktardush,"New Delhi, India",Narcissist. . .loud . . .spontaneous ...crazy about  dogs. . .Ex-Actor and doctor by profession !!!,294,179,184726,False,"Coronavirus spread not just an epidemic, pseudoscience has made it a ‘misinfo-demic’ too | @Neurophysik writes https://t.co/KwzXK3y6m4"
2020-02-07 17:42:29+00:00,RT @ANI: EAM Dr S Jaishankar in Rajya Sabha: We were prepared to bring back not only our people but also those from all our neighbourhood w…,viggu_8391,"New Delhi,India",Love my cold beer. Leisure Traveller. Dog lover. Animal lover but dislike Cats...  Nationalist. Unpaid troll. India First 🇮🇳,274,2054,44473,False,EAM Dr S Jaishankar in Rajya Sabha: We were prepared to bring back not only our people but also those from all our neighbourhood who would have liked to. This was an offer which was made to all our neighbours but only 7 nationals of Maldives chose to avail the offer. #Coronavirus https://t.co/S2lquD7ykm
2020-02-07 17:42:31+00:00,RT @LiYuan6: The Chinese public have staged what amounts to an online revolt last night after the death of Dr. Li Wenliang.Government offic…,sharansri1326,"Hyderabad, India",No Value Mentioned,21,94,41,False,"The Chinese public have staged what amounts to an online revolt last night after the death of Dr. Li Wenliang.Government officials,biz figures &amp; ordinary folks,have posted numerous messages expressing their grief and anger. It's sth I haven't seen in years https://t.co/zge4rVysB2 https://t.co/uL4JVd89u1"
2020-02-07 17:42:31+00:00,‘Had Offered All Our Neighbours To Bring Back Their People From China’: EAM Jaishankar On Rescuing Pakistanis  https://t.co/QWvsPHPAgd,YusufDFI,"Bangalore, India","Editor, Indian Defence Forum https://t.co/xpbuZAFzVr Blogs at https://t.co/oHy4YvGhiz   YusufUnjhawala@mastodon.social",34366,1490,130252,True,No Value Mentioned
2020-02-07 17:42:44+00:00,RT @RealCandaceO: Everyone is worried about the Coronavirus in China when we have a full-fledged Trump Derangement Syndrome outbreak here i…,Unlawful_Badger,Indianapolis,Boilermaker through and through. Bleed black and Chug Gold. Hammer Down! We got the bucket and IU don’t. Proud Christian & Legal 2A Gun owner.,274,610,4987,False,"Everyone is worried about the Coronavirus in China when we have a full-fledged Trump Derangement Syndrome outbreak here in the States, w/ no known vaccine or cure on the horizon. 

This is what it looks like, stage 4. 
Be sure to wash your hands as much as possible this season. https://t.co/5F487ETvQX"
2020-02-07 17:42:47+00:00,RT @JackPosobiec: They were all tested before they were let off right?,ByrdWes,"Indian Trail, NC","Follower of Jesus Christ, Father of 2 beautiful girls, husband to the most amazing wife. #MAGA #KAG",685,1260,1020,False,They were all tested before they were let off right? https://t.co/PWhstK6i8D
2020-02-07 17:42:48+00:00,"RT @wetuiozx: @2the_hill @DFW_Dee @bfs2020 You're exactly right, or China could call all it's loans in. We'd be in a 🌎of hurt then.🤯🤯🤯",2the_hill,"Indiana, USA","My opinions idealistically true,💕 family, desires to retrieve🇺🇸 ✊dignity ethics&honesty,We must remove corruption,inhumane unethical traitors🤥WH/GOP #Resist",4772,3513,96848,False,"@2the_hill @DFW_Dee @bfs2020 You're exactly right, or China could call all it's loans in. We'd be in a 🌎of hurt then.🤯🤯🤯"
2020-02-07 17:42:49+00:00,@paulwasher Praying for my brothers and sisters in Christ of China and for God to work through this open door.,ChiruLun,"Delhi, India",A Student who is in the thick of the pressures of life. #ReformedChristian.,36,84,234,False,No Value Mentioned
