created_at,full_text,screen_name,location,description,followers_count,friends_count,statuses_count,verified,full_retweet_text
2020-01-30 21:59:02+00:00,"RT @latimesfood: She fled her home in North Korea in 2011. After spending two years in China, she took an established smuggling route to So…",DeborahS_IN,"Indiana, USA",Memes Humor Lifestyle Personalities Travel Interesting Pictures Haha Animals Gov Officials & Agencies Trending,917,1570,22796,False,"She fled her home in North Korea in 2011. After spending two years in China, she took an established smuggling route to Southeast Asia, where she sought asylum at a South Korean embassy.

Now Jessie Kim is teaching cooking classes in Seoul. https://t.co/7Tg3ROZp0C"
2020-01-30 21:58:23+00:00,@mjmiriz @WIRED Could be from lab or bats.. but don't expect any fair investigation about it from China or WHO,Gladi911,India,Analyst | Navjagran Times (Bihar). Follow me for updates on political scenario here.. #BiharElections2020,44,104,3240,False,No Value Mentioned
2020-01-30 21:58:18+00:00,"RT @jetbutton: @RyanAFournier Isn't the there a law against wearing a mask in public unless it's needed for work. Such as welders, miners,…",georgew95304553,Indiana,A patriot in for the fight of my life #thisistheway #thewaybible  Be aglow@and burning in the spirit. https://t.co/fcXWWjO3bg,2818,3581,6146,False,"@RyanAFournier Isn't the there a law against wearing a mask in public unless it's needed for work. Such as welders, miners, etc. They need to be rounded up like the animals they are on put on a slow boat to China."
2020-01-30 21:57:28+00:00,RT @RawStory: Trump administration refuses to turn over details on secret Kushner 2017 meeting in China until after the election: report ht…,kathyru1,"Indiana, USA","I'm a Vietnam era Navy vet. 45 is an embarrassment, a danger to the world. #Resist #Resistance",1879,1648,118955,False,Trump administration refuses to turn over details on secret Kushner 2017 meeting in China until after the election: report https://t.co/pJSGqwm4B9
2020-01-30 21:50:16+00:00,"RT @INCIndia: Today, China dominates manufacturing, the whole world wants to balance China and every single country wants India to compete…",AakashMahantIYC,"Chhattisgarh, India","!! 𝐀 𝐂𝐎𝐍𝐆𝐑𝐄𝐒𝐒𝐌𝐀𝐍 !!  🅲🅾🅽🆃🅰🅲🆃 +𝟫𝟣𝟨𝟤𝟨𝟦𝟩𝟥𝟥𝟦𝟦𝟨 
 
https://t.co/7mrKx2uBpG",2493,4006,68263,False,"Today, China dominates manufacturing, the whole world wants to balance China and every single country wants India to compete with China. They are ready to support us but they have a question- what has happened to the peaceful, loving India?: @RahulGandhi
#SaveTheConstitution https://t.co/25TELsPLLb"
2020-01-30 21:49:04+00:00,"RT @HarsimratBadal_: Wishing all Punjabis a very happy #BasantPanchmi. 
For the youth of Punjab, kite flying symbolises the spirit of Basan…",SarwaraKarmjot,"Patiala, India",No Value Mentioned,51,9,2290,False,"Wishing all Punjabis a very happy #BasantPanchmi. 
For the youth of Punjab, kite flying symbolises the spirit of Basant. Let your joy soar but please do not use the deadly China string which costs innocent lives. Let this festival be about joy, kindness and compassion. https://t.co/F6giDPzCNQ"
2020-01-30 21:48:16+00:00,"RT @AgnesClackett: Are Western Corporations Knowingly Profiting from China's Uyghur Organ Harvesting?

CJ Werleman examines the role of wes…",Sk_Zub,"Maharashtra, India","‏‏‏‏‏‏ہم وہاں ہیں جہاں سے ہم کو بھی  ۔ 
      کچھ    ہماری    خبر    نہیں    آتی ",156,269,8851,False,"Are Western Corporations Knowingly Profiting from China's Uyghur Organ Harvesting?

CJ Werleman examines the role of western businesses in China’s persecution of its Muslim minority.

Byline Times https://t.co/gn0ZhExljp"
2020-01-30 21:47:53+00:00,RT @funder: How long until Trump asks China to investigate Mitt Romney or other Republicans? That’s the road we are headed on. This is luna…,GantMichael,"Indianapolis, Indiana","Friendmaker, Husband, Dad, Son, Brother, Athletic Sales Representative 4 @GearBoss_Wenger, Duke MBB Fan, RUSH Lover, Music Lover. Opinions here are my own.",2733,4563,61808,False,How long until Trump asks China to investigate Mitt Romney or other Republicans? That’s the road we are headed on. This is lunacy.
2020-01-30 21:45:54+00:00,"RT @cjwerleman: Arab leaders have failed Palestinians in their hour of need, the same way they’ve betrayed 8 million Muslims in Kashmir and…",abumushir2013,India,Male & Married 👨‍👩‍👧‍👦,551,302,205882,False,"Arab leaders have failed Palestinians in their hour of need, the same way they’ve betrayed 8 million Muslims in Kashmir and 13 million Muslims in China.

My latest for @TRTworld. https://t.co/Vew4aTs4hu"
2020-01-30 21:45:55+00:00,"RT @INCIndia: Made In China is the power of China's youth and I know that Made In India can compete with China. But for this, the youth nee…",AakashMahantIYC,"Chhattisgarh, India","!! 𝐀 𝐂𝐎𝐍𝐆𝐑𝐄𝐒𝐒𝐌𝐀𝐍 !!  🅲🅾🅽🆃🅰🅲🆃 +𝟫𝟣𝟨𝟤𝟨𝟦𝟩𝟥𝟥𝟦𝟦𝟨 
 
https://t.co/7mrKx2uBpG",2493,4006,68263,False,"Made In China is the power of China's youth and I know that Made In India can compete with China. But for this, the youth need to raise their voice and ask questions: Shri @RahulGandhi
#YuvaAakroshRally"
2020-01-30 21:45:58+00:00,"@awkwardgoogle Whatever we talk about China, This virus has show how quick &amp; helpful these people are. Together they are strong to be greater again. God bless👏",saurav9072,India,"Traveller, Thinker, Passionate,..lover of lord's gift..!",373,1378,584,False,No Value Mentioned
2020-01-30 21:45:59+00:00,RT @INCIndia: We have to bring back India’s dignity in the world. India will compete with China with love and Made In India can again defea…,AakashMahantIYC,"Chhattisgarh, India","!! 𝐀 𝐂𝐎𝐍𝐆𝐑𝐄𝐒𝐒𝐌𝐀𝐍 !!  🅲🅾🅽🆃🅰🅲🆃 +𝟫𝟣𝟨𝟤𝟨𝟦𝟩𝟥𝟥𝟦𝟦𝟨 
 
https://t.co/7mrKx2uBpG",2493,4006,68263,False,"We have to bring back India’s dignity in the world. India will compete with China with love and Made In India can again defeat Made In China: Shri @RahulGandhi
#YuvaAakroshRally"
2020-01-30 21:45:59+00:00,"RT @ThtKashmiriGuy: 1990 Kashmiri Hindu Genocide.
European Union keeps Quiet

Hindus being converted In Pak
European Union keeps Quite

Det…",BeingMaverick_,India,"Follows you;

not left or right just correct and politically incorrect",29,609,7259,False,"1990 Kashmiri Hindu Genocide.
European Union keeps Quiet

Hindus being converted In Pak
European Union keeps Quite

Detention camps in China
European Union keeps Quite

Article370 CAA &amp; NRC
All internal matters of India

And suddenly EU is concerned about Humanity &amp; human rights"
2020-01-30 21:45:29+00:00,"RT @cjwerleman: Arab leaders have failed Palestinians in their hour of need, the same way they’ve betrayed 8 million Muslims in Kashmir and…",anshsharma,India,Love | Passion | Life | Sarcastic | Scorpio | Music | Coffee | Not Highly Educated. | Autodidact | Gamer | co-creator | it's always better when we are together.,677,0,127358,False,"Arab leaders have failed Palestinians in their hour of need, the same way they’ve betrayed 8 million Muslims in Kashmir and 13 million Muslims in China.

My latest for @TRTworld. https://t.co/Vew4aTs4hu"
2020-01-30 21:45:34+00:00,"Europe evacuation flight off to China, cruise ship checked – Times of India https://t.co/U3KXAxw7mI",AjayStfc,india,Let’s follow each other!😉,282,157,9118,False,No Value Mentioned
2020-01-30 21:44:48+00:00,RT @spectatorindex: BREAKING: Italy halts flights to and from China,Rashido,Indiana,"Puerto Rican in Indiana. Catholic. MA in political econ @nyuniversity, MS Stats & PhD candidate @IUBloomington. Visiting instructor @WabashCollege.",809,630,26312,False,BREAKING: Italy halts flights to and from China
2020-01-30 21:44:25+00:00,"RT @SriSri: The #ChineseNewYear was celebrated in @BangaloreAshram with a large group from China, Hong Kong, Malaysia &amp; Taiwan. https://t.c…",gautam_pea,"Mumbai, India","Spirituality is the soul of all religions,  Debator,Founder at Volunteers for Animal Rights and Sustainable Development (VARSD)",302,1922,12107,False,"The #ChineseNewYear was celebrated in @BangaloreAshram with a large group from China, Hong Kong, Malaysia &amp; Taiwan. https://t.co/TVnGDUYRpo"
2020-01-30 21:43:17+00:00,RT @OpIndia_com: Ilyas Sharafuddin has stated that Allah has punished the Chinese by unleashing Corona virus on them for their brutal crack…,gautam_pea,"Mumbai, India","Spirituality is the soul of all religions,  Debator,Founder at Volunteers for Animal Rights and Sustainable Development (VARSD)",302,1922,12107,False,"Ilyas Sharafuddin has stated that Allah has punished the Chinese by unleashing Corona virus on them for their brutal crackdown on Uighur Muslims
https://t.co/zzVJ2Ztxrr"
2020-01-30 21:41:56+00:00,"RT @cjwerleman: Arab leaders have failed Palestinians in their hour of need, the same way they’ve betrayed 8 million Muslims in Kashmir and…",IMRANKHANMOGUL,India,"Staunch Muslim loves ❤ #Islam, #India & @INCindia. Political critic. Peace lover. Human Rights. Self Respect. Equality. Justice for #Kashmir #FreePalestine🇵🇸",618,1626,72896,False,"Arab leaders have failed Palestinians in their hour of need, the same way they’ve betrayed 8 million Muslims in Kashmir and 13 million Muslims in China.

My latest for @TRTworld. https://t.co/Vew4aTs4hu"
2020-01-30 21:40:57+00:00,"RT @cjwerleman: Arab leaders have failed Palestinians in their hour of need, the same way they’ve betrayed 8 million Muslims in Kashmir and…",skonarauto,Dominican republic&India ,Korean used vehicles,145,1234,7280,False,"Arab leaders have failed Palestinians in their hour of need, the same way they’ve betrayed 8 million Muslims in Kashmir and 13 million Muslims in China.

My latest for @TRTworld. https://t.co/Vew4aTs4hu"
2020-01-30 21:40:43+00:00,"RT @DrTedros: I am declaring a public health emergency of international concern over the global outbreak of #2019nCoV, not because of what…",RaviKapoor,"New Delhi, India","Admirer: @DeepikaPadukone's strength, @GulPanag's dimples, and @IamSRK's humor. #COVID19 Reporter. Digital PR Consultant. Minimalist. Mail: callravi@gmail.com",15628,7187,150200,False,"I am declaring a public health emergency of international concern over the global outbreak of #2019nCoV, not because of what is happening in #China, but because of what is happening in other countries.
https://t.co/HNrxyGeoBA"
2020-01-30 21:39:51+00:00,"@atlantech1966 @DonaldJTrumpJr @RandPaul Ask yourself this: If Obama asked China to investigate Mitt Romney in 2012, would that bother you? The electorate pendulum will swing back to the left at some point. Are you really okay with a Dem POTUS asking a foreign power to investigate their political opponents? I'm not.",DanielleAmes10,"Indiana, USA","Liberal, Wife of 82nd Airborne Veteran, Mother, Millennial, ASD & Animal advocate, writer. #resist #FBR #FuckTrump #VoteBlueNoMatterWho #NeverthelessWePersist",7480,7223,29618,False,No Value Mentioned
2020-01-30 21:39:32+00:00,RT @Lipper_Alpha: What is China's true vacancy rate? @fathommacro explores in this week's News in Charts: https://t.co/sYXivNU8Jp https://t…,Debajit27853884,"Mumbai, India",Senior Precious Metals Analyst in GFMS Refinitiv in India,95,60,372,False,What is China's true vacancy rate? @fathommacro explores in this week's News in Charts: https://t.co/sYXivNU8Jp https://t.co/jcIEpvwXob
2020-01-30 21:39:43+00:00,"RT @MisterAntiBully: *Unzips Chinas pants
This is an unprecedented outbreak
*Massages Chinas balls
We are declaring a public health emergen…",JimmyLewis1132,Indiana,woah,56,302,2998,False,"*Unzips Chinas pants
This is an unprecedented outbreak
*Massages Chinas balls
We are declaring a public health emergency
*Doesn't limit travel or trade
Human to human transmissions are worrying us
*Swallows the load
Please don't be mean to China. https://t.co/x0LXLdvsEf"
2020-01-30 21:39:13+00:00,"RT @majorgauravarya: Pakistan not to evacuate its citizens from virus-hit Wuhan to show solidarity. Until now, Pakistan had only sold its n…",MuraleeSure,"Hyderabad, India","Humanity is above All, live young, live life help the deserving needy",196,343,44827,False,"Pakistan not to evacuate its citizens from virus-hit Wuhan to show solidarity. Until now, Pakistan had only sold its national assets to China. Now it is selling its citizens, too. 

Leaving its citizens to die so that money continues to flow in from China. https://t.co/HlUX6zPYNb"
2020-01-30 21:39:24+00:00,RT @OpIndia_com: Ilyas Sharafuddin has stated that Allah has punished the Chinese by unleashing Corona virus on them for their brutal crack…,sri_ranchi_wale,India,Sanghi. Fascist. Nazist. Aur kuchh....?,260,494,10569,False,"Ilyas Sharafuddin has stated that Allah has punished the Chinese by unleashing Corona virus on them for their brutal crackdown on Uighur Muslims
https://t.co/zzVJ2Ztxrr"
2020-01-30 21:38:15+00:00,RT @spectatorindex: BREAKING: Italy halts flights to and from China,Addicted2Tarak,"Kurnool, India ↔️ Melbourne",@tarak9999 ❤️❤️❤️,1838,272,58304,False,BREAKING: Italy halts flights to and from China
2020-01-30 21:36:58+00:00,"RT @majorgauravarya: Pakistan not to evacuate its citizens from virus-hit Wuhan to show solidarity. Until now, Pakistan had only sold its n…",gautam_pea,"Mumbai, India","Spirituality is the soul of all religions,  Debator,Founder at Volunteers for Animal Rights and Sustainable Development (VARSD)",302,1922,12107,False,"Pakistan not to evacuate its citizens from virus-hit Wuhan to show solidarity. Until now, Pakistan had only sold its national assets to China. Now it is selling its citizens, too. 

Leaving its citizens to die so that money continues to flow in from China. https://t.co/HlUX6zPYNb"
2020-01-30 21:36:38+00:00,"RT @cjwerleman: China holds millions of Muslims in concentration camps, where they are subjected to vicious cruelty, including torture, gan…",khwaish321,Indian Occupied Kashmir,No Value Mentioned,184,173,3705,False,"China holds millions of Muslims in concentration camps, where they are subjected to vicious cruelty, including torture, gang rape &amp; worse, while many are executed to supply global demand for organ transplants.

That it barely raises to the level of a news story is something else."
2020-01-30 21:35:53+00:00,"RT @atrupar: Rep. Crow just ran a video montage of Trump's ""evolution of solicitation"" of foreign governments over the years, starting with…",IntjMadness,"Indiana, USA","Green hedgewitch, gamer, book enthusiast. Made myself into the person I needed when I was little. Aspiring writer, never let anyone read my work.",48,564,2236,False,"Rep. Crow just ran a video montage of Trump's ""evolution of solicitation"" of foreign governments over the years, starting with ""Russia if you're listening"" and ending with Trump publicly calling for China and Ukraine to investigate the Bidens last October https://t.co/NuFI2TwmT3"
2020-01-30 21:35:55+00:00,"RT @DrTedros: I am declaring a public health emergency of international concern over the global outbreak of #2019nCoV, not because of what…",MrGladPortBlair,"Andaman Nicobar Islands, India","Editor-in-Chief, Hawk Eye, English Daily & guest Newscaster at All India Radio (AIR), Port Blair, A&N Islands",1395,199,14982,False,"I am declaring a public health emergency of international concern over the global outbreak of #2019nCoV, not because of what is happening in #China, but because of what is happening in other countries.
https://t.co/HNrxyGeoBA"
2020-01-30 21:35:25+00:00,British Airways halts China flights for a month https://t.co/OYk8ngQpNU,Vsplusonline,INDIA,Web Hosting India | Web Hosting Space Unlimited | Free Domain Registration | Top Hosting India | Unlimited Domains | Reseller | VPS | Dedicated Server,148,32,37715,False,No Value Mentioned
2020-01-30 21:35:12+00:00,"RT @DrTedros: In many ways, #China is actually setting a new standard for outbreak response. Our greatest concern is the potential for the…",MrGladPortBlair,"Andaman Nicobar Islands, India","Editor-in-Chief, Hawk Eye, English Daily & guest Newscaster at All India Radio (AIR), Port Blair, A&N Islands",1395,199,14982,False,"In many ways, #China is actually setting a new standard for outbreak response. Our greatest concern is the potential for the virus to spread to countries with weaker health systems, and which are ill-prepared to deal with it. #2019nCoV
https://t.co/GdUQZGvzkd"
2020-01-30 21:35:19+00:00,New post (British Airways halts China flights for a month) has been published on ApzWeb - https://t.co/OYk8ngQpNU,Vsplusonline,INDIA,Web Hosting India | Web Hosting Space Unlimited | Free Domain Registration | Top Hosting India | Unlimited Domains | Reseller | VPS | Dedicated Server,148,32,37715,False,No Value Mentioned
2020-01-30 21:34:25+00:00,"RT @kesar_akankasha: ""India, and with it Hinduism, is paying for its broad-mindedness and tolerance, while China and Pakistan are being rew…",filmbuff1611,India,"🇮🇳 | Trekker | Reader | Animal Lover | Feminist | Ex-Leftist | Proud Hindu-Atheist (Nope, it’s not an oxymoron)",742,2247,40913,False,"""India, and with it Hinduism, is paying for its broad-mindedness and tolerance, while China and Pakistan are being rewarded for their intolerance.""

~Dr. @Koenraad_Elst"
2020-01-30 21:34:26+00:00,"Bad news apparently on the horizon for the United States, as a China virus has made its way here. It has spread from person-to-person, with six already affected by it.

Full Story via Journal Gazette (URL: https://t.co/Dltc0fHTWe)",jctslice,"Fort Wayne, Indiana",Senior Communications Major at Purdue Fort Wayne University,73,138,1259,False,No Value Mentioned
2020-01-30 21:34:27+00:00,"RT @WHO: @DrTedros @WHOWPRO @WHOSEARO @pahowho @WHO_Europe @WHOEMRO @WHOAFRO ""The speed with which #China detected the outbreak, isolated t…",raja_2619,"Ludhiana, India","Dog lover , CA Final Student !",43,560,5601,False,"@DrTedros @WHOWPRO @WHOSEARO @pahowho @WHO_Europe @WHOEMRO @WHOAFRO ""The speed with which #China detected the outbreak, isolated the virus, sequenced the genome and shared it with WHO and the world are very impressive. So is 🇨🇳’s commitment to transparency and to supporting other countries""-@DrTedros #2019nCoV"
2020-01-30 21:34:35+00:00,"RT @WHO: @DrTedros @WHOWPRO @WHOSEARO @pahowho @WHO_Europe @WHOEMRO @WHOAFRO ""There are now 98 #2019nCoV cases in 18 countries outside #Chi…",raja_2619,"Ludhiana, India","Dog lover , CA Final Student !",43,560,5601,False,"@DrTedros @WHOWPRO @WHOSEARO @pahowho @WHO_Europe @WHOEMRO @WHOAFRO ""There are now 98 #2019nCoV cases in 18 countries outside #China, including 8 cases of human-to-human transmission in four countries: Germany, Japan, Viet Nam and the United States of America""-@DrTedros"
2020-01-30 21:34:09+00:00,RT @spectatorindex: BREAKING: Italy halts flights to and from China,rebellious230,"Mumbai, India",Consistently Inconsistent. Endorsements did not require RTing ;),211,614,109292,False,BREAKING: Italy halts flights to and from China
2020-01-30 21:34:19+00:00,@JackPosobiec It is China we will never hear anything about it if it happens,mj1356,Indianapolis,"Do or do not, there is no try.--  Yoda",124,99,7377,False,No Value Mentioned
2020-01-30 21:27:11+00:00,"@rick_hennig @CBSNews Does this mean Ivanka applying for trademarks in China, is really saying she doesnt care about America?
Trying to understand the logic of the smooth brains is hard. https://t.co/bWqJkk2nuK",BlazeRuzzo,Indiana,A freedom loving American millennial in Indiana. I RT to much. Will follow back :) #ClimateChange #In5 #Vote2020 #resistance,429,935,8219,False,No Value Mentioned
2020-01-30 21:27:17+00:00,"RT @detresfa_: #WuhanCoronavirus pressure mounting up on construction workers, fights break out on site as the race against time to build t…",Pobbathi_Venku,"Hyderabad, India","Pls donate to #BharatKeVeer
https://t.co/WhEMe2bnaW",574,3449,314314,False,"#WuhanCoronavirus pressure mounting up on construction workers, fights break out on site as the race against time to build the first #coronarvirus hospital in #Wuhan continues

Wonder if #China's ""live site video"" streamed the fight for millions of international viewers 🤔 https://t.co/RdO1iSA50e"
2020-01-30 21:26:47+00:00,"RT @cjwerleman: Arab leaders have failed Palestinians in their hour of need, the same way they’ve betrayed 8 million Muslims in Kashmir and…",BaagRafiuddin,"Gulbarga, India","Businessman,Social activist and Politician above all iam a proud Indian muslim",295,909,11049,False,"Arab leaders have failed Palestinians in their hour of need, the same way they’ve betrayed 8 million Muslims in Kashmir and 13 million Muslims in China.

My latest for @TRTworld. https://t.co/Vew4aTs4hu"
2020-01-30 21:26:24+00:00,"RT @shri8354: Abolish I-T, maintain 10% GDP for a decade to beat China: Dr @Swamy39 in Surat
I see Dr.@Swamy39 ji is the only one who is go…",NarenSrivstava,"Bengaluru, India",MaiBhiChowkidar,32,149,557,False,"Abolish I-T, maintain 10% GDP for a decade to beat China: Dr @Swamy39 in Surat
I see Dr.@Swamy39 ji is the only one who is going round the country &amp; explaining how current #EconomicCrisis can be solved. He is the one who is giving hope to the masses!
https://t.co/tAQN5y2F64"
2020-01-30 21:26:08+00:00,ITALY'S PM CONTE SAYS ITALY HAS BLOCKED AIR TRAFFIC BETWEEN CHINA AND ITALY https://t.co/j0pblnsxWP,macroguru9,Hong Kong Dubai Bali India,"CIO at Macro Family Office, Ex Sell side EM Trader. 
Wharton Alumni
Supporter of Indian Cricket & Modi.
Not a signal seller
We do managed accounts.",3498,1123,10197,False,No Value Mentioned
2020-01-30 21:25:48+00:00,"@DaveWoodwardAC It's really sad. Due to mistakes by people , now a lot of people at risk. Hope it ends soon. But real question is ""Will it change any of the way people go by in China"" ?",Abhishek_Myth,"Orissa, India",Forever Single And Only PC Game And Hardware are Interest and bit of Console gaming too.  😁,783,1472,51225,False,No Value Mentioned
2020-01-30 21:25:33+00:00,RT @wheelchairswag1: The demorats socialist party at it again. Who is voting for these communist. Anything that mirrors China has no place…,ruffedge," Indiana, USA","🇺🇸Free speech and individual liberty🇺🇸  

🇺🇸I'M STILL VOTING FOR TRUMP🇺🇸

#MAGA  #Trump2020
 
Follow Back Patriots

Little patience with Grammer Nazis",19593,18577,61233,False,"The demorats socialist party at it again. Who is voting for these communist. Anything that mirrors China has no place in America #MAGA #TRUMP2020
❤️🇺🇲♿🇺🇲

Democrats Kill Amendment Protecting Americans from Credit Discrimination Based on Politics, Religion https://t.co/gDJp6WYyuK"
2020-01-30 21:24:55+00:00,"RT @mindthiskapoor: Just imagine You order Mask for protection against Corona Virus and come to know , it being shipped from China 🤔",AavaariBanjaarn,"New Delhi, India",Artist & Designer Insta : @/aavaariart @/aavaariofficial @/aavaaribanjaaran,1784,1167,11976,False,"Just imagine You order Mask for protection against Corona Virus and come to know , it being shipped from China 🤔"
2020-01-30 21:24:10+00:00,WHO declares global emergency as China virus death toll reaches 170 https://t.co/jdex02u0qg,moomblr,"Mumbai, India","Information at your fingertips from top social media news on topics to share on Facebook, YouTube, Google, Twitter and More.",1144,1921,241645,False,No Value Mentioned
2020-01-30 21:23:52+00:00,RT @TOIWorld: Pakistan not to evacuate its citizens from virus-hit Wuhan to show 'solidarity' with China: Official https://t.co/vOI8XkEOp0,MuraleeSure,"Hyderabad, India","Humanity is above All, live young, live life help the deserving needy",196,343,44827,False,Pakistan not to evacuate its citizens from virus-hit Wuhan to show 'solidarity' with China: Official https://t.co/vOI8XkEOp0
2020-01-30 21:22:13+00:00,RT @chitraSD: #China is a very powerful country in geopolitics. #WHO’s weight is rather limited even in the multilateral health world. Coun…,SitanshuDesai,India ,"This Bird Tweets Less But , Likes Other Tweeting . #NaModified",460,1287,172654,False,#China is a very powerful country in geopolitics. #WHO’s weight is rather limited even in the multilateral health world. Countries will now have to fend for themselves. #CoronavirusOutbreak
2020-01-30 21:21:51+00:00,"RT @ThtKashmiriGuy: 1990 Kashmiri Hindu Genocide.
European Union keeps Quiet

Hindus being converted In Pak
European Union keeps Quite

Det…",ArjunDares,India,Proud Indian | Proud Hindu | Believe in Sanatana Dharma | All lives Matter,351,253,100212,False,"1990 Kashmiri Hindu Genocide.
European Union keeps Quiet

Hindus being converted In Pak
European Union keeps Quite

Detention camps in China
European Union keeps Quite

Article370 CAA &amp; NRC
All internal matters of India

And suddenly EU is concerned about Humanity &amp; human rights"
2020-01-30 21:21:53+00:00,RT @ankur_16n: Moron they don't have symptons it's just that they returned from China and have been kept in isolation to observe them to av…,twtlikeakhiladi,"Punjab, India",Punjabi |Respect Indian army |Nation first | An Akshay kumar fan | Engineer,4031,2544,240045,False,"Moron they don't have symptons it's just that they returned from China and have been kept in isolation to observe them to avoid any future issues.
Fake News spread karke khud atmosphere kharab karte hai. https://t.co/LL8mD8JaQQ"
