created_at,full_text,screen_name,location,description,followers_count,friends_count,statuses_count,verified,full_retweet_text
2020-02-05 13:00:03+00:00,"RT @WilliamYang120: Latest on #coronavirus - The total number of cases has risen to 23673, a more than 3000 increase from the day before. T…",MoncyKurian,India,"29, straightoutta90s, #AEROGEEK luchando por mantenerse informado, Mallu in #mumbai techgeek",165,2226,17342,False,"Latest on #coronavirus - The total number of cases has risen to 23673, a more than 3000 increase from the day before. The number of suspected cases is at 23214, and the total death toll is now at 490. 688 people have reportedly recovered from the infection. https://t.co/OyckLdhQz6"
2020-02-05 13:00:03+00:00,Kerala tackling coronavirus with experience drawn from fighting Nipah https://t.co/aDn4wIyVr3,TOIKochiNews,"Cochin, India",Your city. Your neighborhood. Your block. Covered for you by https://t.co/VSKi1mCAsZ,1132,24,21979,True,No Value Mentioned
2020-02-05 13:00:06+00:00,"RT @tejimandi1: India continues to rally post the budget.With corona virus and slowdown in Asia, India might continue to outperform given t…",Khemchandjoya,"Jodhpur, India","MR INDIA , MR EASTERN INDIA, IIT(ISM) Dhanbad, Electronic and instrumentation engineer",328,347,26378,False,"India continues to rally post the budget.With corona virus and slowdown in Asia, India might continue to outperform given that it is now increasingly becoming a safe haven for emerging market funds.   Crude coming off to $54 definitely helps. 
#teji for Indian markets"
2020-02-05 13:00:07+00:00,"ETAuto | Coronavirus fear grips Auto Expo 2020, masks all over https://t.co/Gwoo19kS0J",ETAuto,"New Delhi, India","The Economic Times, The No.1 Business Daily In India, is your most trusted resource on #cars #bikes & #automobiles",27096,96,77107,False,No Value Mentioned
2020-02-05 13:00:07+00:00,"RT @fayedsouza: Dr Sanjeev Mehta of Lilavati: ""The Govt's advisory to prevent CoronaVirus using Ayurveda is not the truth. There is no cure…",Knowingly_UNKWN,🇮🇳India,No Value Mentioned,39,335,4832,False,"Dr Sanjeev Mehta of Lilavati: ""The Govt's advisory to prevent CoronaVirus using Ayurveda is not the truth. There is no cure or prevention know right now"" 

Watch full conversation here: https://t.co/WsbJyotYOv https://t.co/1F4ali1NLn"
2020-02-05 13:00:14+00:00,RT @ShashiTharoor: Moving. “Love In The Time of Coronavirus “.,Krishna51235573,"Kerala, India","Hai, I am an Engineer providing air conditioning to variety of buildings, interested in music, football and politics.., Wishes good for all... always",102,244,10317,False,Moving. “Love In The Time of Coronavirus “. https://t.co/YBfzUWKJNJ
2020-02-05 13:00:15+00:00,"RT @HUNTER__SINGH: Hirani 3I ka credit le gya 
Bauna fr ghar pe.

Zaira aur Fatima china le gyee sadme se ubharne ke liye.

Gave biggest di…",SRKianYash_,India,"Fan Of KingKhan @iamsrk 

𝐒𝐑𝐊 𝐈𝐬 𝐋𝐨𝐯𝐞 ❤️


Bhakts Not Allowed 🖕


💯% Follow back",872,780,23009,False,"Hirani 3I ka credit le gya 
Bauna fr ghar pe.

Zaira aur Fatima china le gyee sadme se ubharne ke liye.

Gave biggest distributors loss of the decade with TOH

Now doing remakes for roji roti 

Epic saga oF The Batla Warrior https://t.co/HH8CXOQecd"
2020-02-05 13:00:15+00:00,I love Corona...i mean beer.,shashankjaitely,"Gurgaon, India",Modern marketer   l   Ancient soul   l   On a perpetual quest   l    Tweets are personal views.,1250,2382,15764,False,No Value Mentioned
2020-02-05 13:00:17+00:00,"LabCorp/Covance update on #Coronavirus 

#healthcare https://t.co/XghCN0dsQv",NiharG1,"Bangalore, India","Employer Branding, Talent Engagement & Candidate Experience, Employee Experience, Recruitment Marketing, Social Media",135,283,906,False,No Value Mentioned
2020-02-05 13:00:20+00:00,"CORONA Virus is now in India: How safe are we?
Read to know more.

#Coronavirus #Coronavirusinindia #Coronavirusoutbreak #Coronaviruses #Coronavirus2020
 https://t.co/YKtO7tHYZW",TribecaCare,"Kolkata, India","From 24x7 Emergency Support to Home Care, Senior Travel to Club Tribeca, we support seniors in every aspect of their lives. Begin a new life with us!",107,951,650,False,No Value Mentioned
2020-02-05 13:00:29+00:00,"RT @fakingnews: Coronavirus enters Arnab’s debate show, team of doctors called in to save Coronavirus https://t.co/RqwLiEbP1Q",SekarRathin,"Bangalore, India","Engineer, Optimist, Believes India is changing for the better, Believes world is changing for the better",27,42,4867,False,"Coronavirus enters Arnab’s debate show, team of doctors called in to save Coronavirus https://t.co/RqwLiEbP1Q"
2020-02-05 13:00:42+00:00,@DailyPakistan Are you going to pick your people from China ???,dilermikka,India,No Value Mentioned,249,2870,3290,False,No Value Mentioned
2020-02-05 13:00:53+00:00,RT @benedictrogers: China’s Global Human-Rights Whitewash by Aryeh Neier @ProSyn https://t.co/nNfrVzjghB,tkdb10,"Dharamshala, India",trying to practice compassion in daily life,438,258,6317,False,China’s Global Human-Rights Whitewash by Aryeh Neier @ProSyn https://t.co/nNfrVzjghB
2020-02-05 13:01:01+00:00,"A newborn in #China's Wuhan has tested positive for the #coronavirus, Chinese media said on Wednesday, adding that the development has caused concerns that the ""infection could be contracted in the womb"" https://t.co/PTOKEjr1O5",thefirstindia,"Jaipur, India",Welcome to the Official Twitter page of First India Newspaper. Follow us for the latest updates. #FirstIndia,3910,189,31747,False,No Value Mentioned
2020-02-05 13:01:14+00:00,"RT @TimesNow: Coronavirus LIVE UPDATES: Suspected case of coronavirus in Haryana; Trump says US coordinating with China.

https://t.co/XhoZ…",SharmisthaDatt9,"Kolkata, India",I respect the interests of future generations,78,42,6166,False,"Coronavirus LIVE UPDATES: Suspected case of coronavirus in Haryana; Trump says US coordinating with China.

https://t.co/XhoZCEy2JD"
2020-02-05 13:01:18+00:00,RT @enricomolinari: Hong Kong government introduced electronic bracelets to track people placed under home quarantine in a bid to contain t…,sectest9,"Hyderabad, India",News Hub! Get the latest Security News & Updates!,30339,1,1758038,False,"Hong Kong government introduced electronic bracelets to track people placed under home quarantine in a bid to contain the #coronavirus TY @QuickTake via @enricomolinari #ehealth #wearables #IoT

@Paula_Piccard @MikeQuindazzi @SpirosMargaris @ipfconline1 @sallyeaves @jblefevre60 https://t.co/8ohdoEAh9H"
2020-02-05 13:01:18+00:00,US President Donald Trump delivers his third State of the Union Address in Washington DC says we are working on Coronavirus outbreak in China https://t.co/mv5gzDRRoW https://t.co/MVwU1yEWKM,Pawan05258Kumar,"Goa, India","part time web designer, music lover",488,34,16657,False,No Value Mentioned
2020-02-05 13:01:21+00:00,"Two planes carrying 350 American coronavirus evacuees from Wuhan, China, land at Travis Air Force Base in California via FOX NEWS",beeplusmind,"Tamil Nadu, India","Hi nice to meet you,  I'm finished PG course , now I'm doing tax consultant course and I'm doing market analyzing and trend productions work. I'm 32+ thank you",3,1,2204,False,No Value Mentioned
2020-02-05 13:01:22+00:00,Özil's agent talked about how they lost deal with Arsenal China after Mesut spoke against CCP for uighur atrocities.,Winkerbell_,"Bengaluru, India",good economics takes and banter,4764,444,64300,False,No Value Mentioned
2020-02-05 13:01:26+00:00,"RT @PTI_News: Two persons, including two-year-old boy, admitted to hospital in MP's Indore district for possible exposure to novel #coronav…",abhic4ever,India,"writer (of my blogposts), thinker (of my blogposts),reader (of my blogposts).


'grammar typoist'",3002,551,169007,False,"Two persons, including two-year-old boy, admitted to hospital in MP's Indore district for possible exposure to novel #coronavirus: Officials"
2020-02-05 13:01:28+00:00,"RT @DiMartinoBooth: Wilted flowers, empty cafes: China's small businesses bear coronavirus costs

SMEs pose “threat to China's economy, gro…",karagis75,"Chennai, India","All my tweets are my personal view.. I love to explore latest technology and sharing my learning with others.
I would like to learn from trading experts",300,563,36825,False,"Wilted flowers, empty cafes: China's small businesses bear coronavirus costs

SMEs pose “threat to China's economy, growing slowest in 3 decades. SMEs contribute &gt;1/2 of China's tax revenues, 2/3 of economic output &amp; 8 of 10 urban jobs”

ht ⁦@chigrl⁩ https://t.co/LypmdvNJ5R"
2020-02-05 13:01:28+00:00,"RT @DesireeWolf182: @dailydot I made a gajinka out of the coronavirus, called corona chan. Dare you to stop me. https://t.co/v04IDjPZoo",Hemorrhagician,"Indiana, USA","23/5 🐊 INTP
#AnimeRight",672,383,3911,False,"@dailydot I made a gajinka out of the coronavirus, called corona chan. Dare you to stop me. https://t.co/v04IDjPZoo"
2020-02-05 13:01:30+00:00,"Coronavirus: Symptoms, Prevention and treatment measures https://t.co/9y8x8Eq2Gb",hamaratimes,"New Delhi, India",No Value Mentioned,153,267,1929,False,No Value Mentioned
2020-02-05 13:01:33+00:00,"RT @united__UK: This isn’t just any small-time wiseguy — at one time, this mob boss was number two on the FBI’s “Ten Most Wanted” 
Joe Bide…",RPScott1,"Monticello, Indiana","Eagle Scout Retired DOJ/USMS DHS/FAM, MA, Adjunct Prof Indiana Univ. NW Dom & Intl Terrorism. Entrepreneur Scottland Yard Ent #NRA#2A",10396,10556,92209,False,"This isn’t just any small-time wiseguy — at one time, this mob boss was number two on the FBI’s “Ten Most Wanted” 
Joe Biden’s son, Hunter Biden, even used the family to strike up a $1.5 billion deal with communist China.

https://t.co/pDgrPG78Rp"
2020-02-05 13:01:36+00:00,"RT @ShibbuKumar16: Peoples of India, USA, China, Japan, England and all other country also must know this World Cancer Day 
#CureCancer_By_…",ramkeshdass,"New Delhi, India",No Value Mentioned,124,133,12870,False,"Peoples of India, USA, China, Japan, England and all other country also must know this World Cancer Day 
#CureCancer_By_TrueWorship
When Doctor had no hope for cancer patient
Just by taking initiation from
Saint Rampal Ji Maharaj get rid out of it... 
#coronaviruschina https://t.co/caZDi14BW6"
2020-02-05 13:01:48+00:00,"RT @DiMartinoBooth: Coronavirus: infant tests positive just 30 hours after birth | South China Morning Post

Wrinkles continue to emerge as…",karagis75,"Chennai, India","All my tweets are my personal view.. I love to explore latest technology and sharing my learning with others.
I would like to learn from trading experts",300,563,36825,False,"Coronavirus: infant tests positive just 30 hours after birth | South China Morning Post

Wrinkles continue to emerge as numbers disregarded due to containment. 

ht ⁦@BVantozzi⁩  https://t.co/0lOLxldYBh"
2020-02-05 13:01:50+00:00,medical students who came back from #China ahead of #nCoV2019 speak to @timesofindia @TOINagpur and share their views... https://t.co/AV4wZEs0us,ChaitanyadTOI,"Nagpur, India","Chaitanya Deshpande is a journalist with The Times of India Nagpur and writes on Health, Research, Technology and Agriculture. Views expressed are personal.",885,184,4081,False,No Value Mentioned
2020-02-05 13:01:58+00:00,@JacksonLeeTX18 Thank you for cosponsoring the Global Health Security Act which will increase the U.S. government’s efforts to support epidemic and pandemic preparedness and prevent threats of infectious disease outbreaks.,seespeakdo,"Indiana, USA","sher/her/hers Passionate about changing my situation, community, and world 🌎",223,3000,1727,False,No Value Mentioned
2020-02-05 13:02:05+00:00,RT @purnachaitanya: This weekend we completed a special Yoga Retreat for a group of Chinese participants. Followed by this we had a special…,VDSManoj,"Kalady, India",वसुधैव कुटुम्बकम ।।...Jai Gurudev.💐,168,810,2518,False,"This weekend we completed a special Yoga Retreat for a group of Chinese participants. Followed by this we had a special LIVE knowledge session with chanting &amp; meditation for @ArtofLiving members in China, with more than 1200 people joining in, feeling more peace &amp; relief. https://t.co/oRSjFwwenL"
2020-02-05 13:02:07+00:00,"RT @fayedsouza: Dr Sanjeev Mehta of Lilavati: ""The Govt's advisory to prevent CoronaVirus using Ayurveda is not the truth. There is no cure…",SakkeerSalman,INDIA,Graduating Naval-architecture and ship building engineering,14,346,242,False,"Dr Sanjeev Mehta of Lilavati: ""The Govt's advisory to prevent CoronaVirus using Ayurveda is not the truth. There is no cure or prevention know right now"" 

Watch full conversation here: https://t.co/WsbJyotYOv https://t.co/1F4ali1NLn"
2020-02-05 13:02:11+00:00,"RT @satyug20201: #NoMeat_NoCoronaVirus
China
God kabir
Saint Rampal ji maharaj
Those who consume meat and alcohol are violent by nature. Th…",sunnych65168044,"Kedarnath, Uttarakhand India",Speak less Say more.,184,719,5065,False,"#NoMeat_NoCoronaVirus
China
God kabir
Saint Rampal ji maharaj
Those who consume meat and alcohol are violent by nature. They are always malicious, lazy and sick.
Salvation is impossible for non vegetarians
#coronavirusindia
 https://t.co/IwCpcLmeWh"
2020-02-05 13:02:11+00:00,"Coronavirus toll nears 500, millions confined https://t.co/CiReEHVNC6 https://t.co/VMTMK0bA7p",somsirsa,"Chandigarh, India","Technophile, AI Faculty, Mental Health Advocate, @JUFET alum, 

Appointments at 👉
https://t.co/BzXQ3mIfBS",812,1714,361001,False,No Value Mentioned
2020-02-05 13:02:13+00:00,"RT @rajkumar8973: #NoMeat_NoCoronaVirus
Many diseases have to be faced due to intoxication such as meat diet and alcohol etc.
Just like in…",NaerndraM,"Gorakhpur, India",kabir is God,2,12,129,False,"#NoMeat_NoCoronaVirus
Many diseases have to be faced due to intoxication such as meat diet and alcohol etc.
Just like in the world today, China is battling cancer and the corona virus. https://t.co/rnwOmQxb9B"
2020-02-05 13:02:16+00:00,@RepMcGovern Thank you for cosponsoring the Global Health Security Act which will increase the U.S. government’s efforts to support epidemic and pandemic preparedness and prevent threats of infectious disease outbreaks.,seespeakdo,"Indiana, USA","sher/her/hers Passionate about changing my situation, community, and world 🌎",223,3000,1727,False,No Value Mentioned
2020-02-05 13:02:22+00:00,RT @ScottGottliebMD: THREAD: A brief review of Catch-22 when it comes to #Coronavirus and need for more diagnostic screening capability. Ho…,Deplorable22,Indiana,No Value Mentioned,1351,4359,15809,False,THREAD: A brief review of Catch-22 when it comes to #Coronavirus and need for more diagnostic screening capability. Hospitals can roll out RT-PCR based test CDC developed. They all have Roche systems to run these tests. The technology is fairly straightforward. Here’s the rub 1/9 https://t.co/lHIOqcbCSt
2020-02-05 13:02:22+00:00,"RT @Avinash_5537: Dettol knew about this CORONA VIRUS in 2019..
Surprising...?? 
Everything is planned...?? 
What do you think guyz?? 
🙄🤔🙄🤔…",Rj10WaleJaat,India,Proud Farmer,39,121,1186,False,"Dettol knew about this CORONA VIRUS in 2019..
Surprising...?? 
Everything is planned...?? 
What do you think guyz?? 
🙄🤔🙄🤔🙄🤔 https://t.co/ZSqOIrzQnm"
2020-02-05 13:02:24+00:00,"""Trapped on a Cruise Ship by the Coronavirus: When Is Breakfast?"" by BY EIMI YAMAMITSU AND BEN DOOLEY via NYT New York Times https://t.co/Eo6jC1pkLI",rajsuman110,"Jhalawar, India","Lighter and decoreter
blogger
digital marketer
YouTuber",67,57,19644,False,No Value Mentioned
2020-02-05 13:02:25+00:00,RT @Feeray: @somalijawn this is clearly live footage of how the coronavirus started https://t.co/Lb8quHvgLH,LOUD_besos,"Indiana, USA",Affliated Twitch Streamer that's an advocate of flattening the pandemic curve. Stay the fork home people.,6317,610,459032,False,@somalijawn this is clearly live footage of how the coronavirus started https://t.co/Lb8quHvgLH
2020-02-05 13:02:27+00:00,"RT @PTI_News: Two persons, including two-year-old boy, admitted to hospital in MP's Indore district for possible exposure to novel #coronav…",rakesh26329280,"Bihar, India",No Value Mentioned,1036,591,411125,False,"Two persons, including two-year-old boy, admitted to hospital in MP's Indore district for possible exposure to novel #coronavirus: Officials"
2020-02-05 13:02:27+00:00,"RT @Real_Heena: #NoMeat_NoCoronaVirus
Stop eating meat Corona Virus come from wild or domestic animals. 
One should never consume meat God…",NaerndraM,"Gorakhpur, India",kabir is God,2,12,129,False,"#NoMeat_NoCoronaVirus
Stop eating meat Corona Virus come from wild or domestic animals. 
One should never consume meat God is never happy 
with those who kill his beings. 
Must watch Sadhna TV 7:30 p.m.    Amber everyday 
🌺🌺🌺🌺🌺🌺🌺🌺🌺
https://t.co/S2qaCXO88j"
2020-02-05 13:02:29+00:00,ZTE and LG cancel MWC 2020 events citing coronavirus concerns https://t.co/LFkWvKywqg,OursWideWeb,India,This website fpr Letest update about Technology Gadgets Apps Games Social networking & Science.,4,57,656,False,No Value Mentioned
2020-02-05 13:02:38+00:00,damn that’s a punchable mug https://t.co/NCrT3wVdtl,litescript,"Indianapolis, IN",pretty quick in one direction. co-leader of D2 clan Morals.,630,1426,135492,False,No Value Mentioned
2020-02-05 13:02:40+00:00,"RT @PREETMEHTA1313: #NoMeat_NoCoronaVirus

Science could not stop Australia's fire.
 China is now unable to stop the corona virus.  Disaste…",NaerndraM,"Gorakhpur, India",kabir is God,2,12,129,False,"#NoMeat_NoCoronaVirus

Science could not stop Australia's fire.
 China is now unable to stop the corona virus.  Disaster can be averted only by spiritual knowledge. https://t.co/gF1PXQAAQS"
2020-02-05 13:02:41+00:00,"RT @JQ_plaintalk: After invading J&amp;K, killing, raping, looting, annexing parts of it, dividing it, gifting some to China, revoking the Stat…",akhil_glg,"Uttar Pradesh, India",Blessed Indian🇮🇳 || Mahadev ❤️❤️ ||Sanatani 🚩||#ModiBhakt😎|| #ProudSanghi || Afzal & Kanhaiya supporters stay away👊👊,413,529,18897,False,"After invading J&amp;K, killing, raping, looting, annexing parts of it, dividing it, gifting some to China, revoking the State Subject in Gilgit Baltistan, starting Terrorism in the Valley, Pakistan will celebrate all this tomorrow by observing ‘Kashmir Solidarity Day’. 

Fantastic!"
2020-02-05 13:02:41+00:00,"RT @thekorahabraham: I have said this last year during the Nipa outbreak and I'm saying this again - @shailajateacher,  health minister of…",Meenfryyyy,India,F*ck Hindu N*zis 🏳️‍🌈,469,1338,12990,False,"I have said this last year during the Nipa outbreak and I'm saying this again - @shailajateacher,  health minister of Kerala is someone we can all be proud of. 

Listening to her address the press in itself is calming and reassuring. She gives us the confidence that all is fine."
2020-02-05 13:02:43+00:00,"RT @yessirtns: MODI ji after Imran Khan refused to help PAKISTANI students from being evacuated from Wuhan...

😂🤣😂🤣

#DefExpo2020 https://t…",Ksingh561,India Delhi,"Hard core Modi Fan, Nationalist Indian. Followed by Shri Amit Shahji, Shri Kiran Rijue ji, Piyush Goyal , Ratan Shardaji, Shri Harsh Goenkaji, Shri Gaurav pradh",5186,4787,139664,False,"MODI ji after Imran Khan refused to help PAKISTANI students from being evacuated from Wuhan...

😂🤣😂🤣

#DefExpo2020 https://t.co/F5AC6qTEf7"
2020-02-05 13:02:52+00:00,"@kayzgal China??? Believe in GOD???
Reallyyy????",narayan_shank,"Bengaluru, India",90s kid|GCTian|Nadal|Enfield|CSK,146,342,626,False,No Value Mentioned
2020-02-05 13:02:55+00:00,"As the coronavirus continues its rapid spread, China continues to struggle ... Overall box office already took a big hit this weekend when Chinese cinemas ... The future of Hollywood releases in the market is currently unknown. ... The annual Spring Festival Gala on Friday drew https://t.co/hETLCm5cKL",GrepInfotech,India,We have 100+ employee who can provide #GuestPosting #whitehat #SEO #linkbuilding #Keywordresearch #ONsitewebsiteoptimization #Backlinkanalysis #Competitor,10,36,1473,False,No Value Mentioned
2020-02-05 13:02:59+00:00,"RT @iam_dkushwaha: #NoMeat_NoCoronaVirus
Pure bhakti spiritual knowledge se corona viruses so what diseases like cancer also end
For more i…",NaerndraM,"Gorakhpur, India",kabir is God,2,12,129,False,"#NoMeat_NoCoronaVirus
Pure bhakti spiritual knowledge se corona viruses so what diseases like cancer also end
For more information, watch Satsang by
JagatGuru Saint Rampal Ji Maharaj on Sadhna tv 07:30 pm
 https://t.co/v1u1UAHAUF"
2020-02-05 13:03:02+00:00,"RT @ndmaindia: Novel Coronavirus (2019-nCoV) advice for the public: #MythBusters #Coronavirus

Does the new coronavirus affect older people…",anandkarthick27,"Chennai, India","If you see something being done below standard and you do nothing about it, you have created a new standard.thats our Namo and New india",108,515,21976,False,"Novel Coronavirus (2019-nCoV) advice for the public: #MythBusters #Coronavirus

Does the new coronavirus affect older people, or are younger people also susceptible?

Courtsey - 
@WHO https://t.co/d2YnLkXE8o"
2020-02-05 13:03:03+00:00,"The momentum has picked by next week middle the number would cross a quarter million globally, devastation is eminent, #coronavirus https://t.co/LXuQ6LtiAN",KishorePrabhala,"#Guntur, India","Hindu college, BSEE-Purdue(1978-81), MSEE-Georgia Tech.(1989), CMOS VLSI-Silicon Valley-1981-94, Returned to India, Serving young, talented & poor, Care Animals",737,1990,29877,False,No Value Mentioned
2020-02-05 13:03:03+00:00,"RT @firstpost: A newborn in #China's Wuhan has tested positive for the #coronavirus, Chinese media said on Wednesday, adding that the devel…",vssutt,INDIA🇮🇳,"Sometimes, it's difficult to stand,
For things, you believe to be true...
And you can't make 'em understand,
The way you think & what are you..",41,702,3340,False,"A newborn in #China's Wuhan has tested positive for the #coronavirus, Chinese media said on Wednesday, adding that the development has caused concerns that the ""infection could be contracted in the womb""

https://t.co/YlGmc9OIcS"
2020-02-05 13:03:06+00:00,"RT @ndmaindia: Novel Coronavirus (2019-nCoV) advice for the public: #MythBusters #Coronavirus

Are there any specific medicines to prevent…",anandkarthick27,"Chennai, India","If you see something being done below standard and you do nothing about it, you have created a new standard.thats our Namo and New india",108,515,21976,False,"Novel Coronavirus (2019-nCoV) advice for the public: #MythBusters #Coronavirus

Are there any specific medicines to prevent or treat the new coronavirus?

Courtsey - 
@WHO https://t.co/cnNlE4tTVT"
2020-02-05 13:03:08+00:00,"RT @PREETMEHTA1313: #NoMeat_NoCoronaVirus
Stop eating meat, or else you will have to stop forcing, like China stopped meat with the corona…",NaerndraM,"Gorakhpur, India",kabir is God,2,12,129,False,"#NoMeat_NoCoronaVirus
Stop eating meat, or else you will have to stop forcing, like China stopped meat with the corona virus. https://t.co/9BUksnbcEB"
2020-02-05 13:03:14+00:00,"RT @RT_com: #Coronavirus leaves streets of #Shanghai, a city of  24mn people, deserted https://t.co/OjY0xdZCIW",IMRANKHANMOGUL,India,"Staunch Muslim loves ❤ #Islam, #India & @INCindia. Political critic. Peace lover. Human Rights. Self Respect. Equality. Justice for #Kashmir #FreePalestine🇵🇸",618,1634,73225,False,"#Coronavirus leaves streets of #Shanghai, a city of  24mn people, deserted https://t.co/OjY0xdZCIW"
2020-02-05 13:03:15+00:00,RT @moneycontrolcom: The World Health Organization has come out with a list of Frequently Asked Questions (FAQs) concerning the deadly dise…,hbk_prabhakar,"Ahmednagar, Maharashtra, India",wwe,155,668,4028,False,"The World Health Organization has come out with a list of Frequently Asked Questions (FAQs) concerning the deadly disease.

https://t.co/p7CwM0PYPl"
2020-02-05 13:03:21+00:00,RT @THM_Off: This is sick and insane..!!! #CoronaVirus,im_vasthan,"Tiruchirapalli, India",Vanakkam,456,64,6370,False,This is sick and insane..!!! #CoronaVirus https://t.co/lXIz6eFHmI
2020-02-05 13:03:24+00:00,"RT @desimojito: Zee News : Kapil Gujjar, the guy who open flred in Shaheen Bagh is an AAP member. 
Republic : Kejriwal exposed, Shaheen Bag…",sanjaymshra,India,"Sanatan Dharmi, Seeker, Believe in Vashudhaive Kutumbkam, Respect is luxury work hard to earn it. 
Differences in opinions is ok but Bullshit is not.",722,215,231975,False,"Zee News : Kapil Gujjar, the guy who open flred in Shaheen Bagh is an AAP member. 
Republic : Kejriwal exposed, Shaheen Bagh sh00ter is an AAP member 

NDTV : China is sending corona virus via emails and whatsapp"
2020-02-05 13:03:34+00:00,"@dr_gsharma @charliechancat 

getting ugly 🤔 https://t.co/b6d5IgZOz1",Be_Nationalist,New India ,"Defence, Military Conflicts Technology, Diplomacy, Governance, Economy ... #OSNIT, Data Mining, Hunting .. India First!🇮🇳🇮🇱🇺🇲",904,3728,31394,False,No Value Mentioned
2020-02-05 13:03:35+00:00,RT @freddie1999: VIDEO: Final preparations being made at the International Convention and Exhibition Center to receive #coronavirus detaine…,raviraj82006007,Kuwait-GCC@India,Sr.Mgmt.Professional. People & Performances are evolving always. Share ur wisdom. Opinions are personal & RTs are not endorsements.,46,125,2106,False,VIDEO: Final preparations being made at the International Convention and Exhibition Center to receive #coronavirus detainees https://t.co/JHcDZsxKjz #Wuhan #PRC 🇨🇳
2020-02-05 13:03:38+00:00,@PDChina Stay strong China,mahichimalapati,"Warangal-Hamamkonda, India","We are what we believe we are... 
♥️",5,83,3,False,No Value Mentioned
