created_at,full_text,screen_name,location,description,followers_count,friends_count,statuses_count,verified,full_retweet_text
2020-04-04 14:02:13+00:00,"RT @PrisonPlanet: More accurate estimates now say more than 40,000 died in China.

Their cover-up placed the world in peril and led to tens…",vsuke96,"Mumbai, India",Nothing you think matters matters,31,674,8285,False,"More accurate estimates now say more than 40,000 died in China.

Their cover-up placed the world in peril and led to tens of thousands of needless deaths.

Once this is over, a massive investigation should be launched and China should be forced to pay up for what they have done."
2020-04-04 14:02:14+00:00,"RT @Jali_Cat: 💥BEST NEWS OF THE DAY!

👉🏻Dr. Zelenko Has Now Treated 699 Coronavirus Patients w 100% SUCCESS RATE!

Hydroxychloroquine, Zinc…",cjcole1985,"Indiana, USA","Trump 2020 WWG1WGA 🇺🇸Pro life, NRA, for God, country and family! Feel honored to be followed by General Flynn ⭐️⭐️⭐️",5933,6350,95183,False,"💥BEST NEWS OF THE DAY!

👉🏻Dr. Zelenko Has Now Treated 699 Coronavirus Patients w 100% SUCCESS RATE!

Hydroxychloroquine, Zinc and Z-Pak!!

💯%Affordable treatment for everyone!!! Big Pharma giants will hate it because they can’t price gouge us to death!
https://t.co/UrOSn9WnA7"
2020-04-04 14:02:15+00:00,"RT @SirPareshRawal: When Corona Virus  is over, let’s spend our holidays in India, eat in local restaurants, buy local meats and veggies ,…",brahmbh3,India,Government and Politics Breaking News Business & CEOs Business and Financial News Government & Public Utilities Journalists News Politicians and Pol Parties,975,4562,66400,False,"When Corona Virus  is over, let’s spend our holidays in India, eat in local restaurants, buy local meats and veggies , buy clothes and shoes from indian brands and support local businesses. These businesses are going to find it very difficult to survive without our help."
2020-04-04 14:02:15+00:00,"@PMOIndia Sir, somany newspaper's says for railway booking starts from 15th april. Corona virus fastly spread by rail &amp; road transport. So m suggest for this, it would  not be start from before 30th april.",Amit98682169,"Kotdwara, India","Computer hardware professional having DES (Dell Exclusive Store), Lenovo Store  & HP World in Gateway of Uttarakhand.",34,146,128,False,No Value Mentioned
2020-04-04 14:02:16+00:00,"RT @arabnews: #BREAKING: More than 60,000 people have died worldwide from #coronavirus #StayAtHomeSaveLives https://t.co/pnhIp4V1nH https:/…",_Trump2020__,"Indiana, USA",#TrustTrump #MAGA #Trust #KAG #EndTheFed #2A #WWG1WGA  #Blessed #Cult45 #GodWins #DigitalSoldiers,9719,10212,236693,False,"#BREAKING: More than 60,000 people have died worldwide from #coronavirus #StayAtHomeSaveLives https://t.co/pnhIp4V1nH https://t.co/h9SMIx3qJY"
2020-04-04 14:02:16+00:00,"RT @_DigitalPolice: Prince Charles' Office Denies Indian Minister's Ayurveda Cure Of COVID-19. Isaac Mathai, who runs the Soukya Ayurveda R…",_IndianElection,"New Delhi, India","An Initiative Of @PTLB To Discuss Issues Of #EconomicDevelopment, Growth, Economy, #Elections Etc Of #IndianElections That Our Political Parties Never Fulfill.",43,0,4475,False,"Prince Charles' Office Denies Indian Minister's Ayurveda Cure Of COVID-19. Isaac Mathai, who runs the Soukya Ayurveda Resort in Bengaluru, said that his treatment of ""Prince Charles through ayurveda and homeopathy has been successful"". #DigitalIndia @IMPraveenDalal @P4LOIndia https://t.co/YLbfG3QeZp"
2020-04-04 14:02:16+00:00,RT @CMOMaharashtra: Singapore's Prime Minister announced that the country will impose a lockdown from Tuesday. The same measures being take…,TTeerandaz,India,"Reduce Reuse Recycle, 
Save The Planet Earth,
RT's are not endorsements.",502,2572,174371,False,"Singapore's Prime Minister announced that the country will impose a lockdown from Tuesday. The same measures being taken in India and Maharashtra are being replicated elsewhere. 

This means that regardless of the country, Virus and solution is the same, “staying at home.”"
2020-04-04 14:02:17+00:00,RT @sharmarekha: Had a fruitful interaction via video conferencing with @ilo delegation - Mr. Sasaki (Dy. Dir) &amp; other specialists &amp; Mr Sri…,pradeep999993,India,"An ordinary https://t.co/3zwNLZf0QA my country the most and  the persons who work for my nation selflessly,honestly and dedicatedly.",670,4047,51086,False,"Had a fruitful interaction via video conferencing with @ilo delegation - Mr. Sasaki (Dy. Dir) &amp; other specialists &amp; Mr Srinivas (DG, @VVGNLI1) &amp; on an immediate action plan along wd my officials to help migrant #women workers across the country in the wakeof #Covid_19 outbreak. https://t.co/WKAJEyypjC"
2020-04-04 14:02:17+00:00,"RT @RahulGandhi: India is simply not testing enough to fight the #Covid19 virus. 

Making people clap &amp; shining torches in the sky isn't go…",Libin_Raj_M,"marthandam, india",No Value Mentioned,198,571,25653,False,"India is simply not testing enough to fight the #Covid19 virus. 

Making people clap &amp; shining torches in the sky isn't going to solve the problem. https://t.co/yMlYbiixxW"
2020-04-04 14:02:17+00:00,"RT @CMOMaharashtra: Like Coronavirus there is another virus that is emerging which is threatening social harmony, the virus of fake news &amp;…",Jagadis54632103,"visakhapatnam, India",Spread love 💓💓 .....Nature lover 🏞.... photography lover 📸🎥...loves ancient Temple's.,157,330,8495,False,"Like Coronavirus there is another virus that is emerging which is threatening social harmony, the virus of fake news &amp; communal hatred."
2020-04-04 14:02:19+00:00,"Here is #Mahammari full video song.

➡️https://t.co/hEACiGvq48

A special song on #CoronaVirus by Music Director @kuncheraghu

Lyrics by @sirasri
#StayHomeStaySafe
#CoronaLockdown",V6_Suresh,"Hyderabad, India","Reporter, Entertainment Journo & Reviewer at @V6News.
PRO, Movie Buff.Views Are Purely Personal.",42408,335,41394,False,No Value Mentioned
2020-04-04 14:02:19+00:00,RT @noconversion: Not a SINGLE christian PASTOR has gone to any hospital to do MIRACLE Cure ...#Coronavirus has   exposed #Christian  FRAUD,adityasaxena200,"Meerut, India",Start Up Soon◆My Ten Thousand Generation will Remain HINDU◆Ex-Secular◆🇮🇳 Gardening◆Sarcasm◆ @gardenlivenow https://t.co/FpS8aQ8WQF,1249,3450,197774,False,Not a SINGLE christian PASTOR has gone to any hospital to do MIRACLE Cure ...#Coronavirus has   exposed #Christian  FRAUD
2020-04-04 14:02:19+00:00,"RT @narendramodi: Had an extensive telephone conversation with President @realDonaldTrump. We had a good discussion, and agreed to deploy t…",vivek_s85,"Uttar Pradesh, India","I have the passion to write in the interest of the country✍✍
Pharmacist District Women's Hospital,Gonda, U.P.",4365,4936,40798,False,"Had an extensive telephone conversation with President @realDonaldTrump. We had a good discussion, and agreed to deploy the full strength of the India-US partnership to fight COVID-19."
2020-04-04 14:02:20+00:00,"The virus of hate derived from Media Virus is more Dangerous than corona
So the Best thing to do now is 
#टीवी_देखना_बंद_करो
Stop watching TV, especially News channels.",ErSahidOfficial,"Forbesganj, India",Engineer,17,315,351,False,No Value Mentioned
2020-04-04 14:02:20+00:00,"RT @narendramodi: Had an extensive telephone conversation with President @realDonaldTrump. We had a good discussion, and agreed to deploy t…",ajay_pandit8,India,Technology lover | Interested in politics | Skills in computer | CA Student | Loves Listening Loudly Melody Music,138,1334,10647,False,"Had an extensive telephone conversation with President @realDonaldTrump. We had a good discussion, and agreed to deploy the full strength of the India-US partnership to fight COVID-19."
2020-04-04 14:02:20+00:00,"Secondly, sanitizer one is carrying might be of hardly any use if it is it has low alcohol concentration. We need at least 65% alcohol to kill the virus

https://t.co/nuusS3As0v",dr_puneet,"Dwarka, New Delhi, India",No Value Mentioned,260,45,1139,False,No Value Mentioned
2020-04-04 14:02:20+00:00,"RT @amitlahoti1980: Dear @narendramodi ji @SrBachchan ji, both kids Kshitij (10) and Aadya (5) are big fan of yours. Watching you encouragi…",FCSJigarShah,"Mumbai, India","Member of @icsi_cs since 2008. ""UNIQUE, like everyone else😎"" Cricket, Corporate Law, Traveling|
योगः कर्मसु कौशलम्
Partner @jmjallp
""Views are personal""",1836,375,29357,False,"Dear @narendramodi ji @SrBachchan ji, both kids Kshitij (10) and Aadya (5) are big fan of yours. Watching you encouraging people relentlessly to combat #CoronaVirus , they together also have done some efforts for their own awareness drive, they wish that you watch it once.. https://t.co/OBbLE3jjJ2"
2020-04-04 14:02:20+00:00,"RT @ndtv: #COVID19 testing, treatment to be free for Ayushman Bharat beneficiaries https://t.co/qPQ5kK0U3H

#CoronavirusOutbreak https://t.…",Jeeveshu,India,Stand-Up Comic/Actor/Host/Voice Over Artist Bookings : +919811239932 query@jeeveshu.com,20463,569,23921,True,"#COVID19 testing, treatment to be free for Ayushman Bharat beneficiaries https://t.co/qPQ5kK0U3H

#CoronavirusOutbreak https://t.co/zv11zEu4Ku"
2020-04-04 14:02:20+00:00,"RT @PTI_News: COVID-19 death toll rises to 75, cases climb to 3,072: Union Health Ministry",BPatil02,India,A passionate Human Resources Professional & Student of Psychology!,326,705,14093,False,"COVID-19 death toll rises to 75, cases climb to 3,072: Union Health Ministry"
2020-04-04 14:02:21+00:00,RT @Iamkavitak: Because Mr Khan is a very good human being ❤🙏,ChallaAnkur,"Muzaffarpur, India",No Value Mentioned,1479,45,40374,False,Because Mr Khan is a very good human being ❤🙏 https://t.co/mZbJtm2oIH
2020-04-04 14:02:23+00:00,"RT @mvmeet: Dear Pappu,

People will be tested only after they develop symptoms of corona virus!

Are you a fool since birth or only after…",LakshyaMe,"Mumbai, India",No Value Mentioned,299,162,116443,False,"Dear Pappu,

People will be tested only after they develop symptoms of corona virus!

Are you a fool since birth or only after joining politics? https://t.co/fr4wNhD6yc"
2020-04-04 14:02:24+00:00,"RT @narendramodi: Had an extensive telephone conversation with President @realDonaldTrump. We had a good discussion, and agreed to deploy t…",MDhanwadkar,"Bengaluru, India",No Value Mentioned,26,23,298,False,"Had an extensive telephone conversation with President @realDonaldTrump. We had a good discussion, and agreed to deploy the full strength of the India-US partnership to fight COVID-19."
2020-04-04 14:02:24+00:00,RT @priyankagandhi: It is imperative that India immediately ramps up its rate of testing. Extremely valuable information about the severity…,Faiz28442096,India,No Value Mentioned,236,392,14728,False,"It is imperative that India immediately ramps up its rate of testing. Extremely valuable information about the severity of the disease, disease clusters and focal points is gained from testing. In order for this lockdown to yield results, it has to be backed up..1/2
#MoreTesting"
2020-04-04 14:02:25+00:00,RT @ANI: 74 #COVID19 positive cases reported in Tamil Nadu today out of which 73 had attended the Tableeghi Jamaat event at Markaz Nizamudd…,ashim_k_saha,India,No Value Mentioned,46,658,2567,False,"74 #COVID19 positive cases reported in Tamil Nadu today out of which 73 had attended the Tableeghi Jamaat event at Markaz Nizamuddin, Delhi: Beela Rajesh Tamil Nadu Health Secretary https://t.co/cpHHqoXOBO"
2020-04-04 14:02:26+00:00,"@MaryLeeShark Just be safe. The Sturgeon General says; Stay home, we know when you move obviously. I know you want to attack prey in groups.  Don't. 
If you feel sick don't be swimming around others.
Cover your mouth when you are coughing, well I mean, turn you head away.",DeanofJacksons,NE Indiana/NW-SW Ohio,Dakota's Dad @spectrumnews1OH @MySports1027 @WOSNscores @NKTelcoSports #farmboy #1000 #ManOnAMission  blog@ web: https://t.co/KSoh2JDGnG #historyhack,1018,2760,4067,False,No Value Mentioned
2020-04-04 14:02:26+00:00,RT @KatiePavlich: Los Angeles Times and Bloomberg News: Federal stockpile of N95 masks was depleted under Obama and never restocked https:/…,DBurton3,INDIANA,"#MILITARY #VETS🇺🇸 
 #JESUSCHRISTISKING #TRUMPTRAIN🚂 #MAGA #HOOSIERTRUMPERS #GENERALFLYNN
#BUILDTHEWALL  #BACKTHEBLUE👮.  #MARRIED❤️",17227,17333,85769,False,Los Angeles Times and Bloomberg News: Federal stockpile of N95 masks was depleted under Obama and never restocked https://t.co/sRfUDTflrP
2020-04-04 14:02:26+00:00,"RT @htTweets: #Covid19Pandemic | 2 days after Padma Shri awardee Bhai Nirmal Singh’s death, daughter tests positive for #coronavirus

https…",varun18vijay,"Bengaluru, India","News-Curator Content-Curator Political-Analyst Patriot 
(Subliminal/Hidden Messages Decoder) Trend-Spotter
Retweets, Likes imply #interesting, NOT endorsements",1364,4172,600816,False,"#Covid19Pandemic | 2 days after Padma Shri awardee Bhai Nirmal Singh’s death, daughter tests positive for #coronavirus

https://t.co/Ob2Pn41FfC https://t.co/lcm2VkdsFb"
2020-04-04 14:02:27+00:00,"After a long while,river #Yamuna is flowing full &amp; cleaner at this time of year. The River has seen significant improvement since enforcement of  nationwide lockdown due to #Covid_19.

It is a very good time for @CPCB_OFFICIAL to study the level of pollution coming from industry. https://t.co/8mNwDoddbe",AshwaniSCI,"New Delhi, India","Advocate-on-Record, Supreme Court of India. Public Speaker, TV Panelist. Love Books, Fashion, Nature Lover. I do not conform to any ideology. RT not endorsement",7162,1086,18609,False,No Value Mentioned
2020-04-04 14:02:28+00:00,RT @Khush_boozing: Just tell me how you cleared the Civil services exam?,bj2789,India🇮🇳🇮🇳🇮🇳,Movie lover. Secular. Indian. Indian National Congress follower.,427,529,105040,False,Just tell me how you cleared the Civil services exam? https://t.co/LXUJkUMfds
2020-04-04 14:02:29+00:00,"🚨STAY VIGILANT 

There is no fee to apply for the #PaycheckProtectionProgram loan. Be aware of fraudulent actors who may charge people to help them get one. 

Learn about https://t.co/3Oy033MaNM

https://t.co/005aRYG2b9",DaahirAbdullah,"Eruvadi, India",Official Twitter By Abdullah Muhammad Bin Salman,17,94,629,False,No Value Mentioned
2020-04-04 14:02:29+00:00,Asia number one slum area very sad news today  😂https://t.co/GKASsP7q78,Abdulkadir1613,India,No Value Mentioned,161,232,2666,False,No Value Mentioned
2020-04-04 14:02:30+00:00,"RT @narendramodi: Had an extensive telephone conversation with President @realDonaldTrump. We had a good discussion, and agreed to deploy t…",eranuragpisti,"Jabalpur, India",I am a musician / cricketer and nation lover,241,397,4234,False,"Had an extensive telephone conversation with President @realDonaldTrump. We had a good discussion, and agreed to deploy the full strength of the India-US partnership to fight COVID-19."
2020-04-04 14:02:30+00:00,"RT @RedChilliesEnt: Support makes everyone stronger. And in our fight against COVID-19, we need each other’s support as a society. Let’s he…",DebarshiParasa4,"Assam, India","@iamsrk devote ♦️❤️💕
@msdhoni fan❤️💕",30,44,842,False,"Support makes everyone stronger. And in our fight against COVID-19, we need each other’s support as a society. Let’s help each other more, and win this fight collectively! 
@iamsrk @gaurikhan 
@mybmc @mybmcWardHW 

#Covid19 #StrongerTogether https://t.co/Le915sddCA"
2020-04-04 14:02:30+00:00,"RT @Drrksingh25: Now another responsive offering with SAFE , here it is SIDBIs SAFE PLUS                               Covid से राष्ट्र जंग…",neerajv007,"New Delhi, India","Passionate Development Banker, Candid, Innovation, creativity, simplicity, dedication,  follower of Radhasoami Faith,.........l personal posts..",72,129,521,False,"Now another responsive offering with SAFE , here it is SIDBIs SAFE PLUS                               Covid से राष्ट्र जंग, उद्यमी, तुम संग हम @sidbiofficial @investindia @manojmittal28 @NITIAayog @DFS_India @FinMinIndia  @PMOIndia https://t.co/gdUzfEBX6E"
2020-04-04 14:02:32+00:00,"#AskZee carrier of corona are human bomb,terrorist,they should be immediatly irradicated from our country.",PnraiPgt,"Arunachal Pradesh, India","Pgt.Chemistry, Ghss Palin, Kradaadi District",11,153,887,False,No Value Mentioned
2020-04-04 14:02:32+00:00,"RT @AlwaysRamCharan: I am proud of everyone who has faithfully been abiding by the lockdown! My love to you all.

With the same spirit, let…",Karthiktinku10,"Chennai, India",| Flyweight Boxer 👊 | Writer✍ | Ramcharan Fan!!! ✌ArmaanMalik addict!!! 🎸 @ArmaanMalik22  MarcMarquez93 Lover ❤ TulsiKumar is my Princess 😍 @TulsiKumarTK,73,39,288,False,"I am proud of everyone who has faithfully been abiding by the lockdown! My love to you all.

With the same spirit, let's light up lamps and come together to spread awareness for 9 minutes at 9 pm this Sunday. Don’t forget! 🙏🤗
@NarendraModi #LightForIndia #IndiaFightsCorona https://t.co/p28rAwG8MP"
2020-04-04 14:02:33+00:00,"@SitaramYechury Coronavirus is being linked to a particular community maximum cases are coming from jamaat. It is happening due to mass testing of particular people.
Let us go for massive testing it will prove Corona has no religion",BalbirSingh3691,"Ludhiana, India",No Value Mentioned,9,95,48,False,No Value Mentioned
2020-04-04 14:02:34+00:00,RT @nakulssawhney: Hundreds out on streets to celebrate Ram Navmi. All social distancing guidelines violated. Should this be called #Corona…,ShaikMohsin988,"Hyderabad, India",Conductor @ TSRTC,330,607,16168,False,"Hundreds out on streets to celebrate Ram Navmi. All social distancing guidelines violated. Should this be called #CoronaDharamYudh? Of course, not. You can't blame any religion for this pandemic. Let's not be stupid. Let's concentrate on right to healthcare. #DocsNeedGears https://t.co/n1rzsPl21U"
2020-04-04 14:02:34+00:00,"RT @stpiindia: Let’s dispel the darkness of #COVID19 by lighting a candle, diya, torch or mobile flashlight for 9 minutes at 9 pm on 5th Ap…",MUKULDHARSHARMA,"Pune, India","Assistant Director, STPI Pune",29,47,3226,False,"Let’s dispel the darkness of #COVID19 by lighting a candle, diya, torch or mobile flashlight for 9 minutes at 9 pm on 5th April 2020 and stand together to support the call of Hon’ble PM Shri @NarendraModi ji. Maintain #socialdistancing. #IndiaFightsCorona #9baje9minute @RSPrasad https://t.co/ZLwaGgc6yc"
2020-04-04 14:02:34+00:00,"RT @annafifield: Official Chinese statistics put Wuhan’s coronavirus death toll at 2,563. Evidence coming out of the city suggests it was a…",GopalaRayudu99,"Vishakhapatnam, India","Do your best, leave the rest.
Do good for others but don't expect good from others. bcz this is 2020.
#TDPTwitter",199,1096,17234,False,"Official Chinese statistics put Wuhan’s coronavirus death toll at 2,563. Evidence coming out of the city suggests it was actually more than 40,000. Our latest: https://t.co/6D2zHtAd17"
2020-04-04 14:02:35+00:00,"RT @Lawyersclub: Rs. 4.5k per #CoronaTesting? Why can't it be provided to people for free? Telangana HC questions the state runners!

The C…",lexvachaspati,"Lucknow, India",Celebrate the Differences!!!,164,379,32581,False,"Rs. 4.5k per #CoronaTesting? Why can't it be provided to people for free? Telangana HC questions the state runners!

The Corona Test prices being high, discourage people from getting tested resulting in the wrong metrics related to the disease!
#CautionYesPanicNo 
#Covid_19india"
2020-04-04 14:02:36+00:00,"RT @Drrksingh25: credit+ has been mainstay of SIDBI 2.0. Continuing its responsive steps against covid, safe plus has been positioned. राष्…",neerajv007,"New Delhi, India","Passionate Development Banker, Candid, Innovation, creativity, simplicity, dedication,  follower of Radhasoami Faith,.........l personal posts..",72,129,521,False,"credit+ has been mainstay of SIDBI 2.0. Continuing its responsive steps against covid, safe plus has been positioned. राष्ट्र के हरक़दम में ,सिडबी हमदम, हरदम @globaljagat @manojmittal28 @PMOIndia @investindia @pandeyak1968 @NITIAayog https://t.co/qGDZ8sHUwp"
2020-04-04 14:02:36+00:00,Yes. Positivity and confidence on self that we can overcome this is the way forward https://t.co/UIADYaIxfZ,ThePashSharma,"New Delhi, India","Share info on #teach #study #learn #Edtech #smartstudy #achieve #quiz #contest #competition. 
Entrepreneur | Author | Marathoner | Guitar | WIP :) ⭐⭐⭐⭐⭐",116,277,914,False,No Value Mentioned
2020-04-04 14:02:38+00:00,RT @India_Policy: A Cluster Of Coronavirus Cases Can Be Traced Back To A Single Mosque https://t.co/doBvVCayHb,sscomp32,"Patna, India","Gadgets Cricket and Dance. MSD 
Bhakt. Love anything creative. Sanghi. Nationalist 🇮🇳. 🚩जय श्री राम 🚩#YogiRoxx #Modi2024🏏 #KashiMathuraBaakiHai",716,1108,286776,False,A Cluster Of Coronavirus Cases Can Be Traced Back To A Single Mosque https://t.co/doBvVCayHb
2020-04-04 14:02:38+00:00,"RT @AartiTikoo: The most famous Indian fangirl of the Chinese Communisty Party, bashes US &amp; India over #WuhanCoronaVirus in her latest rant…",__RajeevKumar,आर्यावर्त INDIA,"करारा जवाब मिलेगा / इतिहास राजनीति और समाजशास्त्र में विशेष रुचि!चाणक्य का प्रशंसक!
अपने राष्ट्र और धर्म के प्रति सजग! नेताओं से ज्यादा पत्रकारों से नफ़रत !",1686,2328,61520,False,"The most famous Indian fangirl of the Chinese Communisty Party, bashes US &amp; India over #WuhanCoronaVirus in her latest rant in foreign press. Not a word against People’s Liberation Army. President Xi Jinping should now make her his official spokesperson. She is doing a great job."
2020-04-04 14:02:40+00:00,"RT @Ach_Balkrishna: Does #Ayurveda offer any prophylactic or symptomatic treatments to battle coronavirus, #COVID19?
To find this out, foll…",Amrutanshu_YB,"Bhubaneswar, Odisha,India","State Social Media Head of Patanjali Yuva Bharat,Odisha.

https://t.co/3kmQmFLWKa(IT) at CET, Bhubaneswar.                 

Research Scholar at IIIT, Bhubaneswar",2592,1456,5153,False,"Does #Ayurveda offer any prophylactic or symptomatic treatments to battle coronavirus, #COVID19?
To find this out, follow the latest research from #Patanjali Research Institute #PRI https://t.co/UYH4eCzd2i"
2020-04-04 14:02:40+00:00,RT @ashokgehlot51: I thank HG Infra Engineering Ltd’s CMD Sh. Harendra Singh for donating Rs.1 crore 50 lakhs to the Rajasthan CM COVID-19…,RishuGk,"Jaipur, India",INTENSE...... PASSIONATE..... LOVER.........MECHANICAL ENGINEER...... !,133,268,494,False,"I thank HG Infra Engineering Ltd’s CMD Sh. Harendra Singh for donating Rs.1 crore 50 lakhs to the Rajasthan CM COVID-19 Relief Fund &amp; for setting up a separate fund of Rs. 50 lakhs for food, masks, gloves, sanitizers etc. for #Coronawarriors &amp; the needy. https://t.co/kAwGyrz2CZ"
2020-04-04 14:02:40+00:00,"RT @CMOMaharashtra: Like Coronavirus there is another virus that is emerging which is threatening social harmony, the virus of fake news &amp;…",saiyedirfan1981,ahmedabad. india,"i love my country 
i love india",91,1361,2687,False,"Like Coronavirus there is another virus that is emerging which is threatening social harmony, the virus of fake news &amp; communal hatred."
2020-04-04 14:02:42+00:00,"RT @ANI: Increase of 525 #COVID19 cases in the last 24 hours, the largest spike in a day. Total number of #COVID19 positive cases rise to 3…",yok382,"Chennai, India",Thalapathy VIJAY Rasigan ❤ | Founder @ActorVijayFP | ❤️🎦,28623,588,55270,False,"Increase of 525 #COVID19 cases in the last 24 hours, the largest spike in a day. Total number of #COVID19 positive cases rise to 3072 in India (including 2784 active cases, 213 cured/discharged/migrated people and 75 deaths): Ministry of Health and Family Welfare https://t.co/1aePFISWKK"
2020-04-04 14:02:42+00:00,"RT @AskRaushan: Foreigner visiting Mosques are spreading Coronavirus.
Foreigners visting Temples are helping us to contain Coronavirus.
Now…",AyushJh11019192,"Mumbai, India",civil engineering nationalist india first,1125,1094,65393,False,"Foreigner visiting Mosques are spreading Coronavirus.
Foreigners visting Temples are helping us to contain Coronavirus.
Now Who say Allah and Bhagwan are same ?? #जिहादी_TikTok https://t.co/iwW1LZqNIq"
2020-04-04 14:02:44+00:00,"RT @narendramodi: Had an extensive telephone conversation with President @realDonaldTrump. We had a good discussion, and agreed to deploy t…",ramautar684, India,"*तुम भी मोदी रोको अभियान में और*
 *हम भी मोदी रोको अभियान में . .*

*बस तुमने सोचा है आने नही देंगे* 
*और हमने ठाना है जाने नही देंगे*
            @narendramodi",1181,1045,32104,False,"Had an extensive telephone conversation with President @realDonaldTrump. We had a good discussion, and agreed to deploy the full strength of the India-US partnership to fight COVID-19."
