created_at,full_text,screen_name,location,description,followers_count,friends_count,statuses_count,verified,full_retweet_text
2020-02-10 08:00:00+00:00,RT @_shahrukhansari: This is Dr Sabista khan .I request all the Indians to come with me and speak up and take part in the protest today at…,Yasinshaikh112,"Mumbai, India","stand for humanity, spread love, make india beautiful and best place to live...",113,513,5224,False,"This is Dr Sabista khan .I request all the Indians to come with me and speak up and take part in the protest today at 11 AM Mandi House, Delhi #FreeDrKafeel #LiWenliang #coronavirus @drkafeelkhan https://t.co/kU1rvtwDW8"
2020-02-10 08:00:00+00:00,"More than 70 exhibitors, including major U.S. defence firms Lockheed Martin Corp and Raytheon Co have pulled out over concerns related to the new #coronavirus https://t.co/0ZJdeOs4Yy",the_hindu,"Chennai, India",News feeds from India's National Newspaper,5965022,202,307131,True,No Value Mentioned
2020-02-10 08:00:00+00:00,"Everything we know about the pangolin - the scaly mammal that may have spread the coronavirus to humans

https://t.co/QevWc2q4jf https://t.co/rPZtbs0ljB",BiIndia,"New Delhi, India",Intelligence for India's next generation.,55160,222,36071,True,No Value Mentioned
2020-02-10 08:00:01+00:00,How bloody good we(humans) have been to this planet so far.👏👏 https://t.co/VbX9iufg2q,indianankit1,"Patna, India","खुल के जीयो,जानवरो से प्यार करना सीखो क्योंकि वो कोई खाने की चीज़ नहीं और शाकाहारी बनो🙏 अपने देश,अपनी भाषा और अपने लोगों से प्यार करना सीखो🙏",71,381,8146,False,No Value Mentioned
2020-02-10 08:00:09+00:00,RT @ganeshmantra: If Congress had not controlled the communist in the 1950's we would have become some fucked up Country like China.,MalabarBiryani,"Delhi, India","💕#INC। Wildlife, History, Art enthusiast। Atheist। #IndiraGandhi is my idol",3268,3835,98358,False,If Congress had not controlled the communist in the 1950's we would have become some fucked up Country like China.
2020-02-10 08:00:11+00:00,"Some Relief-
THE CURE RATE FOR THE NOVEL #coronaviruschina CORONAVIRUS HAS INCREASED SIGNIFICANTLY FROM THE FIGURE ANNOUNCED ON JAN. 27, ACCORDING TO CHINA'S NATIONAL HEALTH COMMISSION: - 1.3% TO 8.2% ACROSS CHINA - 2.6% TO 6.2% IN WUHAN CITY - 1.7% TO 6.1% IN HUBEI PROVINCE",21Himanshugupta,"New Delhi, India","Market Strategist on Equities, Commodities and Forex !! Yoga for mind, body & soul!! Tweets are for educational purposes !!",211,79,424,False,No Value Mentioned
2020-02-10 08:00:20+00:00,RT @omar270: Those folk in China 🇨🇳 are just inhumane 😱🤬 #coronavirus https://t.co/4pAqvJVS9z,AshokPatelbhau,"Jodhpur, India",Proud Indian 🇮🇳 ❤🇮🇳!! Cricket  Cricket Cricket ❤❤!!   मारवाड़ी😎!!,370,837,9763,False,Those folk in China 🇨🇳 are just inhumane 😱🤬 #coronavirus https://t.co/4pAqvJVS9z
2020-02-10 08:00:22+00:00,"@ParineetiChopra - 1 upside -you probably get less hassled in public places, hard to recognise you with the mask. I didn't mind my anonymity last night. STAY SAFE India from #2019-nCoV https://t.co/uBozeqHXwT https://t.co/6WOdSyjmag",mkheterpal,India,VC @WBridgeVentures.  Investor @atlanhq @bijnisapp @Chaloapp @Dataweavein @DoubtNutapp @mymagicpin @PocketPills @unacademy @ziploanindia @9stacksonline,1222,486,1379,False,No Value Mentioned
2020-02-10 08:00:39+00:00,RT @nailainayat: Just some Pakistani things and coronavirus. https://t.co/ePgRapOzzG,avinash_mailme,India,No Value Mentioned,1100,1348,530654,False,Just some Pakistani things and coronavirus. https://t.co/ePgRapOzzG
2020-02-10 08:00:48+00:00,@desimojito Not only Animals. Even journalist Reported on Corona virus from Wuhan is gone missing https://t.co/Cn3ANHm19Y,AskAnything_RK,"New Delhi, India",Enigma Wrapped Inside a Mystery,151,630,13257,False,No Value Mentioned
2020-02-10 08:00:53+00:00,"RT @free_thinker: Around 18,000 chickens were culled in China due to H5N1 avian flu, and not the Coronavirus infection. Misleading warnings…",itsnizam4u,India,"“The best thing about the future is that it only comes one day at a time.
Rts not endorsed. Businesses man",143,2044,10015,False,"Around 18,000 chickens were culled in China due to H5N1 avian flu, and not the Coronavirus infection. Misleading warnings and rumours on social media discourage the consumption of broiler chicken in India. #AltNewsSciCheck | @Neurophysik

https://t.co/YTfygWMZ6k"
2020-02-10 08:00:54+00:00,"RT @daas_pawan: #NoMeat_NoCoronaVirus 
Spirituality begins where Science Ends
No Meat no Corona Virus

Watch Sadhna TV 7:30 PM 
 https://t.…",RaniDasi13,India,Social worker,989,1630,181011,False,"#NoMeat_NoCoronaVirus 
Spirituality begins where Science Ends
No Meat no Corona Virus

Watch Sadhna TV 7:30 PM 
 https://t.co/BtL8Yuac1i"
2020-02-10 08:00:57+00:00,"RT @daas_pawan: Like the corona virus came from the meat market. 
But no Meat no Corona Virus
#NoMeat_NoCoronaVirus https://t.co/1T7HJE0pn2",RaniDasi13,India,Social worker,989,1630,181011,False,"Like the corona virus came from the meat market. 
But no Meat no Corona Virus
#NoMeat_NoCoronaVirus https://t.co/1T7HJE0pn2"
2020-02-10 08:01:00+00:00,This is getting scary pretty fast🥵 https://t.co/y4z3Ep8q8f,chirayugulati,India,"Finance, infra devlp, public policy, railways & ISRO.",21,295,1302,False,No Value Mentioned
2020-02-10 08:01:04+00:00,"RT @satyug20201: #NoMeat_NoCoronaVirus
forget humanity, quit vegetarianism, become a demon, eat non-veg,  will become a victim of deadly vi…",RaniDasi13,India,Social worker,989,1630,181011,False,"#NoMeat_NoCoronaVirus
forget humanity, quit vegetarianism, become a demon, eat non-veg,  will become a victim of deadly viruses like corona.
#coronarvirusitalia 
China
https://t.co/LynMiDmpzR"
2020-02-10 08:01:16+00:00,@omar270 @AskAnything_RK I Think Because Of Corona Viruse😰😰☝️,JoshiKrutarth5,"Ahmadabad City, India","Engineer😂🤣😎😎 Interested In Politics 
(Single 😍😎) Gujarat ,Ahmedabad #gujju 
mummy ka beta
Facebook https://t.co/ztqCU6iFIK",458,1418,7469,False,No Value Mentioned
2020-02-10 08:01:21+00:00,"Things in Wuhan (rather China) are getting murkier. Hope @WHO and @DrTedros are taking note of the matters.

Can we access #facts when voices, such as Chen's, are silenced or repressed?

#factsnotfears #coronavirus #citizenjournalist https://t.co/qYBGq3v73U",SudeshnaBBaruah,"Assam, India ",No Value Mentioned,366,190,7999,False,No Value Mentioned
2020-02-10 08:01:23+00:00,"RT @daas_pawan: #NoMeat_NoCoronaVirus 
Do not eat Meat or kill any living being.
No Meat No Corona Virus 

https://t.co/Lt9JBBW0wj",RaniDasi13,India,Social worker,989,1630,181011,False,"#NoMeat_NoCoronaVirus 
Do not eat Meat or kill any living being.
No Meat No Corona Virus 

https://t.co/Lt9JBBW0wj"
2020-02-10 08:01:31+00:00,RT @HamsiniH: (1/n) A long story about racism in light of the coronavirus in #Chennai: I am using the break caused by coronavirus to finish…,khemtajose,India,Believe everyone should regularly look at photos from space to regain perspective. News Editor & Snr Foreign Affairs Correspondent. Tweets personal.,2869,1582,18068,False,(1/n) A long story about racism in light of the coronavirus in #Chennai: I am using the break caused by coronavirus to finish my yoga teacher training in Chennai. Two of my classmates are from Hong Kong and have been staying in India since Jan 30.
2020-02-10 08:01:40+00:00,@htTweets The respected sir should go to China if he is feeling so Pakistan about an Indian!,kashiflion,India hyderabad ,"action director, healer, ghosts, actor, public figure, the next greatest action star of the world, mystic, spirituality, service to man is service to God.",4541,610,115186,False,No Value Mentioned
2020-02-10 08:01:43+00:00,"RT @SGTreport: Exiled Chinese billionaire Guo Wengui said Sunday, citing leaked information out of Wuhan, that the coronavirus death toll c…",Judah08076507,"Indiana, USA",These are my HEROs,398,793,3971,False,"Exiled Chinese billionaire Guo Wengui said Sunday, citing leaked information out of Wuhan, that the coronavirus death toll could be as high as 50,000.  (zero hedge)

Pray that he's overestimating the scope of the #pandemic https://t.co/mMvwQlUQKW"
2020-02-10 08:01:44+00:00,RT @Geopolitics_Emp: #FrankPlummer – Canadian Scientist Key To #Coronavirus Investigation Assassinated In #Africa? @GreatGameIndia https://…,GreatGameIndia,India,Journal on Geopolitics & International Relations https://t.co/R2CahjL0pK. Book https://t.co/ic0Tq49JmH. Chat & Tips https://t.co/LBVtVPIeWC,14612,1884,17890,False,#FrankPlummer – Canadian Scientist Key To #Coronavirus Investigation Assassinated In #Africa? @GreatGameIndia https://t.co/kXMKF50M3s
2020-02-10 08:01:50+00:00,"WHO warns overseas coronavirus spread may be 'tip of the iceberg'

#coronavirus #Corona #WHO #worldhealthorganization #coronaviruschina #coronaviruswuhan 

https://t.co/RQHFIOgLG7",ruchikapatil14,"Mumbai, India",No Value Mentioned,309,380,2217,False,No Value Mentioned
2020-02-10 08:02:00+00:00,"RT @BBCBreaking: UK government declares coronavirus a ""serious and imminent threat"" to public health https://t.co/Deq2cDBf4o",AashishMisra,India,INDIAN. RTs are not always endorsement 😜,347,230,44413,False,"UK government declares coronavirus a ""serious and imminent threat"" to public health https://t.co/Deq2cDBf4o"
2020-02-10 08:02:06+00:00,Coronavirus Fears Pinch Kolkata Links With China's Kunming - NDTV https://t.co/1iy80q7PJL,poupee_107,"Calcutta,Indiaকলকাতা,ভারতবর্ষ ","Chaque jour est une nouvelle chance d'y arriver..
j'adore ces gens qui sont aimables et amicaux 
j'aime les sports - le football, le tennis, les
échecs 👑💚💙❤",468,1049,8599,False,No Value Mentioned
2020-02-10 08:02:10+00:00,"RT @intricate119: ""No occasion for panic""

Newspaper in 1918 trying to downplay the Spanish Flu, which ended up killing 50 million people.…",meghamitra,India,"“The illiterate of the future are not those who can’t read or write but those who cannot learn, unlearn, and relearn.”",64,205,12002,False,"""No occasion for panic""

Newspaper in 1918 trying to downplay the Spanish Flu, which ended up killing 50 million people. #Coronavirus https://t.co/65TqGRJuii"
2020-02-10 08:02:11+00:00,"Welcome to CDC COC MAKER! We are providing all Flags Documentation PANAMA/ INDIAN/ PALAU/
LIBERIAN/ HONDURAS/ MARSHALL ISLANDS/ BAHAMAS/ ST. KITTS &amp;amp; NEVIS/ SAMOA for STCW/ STSDSD/
CDC/ SEAMAN BOOK/ COE/ COP/ INDOS/ DC/
More Details mobile No - 9997973040 https://t.co/c2qKUvUtJ7",cdcmaker32,"Noida, India","Established in the year 2016, We ‘CDC / COC maker’, are an ISO 9001:2008 certified organization engaged in offering Merchant Navy Certification.",189,2203,10771,False,No Value Mentioned
2020-02-10 08:02:12+00:00,Coronavirus Effect: Foxconn Planning to Produce 2 Million Masks Everyday https://t.co/GCB26DETib,sunder_barange,"Indore, India","I'm a Mechanical engineer, Trusted 360 view photographer, Chess player, Rubik's Speed Cuber, YouTuber, Tech guy, Animal Lover.🐱🐶🐕🙏Jai Hind🙏🇮🇳",289,961,15594,False,No Value Mentioned
2020-02-10 08:02:14+00:00,RT @Loksatta_Party: #CoronaVirus and India’s preparedness to tackle such situations. https://t.co/lHxfoDnM1B,131779IAS,"Hyderabad, India","“Let’s get to work and change the world.”
@131779IAS",10,326,47,False,#CoronaVirus and India’s preparedness to tackle such situations. https://t.co/lHxfoDnM1B
2020-02-10 08:02:16+00:00,#RT @Psm_cuts: RT @maharora: @suhasinih @the_hindu What we need is indigenously developed smart diplomacy.  China did it brilliantly without an FTA with US n built  its strong industrial base n successfully replicated US technology giving sleepless nights to US Admn and has …,cutscitee,"Jaipur, Rajasthan, #India","Centre for International #Trade #Economics & #Environment Pursuing economic equity,social justice within & across borders by persuading govt & empowering people",806,168,7866,False,No Value Mentioned
2020-02-10 08:02:19+00:00,"RT @QuickTake: #AmericanFactory just won the documentary film Academy Award.

The Obama-backed @Netflix documentary even created a buzz in…",Lionking114433,"New Delhi, INDIA","Love my ❤ALLAH❤ ||
Dreamer | Thinker | Patriot 🇮🇳 | Adorable Loser | Ex-Journo | Just spreading L❤VE 🌴| RTs/ Likes are not endorsement |
Al -Aqsa is my ♥️ |",602,5001,150338,False,"#AmericanFactory just won the documentary film Academy Award.

The Obama-backed @Netflix documentary even created a buzz in China #Oscars #Oscars2020 @afactoryfilm https://t.co/ED2UdPT6qH"
2020-02-10 08:02:25+00:00,RT @omar270: Those folk in China 🇨🇳 are just inhumane 😱🤬 #coronavirus https://t.co/4pAqvJVS9z,AmitCha98806304,"Himachal Pradesh, India",love my daughter 😘,73,378,1106,False,Those folk in China 🇨🇳 are just inhumane 😱🤬 #coronavirus https://t.co/4pAqvJVS9z
2020-02-10 08:02:28+00:00,"There were 97 deaths and 3,062 new confirmed cases of the lethal infection on Sunday, China's National Health Commission said.

#China #coronavirus #deathtoll #WorldHealthOrganisation #sakalviral #SakalTimes

https://t.co/yK3PE6CnPd",sakaltimes,"Maharashtra, India","English daily 🗞️ from Pune bringing the latest news, updates & features from Maharashtra and around the world.
A part of Sakal Media Group (@sakalmedianews).",19957,11,39314,False,No Value Mentioned
2020-02-10 08:02:28+00:00,Mapping Baidu App Location Data Shows How Coronavirus Spread in China https://t.co/lHsECRThY9,sunder_barange,"Indore, India","I'm a Mechanical engineer, Trusted 360 view photographer, Chess player, Rubik's Speed Cuber, YouTuber, Tech guy, Animal Lover.🐱🐶🐕🙏Jai Hind🙏🇮🇳",289,961,15594,False,No Value Mentioned
2020-02-10 08:02:32+00:00,Mobile World Congress 2020 Organisers Brace for Coronavirus Impact as Tech Firms Exit https://t.co/xx0lSyH0ra,sunder_barange,"Indore, India","I'm a Mechanical engineer, Trusted 360 view photographer, Chess player, Rubik's Speed Cuber, YouTuber, Tech guy, Animal Lover.🐱🐶🐕🙏Jai Hind🙏🇮🇳",289,961,15594,False,No Value Mentioned
2020-02-10 08:02:34+00:00,Coronavirus is Hitting Tech Companies Hard And Could Soon Hurt Your Wallet Too https://t.co/o3ACCzHDVp,sunder_barange,"Indore, India","I'm a Mechanical engineer, Trusted 360 view photographer, Chess player, Rubik's Speed Cuber, YouTuber, Tech guy, Animal Lover.🐱🐶🐕🙏Jai Hind🙏🇮🇳",289,961,15594,False,No Value Mentioned
2020-02-10 08:02:35+00:00,RT @CGTNOfficial: Live: Press briefing by the Joint Prevention and Control Mechanism of the State Council on #coronavirus outbreak https://…,champrose,"New Delhi, India","The word perfection is a misnomer, and can be misleading, at times. To be perfect you have to be God. #Lawyer by profession. I follow back.",1232,4418,53344,False,Live: Press briefing by the Joint Prevention and Control Mechanism of the State Council on #coronavirus outbreak https://t.co/PlKohCWboA
2020-02-10 08:02:38+00:00,"#coronavirus will make a classic case study of a ""viral infection"" impacting a superpower across domains in an unprecedented manner not known hithertofore. CCP must initiate this exercise to prevent outbreaks in future as also manage calamity better with human considerations. https://t.co/czE18Ml83d",Anil7760,India,"M Sc Def Studies, Ph D Def Studies (Disaster Mgt), UN Msn to DRC(Observer & Mil Liaison Offr), Chinese Interpretership, psc",163,1044,4095,False,No Value Mentioned
2020-02-10 08:02:38+00:00,RT @BangXiao_: Fake news. The donation wasn’t from Australia. It’s interesting that an official from China’s foreign ministry spread mislea…,Meenfryyyy,India,F*ck Hindu N*zis 🏳️‍🌈,468,1338,12989,False,"Fake news. The donation wasn’t from Australia. It’s interesting that an official from China’s foreign ministry spread misleading info without verification.  According to China Southern Airlines, the flight in the video was CZ634 from Nairobi, not Melbourne. https://t.co/0vzQJyYfmp"
2020-02-10 08:02:43+00:00,"RT @PrisonPlanet: Meanwhile, in China... https://t.co/PgcdIANzak",IamAnnaShetty,India,"तू खुद की खोज में निकल
तू किस लिए हताश है,
तू चल तेरे वजूद की
समय को भी तलाश है।
🇮🇳सत्यमेव जयते!!!🇮🇳",555,68,74892,False,"Meanwhile, in China... https://t.co/PgcdIANzak"
2020-02-10 08:02:45+00:00,"Welcome to CDC COC MAKER! We are providing all Flags Documentation PANAMA/ INDIAN/ PALAU/
LIBERIAN/ HONDURAS/ MARSHALL ISLANDS/ BAHAMAS/ ST. KITTS &amp;amp; NEVIS/ SAMOA for STCW/ STSDSD/
CDC/ SEAMAN BOOK/ COE/ COP/ INDOS/ DC/
More Details mobile No - 9997973040 https://t.co/DkcWrFu8WR",cdcmaker32,"Noida, India","Established in the year 2016, We ‘CDC / COC maker’, are an ISO 9001:2008 certified organization engaged in offering Merchant Navy Certification.",189,2203,10771,False,No Value Mentioned
2020-02-10 08:02:54+00:00,"RT @DanishKh4n: [Interview] #Xiaomi India's Manu Jain on Coronavirus impact, handset exports and new products https://t.co/6FqPvcfop4",Basanthabc,India,I never changed. I just learned,171,3264,35202,False,"[Interview] #Xiaomi India's Manu Jain on Coronavirus impact, handset exports and new products https://t.co/6FqPvcfop4"
2020-02-10 08:02:59+00:00,@YatraOfficial how are you helping your customers with booked travel in wake of coronavirus outbreak?,pungoyal,"Bengaluru, India",Building @gojektech,1099,401,3861,False,No Value Mentioned
2020-02-10 08:03:00+00:00,"RT @FirstSquawk: THE CURE RATE FOR THE NOVEL CORONAVIRUS HAS INCREASED SIGNIFICANTLY FROM THE FIGURE ANNOUNCED ON JAN. 27, ACCORDING TO CHI…",nkashimpuria9,India,Energy and Sugar Markets derivatives and Personal Finance Enthusiast,63,36,1922,False,"THE CURE RATE FOR THE NOVEL CORONAVIRUS HAS INCREASED SIGNIFICANTLY FROM THE FIGURE ANNOUNCED ON JAN. 27, ACCORDING TO CHINA'S NATIONAL HEALTH COMMISSION: - 1.3% TO 8.2% ACROSS CHINA - 2.6% TO 6.2% IN WUHAN CITY - 1.7% TO 6.1% IN HUBEI PROVINCE"
2020-02-10 08:03:13+00:00,"#Coronavirus: Over 900 dead in China, and 40,000 infected

https://t.co/0K4aLDzZIe",tagtodayO,india,Breaking News | Tech News | We Retweet Knowledgeable & informative Tweet's from varios News Portals,847,1,19518,False,No Value Mentioned
2020-02-10 08:03:15+00:00,RT @omar270: Those folk in China 🇨🇳 are just inhumane 😱🤬 #coronavirus https://t.co/4pAqvJVS9z,Maazloner_,"Gujarat, India",Software tester,94,112,8272,False,Those folk in China 🇨🇳 are just inhumane 😱🤬 #coronavirus https://t.co/4pAqvJVS9z
2020-02-10 08:03:17+00:00,"#Coronavirus and beyond— reasons why this is not ideal time to buy stocks in India, according to experts, money managers, and researchers - by iyer_sriram

https://t.co/quujcwt2IW https://t.co/WjjNYYZOhV",tagtodayO,india,Breaking News | Tech News | We Retweet Knowledgeable & informative Tweet's from varios News Portals,847,1,19518,False,No Value Mentioned
2020-02-10 08:03:17+00:00,"Everything we know about the pangolin - the scaly mammal that may have spread the coronavirus to humans

https://t.co/MBxS9h2lt9 https://t.co/N3uZ7BfGka",tagtodayO,india,Breaking News | Tech News | We Retweet Knowledgeable & informative Tweet's from varios News Portals,847,1,19518,False,No Value Mentioned
2020-02-10 08:03:20+00:00,RT @yardley_wong: #day6 #coronavirus #CoronavirusOutbreak #quarantined on #DiamondPrincess captain official announcement. Not 60 but 66!!!!…,Sohamchels,India,No Value Mentioned,482,1033,20565,False,#day6 #coronavirus #CoronavirusOutbreak #quarantined on #DiamondPrincess captain official announcement. Not 60 but 66!!!! 😫😫😫😫 some are staffs #hanginthereprincess #Anxiety https://t.co/shlmjWUxEJ
2020-02-10 08:03:23+00:00,"Where is PETA???
And China can go any extent they want...😠😠
This is so cruel..😭 https://t.co/7ngAwNhQbI",iamsush7777,"Bengaluru, India","Passion for: Music, Traveling, Reading, ❤ARIJIT & SPB voice, big fan of  @narendramodi, HINDUSTAN, HINDUTVA🚩 #gulams stay away, #jaishriram🙏",3502,302,17965,False,No Value Mentioned
2020-02-10 08:03:41+00:00,Coronavirus Japan: 130 passengers test positive for coronavirus on quarantined cruise ship #Japan #Coronavirus #DiamondPrincess #CoronavirusOutbreak https://t.co/49Px8ofbxT,ThatSindhiCM,India,Eating each day to live... mandir kahe pe bhi banao,256,4,16680,False,No Value Mentioned
2020-02-10 08:03:47+00:00,RT @HealthwireMedia: #Coronavirus: Big Controversy on death of #Whistleblower #LiWenliang #CoronavirusOutbreak #Wuhan https://t.co/xzDm87BP…,shobhamishra23,"New Delhi, India",Student of LIFE,241,60,1174,False,#Coronavirus: Big Controversy on death of #Whistleblower #LiWenliang #CoronavirusOutbreak #Wuhan https://t.co/xzDm87BPPc
2020-02-10 08:03:47+00:00,RT @detresfa_: One way to touch stuff while moving around in an epidemic zone #China #Coronavirus https://t.co/EpvAYM0XRL,Meenakshi_shn,India,Rts are not endorsements.,1887,1459,84207,False,One way to touch stuff while moving around in an epidemic zone #China #Coronavirus https://t.co/EpvAYM0XRL
2020-02-10 08:03:50+00:00,"#NewsAlert | London calls new #coronavirus ""imminent and serious threat"": news agency AFP",htTweets,India,"One of India's largest media companies. Latest news from around the world. Retweets are not endorsements

Telegram: https://t.co/oRjuzAvYUY",7295601,128,691592,True,No Value Mentioned
2020-02-10 08:03:52+00:00,"#BREAKING | London calls new #coronavirus ""imminent and serious threat""

(News agency AFP) 

For more updates, follow: https://t.co/axEEtxslcV 

#CoronavirusOutbreak https://t.co/m0CtbLmEiL",JagranEnglish,"New Delhi, India",Jagran English the new age Trending News site. Check out https://t.co/UuzBHS8KDs for all latest & top trends across globe.,4646,33,125404,True,No Value Mentioned
2020-02-10 08:04:11+00:00,Virus may have infected 5L in Wuhan by peak https://t.co/d475VghS9k,iBirjuBaba,"Mumbai, India",Gumnam hai Koi,1138,2858,18090,False,No Value Mentioned
2020-02-10 08:04:13+00:00,"RT @FirstSquawk: THE CURE RATE FOR THE NOVEL CORONAVIRUS HAS INCREASED SIGNIFICANTLY FROM THE FIGURE ANNOUNCED ON JAN. 27, ACCORDING TO CHI…",SahilKapoor,"Mumbai, India","Avid learner of Markets, Economics, Sports. First time dad. 'Kitabikida', Always reading!",3248,79,7970,False,"THE CURE RATE FOR THE NOVEL CORONAVIRUS HAS INCREASED SIGNIFICANTLY FROM THE FIGURE ANNOUNCED ON JAN. 27, ACCORDING TO CHINA'S NATIONAL HEALTH COMMISSION: - 1.3% TO 8.2% ACROSS CHINA - 2.6% TO 6.2% IN WUHAN CITY - 1.7% TO 6.1% IN HUBEI PROVINCE"
2020-02-10 08:04:18+00:00,"RT @nytimes: Nearly 100 people died from the coronavirus on Sunday, many of them in Wuhan, China, the epicenter of the epidemic. It was the…",mpramodkumar,"Coimbatore, India","Asstt. Prof, Amrita Darshanam Centre, Amrita Vishwa Vidyapeetham, Coimbatore.
Convenor, Indica Coimbatore.
Sec Gen, Ekal Sansthan CBE, Joint Secretary, BISS TN",1132,1449,24133,False,"Nearly 100 people died from the coronavirus on Sunday, many of them in Wuhan, China, the epicenter of the epidemic. It was the single deadliest day since the outbreak began.

Live updates: https://t.co/QLINDuywew"
2020-02-10 08:04:25+00:00,"RT TechCrunch ""Amazon withdraws from MWC over coronavirus-related concerns https://t.co/bglCsrqmqB by catherineshu https://t.co/n2OlpskLla""",globalxmagzine,India,"Global X Magzine is all about  technology, news, events, gossip and what's happening in this fast-changing world.",282,124,186055,False,No Value Mentioned
2020-02-10 08:04:27+00:00,"RT @vivekagnihotri: How to educate those who think the only truth is in one book? 

How does one talk to the architects of #ShaheenBagh?…",snsadvtg,"Kanpur, India",Follower of our honorable Prime Minister Shri Narendra Modi ji,1296,186,147065,False,"How to educate those who think the only truth is in one book? 

How does one talk to the architects of #ShaheenBagh? 

Same Hoky book can create APJ Kalam and same can cause the genocide of Kashmiri Hindus. 

जा की रही भावना जैसी। https://t.co/T74LJY1664"
2020-02-10 08:04:27+00:00,"RT @LavYada72593149: Today, people of China are very sad to see the death of their family members due to Corona virus‼
If even while killin…",Jitende54245464,"karnal, India",Real god Is Kabir,284,229,44456,False,"Today, people of China are very sad to see the death of their family members due to Corona virus‼
If even while killing the flesh while killing the creatures, they would think that these creatures also have a family, do not have to see this day today https://t.co/4ddd0xhEfl"
2020-02-10 08:04:33+00:00,"Chinese Citizen Journalist Reporting On Coronavirus Outbreak Missing

https://t.co/eQ1pgJonP5

Shared via NDTV News App (Android - https://t.co/cVbDjv7bYu | iPhone - https://t.co/CBsQAIKNe1 )",MickyGupta84,"Mumbai, India","#BureauChief @ndtv Writes for https://t.co/1lQMknHAfz Views personal,NOT @ndtv's.Interests: #Northeast #BBIN. #MobileJournalist #MoJo #ExXIC Loves Dogs&Hills.Foodie.#Hermonite",3734,2237,18556,True,No Value Mentioned
2020-02-10 08:04:39+00:00,"RT @htTweets: #NewsAlert | London calls new #coronavirus ""imminent and serious threat"": news agency AFP",ruknagi,"Noida, India",Change is the essence of life............. be the change you want to see.,308,797,37500,False,"#NewsAlert | London calls new #coronavirus ""imminent and serious threat"": news agency AFP"
