created_at,full_text,screen_name,location,description,followers_count,friends_count,statuses_count,verified,full_retweet_text
2020-03-14 23:54:19+00:00,President Trump's personal physician says the president has tested negative for the new coronavirus. https://t.co/9uSOIZsK7J,FOX59,"Indianapolis, IN","Serving central Indiana with breaking news, sports, weather, community information & more",262912,6321,284362,True,No Value Mentioned
2020-03-14 23:54:21+00:00,RT @ramprasad_c: Italy fatalities will surpass that of China it seems like. Tragic.,bhagwanparge,"Pune, India","Sr. Software Engg. Reading P vs NP, Integer factorization.

My P = NP Paper https://t.co/e4GZZDdLVU",263,950,42571,False,Italy fatalities will surpass that of China it seems like. Tragic. https://t.co/hSXSWnrtS2
2020-03-14 23:54:35+00:00,"RT @rupasubramanya: If there’s one place in the country that has consistently shown leadership in times of crisis, it’s Kerala. Massively i…",Muddasir060785,India,Indian,128,640,28903,False,"If there’s one place in the country that has consistently shown leadership in times of crisis, it’s Kerala. Massively impressed with how the government handled the devastating floods of 2018 and now the #Covid19 crisis.Developed world standards. This is also the “Kerala model”. https://t.co/Jx5FJbBTYv"
2020-03-14 23:54:45+00:00,"RT @VirusesImmunity: Let's dispel the notion that ""novel coronavirus is just like the flu"".  Sharing this striking comparison of #Flu, #COV…",D91882373,India,running coder,22,118,8274,False,"Let's dispel the notion that ""novel coronavirus is just like the flu"".  Sharing this striking comparison of #Flu, #COVID19, #SARS and #MERS made by @BioRender. 

#COVID19 is 30x more deadly and almost 2x more contagious than the flu. We have no existing immunity to COVID19. https://t.co/fdJgsSFMnB"
2020-03-14 23:54:48+00:00,Mahan airlines arrived Mumbai from Tehran with 234 passengers who were stuck in #coronavirus hit country #Iran. @imranrezaansari @MEAIndia @DrSJaishankar,bilalbhat,"Hyderabad, India","News Editor @ ETV Bharat,   (Ramoji Film City, Hyderabad), formerly with Kashmir Reader, Sahara TV, NBC,Tweets are personal, RT's don't mean endorsement",937,1377,1356,False,No Value Mentioned
