created_at,full_text,screen_name,location,description,followers_count,friends_count,statuses_count,verified,full_retweet_text
2020-02-03 21:14:05+00:00,"RT @CDCgov: Are you interested in gaining population health experience as an employee in public health, health care, and community health s…",cityvost,"Indianapolis, IN",Digital Christians gathering into Virtual Operations Support Teams (#VOST) city-by-city to help build #ReadyCity(s) for urgent situations. Join us!,388,549,3599,False,"Are you interested in gaining population health experience as an employee in public health, health care, and community health settings? Apply for the CDC Population Health Training In Place Program! Applications are open now through Feb. 29. https://t.co/ElglS9bJ8r https://t.co/kYI3Jd9rPC"
2020-02-03 21:14:07+00:00,"RT @HimalayaGlobal: Contractor reveals the inside of one of the two #Wuhan  #coronavirus hospitals that were constructed in 10 days

Window…",ranjitmanhas,"Navi Mumbai, India","Play hard,
Forgive quickly,
Apologize when you are wrong, 
Take chances,
and have no regrets.",310,616,54675,False,"Contractor reveals the inside of one of the two #Wuhan  #coronavirus hospitals that were constructed in 10 days

Windows wielded shut,  doors could not be opened from the inside, items delivered from the small window well

It is more like a prison than a ward

#WuhanCoronavirus https://t.co/ccooD2NyYI"
2020-02-03 21:14:20+00:00,"Built in 10 days, China's virus hospital takes 1st patients (from @AP) https://t.co/RjFwS59au8",tn_haokip,"Imphal, India","Formet President,Manipur Pradesh Congress Committee.Former Minister and Speaker, Manipur Legislative https://t.co/ZHdTXL9bbF reading & traveling",1224,68,26115,True,No Value Mentioned
2020-02-03 21:14:33+00:00,RT @abduldanja87: #Turkey has sent medical aid to China and told the world that #Islam does not respond to evil with evil. https://t.co/yzq…,WhySoCreeeepy,India,The INDIAN Muslim 🇮🇳♥️,19,110,1211,False,#Turkey has sent medical aid to China and told the world that #Islam does not respond to evil with evil. https://t.co/yzqwEd3jai https://t.co/Ur6m0V3Fmm
2020-02-03 21:14:33+00:00,"RT @realDonaldTrump: Republicans in Iowa, go out and Caucus today. Your great Trade Deals with China, Mexico, Canada, Japan, South Korea an…",selberan,"INDIA,KERALA,KOLLAM.UAE",YOU ARE LOOKING GOOD,734,4973,87671,False,"Republicans in Iowa, go out and Caucus today. Your great Trade Deals with China, Mexico, Canada, Japan, South Korea and more, are DONE. Great times are coming, after waiting for decades, for our Farmers, Ranchers, Manufacturers and ALL. Nobody else could have pulled this off!"
2020-02-03 21:14:42+00:00,"RT @spectatorindex: Meaning of country's name.

India: Land of the Indus

Iran: Land of Aryans

Japan: Land of rising sun

Egypt: Frontier…",FedGupta,"Bengaluru, India",IT professional. Like to make friends worldwide.,313,3052,7963,False,"Meaning of country's name.

India: Land of the Indus

Iran: Land of Aryans

Japan: Land of rising sun

Egypt: Frontier

Nigeria: Land of the Niger river

Italy: Land of young cattle

France: Land of the Franks

Germany: Fertile land

China: Qin state

Indonesia: Indian islands"
2020-02-03 21:15:08+00:00,"Watch ""The Spread of Coronavirus from China to the World"" on YouTube https://t.co/0rzS544HQz",mathematicsaks,"Ranchi, JH., India",Mathematics Expert & Question Solver.,3,138,50,False,No Value Mentioned
2020-02-03 21:15:09+00:00,The second culture night of the semester is tomorrow!  Join us to learn more about China. https://t.co/YmRENM1g2o,USI_IPS,"Evansville, Indiana","USI Center for International Programs:  central office on campus for all things international - study abroad, immigration, campus programming. #ScrEaglePride",351,180,1269,False,No Value Mentioned
2020-02-03 21:15:27+00:00,"RT @AsatyaHindi: Hii @kunalkamra88
Indigo is seeing Apologies from you, we would like to let you know we have lifted your ban and now you w…",skypatel_,India,🤫,223,1587,43243,False,"Hii @kunalkamra88
Indigo is seeing Apologies from you, we would like to let you know we have lifted your ban and now you would be able to travel from our Indigo Airlines.

* Only valid for Travelling to China."
2020-02-03 21:15:37+00:00,"RT @realDonaldTrump: Republicans in Iowa, go out and Caucus today. Your great Trade Deals with China, Mexico, Canada, Japan, South Korea an…",antonette_souza,"Mumbai, India",No Value Mentioned,180,20,50205,False,"Republicans in Iowa, go out and Caucus today. Your great Trade Deals with China, Mexico, Canada, Japan, South Korea and more, are DONE. Great times are coming, after waiting for decades, for our Farmers, Ranchers, Manufacturers and ALL. Nobody else could have pulled this off!"
2020-02-03 21:15:43+00:00,"RT @GlobeBangkok: Coronavirus concerns may cause your Grab taxi to be late these days, you have been warned 😳😷

#coronavirus #grab https://…",farahsinister,"Indiana, USA","my personality is mine. my attitude depends on yours.

🇲🇾🇺🇸",603,237,69630,False,"Coronavirus concerns may cause your Grab taxi to be late these days, you have been warned 😳😷

#coronavirus #grab https://t.co/0Xw3aDCIXg"
2020-02-03 21:15:46+00:00,RT @ExSecular: Hello @khanumarfa out of 324 people evacuated from China 124 are Muslims and all were chanting har har modi ghar ghar Modi .…,IndiaAnalyst,India,"Pro-logic. Pro-Choice, Anti-Hypocrisy, India First. rt/follow is nt endorsement.
Profile Pic by domdeen / https://t.co/I3aK2xrCaz #CoronaVirus #WuhanVirus",2534,1933,175092,False,Hello @khanumarfa out of 324 people evacuated from China 124 are Muslims and all were chanting har har modi ghar ghar Modi .. am just saying
2020-02-03 21:15:46+00:00,"RT @weatherindia: Authorities revealed that 57 more died on Sunday (February 2) and 2,829 new confirmed cases of #Coronavirus infection wer…",mayurmatani46,"Pune, India",Editor💻 | Writer✏ | Videographer🎬|,15,61,8,False,"Authorities revealed that 57 more died on Sunday (February 2) and 2,829 new confirmed cases of #Coronavirus infection were identified."
2020-02-03 21:16:05+00:00,"@avarakai @HuXijin_GT @China_Amb_India @IndoPac_Info @CestMoiz @KatochPrakash There have been stories of attempts in past 

Top Chinese officials 'plotted to overthrow Xi Jinping' 

- BBC News 

https://t.co/O1hvqevVUO",desertfox61I,India,"Once a Soldier Always a Soldier
RT not endorsements",12134,2726,442153,False,No Value Mentioned
2020-02-03 21:16:08+00:00,RT @mksinghiitd: Pakistan government left its students in China and they will be used as Guinea pig after being infected to test Coronaviru…,HinduNatl,India,"Nationalist, Hindu, architect, #BJP supporter, #IndiaFirst",2520,249,108045,False,Pakistan government left its students in China and they will be used as Guinea pig after being infected to test Coronavirus vaccine. Just wait and watch the true nature of Pak and an eyeopener for many in India. @narendramodi @PMOIndia @Swamy39 @vhsindia @BJP4India @AamAadmiParty
2020-02-03 21:16:09+00:00,"RT @Forbes: The coronavirus that was first found recently in Wuhan, China, is not the same as Corona beer. It has nothing to do with beer h…",Cvijin_separe,"Bollywood,India",No Value Mentioned,42,53,4924,False,"The coronavirus that was first found recently in Wuhan, China, is not the same as Corona beer. It has nothing to do with beer https://t.co/X125beBlQk https://t.co/bTCXlySpSC"
2020-02-03 21:16:21+00:00,RT @RT_com: Streets of #Shanghai get empty amid #coronavirus outbreak https://t.co/o7ZqgYcTRC,selberan,"INDIA,KERALA,KOLLAM.UAE",YOU ARE LOOKING GOOD,734,4973,87671,False,Streets of #Shanghai get empty amid #coronavirus outbreak https://t.co/o7ZqgYcTRC
2020-02-03 21:16:35+00:00,"RT @RT_com: #Timelapse of the #Wuhan Hospital Built in 10 Days:
China has completed construction of the first of two new hospitals. The Huo…",selberan,"INDIA,KERALA,KOLLAM.UAE",YOU ARE LOOKING GOOD,734,4973,87671,False,"#Timelapse of the #Wuhan Hospital Built in 10 Days:
China has completed construction of the first of two new hospitals. The Huoshenshan Hospital has 1,000 beds and is set up in response to the Wuhan #coronavirus.

MORE: https://t.co/1a4s6e3y0l https://t.co/XLWlPTpu05"
2020-02-03 21:16:41+00:00,"RT @Ingenieurbiomed: Liang Wudong, who was treating patients with corona virus in Wuhan, became infected while treating his patients and be…",CaptKalkal,India,"An Infantry Veteran, Rajputana Rifles. Views here are purely personal. Socialist, Secular & Democratic as our preamble says. RTs are not endorsements always.",581,640,18348,False,"Liang Wudong, who was treating patients with corona virus in Wuhan, became infected while treating his patients and becomes the first doctor to die for corona virus. A reminder that while everyone tries to avoid it, front line medical staff risk their lives to save others. https://t.co/wVNHLCKnFZ"
2020-02-03 21:16:49+00:00,"RT @QuickTake: China has completed its 1st emergency #coronavirus hospital in 10 days.

Here’s a look at the construction of the 1,000-bed…",shanethewriter5,Indiana,I'm a #writer.#Politician.#Lyricist. freelance #columnist and #author of 'Life In Idleness' and soon to be certified #nutritionist & #fitness trainer.,421,1664,7320,False,"China has completed its 1st emergency #coronavirus hospital in 10 days.

Here’s a look at the construction of the 1,000-bed #Huoshenshan hospital in #Wuhan. More @business: https://t.co/rzNpGUStbB #CoronavirusOutbreak  #新型肺炎 https://t.co/rZwv36MNWA"
2020-02-03 21:17:12+00:00,"RT @AFP: China's unprecedented quarantining of virus-hit Wuhan has separated millions from their families -- and many from their pets, prom…",selberan,"INDIA,KERALA,KOLLAM.UAE",YOU ARE LOOKING GOOD,734,4973,87671,False,"China's unprecedented quarantining of virus-hit Wuhan has separated millions from their families -- and many from their pets, prompting worried owners and kind strangers to take to social media to ensure left-behind animals are looked after https://t.co/Bjc1dusARW"
2020-02-03 21:17:23+00:00,RT @AFP: Hundreds of residents of a remote Indonesian island protested the government's decision to use it to quarantine evacuees from the…,selberan,"INDIA,KERALA,KOLLAM.UAE",YOU ARE LOOKING GOOD,734,4973,87671,False,Hundreds of residents of a remote Indonesian island protested the government's decision to use it to quarantine evacuees from the Chinese city at the epicentre of the coronavirus outbreak https://t.co/wkJBKu4Rmh
2020-02-03 21:17:24+00:00,#Coronavirous😂😂 @ReallySwara And @kunalkamra88 Should be send first 🤓🤓.. https://t.co/9MELSTxQEO,KkswainS,"Bengaluru, India","Humanitarian, Ambitious. I'm proud Indian...tweets only for better India..",91,589,267,False,No Value Mentioned
2020-02-03 21:17:48+00:00,"RT @bradygibson: US Coronavirus cases: 11
US Coronavirus deaths: 0
US Flu cases (this season): 19,000,000 – 26,000,000
US Flu deaths (this…",93wibc,"Indianapolis, IN","On the level. On the go.
🎙@tonykatz 6-9am & 11am-1pm
🎙@chicksonright 9am-11am
🎙@hammerandnigel 3pm-7pm

INSTAGRAM
📷 @93wibc",30381,1798,108203,True,"US Coronavirus cases: 11
US Coronavirus deaths: 0
US Flu cases (this season): 19,000,000 – 26,000,000
US Flu deaths (this season): 10,000 – 25,000
Indiana Flu deaths: 45"
2020-02-03 21:18:13+00:00,"RT @zoo_bear: I think she and @madhukishwar is on same WhatsApp group. 🙄

""Demonetisation ka baad China ka Business thap ho gaya tha, Waha…",reuben383,"New Delhi, India",No Value Mentioned,47,51,18502,False,"I think she and @madhukishwar is on same WhatsApp group. 🙄

""Demonetisation ka baad China ka Business thap ho gaya tha, Waha ki Economy hill gayi thi, Modi ji ne baithe baithe dusre desho ko hila Diya tha"" https://t.co/bniktqkEoP https://t.co/1eSIWafrcu"
2020-02-03 21:18:35+00:00,"RT @layshands: According to published donation list from Wuhan Red Cross, Yixing donated 100 thousand RMB via his studio sometimes between…",Aditi67927486, India,follow @weareoneEXO (OT9 stans only and no solo stans or OT8 please),349,343,80581,False,"According to published donation list from Wuhan Red Cross, Yixing donated 100 thousand RMB via his studio sometimes between Jan 22th - Jan 28th 💪💪💪  
@layzhang @lay_studio #Lay https://t.co/NPrZANXDlR"
2020-02-03 21:18:44+00:00,"RT @sagenaradamuni: Is this true ?

AIDS found in Congo
Nipah found in Malaysia
Corona found in China
Ebola found in Africa
Dengue found in…",vijalgope,"Ranchi, India","Non Political, MBA, Businessman, Hindu Nationalist.",8613,2688,105775,False,"Is this true ?

AIDS found in Congo
Nipah found in Malaysia
Corona found in China
Ebola found in Africa
Dengue found in HongKong

In India, Crores of People gather for Puri Jagannath Yatra, Crores of People take Holy Dip in Kumbhamela....

No special Virus found"
2020-02-03 21:18:46+00:00,"RT @cjwerleman: Locating a contagious virus – one that does not discriminate against race, religion, culture or creed – within Chinese food…",shahidssm,"ಬೆಂಗಳೂರು , India",SELF EMPLOYED,453,722,17067,False,"Locating a contagious virus – one that does not discriminate against race, religion, culture or creed – within Chinese food culture is no different than locating ‘Islamic’ terrorism in the religious practices of Muslims.

My latest for @BylineTimes.

https://t.co/zisOGhMLhM"
2020-02-03 21:18:54+00:00,"RT @ANI: A WHO-led international team of experts could go to China as early as this week to investigate the #coronavirus outbreak, as agree…",selberan,"INDIA,KERALA,KOLLAM.UAE",YOU ARE LOOKING GOOD,734,4973,87671,False,"A WHO-led international team of experts could go to China as early as this week to investigate the #coronavirus outbreak, as agreed between WHO (World Health Organisation) chief &amp; Chinese President Xi Jinping, and could include US experts, a WHO spokesman said on Monday: Reuters https://t.co/BgV1SDJhCG"
2020-02-03 21:19:33+00:00,"RT @ANI: Kerala: #CoronaVirus has been declared as a state disaster, on directions of Chief Minister Pinarayi Vijayan. https://t.co/04rOXTs…",selberan,"INDIA,KERALA,KOLLAM.UAE",YOU ARE LOOKING GOOD,734,4973,87671,False,"Kerala: #CoronaVirus has been declared as a state disaster, on directions of Chief Minister Pinarayi Vijayan. https://t.co/04rOXTsAzd"
2020-02-03 21:19:39+00:00,"RT @Pun_Starr: China has built a 1000 bed hospital for Coronavirus patients in just 10 days.

Meanwhile, the govt of India hasn't been able…",Dhanuu007,"Nashik, India","SRK 🙏🙌😍
Bday on 22 March",756,2480,64672,False,"China has built a 1000 bed hospital for Coronavirus patients in just 10 days.

Meanwhile, the govt of India hasn't been able to move anywhere for 2 months because of traffic jam at Shaheen Bagh."
2020-02-03 21:19:40+00:00,"RT @yessirtns: Its easy to mak fun of the loss made by AIR INDIA.The GOVT even put up its  entire shares fr sale. But, when it comes to ope…",SortedEagle,India,No Value Mentioned,4606,2663,77226,False,"Its easy to mak fun of the loss made by AIR INDIA.The GOVT even put up its  entire shares fr sale. But, when it comes to operating a flight to Wuhan to get our fellow countrymen back, d GOVT has only one option. That is AIR INDIA. Be it Libya, Yemen &amp; now Wuhan 
🙏🙏🇮🇳
#AirIndia"
2020-02-03 21:19:44+00:00,"People are literally not understanding how bad exactly the Coronavirus is. I blame the media for this. No fucking investigation, no questions, just regurgitating Chinese propoganda and telling the people, 'Its just a flu bro!'. People will get it when the bodies start dropping.",JatNationalist,India,Traditional Conservative. Hardcore Nationalist. Currently focused on the Coronavirus (COVID-19).,1565,703,10609,False,No Value Mentioned
2020-02-03 21:19:52+00:00,RT @PDChina: #Wuhan announced on Mon to build mobile cabin hospitals on its sports stadium and two convention centers to treat novel #coron…,selberan,"INDIA,KERALA,KOLLAM.UAE",YOU ARE LOOKING GOOD,734,4973,87671,False,#Wuhan announced on Mon to build mobile cabin hospitals on its sports stadium and two convention centers to treat novel #coronavirus infected patients with mild syndromes. Timelapse video shows the work underway. https://t.co/kCdmtNJV3n
2020-02-03 21:19:58+00:00,"RT @PDChina: Race against time! After the #Huoshenshan Hospital built in 10 days went operational on Sunday, China is working at top speed…",selberan,"INDIA,KERALA,KOLLAM.UAE",YOU ARE LOOKING GOOD,734,4973,87671,False,"Race against time! After the #Huoshenshan Hospital built in 10 days went operational on Sunday, China is working at top speed to build the 2nd special hospital, #Leishenshan Hospital, which is due to open on February 5 to treat treating patients infected with novel #coronavirus https://t.co/mz4AG3mfhk"
2020-02-03 21:20:03+00:00,RT @PDChina: Winding mountain highway in N China's Shanxi will blow you away! #infrastructure #MadeInChina https://t.co/ZJsMMaB76Z,selberan,"INDIA,KERALA,KOLLAM.UAE",YOU ARE LOOKING GOOD,734,4973,87671,False,Winding mountain highway in N China's Shanxi will blow you away! #infrastructure #MadeInChina https://t.co/ZJsMMaB76Z
2020-02-03 21:20:03+00:00,RT @suhaunah: Fear of coronavirus is fueling racist sentiment toward East Asians; I spoke to people who fielded suspicious looks &amp; nasty co…,ibrahim_extreme,"Thane, India",No Value Mentioned,0,6,8,False,"Fear of coronavirus is fueling racist sentiment toward East Asians; I spoke to people who fielded suspicious looks &amp; nasty comments. Derogatory jokes gathered steam online, drawing on age-old racist tropes associating Chinese people w disease &amp; dirty food https://t.co/lncH40qTBx"
2020-02-03 21:20:06+00:00,"RT @asianosint: Don’t say I didn’t warn you, India. Now Indian government should put Kerala state under quarantine before it spreads elsewh…",mayank1999s,India,"Sanatan believer.
Proud HINDU & INDIC civilization researcher.
Reject left historians
YouTube channel for fact check clips. Subscribe. 
https://t.co/HLKKvN0uPw",482,1521,171564,False,"Don’t say I didn’t warn you, India. Now Indian government should put Kerala state under quarantine before it spreads elsewhere. 500 people from China returned to Kerala alone, many of them from Wuhan province. ⚠️ https://t.co/sq3HUt1iay"
2020-02-03 21:20:08+00:00,RT @PDChina: #Wuhan city in C China has suspended #immigration administration services as part of the prevention and control measures of no…,selberan,"INDIA,KERALA,KOLLAM.UAE",YOU ARE LOOKING GOOD,734,4973,87671,False,"#Wuhan city in C China has suspended #immigration administration services as part of the prevention and control measures of novel #coronavirus epidemic, local authorities said Monday https://t.co/vVeuKYLix2"
2020-02-03 21:20:20+00:00,"RT @cjwerleman: Locating a contagious virus – one that does not discriminate against race, religion, culture or creed – within Chinese food…",Li_Humanity,"Mumbai, India","During times of universal deceit, telling the truth becomes a revolutionary act - Orwell. Injustice anywhere is threat to justice everywhere - Martin Luth k.jr.",185,1052,75784,False,"Locating a contagious virus – one that does not discriminate against race, religion, culture or creed – within Chinese food culture is no different than locating ‘Islamic’ terrorism in the religious practices of Muslims.

My latest for @BylineTimes.

https://t.co/zisOGhMLhM"
2020-02-03 21:20:23+00:00,"RT @PDChina: A 4.6-magnitude #earthquake hit Hualien County in SE China's Taiwan at 01:02 a.m. Tuesday (local time), according to the China…",selberan,"INDIA,KERALA,KOLLAM.UAE",YOU ARE LOOKING GOOD,734,4973,87671,False,"A 4.6-magnitude #earthquake hit Hualien County in SE China's Taiwan at 01:02 a.m. Tuesday (local time), according to the China Earthquake Networks Center (CENC). https://t.co/Q8RyzZP9Z6"
2020-02-03 21:20:26+00:00,"RT @PDChina: #AmazingChina These volcanoes are more than 200 years away from the last eruption. For volcanoes, more than 200 years is not l…",selberan,"INDIA,KERALA,KOLLAM.UAE",YOU ARE LOOKING GOOD,734,4973,87671,False,"#AmazingChina These volcanoes are more than 200 years away from the last eruption. For volcanoes, more than 200 years is not long at all. They are young volcanoes in China, but they have witnessed the birth of the Wudalianchi Scenic Area. https://t.co/wVJ8BxHQ9D"
2020-02-03 21:20:34+00:00,RT @PDChina: #China had imported more than 810 million yuan (about 117 million U.S. dollars) worth of medical supplies as of Sunday to ease…,selberan,"INDIA,KERALA,KOLLAM.UAE",YOU ARE LOOKING GOOD,734,4973,87671,False,"#China had imported more than 810 million yuan (about 117 million U.S. dollars) worth of medical supplies as of Sunday to ease domestic shortages amid efforts to contain the novel #coronavirus outbreak, customs data showed Monday #2019nCoV https://t.co/ykEFAcTJUi"
2020-02-03 21:20:36+00:00,"RT @realDonaldTrump: Republicans in Iowa, go out and Caucus today. Your great Trade Deals with China, Mexico, Canada, Japan, South Korea an…",SherryDavis8,Indiana,"❤️ @realdonaldtrump, 🤒of our corrupt government officials.
#MAGA
#TRUMP2020
#WWG1WGA
#DRAINTHESWAMP
#BUILDTHEWALL
Happily Married for 36 years",3466,3546,38280,False,"Republicans in Iowa, go out and Caucus today. Your great Trade Deals with China, Mexico, Canada, Japan, South Korea and more, are DONE. Great times are coming, after waiting for decades, for our Farmers, Ranchers, Manufacturers and ALL. Nobody else could have pulled this off!"
2020-02-03 21:20:37+00:00,RT @PDChina: China's finance authorities at all levels have allocated 47 billion yuan (about 6.8 billion U.S. dollars) as of midnight Feb.…,selberan,"INDIA,KERALA,KOLLAM.UAE",YOU ARE LOOKING GOOD,734,4973,87671,False,"China's finance authorities at all levels have allocated 47 billion yuan (about 6.8 billion U.S. dollars) as of midnight Feb. 2 for the novel #coronavirus prevention and control work, official data showed https://t.co/tM3sBuJSvO"
2020-02-03 21:20:38+00:00,"@imSupriyaGusain Regret, we are bounded by the airline's discretion.  As of now, the airlines are only providing a refund for the flight to and from China only.",makemytripcare,"Gurgaon, India",Please see our FAQs on COVID-19 for quick resolution to your travel concerns. Link https://t.co/1Pq9NVVMcH,25010,6755,311240,False,No Value Mentioned
2020-02-03 21:20:39+00:00,"@imSupriyaGusain Regret, we are bounded by the airline's discretion.  As of now, the airlines are only providing a refund for the flight to and from China only.",makemytripcare,"Gurgaon, India",Please see our FAQs on COVID-19 for quick resolution to your travel concerns. Link https://t.co/1Pq9NVVMcH,25010,6755,311240,False,No Value Mentioned
2020-02-03 21:20:40+00:00,"RT @PDChina: An inside look at the Huoshenshan Hospital, which was finished in 10 days in #Wuhan. On February 2, the makeshift hospital beg…",selberan,"INDIA,KERALA,KOLLAM.UAE",YOU ARE LOOKING GOOD,734,4973,87671,False,"An inside look at the Huoshenshan Hospital, which was finished in 10 days in #Wuhan. On February 2, the makeshift hospital began to receive #coronavirus patients. Each ward has a toilet with a water heater and an air purifier. https://t.co/clxWsVw8sk"
2020-02-03 21:20:41+00:00,"RT @NerdKid_94: The deceased is a 44 years old men from Wuhan that traveled to Philippines.

Please read the whole article ya 😅",farshisui,"Indiana, USA",🤪,594,633,38065,False,"The deceased is a 44 years old men from Wuhan that traveled to Philippines.

Please read the whole article ya 😅 https://t.co/ssB411LcdU"
2020-02-03 21:20:43+00:00,"RT @PDChina: Chinese President #XiJinping chaired a meeting Mon on the prevention and control of novel #coronavirus outbreak, where Xi expr…",selberan,"INDIA,KERALA,KOLLAM.UAE",YOU ARE LOOKING GOOD,734,4973,87671,False,"Chinese President #XiJinping chaired a meeting Mon on the prevention and control of novel #coronavirus outbreak, where Xi expressed respect to those fighting on the front line against the epidemic and greeted patients and their families. (file pic) https://t.co/3QMNtczcUf"
2020-02-03 21:20:45+00:00,"RT @PDChina: Multiple medical institutions are conducting #clinicaltrials for the anti-novel #coronavirus #drug #Remdesivir, Chinese health…",selberan,"INDIA,KERALA,KOLLAM.UAE",YOU ARE LOOKING GOOD,734,4973,87671,False,"Multiple medical institutions are conducting #clinicaltrials for the anti-novel #coronavirus #drug #Remdesivir, Chinese health authorities said Monday #2019nCoV https://t.co/5IHazBlw36"
2020-02-03 21:20:45+00:00,"RT @P1GGY6: 🎉🎉❤️💕KNIFE GIVEAWAYS 🎉🎉❤️💕
Hello Twitter! I am a 14-year-old (perhaps the youngest) collector of Katowice items in China.

I am…",kapil_rai_,India 76561198810862477,"let's be real 
Play's CSGO || 👀 Netflix || Undergraduate in Computer Science.

https://t.co/uxO5bnf9lS",117,1376,10627,False,"🎉🎉❤️💕KNIFE GIVEAWAYS 🎉🎉❤️💕
Hello Twitter! I am a 14-year-old (perhaps the youngest) collector of Katowice items in China.

I am giving away this cool crimson knife in 8 days.

To participate:
1. RT
2. Follow me @P1GGY6 @ohnePixel 

Thank you guys and have a nice day.🐷🐷🐷 https://t.co/cPsk5Vv0sl"
2020-02-03 21:20:48+00:00,"RT @PDChina: China's #HongKong #economy dropped 1.2% year-on-year in 2019, the 1st annual contraction over the past decade, as months-long…",selberan,"INDIA,KERALA,KOLLAM.UAE",YOU ARE LOOKING GOOD,734,4973,87671,False,"China's #HongKong #economy dropped 1.2% year-on-year in 2019, the 1st annual contraction over the past decade, as months-long unrest and chaos dealt a crushing blow to a wide range of industries from tourism to catering https://t.co/s6UA1n97ah"
