created_at,full_text,screen_name,location,description,followers_count,friends_count,statuses_count,verified,full_retweet_text
2020-02-10 06:58:05+00:00,"RT @VISHAL24550258: Eating meat is a heinous sin.
It increases the risk of cancer and other deadly diseases. Like the corona virus came fro…",godavari_kapoor,"Chandigarh, India",Sat sahib ji,188,86,311040,False,"Eating meat is a heinous sin.
It increases the risk of cancer and other deadly diseases. Like the corona virus came from the meat market.
#NoMeat_NoCoronaVirus https://t.co/QeRjIvnJXH"
2020-02-10 06:58:06+00:00,"@ParineetiChopra Corona virus photoshoot?😬😬 Are you serious? 
Did you buy that mask because it matches your shirt? 
Did you install antivirus in your phone? 😂😂",BongMindz,India,An independent opinionated thinker.,11,239,1436,False,No Value Mentioned
2020-02-10 06:58:08+00:00,"RT @VISHAL24550258: #NoMeat_NoCoronaVirus
Coronavirus in China showed that there are somethings above humans over which humans have no cont…",godavari_kapoor,"Chandigarh, India",Sat sahib ji,188,86,311040,False,"#NoMeat_NoCoronaVirus
Coronavirus in China showed that there are somethings above humans over which humans have no control. The True Worship of God controls these. https://t.co/vDCdwjuo4N"
2020-02-10 06:58:10+00:00,RT @timesofindia: Coronavirus: How not to get sick while traveling https://t.co/BGS1qPEg52 via @TOIWorld,Vivek94890637,NEW DELHI INDIA ,"Student ,Social worker",107,4730,140644,False,Coronavirus: How not to get sick while traveling https://t.co/BGS1qPEg52 via @TOIWorld
2020-02-10 06:58:12+00:00,"RT @StephenMcDonell: Poor people on board this ship must be freaking out a bit, although 130 cases amongst 3,500 people is still small.",NavroopSingh_,"New Delhi, India","IPR Attorney, Geo Political Analyst, co-author of two books #TheNewGlobalOrder & #KoreanPeninsula with @AsianWarrior, Music Lover, Poet. RTs ≠Endorsements",25156,3327,698644,False,"Poor people on board this ship must be freaking out a bit, although 130 cases amongst 3,500 people is still small. https://t.co/ZlJeVVrHnb"
2020-02-10 06:58:12+00:00,"RT @VISHAL24550258: Go vegan today to improve your health, animal kindness, the environment, and to prevent billions of people from dying i…",godavari_kapoor,"Chandigarh, India",Sat sahib ji,188,86,311040,False,"Go vegan today to improve your health, animal kindness, the environment, and to prevent billions of people from dying in misery from preventable diseases like the corona virus.

#NoMeat_NoCoronaVirus China

Must watch sadhna TV at 7:30pm 
@SaintRampalJiM https://t.co/WhDAfZV8FT"
2020-02-10 06:58:16+00:00,"RT @porbotialora: Chinese actress Dilraba Dilmurat

She is an ethnic Uyghur but can speak Mandarin fluently

She is one of the most popular…",rohittiwari22,India,"Jai Shri Ram .Religion :Hindu ,a vegetarian, Engineer  , नमस्ते सदा वत्सले मातृभूमे!!Reason to join Twitter @Swamy39 & @RajivMessage",396,715,39068,False,"Chinese actress Dilraba Dilmurat

She is an ethnic Uyghur but can speak Mandarin fluently

She is one of the most popular actresses in China right now https://t.co/BWrVcWmLTs"
2020-02-10 06:58:18+00:00,"Coronavirus impact: Experts see weakest quarter for global growth since GFC

#coronavirus #WuhanVirus 

https://t.co/PexbKs3ZDe",mylucky137276,"Mumbai, India","Hi, Myself  Lucky",798,3766,24369,False,No Value Mentioned
2020-02-10 06:58:19+00:00,RT @yaneerbaryam: BREAKING: Dramatic drop in new China Coronavirus case counts today. Confirmed (blue dots in attached) and suspected (red…,NeerajK_,"Mumbai, India",Views are strictly personal. RTs not to be treated as endorsments,851,425,57603,False,"BREAKING: Dramatic drop in new China Coronavirus case counts today. Confirmed (blue dots in attached) and suspected (red dots) declined. As recent days suggested, once counts decrease we should expect rapid decline. https://t.co/knjRVbOpAc"
2020-02-10 06:58:25+00:00,RT @MirrorBreaking_: Sixty more people onboard quarantined coronavirus cruise test positive for virus https://t.co/P1TLUjv0dg https://t.co/…,Vivek94890637,NEW DELHI INDIA ,"Student ,Social worker",107,4730,140644,False,Sixty more people onboard quarantined coronavirus cruise test positive for virus https://t.co/P1TLUjv0dg https://t.co/AeTSn3okJf
2020-02-10 06:58:25+00:00,RT @coriiiiiiiiiii1: This store serving from a distance. #coronavirus  https://t.co/ruGR8zseBA,GBK_Tweets,India,"Student, #Biochemist.
Diehard fan of @actorvijay, @urstrulymahesh, @msdhoni, Lionel Messi, @chennaiIPL, @Chennaiyinfc, @fcbarcelona, @indianfootball 🇮🇳😊",1336,2460,368839,False,This store serving from a distance. #coronavirus  https://t.co/ruGR8zseBA
2020-02-10 06:58:31+00:00,"RT @TimesNow: #LIVE | Centre's statement on Coronavirus. 

'India is completely prepared &amp; all precautionary measures are in place,' says U…",pickooo,"New Delhi, India",Athlete⛹️Aesthetic💪Fitness lover 🏋️Traveler🏂 Interest in Social|Defence|Politics|Sports|Foreign Policy|Information Technology|Digital India|Data Analyst|AI.,7755,404,565423,False,"#LIVE | Centre's statement on Coronavirus. 

'India is completely prepared &amp; all precautionary measures are in place,' says Union Health Minister @drharshvardhan in the Lok Sabha. 

Listen in. https://t.co/sW1UNxFKRG"
2020-02-10 06:58:38+00:00,China's economic growth could see a swift uptick in the second quarter if the virus is brought under control by end of February: analyst https://t.co/t4jFuUCiXU https://t.co/OJU9nbezG3,muralikumarje,"Tamil Nadu, India","Latest news updates.... Indian Stock markets NSE, BSE and World Stock markets related news and more.",4166,66,267873,False,No Value Mentioned
2020-02-10 06:58:50+00:00,RT @ReutersBiz: Amazon withdraws from Barcelona's Mobile World Congress tech conference over coronavirus - El Mundo https://t.co/5dg6gR6pAM…,avinash_mailme,India,No Value Mentioned,1107,1346,528793,False,Amazon withdraws from Barcelona's Mobile World Congress tech conference over coronavirus - El Mundo https://t.co/5dg6gR6pAM https://t.co/ApEnNEgOiz
2020-02-10 06:58:52+00:00,"RT @XHNews: To cut off virus spreading, Wuhan, epicenter of novel coronavirus outbreak, is combing communities to leave no coronavirus pati…",muralikumarje,"Tamil Nadu, India","Latest news updates.... Indian Stock markets NSE, BSE and World Stock markets related news and more.",4166,66,267873,False,"To cut off virus spreading, Wuhan, epicenter of novel coronavirus outbreak, is combing communities to leave no coronavirus patients unattended. #WuhanMoments https://t.co/v1h9kGhbrZ https://t.co/DlslBQhHwv"
2020-02-10 06:58:52+00:00,Sick https://t.co/tCvvAA0KNL,notmyhell,India,"PhD. Interested in Politics, History
Department of Science and Technology, TCS 
Views are personal",13,81,1328,False,No Value Mentioned
2020-02-10 06:58:59+00:00,RT @andhroindian: 🙄 #CoronaVirus impact in China https://t.co/SwQrE7wVlh,JSPSriram,India,"Indian, Janasena Soldier,
Pawan Kalyan, Traveller ,Tweets are personal opinions 😌",6431,260,16560,False,🙄 #CoronaVirus impact in China https://t.co/SwQrE7wVlh
2020-02-10 06:58:59+00:00,"Thanks for clarification.
@the_hindu
@TheHinduScience 

Reporters should be vigilante enough while reporting sensitive issues.
https://t.co/34uZ8altAC",SonuKRDubey,"New Delhi, India",I'm practicing Social Distancing,2514,1279,70847,False,No Value Mentioned
2020-02-10 06:59:01+00:00,#CoronaVirus and India’s preparedness to tackle such situations. https://t.co/lHxfoDnM1B,Loksatta_Party,India,"Loksatta in news : https://t.co/AJVzI7fIAg || FB = https://t.co/Gmr48sRhLD || Dr JP: @jp_loksatta , https://t.co/EjbKa7m8WD",33450,554,11443,True,No Value Mentioned
2020-02-10 06:59:26+00:00,RT @jenniferatntd: A netizen in #Wuhan: Let me tell you what our feeling is now. A batch of chickens are in a cage of a restaurant. Everyda…,rishabhrps,"Bengaluru South, India","Not thinking too hard, but also not really having fun with things.",20,126,560,False,A netizen in #Wuhan: Let me tell you what our feeling is now. A batch of chickens are in a cage of a restaurant. Everyday the chef comes to get two out. We feel exactly like the chickens that are not taken yet. Watch the video to understand better.#Coronavirus #coronaviruschina https://t.co/f4A7Tkx6nC
2020-02-10 06:59:28+00:00,Fuck fuck fuck fuck fuck Coronavirus. It's fucking with everything.,AkashDChoudhary,"Gurgaon, India","Living life one day at a time.
Something at @travartofficial",1081,564,1773,False,No Value Mentioned
2020-02-10 06:59:32+00:00,B'deshi worker tested positive for NCoV in Singapore - https://t.co/2ibf8GVNm3 https://t.co/QI8M00YXGR,YuvNewsOfficial,"Hyderabad, India","Get flash news and regular updates on Politics, Economy, Science and Technology, Entertainment, Sports, Health and Legal all over the world.",268,77,17636,False,No Value Mentioned
2020-02-10 06:59:34+00:00,RT @coriiiiiiiiiii1: Chinese billionaire shares #coronavirus case numbers. Claims that millions are infected and tens of thousands have die…,iamRsrivastava,"Bengaluru, India","🇮🇳Jai Hind Jai Bharat🇮🇳 क्‍या हार में क्‍या जीत में,किंचित नहीं भयभीत मैं. संधर्ष पथ पर जो मिले यह भी सही वह भी सही।",118,104,2462,False,Chinese billionaire shares #coronavirus case numbers. Claims that millions are infected and tens of thousands have died. Draconian measures seem to be impelemented.  https://t.co/f0ImOS5CtR
2020-02-10 06:59:40+00:00,"@SingaporeAir Hi,we have a flight booked to singapore on 14th Feb.We need to cancel this amidst CoronaVirus alert turned to Orange in the city of singapore..Is it possible to refund the amount please?we should not be penalised for cancelling the flight, Booking ID:NN2912250365880",soujanya84,"Bengaluru, India",No Value Mentioned,19,51,4,False,No Value Mentioned
2020-02-10 06:59:47+00:00,"China's Tianjin University claims of testing #coronavirus in 15 minutes

https://t.co/y9QO6o5t3U https://t.co/3sfkpuUaoZ",livemint,India,"Breaking news and analyses of Indian and world business, economy and politics from Mint. Now also on Telegram: https://t.co/oYiXyX3x8l",1867597,127,307398,True,No Value Mentioned
2020-02-10 06:59:56+00:00,@sen_ggs Don't go out unnecessarily and use coronavirus mask. Take care ..,3_karnail,India,confidence + honesty = me🦹,11,36,204,False,No Value Mentioned
2020-02-10 06:59:54+00:00,RT @AnnuJal: A widely circulated post in #China this week shows a photo of boxes of face-masks donated from Japan for Wuhan. One line drew…,ENjoydeepLY,"Mumbai , India","”अयं बन्धुरयं नेति गणना लघुचेतसाम् | उदारचरितानां तु वसुधैव कुटुम्बकम् ||” 
Passionate £earner & interested in sports,travel,mark€tiΠg, ¢ooking,※রবীন্দ্রসঙ্গীত※",651,276,46743,False,"A widely circulated post in #China this week shows a photo of boxes of face-masks donated from Japan for Wuhan. One line drew attention. It read: 山川异域 风月同天 which roughly translates ""Lands apart, Same sky"" #Tang #Poetry #Jianzhen (鑑真 Jpn: Ganjin)
Sharing from @sfzc 🙏🏼🌍 https://t.co/FTKKoBuh3d"
2020-02-10 06:59:57+00:00,"Pakistan refuses to evacuate it's own citizens from China👇

https://t.co/DlauALMIrP",NairSundar,"Coimbatore, India","I am a retired person, interested in sports and present happenings.I cannot stand hypocrisy and open to new information.",145,217,29172,False,No Value Mentioned
