created_at,full_text,screen_name,location,description,followers_count,friends_count,statuses_count,verified,full_retweet_text
2020-05-24 01:27:35+00:00,"RT @ImranKhanPTI: Wishing a special Eid Mubarak to Kashmiris in IOJK, and admiration for their patience and courage during the inhumane loc…",magray_momin,India occupied Kashmir ,"‏‏‏‏‏‏‏‏‏‏‏﷽
لا إله إلا الله محمد رسول الله
اَشْهَدُ اَنْ لَّآ اِلٰهَ اِلَّا اللهُ وَحْدَہٗ لَاشَرِيْكَ لَہٗ وَاَشْهَدُ اَنَّ مُحَمَّدًا عَبْدُهٗ وَرَسُولُہٗ‎
‎",51,52,5,False,"Wishing a special Eid Mubarak to Kashmiris in IOJK, and admiration for their patience and courage during the inhumane lockdown and continuing oppression by Indian Occupation forces."
2020-05-24 01:27:35+00:00,"RT @friendsofrss: RSS volunteers donated blood for corona infected patients at a community centre of Barwala, Panchkula. Total 66 units of…",Naveenku555,India,Yeh dil manger more,1244,1432,233926,False,"RSS volunteers donated blood for corona infected patients at a community centre of Barwala, Panchkula. Total 66 units of blood has been donated. https://t.co/N060XlhtUp"
2020-05-24 01:27:39+00:00,"@SonuSood appreciate nd hattsof sir we proud of you u r doing wonderful work during lockdown!!
Great work sir u r such a hero..
🙏🙏🙏",RajeshS75526058,Mirzapur India,"Mai Ladakiyo ke liye car ka Gate nhi kholta aur nhi nicha  samjhta hu..
But Jaha Unke sath galat hota h..par unke liye phle mai khada rhta hu..☺️☺️",19,152,39,False,No Value Mentioned
2020-05-24 01:27:42+00:00,"Surely these migrants n poor deserve a treat let's celebrate #Eid
Making them feel special
Jazak Allah for all those doing this.
May Allah also make us the source of happiness for poor n underprivileged.
#MigrantLivesMatter 
#MigrantsOnTheRoad https://t.co/c55Vh2umRF",ProudMuhajabah,India,Striving Muslimah•Psychology•Aim is pleasure of Allah and occupation is Tarbiyah of 3 highly energetic n curious kids.Alhamdullilah,271,423,2758,False,No Value Mentioned
2020-05-24 01:27:46+00:00,"RT @SanjayShivaR: They tried to do this back in 2012, but Hindus protested in large numbers and it finally did not happen. The Commies now…",BharatDharmaom,"Anantapur, India",ॐ हर हर हर महादेव  🙏 🚩,402,1028,15204,False,"They tried to do this back in 2012, but Hindus protested in large numbers and it finally did not happen. The Commies now know that we cannot gather bcoz of #COVID19 hence they're desperately trying to do this ASAP. PLEASE RAISE YOUR VOICE.

#FreeHinduTemplesFromGovtControl"
2020-05-24 01:27:46+00:00,RT @GSPC_Gujarat: @KrunalS333  We all are so happy on this good news and proud on your brave work support to our society in this critical t…,visittorohit,"Gujarat, India",Junior Pharmacist CHC Kalol Dist. Gandhinagar,46,11,301,False,"@KrunalS333  We all are so happy on this good news and proud on your brave work support to our society in this critical time.
Do share your experience fighting against Covid-19 to motivate our front line #pharmacistwarriors
#gspcheros
@CMOGuj
@drharshvardhan 
@PS_HFWD_GUJ https://t.co/jFNOyKSs88"
2020-05-24 01:27:46+00:00,"RT @Shivamda: @Sidd16393 Virus have strong propensity to mutate, and change their surface antigen, or combine DNA with another virus to for…",rakesh26329280,"Bihar, India",No Value Mentioned,1087,614,450561,False,"@Sidd16393 Virus have strong propensity to mutate, and change their surface antigen, or combine DNA with another virus to form a novel species (like in coronavirus).

Hence, it is difficult to get a definitive treatment or develop a long lasting immunity against them."
2020-05-24 01:27:47+00:00,RT @ANINewsUP: UP govt bans use of mobile phones by patients in isolation wards of L-2 &amp; L-3 dedicated #COVID19 hospitals. The mobile phone…,PrayagrajSocial,"Allahabad, India","♻️Prayagraj goes Social ! Explore the Smart City on Social Media,get updates what’s happening around the Kumbh City. Follow🔛Facebook•27K+ ✨Likes & Instagram",324,748,3082,False,UP govt bans use of mobile phones by patients in isolation wards of L-2 &amp; L-3 dedicated #COVID19 hospitals. The mobile phones of such patients needs to be submitted to the ward incharge of the COVID care centre so as to ensure mobile phone infection prevention norms. https://t.co/uMAZWDmsVK
2020-05-24 01:27:47+00:00,RT @iMac_too: Dombivali: 70+ yr old parents of a #ChineseVirus positive patient were supposed to be taken to hospital for tests. Ambulance…,MaverickLG,India,"India First.  ------ हाथ मेँ हाथ, आप कांग्रेस के साथ.",1006,1222,282731,False,"Dombivali: 70+ yr old parents of a #ChineseVirus positive patient were supposed to be taken to hospital for tests. Ambulance came. Stretcher wasn't available, parents dragged themselves 4 floors down. Driver of amb left them in lurch citing Roza break
https://t.co/Qryd7rg4Gb"
2020-05-24 01:27:53+00:00,RT @Ra_c7r: Also out of 210 countries only 64 countries have more Corona cases than Tablighi Jamaat @WhoNehr,Wittosaur,India,The witty dino.,304,494,5478,False,Also out of 210 countries only 64 countries have more Corona cases than Tablighi Jamaat @WhoNehr
2020-05-24 01:27:56+00:00,Excellent tips on summer safety re: #COVIDー19 https://t.co/mwYriljxcj,AmidonChris,"Indiana, USA","I believe in: nursing, equality, gun safety, public health & ed. 🌈College nurse & MSN student. Proud to represent Indiana on NASN board. #NursesDemandAction",1132,834,15571,False,No Value Mentioned
2020-05-24 01:27:58+00:00,RT @JordanSchachtel: I’ve been back in DC land for only 4 hours &amp; I’m immediately ready to leave this hellscape of perpetual lockdown &amp; its…,kpcharlie9216,"Indiana, USA",No Value Mentioned,44,336,1889,False,I’ve been back in DC land for only 4 hours &amp; I’m immediately ready to leave this hellscape of perpetual lockdown &amp; its unanimous distribution of mask wearing Karens. The difference btwn free states &amp; lockdown states is night &amp; day. Even general attitudes r dramatically different.
2020-05-24 01:27:59+00:00,RT @BJYM: BJYM honors all Covid-19 warriors and strongly believes that under the able leadership of Hon Prime Minister Shri @narendramodi J…,Amit60Panchal,India,World is getting smaller and smaller,437,2232,13723,False,BJYM honors all Covid-19 warriors and strongly believes that under the able leadership of Hon Prime Minister Shri @narendramodi Ji – “#HumHongeKamyab”. https://t.co/LtIflApEQN
2020-05-24 01:27:59+00:00,RT @IPPBOnline: MeitY’s Digidhan ranks @IPPBOnline in the top 5 banks for consistently contributing to a significant rise in the total numb…,Ravi1Yadav1,"Jhansi, India",No Value Mentioned,33,81,98,False,"MeitY’s Digidhan ranks @IPPBOnline in the top 5 banks for consistently contributing to a significant rise in the total number of digital payment transactions between April 1 to May 19, amidst the Coronavirus pandemic and lockdown. #AapkabankAapkeDwaar #Bankingatlastmile #DakPay https://t.co/X34Jyz559U"
2020-05-24 01:28:00+00:00,"RT @pbhushan1: We had the world's most brutal Lockdown at 4 hours notice, 52 days after1st Covid case. During this, Trump's visit celebrate…",sonuxanand,"Bihar, India","Proud Indian, Proud Hindu, fully wrapped in Patriotism, Love Army, respect army.....",222,424,9398,False,"We had the world's most brutal Lockdown at 4 hours notice, 52 days after1st Covid case. During this, Trump's visit celebrated &amp; MP govt toppled. No experts were consulted before Lockdown &amp; no planning for Jobs, economy &amp; migrants. Covid cases &gt;300x since then. No accountability?"
2020-05-24 01:28:00+00:00,"#IndiaFightsCorona

In case of symptoms like fever, cough or difficulty in breathing, call 1075 (toll free) and seek immediate help. Don’t hesitate. Together we will fight #COVID19. 

#HealthForAll #CoronaOutbreak #SwasthaBharat #Lockdown4
@Sachin_YB 
@shankar_YB 
@Umesh_YB https://t.co/JTPQODWsae",mukund_YB,"Washim, India",योगऋषी स्वामी रामदेव जी महाराज  द्वारा प्रशिक्षित योगशिक्षक तथा जिला प्रभारी वाशीम पतंजलि युवा भारत,367,410,2837,False,No Value Mentioned
2020-05-24 01:28:04+00:00,"RT @BDUTT: He said it in innocence. He even smiled. But this 9 year child captured the magnitude of the humanitarian crisis. In Bhiwandi, a…",chandru_ar,"Bengaluru, India","Speculator, LFC fan, Pluviophile and a moving average Joe.",1236,362,20613,False,"He said it in innocence. He even smiled. But this 9 year child captured the magnitude of the humanitarian crisis. In Bhiwandi, as he boarded a bus for U.P, I asked if he'd heard of Corona.  Nitin said, ""Yes, it means, Khana Nahin Milta- I dont get food."" My report for @themojo_in https://t.co/XibHxNXITu"
2020-05-24 01:28:09+00:00,RT @IYC: The reason the lockdown has not done its jobs is because the lockdown wasn't carried out scientifically it was carried arbitrarily…,SuvarnaVeerappa,"Bengaluru, India",Indian .proud Mangalorean.❤️dancing to retro music ❤️🏋🏻‍♀️.proud not to be followed by Narendra Surrender Modi and to be blocked by Shefali Vaidya.❤️🐟,2405,1584,78594,False,"The reason the lockdown has not done its jobs is because the lockdown wasn't carried out scientifically it was carried arbitrarily. It was not done asking the stakeholders: Shri 
@RahulGandhi https://t.co/MxGRzRF02L"
2020-05-24 01:28:10+00:00,"RT @HrprtInsan_arts: Let us try to do our best to #HelpTheNeedy whose life has become tough due to the Corona Crisis, who face food shortag…",ThisIsMohit777,"UP 12, India 🇮🇳","MSc (MicroBiologist)

स्वस्थ रहो (Be Healthy)! मस्त रहो (Be Happy)! व्यस्त रहो (Be Busy)! 😊",1819,501,116491,False,"Let us try to do our best to #HelpTheNeedy whose life has become tough due to the Corona Crisis, who face food shortage or are sick needy while following the safety guidelines 
Let's provide food &amp; water to the needy,feed animals and birds etc with permission from the authorities https://t.co/SwlUv4OWtY"
2020-05-24 01:28:10+00:00,RT @abbas_nighat: Delhi is going towards disastrous route replicating Maharastra. Please save Delhi and ensure proper planning @ArvindKejri…,RajJaiswal4,New Delhi (India),"हिंदू हिंदी हिंदुस्तान ...... जय श्रीराम।
आतंकवादी धर्म के लोग follow करने से बचें।
धर्म परिवर्तन गैंग देश के लिये बहुत घातक सिद्ध होंगे एक दिन।",3137,2720,27451,False,"Delhi is going towards disastrous route replicating Maharastra. Please save Delhi and ensure proper planning @ArvindKejriwal this is not the first complaint and you have already opened the flood gates
 CC @PMOIndia PMOIndia https://t.co/zL8yoCiBoa"
2020-05-24 01:28:14+00:00,"Canada to ramp up COVID-19 testing and tracing, recommend digital app – Latest News | Gadgets Now https://t.co/twmzOmzq7O",desitrends_in,India,"We provide you latest trending news, article and videos straight from the all over the industry like news, entertainment, health and technology",72,14,1274,False,No Value Mentioned
2020-05-24 01:28:18+00:00,RT @ShashiTharoor: Preventing #Covid19: DFMD Thermal imaging camera commissioned at ⁦@TVC138⁩ railway station.Senior railway officials were…,ash_missh,"Mumbai, India",Beautifully chaotic,181,199,12886,False,Preventing #Covid19: DFMD Thermal imaging camera commissioned at ⁦@TVC138⁩ railway station.Senior railway officials were present w/ ⁦@rohithsuresh_89⁩ representing ChandranTharoor Foundation. A mock trial was held today which went well. Thanks ⁦@HikvisionHQ⁩! https://t.co/eYJxi1owci
2020-05-24 01:28:22+00:00,"RT @NorbertElekes: NEW: Mexico reports 3,329 new cases of coronavirus, 65,856 cases in total.

Mexico's largest daily increase by far.",gokulponting123,"Tindivanam, India","gokulnath🤠🤑😎  Thalapathy vijay, Chiyaan vikram, Ricky ponting",1329,1526,116297,False,"NEW: Mexico reports 3,329 new cases of coronavirus, 65,856 cases in total.

Mexico's largest daily increase by far."
2020-05-24 01:28:26+00:00,"RT @NorbertElekes: On the upside, India's per capita figure is still among the lowest in the world.",rakesh26329280,"Bihar, India",No Value Mentioned,1087,614,450561,False,"On the upside, India's per capita figure is still among the lowest in the world. https://t.co/Rqcp4VEHno"
2020-05-24 01:28:27+00:00,"RT @NorbertElekes: NEW: Number of recovered coronavirus patients has passed 2,222,222 worldwide.",gokulponting123,"Tindivanam, India","gokulnath🤠🤑😎  Thalapathy vijay, Chiyaan vikram, Ricky ponting",1329,1526,116297,False,"NEW: Number of recovered coronavirus patients has passed 2,222,222 worldwide."
2020-05-24 01:28:27+00:00,Corona beating it's own records every day.  6663  cases till 12Am today... https://t.co/LocxOXpm7w,ImkotiM,India,Naaaa ICTeam... #Cricket #Cinema #Dream11  #PONTING #DHONI #VIRAT  #LARA #Dravid #WARNE #McGRATH ...,1641,713,44948,False,No Value Mentioned
2020-05-24 01:28:27+00:00,@Elephant9999999 @KRforINDIA @narendramodi Can you see the difference ? Which benefit of pakistan dude! Your GDP is equal to our relief fund for covid19 https://t.co/6PBI7Hrnbi,SharmaGkaldkaaa,India,"श्रेष्ठ | चतुर | बुद्धिमान | मेहनती | पढ़ाकू | निडर
| Engineering का छात्र |
| वो भी civil engineering |",43,105,364,False,No Value Mentioned
2020-05-24 01:28:28+00:00,"RT @ECDC_EU: Residents in #LTCFs are a vulnerable population group. They're often elderly &amp; frail, with complex health needs. People aged 6…",iDeepakPal,"Varanasi, India","journalist . politics & policy views personal
@aajtak @IndiaToday",179,1710,26075,False,"Residents in #LTCFs are a vulnerable population group. They're often elderly &amp; frail, with complex health needs. People aged 65+ years are disproportionately affected by adverse outcomes of #COVID19 compared to younger age groups.

➡️https://t.co/AVOig7iSj7 https://t.co/PeTt8VDAmy"
2020-05-24 01:28:31+00:00,"The news on the front page of @nytimes give tribute to the ones who lost their lives in the pandemic,..The New York Times did a really good thing in making those names remember as we proceed towards a brighter future!!! #StayHome https://t.co/31jLzZ2Tcx",Yash92122071,India,No Value Mentioned,100,33,9,False,No Value Mentioned
2020-05-24 01:28:33+00:00,@sehrtaneja6 @ShashiTharoor One sci fi problem at a time madam!! First fight covid...,Balramjha4719,"New Delhi, India","Just a curious Indian!
And clearly not in love affair with any politcal parties/leader.  
Aspire to see India as happiest nation..

India First!!",19,20,163,False,No Value Mentioned
2020-05-24 01:28:34+00:00,"RT @NorbertElekes: JUST IN: South Africa reports 1,218 new cases of coronavirus, 21,343 in total.

South Africa's largest daily increase so…",gokulponting123,"Tindivanam, India","gokulnath🤠🤑😎  Thalapathy vijay, Chiyaan vikram, Ricky ponting",1329,1526,116297,False,"JUST IN: South Africa reports 1,218 new cases of coronavirus, 21,343 in total.

South Africa's largest daily increase so far."
2020-05-24 01:28:34+00:00,"RT @StateHealthIN: We're conducting the second phase of the #COVID19 impact study with @FSPH_IUPUI.

If you receive a text or postcard from…",marybschneider,Indianapolis,"After years covering politics & govt  for The Indy Star & then writing a column for https://t.co/aYL1YgCE8z, I’m officially retired! I remain The Twitter Lady.",17250,2509,131457,True,"We're conducting the second phase of the #COVID19 impact study with @FSPH_IUPUI.

If you receive a text or postcard from us, PLEASE RESPOND – even if you’ve been tested before. We're offering free testing to those randomly selected to participate.

Info ➡️ https://t.co/BpOE6QBFh7 https://t.co/hGv2AKhTIU"
2020-05-24 01:28:35+00:00,RT @Reuters: Project leader: Oxford's COVID-19 vaccine trial has 50% chance of success - Telegraph https://t.co/qcoYCsWE8p https://t.co/NDs…,mrzbilal2,"Maharashtra, India",entrepreneur,14,709,497,False,Project leader: Oxford's COVID-19 vaccine trial has 50% chance of success - Telegraph https://t.co/qcoYCsWE8p https://t.co/NDszKzmute
2020-05-24 01:28:35+00:00,RT @narendramodi: Had an excellent talk with President @GotabayaR.  Sri Lanka is fighting COVID-19 effectively under his leadership. India…,vyom2vyom,"New Delhi, India","followed by Sir Narendra Modi Advertising Professional, BJP IT cell, Staunch supporter and follower of MODI SIR;",1470,2872,69171,False,Had an excellent talk with President @GotabayaR.  Sri Lanka is fighting COVID-19 effectively under his leadership. India will continue to support our close maritime neighbour in dealing with the pandemic and its economic impact.
2020-05-24 01:28:41+00:00,RBI announces some relief measures to strengthen the Economy amidst the COVID-19 crisis. #IndiaFightsCorona https://t.co/HdXlRlzp7T,AIRKolkata,"Kolkata, India ",Official Twitter Account of All India Radio Kolkata. Find us on YouTube : https://t.co/r8AIcUE50M…,1350,24,1736,False,No Value Mentioned
2020-05-24 01:28:44+00:00,RT @KKChaubey10: Highly qualified and well trained @TeqipF faculties have given a new dimension to the technical education for students of…,Gupta23suchit,India,"Assistant Professor, Mechanical Engineering #npiufaculty GCE Keonjhar",90,322,2641,False,Highly qualified and well trained @TeqipF faculties have given a new dimension to the technical education for students of backward and rural areas. These young IITs/NITians are ready to serve the nation with full dedication. Plz provide them opportunity. @DrRPNishank Sir https://t.co/CvudPipIPU
2020-05-24 01:28:45+00:00,RT @narendramodi: Had an excellent talk with President @GotabayaR.  Sri Lanka is fighting COVID-19 effectively under his leadership. India…,BaluBal04983816,"Adoni, India",No Value Mentioned,0,4,45,False,Had an excellent talk with President @GotabayaR.  Sri Lanka is fighting COVID-19 effectively under his leadership. India will continue to support our close maritime neighbour in dealing with the pandemic and its economic impact.
2020-05-24 01:46:24+00:00,"RT @priyalmofficial: When the whole world going on footprints of Social Distancing and another side ""Church's Priest caught red-handed havi…",Rahulamitynoida,"Noida, India",Asst manager Indiamart Intermesh( ops ),200,255,13196,False,"When the whole world going on footprints of Social Distancing and another side ""Church's Priest caught red-handed having sex with a lady in a church ! Amazing .. Shameful. https://t.co/1h206Pok93"
2020-05-24 01:46:25+00:00,"RT @Sportsperson5: As we all know, the global epidemic of corona salt has made it difficult for us to grow. That is why many labourers were…",kansal2808,India,"💞No one in this world is Pure & Perfect.💞
If you avoid people for their mistakes,✨you will be alone in this world.🥰So judge less & love more.🤗😘👍💫",1032,128,66968,False,"As we all know, the global epidemic of corona salt has made it difficult for us to grow. That is why many labourers were sleeping hungry and thirsty. With the permission of the government the followers of  @derasachasauda, #HelpTheNeedy under the education of @Gurmeetramrahim ji. https://t.co/V5vRegcPmH"
2020-05-24 01:46:25+00:00,"RT @OECD_ENV: On International #BiodiversityDay let‘s seek to #BuildBackBetter following the #Covid19 crisis.🌱

We cannot go back to busine…",MeTheChange,India,We Empower Social Sustainability Goals & Celebrate Social Good in Life. We are Building a Better World with #MeTheChangemaker. Pick our Projects & Stories.,165,256,11073,False,"On International #BiodiversityDay let‘s seek to #BuildBackBetter following the #Covid19 crisis.🌱

We cannot go back to business as usual. Our planet needs new economic systems that value nature as a central source of our health and well-being. 🌍 ⚕️ 👨‍👩‍👧‍👦

https://t.co/slUl1DRC3v https://t.co/fHr6bxotuS"
2020-05-24 01:46:27+00:00,RT @OpIndia_com: Newslaundry pressurises Zee News journalist affected with coronavirus to do a hitjob on channel’s Editor-in-Chief Sudhir C…,fullyfaltu2020,Indiaaaaah,nothing to boast about....,264,591,41467,False,"Newslaundry pressurises Zee News journalist affected with coronavirus to do a hitjob on channel’s Editor-in-Chief Sudhir Chaudhary

https://t.co/oCkdciDs4j"
2020-05-24 01:46:29+00:00,"RT @pawpreet: In situation of Corona virus @derasachasauda volunteers always ready for #HelpTheNeedy 
Like food distribution, feed up the b…",DeviChand_Insa,"Sangrur, India","जो लाखों में एक होता है ना,
   *बस* 
 वह ही मेरे लिए तुम हो
My dearest daughter @ImKasam_insan2 🍫🍫🍫",206,156,18232,False,"In situation of Corona virus @derasachasauda volunteers always ready for #HelpTheNeedy 
Like food distribution, feed up the birds with inspiration of @Gurmeetramrahim ji https://t.co/cLxJrJKgsj"
2020-05-24 01:46:31+00:00,"RT @SamShorey: this is Sara Little Turnbull, she invented the n95 mask while working in the ""gift wrap, ribbons &amp; tape"" division of 3M. 

T…",sharanpraveen,India ,Seeking Exuberance,9,96,811,False,"this is Sara Little Turnbull, she invented the n95 mask while working in the ""gift wrap, ribbons &amp; tape"" division of 3M. 

The prototype was based on the form for a new molded bra cup and was informed by her experience as a caretaker for three dying family members. #WomenInSTEM https://t.co/GItStIvaLL"
2020-05-24 01:46:31+00:00,"RT @IndianExpress: #ExpressFrontPage | So far, the Civil Hospital has seen 377 Covid deaths, which accounted for 45% of the total deaths in…",mishankmodi,India,No Value Mentioned,46,344,3955,False,"#ExpressFrontPage | So far, the Civil Hospital has seen 377 Covid deaths, which accounted for 45% of the total deaths in the state.

https://t.co/SEbp6nRbur"
2020-05-24 01:46:34+00:00,"RT @iepunjab: At least 161 Covid-19 patients in the city are from the Bapu Dham Colony, a containment zone and hotspot. https://t.co/bdHYfx…",grewal_sharma,"Chandigarh, India",Everybody has a story to tell. I like to write it. Journalist. Writer. Editor.,920,325,1810,False,"At least 161 Covid-19 patients in the city are from the Bapu Dham Colony, a containment zone and hotspot. https://t.co/bdHYfx09Eq"
2020-05-24 01:46:37+00:00,"Coronavirus in Delhi: Senior AIIMS Doctor And Eminent Pulmonologist Succumbs to COVID-19

https://t.co/Fe16IIQA9o
Source : ""https://t.co/YwRFSGVxuA"" via Dailyhunt

Download Now
https://t.co/hNSHvsJAzi",Ibrahim_313,Bengaluru India,No Value Mentioned,95,453,2380,False,No Value Mentioned
2020-05-24 01:46:37+00:00,RT @SCMPNews: Hong Kong’s coronavirus success should help the city craft a positive self-narrative that pivots away from protests https://t…,raghav4india,India,IITian | Brajwasi | Bharat Bandhu Network | Creative Resistance | The Braj Forum | Students’ Forum for India’s Heritage | Neo-Swadesi | Enlightened Electorate,1504,2611,65322,False,Hong Kong’s coronavirus success should help the city craft a positive self-narrative that pivots away from protests https://t.co/gFcUm55h5K
2020-05-24 01:46:37+00:00,"RT @RajeshChokhani: Just ordered vegetables and asked the vendor that we will pay digital. He pleaded no and asked for cash. He says PayTM,…",pschokhani,"Mumbai, India",Financial services,27,79,1072,False,"Just ordered vegetables and asked the vendor that we will pay digital. He pleaded no and asked for cash. He says PayTM,google pay etc are charging huge fee in lockdown, as high as Rs 60-100. हम गरीब क्या कमाएँगे! 

True? @vijayshekhar @GooglePay @narendramodi @rsprasad"
2020-05-24 01:46:37+00:00,"@OpIndia_com What is this Hell , why cases are not filed on all Maulana’s of India for Namaj on all Fridays during Lockdown ?",PKSPassionate,"Delhi, India","Am here to be with you, a thinker, an entrepreneur, Bindas Bhartiya Bhakt. Likes and RT are not endorsements.🔸🟧🔸",9,51,1200,False,No Value Mentioned
2020-05-24 01:46:37+00:00,"RT @TelanganaToday: First COVID-19 vaccine human trial ‘safe’, induces immune response
https://t.co/bJPoz9y6K1",almostinfamous,"Hyderabad, India","🤔retweets are confusions🤔

🌟 i apologise for the inconvenience 🌟

photos only account at @photosbyaditya

the 6 million fav man",2651,2434,242563,False,"First COVID-19 vaccine human trial ‘safe’, induces immune response
https://t.co/bJPoz9y6K1"
2020-05-24 01:46:38+00:00,RT @tickerguy: @denniskneale @realDonaldTrump Btw Dennis read 18 USC 242. Contemplate what FORCING nursing homes to take Covid+ pts by Stat…,Joe_in_Indiana,"NW Indiana & Door County, WI",Proud husband of Sagamore of the Wabash Wife and Father of 40 under 40@Indy Daughter. Picture of Diogenes looking for an Honest Person.,989,1273,169287,False,@denniskneale @realDonaldTrump Btw Dennis read 18 USC 242. Contemplate what FORCING nursing homes to take Covid+ pts by State EO is to those who died as a result.  What penalty is permitted for anyone who did so? Just saying.... Cough-cough
