created_at,full_text,screen_name,location,description,followers_count,friends_count,statuses_count,verified,full_retweet_text
2020-02-19 17:46:43+00:00,"RT @Baidu_Inc: As SMEs face economic challenges due to #COVID2019, Baidu's SME Support Plan aims to help them persevere💪Included in the pac…",AkashCh04114783,"Aurangabad, India",Medical Student,140,653,16149,False,"As SMEs face economic challenges due to #COVID2019, Baidu's SME Support Plan aims to help them persevere💪Included in the package is free access to 240 #AI techs on Baidu Brain, Baidu Hi intelligent office platform for Wuhan companies to work remotely &amp; much more.
Learn more👇 https://t.co/J9B87a6C0n"
2020-02-19 17:46:45+00:00,"RT @rahulroushan: isme mera koi haath nahi hai! people threw her out as her antics were for anyone to see.. as someone had recently said, R…",ecstaticmind100,"Bengaluru, India",No Value Mentioned,28,272,4696,False,"isme mera koi haath nahi hai! people threw her out as her antics were for anyone to see.. as someone had recently said, RW (rather non-left) is way too independent and volatile to have leaders or 'bullies' controlling them... waise it's fun to imagine yourself as handsome bully. https://t.co/D34OsaLCac"
2020-02-19 17:46:53+00:00,RT @DrEricDing: Update on virus in Iran - actually two #covid19 cases in Iran have now died. This is the first country outside of China to…,RightEyeGuy,Southern Indiana,Conservatarian Motorcycle Chocolate #savedbygrace #teaparty #NRA #TCOT #2A #indiana #cos #molonlabe #CruzCrew Eph 2:8. I don't believe in CAGW.,7964,8433,29959,False,Update on virus in Iran - actually two #covid19 cases in Iran have now died. This is the first country outside of China to have 2 deaths. We didn’t even know there were any cases there before today. Epidemic must be already underway in Iran. https://t.co/RxDUvlQE7T
2020-02-19 17:46:55+00:00,RT @BBCWorld: Coronavirus: Iran reports two suspected fatal cases at Qom hospital https://t.co/43P03b99q5,_ap_studio,"Kerala, India","Your Imagination, Our Creation....    
Bringing to you what matters the most 👍           
Instagram- @_ap_studios",3,66,51,False,Coronavirus: Iran reports two suspected fatal cases at Qom hospital https://t.co/43P03b99q5
2020-02-19 17:47:15+00:00,Nanhe Munne: Chinese CDC study finds Covid-19 virus to be more ... https://t.co/Wb3z0dl9TF,Veerubhai1947,INDIA,No Value Mentioned,30,35,12942,False,No Value Mentioned
2020-02-19 17:47:17+00:00,"#Coronavirus Scare in India: #Karnataka Poultry Industry Suffers Losses Amid Rumours of #Chicken Infected with #COVID19
https://t.co/x23fuDJrxp",latestly,"Mumbai, India","https://t.co/U4rHOvEUQR focuses on the What, When, Who and How of a trending story, and helps readers with analyses that go beyond the domain of news. https://t.co/OCtmVDjYfd",57826,340,104593,True,No Value Mentioned
2020-02-19 17:47:23+00:00,"RT @truerealface: Youtube Link:  https://t.co/exOuLO4Yfr
Bill Gates One Health Agenda | Corona Virus Coincidence | Tamil | PART 2 https://t…",RaghavJArun,"Tamil Nadu, India","எந்த நாட்டு இளைஞர்களிடம் அரசியல் கல்வி, வாழ்கை கல்வி காலம் தவறாமல் போதித்து வருகின்றதோ அந்த நாடுதான் எல்லாத் துறைகளிலும் செழிப்பும்,சிறப்பும் உடையதாக இருக்கும்.",260,520,11865,False,"Youtube Link:  https://t.co/exOuLO4Yfr
Bill Gates One Health Agenda | Corona Virus Coincidence | Tamil | PART 2 https://t.co/ZPh4ieC1LD"
2020-02-19 17:47:24+00:00,RT @charts_k: SBS has decided to postpone Super Concert in Daegu until further notice to prevent the spread of Coronavirus following an out…,YagnikIshita,India ,"..Love BTS 😍🤩☺️
only ARMY..💜💜💜💜💜💜💜",896,830,93748,False,"SBS has decided to postpone Super Concert in Daegu until further notice to prevent the spread of Coronavirus following an outbreak in the area (15 new cases in Daegu) &amp; for the safety of the audience &amp; performers.

@BTS_twt were scheduled to perform in the lineup for March 8. https://t.co/dvfnvZkS4a"
2020-02-19 17:47:25+00:00,RT @thaiparampil: Coronavirus could cost global economy $1tn in lost output https://t.co/juomfchqIg,Equateall,India,"Educationist, Startup / Product Consultant, Mentor, Career Coach.
eTestZone: India's Largest Performance Rewards for IIT JEE / NEET / CET. Open to ALL students.",7750,1123,256716,False,Coronavirus could cost global economy $1tn in lost output https://t.co/juomfchqIg
2020-02-19 17:47:29+00:00,"RT @ArindamRERN: Anti HK gang's logic #UnitedByAsim

This spread                Then what this
Love                             Spread!!!!!…",lill_Wass,India,"✧•̀  I'm an ardent follower of @imrealasim
✧•̀  I'm a supporter of #AsiManshi •́
✧•̀  I'm an admirer of @realhimanshi  
✧•̀  FANBOY  •́
Watch #KallaSohnaNai⤵️",627,310,28100,False,"Anti HK gang's logic #UnitedByAsim

This spread                Then what this
Love                             Spread!!!!!!
                                     Corona??? https://t.co/O6Fd6d2bcj"
2020-02-19 17:47:37+00:00,RT @TOIIndiaNews: India's third coronavirus patient tests negative; decision on discharge on Thursday https://t.co/nTGBXPbhqg,NayakaKBL,Davangere Karnataka INDIA,No Value Mentioned,28,100,5416,False,India's third coronavirus patient tests negative; decision on discharge on Thursday https://t.co/nTGBXPbhqg
2020-02-19 17:47:40+00:00,RT @nytimes: Breaking News: China on Wednesday said it would revoke the press credentials of three Wall Street Journal reporters working in…,Tsundoku_Irusu,India,Nothing good ever happens when people care more about our differences than the things we share in common. 🏳️‍🌈 ~Animu for life~ 🏳️‍🌈,151,367,10282,False,"Breaking News: China on Wednesday said it would revoke the press credentials of three Wall Street Journal reporters working in mainland China, in a significant escalation of Beijing’s pressure on the foreign news media https://t.co/zjw4NABoBQ"
2020-02-19 17:47:44+00:00,"RT @IndianPrism: @ashoswai Birds of a feather flock together. Seriously, BJP's rape culture is an epidemic.",DrFasih4,India,Human Right Activist,20,173,1484,False,"@ashoswai Birds of a feather flock together. Seriously, BJP's rape culture is an epidemic."
2020-02-19 17:47:46+00:00,"RT @ArindamRERN: Anti HK gang's logic #UnitedByAsim

This spread                Then what this
Love                             Spread!!!!!…",themoin_khan,"Mangalore, India","creativity, strong and positive...aim to win the world...dream is big but having hope in sha allah I'll. The best way of revenge is massive succes. luv u mom❤",17,8,4698,False,"Anti HK gang's logic #UnitedByAsim

This spread                Then what this
Love                             Spread!!!!!!
                                     Corona??? https://t.co/O6Fd6d2bcj"
2020-02-19 17:47:48+00:00,"RT @hofrench: Very useful explainer. ""How the coronavirus can kill people"" https://t.co/4dBkBXLKpl",raizooi,India,Currently in China. Completing Masters in Law & Chinese Foreign Policy. Doggos ❤️,321,1897,27810,False,"Very useful explainer. ""How the coronavirus can kill people"" https://t.co/4dBkBXLKpl"
2020-02-19 17:47:56+00:00,"RT @Nitendradd: How do you disinfect a city five times the size of London?

  Look at this  #Wuhan #WuhanToday https://t.co/LaJSMbU1Iw",samanwaya_et,"New Delhi, India",write on legal issues for the economic times. views expressed are personal. pacifist. Gandhian.,2484,1720,39983,False,"How do you disinfect a city five times the size of London?

  Look at this  #Wuhan #WuhanToday https://t.co/LaJSMbU1Iw"
2020-02-19 17:48:02+00:00,"RT @KiranKS: China accounts for 70% of Asian bond issuances. But since Corona Virus in China, Indian companies have become hot for global i…",tapanpokar,"Pune, India","Entrepreneur,Chemical Engineer,, Techlover,EV next big thing,Nationalist",565,196,75768,False,"China accounts for 70% of Asian bond issuances. But since Corona Virus in China, Indian companies have become hot for global investors. 

In just 2 weeks, Indian companies received bids for $11 billion in the Dollar bond market, while they had lined up for just $1.55 bn issues."
2020-02-19 17:48:06+00:00,"Antiviral Drug, Plasma Transfusions Show Promise in Treating Coronavirus https://t.co/kLu2o0TqxH https://t.co/TFio5duX5h",ttechoftomorrow,"Navi Mumbai, India",Read News Headlines Analysis By Experts In India. Know The Actual Story Behind The Seen. Get The Top Level Of News Event Analysis By Famous Experts.,39,0,13831,False,No Value Mentioned
2020-02-19 17:48:08+00:00,"RT @WIONews: #Gravitas | The US has launched a new war against China. From now on, Journalists from Chinese state media organisations will…",pandey_prat,"Raigad, Maharashtra, India","COEP, PUNE,
Social Activist.",140,948,24955,False,"#Gravitas | The US has launched a new war against China. From now on, Journalists from Chinese state media organisations will be treated as operatives of the Chinese state. Meanwhile, Beijing has expelled three journalists from the Wall Street Journal. @palkisu tells you more https://t.co/8e7uZgaUf5"
2020-02-19 17:48:11+00:00,@rkhamsi I have recently developed an Affordable Non-hazardous Technique from IISER-M: Vacuum Integrated Removal of Unwanted Species (ANTI: VIRUS) in Indoors for Corona like microorganisms. Watch: https://t.co/zx59RVyUOd,lab_innovators,"Mohali, India","Chemistry Laboratory.  Develops Swadeshi Frugal Innovations, lifehacks. Go Green. Bicycle. Save water, electricity. Say no to plastic. Stop polluting air. 🇮🇳.",248,1154,937,False,No Value Mentioned
2020-02-19 17:48:28+00:00,"RT @ayemojubar: China govt is up to something deadly and #CoronavirusOutbreak is likely to be a test.

Chinese scientists said Corona Virus…",2601Manish,India,Proprietor at English Academy. Founder https://t.co/mX0TBhkRV3 Influencer #Blockchain #Cryptocurrencies #AI #IoT #Fintech #BigData #AR #VR #XR #MR & Authored 5 Books,2682,1672,251908,False,"China govt is up to something deadly and #CoronavirusOutbreak is likely to be a test.

Chinese scientists said Corona Virus originated at a Govt Bioweapons Research facility in Wuhan, rather than Huanan seafood markets as claimed.

https://t.co/ugiaWwvN76 https://t.co/EwQDahzZ2q"
2020-02-19 17:48:34+00:00,RT @talaluoh: Robots attending to Corona virus patients in 🇨🇳China #CoronavirusOutbreak https://t.co/0RTfKvpMwL,2601Manish,India,Proprietor at English Academy. Founder https://t.co/mX0TBhkRV3 Influencer #Blockchain #Cryptocurrencies #AI #IoT #Fintech #BigData #AR #VR #XR #MR & Authored 5 Books,2682,1672,251908,False,Robots attending to Corona virus patients in 🇨🇳China #CoronavirusOutbreak https://t.co/0RTfKvpMwL
2020-02-19 17:48:40+00:00,"RT @charliekirk11: Facts:

Mike Bloomberg said China’s dictator, Xi Jinping, is “not a dictator”

Joe Biden says that China is “not a threa…",jeffallen1987,"The cornfields of Indiana, USA","Pastor, ""Radical Religious Right"", Author of Shattering Liberal Lies About the Bible, available at: https://t.co/Bg7vCkzUZy",2015,1917,21854,False,"Facts:

Mike Bloomberg said China’s dictator, Xi Jinping, is “not a dictator”

Joe Biden says that China is “not a threat”

Bernie Sanders said China has done more to address extreme poverty “than any country in history”

Why are Democrats so friendly to America’s greatest enemy?"
2020-02-19 17:48:42+00:00,RT @BBCWorld: Coronavirus: Iran reports two suspected fatal cases at Qom hospital https://t.co/43P03b99q5,das_varun99,India,Journalist.,1390,4919,63756,False,Coronavirus: Iran reports two suspected fatal cases at Qom hospital https://t.co/43P03b99q5
2020-02-19 17:48:42+00:00,"RT @arunv2808: Apple expresses its concern about continuing to manufacture goods with China due to Corona virus.

I'm sure Modi is eyeing t…",jag_karthik,"Chennai, India","Vande Mataram 🇮🇳🇮🇳

Happy for Modi 2.0, but 'Sabka Vishwas' seems to ring alarmbells for Hindus.",361,390,50676,False,"Apple expresses its concern about continuing to manufacture goods with China due to Corona virus.

I'm sure Modi is eyeing this as an opportunity to entice them here.

The meet with Trump could materialize this shift (I hope)."
2020-02-19 17:48:43+00:00,"RT @charliekirk11: Tom Cotton has a backbone most of our leaders can’t find when it comes to China

He actually cares about America not the…",HydeJekyl67,"Peru, Indiana ","Huge ND fan, Red Sox, Cubs, Colts , Pacers and Celtics. MAGA 2020, Trump 100%, love the USA 🇺🇸🇺🇸💯 Q",2792,5001,6106,False,"Tom Cotton has a backbone most of our leaders can’t find when it comes to China

He actually cares about America not the CCP

China is lying to the world about the severity of CoronaVirus. Evidence shows it is much worse

The pro-China political class &amp; media is covering this up https://t.co/p4XyrohhVN"
2020-02-19 17:48:55+00:00,"RT @JournoPranay: India to evacuate some Myanmar nationals from  #coronavirus hit
Wuhan city, onboard the C17 aircraft of @IAF_MCC which is…",sharma_niaa,"New Delhi, India","Writer at @qzindia
Send pitches: nsharma@qz.com 
Ex: @news18dotcom, @bsindia, @dna, @BT_India",624,482,3489,False,"India to evacuate some Myanmar nationals from  #coronavirus hit
Wuhan city, onboard the C17 aircraft of @IAF_MCC which is being sent tomorrow with medical relief material to China. This special aircraft will bring many indians who could not come during earlier evacuations. https://t.co/eZLxEF45gr"
2020-02-19 17:48:57+00:00,RT @HckmstrRahul: This is such a powerful dataset. It took only 7 years for India (from 2012) to slash its way all the up. Thanks to the ch…,chintan0610,"Ahmadabad City, India","Stock market strategist, Love to learn Economics, News junkie, Victim of ma son's wrapping love.",46,140,104,False,"This is such a powerful dataset. It took only 7 years for India (from 2012) to slash its way all the up. Thanks to the cheap mobile devices &amp; data packs, India &amp; China went on to create their separate patterns and audience of internet users. 

#next100million #nextgen #netizen https://t.co/5LfmSt94iD"
2020-02-19 17:49:48+00:00,"RT @TimesNow: New low in political mudslinging.
TIMES NOW fact check exposes a plot which equates India with China days before US President…",thenewshour,India,"Watch The Newshour with Navika Kumar, weeknights at 9 PM, & The Newshour AGENDA with Padmaja Joshi, weeknights at 10 PM, only on @TimesNow.",361979,9,69416,True,"New low in political mudslinging.
TIMES NOW fact check exposes a plot which equates India with China days before US President @realDonaldTrump’s visit to India.

Details by TIMES NOW's Kajal &amp; Padmaja Joshi on @thenewshour AGENDA. | #WallOfFakery https://t.co/cKvYCX7qNu"
2020-02-19 17:49:56+00:00,RT @IndianDefence3: @AskAnshul A Chinese cargo ship carrying missile launching machinery and arms has been seized at the KANDLA PORT of Guj…,a_chathurya,"Karnataka, India",Indian    '' feminist'',95,102,208,False,"@AskAnshul A Chinese cargo ship carrying missile launching machinery and arms has been seized at the KANDLA PORT of Gujarat &amp; is being searched by Indian intelligence agencies. The ship arrived from China and the next destination of the ship is the Karachi port 
#IndianDefenceNews  🇮🇳"
2020-02-19 17:50:00+00:00,"RT @gaye_gallops: OH NO SAY IT IS NOT SO BLOOM!

BLOOMBERG ACCUSED of Helping Communist China Suppress News https://t.co/viS3cE5JsZ via @Br…",MistyBlueGreen1,Indianapolis Indiana,"Mother, Patriot #MAGA #KAG #Trump2020",191,365,2284,False,"OH NO SAY IT IS NOT SO BLOOM!

BLOOMBERG ACCUSED of Helping Communist China Suppress News https://t.co/viS3cE5JsZ via @BreitbartNews 

He tried to SILENCE WOMEN through non-disclosure agreements!

Leta Fincher accused Bloom of lying to PROTECT HIS INTERESTS IN CHINA!

NAUGHTY BOY"
2020-02-19 17:50:02+00:00,RT @Milz8732: Makes one wonder... 😷 anyway DM if you want to the pdf #Wuhan-400 #coronavirus https://t.co/WSJqrpeDli,drritesh6,India,Proud Indian... Social Thinker ... Pulmonologist & Intensivist.             “ मेरा  एक ही सपना की मेरा भारत हो विश्वगुरु “,74,169,572,False,Makes one wonder... 😷 anyway DM if you want to the pdf #Wuhan-400 #coronavirus https://t.co/WSJqrpeDli
2020-02-19 17:50:04+00:00,"RT @OlaTinee: Coronavirus: Africa are you ready??? 

Africans: Yeaaa 

Coronavirus: I said Africans are you readdyyyyyyy 🤘🏾🤘🏾🤘🏾🤘🏾🤘🏾",TeJay29,India,"What we sow is what we reap.
Traversing twitter for trivia & trivial.
All characters in tweets are fictional. Typos happen.
🍻☕🏏📚💹📝♊🇮🇳",1656,723,314751,False,"Coronavirus: Africa are you ready??? 

Africans: Yeaaa 

Coronavirus: I said Africans are you readdyyyyyyy 🤘🏾🤘🏾🤘🏾🤘🏾🤘🏾 https://t.co/UDzFR9AuJM"
2020-02-19 17:50:10+00:00,RT @MogaleMo07: Not even a single pastor is going to China to cure Corona virus?😮💁‍♂️😏 https://t.co/451LAtxeOH,IndiaAnalyst,India,"Pro-logic. Pro-Choice, Anti-Hypocrisy, India First. rt/follow is nt endorsement.
Profile Pic by domdeen / https://t.co/I3aK2xrCaz #CoronaVirus #WuhanVirus",2533,1932,175094,False,Not even a single pastor is going to China to cure Corona virus?😮💁‍♂️😏 https://t.co/451LAtxeOH
2020-02-19 17:50:13+00:00,RT @HckmstrRahul: This is such a powerful dataset. It took only 7 years for India (from 2012) to slash its way all the up. Thanks to the ch…,i_praveensharma,"Gurugram, India","Human Being, #SEO Strategist, Proud of @adgpi & @isro, Optimistic, @sachin_rt, @ihrithik, & @tripathiipankaj's Fan. Work in Progress. :)
Tweet/RTs are personal.",868,74,10084,False,"This is such a powerful dataset. It took only 7 years for India (from 2012) to slash its way all the up. Thanks to the cheap mobile devices &amp; data packs, India &amp; China went on to create their separate patterns and audience of internet users. 

#next100million #nextgen #netizen https://t.co/5LfmSt94iD"
2020-02-19 17:50:13+00:00,RT @JB_Bees: FYI on how viruses work #coronavirus https://t.co/YUa954ih1k,shareswalla,India,...mostly thinking about markets!,297,91,9844,False,FYI on how viruses work #coronavirus https://t.co/YUa954ih1k
2020-02-19 17:50:24+00:00,RT @chigrl: Locust swarms are heading to #China now 😳,karagis75,"Chennai, India","All my tweets are my personal view.. I love to explore latest technology and sharing my learning with others.
I would like to learn from trading experts",300,563,36811,False,Locust swarms are heading to #China now 😳 https://t.co/bKdKoNnT4U
2020-02-19 17:50:33+00:00,"RT @TimesNow: New low in political mudslinging.
TIMES NOW fact check exposes a plot which equates India with China days before US President…",thenewshour,India,"Watch The Newshour with Navika Kumar, weeknights at 9 PM, & The Newshour AGENDA with Padmaja Joshi, weeknights at 10 PM, only on @TimesNow.",361979,9,69416,True,"New low in political mudslinging.
TIMES NOW fact check exposes a plot which equates India with China days before US President @realDonaldTrump’s visit to India. 

Share your view with Navika Kumar on @thenewshour. | Tweet with #WallOfFakery https://t.co/3m322b3uwm"
2020-02-19 17:50:35+00:00,Iran reports two suspected coronavirus deaths https://t.co/r0q0oL4WjM https://t.co/fyo9I32yh0,Ritsvevo,"Madhya Pradesh, India",Hey this is Rits - Vocalist & Blogger,6,40,16894,False,No Value Mentioned
2020-02-19 17:50:41+00:00,"RT @ArindamRERN: Anti HK gang's logic #UnitedByAsim

This spread                Then what this
Love                             Spread!!!!!…",SalinaT27793838,"Darjeeling ,India",No Value Mentioned,247,398,7141,False,"Anti HK gang's logic #UnitedByAsim

This spread                Then what this
Love                             Spread!!!!!!
                                     Corona??? https://t.co/O6Fd6d2bcj"
2020-02-19 17:50:41+00:00,RT @peytnhaag: i just overheard this little white girl in starbucks say “china has too many ppl anyways what’s so bad about coronavirus” an…,donatopavrey,"Mumbai, India","Footballer & Track/Field athlete. Simple life. Roman Catholic. Jazz drummer. Football Management. Working @JFK_India, Winger for WFC, #MUFC supporter",642,484,36982,False,i just overheard this little white girl in starbucks say “china has too many ppl anyways what’s so bad about coronavirus” and i WHIPPED my head just to see she is SITTING BEHIND AN ASIAN GUY WHO HEARD HER AND THEN TURNS AROUND AND COUGHS ON HER!! i swear her soul left her body
2020-02-19 17:50:47+00:00,"RT @TheEconomist: Today on “The Intelligence”: China’s locked-down migrant workers, Boeing’s space-and-defence division losing altitude and…",ThishaanShanthi,"Tamil Nadu, India",No Value Mentioned,54,58,17806,False,"Today on “The Intelligence”: China’s locked-down migrant workers, Boeing’s space-and-defence division losing altitude and the undue influence of politicians’ heights https://t.co/vxparp7iwE"
2020-02-19 17:50:49+00:00,"Swiggy aims to use the funds to further develop its new lines of business. The company will continue to invest in new growth areas - Stores, Go and SuprDaily. https://t.co/EWVFZPNtZH",supriya_speaks,"Bengaluru, India",I cover the biztech scene across enterprise tech & the start-up ecosystem in India for News Corp's @TechCircleIndia; Previously @Reuters; (https://t.co/Tqkn8UDdDp),50,428,170,False,No Value Mentioned
2020-02-19 17:50:58+00:00,"RT @TScelzo: #WuhanCoronavirus DISASTER IT WAS PLANNED 
THIS IS AN EVIL SOCIETY 
We have no freedom
Watch it all &amp; retweet 
#coronavirus #C…",2601Manish,India,Proprietor at English Academy. Founder https://t.co/mX0TBhkRV3 Influencer #Blockchain #Cryptocurrencies #AI #IoT #Fintech #BigData #AR #VR #XR #MR & Authored 5 Books,2682,1672,251908,False,"#WuhanCoronavirus DISASTER IT WAS PLANNED 
THIS IS AN EVIL SOCIETY 
We have no freedom
Watch it all &amp; retweet 
#coronavirus #COVID19 #virus #coronaviruswuhan #Coronavirius #Coronavirustruth #Chine #ChinaLies #coronavirusoutbreak 
https://t.co/ztBBOLLQiP"
2020-02-19 17:51:09+00:00,"RT @keepitreal_luke: #coronavirus 

Now. 60% of imports have reached destination. 

1-3 wks companies start closing due to shortage of part…",IAMPMSM,India  ,"IITTM-alumnus,National Retail Head,Sacrificed myself to the service of humanity & Lord Sri Krishna🙏Follower of Advaita Darshan🙏",1479,1391,10720,False,"#coronavirus 

Now. 60% of imports have reached destination. 

1-3 wks companies start closing due to shortage of parts

4 wks 30% workers cannot pay rent/ mortgage 
6 wks lay offs, more companies shutter doors, banks call in loans evictions start

8 wks economies collapse https://t.co/tDjZDQ2fhj"
2020-02-19 17:51:10+00:00,RT @GordonGChang: We need a new organization dedicated to world health. #COVID19  #CoronavirusOutbreak #China #WHO,2601Manish,India,Proprietor at English Academy. Founder https://t.co/mX0TBhkRV3 Influencer #Blockchain #Cryptocurrencies #AI #IoT #Fintech #BigData #AR #VR #XR #MR & Authored 5 Books,2682,1672,251908,False,We need a new organization dedicated to world health. #COVID19  #CoronavirusOutbreak #China #WHO https://t.co/Yj7oqyKL1D
2020-02-19 17:51:18+00:00,"RT @KamathBv: @BJP4Karnataka @girgit_kejriwal Put one prank Corona Virus Suspect in Shaheen bhag and close all gates, protest will see its…",sailesh5210,"Bengaluru, India",Tweets are just opinions and not endorsements!,52,276,499,False,"@BJP4Karnataka @girgit_kejriwal Put one prank Corona Virus Suspect in Shaheen bhag and close all gates, protest will see its end itself."
2020-02-19 17:51:44+00:00,"RT @TimesNow: New low in political mudslinging.
TIMES NOW fact check exposes a plot which equates India with China days before US President…",thenewshour,India,"Watch The Newshour with Navika Kumar, weeknights at 9 PM, & The Newshour AGENDA with Padmaja Joshi, weeknights at 10 PM, only on @TimesNow.",361979,9,69416,True,"New low in political mudslinging.
TIMES NOW fact check exposes a plot which equates India with China days before US President @realDonaldTrump’s visit to India. 

Tune in to TIMES NOW with Navika Kumar on @thenewshour. | Tweet with #WallOfFakery https://t.co/iiQJ8a8eCg"
2020-02-19 17:51:49+00:00,RT @_africanprodigy: I hope this gives people an indication of what’s going to happen when things on earth really hit the fan,thatmanutdlad,"Vadodara, India ",tell the things that I once enjoyed I said hi,528,1190,17836,False,I hope this gives people an indication of what’s going to happen when things on earth really hit the fan https://t.co/8xoy4zCWYI
2020-02-19 17:51:49+00:00,"RT @Nitendradd: How do you disinfect a city five times the size of London?

  Look at this  #Wuhan #WuhanToday https://t.co/LaJSMbU1Iw",Rakshaskota,India ,The best in a billion!!!!,324,835,36963,False,"How do you disinfect a city five times the size of London?

  Look at this  #Wuhan #WuhanToday https://t.co/LaJSMbU1Iw"
2020-02-19 17:51:49+00:00,"China to expel WSJ journalists over 'malicious’ coronavirus column

https://t.co/Jj8MXuD5sk",sanjibc74542118,INDIA.,A person for the sake of people.,235,546,14923,False,No Value Mentioned
2020-02-19 17:51:49+00:00,RT @realDennisLynch: @SenSanders This tweet is why people will never make you president.  Freedom and being the greatest country world ends…,jdfogle2,West Central Indiana,"Cancer Sucks! RIP Mom. Christian, Patriot, Fly fisherman, US Air Force (Ret.) 
AMERICAN and proud of it! Oklahoma.",786,1753,7142,False,@SenSanders This tweet is why people will never make you president.  Freedom and being the greatest country world ends the day China and or Russia can manhandle us.  You’re a clown.  #Trump2020
