created_at,full_text,screen_name,location,description,followers_count,friends_count,statuses_count,verified,full_retweet_text
2020-04-22 01:05:20+00:00,"RT @jijoy_matt: No Food, No Money, No Job. 
""Give us food or let us go home,"" here is why migrant labourers in Surat, Gujarat are protestin…",Karan_withRG,India,"@withRG
I believe in ideology of @INCindia  | @congress in blood | Fan of sh @RahulGandhi ji, Maharaja @Capt_amarinder ji",1138,288,31671,False,"No Food, No Money, No Job. 
""Give us food or let us go home,"" here is why migrant labourers in Surat, Gujarat are protesting on the streets, amid a nationwide lockdown due to Covid-19. Watch this. https://t.co/jCWbJqGGs3"
2020-04-22 01:05:23+00:00,"RT @haidermisbahi: This is Raj Thackrey, one of the prominent leaders of MNS, a political party in Maharashtra, India. He had given a call…",QamareAlam16,"Gorakhpur, Uttar pradesh India",teacher,375,412,3997,False,"This is Raj Thackrey, one of the prominent leaders of MNS, a political party in Maharashtra, India. He had given a call to shoot people belonging to #TablighiJamat. Because like many, he thinks these people have spread #Corona in India.
#Islamophobia_In_India https://t.co/AYW0WPyfCs"
2020-04-22 01:05:25+00:00,"RT @MadhuriDixit: Hey guys, since the lockdown has got us all hooked on our phones, I thought why not have some fun with it! I am going to…",ayushbikku,India,Really exciting to work and develop technology for humanity.,10,118,229,False,"Hey guys, since the lockdown has got us all hooked on our phones, I thought why not have some fun with it! I am going to share a screenshot of my phone wallpaper &amp; I am eager to see what's yours. So let's begin! #WhatsOnYourPhone https://t.co/7leQNx72fg"
2020-04-22 01:05:28+00:00,RT @NaveenismOdisha: Centre has appreciated Odisha for being among top two states in controlling and combating the #COVID19 pandemic effici…,SpeaksOdisha,"Orissa, India",No Value Mentioned,1010,7,2778,False,"Centre has appreciated Odisha for being among top two states in controlling and combating the #COVID19 pandemic efficiently and the virus rate is doubled in 30 days in other states compared to Odisha.

#OdishaFightsCorona #NaveenCares https://t.co/30ZCtYneRj"
2020-04-22 01:05:30+00:00,"RT @AskAnshul: Bihar's Araria:

A policeman was 'punished' &amp; forced to do sit-ups while holding ears by agriculture officer Manoj Kumar

Hi…",KunmunSankar,"Jajpur, India","Big fan of Modi,Yogi# Supporter of BJP,RSS,VHP#Not communal but Hates Pseudosecular|Proud to Born as a Hindu.",660,1842,5297,False,"Bihar's Araria:

A policeman was 'punished' &amp; forced to do sit-ups while holding ears by agriculture officer Manoj Kumar

His only fault was that he followed lockdown orders &amp; stopped the officer  

And Bihar Govt sent a show-cause notice to that officer.

Notice? Is this a joke?"
2020-04-22 01:05:34+00:00,"RT @RT_com: A Chinese scientist says #COVID19 has mutated into a deadlier strains, and you know what, this is now how we're going to go out…",SanaSarwat7,India,"Housewife. Passionate about #Maths education, collaboration and learning. Visit my #Fashion store https://t.co/aM0OYU8iXV",79,49,18220,False,"A Chinese scientist says #COVID19 has mutated into a deadlier strains, and you know what, this is now how we're going to go outside for the rest of 2020 and beyond. 

https://t.co/WRkCwUhhPE https://t.co/0VdETplI2X"
2020-04-22 01:05:36+00:00,"RT @Satyanewshi: After central team  came to help the state, instead of helping the task force Nirmamata restricted them from visiting the…",kanhaiyajee12,India,"https://t.co/U0JfDNbKDF
le_images…",155,71,31256,False,"After central team  came to help the state, instead of helping the task force Nirmamata restricted them from visiting the hotspots, and now she has  been into Rajabazar, Topsia, requesting to obey lock down
HIDE and SEEK  going on https://t.co/PPgQKMn3LC"
2020-04-22 01:05:36+00:00,"RT @AskAnshul: For Palghar lynching, nobody questioned:

1. State govt: How did crowd gather in lockdown?

2. CPIM MLA

3. Police for watch…",bittu_bhai1010,India,"Graduate.
Aspirations For a Better Tomorrow.
Foody.
Have my own Ideology, Views and difference of Opinion on different Issues.",1311,2436,94193,False,"For Palghar lynching, nobody questioned:

1. State govt: How did crowd gather in lockdown?

2. CPIM MLA

3. Police for watching silently.

Instead, fake news was spread: BJP Sarpanch was arrested in this case.

Fact: BJP Sarpanch getting threats from relatives of arrested accused"
2020-04-22 01:05:38+00:00,"Coronavirus: US green cards to be halted for 60 days, Trump says https://t.co/QrMgKgMok5",namanmahajan44,"Dewas, India","I am Naman Mahajan as a profession I am a multimedia artist with various skills like graphics design and animation, my current website is https://t.co/Ml7A8mvt5E",18,25,3168,False,No Value Mentioned
2020-04-22 01:05:38+00:00,RT @angkitadutta: . @srinivasiyc has been an inspiration throughout his journey as an activists. Personally I have not seen anyone who has…,Karan_withRG,India,"@withRG
I believe in ideology of @INCindia  | @congress in blood | Fan of sh @RahulGandhi ji, Maharaja @Capt_amarinder ji",1138,288,31671,False,. @srinivasiyc has been an inspiration throughout his journey as an activists. Personally I have not seen anyone who has worked tirelessly and with such dedication during #COVIDー19 Relief ! Relief ! Relief thats what’s he has been doing since this lockdown without a plan @IYC https://t.co/8ptBqWK6HM
2020-04-22 01:05:38+00:00,"RT @Rajniin48551148: In this lockdown period, @derasachasauda followers are also doing their contribution such as providing food / rashan t…",kukkartarsem,Bikaner Rajasthan India,IT WING MEMBER,231,283,63445,False,"In this lockdown period, @derasachasauda followers are also doing their contribution such as providing food / rashan to the needy. This they have learnt from their Guru  @Gurmeetramrahim Ji. What other contribution they are giving??? 

#ServeNeedyInLockdown"
2020-04-22 01:05:38+00:00,RT @priya_cheers: From a colleague in the field of Anesthesia and ICU working on the frontline of COVID19- here is what she messaged today.…,harini_niki1910,"Salem, India",Sadhguru’s little girl...!! 🙈🙈 A craziest lover of Devi..!! 🙊🙊,637,838,8831,False,From a colleague in the field of Anesthesia and ICU working on the frontline of COVID19- here is what she messaged today. Truly grateful to @SadhguruJV and @ishafoundation for a simple 3 minute tool to build immunity and improve lung capacity #SimhaKriya 🙏🏼 https://t.co/YxpD9ZxNnR
2020-04-22 01:05:39+00:00,RT @NursingNotesUK: It is with great sadness we announce that nurse Julie Penfold has sadly died from COVID-19. Her daughter said she “love…,thanalofficial,"Chennai, India","இங்கு ரவுத்திரம் பிறப்பதும், மூடமய் எரிப்பதும், தீச்செயல் அழிப்பதும் - தணல், நாடு திருந்த திருத்தம் சொல்லும். retweets are not endorsements.",9,189,553,False,"It is with great sadness we announce that nurse Julie Penfold has sadly died from COVID-19. Her daughter said she “loved her job, she loved helping people, she was a beautiful person.” https://t.co/NvSSaaXH4f"
2020-04-22 01:05:40+00:00,CDC chief warns of 'even more difficult' wave of coronavirus next winter https://t.co/jgoNPLCowy,anish_nanda,"Mumbai, India",21 yrs exp in IT. Held Leadership positions in various companies. Now in stock market-Not SEBI registered; educational purpose only. Canadian citizen with OCI.,49,8,7583,False,No Value Mentioned
2020-04-22 01:05:42+00:00,"RT @NehaWadekar: Last year @samiribrahim and I bought a bunch of stuff for #burningman - masks with filters, hand sanitizer, Lysol wipes. W…",mrsunil58,India,"Admire positive thinking, transparency and honest action, Simplicity #Motivation  #inspiration Love Nature, Wildlife, Travel, Good Food, Sports, Music, Reading",5659,5831,32004,False,"Last year @samiribrahim and I bought a bunch of stuff for #burningman - masks with filters, hand sanitizer, Lysol wipes. Who would have thought our surplus would come in handy now? #COVID19"
2020-04-22 01:05:43+00:00,"RT @ashoswai: They keep saying in China, they eat 'this and that'. If you tell them in certain parts of India, we also eat that 'this and t…",rvn1304,"Bengaluru South, India","stock market:Trader & investor in #substandard #poverty #fraud #corruption rich country #India #castism  #doublestandards #atrocity

https://t.co/JHi3GHnEAC",422,4340,8130,False,"They keep saying in China, they eat 'this and that'. If you tell them in certain parts of India, we also eat that 'this and that' then they say you are a racist. Logic and bigotry are like water and oil! #COVID19"
2020-04-22 01:05:43+00:00,RT @indgop: .@INGuardsman has been working hard to serve Hoosiers in our fight against the #coronavirus. They have been on the front lines…,lisareid11,Indiana,No Value Mentioned,1686,408,115526,False,".@INGuardsman has been working hard to serve Hoosiers in our fight against the #coronavirus. They have been on the front lines delivering food, supplies &amp; helping at test sites.

https://t.co/kp1wqzYHXN"
2020-04-22 01:05:45+00:00,Good for this dude. Shit em DOWN https://t.co/vVRCcbSFIY,aeast317,"Indianapolis, IN",still sad after all these years (oh p.s. my opinions are my own),481,939,19492,False,No Value Mentioned
2020-04-22 01:05:48+00:00,"RT @CissnaMatthew: No thanks, experts. I get my health advice from a failed casino owner who makes gut decisions. https://t.co/TyFoAzUB3q",SarcasmicGuru,"New Delhi, India","an Anesthesiologist,
a newbie reader,
a Gulzar disciple,
a dad of 2 cuties and.... 
no offences... 
#thodaSARCASMhojaye 
#sarcasmisMeditation",556,1798,6859,False,"No thanks, experts. I get my health advice from a failed casino owner who makes gut decisions. https://t.co/TyFoAzUB3q"
2020-04-22 01:05:55+00:00,"RT @StuteeMishra: In Bihar's Araria, a homeguard was made to do sit-ups as punishment and beg for mercy after he stopped an agriculture off…",CAP_269,India,No Value Mentioned,289,444,8450,False,"In Bihar's Araria, a homeguard was made to do sit-ups as punishment and beg for mercy after he stopped an agriculture officer, asked for pass and checked his car. What an honourable way to thank Corona-fighters! https://t.co/8kICdUdNAg"
2020-04-22 01:05:56+00:00,@StateHealthIN Dr. Box - REALLY??? Why aren’t we testing EVERYONE??? @GovHolcomb @IndyMayorJoe https://t.co/dJV7v8SvjC,monarchmom,"Indianapolis, IN","I love my amazing granddaughters, monarch butterflies, bunnies, hiking, biking, photography, and all things nature.",92,207,201,False,No Value Mentioned
2020-04-22 01:05:56+00:00,"RT @ncjain50: @geetv79 Destabilised MP Govt of Kamal Nath &amp; finally dislodged. All through Covid-19 kept spreading, now MP Gujarat are fast…",Karan_withRG,India,"@withRG
I believe in ideology of @INCindia  | @congress in blood | Fan of sh @RahulGandhi ji, Maharaja @Capt_amarinder ji",1138,288,31671,False,"@geetv79 Destabilised MP Govt of Kamal Nath &amp; finally dislodged. All through Covid-19 kept spreading, now MP Gujarat are fastest spreading virus with no. of new cases &amp; death rising. While Kerala, Chattisgarh &amp; Rajasthan performance good."
2020-04-22 01:05:57+00:00,"RT @swati_gs: Except that the family of the deceased has given a complaint to police accusing the ""five Muslim friends"" of lying to the med…",rudraax,India,Take no hindutva warrior seriously unless he/she has atleast 3 kids of their own.,55,82,14919,False,"Except that the family of the deceased has given a complaint to police accusing the ""five Muslim friends"" of lying to the media for publicity

Follow-up report tomorrow 👍 https://t.co/GSRzDo7Z2C"
2020-04-22 01:06:10+00:00,"RT @amitmalviya: After Bengal, now Maharashtra Chief Minister attempts to gag doctors who may be critical of his government’s poor handling…",spsinghace,"New Delhi, India","A fighter pilot, Strategic Expert, Troubleshooter, Motivator, Handled infrastructure projects worth 500 Cr and above, Flown SU-30, Bison & MiG21 aircrafts",74,368,2469,False,"After Bengal, now Maharashtra Chief Minister attempts to gag doctors who may be critical of his government’s poor handling of Covid... Deplorable! https://t.co/vjxmOjUHVY"
2020-04-22 01:06:11+00:00,RT @NZStuff: Live: Prime minister giving daily coronavirus update https://t.co/ec7OPSbXaW,HotelsWindow,"Dehradun, India",Traveller n Foodie,404,1087,9030,False,Live: Prime minister giving daily coronavirus update https://t.co/ec7OPSbXaW
2020-04-22 01:06:16+00:00,"World coronavirus dispatch: Lockdowns go into June; US halts immigration  
https://t.co/Ls5piqSF4j",Uditgupta_ug,"Jaora, India",https://t.co/ZJBw54Eyg5,38,29,41026,False,No Value Mentioned
2020-04-22 01:06:18+00:00,"Thanks ,Hospital got Corona+ Report on 11th April, but hide that report and treated him in Yellow Hospital n slapped bill of 4 lakh, had he been transfered to Red Hospital he could have been saved, Will @ChouhanShivraj You cancell Licence of Synergy Hospital??? For Ignorance https://t.co/96ID7vM3rp",CaAmod,India,"Proud Indian, A  CA, DISA, Am not biased, Follow back is not guaranteed, Love my India, RT are not necessary my endorsement, Modi Chhap Do not follow me",538,451,4629,False,No Value Mentioned
2020-04-22 01:06:19+00:00,Kerala CM calls for self-sufficiency in producing food grains if Covid-19 lockdown extends https://t.co/6k8abDcgoO,republic,"Mumbai, India","Official handle of the Republic Media Network.
DIGITAL. TV. MEDIA
https://t.co/jpp32jhq3d",1373443,3,311875,True,No Value Mentioned
2020-04-22 01:06:20+00:00,"Stunning #flamingoes 🦩 come gliding and swaying onto #mumbai waters , this year these migratory birds and many more in number - such a delightful sight 
Tweet @nishjamvwal #coronaindia #lockdown https://t.co/3QgK7t6KrB",nishjamvwal,India,Lifestyle Columnist/Luxury/BrandConsultant/Influencer/Traveler 💌Instagram 👉🏻 nishjamvwal 💌Facebook 👉🏻nisha.jamvwal 💌snapchat 👉🏻nishajamvwal,15856,913,10538,True,No Value Mentioned
2020-04-22 01:06:21+00:00,"RT @thakur_shivangi: Dear All, 

Many are trying to reach out to me and wanted to know whether I am ok or not. Unfortunately I am one of th…",ShriManojTiwari,"Mumbai, India","Sports, Politics and Entertainment writer. Working with @100MasterBlastr. Formerly has worked with @TheSportswallah. RT is not endorsed.",217,693,10864,False,"Dear All, 

Many are trying to reach out to me and wanted to know whether I am ok or not. Unfortunately I am one of those mumbai journalist who tested POSITIVE for corona virus but I am doing well as of now. I keep praying, hoping and believing that soon I will win this battle."
2020-04-22 01:06:21+00:00,RT @Ganjam_Admin: Unlock yourself in Lockdown..we got very enthusiastic response from students for painting competitions.. thx to X GEN aca…,Jagannath_jaggs,"Brahmapur, India","Student by profession,Traveller by passion,Rider by hobby.

A proud Indian.",63,513,3770,False,Unlock yourself in Lockdown..we got very enthusiastic response from students for painting competitions.. thx to X GEN academy Berahampur #OdishaFightsCorona @CMO_Odisha https://t.co/60Xxv2a258
2020-04-22 01:06:22+00:00,"RT @CortesSteve: A lockdown into June for Chicago would send the city’s economy into a full-on depression.

Mayor Lightfoot is a scold, a t…",JanetOwens1000,"Indiana, USA","Patriotic American.  I’m loyal, fun and a great listener.",469,891,36681,False,"A lockdown into June for Chicago would send the city’s economy into a full-on depression.

Mayor Lightfoot is a scold, a tyrant, and a complete hypocrite.

https://t.co/E1oDepZqiI https://t.co/SBNaag6gDD"
2020-04-22 01:06:22+00:00,"RT @Faruk_Shaikh77: The police raided the mosque. After  they were received the news of offering prayers in the mosque, but no one was offe…",MdNewtonSk2,India,"Jinki Umeed Allah Se Ho,

Woh Kabhi Na Umeed Nahi Hote",36,20,7225,False,"The police raided the mosque. After  they were received the news of offering prayers in the mosque, but no one was offering prayers, they were preparing food kits for the poor, also taking care of social distancing.

#Islamophobia_In_India https://t.co/96TYLVht5t"
2020-04-22 01:06:25+00:00,@jon_dmk Madam got busy with tackling corona #FightAgainstCoronavirus,athaulla5,"Nellore, India",Need to simplify the life 👈,5,114,21,False,No Value Mentioned
2020-04-22 01:06:28+00:00,Good morning to everyone I hope you all are #StayHome #StayHomeStaySafe https://t.co/tSY5fx0FDF,AnushkaSharmaa9,"Mumbai, India","FC Account,Actress, lovers, Singer, 
A Fan Page @AnushkaSharma
Ask question #AnushkaSharmaa9",1007,34,1210,False,No Value Mentioned
2020-04-22 01:06:30+00:00,"RT @LadyVelvet_HFQ: I knew India, the country of Gandhi, a country which suffered enough. The whole world is on its nerves with Covid19, bu…",SadanShaikh1532,"Purnea - Bihar, India","हम मुसलमान हैं साहब 
जितनी मुहब्बत ईमान से है 
उतनी ही  मुहब्ब्त 
अपने मुल्क हिंदुस्तान से है।",63,153,619,False,"I knew India, the country of Gandhi, a country which suffered enough. The whole world is on its nerves with Covid19, but the hate should stop. Namaste 🙏 

https://t.co/HvXgOP0oq8"
2020-04-22 01:06:35+00:00,"RT @ArvinderSoin: Physician notes tell us COVID not limited to lungs. It can have a wide-ranging impact (https://t.co/v5aqZKSHeS). 

Moral:…",GunjalkarTweets,"Maharashtra, India",Bhartiya Janata Party - BJP,218,5013,7464,False,"Physician notes tell us COVID not limited to lungs. It can have a wide-ranging impact (https://t.co/v5aqZKSHeS). 

Moral: #StayHomeSaveLives https://t.co/gSb3DZeIxv"
2020-04-22 01:06:37+00:00,"RT @MoCharoliya: 30 Tablighi Jamaat Muslims, including a Professor, have been arrested in Allahabad, on the false pretext of Corona.
Police…",IndiasMuslims20,india,Indian muslim,564,80,3298,False,"30 Tablighi Jamaat Muslims, including a Professor, have been arrested in Allahabad, on the false pretext of Corona.
Police also alleged that ""they had been indulging in propagating their religion"".
Being a Muslim in India is a crime #Islamophobia_In_India
 https://t.co/xVAUdQpEFk"
2020-04-22 01:06:38+00:00,"RT @alig_choudhary: Boxer Wilhelm Ott Converts To Islam During Corona Isolation On April 16.
Ott has revealed that he has found his faith i…",MdNewtonSk2,India,"Jinki Umeed Allah Se Ho,

Woh Kabhi Na Umeed Nahi Hote",36,20,7225,False,"Boxer Wilhelm Ott Converts To Islam During Corona Isolation On April 16.
Ott has revealed that he has found his faith in Islam during the crona- lockdown.This crona- crisis hit the entire world, people are getting inclined towards the teaching of Islam.
#Islamophobia_In_India https://t.co/Nocf4HFKKL"
2020-04-22 01:06:38+00:00,@flyspicejet @DGCAIndia @ushapadhee1996 @HardeepSPuri @AjaySingh_SG @aajtak @MoCA_GoI  how ur making booking without government instructions????.how ur confirming it wen payment is made????? y den not refunding our old booking money made before lockdown...stop duping us ??????? refund it,SatishG20685,India,"Lovable, notorious & day dreamer......music and cricket is ma passion......nythn for dis",18,0,12723,False,No Value Mentioned
2020-04-22 01:06:41+00:00,"RT @mdbaid: Massive Tsunami is coming.

They are fooling about..They are not clear about what to do. India should be preparing itself not f…",Karan_withRG,India,"@withRG
I believe in ideology of @INCindia  | @congress in blood | Fan of sh @RahulGandhi ji, Maharaja @Capt_amarinder ji",1138,288,31671,False,"Massive Tsunami is coming.

They are fooling about..They are not clear about what to do. India should be preparing itself not for just COVID virus but for the ""economic devastation"" that is coming.

..saying it again and again. 

Our PPL are going to go through unimaginable pain. https://t.co/6EgdkJ5iO8"
2020-04-22 01:06:41+00:00,"I'm proud to be the #Indian 🇮🇳  and I'm sure we'll recover from #COVIDー19 very soon... Thanks to all Doctors, Nurses, Policemen and Municipal workers.... proud of you #FrontLineHeroes 

#IndiaFightsCorona https://t.co/q1lRu3mCPl",ArunJD_,"Punjabi , INDIA",I am a Nature Lover person🌳🌴🌳🌴 🍀Love all the beautiful creatures 🐬🐳🐟 of this planet created by Creator himself (GOD),58,368,4034,False,No Value Mentioned
2020-04-22 01:06:42+00:00,"RT @adgpi: #HarKaamDeshKeNaam

#IndianArmy is committed to build critical lines of communication even through the challenges of #COVID19.…",Shrikant_STPIB,"Bengaluru, India",Software Technology Parks of India Bengaluru-STPIB,329,182,119399,False,"#HarKaamDeshKeNaam

#IndianArmy is committed to build critical lines of communication even through the challenges of #COVID19. 

484 M Bridge connecting  #Kasowal Enclave to mainland #Punjab constructed on #RaviRiver. https://t.co/hVsrhA4Z98"
2020-04-22 01:06:43+00:00,"RT @nypost: De Blasio's social distancing tip line flooded with penis photos, Hitler memes https://t.co/lZaLcZnULm https://t.co/J297k858hq",Hemorrhagician,"Indiana, USA","23/5 🐊 INTP
#AnimeRight",663,356,4373,False,"De Blasio's social distancing tip line flooded with penis photos, Hitler memes https://t.co/lZaLcZnULm https://t.co/J297k858hq"
2020-04-22 01:06:46+00:00,RT @CBS_Herridge: #FISA During a phone-in radio interview @hughhewitt asked if the Durham investigation into the origins of the FBI 2016 Ru…,mrarbuckle33,"Indiana, USA","U.S. Navy Veteran, Husband, Small business owner and proud follower of Christ☦. I love our Country and @POTUS @RealDonaldTrump!🙏🇺🇸#MAGAVETERANS #MAGA #Q #Q+",2158,3357,6127,False,"#FISA During a phone-in radio interview @hughhewitt asked if the Durham investigation into the origins of the FBI 2016 Russia probe, and the four FISA warrants for a Trump campaign aide is on track, undisturbed by COVID-19? Attorney General Barr: “Yes” @CBSNews"
2020-04-22 01:06:47+00:00,"RT @dana81408206: The Hidden TRUTH About the
Coronavirus!
https://t.co/C1ePz9CQRd https://t.co/y2EslErfZk",ravinderuiux,"New Delhi, India","Hi, I have three years experience in creating a professional UI/UX design. #uidesign #graphicdesign #frontenddeveloper #angular #expressjs #mongodb #wordpress",56,160,915,False,"The Hidden TRUTH About the
Coronavirus!
https://t.co/C1ePz9CQRd https://t.co/y2EslErfZk"
2020-04-22 01:06:49+00:00,"RT @DIPR_Leh: A senior citizen of Diskit Tsal Housing Colony Smt Rigzin Angmo generously donated Rs. 20,000/- towards LG Relief Fund to fig…",shinde56shinde1,"New Delhi, India",INDIAN,20,104,588,False,"A senior citizen of Diskit Tsal Housing Colony Smt Rigzin Angmo generously donated Rs. 20,000/- towards LG Relief Fund to fight #COVID19

https://t.co/6rKMzO0lDl

@PMOIndia @lg_ladakh @ladags @DvCom_Secretary @justcsachin https://t.co/NQHjcFbRjk"
2020-04-22 01:06:50+00:00,"RT @geetv79: Mo-Sha who are now busy hunting for scapegoats to blame for the spread of Covid in India, denied that Coronavirus was a proble…",Karan_withRG,India,"@withRG
I believe in ideology of @INCindia  | @congress in blood | Fan of sh @RahulGandhi ji, Maharaja @Capt_amarinder ji",1138,288,31671,False,"Mo-Sha who are now busy hunting for scapegoats to blame for the spread of Covid in India, denied that Coronavirus was a problem till 13th March &amp; waited to topple the MP Govt before declaring lockdown on 24th March, infecting many of the state's officials
https://t.co/Vd7772cala"
2020-04-22 01:06:50+00:00,"RT @ANI: More than 2,700 dead in United States from #Coronavirus in last 24 hours: AFP news agency quoting tracker",drjkdwivedi,India,"persons with hidden identity may be criminal so get away, JAI HIND",135,183,4680,False,"More than 2,700 dead in United States from #Coronavirus in last 24 hours: AFP news agency quoting tracker"
2020-04-22 01:06:52+00:00,RT @BillOReilly: Question of the evening: why are so few children getting Coronavirus? Check out the No Spin News on https://t.co/rryWmyXe7…,JanetOwens1000,"Indiana, USA","Patriotic American.  I’m loyal, fun and a great listener.",469,891,36681,False,Question of the evening: why are so few children getting Coronavirus? Check out the No Spin News on https://t.co/rryWmyXe7C for the answer!
2020-04-22 01:06:54+00:00,"Corona Virus: Infection of Maharashtra picks up pace, death rate more in Punjab https://t.co/f8gqfm6AJx https://t.co/z7D2WLFZTm",AmpinityNews,"Mumbai, India","Ampinity News - Latest English News Updates On Entertainment, politics, sports, education, festival, technology television serials world news updates.",76,211,9995,False,No Value Mentioned
2020-04-22 01:06:54+00:00,RT @WHOAFRO: The @UN Solidarity Flight arrived last night in Guinea-Bissau w/ medical equipment to support health workers in the fight agai…,Karan_withRG,India,"@withRG
I believe in ideology of @INCindia  | @congress in blood | Fan of sh @RahulGandhi ji, Maharaja @Capt_amarinder ji",1138,288,31671,False,"The @UN Solidarity Flight arrived last night in Guinea-Bissau w/ medical equipment to support health workers in the fight against #COVID19. The cargo was donated by @WHO &amp; @foundation_ma, with logistics &amp; transportation supported by @WFP, @FMoHealth, @AfricaCDC &amp; @_AfricanUnion. https://t.co/pKlGeJ6qug"
