created_at,full_text,screen_name,location,description,followers_count,friends_count,statuses_count,verified,full_retweet_text
2020-04-30 06:07:46+00:00,"RT @chintskap: An appeal 🙏 to all brothers and sisters from all social status and faiths. Please don’t resort to violence,stone throwing or…",DwivediPraddumn,"Bhopal, India","Simplest....No attitude but full(लबरेज़)of confidence..

।।भगवद्प्रेमी।।",181,177,42917,False,"An appeal 🙏 to all brothers and sisters from all social status and faiths. Please don’t resort to violence,stone throwing or lynching. Doctors,Nurses,Medics, Policemen etc..are endangering their lives to save you. We have to win this Coronavirus war together. Please. Jai Hind!🇮🇳"
2020-04-30 06:07:46+00:00,"RT @MumbaiPolice: Our 29 year old frontline warrior, who tested positive for Coronavirus, just summarised what we’ve been meaning to tell y…",vinay_gangan18,"Mumbai, India","One Word - 'Cricket'
And Just 3 letters 'MSD' ❤",162,443,461,False,"Our 29 year old frontline warrior, who tested positive for Coronavirus, just summarised what we’ve been meaning to tell you all along - काही टेंशन घेऊ नको रे, मित्रा! 

#AamhiDutyVarAahot 
#MumbaiPoliceOnDuty 
#MumbaiFirst
#TakingOnCorona https://t.co/tNJWg7Ljsv"
2020-04-30 06:07:47+00:00,RT @ashokgehlot51: Rahul ji’s dialogue with Dr Rajan is a way to seek expert opinion to deal with the grave crisis that our country is faci…,drmadanyadav,"Jaipur, India",Phd in Management | Indian Citizen Views~Personal|,277,78,2854,False,"Rahul ji’s dialogue with Dr Rajan is a way to seek expert opinion to deal with the grave crisis that our country is facing due to #COVID19 &amp; slowdown in economy. It is an attempt to show the way ahead with suggestions from experts so that things can improve.
#RahulShowsTheWay"
2020-04-30 06:07:47+00:00,"RT @achyuta_samanta: Art of Giving is all about creating an unconditional and sustainable abundance of love, peace and happiness and conten…",Rajeshmantry3,"Bhubaneswar,India",No Value Mentioned,21,28,394,False,"Art of Giving is all about creating an unconditional and sustainable abundance of love, peace and happiness and contentment for others through gestures of kindness and generosity...
Read the blog: https://t.co/EL9dB9Aqcw

#ArtofGiving 
@artofgiving_net"
2020-04-30 06:07:47+00:00,RT @INCAssam: LIVE: Shri @RahulGandhi in conversation with Dr. Raghuram Rajan on COVID19 &amp; its economic impact. #RahulShowsTheWay https://t…,AshaudIYC,"Assam, India","Assam Prodesh Youth Congress &
Social Media Department",218,91,5026,False,LIVE: Shri @RahulGandhi in conversation with Dr. Raghuram Rajan on COVID19 &amp; its economic impact. #RahulShowsTheWay https://t.co/9w3YRtlyVG
2020-04-30 06:07:47+00:00,RT @Muralik79739498: What's your take on hundreds of acres of Delhi's land wasted upon politician’s graves belonging to Nehru/Gandhi with N…,Gemphpnut,India,"Freelance web developer,content developer,",86,376,16909,False,"What's your take on hundreds of acres of Delhi's land wasted upon politician’s graves belonging to Nehru/Gandhi with Nehru having53acres, Indira having45acres, Rajiv with15acres, and Gandhi with 44acres worth more than one lakh crores? Who is paying the maintenance charges of it? https://t.co/LPTvh3YxNj"
2020-04-30 06:07:48+00:00,"RT @ImRaina: Happy birthday, Rohit! Wishing you and the family health and happiness in these dire times. Stay home, stay safe, bake a cake.…",hell10jack,"Bengaluru, India",my main id @helljack10,218,341,1212,False,"Happy birthday, Rohit! Wishing you and the family health and happiness in these dire times. Stay home, stay safe, bake a cake. @ImRo45 #HappyBirthdayRohit https://t.co/E2ToRIkGIS"
2020-04-30 06:07:48+00:00,"RT @RahulGandhi: A conversation with Dr Raghuram Rajan, former RBI Governor, on dealing with the #Covid19 crisis. https://t.co/cdJtJ7ax0T",savitasingh36,"Delhi, India",Working with an MNC!! 🐠 ‘’Only dead fish go with the flow”!! R u alive???,531,251,24658,False,"A conversation with Dr Raghuram Rajan, former RBI Governor, on dealing with the #Covid19 crisis. https://t.co/cdJtJ7ax0T"
2020-04-30 06:07:49+00:00,RT @HimanshuS_INC: Sri #RahulGandhi will be interacting with Former RBI Governor Dr. #RaghuramRajan on the critical issues related to #COVI…,IycJaved,"Amroha, India","जिला संयोजक शोशल मीडिया यूथ कोंग्रेस अमरोहा 
पूर्व जिला संयोजक व पूर्व प्रदेश सचिव NSUI पश्चिम उत्तर प्रदेश
8126383318",312,701,5375,False,"Sri #RahulGandhi will be interacting with Former RBI Governor Dr. #RaghuramRajan on the critical issues related to #COVID-19 and its economic impact. 

Join us tomorrow at 9 am to watch this interaction on INC's social media platforms. @INCUttarPradesh   @RahulGandhi https://t.co/KeOajuB0r0"
2020-04-30 06:07:50+00:00,"RT @ashokgehlot51: Dr Rajan insists, number of corona testing should increase. He suggests going for mass testing &amp; prioritizing testing in…",drmadanyadav,"Jaipur, India",Phd in Management | Indian Citizen Views~Personal|,277,78,2854,False,"Dr Rajan insists, number of corona testing should increase. He suggests going for mass testing &amp; prioritizing testing in the hot spots. #RahulGandhi ji has been also emphasizing that we need to test more.
#RahulShowsTheWay"
2020-04-30 06:07:50+00:00,"RT @LadyVelvet_HFQ: I knew India, the country of Gandhi, a country which suffered enough. The whole world is on its nerves with Covid19, bu…",KolkataRoyal,Punjab india ,"@KolkataRoyalOfficial
The tweeter page of Kolkata Royal Team official ,Founder Chairperson,GroupofRestaurant,
Operational Manager,H.R Manager, Punjab,India",13,89,365,False,"I knew India, the country of Gandhi, a country which suffered enough. The whole world is on its nerves with Covid19, but the hate should stop. Namaste 🙏 

https://t.co/HvXgOP0oq8"
2020-04-30 06:07:51+00:00,"RT @RahulGandhi: At 9 AM today, you can watch my conversation with Dr Raghuram Rajan, former RBI Governor, on dealing with the #Covid19 cri…",AnsariRashika,Dhule Maharashtra India ,"Not a deshbhakt but really a desh premi, logical not andh bhakti, real issues not Gau gobar",90,52,25120,False,"At 9 AM today, you can watch my conversation with Dr Raghuram Rajan, former RBI Governor, on dealing with the #Covid19 crisis &amp; a new vision for India on my Twitter, Facebook &amp; Youtube platforms. This is the first of a series of conversations with global &amp; Indian thought leaders."
2020-04-30 06:07:52+00:00,"RT @siddmh_TNIE: With 14 active cases, coronavirus fear grips Delhi's Azadpur mandi traders https://t.co/ngcews2r78 via @NewIndianXpress",theparvezsultan,"New Delhi, India","writes on Delhi politics, heritage & urban issues @NewIndianExpress/ @TheMornStandard Ex @htTweets @TheDailyPioneer @mail_today
contact: parwaiz@gmail.com",3610,885,13555,True,"With 14 active cases, coronavirus fear grips Delhi's Azadpur mandi traders https://t.co/ngcews2r78 via @NewIndianXpress"
2020-04-30 06:07:52+00:00,"It assumes that all of us have the time, resources and mental capacity to actually deal with a pandemic, and absorb vast amounts of information. On top of everything else. If you are unable to, there is an implicit understanding that the carnival has left without you.",shohinisengupta,"New Delhi, India","Finding love in animals, books, food, travel, and obscure ideas; and hope in humanity.",477,827,3019,False,No Value Mentioned
2020-04-30 06:07:53+00:00,"RT @thewire_in: It is shocking that even six weeks into this lockdown, there has not been a single intervention or positive direction by th…",RupeshR25506368,"New Delhi, India",Indian Citizen,26,115,10404,False,"It is shocking that even six weeks into this lockdown, there has not been a single intervention or positive direction by the court despite multiple petitions before it begging for justice | Mahua Moitra

https://t.co/MbDGkiDfpV"
2020-04-30 06:07:53+00:00,"RT @TimesNow: One has to understand that this is not a permanent ban, but a temporary one only during the lockdown: @syedzafarBJP, Spokespe…",haiderkhan1983,"New Delhi, India","Delhi High Court,
Social Worker",513,387,42085,False,"One has to understand that this is not a permanent ban, but a temporary one only during the lockdown: @syedzafarBJP, Spokesperson, BJP tells Padmaja Joshi on @thenewshour AGENDA. | #LiquorLockdownJam https://t.co/865vZgh8CZ"
2020-04-30 06:07:54+00:00,RT @INCIndia: Shri @RahulGandhi will be interacting with Former RBI Governor Dr. Raghuram Rajan on the critical issues related to COVID-19…,arikakanwar011,"Punjab, India",Vice chaiman social media cell punjab #SocialActivist,2877,223,121340,False,"Shri @RahulGandhi will be interacting with Former RBI Governor Dr. Raghuram Rajan on the critical issues related to COVID-19 and its economic impact. 

Tune in tomorrow at 9am to watch this interaction on our social media platforms. https://t.co/Bi1BEwY7gL"
2020-04-30 06:07:55+00:00,RT @INCTelangana: LIVE: Shri @RahulGandhi in conversation with Dr. Raghuram Rajan on COVID19 &amp; its economic impact. #RahulShowsTheWay https…,INCHubDwdEast,"Hubli, India","Official Account of Hubli Dharwad East Assembly Congress.
https://t.co/EcuDe2i35D
@inckarnataka",2704,2889,54813,False,LIVE: Shri @RahulGandhi in conversation with Dr. Raghuram Rajan on COVID19 &amp; its economic impact. #RahulShowsTheWay https://t.co/hCpnGHXYlX
2020-04-30 06:07:58+00:00,"RT @chintskap: An appeal 🙏 to all brothers and sisters from all social status and faiths. Please don’t resort to violence,stone throwing or…",asangeldreams,india,"pretty boy.                         
@asangledreams on Instagram.",330,274,52603,False,"An appeal 🙏 to all brothers and sisters from all social status and faiths. Please don’t resort to violence,stone throwing or lynching. Doctors,Nurses,Medics, Policemen etc..are endangering their lives to save you. We have to win this Coronavirus war together. Please. Jai Hind!🇮🇳"
2020-04-30 06:07:59+00:00,"@hillmailIndia @The_NehaJoshi @ArushiNishank @Rjkaavya You're doing a great job since the first day of lockdown. Indeed, we appreciate you ever. Proud of you dear sister.🙏🙏",IYogeshRana,"Dehradun, India 🇮🇳","Innovative Thinker, Blogger by passion, #SEO, #SMO, #WebAnalytics & #DataScience Evangelist. Let me show you how to generate endless leads to fuel your business",3225,4871,3506,False,No Value Mentioned
2020-04-30 06:07:59+00:00,@mybmc @PMOIndia @HMOIndia @MoHFW_INDIA @CMOMaharashtra @AnilDeshmukhNCP @rajeshtope11 @mayor_mumbai @mybmcHealthDept @mybmcPHD @PIBMumbai Alcohol has absolutely no connection for spread of Corona. Please open licensed liquor stores immediately.,anandjondhale,Mumbai-India,Lawyer/Advocate/Human Rights Activist/Political Thinker,223,1957,4052,False,No Value Mentioned
2020-04-30 06:08:00+00:00,"RT @ndtv: ""We don’t have the capacity to support people across the spectrum for too long"": Former RBI chief Raghuram Rajan speaks to Rahul…",amar_hrhelpdesk,"Gurgaon, India","Partner - Performance & Culture, Diversity. Global GoalKeeper 18 at Gates Foundation | Policy Maker (POSH) |",4581,145,5489,False,"""We don’t have the capacity to support people across the spectrum for too long"": Former RBI chief Raghuram Rajan speaks to Rahul Gandhi on #coronavirus crisis https://t.co/l0v6buZoWn"
2020-04-30 06:08:00+00:00,"RT @seemi_pasha: During #Covid_19 #lockdown when only essential services are allowed, should the Govt have suspended its witch-hunt of #Ant…",Rare22,India,"An observer of the happenings as they unfold ! Interests include Books , Films , Politics & Sports in no particular order . Retweets not endorsements .",784,1621,71336,False,"During #Covid_19 #lockdown when only essential services are allowed, should the Govt have suspended its witch-hunt of #Anti_CAAProtesters or is that too essential to postpone? My article in ⁦@thewire_in⁩ #delhiriotsconspiracy  https://t.co/AJNWL3G6fV"
2020-04-30 06:08:01+00:00,RT @rkmarar9: COVID-19 Crisis: Where is Modi’s Fall Guy? https://t.co/THsSmAFySz via @thewire_in,dmurugeshan2,"Bengaluru, India","Challenge an idea with your own. There's no one absolute truth it's all contextual. Just like Grey is Whiter next to Black, Darker next to White! Respect all 🙏",225,192,74266,False,COVID-19 Crisis: Where is Modi’s Fall Guy? https://t.co/THsSmAFySz via @thewire_in
2020-04-30 06:08:01+00:00,"RT @IndoPac_Info: #BREAKING:  #Wuhan lab ""most likely"" #coronavirus source, #US government analysis find

A Wuhan laboratory is the “most l…",pandeyji_k_beta,भारतवर्ष काशी क्षेत्र  India,"Smash me if you can I'm a Brahmin 🙏
Proud K A F I R",322,2826,12730,False,"#BREAKING:  #Wuhan lab ""most likely"" #coronavirus source, #US government analysis find

A Wuhan laboratory is the “most likely” source of the outbreak. It concludes that other explanations for the origin of the coronavirus are less credible.
https://t.co/hR9I7qkey1"
2020-04-30 06:08:01+00:00,"RT @pbhushan1: Many Tablighi Jamaat members, who have recently recovered from novel coronavirus, have come forward to donate their plasma f…",Raju89409618,"Navi Mumbai, India","उसूलों पर जहाँ आँच आये, टकराना ज़रूरी है !
जो ज़िन्दा हो, तो फिर ज़िन्दा नज़र आना ज़रूरी है !",600,662,40542,False,"Many Tablighi Jamaat members, who have recently recovered from novel coronavirus, have come forward to donate their plasma for the treatment of other Covid-19 patients https://t.co/w93DiiHzmY"
2020-04-30 06:08:02+00:00,@Twitter @ahmed_waqas21 Coz now lockdown,irupchan,"Guwahati, India","India first🙋,retweet r'nt endorsement. music 🎶🎧🤍",37,1238,168,False,No Value Mentioned
2020-04-30 06:08:02+00:00,"All progress takes place outside the comfort zone.
#stayfitathome #healthylifestyle
#StayAtHome 
And that's how we can fight against this Covid-19 https://t.co/fz5M4nc5EJ",SagarSh629,"Ghaziabad, India",Friendly/Extrovert/Ambitious/Ethcial,5,51,38,False,No Value Mentioned
2020-04-30 06:08:04+00:00,"RT @Collector_MBNR: Collector asked the bank managers to ensure social distancing outside the banks.

He also urged the bankers to ensure h…",v14460721_vali,"Hyderabad, India",1986,27,253,874,False,"Collector asked the bank managers to ensure social distancing outside the banks.

He also urged the bankers to ensure hand wash &amp; masks are made available outside the banks for the customers to curtail the spread of dreaded coronavirus.
@KTRTRS @VSrinivasGoud https://t.co/gvrq4Juj3q"
2020-04-30 06:08:05+00:00,"RT @RailMinIndia: #Coronavirus is waiting for you outside your home. 

If you step outside your house, #Coronavirus will make a way inside…",cmypp2019_uk,"Dehradun, India","Official page of Chief Minister Young Professional Programme, Government of Uttarakhand",886,58,910,False,"#Coronavirus is waiting for you outside your home. 

If you step outside your house, #Coronavirus will make a way inside your home. So please #StayHomeStaySafe
 
#IndiaFightsCorona https://t.co/bP8SjrqAEK"
2020-04-30 06:08:06+00:00,"RT @BJPLive: From giving additional insurance coverage to bringing an ordinance entailing stringent punishment for attacks against them, Mo…",RanjuNoida,"Noida, India","Co-Convenor IT & Social Media, BJP, Greater Noida West.",1408,1654,2633,False,"From giving additional insurance coverage to bringing an ordinance entailing stringent punishment for attacks against them, Modi government stands firmly with Corona warriors.

#IndiaFightsCorona https://t.co/dFLW7UFsFH"
2020-04-30 06:08:06+00:00,"RT @ashokgehlot51: The series of conversations started by #RahulGandhi ji wd global &amp; Indian thought leaders is a wonderful initiative, mor…",IycJaved,"Amroha, India","जिला संयोजक शोशल मीडिया यूथ कोंग्रेस अमरोहा 
पूर्व जिला संयोजक व पूर्व प्रदेश सचिव NSUI पश्चिम उत्तर प्रदेश
8126383318",312,701,5375,False,"The series of conversations started by #RahulGandhi ji wd global &amp; Indian thought leaders is a wonderful initiative, more so during the time of prsnt challenges. First in series wd former RBI gov,Dr #RaghuramRajan on dealing wd #COVID19 &amp; a new vision for India is very insightful"
2020-04-30 06:08:07+00:00,"RT @mvmeet: One should learn from Kerala how to destroy a state!

Kerala had relaxed lockdown across state

Now entire state is pushed back…",kumarbambam,INDIA,"*राष्ट्र प्रथम*  छद्म सेक्युलरो से घृणा #सनातनी# भक्त मर्यादा पुरषोतम का # हर हर महादेव । नमो नमः , हर RT समर्थन नही ।",1457,1148,282337,False,"One should learn from Kerala how to destroy a state!

Kerala had relaxed lockdown across state

Now entire state is pushed back into Red Zone

Pinarayi, what did you achieve under your tenure other than killing RSS &amp; BJP karyakarthas?

Now don't blame Modiji for your inefficiency"
2020-04-30 06:08:08+00:00,Misbehaviour Against Doctors and Staff in this PandemicTake action ASAP on this Fraudulent World College Jhajjar @drharshvardhan @UnitedRda @NMSF3 @FordaIndia @DrRebellious @drpankajsolanki @ndtv @ABPNews @mlkhattar @jyotiyadaav @nmoharyana @RdaPgims @AmitShah @JPNadda @AIIMSRDA https://t.co/odOShaC9BZ,swapi_007,"Gurgaon, India","INDIAN. MEDICO. 
Sic Mundus Creatus Est.",98,174,2913,False,No Value Mentioned
2020-04-30 06:08:09+00:00,Care workers in the epidemic—Part 2: Twenty years as a migrant worker mother - https://t.co/6K2rA93kww,N_Jayaram,"Bangalore, India",Independent journalist and translator (French to  English). My translation of a book on the Chinese regime was out a few months ago.,1114,197,29336,False,No Value Mentioned
2020-04-30 06:08:09+00:00,"RT @geetv79: Excellent ! If #ModiMadeDisaster is too arrogant to consult economists with expertise, experience &amp; erudition, on the economic…",puriyash41,"Bengaluru, India","Proud Hindu & Proud Congressi .
Tweets personal. RTs not endorsement.",3331,699,681875,False,"Excellent ! If #ModiMadeDisaster is too arrogant to consult economists with expertise, experience &amp; erudition, on the economic disaster unleashed on the country (even before the Coronavirus hit us), then RG will do it for him in national interest. 
#RahulShowsTheWay https://t.co/s52JYdefvD"
2020-04-30 06:08:09+00:00,RT @INCIndia: LIVE: Shri @RahulGandhi in conversation with Dr. Raghuram Rajan on COVID19 &amp; its economic impact. #RahulShowsTheWay https://t…,ansari_zubair,"Pune, India","HR, ITIL, ITSM, Data Management, Content Writer, People Management, Student of comparative Religion",40,242,997,False,LIVE: Shri @RahulGandhi in conversation with Dr. Raghuram Rajan on COVID19 &amp; its economic impact. #RahulShowsTheWay https://t.co/azomUpU1eW
2020-04-30 06:08:10+00:00,"@KTRTRS @KTRoffice @TelanganaDGP respected sir , I am a surgeon working with AIG hospital,HYD. We dropped our 3 yr old son with my in-laws at Chandrapur (MS) just before lockdown we need to get him back now coz he is missing us badly. Please help us,Thank U",AbhishekKatakwa,"Hyderabad, India",AbHi,19,9,88,False,No Value Mentioned
2020-04-30 06:08:10+00:00,"RT @chinmoyee5: Cardiologist Dr KK Aggarwal, former president of Indian Medical Association (IMA), wrote a letter to PM Modi about 10 days…",aadi_PA14,"Khargone,(MP) India","True Indian 
& 
 💯% 🅱️🅰️D 🅱️🅾️Y",720,300,19408,False,"Cardiologist Dr KK Aggarwal, former president of Indian Medical Association (IMA), wrote a letter to PM Modi about 10 days ago requesting him to replace ‘Namaste Trump’ with ‘Corona Namaste’. He is still waiting for a reply. 

Corona Carrier Trump is now exposed. https://t.co/B4ap0lqjTp"
2020-04-30 06:08:11+00:00,"RT @vpsbadnore: #COVID19 #WarRoom Review: #April29: 
Continuous rising of Positive cases in #Chandigarh is a cause of grave concern to all…",nidanoor143,"Chandigarh, India","🐼
23-1🎂
The heart wants what it wants ❤️

Snapcode - nidawaternymph",29,79,6140,False,"#COVID19 #WarRoom Review: #April29: 
Continuous rising of Positive cases in #Chandigarh is a cause of grave concern to all of us. My earnest appeal to the residents for physical distancing and  voluntary participation to help the Administration combat #COVID19. https://t.co/paqEDB5upb"
2020-04-30 06:08:12+00:00,"RT @VipanInsan: #ServingTheNation
 @derasachasauda Volunteers are #ServingTheNation Incredibly and helping people to fight against #COVIDー1…",_Sher_E_Hind_,"Haryana, India",🙏Dhan Dhan SATGURU Tera hi Aasra🙏,39,19,8859,False,"#ServingTheNation
 @derasachasauda Volunteers are #ServingTheNation Incredibly and helping people to fight against #COVIDー19
https://t.co/VBkEm6kKbv https://t.co/QUgsUvNuIJ..."
2020-04-30 06:08:12+00:00,RT @sanjayjavin: #BiharFightsCorona district wise cases in bihar as of 10 am on 30/4/2020.403 positive covid-19 cases till date. https://t.…,_shukla_abhinav,bettiah bihar india,Performance of indian cricket team affects my mood. I tweet as i like to be tweeted.😎😎,838,3967,3402,False,#BiharFightsCorona district wise cases in bihar as of 10 am on 30/4/2020.403 positive covid-19 cases till date. https://t.co/gGJtKpBNBa
2020-04-30 06:08:14+00:00,@Ganjam_Admin @CMO_Odisha @HFWOdisha Very correct and innovative step for social distancing. Salute for novel ideas of @Ganjam_Admin,SatyaDash753,"Odisha, India","Working as Associate Professor in Political Science, Sambalpur University",10,58,207,False,No Value Mentioned
2020-04-30 06:08:14+00:00,"#Mohali and #TarnTaran report fresh cases of #coronavirus

#CoronavirusPunjab #PunjabFightsCorona #COVID19

https://t.co/EnavYaQqUB",ptcnews,"Mohali, India","Official Twitter account of PTC NEWS, the leading Punjabi News channel, is the most sought after source of all news related to Punjab and Punjabiyat worldwide.",12246,77,91092,False,No Value Mentioned
2020-04-30 06:08:14+00:00,RT @EspireInfolabs: Brands are likely to experience disruption to usual operations &amp; face underperformance due to #COVID19- @EYnews. Join o…,MalhotraAakshi,"Gurgaon, India",No Value Mentioned,48,387,285,False,Brands are likely to experience disruption to usual operations &amp; face underperformance due to #COVID19- @EYnews. Join our #webinar &gt; https://t.co/VA7ygWctV0 to find how a quick 5-step #businesscontinuity &amp; Risk Mitigation plan can turn tides to favourable business returns! https://t.co/0bZzyXlghv
2020-04-30 06:08:15+00:00,Simple data &amp; trend for fight of #WestBengal  against Corona. 1. Day's positive 2. Number of Testing 3. Positive Cases per Testing. @derekobrienmp @MamataOfficial @madhuparna_N @ishadrita . Testing rate increased &amp; Positive cases/Testing is dropping. Datawise it is good indicator https://t.co/G97OYsjJQz,partha2019LS,"Gurgaon, India","IIM Bangalore Alumni,psephologist , Election Result Analyst. Visit: https://t.co/MKxzKSxINl for election result n analysis",5195,306,4057,False,No Value Mentioned
2020-04-30 06:08:15+00:00,"RT @SupriyaShrinate: Excellent, informative. This is the kind of conversation that must be had at times like these. It enriches public disc…",husainghw,"Bharuch, India",Civil Engineer (Dharamsinh Desai Uni.),385,384,21807,False,"Excellent, informative. This is the kind of conversation that must be had at times like these. It enriches public discourse. Puts fresh ideas on the table @RahulGandhi @INCIndia #RahulGandhi #RaghuramRajan #RahulShowsTheWay https://t.co/qhavBQsYsZ"
2020-04-30 06:08:15+00:00,RT @sambitlnt: Odisha needs to follow this. Please don't keep things locked up. The economic impact will be huge. We still don't have a wor…,mohapatrasachi1,India,"ସତ୍ ଚିତ୍ ଅଛି, ଆନନ୍ଦ ଫେରାର୍ ହେଇଯାଇଛି 😒",503,359,45971,False,"Odisha needs to follow this. Please don't keep things locked up. The economic impact will be huge. We still don't have a worrying number.

(I get we are expecting a huge influx. But that's controlled incoming, isn't it?) https://t.co/nuqfie88zt"
2020-04-30 06:08:16+00:00,"RT @RahulGandhi: At 9 AM today, you can watch my conversation with Dr Raghuram Rajan, former RBI Governor, on dealing with the #Covid19 cri…",AryaYadu,"New Delhi, India","Modes of passion brought tragedy so i was not to spell them high, this the point where LORD met me thwarting the culpable sigh. FOREVER IN YOUR SERVICE MY LORD.",56,272,1250,False,"At 9 AM today, you can watch my conversation with Dr Raghuram Rajan, former RBI Governor, on dealing with the #Covid19 crisis &amp; a new vision for India on my Twitter, Facebook &amp; Youtube platforms. This is the first of a series of conversations with global &amp; Indian thought leaders."
2020-04-30 06:08:16+00:00,"CII is reaching out to various communities, providing immediate relief &amp; strategic long-term rehabilitation support across India. Learn about its outreach programs to fight #COVID19outbreak. Learn more in CII #COVID19 bulletin➡️ https://t.co/mGZvpsBgEj #CIIFightsCorona #cii4india https://t.co/pzDeIE8z24",FollowCII,India,"Premier business association, CII partners Indian Industry, Govt. & Civil Society to create & sustain environment conducive to development of India.",153472,629,50922,True,No Value Mentioned
