created_at,full_text,screen_name,location,description,followers_count,friends_count,statuses_count,verified,full_retweet_text
2020-02-10 06:51:02+00:00,'All options on table for Pak citizens' return from China' - https://t.co/fOiLUfAZxC https://t.co/Vkp8zCzCLK,YuvNewsOfficial,"Hyderabad, India","Get flash news and regular updates on Politics, Economy, Science and Technology, Entertainment, Sports, Health and Legal all over the world.",268,77,17636,False,No Value Mentioned
2020-02-10 06:51:02+00:00,Factories Remain Shuttered in China as Some Regions Extend Shutdowns Amid Coronavirus https://t.co/YjUagOBZLx,MasterMindArun,"New Delhi, India",My name is Arun I’m a Technical Analyst based in Delhi. I spend a lot of time to market analysis for traders and try to understand global market. 😀,33,9,4656,False,No Value Mentioned
2020-02-10 06:51:06+00:00,RT @ETMarkets: Oil rises a second day in 'relief rally' over China coronavirus #CommodityNews #Outlook https://t.co/Iwc1SbtyU4,viralvm69,"Mumbai, India","Mumbai Meri Jaan...once you have lived in Maximum City ,no other place, is good enough",882,445,396580,False,Oil rises a second day in 'relief rally' over China coronavirus #CommodityNews #Outlook https://t.co/Iwc1SbtyU4
2020-02-10 06:51:09+00:00,RT @robindbrant: Walking through what should be the height of the lunchtime rush in Shanghai. This is not a city that’s ‘back to work’ #cor…,lakshmishaks,India,"Founder - Namo Brigade, Ex-Management Consultant, Amateur Economist,  NITK-Surathkal, XLRI alumnus",800,1139,29418,False,Walking through what should be the height of the lunchtime rush in Shanghai. This is not a city that’s ‘back to work’ #coronavirus
2020-02-10 06:51:11+00:00,RT @drkafeelkhan: This is Dr Sabista khan .I request all the Indians to come with me and speak up and take part in the protest today at 11…,Jeswin_V_George,"Pune/Cochin, India",Data analyst,61,411,1693,False,"This is Dr Sabista khan .I request all the Indians to come with me and speak up and take part in the protest today at 11 AM Mandi House, Delhi #FreeDrKafeel #LiWenliang #coronavirus https://t.co/GOQ26p076T"
2020-02-10 06:51:12+00:00,"If her next sample also tests negative, the patient will be declared fully recovered and will be discharged from the hospital. #coronavirus

https://t.co/pu9dbMHIPt",QuintFit,"Noida, India","Health. Get with it.
Join us on Telegram: https://t.co/LgZZhwuBHW",7535,251,7750,True,No Value Mentioned
2020-02-10 06:51:17+00:00,"RT @nytimes: Li Wenliang, a 34-year-old doctor, was among the first to warn about the coronavirus outbreak — only to be silenced by the pol…",Bindas_Bol_,India,"जो बोलना हे बिंदास बोल,ताकि दुनिया को सच पता चले # में नहीं कर सकता,पर हम जरुर कर सकते हे #
गलत की निंदा और सही की प्रशंसा करने का जिगर रखता हूँ !",1252,4997,173223,False,"Li Wenliang, a 34-year-old doctor, was among the first to warn about the coronavirus outbreak — only to be silenced by the police. We interviewed him via WeChat as he was hospitalized after he caught the virus from a patient. He died a few days later. https://t.co/worImk1zyx https://t.co/Xu4WeLiVBf"
2020-02-10 06:51:18+00:00,"Harshvardhan on #CoronaVirus 

Labs set up to do testing and research
1510 samples tested, 1507 found safe, being tested
Radio TV being used to spread awareness
Emergency Response kits ready
Number - 011-23978046
Giving technical assistance to Bhutan also

#SansadWatch",_maadhyam_,"New Delhi, India",Maadhyam is a Participatory Policy Making Platform. It aims to bring policy making closer to people and enable meaningful engagement!,2437,391,5952,False,No Value Mentioned
2020-02-10 06:51:27+00:00,"@smitaprakash @sona2905 Looks like a weapon has back fired. It's not from sea food, early reports said it is from bats or snakes certainly even in a country of anything eater like China ,not many must be eating bats or snakes.",displayjunction,"Mumbai, India","Manufacturer of #ModularPortableExhibitionSystems #PromotionTables,#DisplayBannerStands #MagneticPopUpsystems
R/T is not endorsement.",566,861,10971,False,No Value Mentioned
2020-02-10 06:51:29+00:00,"China Plans To Construct A Power Station In Space By 2025https://vilabin.com/article/china-plans-to-construct-a-power-station-in-space-by-2025/?feed_id...
https://t.co/MgllUtn7MT",VILabIndia,"Kolkata, India","Visual Information Lab (VILab India) #InformationSecurity, #WordPress, #HealthCorner, #Entertainment, #Science, #Design, #Blogging, #HealthCare & #DataSecurity.",169,1236,33118,False,No Value Mentioned
2020-02-10 06:51:30+00:00,"RT @LawrenceSellin: I agree.
The Indian Ministry of External Affairs: China-Pakistan Economic Corridor Impinges Sovereignty And Territorial…",IndiaAnalyst,India,"Pro-logic. Pro-Choice, Anti-Hypocrisy, India First. rt/follow is nt endorsement.
Profile Pic by domdeen / https://t.co/I3aK2xrCaz #CoronaVirus #WuhanVirus",2530,1938,175127,False,"I agree.
The Indian Ministry of External Affairs: China-Pakistan Economic Corridor Impinges Sovereignty And Territorial Integrity Of India, Hence Illegal.
https://t.co/LgvQe0aA1u"
2020-02-10 06:51:33+00:00,"By shattering the 92 years of #Oscars history, the South Korean #Parasite, becomes the first Non-English Movie to win the best picture academy award. 

Hollywood clearly knows where there is money. 21st century is clearly with Asia (read as China first).
https://t.co/aEQER6VVAO",venkatarangan,"Chennai, India","A white space leader 👨‍💼, Microsoft Regional Director (Honorary), startup investor, software entrepreneur, enjoys movies🎬, books 📚& blogging ✍️.",733,260,3516,False,No Value Mentioned
2020-02-10 06:51:51+00:00,RT @ANI: Union Health Minister Dr. Harsh Vardhan in Lok Sabha on Novel Coronavirus: So far 811 deaths have been reported in China. India is…,ManojSHindu,"Gurgaon, India","#HardcoreHindu, #BJPSupporter #Modifan, #HateCongress,",290,567,12809,False,"Union Health Minister Dr. Harsh Vardhan in Lok Sabha on Novel Coronavirus: So far 811 deaths have been reported in China. India is taking all preventive measures. We are monitoring and reviewing the situation daily. Till now 1,118 flights have been screened. https://t.co/aIiseda9tx"
2020-02-10 06:51:52+00:00,"#coronavirus do you still think like this ? Don't panic, so called ""government"" fake agenda. https://t.co/67NHpAkQJQ",_Devpandya,INDIA,"Hustle | Dream | Achieve
Hustle is the most controllable thing!!",58,192,2658,False,No Value Mentioned
2020-02-10 06:51:52+00:00,"RT @RGVzoomin: If I dint know this is the coronavirus , I would have put this as a decoratory piece in my room😳😳😳..Considering how cute it…",chaitanya_224,"Guntur, India","life sciences graduate, working in Bank",53,401,1980,False,"If I dint know this is the coronavirus , I would have put this as a decoratory piece in my room😳😳😳..Considering how cute it looks, I guess God has a very sadistic and cruel sense of humour🙏 https://t.co/UPmlb8kPyl"
2020-02-10 06:51:52+00:00,Chen Qiushi spoke out about the Wuhan virus. Now people fear he's been silenced - CNN https://t.co/h0nUi6gEQZ,Sandeep71121431,"Kolkata, India","justice,humanity, democracy. Retired.",320,178,48810,False,No Value Mentioned
2020-02-10 06:51:54+00:00,"RT @niubi: ""What is more worrisome is the virus’s damage to people’s lower respiratory systems, causing serious consequences even after a p…",GaalliDabba,India,No Value Mentioned,208,701,14826,False,"""What is more worrisome is the virus’s damage to people’s lower respiratory systems, causing serious consequences even after a patient recovers. Peking Union’s Du said it could take at least six months for patients to recover heart and lung function."" https://t.co/d2pyyuflhp"
2020-02-10 06:51:55+00:00,"RT @ETMarkets: Edible oil cools due to Coronavirus, restrictions on refined palm #CommodityNews #Outlook https://t.co/spixKbhG92",viralvm69,"Mumbai, India","Mumbai Meri Jaan...once you have lived in Maximum City ,no other place, is good enough",882,445,396580,False,"Edible oil cools due to Coronavirus, restrictions on refined palm #CommodityNews #Outlook https://t.co/spixKbhG92"
2020-02-10 06:51:57+00:00,Drones come handy in fight against #cronavirus https://t.co/EBF1It1Zrn,sandeepbudki,"New Delhi, India","Founder & Editor, The Mobile Indian, Guest technology Speaker @cnbcawaaz, @zeebusiness @news18",1009,47,3566,False,No Value Mentioned
2020-02-10 06:52:01+00:00,RT @THMumbai: Ophthalmologists warn about the possibility of novel #coronavirus (nCoV) being transmitted through the eyes | reports @jyotis…,jyotishelar,"Mumbai, India","Journalist @the_hindu | Author | Write on health and communities| Former: Mumbai Mirror, DNA, Hindustan Times",4614,593,6021,True,Ophthalmologists warn about the possibility of novel #coronavirus (nCoV) being transmitted through the eyes | reports @jyotishelar https://t.co/EawGjPKXQe
2020-02-10 06:52:01+00:00,"RT @TrakinTech: The #RedmiK20Pro to be discontinued in February as per Xiaomi's General Manager Lu Weibing

The discontinuation is a sign t…",ImAbhirajk,India,Stay Positive,828,79,76114,False,"The #RedmiK20Pro to be discontinued in February as per Xiaomi's General Manager Lu Weibing

The discontinuation is a sign that Xiaomi is making way for the successor #RedmiK30Pro⚡️

However, there is no clarification if it will be discontinued in China or India🤔 https://t.co/RDm9UjTrX0"
2020-02-10 06:52:07+00:00,#Coronavirus : 145 suspected cases reported in #Hyderabad https://t.co/wJDVjwdwxV,TV9Telugu,"Hyderabad, Telangana, India",TV9 is a Telugu news channel started in January 2004 by a team of journalists.,306220,60,160897,True,No Value Mentioned
2020-02-10 06:52:07+00:00,"RT @thattai: Last week's misreporting in @the_hindu was a breach of trust - not between journalists and scientists, but between the paper a…",unmixablemix,"IISER Pune, India",Field Ecologist hopelessly in love with programming. Also has an artistic streak that manifests in different forms every once in a while.,55,193,41,False,"Last week's misreporting in @the_hindu was a breach of trust - not between journalists and scientists, but between the paper and its readers.

The Reader's Editor has now published a clear apology: https://t.co/jD2ukiy5iR"
2020-02-10 06:52:08+00:00,RT @htTweets: Sunday recorded the highest number of new deaths from the novel #coronavirus pneumonia outbreak for a single day in China wit…,PandeySatyadev,India,"Practicing lawyer at High Court. nationalist, secular. liberal, humane and compassionate. Retweet is not an endorsement. I simply block abusers & fanatics.",555,438,15742,False,"Sunday recorded the highest number of new deaths from the novel #coronavirus pneumonia outbreak for a single day in China with 97 people dying until midnight

(reports @spatranobis)

https://t.co/5tNdLsWsGq"
2020-02-10 06:52:09+00:00,"RT @amitbhawani: #MWC2020 @GSMA Update on Coronavirus

Approx. 5-6000 exhibitors/attendees from China won't be joining 
Some large exhibito…",ImAbhirajk,India,Stay Positive,828,79,76114,False,"#MWC2020 @GSMA Update on Coronavirus

Approx. 5-6000 exhibitors/attendees from China won't be joining 
Some large exhibitors have decided not to come to the show this year
Catalonia is continually welcoming thousands of visitors to the region

As suggested earlier, Stay Safe. ✌️ https://t.co/9kBMwFDGY9 https://t.co/N8KVrypJbR"
2020-02-10 06:52:11+00:00,Coronavirus outbreak: The latest from around the world https://t.co/yMKLbsDNgs,kishorenair1,"Kerala, India",A lazy Sagittarian. Tweets are personal.,177,432,14862,False,No Value Mentioned
2020-02-10 06:52:18+00:00,"Union Health Minister Dr. Harsh Vardhan in Lok Sabha on Novel Coronavirus: So far 811 deaths have been reported in China. India is taking all preventive measures. We are monitoring and reviewing the situation daily. Till now 1,118 flights have been screened. @drharshvardhan https://t.co/ORHccgN0ZN",DynamiteNews_,"New Delhi, India",Leading National News Portal of India | Politics | Bureaucracy | Uttar Pradesh and many more | Founder & Editor-in-Chief @Manoj_Tibrewal,16434,64,112752,False,No Value Mentioned
2020-02-10 06:52:19+00:00,RT @EconomicTimes: #LeadStoryOnET | Panic spreads as China shutdown shadow lengthens  https://t.co/8f18sANMvg,Bindas_Bol_,India,"जो बोलना हे बिंदास बोल,ताकि दुनिया को सच पता चले # में नहीं कर सकता,पर हम जरुर कर सकते हे #
गलत की निंदा और सही की प्रशंसा करने का जिगर रखता हूँ !",1252,4997,173223,False,#LeadStoryOnET | Panic spreads as China shutdown shadow lengthens  https://t.co/8f18sANMvg
2020-02-10 06:52:21+00:00,RT @shreikanth: Please Share and Retweet Max. It is all about how can we stop outbreak #coronavirusindia https://t.co/IzOPaIpaFX,principalraam1,"Tamil Nadu, India",Sr.Principal-Bharani Park. President-Kongu Sahodaya. National Convenor-Students&Youth For Thiruvalluvar. Commissioner-Bharani Scouts Dist. BCSA.,657,1917,5368,False,Please Share and Retweet Max. It is all about how can we stop outbreak #coronavirusindia https://t.co/IzOPaIpaFX
2020-02-10 06:52:21+00:00,"RT @yessirtns: While GREETING your FRIENDS, try
NAMASTE 🙏
over 
HANDSHAKE 🤝
it ensures ZERO BACTERIAL TRANSFER
practice INDIAN 🙏

Do U know…",nylalsingh,"Gurgaon, India",Ex INDIAN NAVY. RSS. Travelling most of life. Let’s out caste the caste. No DM please. I also had unfollow option.,1651,1388,154531,False,"While GREETING your FRIENDS, try
NAMASTE 🙏
over 
HANDSHAKE 🤝
it ensures ZERO BACTERIAL TRANSFER
practice INDIAN 🙏

Do U know : 

HANDSHAKE causes :124 million bacterial colony ( CFU )
HIGH 5 : 55 million bacterial colony CFU
FIST BUMP :7 million bacterial colony CFU

#Corona"
2020-02-10 06:52:22+00:00,"RT @cnni: Chen Qiushi, a citizen journalist who had been reporting on the coronavirus outbreak in Wuhan, went missing on Thursday evening -…",Sandeep71121431,"Kolkata, India","justice,humanity, democracy. Retired.",320,178,48810,False,"Chen Qiushi, a citizen journalist who had been reporting on the coronavirus outbreak in Wuhan, went missing on Thursday evening -- his family says police have told them he has been forcibly quarantined https://t.co/ViAS7GRTkK"
2020-02-10 06:52:30+00:00,"In India, so one responds to emails or business phone calls in any case. imagine something like China here.. sorry, okay thanks. #JustSaying :-)",muralwrites,"Chennai, India","Public Relations practitioner - Mazeltov Consulting Inc, Executive Search pro, Cyclist 🚵🚵🚵",3779,2879,81665,False,No Value Mentioned
2020-02-10 06:52:31+00:00,"RT @Kirk_925: Trying to decide which is scarier: Corona virus or TDS!
62% of the lunatics left (Dems) in NH choose dying over a second @rea…",stevemurray317,"Indiana, USA","Indianapolis native. Christian. MBA. Lover of well brewed beer or java. Right of center. Colts, Pacers, StL Cards 🚫racists 🚫Hillary #KAG #2A #SocialismKills",3539,3618,14091,False,"Trying to decide which is scarier: Corona virus or TDS!
62% of the lunatics left (Dems) in NH choose dying over a second @realDonaldTrump term😱
Let that sink in!
As their desperation mounts, I pray for the safety of DJT!
RT if u r doing the same
IFB
https://t.co/KoUJToZ4eY"
2020-02-10 06:52:32+00:00,"@ShehzadAshrafCh @imranigra @mophrd @sayedzbukhari @ImranKhanPTI Internet has been blocked in wuhan n other provinces. China is beating up its own ppl, pakistaniyo ka khyaal kar rahe hoge",1Amitz,"Pune,India",Kashmiri Indian wannabe writer🍁⛄ ❄️ Follow me to know my Summers Autumns Winters Walks Rains Drinks. Sun sign- Aquarius 🕺🎨,267,267,9115,False,No Value Mentioned
2020-02-10 06:52:33+00:00,RT @ANI: Union Health Minister Dr. Harsh Vardhan in Lok Sabha on Novel Coronavirus: So far 811 deaths have been reported in China. India is…,PandeySatyadev,India,"Practicing lawyer at High Court. nationalist, secular. liberal, humane and compassionate. Retweet is not an endorsement. I simply block abusers & fanatics.",555,438,15742,False,"Union Health Minister Dr. Harsh Vardhan in Lok Sabha on Novel Coronavirus: So far 811 deaths have been reported in China. India is taking all preventive measures. We are monitoring and reviewing the situation daily. Till now 1,118 flights have been screened. https://t.co/aIiseda9tx"
2020-02-10 06:52:34+00:00,"now #china begun to convert the stadium to hospital.
from this you can imagine the intensity of #cronovirus.
so i aurge all people to take precaution and stay safe #cronavirus_Safety 
current situation by an UK citizen. #Joker #mondaythoughts https://t.co/xpPc9VLU0I",mohhamed_shafi,"Pir Panjal, J&K, India ",Man from Mountains. Grown-up in the laps of Nature. Hates crime against humanity. Believes in just one religion. RELIGION OF HUMANITY. Indian from heart.,91,131,1559,False,No Value Mentioned
2020-02-10 06:52:37+00:00,"Citizen journalist covering coronavirus outbreak from Wuhan goes missing
#Law #Latest #LatestLaws #LegalNews #News #Legal #citizenjournalist #China #ChinaCoronaVirus #ChinaWuHan #ChinaVirusHide #coronaviruschina #coronavirus #CoronavirusOutbreak
https://t.co/fin7QvXmMY",latestlaws,India,"India's Favourite Legal e-Magazine for Latest Legal News, Articles, Blogs, Case Analysis, Largest free Database of Bare Acts, Rules, Regulations & much more",11122,212,18285,False,No Value Mentioned
2020-02-10 06:52:51+00:00,"RT @thattai: Last week's misreporting in @the_hindu was a breach of trust - not between journalists and scientists, but between the paper a…",karthickbala,"Pune, India","Scientist @ari_pune, study #diatoms diversity and distribution from #biodiversity hotspots, #scicomm in #Tamil, அறிவியல், dad of 2 girls, my views are personal!",465,609,1624,False,"Last week's misreporting in @the_hindu was a breach of trust - not between journalists and scientists, but between the paper and its readers.

The Reader's Editor has now published a clear apology: https://t.co/jD2ukiy5iR"
2020-02-10 06:52:57+00:00,Coronavirus toll on quarantined 'Diamond Princess' now at 70; 3700 onboard off Japan coast https://t.co/hJcE9emm3X,republic,"Mumbai, India",Official handle Republic Media Network  DIGITAL. TV. MEDIA,919670,3,280887,True,No Value Mentioned
2020-02-10 06:53:03+00:00,RT @ANI: Union Health Minister Dr. Harsh Vardhan in Lok Sabha on Novel Coronavirus: So far 811 deaths have been reported in China. India is…,Guruskbd,"Bengaluru, India","Something big is coming|
Proud Son of a Proud Father|
हिंदू तन मन हिन्दू जीवन
हिन्दू रग रग मेरा परिचय।
#स्वयंसेवक| 
#Proud_taxpayer 🙏 | 
#Modibhakt🙏",307,157,18933,False,"Union Health Minister Dr. Harsh Vardhan in Lok Sabha on Novel Coronavirus: So far 811 deaths have been reported in China. India is taking all preventive measures. We are monitoring and reviewing the situation daily. Till now 1,118 flights have been screened. https://t.co/aIiseda9tx"
2020-02-10 06:53:04+00:00,@safiranand @rdkriplani A day which is 30% of mills production. Most counties have quarantined goods coming in from China so the earliest that goods booked with China can enter India would be end March beginning April. If domestic steel demand in India remains steady then steel consumers have no option,salil_chadha,"New Delhi, India",Passionate about stocks & investing. Man City Fan. MODI-fied,52,131,924,False,No Value Mentioned
2020-02-10 06:53:06+00:00,RT @drkafeelkhan: This is Dr Sabista khan .I request all the Indians to come with me and speak up and take part in the protest today at 11…,mdajaz777,India,Student,162,252,3576,False,"This is Dr Sabista khan .I request all the Indians to come with me and speak up and take part in the protest today at 11 AM Mandi House, Delhi #FreeDrKafeel #LiWenliang #coronavirus https://t.co/GOQ26p076T"
2020-02-10 06:53:12+00:00,"RT @dravirmani: #GLIMP, #GLIE do you understand why #CCPchina is literally wiping out every trace of #ISLAM from #China; because they view…",NeerajK_,"Mumbai, India",Views are strictly personal. RTs not to be treated as endorsments,851,425,57603,False,"#GLIMP, #GLIE do you understand why #CCPchina is literally wiping out every trace of #ISLAM from #China; because they view it as a #VIRUS as #Deadly as, or more deadly than, the #coronavirus! #CCPGulag https://t.co/hf9iS4l7HV"
2020-02-10 06:53:12+00:00,RT @HawleyMO: #china communist party tries distancing itself from #coronavirus. Won’t work. They own this - now a global health crisis. CCP…,techfunky,India,No Value Mentioned,98,526,2261,False,#china communist party tries distancing itself from #coronavirus. Won’t work. They own this - now a global health crisis. CCP fundamentally corrupt. Another reminder USA needs to decouple its key supply chains from China https://t.co/GPZyqcOjSv
2020-02-10 06:53:12+00:00,"BBC News - Coronavirus claims 97 lives in one single day on Sunday 9-Feb, 2020

but number of infections stabilises https://t.co/JJvDtJTYhF",zhrashidi,India🇮🇳 بھارت,"आम नागरिक। Tax payer, Blogger, Critics,
सवालों की सिरीज़ सीधे देश भर में सत्ता में बैठे लोगों एवं पुलिस प्रशासन से। #सवाल_सत्ता_से 
#जनता_मांगे_जवाब",723,313,9001,False,No Value Mentioned
2020-02-10 06:53:15+00:00,RT @steve_hanke: #Chinese police forcefully detain a woman because she might have the #Coronavirus. China's #Censorship &amp; lies continue to…,Feku_Fakeer,India,"फेंकू फ़कीर | अम्बानी अडानी का चौकीदार |  एंटी रोमियो दल का स्वयम्भू अध्यक्ष तथा गौ रक्षक गैंग का लठैत | प्रचार मंत्री | चोर + चौकीदार दोनों |
No NRC - CAA - NPR",234,193,46612,False,"#Chinese police forcefully detain a woman because she might have the #Coronavirus. China's #Censorship &amp; lies continue to encourage the spread of the disease. Don't believe a word coming out of the #Communist megaphones in  #Beijing.
https://t.co/Jd9oMeA015"
2020-02-10 06:53:25+00:00,60 more people aboard cruise test positive for coronavirus via FOX NEWS,beeplusmind,"Tamil Nadu, India","Hi nice to meet you,  I'm finished PG course , now I'm doing tax consultant course and I'm doing market analyzing and trend productions work. I'm 32+ thank you",4,1,2156,False,No Value Mentioned
2020-02-10 06:53:33+00:00,#Parliament live | Union Health Minister Harsh Vardhan delivers a statement on the steps taken by the government to prevent spread of the #coronavirus https://t.co/mQIkUaoqEC,the_hindu,"Chennai, India",News feeds from India's National Newspaper,5946169,202,306548,True,No Value Mentioned
2020-02-10 06:53:39+00:00,The latest The Blueshark Labs Daily! https://t.co/S7cZFVmRKI Thanks to @makerdemy @A_P_Mulligan @CMJNathan #coronavirus #business,bluesharklabs,USA | AUSTRALIA | UK | INDIA,"@bluesharklabs is the best #MobileAppDevelopment company with 200+ clients, over 250+ apps delivered worldwide. Get the latest trends of #MobileApp #VRapp #AR",549,2713,1045,False,No Value Mentioned
2020-02-10 06:53:39+00:00,"#MeaIndia Hello all, I planned to travel Combodia and Bangkok/Thailand from tomorrow. But I am concerned about corona virus as it is affected in Thailand also. Is it safe to travel? Do you help to get flight tickets refund if they deny?",praveenkn1986,"Bengaluru, India",No Value Mentioned,64,47,38,False,No Value Mentioned
2020-02-10 06:53:48+00:00,"RT @XHNews: A Chinese nurse in a coronavirus-hit hospital in Henan Province gives her sobbing daughter an ""air hug."" #coronavirus https://t…",kkrai75,"New Delhi, India",k,5,96,18,False,"A Chinese nurse in a coronavirus-hit hospital in Henan Province gives her sobbing daughter an ""air hug."" #coronavirus https://t.co/mNZ5SFcPYk"
2020-02-10 06:53:52+00:00,"Corona virus: The Way Forward from a Global Perspective

#CoronaVirus #China #WHO
https://t.co/G4JDIkVFPx",EasternHerald,India,"An international news herald promoting free speech, and protecting democracy.
Editor @MANooriBajwa.
Also on https://t.co/0tZj2H7gBI",145,8,5701,False,No Value Mentioned
2020-02-10 06:54:01+00:00,"RT @DanielleFong: It’s not like a flu; it’s more contagious and more deadly.
It can’t be contained like SARS; it evades screening and tests…",tejasdshah,"Hyderābād, India","UX lead, Product Designer, Agile coach, UX designer; Helping Enterprises & Startups build the best Products, Chief Design Officer @enterpi",347,795,2316,False,"It’s not like a flu; it’s more contagious and more deadly.
It can’t be contained like SARS; it evades screening and tests.

It’s not like 1918; we fly everywhere 🛫🌎
It’s not “safe outside 🇨🇳”
27 days to kill Li Wenliang; it’s a timebomb  💣

It’s #2019-nCoV &amp; it’s wrecking 2020"
2020-02-10 06:54:04+00:00,RT @PBNS_India: Union Health Minister @drharshvardhan in Lok Sabha on Novel Coronavirus: So far 811 deaths have been reported in China. Ind…,basantbhardwaj1,"New Delhi, India",Consultant at Prasar Bharti,14,352,318,False,"Union Health Minister @drharshvardhan in Lok Sabha on Novel Coronavirus: So far 811 deaths have been reported in China. India is taking all preventive measures. We are monitoring and reviewing the situation daily. Till now 1,118 flights have been screened. https://t.co/3TBp6qPBne"
