created_at,full_text,screen_name,location,description,followers_count,friends_count,statuses_count,verified,full_retweet_text
2020-02-14 23:45:02+00:00,RT @BHARAT79611311: What about antibiotic misuse—- plz take care —- Indian  law promoting quack and antibiotics misuse. India NEED TO CONTR…,Kamal38692938,India,No Value Mentioned,130,215,25810,False,What about antibiotic misuse—- plz take care —- Indian  law promoting quack and antibiotics misuse. India NEED TO CONTROL IT.there will be worst consequences. U can’t https://t.co/EAkbdMdhCK will be worst than aids— corona—-result
2020-02-14 23:45:37+00:00,@sillyolyou @risguey @QueerIiberation @SpicyAnarchist @4kshatra @bratyoulater The one that’s funded by China? Sure fam.,IntifadaEve,Indiana,GenSec of Indiana Chapter @NCAcoalition. Director of @GlTprop. She/her. Trans. Intercommunalist. Mixed-race. Brutalism is daddy. #actuallyautistic #BDS 🇵🇸✊🏼,609,1794,10726,False,No Value Mentioned
2020-02-14 23:46:17+00:00,RT @Quresh_Moin: CORONAVIRUS: Another video of a person suspected of suddenly collapsing due coronavirus. New symptoms of COVID-19 in older…,RakeshV24566992,"Gonda, India",Automation Engineer 🌎,527,965,32254,False,"CORONAVIRUS: Another video of a person suspected of suddenly collapsing due coronavirus. New symptoms of COVID-19 in older people may be the reasoning behind these collapses. 

#COVID2019 #coronavirus #CoronaVirus #Coronavirus 
(source: @jenniferatntd) https://t.co/MCTxVN9UJL"
2020-02-14 23:46:53+00:00,"China gets little sympathy in Munich as US, Europe agree on need to confront rising influence. US and Europe at Munich Security Conference on confronting China in contrast to rising transatlantic disagreements. US Europe disagree on approach, US favouring confrontation. #Wuhan https://t.co/zErptngbot",kamireddynrao,"Hyderabad, India",Botanist and Nature loving. Avid reader and traveler.,195,45,5998,False,No Value Mentioned
2020-02-14 23:47:15+00:00,An absolute departure from past by #China to neutralise ill effects of world wide critical views of #coronavirus emanating from #Wuhan. Impeccable language proficiency of the #Chinese speaker to counter any other critical views expressed against China from any source https://t.co/erHJo0dRSS,anshu217,India,"Authored two books on China; Interests- China, West Asia, Pakistan; National security, Space, Deterrence, Military Strategy, Technology- Quantum, AI, Drone, ISR",207,111,2344,False,No Value Mentioned
2020-02-14 23:47:17+00:00,"RT @BjpBiplab: Mr. Yechury, you belong to the party that was against donating blood to the Indian soldiers during 1962 war with China. We a…",chin2incal,"Pune, India",just another tax paying indian,22,65,4743,False,"Mr. Yechury, you belong to the party that was against donating blood to the Indian soldiers during 1962 war with China. We are a party whose top priority is national security and the soldiers who are ensuring it. https://t.co/UQtO7lQwIh https://t.co/TsLhEBnw1X"
2020-02-14 23:47:32+00:00,@TheFlatEartherr Yeah because China has a long history of  giving information to the general public,jusme1233,"Indiana, USA","Take no part in the worthless deeds of evil and darkness; instead, expose them.
Ephesians 5:11 NLT",86,48,6751,False,No Value Mentioned
2020-02-14 23:47:38+00:00,"Take a look. 

This is what the new coronavirus looks like under a microscope. https://t.co/irD0kXKc9T via @business",Studiopjj,India,"I am a gemstone analyst, trainer, writer, self-experimenter, and collector. I am passionately curious about everything in the world. Here's my two cents.",1036,1740,16740,False,No Value Mentioned
2020-02-14 23:48:10+00:00,RT @Jagadishbliss: Thank you @filmmaker_logi and @TeamRealworks for the lovely lyric video 🤗 Full credits to you guys,Prasannakrish5,"Kumbakonam, India","Intuition is the GPS of the Soul 💕Explore your self to find the best path . Don't quite the race till your End🏁🏁 
Vijay || Sachin || kohli || Rohit || ARR",1010,547,28154,False,Thank you @filmmaker_logi and @TeamRealworks for the lovely lyric video 🤗 Full credits to you guys https://t.co/hzST3qYuUt
2020-02-14 23:48:16+00:00,@alaskawater @DevonHill95 Jim Baker has a cure for that and coronavirus too.$300. Such a deal.,careaware,Northcentral Indiana RED ZONE,#savetheplanet #resist 🌊🌊🌊  ✡ 🙊Masks. Spread no virus. Make our own masks America. 🤧   G'ma  Bookworm. Elderly nerd.Sick of GOP. no DMs! VOTE BLUE.,6532,6709,144072,False,No Value Mentioned
2020-02-14 23:48:29+00:00,"RT @iowahawkblog: email from a friend: ""before you pop that bubble wrap, remember the air is from China.""",pizzapimp812,Indiana,"Self employed, small business owner, already paying my fair share in taxes. Hard work is the yeast that makes the dough rise...",474,1067,13213,False,"email from a friend: ""before you pop that bubble wrap, remember the air is from China."""
2020-02-14 23:50:23+00:00,RT @centsible: Health experts warn Congress coronavirus may hit US hard in next two to four weeks https://t.co/vmL7DkIkkV,suzolv,"Indiana, USA",Just trying to figure it all out! #resistance;  Never Trump; #impeachTrump,2668,3319,47645,False,Health experts warn Congress coronavirus may hit US hard in next two to four weeks https://t.co/vmL7DkIkkV
2020-02-14 23:51:00+00:00,"@Drive_pedia No info that comes out of China is reality. Get real. China is a de facto police state that keeps tight reign on information. If it sounds bad, it's usually far worse. If it sounds good, it's almost certainly not nearly as good.",WhatsItMatter8,Indiana,Parler @GershwinsRhapsody,829,1948,26990,False,No Value Mentioned
2020-02-14 23:51:39+00:00,RT @RedbridgeCapitL: #financial stocks relative to #technology since the #coronavirus outbreak.  The largest sector that controls the price…,sectest9,"Hyderabad, India",News Hub! Get the latest Security News & Updates!,30324,1,1757353,False,"#financial stocks relative to #technology since the #coronavirus outbreak.  The largest sector that controls the price movement of the $SPY is still being bought by Institutions (IMF).  The game plan is to $BTFD on  Technology Stocks $AAPL $MSFT
https://t.co/v13nqKuRFi https://t.co/Nu60Qi8wDK"
2020-02-14 23:51:48+00:00,"RT @RealJamesWoods: Has anyone either verified, or conversely, debunked this video from China? What actually is happening here? Does anyone…",isunil_reddy,"Bengaluru, India",All views are Personal....,31,893,535,False,"Has anyone either verified, or conversely, debunked this video from China? What actually is happening here? Does anyone actually know? https://t.co/WSeHtoYy34"
2020-02-14 23:52:15+00:00,Blizzard moves previously canceled Overwatch League games from China to Korea https://t.co/kzT2wtYTeg,TheTeCake,"New Delhi, India","The TeCake, a news website in India, is dedicated to deliver latest and unbiased information to everyone. https://t.co/uUURH7S6OI
https://t.co/InA4smUYdb",554,187,12119,False,No Value Mentioned
2020-02-14 23:52:36+00:00,"RT @balajis: Incredible.

Last week I called out a journalist who I thought was writing a piece that would be a disservice to public health…",zereraz,India,"Seeker of Truth 🧐🐶🤠
Entrepreneur, Software engineer.dum spiro spero.
Bootstrapping startup so Quarantine expert 😉
DMs open, very happy & fulfilled, can help",273,3129,10447,False,"Incredible.

Last week I called out a journalist who I thought was writing a piece that would be a disservice to public health.

Unfortunately, my concerns proved well-founded. Recode’s virus piece ignores WHO &amp; CDC, gets the science wrong…and focuses on handshakes!

Thread: 🧵 https://t.co/fnxOmRL7j5"
2020-02-14 23:53:39+00:00,"@mahmud2008 @xosquare @AmDipty @schaheid @ThePrintIndia As long as the best part of Kashmir is with India ,all you can do is just grimace and provoke for no joy . 
You guys sold Aksai chin to China . Now you are into selling brides . What more where 72 is the ultimate goal in your life .",ivarck,"Chennai, India",No Value Mentioned,21,70,7417,False,No Value Mentioned
2020-02-14 23:54:03+00:00,"1716 medics infected, 6 dead, China finally reveal weeks into coronavirus outbreak - Hindustan Times https://t.co/xV686gBpw7 https://t.co/YrdYibZN5e",india7network,India,India7 Network,131,63,8541,False,No Value Mentioned
2020-02-14 23:54:21+00:00,"RT @Ailsahk: @WHO @WHOSEARO @WHOWPRO @WHO_Europe @pahowho @WHOAFRO @WHOEMRO COVID19 = China Output Virus In December 2019
WHO = WuHan virus…",clearmithun,"Sangli, India",No Value Mentioned,103,198,1688,False,"@WHO @WHOSEARO @WHOWPRO @WHO_Europe @pahowho @WHOAFRO @WHOEMRO COVID19 = China Output Virus In December 2019
WHO = WuHan virus concealers’ Organization
#ChiNazi #WuhanSARS https://t.co/MyLmlprQJe"
2020-02-14 23:54:26+00:00,"“Around 15,991 people across the country have been kept on community surveillance, 497 have been identified as the symptomatic cases and being monitored while 41 are hospitalised.” #coronavirus #coronavirusIndia #COVID19 https://t.co/LHWkfu4UQJ",RitasArtCafe,India,"Hi, Welcome to my Art Cafe. Grab a cup of coffee (or tea, or whatever) and look at my artworks. If you want to buy any, please tweet to me.",7135,3619,98882,False,No Value Mentioned
2020-02-14 23:54:38+00:00,Coronavirus outbreak: Tibet’s Nyingchi discourages tourists from visiting the remote region https://t.co/KhyiJtffX8,brhmmlk93_malik,"PUNE, INDIA","BACHELOR OF ENGINEERING ELECTRONICS AND TELECOMMUNICATION.
ADVANCED MATH EXPERT AT CHEGG INDIA PVT LTD.",556,4977,1676,False,No Value Mentioned
2020-02-14 23:55:29+00:00,"RT @neerangautam: Was in Max Smart MSH, Saket.
Went to Max Pharmacy to buy Mask for myself, as a precaution, since recently I had Renal Tra…",AkhandAryabrat,"Baghpat, India","।। सर्वदा।।
।। सर्वत्र ।।

A bit confused...
A bit disappointed...
But stronger than ever before",1003,167,74679,False,"Was in Max Smart MSH, Saket.
Went to Max Pharmacy to buy Mask for myself, as a precaution, since recently I had Renal Transplant. The Pharmacy Guy replies; Don't talk about masks, You won't find one! Gone Underground!
Because of Corona Virus
😟🙄😳🤯! Hoarding Started, to cash! https://t.co/F4xVYehflg"
2020-02-14 23:55:53+00:00,RT @free_thinker: I have consistently observed that this guy lacks in comprehension skills. The video clip has been shared by literally tho…,tjweet,"Mumbai, India","If I am prejudiced and I look at you, I am not looking at you, I am looking at my prejudice.",232,583,5588,False,I have consistently observed that this guy lacks in comprehension skills. The video clip has been shared by literally thousands and which is why first sentence of the article states that it is 'massively viral' (hyperlinked) with Rangoli as one of the examples. 1/3 https://t.co/wbsgWndPfr
2020-02-14 23:56:28+00:00,"RT @PriyankaJShukla: Quite uncanny!
#Coronavirus was a character in a 2017 Asterix comic series (37th edition).
The Roman villain named Cor…",AjayJangra173,"Gurgaon, India","Don't judge me before u know me, but just to inform u, you won't like me.",1,198,143,False,"Quite uncanny!
#Coronavirus was a character in a 2017 Asterix comic series (37th edition).
The Roman villain named Coronavirus in the issue “Asterix &amp; the Chariot Race” wore a mask &amp; had a reputation of stopping at nothing to win!
However, in the end it fails to win the race. https://t.co/GeGwxSUQIO"
2020-02-14 23:56:38+00:00,"RT @satyug20201: #WorldSavior_SaintRampalJi
The real reformer will not be muslim or Jews 

He will be Hindu
America china all men , women m…",AmitMittal70606,"Sonipat, India",Amit mittal,1257,3293,17111,False,"#WorldSavior_SaintRampalJi
The real reformer will not be muslim or Jews 

He will be Hindu
America china all men , women must see this video human life is too short.
#COVID19
God save aal types of virus but how?? 
 https://t.co/s2S6t4ybu1"
2020-02-14 23:56:44+00:00,RT @PDChina: What a spectacular wonder! Five suns are seen shining in the sky in N China's Inner Mongolia https://t.co/uvYydtCtYJ,raghbir18432168,India,india,550,3103,3501,False,What a spectacular wonder! Five suns are seen shining in the sky in N China's Inner Mongolia https://t.co/uvYydtCtYJ
2020-02-14 23:56:58+00:00,"RT @WayneDupreeShow: The violence against Trump supporters is reaching ""epidemic levels"" and the media is all: 🙈🙉🙊

https://t.co/B62iTU6Ldr",bepearson11,"Indiana, USA",Go Colts 🏈 Patriot 🇺🇸 Love hunting and fishing and the great outdoors💕,185,353,3534,False,"The violence against Trump supporters is reaching ""epidemic levels"" and the media is all: 🙈🙉🙊

https://t.co/B62iTU6Ldr"
2020-02-14 23:58:21+00:00,"Yeah I was almost there on the verge of being fooled @Flipkart . Fortunately for all of us, you're not the only e-commerce website trying to take advantage of #coronavirus outbreak. Just know, that your consumers are aware of your cheap markup tactics. https://t.co/piKHnLRcEJ",purneshtripathi,India,"A Data Scientist, programmer and an amateur photographer. I work for @AWSCloud & my opinions are my own.",145,76,2222,False,No Value Mentioned
2020-02-14 23:58:46+00:00,"RT @thehill: Dr. Robert Redfield, Director of the CDC: ""Right now there is no evidence to me that this [Coronovirus] outbreak is at all und…",RTB2019,Indiana,No Value Mentioned,107,98,64742,False,"Dr. Robert Redfield, Director of the CDC: ""Right now there is no evidence to me that this [Coronovirus] outbreak is at all under control. It is definitely not controlled. And the sooner we can help them get it under control, the better for the whole world."" https://t.co/1ZHd0gigQc"
2020-02-14 23:59:39+00:00,RT @jsblokland: #China #debt-to-@GDP has topped 300%! ht @SoberLook https://t.co/nVFZ6Vn16g,coolrahulmittal,"NCR, Gurgaon, india","Chartered Accountant working in utilities sector, movie buff, views n laughter are personal",175,397,2909,False,#China #debt-to-@GDP has topped 300%! ht @SoberLook https://t.co/nVFZ6Vn16g
