created_at,full_text,screen_name,location,description,followers_count,friends_count,statuses_count,verified,full_retweet_text
2020-01-30 21:28:50+00:00,"RT @K_Kiumbe: When nurses fighting in the frontline of #coronavirus outbreak in #Wuhan take off their masks... #EverydayHero
@PDChina https…",NewUgadi,India,Truth Wins & Balance in Thinking goes a long way,102,535,6484,False,"When nurses fighting in the frontline of #coronavirus outbreak in #Wuhan take off their masks... #EverydayHero
@PDChina https://t.co/Y11vDzfP5X"
2020-01-30 21:28:53+00:00,Chris Kirchenbauer grew up in Madison county. He works in China. His wife and children are in the sealed off city of Wuhan ... the center of the coronavirus outbreak @WTHRcom https://t.co/Oxx4nPxYmr,VanwykWTHR,"Indianapolis, IN","I've been a reporter @wthrcom for 40+ years covering the day's news, events, people and issues that shape the lives, communities and culture of central Indiana.",4833,365,7656,True,No Value Mentioned
2020-01-30 21:29:13+00:00,RT @doctorsoumya: Preparedness is a more important but often neglected aspect of #outbreak response. This includes strengthening research c…,IManokarthi,"Tamil Nadu, India",Because of Sadhguru....,253,1815,22339,False,"Preparedness is a more important but often neglected aspect of #outbreak response. This includes strengthening research capacity, including ethics, especially in countries with less developed health systems. @WHO @JeremyFarrar @ICMRDELHI @MoHFW_INDIA @CEPIvaccines @NIHDirector https://t.co/fEDsJ8DjYw"
2020-01-30 21:29:14+00:00,WHO declares coronavirus an international emergency https://t.co/i2n6eg49E0,Vsplusonline,INDIA,Web Hosting India | Web Hosting Space Unlimited | Free Domain Registration | Top Hosting India | Unlimited Domains | Reseller | VPS | Dedicated Server,148,32,37711,False,No Value Mentioned
2020-01-30 21:29:21+00:00,RT @WHOGOARN: The @WHO convenes the #IHR Emergency Committee today to assess the ongoing #coronavirus (2019-nCov) to advise if it constitut…,IManokarthi,"Tamil Nadu, India",Because of Sadhguru....,253,1815,22339,False,The @WHO convenes the #IHR Emergency Committee today to assess the ongoing #coronavirus (2019-nCov) to advise if it constitutes a public health emergency of international concern. https://t.co/cledoK663n
2020-01-30 21:29:22+00:00,"RT @amritabhinder: If this too has a Made in China type of quality, we all should not be that panicky?",SitanshuDesai,India ,"This Bird Tweets Less But , Likes Other Tweeting . #NaModified",460,1287,172654,False,"If this too has a Made in China type of quality, we all should not be that panicky?"
2020-01-30 21:29:33+00:00,"RT @HarshaliAkiyama: I think my padosan is suffering from Coronavirus. Yesterday night I heard her screaming
Corona
Corona
aur corona.....…",TheKunalManiar,India,Reiki Sadhak!! Healing | Believe in free energy| Things that interest me most Cosmics|Cricket|Food|Movies|Music|Quotes|Nature|You|,1117,725,11916,False,"I think my padosan is suffering from Coronavirus. Yesterday night I heard her screaming
Corona
Corona
aur corona.....
She is Bengali, btw."
2020-01-30 21:29:33+00:00,RT @madhukishwar: Why is no TV channel discussing historic #BodoAccord &amp;letting the nation get to know two young heroes who made it possibl…,Pobbathi_Venku,"Hyderabad, India","Pls donate to #BharatKeVeer
https://t.co/WhEMe2bnaW",574,3449,314314,False,"Why is no TV channel discussing historic #BodoAccord &amp;letting the nation get to know two young heroes who made it possible.
We're sick of needless attention to #ShaheenBaghJamiaJehadis day after day.
Please Ignore the demonic forces &amp;focus on good people https://t.co/H5cbsIcGK9"
2020-01-30 21:29:33+00:00,"@sachin_hello_ @ANI We are trying to bring back our 500 students from Wuhan. Just like we bought our 2500 Indian NRIs during Yemen situation. You can doubt this Indian govt on everything but when it matters the most, they're first. Earlier it was Sushma Swaraj ji, now Modi is personally taking care!",saibharadwaj,"Hyderabad, INDIA",Entrepreneur. Amazonian. Web Developer & Digital Marketer. AR/VR/MR Enthusiast. Covering Bitcoins & Cryptocurrencies for fun.,1233,2831,24352,False,No Value Mentioned
2020-01-30 21:29:43+00:00,RT @vijayanpinarayi: Update on #Coronavirus incident: A patient has been tested positive for Novel #Coronavirus infection and is kept in is…,roam_india,India,"Self-published author
||
Trying to start my own ventures.
||
Burn out like a phoenix, not Icarus.
||
हम देखेंगे
||
He/Him",222,356,23828,False,Update on #Coronavirus incident: A patient has been tested positive for Novel #Coronavirus infection and is kept in isolation.The infected patient is a student of Wuhan University. We are closely monitoring the situation.
2020-01-30 21:29:45+00:00,"@jenvitali @WIRED @WIREDScience @realDonaldTrump @GOP True. My point was that the need of the hour is to act together with other nations (including China) 2 stop this pandemic.

Today this virus was tested +ve in one student in India. I'm scared as people here are poor to afford Medicare, and given overpopulation it will spread alot",Gladi911,India,Analyst | Navjagran Times (Bihar). Follow me for updates on political scenario here.. #BiharElections2020,44,104,3240,False,No Value Mentioned
2020-01-30 21:29:48+00:00,RT @TOIWorld: Vietnam to stop issuing visas for Chinese tourists over coronavirus concerns https://t.co/xMz6VaannP,MuraleeSure,"Hyderabad, India","Humanity is above All, live young, live life help the deserving needy",196,343,44827,False,Vietnam to stop issuing visas for Chinese tourists over coronavirus concerns https://t.co/xMz6VaannP
2020-01-30 21:29:57+00:00,RT @ANI: World Health Organisation (WHO) declares international emergency over #coronavirus: AFP news agency,aatish_mohite,India,Account based Marketing - @netcoresmartech,733,514,59901,False,World Health Organisation (WHO) declares international emergency over #coronavirus: AFP news agency
2020-01-30 21:29:57+00:00,RT @InactionNever: This.,janetplanet2020,BlueCollegeTownIndianaUSA💙,Attn: Parts of #Earth🌎🌍🌏are now #resisting humans ! #AllInclusive #Science #Space #GHeffect🥵🌊#GreenTech #Voter🗳(profile  pic/ memories)😊(married),602,599,27459,False,This. https://t.co/eeSXsJnA4L
2020-01-30 21:29:57+00:00,@iAsura_ That's why corona ?,k_vibhas,teaching in India,"| MacroEconomics | Bonds | Account was hacked at least once on 20.12.19 
| We are watching",292,838,8792,False,No Value Mentioned
2020-01-30 21:30:00+00:00,"RT @RAZ0RFIST: Comically late.
Temporary travel ban now, please. If I'm to die shitting blood, I'd prefer it be from an all-night Chipotle…",pizzapimp812,Indiana,"Self employed, small business owner, already paying my fair share in taxes. Hard work is the yeast that makes the dough rise...",474,1068,13157,False,"Comically late.
Temporary travel ban now, please. If I'm to die shitting blood, I'd prefer it be from an all-night Chipotle blowout. As God intended. https://t.co/pNhzIGZIkI"
2020-01-30 21:30:00+00:00,RT @odedanilo: If South Africans had this we wouldn’t be allowed in other countries just saying,plaguehippie,"Indianapolis, IN",unknown man died eating library paste july 14 1908,211,492,48826,False,If South Africans had this we wouldn’t be allowed in other countries just saying https://t.co/Y5uwTuY81Z
2020-01-30 21:30:03+00:00,"RT @arifaajakia: American Movie Contagion was released in 2011 speaks of Coronavirus-like virus, begins spreading from China to the rest of…",Pobbathi_Venku,"Hyderabad, India","Pls donate to #BharatKeVeer
https://t.co/WhEMe2bnaW",574,3449,314314,False,"American Movie Contagion was released in 2011 speaks of Coronavirus-like virus, begins spreading from China to the rest of the world!
The strangest thing is that at the end of the movie it turns out that the cause of infection is the bat, same reason, disease is currently spread https://t.co/8rjZD1TEfB"
2020-01-30 21:30:07+00:00,The @CDCgov recommends travelers avoid all nonessential travel to #China due to the #2019nCoV outbreak. Learn more about travel safety tips here: https://t.co/RS1LI7mU8e https://t.co/rfjA5bV5YT,StateHealthIN,Indiana,Official account of the Indiana State Department of Health (ISDH). The ISDH promotes and provides essential public health services.,20906,1067,16608,True,No Value Mentioned
2020-01-30 21:30:30+00:00,"RT @DrTedros: I am declaring a public health emergency of international concern over the global outbreak of #2019nCoV, not because of what…",happy_saintt,"Delhi, India",24. Born in Jaipur. IITBHU Alumnus. Sociology stan. support global #EndTheCageAge. #THFC,136,1678,4313,False,"I am declaring a public health emergency of international concern over the global outbreak of #2019nCoV, not because of what is happening in #China, but because of what is happening in other countries.
https://t.co/HNrxyGeoBA"
2020-01-30 21:30:35+00:00,RT @ANI: World Health Organisation (WHO) declares international emergency over #coronavirus: AFP news agency,SitanshuDesai,India ,"This Bird Tweets Less But , Likes Other Tweeting . #NaModified",460,1287,172654,False,World Health Organisation (WHO) declares international emergency over #coronavirus: AFP news agency
2020-01-30 21:30:37+00:00,"RT @arifaajakia: American Movie Contagion was released in 2011 speaks of Coronavirus-like virus, begins spreading from China to the rest of…",VenkatNarayan80,"Bengaluru, India",Dharmo Rakshati Rakshitaha 🕉️,587,1793,53766,False,"American Movie Contagion was released in 2011 speaks of Coronavirus-like virus, begins spreading from China to the rest of the world!
The strangest thing is that at the end of the movie it turns out that the cause of infection is the bat, same reason, disease is currently spread https://t.co/8rjZD1TEfB"
2020-01-30 21:30:40+00:00,"RT @the_hindu: At a time when the no. of novel #coronavirus cases has crossed 7,700 — with deaths at 170 in China alone, the Ministry of #A…",wrickk23,Kolkata INDIA,No Value Mentioned,44,197,1313,False,"At a time when the no. of novel #coronavirus cases has crossed 7,700 — with deaths at 170 in China alone, the Ministry of #AYUSH has once again resorted to dishing out a dangerous prescription to people who might be infected with the virus.
https://t.co/l0gBwTNmly"
2020-01-30 21:30:45+00:00,RT @spectatorindex: BREAKING: Italy halts flights to and from China,happy_saintt,"Delhi, India",24. Born in Jaipur. IITBHU Alumnus. Sociology stan. support global #EndTheCageAge. #THFC,136,1678,4313,False,BREAKING: Italy halts flights to and from China
2020-01-30 21:31:00+00:00,Coronavirus: Wuhan's seafood market virus confirmed in all most 20 countries; #China #Wuhan #Coronavirus #ChinaVirus #WuhanCoronavirus #CoronoaVirus #CoronaOutbreak  #ChinaCoronaVirus https://t.co/jiauECkPh3,ThatSindhiCM,India,Eating each day to live... mandir kahe pe bhi banao,257,4,16680,False,No Value Mentioned
2020-01-30 21:31:07+00:00,"@WHO The World Health Organisation has declared international emergency over the deadly coronavirus as cases continue to spread outside China.
#DelhiPolice #RambhaktGopal #ArrestAnuragThakur #coronavirus #BJPkaGodseRaj #coronarvirus #jamiafiring #StagedJamiaAttack #JamiaShooting",salafi_rakibul,"Mumbai, India","#IT_Professional, Social Activist, Motivator & Fighter for #Humanity and #Poverty",70,516,1511,False,No Value Mentioned
2020-01-30 21:31:39+00:00,RT @spectatorindex: BREAKING: India reports first case of coronavirus,abhiroy92,"Pune, India","Bihari by Brain, Bharatiya by Heart🙏    🏼                             DieHard CrickHolic...🖐🏼",81,236,5242,False,BREAKING: India reports first case of coronavirus
2020-01-30 21:31:54+00:00,RT @the_hindu: Just in | #WHO declares international emergency over #coronavirus. AFP,MrGladPortBlair,"Andaman Nicobar Islands, India","Editor-in-Chief, Hawk Eye, English Daily & guest Newscaster at All India Radio (AIR), Port Blair, A&N Islands",1395,199,14982,False,Just in | #WHO declares international emergency over #coronavirus. AFP
2020-01-30 21:31:57+00:00,RT @sardesairajdeep: News Today: 9 pm: I report from ground zero Jamia: what is the mood among the students after the gunman incident? Will…,mctavish2191,India,"First Cry on 2nd of Jan 😀. Yes I am weird, weird is good. Normal is overrated.",96,1081,18977,False,News Today: 9 pm: I report from ground zero Jamia: what is the mood among the students after the gunman incident? Will the 'goli maaro' politics end? Should minister Thakur be sacked? Coronavirus updates: @IndiaToday news without the noise.
2020-01-30 21:32:07+00:00,"RT @NathanLerner: Just a reminder that our anti-science president cut $750 million from the Prevention and Public Health Fund, which helps…",centerleft3360,Indiana,Friend of the pod.,110,223,16718,False,"Just a reminder that our anti-science president cut $750 million from the Prevention and Public Health Fund, which helps fund the CDC and local health agencies. #CoronavirusOutbreak 
https://t.co/WCdg8peSv9"
2020-01-30 21:32:20+00:00,RT @spectatorindex: BREAKING: World Health Organisation declares coronavirus crisis a public emergency of international concern,Anurag_Donut,"Mundra, India",Believer in India’s growth story. #JaiShreeRam. Football is love. #Investor #Trader.,19,611,2877,False,BREAKING: World Health Organisation declares coronavirus crisis a public emergency of international concern
2020-01-30 21:32:34+00:00,"RT @AmWorkCo: Houston we have a problem.

China, India have hijacked the US immigration system much to the detriment of millions of America…",shivbhaktajoshi,India,"99% of job will be taken by ML/AL, country that has such companies & engineer will be super power in 2040. India should be tax free, 0 regulation, border-less",688,4867,7139,False,"Houston we have a problem.

China, India have hijacked the US immigration system much to the detriment of millions of American workers and the nation's safety.

Congress we the American people deserve better.

End #OPT #H1B #S386 #H4EAD #L1 

https://t.co/6XoEG9RYD9"
2020-01-30 21:32:38+00:00,RT @spectatorindex: BREAKING: Italy halts flights to and from China,dilipjain1979,"Bengaluru, India",Entrepreneur ● Love Cooking ● Blessed To Be Followed By PM Narendra Modi & Sh Amit Shah ● #JaiHind 🇮🇳,13521,413,278535,False,BREAKING: Italy halts flights to and from China
2020-01-30 21:32:41+00:00,"RT @majorgauravarya: Pakistan not to evacuate its citizens from virus-hit Wuhan to show solidarity. Until now, Pakistan had only sold its n…",skaul4,"Srinagar, India","Kashmiri Pandit, Victim of Genocide",136,232,11621,False,"Pakistan not to evacuate its citizens from virus-hit Wuhan to show solidarity. Until now, Pakistan had only sold its national assets to China. Now it is selling its citizens, too. 

Leaving its citizens to die so that money continues to flow in from China. https://t.co/HlUX6zPYNb"
2020-01-30 21:32:53+00:00,"RT @PeterSweden7: BREAKING🚨

The World Health Organization has declared the #CoronaVirus outbreak a global public health emergency.

Retwee…",Pobbathi_Venku,"Hyderabad, India","Pls donate to #BharatKeVeer
https://t.co/WhEMe2bnaW",574,3449,314314,False,"BREAKING🚨

The World Health Organization has declared the #CoronaVirus outbreak a global public health emergency.

Retweet if you agree it's time to stop all flights from affected areas now.

Why wasn't this done weeks ago???"
2020-01-30 21:32:54+00:00,RT @ShivAroor: BREAKING: Coronavirus declared a global health emergency by @WHO.,11Poetic,India,"Old songs are like wine, ageing deliciously ...",336,492,29183,False,BREAKING: Coronavirus declared a global health emergency by @WHO.
2020-01-30 21:32:58+00:00,RT @BBCNews: Coronavirus declared global health emergency https://t.co/5iKIulCrQU,Sterrard8,"Mumbai, India","Football. Films. Chai. Gug!
Photographer.
https://t.co/jbiwq5kMce",521,230,123218,False,Coronavirus declared global health emergency https://t.co/5iKIulCrQU
2020-01-30 21:33:01+00:00,"RT @atrupar: Rep. Crow just ran a video montage of Trump's ""evolution of solicitation"" of foreign governments over the years, starting with…",ashabala2000,India,No Value Mentioned,576,604,85589,False,"Rep. Crow just ran a video montage of Trump's ""evolution of solicitation"" of foreign governments over the years, starting with ""Russia if you're listening"" and ending with Trump publicly calling for China and Ukraine to investigate the Bidens last October https://t.co/NuFI2TwmT3"
2020-01-30 21:33:02+00:00,RT @ShivAroor: BREAKING: Coronavirus declared a global health emergency by @WHO.,Sterrard8,"Mumbai, India","Football. Films. Chai. Gug!
Photographer.
https://t.co/jbiwq5kMce",521,230,123218,False,BREAKING: Coronavirus declared a global health emergency by @WHO.
2020-01-30 21:33:18+00:00,"RT @DanRather: We've seen the president and his enablers peddle in lies and conspiracy theories. They denigrate experts, data, and science.…",HoosierCurt,Indiana,"Broker at Coldwell Banker Lingle in Richmond Indiana.
I love my family, my Cowboys and my Pacers.",36,86,439,False,"We've seen the president and his enablers peddle in lies and conspiracy theories. They denigrate experts, data, and science. And then, as fears of the coronavirus loom, who's going to protect public health? Science experts using data in the face of lies and conspiracy theories."
2020-01-30 21:33:20+00:00,RT @Shelby131960: Why hasn’t the U.S shut them down yet 👇🏼👇🏼,paula_myrick,Fredericksburg Indiana,"🇺🇸💯MAGA 2020  God first, Grandmother,  Conservative Christian, animal lover.⏱️☮️✝️",3915,4986,30234,False,Why hasn’t the U.S shut them down yet 👇🏼👇🏼 https://t.co/KcoybUfa1v
2020-01-30 21:33:25+00:00,RT @BBCWorld: Coronavirus declared global health emergency https://t.co/BVVhaFIjid,kuda_afu,India,No Value Mentioned,534,186,7612,False,Coronavirus declared global health emergency https://t.co/BVVhaFIjid
2020-01-30 21:33:32+00:00,RT @MonoChronica: WHO announces #coronavirus as global emergency 👇,tnpalli,"Hyderabad, India",No Value Mentioned,36,209,14035,False,WHO announces #coronavirus as global emergency 👇 https://t.co/wW4IOnDXfW
2020-01-30 21:33:45+00:00,RT @ABC: BREAKING: World Health Organization declares the coronavirus a public health emergency of international concern—only the sixth tim…,Sai_Eveready,"Bengaluru, India","Film Maker
[ *Cheat the Camera, Not the Audience ! ]",2590,128,2790,False,BREAKING: World Health Organization declares the coronavirus a public health emergency of international concern—only the sixth time such an emergency has been declared. https://t.co/cxD1zD8zvv https://t.co/yScAgxTxov
2020-01-30 21:33:47+00:00,"RT @mybreatheisHC: I don’t know why but my heart is screaming in pain for China 😭💔

May God bless China and I pray that they would find a s…",Chompoo_HC,India,𝙷𝙲𝚒𝚊𝚗𝚜 𝙵𝚛𝚘𝚖 𝚃𝚑𝚊𝚒𝚕𝚊𝚗𝚍,96,211,3336,False,"I don’t know why but my heart is screaming in pain for China 😭💔

May God bless China and I pray that they would find a solution soon 🙏 

Pray for china and pls don’t bash or demean them 😭🙏 https://t.co/6A2HHeZLqX"
2020-01-30 21:33:48+00:00,"RT @davidgura: Count the men. Then, count the women.",dahlingitsme,Indiana,"Librarians will someday control the universe, so you will want me on your side.",1126,1841,132006,False,"Count the men. Then, count the women. https://t.co/dCHo5MBazn"
2020-01-30 21:33:49+00:00,RT @madhukishwar: Why is no TV channel discussing historic #BodoAccord &amp;letting the nation get to know two young heroes who made it possibl…,tnpalli,"Hyderabad, India",No Value Mentioned,36,209,14035,False,"Why is no TV channel discussing historic #BodoAccord &amp;letting the nation get to know two young heroes who made it possible.
We're sick of needless attention to #ShaheenBaghJamiaJehadis day after day.
Please Ignore the demonic forces &amp;focus on good people https://t.co/H5cbsIcGK9"
2020-01-30 21:33:51+00:00,"RT @GappistanRadio: Coronavirus confirmed case detected in the country, a very very densely populated country, how is that not the biggest…",growasyougrow,India,"Thrives on knowledge • Loves to learn • Politics neophyte • Airline Pilot • Cinephile • Hobbyist • Explorer •
❤️#livinforlove🏳️‍🌈",128,244,21522,False,"Coronavirus confirmed case detected in the country, a very very densely populated country, how is that not the biggest story tonight"
2020-01-30 21:33:53+00:00,"-#KunalKamra gets banned from flying for 6 months
-#SainaNehwal joined #BJP
-First case of #Coronavirus confirmed in India
-#RambhaktGopal opens fire in #Jamia at a peaceful anti-#CAA protest 

When can we really expect the sun to shine after all of this in just a span of 2 days?",MuskanShandal,"New Delhi, India",I talk a lot. Audience engagement: @thequint Former intern @9Xm। ਜੀ ਆਇਆ ਨੂੌ!,53,97,293,False,No Value Mentioned
2020-01-30 21:50:54+00:00,RT @spectatorindex: BREAKING: World Health Organisation declares coronavirus crisis a public emergency of international concern,rinkeshind,"Mumbai, India","CS aspirants, Tech Enthusiastic, Masti, Market, Music, Moody & MS Dhoni",75,225,15496,False,BREAKING: World Health Organisation declares coronavirus crisis a public emergency of international concern
2020-01-30 21:50:56+00:00,RT @WHO: LIVE: Press conference on the Emergency Committee meeting on #2019nCoV https://t.co/hTQam7RWc9,phvr159,India,"A Natural Explorer in Life and Science 💫
@IndiaDST-INSPIRE PhD SRF @AcSIR_India
@NewtonFund Fellow @LindauNobel Alumni
Nonlinear Photonics Supercontinuum Laser",17,145,15,False,LIVE: Press conference on the Emergency Committee meeting on #2019nCoV https://t.co/hTQam7RWc9
2020-01-30 21:51:02+00:00,Pilots just sued American Airlines to force a halt to China flights https://t.co/eaUI59mB24 #window7 #SankalpIT,SankalpITteam,"Mohali, India","Expertise in working with the MSPs to set up their #LabTech, #ScreenConnect and #ConnectWise Manage tools. SankalpIT is serving the #MSPs since 2013.",2038,0,18925,False,No Value Mentioned
2020-01-30 21:51:10+00:00,RT @spectatorindex: BREAKING: Italy halts flights to and from China,rinkeshind,"Mumbai, India","CS aspirants, Tech Enthusiastic, Masti, Market, Music, Moody & MS Dhoni",75,225,15496,False,BREAKING: Italy halts flights to and from China
2020-01-30 21:51:23+00:00,"RT @NewIndianXpress: With more than 200 exhibitors from China slated to participate in the biennial auto components show in #Delhi, industr…",ElangoDharma,tamilnadu india,buisness,41,1087,3534,False,"With more than 200 exhibitors from China slated to participate in the biennial auto components show in #Delhi, industry body ACMA assured that all necessary precautionary measures are in place in the wake of #CoronavirusOutbreak.
https://t.co/Ho76kods6S"
2020-01-30 21:51:24+00:00,Coronavirus Anger Boils Over in China and Doctors Plead for Supplies https://t.co/9hu6chTjOA,AjayStfc,india,Let’s follow each other!😉,282,157,9118,False,No Value Mentioned
2020-01-30 21:51:24+00:00,"RT @UNICEF: Here are five ways to protect yourself, your children and your community from #coronavirus.

via @WHO https://t.co/WxtBl5IfCF",iamvijaysr,"Hyderabad, India",Jai Hind Jai Bharat 🇮🇳,56,220,381,False,"Here are five ways to protect yourself, your children and your community from #coronavirus.

via @WHO https://t.co/WxtBl5IfCF"
2020-01-30 21:51:29+00:00,"RT @zlj517: They are the most adorable, honorable people in this new era! Salute to these Chinese doctors who have been working tirelessly…",Neo_DotA,India,"Don't follow me, I'm lost too.",8,384,777,False,"They are the most adorable, honorable people in this new era! Salute to these Chinese doctors who have been working tirelessly in the wake of #coronavirus outbreak in Wuhan city. They've been cut off from their families for a national cause. https://t.co/ECFAtmdQ6l"
2020-01-30 21:51:34+00:00,"RT @UN: NEWS: #Coronavirus declared a public health emergency of international concern by @WHO. 

Global outbreak includes 98 cases in 18 c…",kartheeksharma_,India,📖,21,194,1043,False,"NEWS: #Coronavirus declared a public health emergency of international concern by @WHO. 

Global outbreak includes 98 cases in 18 countries, outside China. 

More info, including tips on how to stay healthy: https://t.co/tsGUhNhrv2 https://t.co/ZDyTXeVXyg"
2020-01-30 21:51:43+00:00,"RT @AhmedBaba_: Philbin just said that Trump didn’t request an investigation into Biden. Blatant lies.

I mean, there is really no way to s…",careaware,Northcentral Indiana RED ZONE,#savetheplanet #resist 🌊🌊🌊  ✡ 🙊Masks. Spread no virus. Make our own masks America. 🤧   G'ma  Bookworm. Elderly nerd.Sick of GOP. no DMs! VOTE BLUE.,6506,6688,143675,False,"Philbin just said that Trump didn’t request an investigation into Biden. Blatant lies.

I mean, there is really no way to spin Trump’s own words:

“[Ukraine] should investigate the Bidens... Likewise, China should start an investigation into the Bidens...“
https://t.co/xfmxuBI3m6"
2020-01-30 21:51:49+00:00,RT @rons1212: This is going to be a catastrophe- WHO declares international health emergency  https://t.co/k7yf6rK6oQ,myobservation,"India, UP70/ UP 14",illogically logical ! Always for Governance. businessman. Indian Liberal,298,968,24314,False,This is going to be a catastrophe- WHO declares international health emergency  https://t.co/k7yf6rK6oQ
2020-01-30 21:51:52+00:00,RT @EndGameWW3: Here we go...#Coronavirus,PJM_USA,"Indiana, USA","Handsome nerd/libertarian

Nationalist. American.",52,287,3378,False,Here we go...#Coronavirus https://t.co/UF9I4bbzxo
2020-01-30 21:51:53+00:00,These guys are far far ahead of most of their fellow humans https://t.co/dsx8T9tctg,srijshukla,"New Delhi, India","study politics, writes for theprint",538,1948,16994,False,No Value Mentioned
