created_at,full_text,screen_name,location,description,followers_count,friends_count,statuses_count,verified,full_retweet_text
2020-03-01 17:16:22+00:00,"RT @brakoo: How India has largely remained immune to coronavirus.

Clearly several steps have been taken - however it is very difficult to…",DMishra0311,New Delhi • Noida | India,"हिन्दू तन–मन, हिन्दू जीवन!
Proud Indian Hindu LLB 🎓| Cricket | Activist BJP & RSS Forever Devotee of @NarendraModi ji & @AkshayKumar | Sitamarhi • Bihar | 🇮🇳",2470,2201,57181,False,"How India has largely remained immune to coronavirus.

Clearly several steps have been taken - however it is very difficult to digest that the number of cases reported is this low.

Let's hope things are indeed going well for us and will continue so. https://t.co/lVUyf0RXax"
2020-03-01 17:16:22+00:00,RT @smna17: Why why pope cancelling his visits? In India priests do miracles of curing  dangerous diseases like cancer which even modern me…,A31X64Vijay,INDIA. (Bharat),"Dreaming for a Strong, Powerful & Glorious 'Great-INDIA' (Akhand Bharat) ... in a Beautiful WORLD !!! .. RTs are Not Endorsements !",4164,5002,395942,False,Why why pope cancelling his visits? In India priests do miracles of curing  dangerous diseases like cancer which even modern medicine can't cure 🙊 n then they convert ppl. Why can't pope do such miracles? @Pontifex should go n meet ppl with corona virus n cure it! https://t.co/o9FgLCmzwM
2020-03-01 17:16:14+00:00,"RT @jenniferatntd: Chilling ""good"" news. Chinese doctor Chen Jingyu's team has successfully conducted World's first double lung transplant…",acharyaprakash,"Barkuru (Udupi)/B'lore,India",Citizen of India,440,1871,44473,False,"Chilling ""good"" news. Chinese doctor Chen Jingyu's team has successfully conducted World's first double lung transplant for a 59 y/o #COVID2019 patient. Offical report says ""Experts in the industry believe this case is of great significance to reduce mortality of #Coronavirus."" https://t.co/Lj8T5wWAHy"
2020-03-01 17:16:09+00:00,RT @TenzingLamsang: If Indians really want to worry about something then look up the rapid spread of COVID-19 and how it is knocking the da…,demiguise77, India,"AatmaNirbhar Anti-national, urban-naxal, pakistani, bangladeshi, beef-eater, tmc, commie, jihadi and the unmentionable.",206,922,35749,False,"If Indians really want to worry about something then look up the rapid spread of COVID-19 and how it is knocking the daylights out of even advanced health systems in the West and Asia-Pacific. 

It’s spread in South Asia is inevitable and we are all not prepared."
2020-03-01 17:16:04+00:00,Coronavirus impact: ACC meeting to decide Asia Cup venue postponed https://t.co/27CORrkuax,TOISportsNews,"Noida, India",For more follow @toisports,97461,339,175176,True,No Value Mentioned
2020-03-01 17:16:03+00:00,"Person who returned from Malaysia didn't die of coronavirus, says Kerala Health Minister https://t.co/9J6G4vbB9V",TOIIndiaNews,"New Delhi, India",Latest news from all over the country brought to by India’s No.1 digital news destination https://t.co/VSKi1mkZBr,1556382,22,252676,True,No Value Mentioned
2020-03-01 17:16:00+00:00,"@devisridhar @WHO @DrTedros @mvankerkhove @DrMikeRyan 2)IHR authorizes @WHO to consider sources other than official reports. Indonesia has not yet reported any case. It has tested ~150 people, it didn't even test Wuhan evacuees. Various sources have raised concern on this. Not sure what's been done by @who
https://t.co/GGMoLSdbwW",Mahesh_Devnani,"Chandigarh, India","Associate Prof, Hospital Administration, PGI
#Fulbright #Chevening #SalzburgGlobal #JohnsHopkinsSPH #OxfordSBS #JLNMC #FRSPH #MAMS #DeltaOmega #UpsilonPhiDelta",1054,503,2961,False,No Value Mentioned
2020-03-01 17:15:57+00:00,RT @sidhant: ITBP's Chhawla camp. The Quarantine Facility is hosting 112 people evacuated from Wuhan. The 112 include 36 foreigners. No sym…,advsubhashsiyag,"New Delhi, India","social activist,advocate at Supreme Court of India,BJP/RSS.tweets are personal view.RT's are not endorsement.",620,2877,73949,False,ITBP's Chhawla camp. The Quarantine Facility is hosting 112 people evacuated from Wuhan. The 112 include 36 foreigners. No symptom of #coronavirusus has been reported. https://t.co/EGiVnvjLaD
2020-03-01 17:15:57+00:00,RT @TenzingLamsang: If Indians really want to worry about something then look up the rapid spread of COVID-19 and how it is knocking the da…,KhanSaheb_1,India,Proud Muslim.,808,3159,98748,False,"If Indians really want to worry about something then look up the rapid spread of COVID-19 and how it is knocking the daylights out of even advanced health systems in the West and Asia-Pacific. 

It’s spread in South Asia is inevitable and we are all not prepared."
2020-03-01 17:15:49+00:00,RT @ek_aalu_bonda: Increase in orders &amp; production by upto 20-30% in small scale industries of Nashik becoz of decrease in supply from chin…,AshishNagram,India,I support Indian army,64,440,1217,False,Increase in orders &amp; production by upto 20-30% in small scale industries of Nashik becoz of decrease in supply from china(corona virus). https://t.co/Q0KNkiWKJ2
2020-03-01 17:15:49+00:00,Rhode Island is today reporting it’s first Coronavirus case. Bad news,ScottLeisz,Indiana. ,"Trump has been impeached! His presidency will now forever be a shit stain on our history. Colts fan, Cubs fan, cyclist. #FBR. #resistance.🌊🌊",25623,25615,35343,False,No Value Mentioned
2020-03-01 17:15:51+00:00,"RT @SteveGuest: @chucktodd @GOPChairwoman @DonaldJTrumpJr @realDonaldTrump Earlier this week, Michael Bloomberg and Joe Biden were called o…",vallygirl_3,"Hoosierville, Indiana","Married Christian Patriot #WalkAway #WWG1WGA #MAGA No DMs
Honored 2 be followed by @GenFlynn ⭐️⭐️⭐️ 
God bless POTUS
God bless America",4678,4971,71155,False,"@chucktodd @GOPChairwoman @DonaldJTrumpJr @realDonaldTrump Earlier this week, Michael Bloomberg and Joe Biden were called out by the AP for lying about President Trump cutting funding to the CDC and NIH.

The facts from the Associated Press: Financing has increased to the CDC and the NIH.

https://t.co/DZ7549XNL0"
2020-03-01 17:15:47+00:00,"RT @kazweida: Coronavirus testing by the numbers...

South Korea: 68,000
Italy: 9,462
UK: 7,132
Japan: 5,450
US: 445

Most states are repor…",bookworm474,Southern Indiana,"avid reader, esp mystery, sci fi/fantasy;Anglophile; IU Alum #Browncoat #Fillionaire Warning! I have #ONFD 
#RESIST #GoJoe #VoteBlueDownBallot #BeTheChange4USA",1173,805,154916,False,"Coronavirus testing by the numbers...

South Korea: 68,000
Italy: 9,462
UK: 7,132
Japan: 5,450
US: 445

Most states are reporting they do not have the coronavirus test kits on hand.

@HHSGov needs to explain this discrepancy to the American people. Why are we so far behind?"
2020-03-01 17:15:49+00:00,"RT @abdullahsid07: Exclusive and Confirmed !
@TheRealKhabri is the main reason of Corona virus spreading all over the world , otherwise koi…",rynahbansal1,India,BIG Asim fan BB13 ❤️❤️,140,196,19421,False,"Exclusive and Confirmed !
@TheRealKhabri is the main reason of Corona virus spreading all over the world , otherwise koi corona ko jaanta bhi nhi tha !😹"
2020-03-01 17:15:45+00:00,RT @htTweets: #HTeditorial | Coronavirus pandemic has roiled global markets. This means that there is little chance of the Indian economy r…,numbdroll,"Bangalore, India ","Self employed professional. Drifter. Opinionated Democratic libertarian. I love my family, my dog & nature. 

If you are religious, stay the f*ck away from me",25,384,4467,False,"#HTeditorial | Coronavirus pandemic has roiled global markets. This means that there is little chance of the Indian economy recovering by March end

https://t.co/XFch63sLTy"
2020-03-01 17:15:45+00:00,RT @trishankkarthik: The #coronavirus is showing that a country that forgets how to build is doomed to extinction. Never outsource that sh*…,govindsethunath,"Coimbatore, India",Area Man Retweets,26,395,2878,False,The #coronavirus is showing that a country that forgets how to build is doomed to extinction. Never outsource that sh*t.
2020-03-01 17:15:40+00:00,"RT @CNN: President Trump, in a tweet, announces people will be screened for coronavirus upon arriving in the US if they are traveling from…",sinha_salvi,India,"Believe in humanity.
TRUTH IS ALWAYS RIGHT.
Follow me on my Instagram food blog page 👇 https://t.co/fyK49mkfjI",485,173,9192,False,"President Trump, in a tweet, announces people will be screened for coronavirus upon arriving in the US if they are traveling from high-risk countries. Follow live updates: https://t.co/P6nUZj0IDY"
2020-03-01 17:15:33+00:00,"RT @SteveGuest: @chucktodd @GOPChairwoman @DonaldJTrumpJr @realDonaldTrump Back to Democrat politicians...

Joe Biden is lying about the Tr…",vallygirl_3,"Hoosierville, Indiana","Married Christian Patriot #WalkAway #WWG1WGA #MAGA No DMs
Honored 2 be followed by @GenFlynn ⭐️⭐️⭐️ 
God bless POTUS
God bless America",4678,4971,71155,False,"@chucktodd @GOPChairwoman @DonaldJTrumpJr @realDonaldTrump Back to Democrat politicians...

Joe Biden is lying about the Trump administration's response to coronavirus.

No officials were muzzled. 

https://t.co/HwTIp4L3Ds"
2020-03-01 17:15:33+00:00,"RT @satkabir_: #Secrets_Of_Vedas
Residents of America Iran China India and everyone understand the secrets of Vedas and make your familiar…",Raju82009270,"Rajasthan, India",No Value Mentioned,90,388,3045,False,"#Secrets_Of_Vedas
Residents of America Iran China India and everyone understand the secrets of Vedas and make your familiar with the Kavir Dev or Kabir Saheb who is the father of all. https://t.co/lf2LeXBQ7e"
2020-03-01 17:15:32+00:00,"RT @Surgeon_General: Seriously people- STOP BUYING MASKS!  

They are NOT effective in preventing general public from catching #Coronavirus…",claykelley,Indiana,Could I have been anyone other than me?,266,669,1377,False,"Seriously people- STOP BUYING MASKS!  

They are NOT effective in preventing general public from catching #Coronavirus, but if healthcare providers can’t get them to care for sick patients, it puts them and our communities at risk! 
 https://t.co/UxZRwxxKL9"
2020-03-01 17:15:32+00:00,"How to Prepare for Coronavirus: Masks, Washing Hands, Masks and More https://t.co/E9IRl8DrqE https://t.co/ziOFAPtX7W",Travel_Advent,India,Tours and Travel Packages around the world with best deals,29,50,4267,False,No Value Mentioned
2020-03-01 17:15:26+00:00,"RT @SteveGuest: @chucktodd @GOPChairwoman @DonaldJTrumpJr @realDonaldTrump The New York Times published this bonkers headline: ""Let's Call…",RobertF4358,"Indianapolis, IN","Christian, Patriot, Dad, Husband, Mil Brat, Ret Fleo, #WWG1WGA",4547,4955,33489,False,"@chucktodd @GOPChairwoman @DonaldJTrumpJr @realDonaldTrump The New York Times published this bonkers headline: ""Let's Call It Trumpvirus.""

Not subtle at all in their attempt to link coronavirus to Trump.

The subhead: ""If you're feeling awful, you know who to blame."" https://t.co/9DMvBv8MyT"
2020-03-01 17:15:24+00:00,RT @soniandtv: False rumours of fresh outbreak of violence as of now. Stray incident of stone throwing reported in one area. Watch NDTV for…,palakkumar,"Jaipur, India",engineer by occupation. realist about the challenges and optimist about change. don't like to get tagged with any type of 'ism',254,107,60383,False,False rumours of fresh outbreak of violence as of now. Stray incident of stone throwing reported in one area. Watch NDTV for more information https://t.co/8Nm70in1hq
2020-03-01 17:15:24+00:00,RT @BBCNews: Coronavirus: Nasa images show China pollution clear amid slowdown https://t.co/QguTq0uUAx,shlokraval,"Ahmadabad City, India","the one who retweets every @newyorker article to look brainy and woke but ends up looking jobless.

instagram- @shlokraval",89,2152,2622,False,Coronavirus: Nasa images show China pollution clear amid slowdown https://t.co/QguTq0uUAx
2020-03-01 17:15:22+00:00,RT @PDChina: #Myanmar on Sunday donated 200 tons of rice to #China as a humanitarian assistance in the battle against the #COVID19 epidemic…,KAUSHALKRSHARMA,HYDERABAD INDIA,"India Health Care All Types of Natural Products mainly Patanjali & Dabur Contact 8191519114 , 9959806170 (What'sApp) Res 04066496806",97,1150,14413,False,#Myanmar on Sunday donated 200 tons of rice to #China as a humanitarian assistance in the battle against the #COVID19 epidemic https://t.co/NoFohWvarg
2020-03-01 17:15:18+00:00,"RT @pradeep_io: Announcement : Giving back

If your engineering team performance is affected by #coronavirus, I would love to help you out…",alok_ben,India,"First deserve, then desire! Views ethically, honestly and (by virtue of a semblance of belonging to a free & alive democracy..) matter-of-facted’ly personal.",102,141,540,False,"Announcement : Giving back

If your engineering team performance is affected by #coronavirus, I would love to help you out get started with effective and accountable remote work. 

Feel free to schedule a call with me https://t.co/geuaYbUgvg"
2020-03-01 17:15:19+00:00,"Till now over 86,500 cases of the #coronavirus reported globally, the majority in #China. Outside China, it has spread to 53 countries, with more than 6,500 cases &amp; more than 100 deaths. #Globally, the illness has killed nearly 3,000 people.
#COVID19 #COVID2019 #CoronaVirusUpdate https://t.co/j8ArfhwKZN",TheVikasLohchab,"New Delhi, India","#Researcher, #Journalist, #Politics, #Policy, #Diplomacy, #StrategicAffairs",164,1222,2853,False,No Value Mentioned
2020-03-01 17:15:20+00:00,RT @SteveGuest: @chucktodd @GOPChairwoman @DonaldJTrumpJr Michael Bloomberg purchased 3 minutes of commercial air time on CBS and NBC to ru…,RobertF4358,"Indianapolis, IN","Christian, Patriot, Dad, Husband, Mil Brat, Ret Fleo, #WWG1WGA",4547,4955,33489,False,"@chucktodd @GOPChairwoman @DonaldJTrumpJr Michael Bloomberg purchased 3 minutes of commercial air time on CBS and NBC to run an ad for his campaign about coronavirus.

Reminder: A month ago, President Trump issued travel restrictions for people coming from China.

That's the preparedness @realDonaldTrump has brought."
2020-03-01 17:15:20+00:00,"RT @TulsiGabbard: .@realDonaldTrump instead of going to war with Russia and Syria in order to protect the al-Qaeda-Turkish alliance, you sh…",Anubhav22924810,"Ayodhya, India",No Value Mentioned,19,781,1295,False,".@realDonaldTrump instead of going to war with Russia and Syria in order to protect the al-Qaeda-Turkish alliance, you should focus on the war against the Coronavirus. #StandWithTulsi https://t.co/Uk7TGeF1km"
2020-03-01 17:15:15+00:00,"RT @SteveGuest: @chucktodd From the beginning, @GOPChairwoman and @DonaldJTrumpJr have been calling out the Democrats for politicizing coro…",RobertF4358,"Indianapolis, IN","Christian, Patriot, Dad, Husband, Mil Brat, Ret Fleo, #WWG1WGA",4547,4955,33489,False,"@chucktodd From the beginning, @GOPChairwoman and @DonaldJTrumpJr have been calling out the Democrats for politicizing coronavirus. 

Example: Schumer &amp; Warren have falsely accused the president of having no plan, despite CDC having a 52-page planned response. https://t.co/hyxz8nsfa0"
2020-03-01 17:15:17+00:00,"RT @abdullahsid07: Exclusive and Confirmed !
@TheRealKhabri is the main reason of Corona virus spreading all over the world , otherwise koi…",iamrealsarif07,"Kolkata, India",Biggest fan of #Asim Riaz #SRK #Cristiano Ronaldo,67,26,17275,False,"Exclusive and Confirmed !
@TheRealKhabri is the main reason of Corona virus spreading all over the world , otherwise koi corona ko jaanta bhi nhi tha !😹"
2020-03-01 17:15:17+00:00,"RT @paanagam: Iran’s former ambassador to the Vatican and prominent cleric Hadi Khosrowshahi died of coronavirus: Anadolu Agency

On anothe…",A31X64Vijay,INDIA. (Bharat),"Dreaming for a Strong, Powerful & Glorious 'Great-INDIA' (Akhand Bharat) ... in a Beautiful WORLD !!! .. RTs are Not Endorsements !",4165,5002,395944,False,"Iran’s former ambassador to the Vatican and prominent cleric Hadi Khosrowshahi died of coronavirus: Anadolu Agency

On another news, Pope Francis cancels official engagements for third day in a row https://t.co/JWeB4r1QuI"
2020-03-01 17:15:15+00:00,"RT @Surgeon_General: Seriously people- STOP BUYING MASKS!  

They are NOT effective in preventing general public from catching #Coronavirus…",katherinestiles,"Pawnee, Indiana","“I don’t know” said the bone, “I didn’t make the world” #tribetown #MRW",424,460,16445,False,"Seriously people- STOP BUYING MASKS!  

They are NOT effective in preventing general public from catching #Coronavirus, but if healthcare providers can’t get them to care for sick patients, it puts them and our communities at risk! 
 https://t.co/UxZRwxxKL9"
2020-03-01 17:15:02+00:00,Coronavirus threat: ISSF says shooters free to take call on participation in Olympic Test Event https://t.co/8O5rgGNXOi,TOISportsNews,"Noida, India",For more follow @toisports,97462,339,175176,True,No Value Mentioned
2020-03-01 17:15:03+00:00,"RT @SteveGuest: Thread.

NBC's Chuck Todd is misleading the American people.

It's Democrats &amp; the MSM who are politicizing coronavirus, no…",RobertF4358,"Indianapolis, IN","Christian, Patriot, Dad, Husband, Mil Brat, Ret Fleo, #WWG1WGA",4547,4955,33489,False,"Thread.

NBC's Chuck Todd is misleading the American people.

It's Democrats &amp; the MSM who are politicizing coronavirus, not Republicans.

So @chucktodd, you asked for it, I'll name some names of Democrats and the media who are trying to score political points with coronavirus. https://t.co/irL26YtP2O"
2020-03-01 17:14:59+00:00,"RT @SteveGuest: @chucktodd @GOPChairwoman @DonaldJTrumpJr @realDonaldTrump The New York Times published this bonkers headline: ""Let's Call…",vallygirl_3,"Hoosierville, Indiana","Married Christian Patriot #WalkAway #WWG1WGA #MAGA No DMs
Honored 2 be followed by @GenFlynn ⭐️⭐️⭐️ 
God bless POTUS
God bless America",4678,4971,71155,False,"@chucktodd @GOPChairwoman @DonaldJTrumpJr @realDonaldTrump The New York Times published this bonkers headline: ""Let's Call It Trumpvirus.""

Not subtle at all in their attempt to link coronavirus to Trump.

The subhead: ""If you're feeling awful, you know who to blame."" https://t.co/9DMvBv8MyT"
2020-03-01 17:15:00+00:00,"When it comes to the impact of #coronavirus on economic well-being and profitability, it may be useful to think of four stages, writes @elerianm. (Via @bopinion)
https://t.co/v7bHW7VEeB",BloombergQuint,"Mumbai, India","#India’s premier multi-platform #business and financial #news company.

#BQBlue queries: support@bloombergquint.com
Follow: https://t.co/Lvz7iz0zt1",161458,140,208147,True,No Value Mentioned
2020-03-01 17:15:00+00:00,"#HTeditorial | Coronavirus pandemic has roiled global markets. This means that there is little chance of the Indian economy recovering by March end

https://t.co/XFch63sLTy",htTweets,India,One of India's largest media companies. Latest news from around the world. Retweets are not endorsements,7573876,126,739527,True,No Value Mentioned
2020-03-01 17:14:52+00:00,"RT @INDems: Pence enabled the worst HIV outbreak in Indiana's history. He has a long record of denying science. Now, he's leading our natio…",Okieoriginal,"Indiana, USA",life long devotion to traditional public schools,394,704,42904,False,"Pence enabled the worst HIV outbreak in Indiana's history. He has a long record of denying science. Now, he's leading our nation's response to the coronavirus? 

Sign our petition if you agree, Pence can't handle a pandemic &gt;&gt;&gt;&gt;&gt;&gt; https://t.co/kPqRxK4xpV https://t.co/3wSx3ODgUn"
2020-03-01 17:14:53+00:00,"RT @Passeriform: I know I read a lot of science fiction but I never expected to be in the one with the climate disaster, the one with the S…",MisraDevika03,"New Delhi, India","Research Scholar 
International Relations
Latin American Politics",262,953,507,False,"I know I read a lot of science fiction but I never expected to be in the one with the climate disaster, the one with the Sudden Dictator, and the one with the epidemic at the same time. A love story might have been nice, if we're going for a combo."
2020-03-01 17:14:48+00:00,RT @JishaJargon: Is the fear of coronavirus stopping you from enjoying meat? #FakeNews #Health #FactsNotFear,healthaasia,"New Delhi, India","Data-driven platform to bring journalists,doctors,data scientists together to shape health reporting in Asia. A DataLEADS initiative awarded by @membershippzzle",2203,717,9591,False,Is the fear of coronavirus stopping you from enjoying meat? #FakeNews #Health #FactsNotFear https://t.co/L3hiMcPPZB
2020-03-01 17:14:48+00:00,RT @ShefVaidya: Can we buy them a one way ticket to Wuhan? https://t.co/7Einr96w9O,ashish200983,India,"photographer,engineer,financial analyst,budding entrepreneur. Vedas for enlightenment. Proud Indian, Yaduvanshi par Samajwadi nahi सभी फौलोअर्स को शुक्रिया",309,738,23239,False,Can we buy them a one way ticket to Wuhan? https://t.co/7Einr96w9O
2020-03-01 17:14:50+00:00,"RT @SteveGuest: @chucktodd @GOPChairwoman @DonaldJTrumpJr @realDonaldTrump Regarding the media, Politico is publishing false stories about…",vallygirl_3,"Hoosierville, Indiana","Married Christian Patriot #WalkAway #WWG1WGA #MAGA No DMs
Honored 2 be followed by @GenFlynn ⭐️⭐️⭐️ 
God bless POTUS
God bless America",4678,4971,71155,False,"@chucktodd @GOPChairwoman @DonaldJTrumpJr @realDonaldTrump Regarding the media, Politico is publishing false stories about President Trump.

Reminder: President Trump did not call coronavirus a hoax.

https://t.co/6VT5E4Ejom"
2020-03-01 17:14:46+00:00,RT @funder: BREAKING: Mike Pence defended Don Jr saying Democrats want “millions” of Americans to die of coronavirus. What a bunch of weak…,ScottLeisz,Indiana. ,"Trump has been impeached! His presidency will now forever be a shit stain on our history. Colts fan, Cubs fan, cyclist. #FBR. #resistance.🌊🌊",25623,25615,35343,False,"BREAKING: Mike Pence defended Don Jr saying Democrats want “millions” of Americans to die of coronavirus. What a bunch of weak pathological liars. No Democrat wants that. None. These people are disgusting, desperate and pathetic, and clearly you shouldn’t trust a word they say."
2020-03-01 17:14:40+00:00,RT @TenzingLamsang: If Indians really want to worry about something then look up the rapid spread of COVID-19 and how it is knocking the da…,gala_khan,"Mysore, India","I am a human full of flaws, proud of every flaw, makes me more human. A little bit of everything. An Educator. Plantation owner of a Coffee Estate. Car lover.",353,2388,2636,False,"If Indians really want to worry about something then look up the rapid spread of COVID-19 and how it is knocking the daylights out of even advanced health systems in the West and Asia-Pacific. 

It’s spread in South Asia is inevitable and we are all not prepared."
2020-03-01 17:14:40+00:00,RT @SteveGuest: @chucktodd @GOPChairwoman @DonaldJTrumpJr Michael Bloomberg purchased 3 minutes of commercial air time on CBS and NBC to ru…,vallygirl_3,"Hoosierville, Indiana","Married Christian Patriot #WalkAway #WWG1WGA #MAGA No DMs
Honored 2 be followed by @GenFlynn ⭐️⭐️⭐️ 
God bless POTUS
God bless America",4678,4971,71155,False,"@chucktodd @GOPChairwoman @DonaldJTrumpJr Michael Bloomberg purchased 3 minutes of commercial air time on CBS and NBC to run an ad for his campaign about coronavirus.

Reminder: A month ago, President Trump issued travel restrictions for people coming from China.

That's the preparedness @realDonaldTrump has brought."
2020-03-01 17:14:41+00:00,RT @TenzingLamsang: If Indians really want to worry about something then look up the rapid spread of COVID-19 and how it is knocking the da…,coughhard,heart of india,Army|secular|patriotic to the Bone|views are own visions| RT for a change ARE endorsements and 'WTH moments',92,708,6117,False,"If Indians really want to worry about something then look up the rapid spread of COVID-19 and how it is knocking the daylights out of even advanced health systems in the West and Asia-Pacific. 

It’s spread in South Asia is inevitable and we are all not prepared."
2020-03-01 17:14:41+00:00,"RT @Xemmypoo: Something to bear in mind about the coronavirus: even though the mortality rate is low, the rate at which the disease spreads…",DerekMK,"Indiana, USA",Speedrunning and music and infosec/IAM.  Still enjoys Bionicle even after Bionicle memes stopped being a thing. He/Him. Personal/vent acct @derekmerekkerek,539,398,15276,False,"Something to bear in mind about the coronavirus: even though the mortality rate is low, the rate at which the disease spreads is higher than influenza. You may not die from the disease, but it’s important to stay healthy so you don’t spread it to someone who could."
2020-03-01 17:14:37+00:00,RT @azbrodsky: A friendly reminder: people who will be high-risk patients if we get coronavirus can hear you when you reassure everyone we'…,katifinch,Indianapolis,🏳️‍🌈 she/her Just a vegan dog mom livin the nerd life tryin to stay sexy and not get murdered,105,1154,5055,False,A friendly reminder: people who will be high-risk patients if we get coronavirus can hear you when you reassure everyone we're the only ones who might die.
2020-03-01 17:14:25+00:00,RT @rvaidya2000: My grandma used to keep us 2 feet away in the name of Madi and insisted that keep distance from ppl--She seems to be right…,VG61462810,"Bengaluru South, India",No Value Mentioned,21,120,7372,False,My grandma used to keep us 2 feet away in the name of Madi and insisted that keep distance from ppl--She seems to be right in her approach--Corona-wise RT
