created_at,full_text,screen_name,location,description,followers_count,friends_count,statuses_count,verified,full_retweet_text
2020-02-03 21:20:55+00:00,"RT @Echinanews: Smart disinfection robots used in quarantine area at hospital in Qingdao, east China's Shandong Province, earning recogniti…",selberan,"INDIA,KERALA,KOLLAM.UAE",YOU ARE LOOKING GOOD,734,4973,87671,False,"Smart disinfection robots used in quarantine area at hospital in Qingdao, east China's Shandong Province, earning recognition from medical personnel #ChinaTech https://t.co/SntPEdE10g"
2020-02-03 21:21:01+00:00,"RT @Echinanews: Xi chairs leadership meeting on epidemic control, calling for all-out efforts to treat the patients, ensure the supply of m…",selberan,"INDIA,KERALA,KOLLAM.UAE",YOU ARE LOOKING GOOD,734,4973,87671,False,"Xi chairs leadership meeting on epidemic control, calling for all-out efforts to treat the patients, ensure the supply of medical protection materials, improve the admission and survival rates, and reduce the infection and mortality rates https://t.co/RoIKAcm68l https://t.co/zOmeq6MRF0"
2020-02-03 21:21:03+00:00,RT @Echinanews: Children of medical personnel in Shanghai create painting works to show their respect to medical workers on the front line…,selberan,"INDIA,KERALA,KOLLAM.UAE",YOU ARE LOOKING GOOD,734,4973,87671,False,Children of medical personnel in Shanghai create painting works to show their respect to medical workers on the front line of the battle against the novel #coronavirus outbreak https://t.co/Sfemc8rUdS
2020-02-03 21:21:07+00:00,RT @Echinanews: China on Monday urged relevant countries to view the novel #coronavirus epidemic rationally and calmly and form science-bas…,selberan,"INDIA,KERALA,KOLLAM.UAE",YOU ARE LOOKING GOOD,734,4973,87671,False,China on Monday urged relevant countries to view the novel #coronavirus epidemic rationally and calmly and form science-based and measured responses https://t.co/r7SLHQun2f
2020-02-03 21:21:10+00:00,RT @Echinanews: Employees at medical material factory in southwest China's Yunnan Province work extra shifts to produce bottled medical dis…,selberan,"INDIA,KERALA,KOLLAM.UAE",YOU ARE LOOKING GOOD,734,4973,87671,False,Employees at medical material factory in southwest China's Yunnan Province work extra shifts to produce bottled medical disinfectant amid novel #coronavirus outbreak https://t.co/EkgAW7ALHG
2020-02-03 21:21:15+00:00,RT @Echinanews: China had imported over $117 million worth of medical supplies as of Feb 2 to ease domestic shortages amid efforts to conta…,selberan,"INDIA,KERALA,KOLLAM.UAE",YOU ARE LOOKING GOOD,734,4973,87671,False,China had imported over $117 million worth of medical supplies as of Feb 2 to ease domestic shortages amid efforts to contain the #nCoV2019 outbreak. https://t.co/pnFIM2AAg4 https://t.co/dfIimg4HUh
2020-02-03 21:21:19+00:00,RT @Echinanews: Is it safe to receive a letter or a package from China? Can pets at home spread the new #coronavirus (2019-nCoV)? Do vaccin…,selberan,"INDIA,KERALA,KOLLAM.UAE",YOU ARE LOOKING GOOD,734,4973,87671,False,Is it safe to receive a letter or a package from China? Can pets at home spread the new #coronavirus (2019-nCoV)? Do vaccines against #pneumonia protect you against the new coronavirus? ...... @WHO answers what concern you most about the #nCoV2019. 👇 https://t.co/lnEnflPV7A https://t.co/Jw56cuE4Jw
2020-02-03 21:21:21+00:00,RT @Echinanews: #Live: Experts from NHC give update on novel coronavirus outbreak https://t.co/3Ervktryrq,selberan,"INDIA,KERALA,KOLLAM.UAE",YOU ARE LOOKING GOOD,734,4973,87671,False,#Live: Experts from NHC give update on novel coronavirus outbreak https://t.co/3Ervktryrq
2020-02-03 21:21:24+00:00,"RT @Echinanews: Apart from #Huoshenshan hospital that has been put into use Monday, the other hospital for #novelcoronavirus patients, #Lei…",selberan,"INDIA,KERALA,KOLLAM.UAE",YOU ARE LOOKING GOOD,734,4973,87671,False,"Apart from #Huoshenshan hospital that has been put into use Monday, the other hospital for #novelcoronavirus patients, #Leishenshan prefab hospital in Wuhan has almost completed the construction. It is due to operate on Feb 5, providing roughly 1600 beds. Come on! Wuhan speed! 💪 https://t.co/pLUiN0eyvo"
2020-02-03 21:21:27+00:00,"RT @NikunjGargN: LATEST #coronavirusindia : This morning's update
I98 samples tested:
195 negative , 3 positive ( one NEW one detected, als…",ibrahim_extreme,"Thane, India",No Value Mentioned,0,6,8,False,"LATEST #coronavirusindia : This morning's update
I98 samples tested:
195 negative , 3 positive ( one NEW one detected, also medical student from Wuhan, from Kerala)..This Is Now The 3rd Case Of The Virus Detected In India."
2020-02-03 21:21:37+00:00,"RT @P1GGY6: 🎉🎉❤️💕KNIFE GIVEAWAYS 🎉🎉❤️💕
Hello Twitter! I am a 14-year-old (perhaps the youngest) collector of Katowice items in China.

I am…",_ChAmPcs,India,"You don't play cause you get old, you get old cause you don't play.
YouTube: https://t.co/VkwXjqiDWN
Twitch: https://t.co/OtkLnMd2PV
Steam: https://t.co/jhjLxs4J8x",217,2425,29823,False,"🎉🎉❤️💕KNIFE GIVEAWAYS 🎉🎉❤️💕
Hello Twitter! I am a 14-year-old (perhaps the youngest) collector of Katowice items in China.

I am giving away this cool crimson knife in 8 days.

To participate:
1. RT
2. Follow me @P1GGY6 @ohnePixel 

Thank you guys and have a nice day.🐷🐷🐷 https://t.co/cPsk5Vv0sl"
2020-02-03 21:21:49+00:00,RT @globaltimesnews: The US ban on foreigners who have visited China within 14 days of entry is the most extreme response among all other c…,selberan,"INDIA,KERALA,KOLLAM.UAE",YOU ARE LOOKING GOOD,734,4973,87671,False,The US ban on foreigners who have visited China within 14 days of entry is the most extreme response among all other countries. We are justified in asking the US to show China respect for the huge sacrifices it has made in fighting the disaster: Editor-in-Chief Hu Xijin #HuSays https://t.co/VgaUCUz2Yf
2020-02-03 21:21:54+00:00,RT @globaltimesnews: Chinese authorities tighten measures to battle novel #coronavirus epidemic. https://t.co/I5vS3P9Gyb https://t.co/mMJxq…,selberan,"INDIA,KERALA,KOLLAM.UAE",YOU ARE LOOKING GOOD,734,4973,87671,False,Chinese authorities tighten measures to battle novel #coronavirus epidemic. https://t.co/I5vS3P9Gyb https://t.co/mMJxqUaB6s
2020-02-03 21:21:56+00:00,"RT @globaltimesnews: Chinese observers slammed the #US' move as over reactive, immoral and unsurprising, after it, without offering any con…",selberan,"INDIA,KERALA,KOLLAM.UAE",YOU ARE LOOKING GOOD,734,4973,87671,False,"Chinese observers slammed the #US' move as over reactive, immoral and unsurprising, after it, without offering any concrete assistance to #China has been creating chaos amid #novelcoronavirus outbreak. https://t.co/ZNFPX0RIkf https://t.co/PJWTK4iykR"
2020-02-03 21:21:57+00:00,Twitter bans Zero Hedge after it posts coronavirus conspiracy theory https://t.co/QkHV1HiMEg https://t.co/liFBLOAAc8,OfficialNews230,india,"Latest news from around the World, politics,business, entertainment, sports, science, health, celebrity, gossip and much more.",38,0,11551,False,No Value Mentioned
2020-02-03 21:22:04+00:00,Analysts feel oil demand impact restricted only to China – A few of the analysts have been starting to wonder if the markets of Oil have been spooked overtly by the potential of the coronav... https://t.co/E7fUrF7SF9 https://t.co/ZWwTM9OGRv,HumanBoundary,"Pune, India",Multi-platform network strives to reach our readers and provide them with news and entertainment worth sharing.,3,59,440,False,No Value Mentioned
2020-02-03 21:22:06+00:00,RT @globaltimesnews: Positive signs have emerged from the #novelcoronavirus outbreak as recovery rates have exceeded death rates and nation…,selberan,"INDIA,KERALA,KOLLAM.UAE",YOU ARE LOOKING GOOD,734,4973,87671,False,Positive signs have emerged from the #novelcoronavirus outbreak as recovery rates have exceeded death rates and nationwide control measures have yielded positive results. https://t.co/Z7jRc5SQuA https://t.co/oa70eFQUOi
2020-02-03 21:22:08+00:00,RT @globaltimesnews: Various measures taken for epidemic prevention across China. https://t.co/Q02nOp38c2 https://t.co/gwk35VAs0u,selberan,"INDIA,KERALA,KOLLAM.UAE",YOU ARE LOOKING GOOD,734,4973,87671,False,Various measures taken for epidemic prevention across China. https://t.co/Q02nOp38c2 https://t.co/gwk35VAs0u
2020-02-03 21:22:10+00:00,"RT @globaltimesnews: #Greece and #Nepal will not restrict Chinese nationals from entering their countries due to the #coronavirus outbreak,…",selberan,"INDIA,KERALA,KOLLAM.UAE",YOU ARE LOOKING GOOD,734,4973,87671,False,"#Greece and #Nepal will not restrict Chinese nationals from entering their countries due to the #coronavirus outbreak, unlike the US and other countries which officials and analysts have said is an overreaction to the epidemic. https://t.co/DTHPo4gx9d https://t.co/YCkk26pjN8"
2020-02-03 21:22:13+00:00,RT @globaltimesnews: #Chinese face mask producers are going all out to increase supplies amid the #coronavirus outbreak. As the holiday dra…,selberan,"INDIA,KERALA,KOLLAM.UAE",YOU ARE LOOKING GOOD,734,4973,87671,False,"#Chinese face mask producers are going all out to increase supplies amid the #coronavirus outbreak. As the holiday draws to an end, producers are gradually recovering capacity. https://t.co/jpTckOob0I https://t.co/LSq0uyK3Su"
2020-02-03 21:22:15+00:00,"RT @TrumpWarRoom: “When [Democrats] were pushing the Russia hoax, my father was renegotiating NAFTA...When they’re signing the Articles Of…",flowersranda9,"Indiana, USA","Hard working conservative, 
🇺🇸#TRUMP2020🇺🇸, MAGA, KAG, Christian, father, grandfather (Papaw)",872,819,28398,False,"“When [Democrats] were pushing the Russia hoax, my father was renegotiating NAFTA...When they’re signing the Articles Of Impeachment, my father signs a historic trade deal with China. That’s the difference between the Do Nothing Democrats and my father.” - @DonaldJTrumpJr https://t.co/s7MpjHWnlP"
2020-02-03 21:22:15+00:00,"RT @globaltimesnews: The digital economy, including online shopping, food delivery services and home entertainment, remains brisk amid the…",selberan,"INDIA,KERALA,KOLLAM.UAE",YOU ARE LOOKING GOOD,734,4973,87671,False,"The digital economy, including online shopping, food delivery services and home entertainment, remains brisk amid the outbreak of the #novelcoronavirus, according to the NDRC, but transports, tourism and retails are among the hardest hit. https://t.co/rLSKEU5y3j https://t.co/GzhXoQCn12"
2020-02-03 21:22:18+00:00,"RT @globaltimesnews: #China's industrial profit will plunge further in 2020 due to the outbreak of #coronavirus, but the decline will narro…",selberan,"INDIA,KERALA,KOLLAM.UAE",YOU ARE LOOKING GOOD,734,4973,87671,False,"#China's industrial profit will plunge further in 2020 due to the outbreak of #coronavirus, but the decline will narrow down for the whole year as production will bounce back in H2: experts https://t.co/Vfpi4QgfUz https://t.co/drqNauY63I"
2020-02-03 21:22:20+00:00,"RT @globaltimesnews: #Coronavirus outbreak in #Wuhan affecting China's #semiconductor, panel and #auto industries. A supply shortage among…",selberan,"INDIA,KERALA,KOLLAM.UAE",YOU ARE LOOKING GOOD,734,4973,87671,False,"#Coronavirus outbreak in #Wuhan affecting China's #semiconductor, panel and #auto industries. A supply shortage among Wuhan chipmakers could also release Chinese suppliers’ market share to #Micro, Samsung. https://t.co/TWhFxl2CsC https://t.co/TRTlv9YFQ4"
2020-02-03 21:22:25+00:00,"RT @globaltimesnews: The #yuan's central parity rate against the US dollar was down 373 basis points on Monday, the greatest drop since Aug…",selberan,"INDIA,KERALA,KOLLAM.UAE",YOU ARE LOOKING GOOD,734,4973,87671,False,"The #yuan's central parity rate against the US dollar was down 373 basis points on Monday, the greatest drop since August 6, 2019, impacted by the #coronavirus outbreak. https://t.co/lYBqFYEACx https://t.co/bA7d4URJRR"
2020-02-03 21:22:28+00:00,"RT @BhaavnaArora: Doctors in Thailand claim of successfully treating the Corona virus.

Thailand has cure for everything 😜~ Rahul Gandhi.",aandy5751,"Kolkata, India",No Value Mentioned,57,284,5303,False,"Doctors in Thailand claim of successfully treating the Corona virus.

Thailand has cure for everything 😜~ Rahul Gandhi."
2020-02-03 21:22:31+00:00,"RT @INUnPlugged: This is Dr Jagdish (an ent surgeon &amp; a Stand up Comedian) on Corona virus :- Hilarious at the same time informative 😃😃
#co…",IMRANKHANMOGUL,India,"Staunch Muslim loves ❤ #Islam, #India & @INCindia. Political critic. Peace lover. Human Rights. Self Respect. Equality. Justice for #Kashmir #FreePalestine🇵🇸",618,1634,73225,False,"This is Dr Jagdish (an ent surgeon &amp; a Stand up Comedian) on Corona virus :- Hilarious at the same time informative 😃😃
#coronarivirus https://t.co/v2Iu7p24gE"
2020-02-03 21:23:20+00:00,"China has finally relented in allowing a @WHO team, which will likely include experts from the US, into a coronavirus-ravaged Wuhan and maybe other cities as well. This could have been possible days before had the UN health arm not been so soft of China.
#coronavirus https://t.co/mtZIfmmpqS",dhairyam14,"New Delhi, India","Assistant Editor at @Indiatvnews; ex-@NH_India, @Dainikbhaskar; intern @the_hindu, @newscorpaus ; @unimelb alum; Views here are entirely personal",357,141,220,False,No Value Mentioned
2020-02-03 21:23:38+00:00,RT @cnni: The UK has pledged £20 million to develop new vaccines for coronavirus and other infectious diseases https://t.co/hbGVxp2bzO,selberan,"INDIA,KERALA,KOLLAM.UAE",YOU ARE LOOKING GOOD,734,4973,87671,False,The UK has pledged £20 million to develop new vaccines for coronavirus and other infectious diseases https://t.co/hbGVxp2bzO
2020-02-03 21:23:42+00:00,"#CoronaVirus #mutiert in #Deutschland? / New #Form of #Transmission #found in #Germany [#FACT] #wuhan #china #wuhanv... https://t.co/MBU8o9Xmar via 
@YouTube
 #AfD #AfDWirkt #politik #Corona #Epidemis #Epidemic #BioWar #WHO #Wuhanvirus #World #Healthy #China #EU #Brexit #Bayern https://t.co/kouonWimP3",tripathipkhere,"Lucknow, India","Ex Signaler of Indian Army, Now Trader  of commodity market 
and Investor of Equity market",27,8,702,False,No Value Mentioned
2020-02-03 21:23:46+00:00,RT @cnni: The Vatican has shipped hundreds of thousands of face masks to China in response to the coronavirus outbreak https://t.co/sqFdmOK…,selberan,"INDIA,KERALA,KOLLAM.UAE",YOU ARE LOOKING GOOD,734,4973,87671,False,The Vatican has shipped hundreds of thousands of face masks to China in response to the coronavirus outbreak https://t.co/sqFdmOKJC8
2020-02-03 21:23:50+00:00,RT @cnni: Villages and cities in China have resorted to flying drones with speakers to patrol streets and scold people not wearing masks in…,selberan,"INDIA,KERALA,KOLLAM.UAE",YOU ARE LOOKING GOOD,734,4973,87671,False,"Villages and cities in China have resorted to flying drones with speakers to patrol streets and scold people not wearing masks in public amid the coronavirus outbreak, according to Chinese state media.  https://t.co/AXX2V0u3VW"
2020-02-03 21:23:54+00:00,"RT @BeijingPalmer: I wrote on Wuhan, transparency, and the hypocrisy of the central Chinese govt getting ready to throw local officials und…",raizooi,India,Currently in China. Completing Masters in Law & Chinese Foreign Policy. Doggos ❤️,322,1898,27824,False,"I wrote on Wuhan, transparency, and the hypocrisy of the central Chinese govt getting ready to throw local officials under the bus for doing exactly what the system demands they do.

https://t.co/lu2GqtQ24L"
2020-02-03 21:24:03+00:00,"#CoronaVirus #mutiert in #Deutschland? / New #Form of #Transmission #found in #Germany [#FACT] #wuhan #china #wuhanv... https://t.co/MBU8oaeX1Z via 
@YouTube
 #AfD #AfDWirkt #politik #Corona #Epidemis #Epidemic #BioWar #WHO #Wuhanvirus #World #Healthy #China #EU #Brexit #Bayern https://t.co/5JGMtcUtXB",tripathipkhere,"Lucknow, India","Ex Signaler of Indian Army, Now Trader  of commodity market 
and Investor of Equity market",27,8,702,False,No Value Mentioned
2020-02-03 21:24:06+00:00,"RT @cnni: Impeachment news continues to dominate Washington this week, but @bianca_nobilo is tracking today's other big headlines:

- Coron…",selberan,"INDIA,KERALA,KOLLAM.UAE",YOU ARE LOOKING GOOD,734,4973,87671,False,"Impeachment news continues to dominate Washington this week, but @bianca_nobilo is tracking today's other big headlines:

- Coronavirus
- Iowa caucuses
- London terror
- Turkey-Syria tensions

Read more: https://t.co/qn46y6G9iE https://t.co/Zb1mcGrp2Z"
2020-02-03 21:24:08+00:00,"RT @JatNationalist: 'Around 2,000 people are under observation in the southern Indian state as the novel virus claimed 361 lives globally.'…",talk_anderson, India,"Libertarian, Doctor,social & economical conservative .Fan of Pork,কশা  পাঁঠার মাংস ,কাতলা মাছ ,Gym,Study,Scotch & PUBG :).
Fav Song-Battle Sympho",1527,4984,207596,False,"'Around 2,000 people are under observation in the southern Indian state as the novel virus claimed 361 lives globally.'

https://t.co/x34xCSwBL4"
2020-02-03 21:24:31+00:00,"RT @atrupar: Secretary Wilbur Ross says coronavirus will be good for [checks notes] American jobs: ""I think it will help to accelerate the…",rudraax,India,Take no hindutva warrior seriously unless he/she has atleast 3 kids of their own.,57,84,14032,False,"Secretary Wilbur Ross says coronavirus will be good for [checks notes] American jobs: ""I think it will help to accelerate the return of jobs to North America."" https://t.co/Y4SbDIcTi4"
2020-02-03 21:24:50+00:00,RT @cnni: The Vatican has shipped hundreds of thousands of face masks to China in response to the coronavirus outbreak https://t.co/lnatGuV…,selberan,"INDIA,KERALA,KOLLAM.UAE",YOU ARE LOOKING GOOD,734,4973,87671,False,The Vatican has shipped hundreds of thousands of face masks to China in response to the coronavirus outbreak https://t.co/lnatGuVBt5
2020-02-03 21:24:55+00:00,"RT @spectatorindex: Meaning of country's name.

India: Land of the Indus

Iran: Land of Aryans

Japan: Land of rising sun

Egypt: Frontier…",lrsingh2004,"Pune, Maharashtra, India","Long experience of Income-tax administration. Keen observer of national & internat'l political & economic affairs.
Modi is Philosopher King- Plato's Ideal Ruler",435,458,54882,False,"Meaning of country's name.

India: Land of the Indus

Iran: Land of Aryans

Japan: Land of rising sun

Egypt: Frontier

Nigeria: Land of the Niger river

Italy: Land of young cattle

France: Land of the Franks

Germany: Fertile land

China: Qin state

Indonesia: Indian islands"
2020-02-03 21:24:56+00:00,"RT @cnni: The death toll from the Wuhan coronavirus has topped 360, and authorities in China and across the world are working to contain th…",selberan,"INDIA,KERALA,KOLLAM.UAE",YOU ARE LOOKING GOOD,734,4973,87671,False,"The death toll from the Wuhan coronavirus has topped 360, and authorities in China and across the world are working to contain the disease.

Here's all the latest info: https://t.co/wwwbiylzAl"
2020-02-03 21:25:06+00:00,"RT @cnni: More than 360 people have died of Wuhan coronavirus in China, the country's health authorities said on Monday, with the total num…",selberan,"INDIA,KERALA,KOLLAM.UAE",YOU ARE LOOKING GOOD,734,4973,87671,False,"More than 360 people have died of Wuhan coronavirus in China, the country's health authorities said on Monday, with the total number of cases in mainland China at 17,205.

The 2003 outbreak of SARS infected 5,327 people in mainland China, with 349 deaths. https://t.co/MgGbRwOYVU"
2020-02-03 21:25:10+00:00,"RT @cnni: US health officials announced three more cases of the coronavirus in California, bringing the country's total to 11 cases https:/…",selberan,"INDIA,KERALA,KOLLAM.UAE",YOU ARE LOOKING GOOD,734,4973,87671,False,"US health officials announced three more cases of the coronavirus in California, bringing the country's total to 11 cases https://t.co/5ufI1ccMqY"
2020-02-03 21:25:13+00:00,RT @RT_com: Streets of #Shanghai get empty amid #coronavirus outbreak https://t.co/o7ZqgYcTRC,RanneetiR,India,"Ranneeti Research make videos for government performance, government schemes performance, people expectation from government, election opinion polls &exit polls",26,359,3888,False,Streets of #Shanghai get empty amid #coronavirus outbreak https://t.co/o7ZqgYcTRC
2020-02-03 21:25:16+00:00,BBC News - Coronavirus Wuhan diary: Living alone in a city gone quiet https://t.co/sdK5YHTgcI,roxyloveslucy,Indiana,"Indiana,my kids,my 2 grandsons, my dogs,B&W movies, film noir, country life, Golf.Lucy.Classic Rock. Indy car. Voted Trump🇺🇸.I work all the time. I'm pooped!",9159,7571,307274,False,No Value Mentioned
2020-02-03 21:25:19+00:00,RT @cnni: These are the countries that have confirmed cases of Wuhan coronavirus: https://t.co/aIxubgsCP0,selberan,"INDIA,KERALA,KOLLAM.UAE",YOU ARE LOOKING GOOD,734,4973,87671,False,These are the countries that have confirmed cases of Wuhan coronavirus: https://t.co/aIxubgsCP0
2020-02-03 21:25:19+00:00,RT @noconversion: Converted RBC from Kerala ...She was a medical student in china .. she is already affected by the virus ...and she is ref…,IChhawchhari,"Guwahati, India","nationalist🇧🇴
jai Sri ram 🙏🙏

proud to be hindu
जो आप #अधर्म के प्रति सहिष्णुता( टॉलरेंस) दिखाते हो तो आप सहिष्णु नही #कायर हो! - भगवद गीत",6112,5947,21951,False,"Converted RBC from Kerala ...She was a medical student in china .. she is already affected by the virus ...and she is refusing medical treatment ..
--- https://t.co/IBirUwOoi9"
2020-02-03 21:25:28+00:00,RT @cnni: The UK has pledged £20 million to develop new vaccines for coronavirus and other infectious diseases https://t.co/Yc21fEbgVP,selberan,"INDIA,KERALA,KOLLAM.UAE",YOU ARE LOOKING GOOD,734,4973,87671,False,The UK has pledged £20 million to develop new vaccines for coronavirus and other infectious diseases https://t.co/Yc21fEbgVP
2020-02-03 21:25:36+00:00,"RT @AgentSaffron: No civilization can last 4000 years and constantly expand their lands and power without being as ruthless as the Hans.

S…",Parashar_Harry,"Faridabad, India",देश पहले,835,1734,75771,False,"No civilization can last 4000 years and constantly expand their lands and power without being as ruthless as the Hans.

Sad for the boy tho. https://t.co/9ihfWmNrYW"
2020-02-03 21:25:39+00:00,"RT @jorge_guajardo: “As long as China struggles to contain the outbreak in Hubei, other province won’t dare open for business. No local gov…",raizooi,India,Currently in China. Completing Masters in Law & Chinese Foreign Policy. Doggos ❤️,322,1898,27824,False,"“As long as China struggles to contain the outbreak in Hubei, other province won’t dare open for business. No local government official is willing to take the blame for spreading the virus further.” https://t.co/sF6Aln6K23"
2020-02-03 21:25:46+00:00,"RT @_AishwaryaKadam: Islamophobia is not only a disease, it's an epidemic which is aggravated by weapons like hate speech and exploitation…",ShakilS26963172,India,"I Am Student YCMOU, I Love Nature, I Love Humanity.",3854,2254,20398,False,"Islamophobia is not only a disease, it's an epidemic which is aggravated by weapons like hate speech and exploitation of power. India's secularism is in the hands of that government who's hands are smeared with blood and violence. 
#शाहीन_बाग_जितेगा_मोदी_हारेगा 
#BJPkaGodseRaj"
2020-02-03 21:25:49+00:00,"RT @RedTRaccoon: Trump lies about deadly coronavirus in Super Bowl interview: ‘We’ve pretty much shut it down’
 https://t.co/Lo3tSiVxMu",suzolv,"Indiana, USA",Just trying to figure it all out! #resistance;  Never Trump; #impeachTrump,2670,3319,47794,False,"Trump lies about deadly coronavirus in Super Bowl interview: ‘We’ve pretty much shut it down’
 https://t.co/Lo3tSiVxMu"
2020-02-03 21:26:06+00:00,"It’s 3 AM. Just came back from hospital in Hyderabad. Friend I met i the evening, got super sick. 

No fear for Corona!! Hehehe. 

I come to this town for a day and drama follows me. Going home in 10 hours. Phew!!",ThatNaimish,India,Home quarantined!,3618,986,13840,False,No Value Mentioned
2020-02-03 21:26:16+00:00,RT @NPRHealth: Why The Response To The New Coronavirus Has Been So Aggressive https://t.co/LMLRQkpMMi,MarkECraft,"Carmel, IN (Indianapolis)","#CorpComms #Marketing #Media #Tech #AI #AR #IoT; All things #TheHumanCondition🤷 Former TV anchor, reporter, producer; lobbyist; Opinions own; RTs🚫endorsements",3048,4977,42167,False,Why The Response To The New Coronavirus Has Been So Aggressive https://t.co/LMLRQkpMMi
2020-02-03 21:26:18+00:00,"RT @zoo_bear: I think she and @madhukishwar is on same WhatsApp group. 🙄

""Demonetisation ka baad China ka Business thap ho gaya tha, Waha…",CSingh751,"New Delhi, India",Free thinker . UPSC CSE aspirant. RTs not endorsement . 💯 % follow back .,831,3088,19695,False,"I think she and @madhukishwar is on same WhatsApp group. 🙄

""Demonetisation ka baad China ka Business thap ho gaya tha, Waha ki Economy hill gayi thi, Modi ji ne baithe baithe dusre desho ko hila Diya tha"" https://t.co/bniktqkEoP https://t.co/1eSIWafrcu"
2020-02-03 21:26:18+00:00,RT @doctorsoumya: A short and concise summary. Coronavirus outbreak: what’s next? https://t.co/L8nsrGBnmJ,IManokarthi,"Tamil Nadu, India",Because of Sadhguru....,254,1838,22594,False,A short and concise summary. Coronavirus outbreak: what’s next? https://t.co/L8nsrGBnmJ
