created_at,full_text,screen_name,location,description,followers_count,friends_count,statuses_count,verified,full_retweet_text
2020-03-27 12:03:57+00:00,"RT @notorioussbeast: Much needed relief to middle class Indians!

Now RBI gives green signal to defer loan repayment for 3 months

Yesterda…",bittusempire,"Mumbai, India","inspired by honorable pm @narendramodi ji देश प्रथम ⚘  #Respect_Indian_Army #ShivA_is_My_SÒul ⚘  जय भारत
Ķě€p ķãĄm & KãĀm Śě ĶáĂm Ñő ĐM 🔫
E£sè BłØčĶ ढिशुम👊",14555,51,288807,False,"Much needed relief to middle class Indians!

Now RBI gives green signal to defer loan repayment for 3 months

Yesterday Modi Govt announced Rs 1.7 lakh Cr worth relief package for poor people, employees &amp; women

Now all Indians must focus on controlling #COVID19

Yes, It's Deadly"
2020-03-27 12:03:57+00:00,RT @PrinceArihan: Open Letter to Dr Tedros Adhanom Ghebreyesus: Are you China’s puppet in W.H.O? https://t.co/lq8Ez0jDJT,vikas_kailash,"Mumbai, India","IF COMMON SENSE WAS COMMON it wouldn't be SENSE laugh , smile , be happy always !!",91,531,7857,False,Open Letter to Dr Tedros Adhanom Ghebreyesus: Are you China’s puppet in W.H.O? https://t.co/lq8Ez0jDJT
2020-03-27 12:03:58+00:00,"RT @mid_day: Coronavirus Outbreak: SoBo Woman Jumps Off Building, Rumours Malign Eatery At Spot

Via. Hemal Ashar and @VishooSingh 

https:…",VishooSingh,"Mumbai, India","JOURNALIST Deputy Assistant Editor @mid_day, ex@zeenewshindi , ex @tv9marathi & PRESIDENT @mumbaicra",1404,363,725,False,"Coronavirus Outbreak: SoBo Woman Jumps Off Building, Rumours Malign Eatery At Spot

Via. Hemal Ashar and @VishooSingh 

https://t.co/TQSv2xGR7h"
2020-03-27 12:03:58+00:00,RT @IamNaveenKapoor: Excellent step @ArvindKejriwal .. Delhi govt to use 325 schools which will serve food to poor during lockdown,tinkuhaweli,"New Delhi, India","Social Activist & teacher
मेरी कही बात की जिम्मेदारी सिर्फ और सिर्फ मेरी होगी   दूसरे को नहीं घसीटने का ....
फैन नहीं मतदाता हूँ ....",501,859,27545,False,Excellent step @ArvindKejriwal .. Delhi govt to use 325 schools which will serve food to poor during lockdown
2020-03-27 12:03:58+00:00,@kansalrohit69 @diprjk @HealthMedicalE1 @MoHFW_INDIA I really think you people should start mass testing .... To prevent j&amp;k from entering stage 3 of Covid transmission,Humaa_13,"Kashmir, India","Passionate writer, 
Muslim ❤️ and proud 
Engineering student 


""in the remembrance of allah do hearts 💕  find rest ""   - quran",75,33,485,False,No Value Mentioned
2020-03-27 12:03:59+00:00,"RT @AskAnshul: Owaisi's AIMIM Party:

1) Maharashtra: Strike by doctors as AIMIM MLA Maulana Mufti barged into hospital with goons &amp; threat…",vinayj,"Amaravati, AP, India - NJ, US","Rutgers MBA @rutgersalumni, Farmer, Resident of Amaravati - The People’s Capital, @PrajaRajadhani🚴‍♀️,🏃‍♂️ ,🏸",118,77,5013,False,"Owaisi's AIMIM Party:

1) Maharashtra: Strike by doctors as AIMIM MLA Maulana Mufti barged into hospital with goons &amp; threatened medical staff.

2) UP: AIMIM leader Mansoor Alam arrested for spreading fake news to create panic that 50,000 people died due to coronavirus in India."
2020-03-27 12:04:00+00:00,"RT @BorisJohnson: Over the last 24 hours I have developed mild symptoms and tested positive for coronavirus.

I am now self-isolating, but…",The_12th_playa,"Chennai, India",No Value Mentioned,67,666,4052,False,"Over the last 24 hours I have developed mild symptoms and tested positive for coronavirus.

I am now self-isolating, but I will continue to lead the government’s response via video-conference as we fight this virus.

Together we will beat this. #StayHomeSaveLives https://t.co/9Te6aFP0Ri"
2020-03-27 12:04:01+00:00,"RT @HKrassenstein: BREAKING:  UK Prime Minister Boris Johnson has just tested positive for Coronavirus

Meanwhile our idiot president still…",rck09_official,India,"Blogger || cricket Lover || love music ||
Spend most of my time in playing cricket || And writing Articles😎
@pumaindia",74,30,12924,False,"BREAKING:  UK Prime Minister Boris Johnson has just tested positive for Coronavirus

Meanwhile our idiot president still wants to open our country up in 2 weeks.  

We need a national #CoronaLockdown ASAP."
2020-03-27 12:04:01+00:00,"RT @BorisJohnson: Over the last 24 hours I have developed mild symptoms and tested positive for coronavirus.

I am now self-isolating, but…",iSachinSrivstva,"Pune,  India","IT Infra Architect Social Causes, No RT Support, Views Mine
Follow by @DrSarojiniMLC @Shyampancharia @Akhiles4661860
Likes @anandmahindra @narendramodi @msdhoni",2372,4386,9159,False,"Over the last 24 hours I have developed mild symptoms and tested positive for coronavirus.

I am now self-isolating, but I will continue to lead the government’s response via video-conference as we fight this virus.

Together we will beat this. #StayHomeSaveLives https://t.co/9Te6aFP0Ri"
2020-03-27 12:04:02+00:00,"RT @TheSkandar: Corona Virus put whole world on knees except China.

Read the First paragraph in the article where it's clearly written tha…",mayank1999s,India,"Sanatan believer.
Proud HINDU & INDIC civilization researcher.
Reject left historians
YouTube channel for fact check clips. Subscribe. 
https://t.co/HLKKvNi5H4",558,1786,187401,False,"Corona Virus put whole world on knees except China.

Read the First paragraph in the article where it's clearly written that China defeated the deadly Virus. https://t.co/xFHBUPDscs"
2020-03-27 12:04:02+00:00,RT @BezwadaWilson: Governments must provide safety gear to all persons engaged in essential services including sanitation workers on par wi…,rajeevinbihar,"Patna, India","WASH Officer, Unicef Bihar.
Live in Bihar and live Bihar in all its hues...ups & down.Not necessarily express organisational views always.
#Delhi University",421,504,1950,False,Governments must provide safety gear to all persons engaged in essential services including sanitation workers on par with the medical staff. #covid19
2020-03-27 12:04:04+00:00,Take care. https://t.co/0vmpXibUyc,Sattylaw,"Chennai, India","Law student, political & governance watcher, avid reader. Blessed NOT to be followed by Narendra Modi.",435,432,95721,False,No Value Mentioned
2020-03-27 12:04:04+00:00,RT @alter_jamie: @cricketaakash @ProfDeano @bazidkhan81 @vikramsathaye @gauravkapur @bhogleharsha ... things we do during lockdown https://…,AshishA29078012,"Ranchi, India","#MEDICAL STUDENT
#CRIC LOVE",101,438,1229,False,@cricketaakash @ProfDeano @bazidkhan81 @vikramsathaye @gauravkapur @bhogleharsha ... things we do during lockdown https://t.co/WxUDqRnVNf
2020-03-27 12:04:04+00:00,"RT @drmonika_langeh: If we can maintain Social Distancing, You should follow the same✌🏻.
#SelfieWithSocialDistancing✌️ https://t.co/74GaBBi…",vicky_twitz,"Ooty, India",Still I Rise!!!!!,1233,648,113114,False,"If we can maintain Social Distancing, You should follow the same✌🏻.
#SelfieWithSocialDistancing✌️ https://t.co/74GaBBibKk"
2020-03-27 12:04:05+00:00,"RT @digitalgreenorg: While on lockdown, #videos4good is #FightingCovid19 with the power to reach the right information to all. In India, @d…",VemulaKamalakar,"Hyderabad, India",Working as a deputy program Manager @digitalgreenorg,20,199,30,False,"While on lockdown, #videos4good is #FightingCovid19 with the power to reach the right information to all. In India, @digitalgreenorg has created a video for @BiharNhm &amp; #FrontLineHeroes to disseminate among communities https://t.co/zjFshSIGfo 
Pls RT &amp; contact us for partnerships https://t.co/PL6QgAMXHC"
2020-03-27 12:04:06+00:00,"RT @PTI_News: If even one person does not follow guidelines related to COVID-19, all our efforts will amount to zero: Health Ministry offic…",GMurugadasssan,"Pondicherry, India","Iam ALL India BJP Member from 2014,My renewed BJP Membership is 1111989850, I want BJP Must rule whole India, One Party one Nation is my Principle",42,413,2290,False,"If even one person does not follow guidelines related to COVID-19, all our efforts will amount to zero: Health Ministry official"
2020-03-27 12:04:06+00:00,Humare pm piche rehgye is bar😭 https://t.co/uCtB6rcNP7,qureshi_097,"Hyderabad, India","Class-clown personality❤❤


Tweets in bookmarks👉🥺👈
No DM, only TL interaction",1149,186,24179,False,No Value Mentioned
2020-03-27 12:04:06+00:00,RT @STPIBengaluru: @stpibengalru &amp; its subcenters contact details for the seamless delivery of #STPIINDIA services during the threat of #CO…,AzadHemlata,"Noida, India",Technical officer at STPI Noida,115,323,5040,False,@stpibengalru &amp; its subcenters contact details for the seamless delivery of #STPIINDIA services during the threat of #COVID19 outbreak. @rsprasad @SanjayDhotreMP @SecretaryMEITY @Omkar_Raii @Shail2108 @stpiindia @GoI_MeitY https://t.co/iAW0GkU9Vs
2020-03-27 12:04:07+00:00,@adgzonekanpur @RbNishad2014 @Uppolice @agrapolice @narendramodi @myogiadityanath @sureshsingbjp @auraiyapolice @112UttarPradesh Sir it's a kind request for you to make social distancing at ramadevi sabji Mandi under flyover people's gathering ina huge number for purchasing we are scared scared of covid19 spreading.plz,Devendr89117137,"Uttar Pradesh, India",surveyor new India insurance company,0,58,452,False,No Value Mentioned
2020-03-27 12:04:08+00:00,"British Prime Minister Boris Johnson reveals about health condition on Twitter. 
So stay at home https://t.co/32WUc7XVsn",KashmirNewscast,"Srinagar, India",TKNA tknewscast,116,970,16441,False,No Value Mentioned
2020-03-27 12:04:08+00:00,RT @MarcellaBrasset: PM Don’t you dare take credit for the work of State govts to lock us down. In direct opposition to your go slow outrag…,rck09_official,India,"Blogger || cricket Lover || love music ||
Spend most of my time in playing cricket || And writing Articles😎
@pumaindia",74,30,12924,False,"PM Don’t you dare take credit for the work of State govts to lock us down. In direct opposition to your go slow outrage. 
 
#ScottyFomMarketing #CoronaLockdown #coronavirusaustralia"
2020-03-27 12:04:10+00:00,"RT @ishkarnBHANDARI: If we can send airplanes to countries eg IRAN where their is community
spread of Coronavirus to get citizens back.

Th…",gurunathank,"Chennai, India","Automation Guru, with some Modesty. Believer of what is Right.",114,284,49295,False,"If we can send airplanes to countries eg IRAN where their is community
spread of Coronavirus to get citizens back.

Then we can provide free trains to daily, migrant workers who are walking 100s of KM to get home."
2020-03-27 12:04:11+00:00,"RT @TVMohandasPai: Victimhood narratives for the foreign media. In 1.37b people India, there will be few cases, but @BDUTT has to defame In…",Rajendr43212394,"New Delhi, India","Do not regret growing older,it is a privilege denied to many.",307,811,22331,False,"Victimhood narratives for the foreign media. In 1.37b people India, there will be few cases, but @BDUTT has to defame India at this juncture,downplay efforts of PM Modi just to show hatred towards NDA!very sad that these narratives are being created @ARanganathan72 @PrinceArihan https://t.co/B3ubnwySeR"
2020-03-27 12:04:11+00:00,"RT @BorisJohnson: Over the last 24 hours I have developed mild symptoms and tested positive for coronavirus.

I am now self-isolating, but…",sbsingh1968,"Lucknow, India",Engineer by profession. Nationalist by passion. Aspiring for adding value to the society. Likes Old hindi songs & movies.,324,579,3850,False,"Over the last 24 hours I have developed mild symptoms and tested positive for coronavirus.

I am now self-isolating, but I will continue to lead the government’s response via video-conference as we fight this virus.

Together we will beat this. #StayHomeSaveLives https://t.co/9Te6aFP0Ri"
2020-03-27 12:04:11+00:00,"Finally got the Hindi name for social distancing. 

TAN DOORI

3.5/21",krlouhit,"Bangalore, India",Ambivert. Globetrotter. Entrepreneur,53,359,447,False,No Value Mentioned
2020-03-27 12:04:11+00:00,"RT @alokkirti1990: At this time due to the corona, qualified doctors like Dr. Kafil should be in the public.

#ReleaseDrKafeel https://t.co…",sunilku18971040,India,"socialist, leader, socio - political leader, son of farmer,.....",85,100,4388,False,"At this time due to the corona, qualified doctors like Dr. Kafil should be in the public.

#ReleaseDrKafeel https://t.co/PGXBJvYqbB"
2020-03-27 12:04:13+00:00,"I haven't been streaming because work is crazy and I feel like I'm going through days in the span of a few hours.

I'll be chilling out next week maybe, but this pandemic is getting worse and I need to be available for work.",ReziroGaunt,"Indiana, USA","25? - Dude - I play video games and D&D
I also eat and yell a lot
Also stream
https://t.co/yB5fCqQLNt
https://t.co/xPXJjMGhvS",31,120,853,False,No Value Mentioned
2020-03-27 12:04:13+00:00,RT @RahulGandhi: The lockdown will devastate our poor &amp; weak. It will deliver a heavy blow to the India we love. India isn’t black &amp; white.…,kalpeshravals,"Jamnagar, India","Editor, owner Bramhastra Weekly News Paper, proprietor meet publicity, r k publication, Yash digital studio, partner news review fortnightly, 
R.K. Tv Gujarati",10380,7944,219643,False,The lockdown will devastate our poor &amp; weak. It will deliver a heavy blow to the India we love. India isn’t black &amp; white. Our decisions have to be carefully thought through. A more nuanced &amp; compassionate approach is required to deal with this crisis. It’s still not too late. https://t.co/qZuoABfOMi
2020-03-27 12:04:13+00:00,"RT @Vishj05: To fight Coronavirus:

Prabhas has donated Rs 4 Crores.
Pawan Kalyan has donated Rs 2 Crores.
Ram Charan has donated Rs 70 Lak…",addrkhan,"Mumbai, India",No Value Mentioned,158,1392,11971,False,"To fight Coronavirus:

Prabhas has donated Rs 4 Crores.
Pawan Kalyan has donated Rs 2 Crores.
Ram Charan has donated Rs 70 Lakhs
Rajinikanth has donated Rs 50 lakhs

Bollywood Celebs have shared their videos banging thalis."
2020-03-27 12:04:14+00:00,RT @INSAUK: Info for Indian students stranded in the UK due to #Coronavirus Outbreak. INSA UK stands committed to helping you during this h…,kaffir_monk,India,Being atheist,19,126,70,False,Info for Indian students stranded in the UK due to #Coronavirus Outbreak. INSA UK stands committed to helping you during this hour of need. @HCI_London @CGI_Bghm @BritIndianVoice @IndiaInScotland @FISI_UK @SecySanjay @DrSJaishankar @adityarajkaul @ukinindia @chandrarsrikant https://t.co/KI4Y0laUMH
2020-03-27 12:04:16+00:00,RT @RahulGandhi: The lockdown will devastate our poor &amp; weak. It will deliver a heavy blow to the India we love. India isn’t black &amp; white.…,chandelsonu1,India,"संघर्ष प्रकृति का आमंत्रण है!
जो स्वीकार करता है,
वही आगे बढ़ता है...!!",170,451,1064,False,The lockdown will devastate our poor &amp; weak. It will deliver a heavy blow to the India we love. India isn’t black &amp; white. Our decisions have to be carefully thought through. A more nuanced &amp; compassionate approach is required to deal with this crisis. It’s still not too late. https://t.co/qZuoABfOMi
2020-03-27 12:04:16+00:00,"RT @bollywood_life: Coronavirus pandemic: Hrithik Roshan's pet dog Zane has an important message for fans 
 #HrithikRoshan 
 https://t.co/U…",IamPrince167,"New Delhi, India",Man on mission- to live the best possible life come what may.,611,399,67218,False,"Coronavirus pandemic: Hrithik Roshan's pet dog Zane has an important message for fans 
 #HrithikRoshan 
 https://t.co/UcfQ4CK9Yn"
2020-03-27 12:04:17+00:00,"RT @drmonika_langeh: If we can maintain Social Distancing, You should follow the same✌🏻.
#SelfieWithSocialDistancing✌️ https://t.co/74GaBBi…",bhagirathi29,"Mumbai, India",Retweets are in no terms endorsements. Tweets are not personalized.,1188,622,193774,False,"If we can maintain Social Distancing, You should follow the same✌🏻.
#SelfieWithSocialDistancing✌️ https://t.co/74GaBBibKk"
2020-03-27 12:04:17+00:00,"RT @MoHFW_INDIA: #IndiaFightsCorona

Follow these basic steps to wash your hands with soap and water thoroughly.

Together we can fight #CO…",dmkoraput,"Koraput, India","District Administration Koraput, Odisha",1557,317,2097,False,"#IndiaFightsCorona

Follow these basic steps to wash your hands with soap and water thoroughly.

Together we can fight #COVID19.

#CoronaOutbreak
#SwasthaBharat
#HealthForAll https://t.co/1pKuMbQmbo"
2020-03-27 12:04:17+00:00,RT @RahulGandhi: The lockdown will devastate our poor &amp; weak. It will deliver a heavy blow to the India we love. India isn’t black &amp; white.…,INCUPEast,"Uttar Pradesh, India",Official Account of UP East Congress,3476,93,4399,True,The lockdown will devastate our poor &amp; weak. It will deliver a heavy blow to the India we love. India isn’t black &amp; white. Our decisions have to be carefully thought through. A more nuanced &amp; compassionate approach is required to deal with this crisis. It’s still not too late. https://t.co/qZuoABfOMi
2020-03-27 12:04:17+00:00,"RT @BorisJohnson: Over the last 24 hours I have developed mild symptoms and tested positive for coronavirus.

I am now self-isolating, but…",somprakashsingh,"Sultanpur, India","मै सच के साथ हूं राष्ट्र के साथ हूं धर्म के साथ हूं ।
और सभी के विरोध में हूं ।",270,480,17521,False,"Over the last 24 hours I have developed mild symptoms and tested positive for coronavirus.

I am now self-isolating, but I will continue to lead the government’s response via video-conference as we fight this virus.

Together we will beat this. #StayHomeSaveLives https://t.co/9Te6aFP0Ri"
2020-03-27 12:04:17+00:00,"RT @Sharanyashettyy: Another vicitm of WuhanVirus in Karnataka is a 65yr old man from Tumkur. 

Tragedy is.. He has 3 wives and 16 children…",vadiraj_u,India,hakuna matata! worst marketing diva! tweets less.. RT’s a lot..,44,451,1660,False,"Another vicitm of WuhanVirus in Karnataka is a 65yr old man from Tumkur. 

Tragedy is.. He has 3 wives and 16 children.  All are now #Covid19 suspects. https://t.co/WVIMuyoQWp"
2020-03-27 12:04:18+00:00,RT @sachin_rt: We all are responsible for ensuring that those who have tested positive for #COVID19 receive all our love and care &amp; don’t f…,shrawansc,"Rajasthan, India","#Professional Rajasthani, #Nationalist,#Part time Blogger, Khastriya. क्षात्र धर्म ही श्रत्रिय जीवन का मार्ग है. राष्ट्र के लिए जीना राष्ट्र के लिए मरना.",2064,2807,12950,False,"We all are responsible for ensuring that those who have tested positive for #COVID19 receive all our love and care &amp; don’t feel any stigma. 

We must all practice #SocialDistancing but we shouldn’t isolate them from our society!

We can win this war only by supporting each other. https://t.co/riPDQE0knf"
2020-03-27 12:04:18+00:00,RT @PratikJ31641963: Indian IT Companies Must Learn to Cope Up with the Coronavirus Outbreak and Realign their Strategies #FeverDetectionCa…,pravinkumarhans,"Noida, India+!Nj",Creative Designer,92,76,1198,False,Indian IT Companies Must Learn to Cope Up with the Coronavirus Outbreak and Realign their Strategies #FeverDetectionCamera @Sparsh_cctv @Infosys @Wipro @TataCompanies @ficci_india #Covid19Out https://t.co/quAF5p5K8c
2020-03-27 12:04:19+00:00,"RT @IArchanaJha: A handwritten letter by me to this lovable gem ❤️💎 in this Covid-19 situation. 
#ParthSamthaan #AnuragBasu #KasautiiZindag…",achtterjee789,"Mumbai, India","SE 
#music #cricke #bookworm #VSC #ParthSamthaan  #Sachin  #ganguli #MJ  #TomC  #arijit  #anupam
.#gratitudeisattitude✌️",425,98,31299,False,"A handwritten letter by me to this lovable gem ❤️💎 in this Covid-19 situation. 
#ParthSamthaan #AnuragBasu #KasautiiZindagiiKay @LaghateParth https://t.co/aDmTWrbLTW"
2020-03-27 12:04:20+00:00,RT @nadeeminc: Smt. @priyankagandhi Ji writes a letter to Uttar Pradesh Chief Minister Yogi Adityanath suggesting him of some necessary ste…,ajitadev,"Bengaluru, India","Innovative entrepreneur, strategist, team builder, business process modeler, thinker, in pursuit of excellence.
Tweets are personal | RT's are not endorsements.",432,1101,20932,False,Smt. @priyankagandhi Ji writes a letter to Uttar Pradesh Chief Minister Yogi Adityanath suggesting him of some necessary steps in the interest of people and assurance of support from the Congress Party to fight the Coronavirus. https://t.co/zm34GTJTUj
2020-03-27 12:04:21+00:00,RT @RahulGandhi: The lockdown will devastate our poor &amp; weak. It will deliver a heavy blow to the India we love. India isn’t black &amp; white.…,mikyroxx,"New Delhi, India","Anti-Extremism, whether right or left! Liberal. Senior Correspondent @letsdroom",371,766,20314,False,The lockdown will devastate our poor &amp; weak. It will deliver a heavy blow to the India we love. India isn’t black &amp; white. Our decisions have to be carefully thought through. A more nuanced &amp; compassionate approach is required to deal with this crisis. It’s still not too late. https://t.co/qZuoABfOMi
2020-03-27 12:04:21+00:00,Mota Bhai thinking how to beat corona with 69 others😁 https://t.co/37OPbfV9PD,basitbinsaeed,"Bengaluru, India","I'm Basit, I make bad choices and Memes",12,81,15,False,No Value Mentioned
2020-03-27 12:04:22+00:00,"RT @jnsbmi: Reason why Criminal China infected the world with  #ChineseVirus .

Foreign Investment Board braces for Chinese takeovers of di…",Being_vinay82,"New Delhi, India",🕉️  Ram Ram Ji  🙏 🚩,992,4190,206935,False,"Reason why Criminal China infected the world with  #ChineseVirus .

Foreign Investment Board braces for Chinese takeovers of distressed Australian assets https://t.co/YBEexNXwjF

#australialockdown"
2020-03-27 12:04:22+00:00,"RT @BBCBreaking: ""I've developed mild symptoms of the coronavirus""

UK PM Boris Johnson tweets video to say he is self-isolating in Downing…",skyadav187,"Allahabad, India",=,6,98,59,False,"""I've developed mild symptoms of the coronavirus""

UK PM Boris Johnson tweets video to say he is self-isolating in Downing Street, but will continue working to ""lead the national fightback against coronavirus""

https://t.co/EzOQHffe76 https://t.co/PuRHXlDXvQ"
2020-03-27 12:04:24+00:00,"RT @RanaAyyub: Battle against coronavirus: BMC asked for 50, but 250 private doctors sign up to help government hospitals in Mumbai. Most h…",singhgagan02,India,"Duniya k sabse bade star ka sabse bada Fan
#FanAccount",518,299,29886,False,"Battle against coronavirus: BMC asked for 50, but 250 private doctors sign up to help government hospitals in Mumbai. Most heartening news of the day. To our health workers,we are indebted to you ♥️ https://t.co/Pzd0criTme"
2020-03-27 12:04:24+00:00,"RT @MahilaCongress: 𝟭𝟮 𝘄𝗮𝗹𝗸 𝟮𝟬𝟬 𝗸𝗺, 𝗱𝗼𝘄𝗻 𝗵𝗶𝗹𝗹𝘀 𝗼𝗻 𝗯𝗶𝘀𝗰𝘂𝗶𝘁𝘀, 𝗼𝗻𝗲 𝗺𝗲𝗮𝗹

In four days and 200 km of walking, they were stopped at every checkp…",AsdhirDubey,"Chandigarh, India","Official Account of Deipa Asdhir Dubey
PRESIDENT, CHANDIGARH PRADESH MAHILA CONGRESS.
Advocate, Supreme Court of India, Punjab & Haryana High Court.",234,168,1716,False,"𝟭𝟮 𝘄𝗮𝗹𝗸 𝟮𝟬𝟬 𝗸𝗺, 𝗱𝗼𝘄𝗻 𝗵𝗶𝗹𝗹𝘀 𝗼𝗻 𝗯𝗶𝘀𝗰𝘂𝗶𝘁𝘀, 𝗼𝗻𝗲 𝗺𝗲𝗮𝗹

In four days and 200 km of walking, they were stopped at every checkpoint. 

Terrible Plight of migrant labourers during #LockdownWithoutPlan 

https://t.co/V5fqWXoWh2"
2020-03-27 12:04:25+00:00,RT @ANI: #WATCH We have built a concoction of cytokines which can be injected to reactivate the immune system in #COVID19 patients. We're i…,Sudhirp1993,"Mumbai, India",No Value Mentioned,52,512,6881,False,#WATCH We have built a concoction of cytokines which can be injected to reactivate the immune system in #COVID19 patients. We're in a very initial stage&amp;hope to be ready with its first set by this weekend. We have applied to the govt for an expedited review: Oncologist Vishal Rao https://t.co/vymRyTrL0R
2020-03-27 12:04:27+00:00,"RT @mvmeet: Once again Karnataka police entered into a Madrasa, chased each &amp; every peaceful &amp; lathi charged at them!

Yesterday it was in…",nirbhay_hindu,"Patna, India","देशहित सर्वोपरि
rt is not endorsement",1181,2201,11453,False,"Once again Karnataka police entered into a Madrasa, chased each &amp; every peaceful &amp; lathi charged at them!

Yesterday it was in Gokak, today it is Mudhol

When will these shameless peacefuls understand the seriousness of corona virus? https://t.co/kKf33sD7Ea"
2020-03-27 12:04:28+00:00,"RT @MrRathna: Life is Social Distancing Nanba. Always be happy 😊🙌. Video conferencing with @Psmithran
@Ravikumar_Dir @george_dop #Coronavir…",Manojku29843570,"Erode, India","ardent fan of Thalapathy Vijay 😻❤
ErOdE OTfC🔥🔥",147,389,10692,False,"Life is Social Distancing Nanba. Always be happy 😊🙌. Video conferencing with @Psmithran
@Ravikumar_Dir @george_dop #CoronavirusOutbreak
#StoryDiscussion
#SocialDistancing
#CoronaLockdown https://t.co/ijIDx6jJEB"
