created_at,full_text,screen_name,location,description,followers_count,friends_count,statuses_count,verified,full_retweet_text
2020-02-18 03:18:24+00:00,"RT @DarrenPlymouth: It's a strange world we live in.

#coronavirus #COVID19 #Wuhan https://t.co/WkjbK4zGaW",SinghaSingrauli,"Singrauli, India","Life is Great !
Cherish your family !
Live for your Country !",14,77,302,False,"It's a strange world we live in.

#coronavirus #COVID19 #Wuhan https://t.co/WkjbK4zGaW"
2020-02-18 03:18:31+00:00,"RT @news18dotcom: A total of 406 people were evacuated from China and kept at the Chhawla camp in Delhi for 17 days, were discharged after…",CaptNardesh,India,"Ex Master Marine, love clean politics, long drive in nature.",123,651,18717,False,"A total of 406 people were evacuated from China and kept at the Chhawla camp in Delhi for 17 days, were discharged after they all tested negative for #Coronavirus.

https://t.co/ssV9NgW6ia"
2020-02-18 03:18:36+00:00,"RT @PDChina: Are you one of the brave who will drive on this natural limestone bridge at Jinpen Village, SW China’s Guizhou Province? https…",narendraLalwan8,"Mumbai, India","a citizen of India ,Jai Hind",210,148,39877,False,"Are you one of the brave who will drive on this natural limestone bridge at Jinpen Village, SW China’s Guizhou Province? https://t.co/yqZlW70pfP"
2020-02-18 03:18:42+00:00,@cpimspeak 1 tweet please😶 https://t.co/Ij1iuC39Lu,dr_communal,"Kerala, India","India first always 

ട്വിറ്ററിന്റെ സ്വന്തം പല്ലെട്ടൻ

An awesome dentist 😎",1724,1014,23355,False,No Value Mentioned
2020-02-18 03:18:54+00:00,"RT @subhashkak1: The Dalai Lama: Combine Indian knowledge with education, then China will pay attention.

We have to revive ancient Indian…",_NiteshRai,"Uttar Pradesh, India","Researcher, Ethics & Artificial intelligence| University of Delhi|
VP(2016-17) MSH Hostel,
Secretary, Pol Science, ARSD College 2014-15.
RTs no endorsement",58,209,1651,False,"The Dalai Lama: Combine Indian knowledge with education, then China will pay attention.

We have to revive ancient Indian knowledge, because India is the only nation that can combine modern knowledge—materialistic sort of knowledge—with deeper knowledge.
 https://t.co/ahikMCAaCR"
2020-02-18 03:19:02+00:00,"RT @dwnews: EXCLUSIVE: China is tracking every movement of its Uighur minority to find reasons to detain them, a leaked document DW obtaine…",omarmosid,"Hyderabad, India",I like Design and Code. #LFC fan and would play ⚽️ everyday if I could.,207,747,5093,False,"EXCLUSIVE: China is tracking every movement of its Uighur minority to find reasons to detain them, a leaked document DW obtained from a whistleblower shows.

People have been arrested for growing beards or having too many children: https://t.co/78F9XKpPUc

#KarakaxList https://t.co/gc3I8Ki0at"
2020-02-18 03:19:03+00:00,"RT @davidfrawleyved: Chinese Communists remain staunch nationalists and honor Chinese culture and traditional Chinese medicine, visiting nu…",VikasThakur__,"Shimla, India",Hey there! Twitter is using me.,680,247,4178,False,"Chinese Communists remain staunch nationalists and honor Chinese culture and traditional Chinese medicine, visiting numerous local temples. Only India's Communists think anti-nationalism is a virtue and refuse to honor their own dharmic civilization that inspired China."
2020-02-18 03:19:14+00:00,"no bro, realme x50 pro and mi 10 are very different smartphones . The first one is simply just a small update on realme x2 pro while mi10 is far refined than it.And yes ther will be price difference https://t.co/7pVvMRUxX5",Rishi52848958,"Patna, India","Lazy, thinker,sweet and warm",5,33,54,False,No Value Mentioned
2020-02-18 03:19:16+00:00,"Any one in India want to go to Karachi @RanaAyyub, the peaceful nation on Earth https://t.co/xTCWS6HupK",manjupcc,"Karnataka, India",Engineer,14,323,3212,False,No Value Mentioned
2020-02-18 03:19:20+00:00,RT @TIME: This is the latest update to the novel coronavirus outbreak. For more news and updates: https://t.co/Ai40xYANu5 https://t.co/ZlA3…,intodust_in,"#IncredibleIndia, भारत ","शिवा, भारत,आ नो भद्रा: क्रतवो यन्तु विश्वत:",296,222,31728,False,This is the latest update to the novel coronavirus outbreak. For more news and updates: https://t.co/Ai40xYANu5 https://t.co/ZlA3bwEINs
2020-02-18 03:19:21+00:00,"RT @MeghUpdates: Harvard university says India has 2600 Nuclear Warheads .Chene P-K shocked .

And these Neighbours thought of us as Gandhi…",TapashishC,"Guwahati, India","Financial Consultant to Industries in NE India.
Curious Mind.
Study Economics|Politics|Defence|Nat.Sec.|Everything else.
Jeeves & Sir Humphrey know best.",548,840,19629,False,"Harvard university says India has 2600 Nuclear Warheads .Chene P-K shocked .

And these Neighbours thought of us as Gandhi Nation . We have seeds of Netaji ,Bhagat singh also . https://t.co/XiFh6uDrmm"
2020-02-18 03:19:34+00:00,This woman by speaking has effectively given up her life. This is the voice of brave person. Honor her and retweet https://t.co/3BWd63anyc,branham_bruce,"Indiana, USA","American Mutt. the blood of royals, and slaves. Irish, Scots, English, German, Cherokee, Blackfoot, and many others. my people came to North America and melted.",181,313,3069,False,No Value Mentioned
2020-02-18 03:19:36+00:00,"RT @airnewsalerts: Death toll from new #coronavirus epidemic crossed 1,700 in #China after 100 more people died in #Hubei province. In its…",kabir_514,"Dehradun, India","A billion dreams,
Only one life.
                                         
Either live counting days or a life you deserve.

https://t.co/uYJl2Pq4BU",45,322,1350,False,"Death toll from new #coronavirus epidemic crossed 1,700 in #China after 100 more people died in #Hubei province. In its daily update, the province's health commission also reported 1,933 new cases."
2020-02-18 03:19:44+00:00,"good morning :)

1st step to coronavirus shield ready for pre-clinical tests, human trials in 6 months https://t.co/DBcAA5bsll via @timesofindia",ashishc78,"Chandigarh, India",Business Consultant - Healthcare IT,386,270,2421,False,No Value Mentioned
2020-02-18 03:19:47+00:00,RT @TIME: This is the latest update to the novel coronavirus outbreak. For more news and updates: https://t.co/Ai40xYANu5 https://t.co/ZlA3…,bhandawatn,"Bengaluru, India","Simplicity is best sophistication || Freedom to fail..
Attack the problem not the person..",64,471,2320,False,This is the latest update to the novel coronavirus outbreak. For more news and updates: https://t.co/Ai40xYANu5 https://t.co/ZlA3bwEINs
2020-02-18 03:19:53+00:00,"China detains Uighurs for growing beards or visiting foreign websites, leak reveals | World news https://t.co/xZldxxRltJ",worldstopnews1,India,Latest News Headlines & Live Updates from World,9,114,2648,False,No Value Mentioned
2020-02-18 03:19:58+00:00,"7 Maldivians discharged from ITBP quarantine camp along with 200 Wuhan evacuees after testing negative for Covid-19

https://t.co/f2ekiEGSAO https://t.co/OUTExfStKk",htTweets,India,"One of India's largest media companies. Latest news from around the world. Retweets are not endorsements

Telegram: https://t.co/oRjuzAvYUY",7278663,127,689973,True,No Value Mentioned
2020-02-18 03:20:00+00:00,"RT @davidfrawleyved: Chinese Communists remain staunch nationalists and honor Chinese culture and traditional Chinese medicine, visiting nu…",Preetkamal000,India,"Make a wish.
Take a chance.
Make a change.
✍",98,51,8762,False,"Chinese Communists remain staunch nationalists and honor Chinese culture and traditional Chinese medicine, visiting numerous local temples. Only India's Communists think anti-nationalism is a virtue and refuse to honor their own dharmic civilization that inspired China."
2020-02-18 03:20:02+00:00,"What Makes the Nine Dash Line Special?: A Background
Chapter from our book - Nine Dash Line: Deciphering the South China Sea Conundrum
https://t.co/NeHV1w61fL
#China #SouthChina #ReferenceBook #Book",kwpubl,"New Delhi, India","One of the pioneers in publishing books on International Relations, Strategic Studies, Military Science, National Security, Management and Commerce.",113,160,933,False,No Value Mentioned
2020-02-18 03:20:03+00:00,"RT @AjayPandey__: #CholaEmpire under Rajendra Chola(1030 C.E) Under Rajaraja Chola &amp; his son Rajendra Chola,the Cholas had strong trading l…",sapnakhatri_16,"Himachal Pradesh, India",देश से बढ़कर कुछ नहीं 🇮🇳जय हिन्द 🇮🇳 No Dm❎️ मेरे ट्वीट्स likes ♥️में,1198,282,27177,False,"#CholaEmpire under Rajendra Chola(1030 C.E) Under Rajaraja Chola &amp; his son Rajendra Chola,the Cholas had strong trading links with #ChineseSongDynasty
The Chola navy conquered the Sri #VijayaEmpire of Indonesia &amp; Malaysia &amp; secured a sea trading route to China..
#IndianHistory 🇮🇳 https://t.co/38cnRTwR2p"
2020-02-18 03:20:05+00:00,"RT @junedyeldoz: China is killing animals to eliminate the corona virus. Maneka Gandhi, the most animal lover of our country, can go to Chi…",arunnair9847,"Mumbai, India",🇮🇳 NATIONALIST 🇮🇳 🚩 HINDU 🚩 🇮🇳 MODI  🇮🇳 BJP 🇮🇳 PHOTOGRAPHER 📸 TWEETS ARE IN PERSONAL CAPACITY. RT IS NOT ENDORSEMENT,165,573,962,False,"China is killing animals to eliminate the corona virus. Maneka Gandhi, the most animal lover of our country, can go to China to save these animals. If she wants, can also take her son Varun Gandhi. #KarnatakaBandh #AhamBrahmasmi #Nehru #Salaried #ThursdayThoughts #Chhalaang https://t.co/YckxzrR0EX"
2020-02-18 03:20:11+00:00,RT @Being_Humor: We have survived congress. 🙂,taktawala,"Gujarat, India",No Value Mentioned,93,91,22745,False,We have survived congress. 🙂 https://t.co/WqWmQVxnQv
2020-02-18 03:20:16+00:00,"RT @jleopold5: Featured Art of the Day: ""GREAT WALL OF CHINA"". Buy it at: https://t.co/wAYt8ZpTMl https://t.co/3NdingxunY",dovesclosetinc,Indiana,You will find art created by my wife and I. Handmade crafts and supplies.,7958,2501,249751,False,"Featured Art of the Day: ""GREAT WALL OF CHINA"". Buy it at: https://t.co/wAYt8ZpTMl https://t.co/3NdingxunY"
2020-02-18 03:20:27+00:00,"Relief and Joy...
Inmates at ITBP Quarantine facility, Chhawla, New Delhi happy after being declared negative in #coronavirus tests leave for their homes https://t.co/qJV8xpV0AV",DDNewslive,"New Delhi, India","Official Twitter account of DD News, the Public Broadcaster of India. हिंदी में @DDNewsHindi. Follow us on- https://t.co/hUdIpLotbt",2744896,27,158254,True,No Value Mentioned
2020-02-18 03:20:38+00:00,RT @samuelluckhurst: A Chelsea fan just shouted at Ighalo: 'Go back to China'. He turned around and just smiled at the prat. #mufc,JD__MUFC,"Ahmedabad, Gujarat , India",Mechanical Engineer 🛠🔧 / Manchester United forever #MUFC ⚽ / Team India 🏏 🇮🇳 / foodie 🍔🍕🍹/ loves #F1 🏎 / Nadal Fan 🎾 / introvert 🎭  / movies freak 🎬,334,138,34480,False,A Chelsea fan just shouted at Ighalo: 'Go back to China'. He turned around and just smiled at the prat. #mufc
2020-02-18 03:20:42+00:00,"RT @dwnews: EXCLUSIVE: China is tracking every movement of its Uighur minority to find reasons to detain them, a leaked document DW obtaine…",AmitMeh13955747,India,INDIAN,90,829,20234,False,"EXCLUSIVE: China is tracking every movement of its Uighur minority to find reasons to detain them, a leaked document DW obtained from a whistleblower shows.

People have been arrested for growing beards or having too many children: https://t.co/78F9XKpPUc

#KarakaxList https://t.co/gc3I8Ki0at"
2020-02-18 03:20:51+00:00,"RT @SuB8u: China's total grip on manufacturing supply chains now beginning to have a ripple effect...in the electronics industry for now.
#…",rparjun_,"Bengaluru, India",Techie. Wanderlust,457,1063,8449,False,"China's total grip on manufacturing supply chains now beginning to have a ripple effect...in the electronics industry for now.
#CoronaVirus
https://t.co/9p1yMTAY6T https://t.co/LjrN70UjOG"
2020-02-18 03:21:03+00:00,"RT @NaomiConrad: This story took me to Istanbul and Oslo, where I met the whistleblower who is taking a big risk by going public “Yes, it’s…",AmitMeh13955747,India,INDIAN,90,829,20234,False,"This story took me to Istanbul and Oslo, where I met the whistleblower who is taking a big risk by going public “Yes, it’s dangerous,” he told me. “But someone should speak up and tell the world what is happening (in #Xinjiang).” #uighurs https://t.co/azL92BZQu3 https://t.co/1T6LdxNUyc"
2020-02-18 03:21:03+00:00,"RT @LittleTiger0721: Pledis donated $40000 to Wuhan Tongji Hospital in 213. Thanks for you. Stay strong, fighting China.@pledisnews
@pledis…",softBeanJR,India,"dp cr. Raonboogie

A huge fan of Nu'est from India. JR is my bias. Minhyun and baekho are my bias wreckers. I stan OT5. 😍",11,144,9111,False,"Pledis donated $40000 to Wuhan Tongji Hospital in 213. Thanks for you. Stay strong, fighting China.@pledisnews
@pledisNewStar https://t.co/lRHgl37tTk"
2020-02-18 03:21:13+00:00,"RT @Frontalfire: This is not Wuhan China, this is Karachi Pakistan. 50 new cases from Gas leak reported just now. DISASTER. https://t.co/P9…",mehtakandy,"Mumbai, India",◾️Nationalist◾️NaMo_fan ◾️Business ◾️Economics ◾️Environment ◾️Politics ◾️History◾️Eternal optimist 🖤 or 🔁 ≠endorsement,126,657,8016,False,"This is not Wuhan China, this is Karachi Pakistan. 50 new cases from Gas leak reported just now. DISASTER. https://t.co/UjHO2lCeDg https://t.co/P9b5NsD61I"
2020-02-18 03:21:20+00:00,"RT @DDNewslive: Relief and Joy...
Inmates at ITBP Quarantine facility, Chhawla, New Delhi happy after being declared negative in #coronavir…",25rubybaruah,India,"25th April.Positivity rules.(From understanding comes Love).Optimist.News is addictive, Nature lover, sky gazer, sports enthusiast n I LOVE My BHARAT🇮🇳",2828,1059,80008,False,"Relief and Joy...
Inmates at ITBP Quarantine facility, Chhawla, New Delhi happy after being declared negative in #coronavirus tests leave for their homes https://t.co/qJV8xpV0AV"
2020-02-18 03:21:32+00:00,"The truth can never be hidden 
#china https://t.co/kxcQCjAhHA",AalishanMustafa,"Nagpur, India",Self study and researcher,23,33,550,False,No Value Mentioned
2020-02-18 03:21:32+00:00,"Toll from coronavirus mounts to 1,868 in China

Read @ANI Story | https://t.co/Sjgl8jy6sN https://t.co/MCvxSTo8ov",ani_digital,India,"Asian News International.Multi-media news agency,content for information platforms:TV,Internet,broadband,newspapers,mobiles https://t.co/QrqluPvffc",73718,0,25862,True,No Value Mentioned
2020-02-18 03:21:32+00:00,"RT @NaomiConrad: In Istanbul, I talked to people whose relatives have disappeared into China’s network of re-education camps. One of them i…",AmitMeh13955747,India,INDIAN,90,829,20234,False,"In Istanbul, I talked to people whose relatives have disappeared into China’s network of re-education camps. One of them is Rozinisa Tohti. After she found out her youngest sister had been sent to a re-education camp, she was heartbroken:  “I couldn’t eat and sleep for many days"" https://t.co/AomnaMZzuq"
2020-02-18 03:21:38+00:00,RT @MichaelCoudrey: BREAKING: Many leading Chinese scientists are starting to speak out and say COVID-19 (coronavirus) originated at a gove…,CaptNardesh,India,"Ex Master Marine, love clean politics, long drive in nature.",123,651,18717,False,"BREAKING: Many leading Chinese scientists are starting to speak out and say COVID-19 (coronavirus) originated at a government bioweapons research facility in Wuhan, rather than the widely-held belief that it emerged from the city's Huanan seafood markets.

https://t.co/DsxwJSAox2 https://t.co/TbshN8eDni"
2020-02-18 03:21:41+00:00,RT @WICricFan: China has begun using #chloroquine against #coronavirus with great promise this far https://t.co/y5eNyb04qF,MeraBharatMah,"Pashchim Muzaffarpur, India",Believe on Me .,946,939,57871,False,China has begun using #chloroquine against #coronavirus with great promise this far https://t.co/y5eNyb04qF
2020-02-18 03:21:45+00:00,RT @ChinaScience: Henan Agricultural University in C China’s Henan Province has developed a new rapid nucleic acid test strip that can iden…,bas5min,India,Im a teeny weeny friendly neighbourhood Bot .Im programmed to RT(for now).When I grow up I want to be an AI n I like to RT and yes RT ≠ Endorsement. 🤖🤖🤖🇮🇳,826,0,69875,False,"Henan Agricultural University in C China’s Henan Province has developed a new rapid nucleic acid test strip that can identify infections of the #COVID19 in just 3 minutes, with the detection result observable to the naked eyes, local authority said on Monday. https://t.co/wMPPhBKOt6"
2020-02-18 03:21:49+00:00,RT @snehiil: Pune based Serum Institute of India has joined hands with US firm to develop a vaccine for the #Covid19 https://t.co/4iHGyv8XKi,drakshayvyas,"Udaipur, India",#SMO @WHO #India #EndPolioForever #Rajasthan,106,84,687,False,Pune based Serum Institute of India has joined hands with US firm to develop a vaccine for the #Covid19 https://t.co/4iHGyv8XKi
2020-02-18 03:21:49+00:00,"RT @dwnews: EXCLUSIVE: China is tracking every movement of its Uighur minority to find reasons to detain them, a leaked document DW obtaine…",shrutinair1,"Pune, India","Live and Let live. How hard is that?














          Philomath 👀📚👩‍🔬👩‍🎓👩‍🏫
Dreamer 🙇‍♀️💤💭🦸‍♀️🏞
Piscean ♋💚👩‍🎨👸🧙‍♀️",78,240,2099,False,"EXCLUSIVE: China is tracking every movement of its Uighur minority to find reasons to detain them, a leaked document DW obtained from a whistleblower shows.

People have been arrested for growing beards or having too many children: https://t.co/78F9XKpPUc

#KarakaxList https://t.co/gc3I8Ki0at"
2020-02-18 03:21:54+00:00,"RT @WHO: From today, WHO will report all #COVID19 confirmed cases, including laboratory-confirmed as previously reported, and clinically di…",vricspl,India,Consulting Firm,45,34,1637,False,"From today, WHO will report all #COVID19 confirmed cases, including laboratory-confirmed as previously reported, and clinically diagnosed cases (currently only applicable to Hubei province, #China🇨🇳)

WHO Situation Report 17 February 2020 https://t.co/RqlUPOzido https://t.co/RtJiPvjR7o"
2020-02-18 03:21:54+00:00,"Oyo In The Red: With over 43000 asset partners and 1.3 million guests for 2018-19, Oyo global losses rise to $335 million due to costly China expansion.
https://t.co/7GhjzdIhu4",divaker01,"Bengaluru, India","Options Trader, Love Liberty, Equality, Blockchain & Fintech, May Evangelize Awarenes and Being Alert. Languages Expert, Kannada, Local Growth",4588,4297,39703,False,No Value Mentioned
2020-02-18 03:22:00+00:00,"RT @davidfrawleyved: Chinese Communists remain staunch nationalists and honor Chinese culture and traditional Chinese medicine, visiting nu…",A_KUMAR77,India,EVERYONE IS UNIQUE IN IT'S OWN WAY...,27,129,8205,False,"Chinese Communists remain staunch nationalists and honor Chinese culture and traditional Chinese medicine, visiting numerous local temples. Only India's Communists think anti-nationalism is a virtue and refuse to honor their own dharmic civilization that inspired China."
2020-02-18 03:22:08+00:00,RT @WICricFan: China has begun using #chloroquine against #coronavirus with great promise this far https://t.co/y5eNyb04qF,harshillukha,"Mumbai, India",Die hard fan of Joker..getting politically aware..Chai- Fan and Emraan Hashmi Fan Kohli Fan Rafa Fan,134,572,22238,False,China has begun using #chloroquine against #coronavirus with great promise this far https://t.co/y5eNyb04qF
2020-02-18 03:22:09+00:00,"RT @DDNewslive: Relief and Joy...
Inmates at ITBP Quarantine facility, Chhawla, New Delhi happy after being declared negative in #coronavir…",WaniKushal,"Pune, India",Bio under construction...check back soon!!,272,1214,7024,False,"Relief and Joy...
Inmates at ITBP Quarantine facility, Chhawla, New Delhi happy after being declared negative in #coronavirus tests leave for their homes https://t.co/qJV8xpV0AV"
2020-02-18 03:22:12+00:00,"RT @DDNewslive: Relief and Joy...
Inmates at ITBP Quarantine facility, Chhawla, New Delhi happy after being declared negative in #coronavir…",mangesh12345,"Maharashtra, India","@ananypandey @sharadhakapoor @priyankachopra @taapsse
 #crazyfan #Bollywoodlover",195,1198,10401,False,"Relief and Joy...
Inmates at ITBP Quarantine facility, Chhawla, New Delhi happy after being declared negative in #coronavirus tests leave for their homes https://t.co/qJV8xpV0AV"
2020-02-18 03:22:12+00:00,RT @Being_Humor: We have survived congress. 🙂,MahajanOmkar93,"Dombivli, India",A PROUD INDIAN🇮🇳 Dombivlikar. Music Connesieur 🥁🎼 If speaking of NATIONAL INTEREST is HYPERNATIONALISM then I am an hyper-nationalist. And a Future DOCTOR.,78,284,2486,False,We have survived congress. 🙂 https://t.co/WqWmQVxnQv
2020-02-18 03:22:24+00:00,RT @pankajcreates: Spread the word. Some more time left. all Indians from Wuhan/Hubei who intend to return urgently call hotlines +86186109…,samanwaya_et,"New Delhi, India",write on legal issues for the economic times. views expressed are personal. pacifist. Gandhian.,2484,1722,39894,False,Spread the word. Some more time left. all Indians from Wuhan/Hubei who intend to return urgently call hotlines +8618610952903 and +8618612083629 or send email to helpdesk.beijing@mea.gov.in before 1900 hours today (17 February 2020). #Coronavirius @mumbaitak
2020-02-18 03:22:29+00:00,"RT @DarrenPlymouth: It's a strange world we live in.

#coronavirus #COVID19 #Wuhan https://t.co/WkjbK4zGaW",JikkuJose,"Trivandrum, India","Mindfulness. STEM. Decentralization. Networks. Open Source. Design. Spirituality. Philosophy. Making Things. Cofounder @_StoryBrain, @Qucentis & @OrigoChain",647,1602,5143,False,"It's a strange world we live in.

#coronavirus #COVID19 #Wuhan https://t.co/WkjbK4zGaW"
2020-02-18 03:22:33+00:00,There is no human rights violations in Kashmir.Kashmir is so peaceful today due to 370.why don't you be critical for all the voilence in Hong Kong.anybody spreading lies and hatred like you did can't be given entry into my country.pls go China once after criticizing China govt https://t.co/EklMKjvKD9,pathakr79,"Bengaluru, India","Engineer by profession, Nationalist by heart, Proud Hindu, Corruption Intolerant",2377,2277,15744,False,No Value Mentioned
2020-02-18 03:22:34+00:00,"@jaideepb India should first focus on catering to local market to reduce imports to bare minimum. Even if India manages to achieve zero trade deficit with China, the savings shall enable her to make investments required to become a global manufacturing power.",Shonkho,"Mumbai, India",Independent thinker with strong interest in current affairs and on everything under the sun. Statements made here are my own and I stand by them.,2305,4612,6538,False,No Value Mentioned
2020-02-18 03:22:36+00:00,RT @WICricFan: China has begun using #chloroquine against #coronavirus with great promise this far https://t.co/y5eNyb04qF,Justbeingriema,"Mumbai, India","ᵃʳᶜʰⁱᵗᵉᶜᵗ ʷⁱᵗʰ ᵃ ˡᵒᵛᵉ ᶠᵒʳ ᶜᵒᵒᵏⁱⁿᵍ...ᶠᵒᵒᵗᵇᵃˡˡ...
ʰⁱˢᵗᵒʳʸ... ᵗᵉᵃ... ʷʰⁱˢᵏᵉʸ
 ᵇᵉˡⁱᵉᵛᵉ ⁱⁿ ˢⁱᵐᵖˡᵉ ˡⁱᵛⁱⁿᵍ. ʰᵃᵖᵖʸ ᵇʸ ᵗʰᵉ ˢᵉᵃ.",787,826,12226,False,China has begun using #chloroquine against #coronavirus with great promise this far https://t.co/y5eNyb04qF
2020-02-18 03:22:37+00:00,RT @MoHFW_INDIA: Hon’ble Prime Minister appreciates efforts beyond call of duty: @drharshvardhan said while handing over the letters of app…,Shankitkumar01,India,The only thing you know about me is nothing,21,57,682,False,"Hon’ble Prime Minister appreciates efforts beyond call of duty: @drharshvardhan said while handing over the letters of appreciation to 10 Doctors &amp; Nursing Officers, part of the #Wuhan evacuation team.
#COVID19
#nCoV_2019

https://t.co/OqtANccASb https://t.co/QkSjDWG8xj"
2020-02-18 03:22:39+00:00,"RT @DDNewslive: Relief and Joy...
Inmates at ITBP Quarantine facility, Chhawla, New Delhi happy after being declared negative in #coronavir…",lolsalaam,"Hyderabad, India","Hindu Nationalist. Telangana/Hyderabad, RTs == sharing..",981,847,89129,False,"Relief and Joy...
Inmates at ITBP Quarantine facility, Chhawla, New Delhi happy after being declared negative in #coronavirus tests leave for their homes https://t.co/qJV8xpV0AV"
2020-02-18 03:22:42+00:00,RT @evankirstel: Coronavirus outbreak used by hackers to spread malware: One sophisticated attack method takes advantage of the trusted Wor…,anuj_vyas,India,"Digital Influencer, Technology Consultant, helping clients in adopting #cloud #iot #blockchain #AI. Nature Lover and a Fan of Game of Throne . Views are my own.",352,343,5606,False,Coronavirus outbreak used by hackers to spread malware: One sophisticated attack method takes advantage of the trusted World Health Organization name to distribute an attachment that will install the AgentTesla Keylogger. https://t.co/8m8qIXMZAC https://t.co/mudBiSh9zz
2020-02-18 03:22:44+00:00,"RT @subhashkak1: The Dalai Lama: Combine Indian knowledge with education, then China will pay attention.

We have to revive ancient Indian…",sandeep21031983,"GGN & Rajasthan, India",Java Expert     :     Techno Functional                                       RTs are not endorsed.,1161,441,335166,False,"The Dalai Lama: Combine Indian knowledge with education, then China will pay attention.

We have to revive ancient Indian knowledge, because India is the only nation that can combine modern knowledge—materialistic sort of knowledge—with deeper knowledge.
 https://t.co/ahikMCAaCR"
