created_at,full_text,screen_name,location,description,followers_count,friends_count,statuses_count,verified,full_retweet_text
2020-01-22 14:50:38+00:00,"What is coronavirus, and should Americans be worried? What to know about the outbreak in China https://t.co/zv5R5WjoM9 via @usatoday",Rhew23,"Indianapolis, IN","Dog lover. Mental.#Resistance, #Bluewave Photo phreak, confused. ..where did the good people go?#Trumpliesalways #Fuck T Rump #ChallengeforFlint",462,1566,3692,False,No Value Mentioned
2020-01-22 14:40:32+00:00,RT @Independent: Inside the US town attempting to contain deadly coronavirus https://t.co/lkZwCisoaQ,ReecheshJC,"#Beautiful but unfortunately #corrupt #INDIA, wanna live on #VeganEarth, #HoverHomes and #SpacePlanes in future",NaturistNudologistR&DConsultantTechnovatorCreativePoet #Space #Solar #Smart #IEEE #IIoT_AI_BI_CI #Astronomy #Mathemagic #SciTech #DgMkt #Actuary #Art #TouchLove,959,4987,31594,False,Inside the US town attempting to contain deadly coronavirus https://t.co/lkZwCisoaQ
2020-01-22 14:14:04+00:00,"RT @2HawkEye2020: Update: First Wuhan Coronavirus Patient is Identified in the United States

A person in Washington State is infected with…",Cruzinmrs,Indiana,"NYC born & raised currently living in Indiana. Moderate Democrat and proud Boriqua, Mother, wife & grandmom. I tell it like it is! #byebyetrump    #nevertrump",681,1055,13793,False,"Update: First Wuhan Coronavirus Patient is Identified in the United States

A person in Washington State is infected with a new respiratory virus. The outbreak began at a market in China and now has spread to at least four other countries.

#WuhanOutbreak

https://t.co/lz0Ou73wNJ https://t.co/TuqfIKW0kJ https://t.co/noeQHzx4t5"
2020-01-22 14:02:07+00:00,"Wuhan Coronavirus: US Confirms First Case of SARS-Like Infection as Death Toll Reaches Six in China
https://t.co/mo3p5NvgZW
#WuhanCoronavirus #SARSvirus #China #Infection #virus",latestly,"Mumbai, India","https://t.co/U4rHOvnjZj focuses on the What, When, Who and How of a trending story, and helps readers with analyses that go beyond the domain of news.",57574,340,103616,True,No Value Mentioned
2020-01-22 14:15:02+00:00,RT @sidbshrestha: Ensure these key behaviours are followed as precaution #C4D #RiskCommunication via/@biharmatters #WuhanCoronavirus https:…,jai_amma,"Chennai, India","Director, Communication at the Swaminathan Foundation @mssrf. Former @unicef @icrisat @indiatoday. Passionate about #devcomm #parenting #gender #scicomm",3644,1003,16231,False,Ensure these key behaviours are followed as precaution #C4D #RiskCommunication via/@biharmatters #WuhanCoronavirus https://t.co/IDJc6GSghu
2020-01-22 14:53:56+00:00,RT @Kaalateetham: Over 4 lakh children not given polio drops in Kerala; Malappuram shows resistance | Pulse Polio drops administration in K…,manojtahini,"Coimbatore, India",Movie Buff and a Foodie,686,913,20615,False,"Over 4 lakh children not given polio drops in Kerala; Malappuram shows resistance | Pulse Polio drops administration in Kerala

@CMOKerala why are you allowing this nonsense?? Are you waiting for an epidemic of polio ?? https://t.co/qRQouPj8r5"
