created_at,full_text,screen_name,location,description,followers_count,friends_count,statuses_count,verified,full_retweet_text
2020-03-27 12:00:00+00:00,"Thermal scanners can detect people with fever, however in cases of infection where the patient has not developed fever, it will go undetected. 
#COVID19outbreak #Coronavirus #CoronavirusPandemic https://t.co/6SKkoyMyV9",medimarvals,"New Delhi, India","India has the best medical clinics with top-class equipment, human services and specialists.",25,41,2488,False,No Value Mentioned
2020-03-27 12:00:01+00:00,"RT @HalaGorani: As #coronavirus symptoms can take up to 2 weeks to appear, one wonders how many people in the Johnson government will need…",SherryJPhillips,"Bangalore, India","Desk Editor @Reuters Motto: Carpe diem. I speak for myself, not my employer. No endorsements, no plugs.",436,678,4073,False,"As #coronavirus symptoms can take up to 2 weeks to appear, one wonders how many people in the Johnson government will need to self-quarantine now that the Prime Minister himself has tested positive?"
2020-03-27 12:00:03+00:00,RT @ANI: United Kingdom Prime Minister Boris Johnson tests positive for #COVID19 https://t.co/ZgQj4gV7sz,vi_raj,"Ahmadabad City, India",No Value Mentioned,48,409,602,False,United Kingdom Prime Minister Boris Johnson tests positive for #COVID19 https://t.co/ZgQj4gV7sz
2020-03-27 12:00:05+00:00,God Bless https://t.co/W4SrC3IoNV,1gregwalden,Detroit/Indiana/Texas,A Libra - JEW -Only The Truth - GOD IS UNCONDITIONAL LOVE ! Receive It & Share It-  NO DM's,1481,4998,22646,False,No Value Mentioned
2020-03-27 12:00:05+00:00,"RT @PiyushGoyal: Amidst the lockdown, 11 units get approved at Gujarat International Finance Tec-City's Special Economic Zone virtually via…",rajende61671926,"New Delhi, India",No Value Mentioned,123,15,29111,False,"Amidst the lockdown, 11 units get approved at Gujarat International Finance Tec-City's Special Economic Zone virtually via teleconferencing.

Enabling businesses to obtain approvals online, this move has significantly enhanced the Ease of Doing Business.

https://t.co/GVQ7q0npk3"
2020-03-27 12:00:06+00:00,RT @rohini_mohan: I spoke to a Delhi doctor who is in quarantine after showing #COVID19 symptoms. He was screening patients for Coronavirus…,venussharma1893,Old India ,"Ajit Kumar Banerjee, Byomkesh Bakshi’s friend and flatmate, will write his biography one day.",181,367,7306,False,"I spoke to a Delhi doctor who is in quarantine after showing #COVID19 symptoms. He was screening patients for Coronavirus for 8 days without protective gear. ""The hospital didn't want to waste masks on us,"" he said. #HealthCareWorkers
https://t.co/LrsPoVhVL9"
2020-03-27 12:00:06+00:00,RT @c_aashish: Chinese Virus is canceled. Deals struck.,akashkedia2002,"Mumbai, India",PE investor | CA (AIR 12) | All views / tweets are personal.,110,402,4755,False,Chinese Virus is canceled. Deals struck. https://t.co/9CIXnduqkj
2020-03-27 12:00:06+00:00,"RT @ani_digital: Spain sends back China's coronavirus testing kits after they fail to work

Read @ANI Story | https://t.co/xmU0O3BNBc https…",chauhanrohit10,"Delhi , India","Air Force Veteran | Nationalist and follower of Sanatan Dharma | All Tweets-Retweets are personal opinions and convey no disrespect to anybody.
Jai Hind 🇮🇳",189,567,27843,False,"Spain sends back China's coronavirus testing kits after they fail to work

Read @ANI Story | https://t.co/xmU0O3BNBc https://t.co/IbeP3jvfqj"
2020-03-27 12:00:06+00:00,"RT @mvmeet: Once again Karnataka police entered into a Madrasa, chased each &amp; every peaceful &amp; lathi charged at them!

Yesterday it was in…",makkana138,India,"RTs are not Endorsements,
चमन तुमसे इबारत है ,बहारे तुमसे जिन्दा है।
तुम्हारे सामने फूलों से मुरझाया नहीं जाता ।।",1618,869,164437,False,"Once again Karnataka police entered into a Madrasa, chased each &amp; every peaceful &amp; lathi charged at them!

Yesterday it was in Gokak, today it is Mudhol

When will these shameless peacefuls understand the seriousness of corona virus? https://t.co/kKf33sD7Ea"
2020-03-27 12:00:07+00:00,RT @Number10cat: People will inevitably ask how Boris Johnson was tested for coronavirus given he has mild symptoms and wasn’t admitted to…,HARDIKS,"Mumbai, India","IT Technology enthusiast, Space Technology explorer, Narendra Modi supporter & highly impressed by his vision of India & style of working",621,354,154867,False,"People will inevitably ask how Boris Johnson was tested for coronavirus given he has mild symptoms and wasn’t admitted to hospital.
Every test that leads to someone isolating is good for us all; regular testing of NHS workers must be prioritised.
Get well soon Prime Minister."
2020-03-27 12:00:08+00:00,"RT @ANI: Odisha: Volunteers of People for Animals feed monkeys in Khandagiri, Bhubaneswar. Aditishi, a volunteer says, ""We feed them everyd…",Manijha7867,"New Delhi, India","Social service
 जिंदगी वही जो दुसरो के काम आये",275,293,6596,False,"Odisha: Volunteers of People for Animals feed monkeys in Khandagiri, Bhubaneswar. Aditishi, a volunteer says, ""We feed them everyday as during the lockdown no tourists come&amp;the monkeys depend on them for food. I will appeal to all to feed stray animals."" #COVID19 https://t.co/9vnv2Swz5q"
2020-03-27 12:00:09+00:00,"RT @HavasMedia: We are currently living in truly unprecedented times, where the lives of people, companies, &amp; communities are being totally…",pawan12patre,"Nagpur, India","#WRITER  || #POET || #CREATIVEPRENEUR
-
#AUTHOR  @themajormantra 🍁",743,2068,12143,False,"We are currently living in truly unprecedented times, where the lives of people, companies, &amp; communities are being totally disrupted. How has the role media plays changed? Learn more in our behavior reports:
https://t.co/zinB8WIwQy

#covid19 #meaningfulmedia https://t.co/xr79vFlKgc"
2020-03-27 12:00:09+00:00,RT @narendramodi: Today @RBI has taken giant steps to safeguard our economy from the impact of the Coronavirus. The announcements will impr…,fyogesh,"PUNE ,Maharashtra,India.","D. N. B. (ORTHO), D. ORTHO, M. Ch. (ORTHO) {USAIM}. 
Orthopaedic surgeon practising in pune since 12+ years.",78,128,138,False,"Today @RBI has taken giant steps to safeguard our economy from the impact of the Coronavirus. The announcements will improve liquidity, reduce cost of funds, help middle class and businesses. 
https://t.co/pgYOUBQtNl"
2020-03-27 12:00:09+00:00,"RT @EXtra_ORrdinary: Why..?
Oh ! I got it ! 
You leader pappu have to go Bangkok..??🙄

And being in RSS is most amazing thing!!🙏🏼",SnowWhite_1379,India,No Value Mentioned,361,402,8776,False,"Why..?
Oh ! I got it ! 
You leader pappu have to go Bangkok..??🙄

And being in RSS is most amazing thing!!🙏🏼 https://t.co/5uiPSryzAx"
2020-03-27 12:00:11+00:00,RT @RahulGandhi: The lockdown will devastate our poor &amp; weak. It will deliver a heavy blow to the India we love. India isn’t black &amp; white.…,RaashidHafeez,Basmath Maharashtra India,‘अगर बचेंगे....तो और भी लड़ेंगे’ tweets are personal ! politics is all about the patience game. (Congressmen),245,486,1278,False,The lockdown will devastate our poor &amp; weak. It will deliver a heavy blow to the India we love. India isn’t black &amp; white. Our decisions have to be carefully thought through. A more nuanced &amp; compassionate approach is required to deal with this crisis. It’s still not too late. https://t.co/qZuoABfOMi
2020-03-27 12:00:11+00:00,RT @gbctwit: @tvsmotorcompany &amp;  Sundaram Clayton Ltd will spend ₹30 cr to support nationwide efforts to combat #COVID19.  The funding will…,VinodBabuG1,"Bengaluru, India",No Value Mentioned,56,149,287,False,"@tvsmotorcompany &amp;  Sundaram Clayton Ltd will spend ₹30 cr to support nationwide efforts to combat #COVID19.  The funding will come via Srinivasan Services Trust, the social arm of two cos. @businessline @Vijayabaskarofl @CMOTamilNadu #TN_Together_AgainstCorona #CoronaLockdown https://t.co/HHB4aoei6m"
2020-03-27 12:00:12+00:00,Another example showcasing how coexistence is important for us to consider...only few days so many examples #COVID2019 #ResetPoint https://t.co/qgBOji7moN,sid06,"New Delhi, India",Assistant Manager @HyundaiIndia;,268,269,1008,False,No Value Mentioned
2020-03-27 12:00:13+00:00,"aimim Bahadurpura MLA @mohdmoazamkhan along with  Corporator @hussaini_pasha Distributed 500 bags of(essential) grocery items among the needy people under Jahanuma Division HYD

NOTE:Moazam Khan appealed Public many times to make social distancing while distributing the groceries https://t.co/rfFB55BvVi",pathan_sumaya,India ,"§lave Of Beloved😍ﷺ
Daughter/sister/frnd/single/AIMIM social Media Administrator/'Right to speak is my Fundamental Right i take as my power😎!
 #AIMIM updates!❤",28311,2563,27145,False,No Value Mentioned
2020-03-27 12:00:13+00:00,"What we have always taken for granted, almost seems like a luxury now... 🙏

#yamunaghat #delhi #throwback #friday #weekend #LockdownQuestions #IndiaFightsCorona #COVID #COVID19 #indialockdown https://t.co/sGLXcZTg3H",theCanonFanboy,"New Delhi, India","📷 𝐏𝐡𝐨𝐭𝐨𝐠𝐫𝐚𝐩𝐡𝐞𝐫
📽️ 𝐘𝐨𝐮𝐓𝐮𝐛𝐞𝐫
✍️  𝐖𝐫𝐢𝐭𝐞𝐫
🏖️ 𝐓𝐫𝐚𝐯𝐞𝐥 𝐁𝐥𝐨𝐠𝐠𝐞𝐫
https://t.co/da1ppzMwJu",1560,209,11551,False,No Value Mentioned
2020-03-27 12:00:13+00:00,RT @Vijayabaskarofl: #UPDATE: The first exclusive Govt hospital for #corona in Tamilnadu is setup at Omandurar. The initial capacity was 35…,ashokhavarshini,"Chennai, India",'Running' successfully in a newsroom near you,20149,788,1165,False,#UPDATE: The first exclusive Govt hospital for #corona in Tamilnadu is setup at Omandurar. The initial capacity was 350 which is now scaled up to a 500 bedded hospital. @CMOTamilNadu @MoHFW_INDIA #TNHealth #vijayabaskar #TN_Together_AgainstCorona
2020-03-27 12:00:14+00:00,RT @1AmyChew: #Indonesia's city of #Tegal is the first city to declare a full lockdown for four months starting March 30- July 2020.,docdhawad,India,Indian..Doctor..Bioinformatics..Healthcare Entrepreneur..Foodie..Love to talk about politics & security,3663,584,210787,False,#Indonesia's city of #Tegal is the first city to declare a full lockdown for four months starting March 30- July 2020. https://t.co/2ulirjWvAn
2020-03-27 12:00:14+00:00,"RT @NewIndianXpress: Is going into a lockdown the answer to beat #Coronavirus? Here's what India has to say!
Follow LIVE updates: https://t…",TnieRathna,"Mysore, India",No Value Mentioned,219,115,2320,False,"Is going into a lockdown the answer to beat #Coronavirus? Here's what India has to say!
Follow LIVE updates: https://t.co/qYR6W2IIx5 https://t.co/nIqZK7E2Tf"
2020-03-27 12:00:14+00:00,"RT @mvmeet: First Corona death reported in Tumkur, Karnataka

Now the 3 wives &amp; 16 children of the deceased are kept in observation

What d…",me2us2me,"New Delhi, India",यदा यदा ही धर्मस्य ग्लानिर्भवति भारतI अभ्युत्थानमधर्मस्य तदात्मानम सृज्याहम II परित्राणाय साधूनां विनाशाय च दुष्कृताम I धर्म संस्थापनार्थाय संभवामि युगे युगे II,240,201,123517,False,"First Corona death reported in Tumkur, Karnataka

Now the 3 wives &amp; 16 children of the deceased are kept in observation

What disturbs me is he stayed in Delhi's Jamia Masjid for 5 days

Yes, the virus is spreading like wild fire bcoz of these irresponsible men

Plz stay at home"
2020-03-27 12:00:14+00:00,RT @latestly: Himachal Pradesh Cuts Curfew Relaxations From 6 to 3 Hours Per Day: Coronavirus Outbreak Live News Updates | #Coronavirus #CO…,RT_Himachal,"Himachal Pradesh, India","A tweet bot,
retweets, #himachal , #himachalPradesh made by @paharihacker",4377,5,486845,False,"Himachal Pradesh Cuts Curfew Relaxations From 6 to 3 Hours Per Day: Coronavirus Outbreak Live News Updates | #Coronavirus #COVID19 #HimachalPradesh @jairamthakurbjp 
https://t.co/evucFAvntb"
2020-03-27 12:00:15+00:00,RT @DrHarjitBhatti: We doctors request PM @narendramodi to address this issue in today’s 8 PM address. Ask people to don’t force doctors to…,arsh11kaur,"Chandigarh, India","Correspondent @News18Punjab Writer, translator, filmmaker, artist, ex @htTweets 
Views and RTs are personal!",631,862,1278,False,"We doctors request PM @narendramodi to address this issue in today’s 8 PM address. Ask people to don’t force doctors to vacate rented houses or hostels. Also in view of lockdown, transportation for healthcare workers to hospitals must be sorted out. #DoctorsSpeakUp https://t.co/ip86R8cxol"
2020-03-27 12:00:16+00:00,"RT @ZeeTvCinemalu: Darling 🙏 
 #Prabhas 
#Corona #COVID19  #ZeeCinemalu https://t.co/17bdCODnFX",mounish_bunny,"Karimnagar, India",💖Prabhas,30,18,3104,False,"Darling 🙏 
 #Prabhas 
#Corona #COVID19  #ZeeCinemalu https://t.co/17bdCODnFX"
2020-03-27 12:00:16+00:00,RT @Meherr_: Azim Premji donates three folds more than what the government alloted to the healthcare to combat COVID 19. Cute.,tikulli,"Delhi, India Ghaziabad, UP","Author | Blogger | Poet | Artist| Storyteller | Wanderer | Dreamer |  My poetry books 
https://t.co/h1llZVNQM8…",2307,1318,41777,False,Azim Premji donates three folds more than what the government alloted to the healthcare to combat COVID 19. Cute.
2020-03-27 12:00:16+00:00,"RT @BorisJohnson: Over the last 24 hours I have developed mild symptoms and tested positive for coronavirus.

I am now self-isolating, but…",hari_cr_,"Mayiladuthurai, India",OTFC MAYILADUTHURAI | 🙏🏻என்றும் தளபதி வழியில்🙏🏻 | ♥️RONALDO♥️ | #spreadThalapathyism✨♥️,75,125,1906,False,"Over the last 24 hours I have developed mild symptoms and tested positive for coronavirus.

I am now self-isolating, but I will continue to lead the government’s response via video-conference as we fight this virus.

Together we will beat this. #StayHomeSaveLives https://t.co/9Te6aFP0Ri"
2020-03-27 12:00:17+00:00,RT @RahulGandhi: The lockdown will devastate our poor &amp; weak. It will deliver a heavy blow to the India we love. India isn’t black &amp; white.…,yvishaly,"Varanasi, India","in this era of religions and ethinicity,i try to be a human,a mere human.",117,279,9376,False,The lockdown will devastate our poor &amp; weak. It will deliver a heavy blow to the India we love. India isn’t black &amp; white. Our decisions have to be carefully thought through. A more nuanced &amp; compassionate approach is required to deal with this crisis. It’s still not too late. https://t.co/qZuoABfOMi
2020-03-27 12:00:17+00:00,"RT @akash207: Shame on people who are false spreading MS Dhoni’s news of donating only Rs. 1 Lakh.

Pune based NGO was raising 12.5 Lakhs &amp;…",akhhi11,"Maharashtra, India","Student, Ms Dhoni ❤,
proud indian🇮🇳",228,1196,2641,False,"Shame on people who are false spreading MS Dhoni’s news of donating only Rs. 1 Lakh.

Pune based NGO was raising 12.5 Lakhs &amp; he just filled the short amount which was Rs. 1 Lakh.

MS Dhoni doesn’t believe in self talking or photo op while donating. #Covid"
2020-03-27 12:00:19+00:00,RT @Jo_Tovey: imagine risking it all for a Melbourne beach,free2speakk_IND,भारत/INDIA,"Enco🤝urage Press Freedom (Writer, Poet/Journalist). volunteer campaigner Press Freedom* & member at HostWriterOrg(कविता/गजल /-: पूर्णत कापीराइट राजेंद्रराज ©)",155,1438,8565,False,imagine risking it all for a Melbourne beach https://t.co/qnypr4lME7
2020-03-27 12:00:21+00:00,@madiustangau @UPKOTuaran @UPKOMalaysia @FelixJSaang @JanniJuliana @AlexWalzico @nelsonwens @MTISabah China lied since inception on wuhan virus,SatishMahaldar,"New Delhi, India",research,197,1263,14384,False,No Value Mentioned
2020-03-27 12:00:22+00:00,RT @vinayak_jain: The WHO will raise $675 million to fighting Corona. China has given just $20 million (less than 3%) to the fund! Even Kuw…,snjusimple,india,"INDIAN, AGRI PRODUCT PRODUCER AND TRY TO BE GOOD SON",109,1686,2897,False,"The WHO will raise $675 million to fighting Corona. China has given just $20 million (less than 3%) to the fund! Even Kuwait has given $40 million.

A nation with $3.3 trillion reserves gives $20 million. Worst of humanity!"
2020-03-27 12:00:22+00:00,"RT @NafratHatao: #LockdownWithoutPlan
Why has everything been unplanned for which Modi said "" Effective from 12:00 AM? Be is demonetization…",AbdurRahman_Hyd,"Hyderabad, India",No Value Mentioned,380,451,2789,False,"#LockdownWithoutPlan
Why has everything been unplanned for which Modi said "" Effective from 12:00 AM? Be is demonetization, GST or this Corona Virus Lockdown. https://t.co/kuKX5llmMo"
2020-03-27 12:00:23+00:00,"UK PM Boris Johnson tests positive for coronavirus COVID-19 | World News  
https://t.co/ByLc8nFU7U",Uditgupta_ug,"Jaora, India",https://t.co/ZJBw54W97D,29,20,28250,False,No Value Mentioned
2020-03-27 12:00:24+00:00,RT @dpradhanbjp: Took stock of the precautionary measures being taken by our personnel working to supply essential petroleum products in th…,AmitMitraBJP,"Odisha, India","Grandson of Late.Biren Mitra, Ex-Chief Minister of Odisha.

Me with my Idol Sri.@dpradhanbjp Ji.

A RSS Swayam Sevak.

Views are Personal, RTs Not Endorsement.",609,619,16939,False,Took stock of the precautionary measures being taken by our personnel working to supply essential petroleum products in these difficult times. Urged all colleagues to use hand sanitizers and maintain social distancing to avoid any risk of infection from #Covid-19.
2020-03-27 12:00:25+00:00,"RT @BorisJohnson: Over the last 24 hours I have developed mild symptoms and tested positive for coronavirus.

I am now self-isolating, but…",itsmevsv,"Nagercoil, India",DOC💉Thalapathy🕊️Always MSD🏏HipHopAdhi🎵 CRIC freak+~உசுப்பேத்துரவன்கிட்ட உம்முனும் கடுப்பேத்துரவன்கிட்ட கம்முனும் இருந்துட்டா வாழ்க ஜம்முன்னு இருக்கும்🤗,238,54,28866,False,"Over the last 24 hours I have developed mild symptoms and tested positive for coronavirus.

I am now self-isolating, but I will continue to lead the government’s response via video-conference as we fight this virus.

Together we will beat this. #StayHomeSaveLives https://t.co/9Te6aFP0Ri"
2020-03-27 12:00:26+00:00,"RT @galattadotcom: I am safe. So please be safe.... 
Doctor @iamsethuraman's recent #Coronavirus awareness video will bring tears in your e…",localboyzzsurya,"Chennai, India",My life..🚶💪 My attitude..🐯🐯 love my Job..🔧🔩🛠..,83,1357,1014,False,"I am safe. So please be safe.... 
Doctor @iamsethuraman's recent #Coronavirus awareness video will bring tears in your eyes  😭😭 

#Sethuraman #RIPSethuraman #RIPDrSethu https://t.co/RCtiJWmELo"
2020-03-27 12:00:29+00:00,RT @66beelzebub: First ever lockdown: https://t.co/W3CBonYM7S,VCtells,"Hyderabad, India","My story is Everyone's Story...I Change, I Evolve...",99,588,421,False,First ever lockdown: https://t.co/W3CBonYM7S
2020-03-27 12:00:32+00:00,UK Prime Minister @BorisJohnson is tested +ve for #COVID19 with mild symptoms https://t.co/Bs2ofSfiQR,Lokesh_Thiagu,"Chennai/Namakkal, India",Project Scientist Civil in NIOT MoES GoI ❤🌎 Human'e'    RT's ≠ Endorsement,65,1394,4313,False,No Value Mentioned
2020-03-27 12:00:32+00:00,Praying for all 🙏🙏 https://t.co/Xyc3P8AliV,ShrrinG,India,"सब कुछ सीखा हमने, पर सीखी न ...........….

After spending 10+ years here, I don't think I need a Bio..",6601,376,161602,False,No Value Mentioned
2020-03-27 12:00:34+00:00,"RT @AshishXL: Superb #AhsaanQureshi giving a very very important message here about Corona. Don't miss it

Please RT https://t.co/jq3EoK5a3t",kulkarnirkrk2,"Bengaluru, India","Falsehood flies, and the Truth comes limping after it",107,1146,3251,False,"Superb #AhsaanQureshi giving a very very important message here about Corona. Don't miss it

Please RT https://t.co/jq3EoK5a3t"
2020-03-27 12:00:35+00:00,"RT @TIinExile: WRONG!

Cholera cannot be called 'Asiatic Cholera' because the origin of ""True Cholera"" was NOT in India or Asia.

The earli…",neelendranath,"Patna, India","#Innovation for Impact at @InnovitasCo - Globalising India's startup ecosystem at @IndiaGlocal  

#Travel : 57 countries so far @travelwithneel  From #Patna",1164,540,60955,False,"WRONG!

Cholera cannot be called 'Asiatic Cholera' because the origin of ""True Cholera"" was NOT in India or Asia.

The earliest known occurrence of Cholera on a wide scale was in Bologna, Italy. Cholera pandemic of 1817 was spread into India by European troops posted in Calcutta https://t.co/B9utRgF56P"
2020-03-27 12:00:36+00:00,RT @BorisJohnson: Please join me for an important update on #coronavirus #StayHomeSaveLives https://t.co/QSlIOIaYsF,yasirshalla,"Srinagar, India","From the land of Indian Occupied #Kashmir

He who fears he will suffer, already suffers because he fears.”",694,634,2792,False,Please join me for an important update on #coronavirus #StayHomeSaveLives https://t.co/QSlIOIaYsF
2020-03-27 12:00:36+00:00,Get well soon 🙏 @BorisJohnson https://t.co/6BeaLXyCCk,vikashmodi381,india,"A visionary entrepreneur,true nationalist and proud India.
I m not politician with so much political knowledge and intrest",139,472,1925,False,No Value Mentioned
2020-03-27 12:00:37+00:00,RT @Tejasvi_Surya: ‘Bengaluru South Coronavirus Task Force’ helpline will assist senior citizens and other vulnerable people during the 21…,rg_pavan,"Hyderabad, India","Software Engineer @Capricorn Systems PVT LTD ,  
keen on Microsoft Technologies,
Cricket Fan, #Rahul Dravid #Role Modle, #Music , #Movies",167,421,6384,False,"‘Bengaluru South Coronavirus Task Force’ helpline will assist senior citizens and other vulnerable people during the 21 day lock down. 

Our 1500+ strong volunteer network with local police &amp; administration will help you. 

The one number you need for next 20 days - 99464 99464. https://t.co/8oRSRPLbub"
2020-03-27 12:00:37+00:00,@BorisJohnson China lied people died,Jiman94,India,"Carpe diem,
piracy and popcorn,
corporate dropout, 
searching",10,76,344,False,No Value Mentioned
2020-03-27 12:00:38+00:00,"Today, 19 samples were tested and all are found negative. Till now, total 152 suspected COVID19 cases were investigated in which 149 samples are found negative &amp; 3 samples found positive: Health Department, Himachal Pradesh",ShimlaTimes,India,"Official Twitter handle of https://t.co/rECF0oBCYo, news portal published from Shimla, India.",5931,230,44633,False,No Value Mentioned
2020-03-27 12:00:39+00:00,"RT @TIinExile: WRONG!

Cholera cannot be called 'Asiatic Cholera' because the origin of ""True Cholera"" was NOT in India or Asia.

The earli…",anandzigzag,India,"Journalist, Previously-Rajasthan Patrika, ETV, News 24. Sports and Entertainment. Music lover. Humanist. RTs not endorsements",139,1394,12337,False,"WRONG!

Cholera cannot be called 'Asiatic Cholera' because the origin of ""True Cholera"" was NOT in India or Asia.

The earliest known occurrence of Cholera on a wide scale was in Bologna, Italy. Cholera pandemic of 1817 was spread into India by European troops posted in Calcutta https://t.co/B9utRgF56P"
2020-03-27 12:00:39+00:00,"RT @BUSHINDIA: Due to visiting preachers two in Madurai contact,  two in Erode now tested positive for corona!",GMurugadasssan,"Pondicherry, India","Iam ALL India BJP Member from 2014,My renewed BJP Membership is 1111989850, I want BJP Must rule whole India, One Party one Nation is my Principle",42,413,2290,False,"Due to visiting preachers two in Madurai contact,  two in Erode now tested positive for corona! https://t.co/nC7cVSqCNI"
2020-03-27 12:00:39+00:00,"RT @rose_k01: This is how China treated #Wuhan citizens who asked for help ""China has a large population, there’ll be no difference without…",santosh4rks,"Ballia, UP, India","🕉Indian Defence First, 
😀 Live and Let Live 😀

🇮🇳 'भारत माता की जय' 🇮🇳       🚩सनातन धर्म सर्वश्रेष्ठ 🚩",3296,3778,54851,False,"This is how China treated #Wuhan citizens who asked for help ""China has a large population, there’ll be no difference without you!"" a sick Wuhan resident was told by a community staff #ChineseVirus19 #ChineseVirus #ChinaVirus #CoronavirusOubreak #BoycottChina #COVID2019 https://t.co/wmxKBthLM1"
2020-03-27 12:00:40+00:00,RT @NEWS9TWEETS: #COVID19outbreak: No social distancing was seen in #MIMS outside the labour ward. While hundreds of pregnant women from #M…,hublimandi,"Dharwad, India","Anything and everything about Hubballi, Dharwad, Karnataka
RTs not endorsements.
For complaints in your area, WhatsApp HDMC on 8277803778
hi@hublimandi.com",4249,124,27723,False,"#COVID19outbreak: No social distancing was seen in #MIMS outside the labour ward. While hundreds of pregnant women from #Mandya visit this hospital, their family members were seen outside the ward maintaining no social distance. https://t.co/vEb1vKeQgS"
