created_at,full_text,screen_name,location,description,followers_count,friends_count,statuses_count,verified,full_retweet_text
2020-03-14 23:29:00+00:00,"RT @PiyushGoyal: In an exemplary step towards fostering regional cooperation, PM @NarendraModi ji will participate in a video conference on…",imAbhishekDutt,"Bengaluru, India","DLT, Deep Learning, Micro services, iOS  |  Standard Chartered, IIT Roorkee- 16 |  Instagram @imabhishekdutt   |  https://t.co/SalLdEGCQp (inactive)",321,803,13422,False,"In an exemplary step towards fostering regional cooperation, PM @NarendraModi ji will participate in a video conference on 15th March along with leaders from all SAARC countries, to chart out a strategy to combat Coronavirus in the region. #NeighbourhoodFirst https://t.co/yU24Rl3Xs7"
2020-03-14 23:29:01+00:00,"RT @MomsDemand: Schools across the nation are closed for the COVID-19 #NationalEmergency, leaving more children and teens with idle time at…",indy_liz_,"Indianapolis, IN",No Value Mentioned,75,424,2096,False,"Schools across the nation are closed for the COVID-19 #NationalEmergency, leaving more children and teens with idle time at home. 

#BeSMART for Kids: Assume curious children will find guns and store them locked, unloaded and separate from ammunition. https://t.co/zNBP1bPeAa"
2020-03-14 23:29:06+00:00,"RT @MinWag3MaxRag3: ""What the hell you doin b***h? You might have that fuckin coronavirus!"" 🤣 https://t.co/qDnJKmv3l0",DarkPandaStudio,"Indianapolis, IN",But I draw things,261,2085,7124,False,"""What the hell you doin b***h? You might have that fuckin coronavirus!"" 🤣 https://t.co/qDnJKmv3l0"
2020-03-14 23:29:11+00:00,RT @spectatorindex: BREAKING: Moroccan minister tests positive for coronavirus,rinseandrepeat2,India,"समर शेष है, नहीं पाप का भागी केवल व्याघ।     

              
जो तटस्थ हैं, समय लिखेगा उनके भी अपराध।     

      


student of life. wanderer. reader. hopeful.",485,570,127367,False,BREAKING: Moroccan minister tests positive for coronavirus
2020-03-14 23:29:27+00:00,RT @venx36: A short thread on China's manufacturing hegemony. This thread is not an opinion piece. It is merely a set of observations that…,keshda,India,"Thoughts are more important. Hypocrisy is quarantined here. 
Keshav Dixit.",2552,1188,312566,False,A short thread on China's manufacturing hegemony. This thread is not an opinion piece. It is merely a set of observations that explains why chinese manufacturing has become so integral to global supply chains.
2020-03-14 23:29:47+00:00,RT @sushantsareen: Corona is the new CAA...the usual suspects (liberal Vultures) are terribly disappointed that more people aren’t affected…,enxart,"Mumbai, India",Artist.,582,166,43823,False,Corona is the new CAA...the usual suspects (liberal Vultures) are terribly disappointed that more people aren’t affected because unless 1000s suffer they won’t get a stick to beat Modi with. So they are doing the next best thing: using the media to doubt veracity of govt data
2020-03-14 23:29:49+00:00,RT @boomlive_in: The @MoHFW_INDIA stated that there is no scientific evidence supporting the theory that higher temperatures kill the #Coro…,sndeep,india,"Anthropologist. Executive Director, ActionAid India. CoChair, World Urban Campaign UNHABITAT. Editor, Agrarian South. Views r personal. RTs are not endorsements",3698,3624,16801,False,"The @MoHFW_INDIA stated that there is no scientific evidence supporting the theory that higher temperatures kill the #Coronavirus. #CoronavirusPandemic #CoronaVirusFacts 

https://t.co/EzI2QTNu9E"
2020-03-14 23:30:25+00:00,"This is, of course, out of concern for COVID-19.",dbenderpt,"Indianapolis, Indiana","Class of 2020, Park Tudor School / Class of 2024, Indiana University / Students United Reporting Network / 2019 Neuharth Scholar / (Formerly @WFYInews)",400,2541,9356,False,No Value Mentioned
2020-03-14 23:30:28+00:00,"RT @TheAhmedShariff: Looooong before Corono virus, I saw this video and decided... I am NEVER stepping foot in China, ever!

Watch at your…",GyanveerSingh8,India,"Proud Indian I support my Armed forces Nation first unapologetically right unabashedly a Modi Fan
RTs not endorsement
Cogito Ergo Sum I think therefore I am",1088,780,168920,False,"Looooong before Corono virus, I saw this video and decided... I am NEVER stepping foot in China, ever!

Watch at your own discretion, this is BEYOND disgusting
https://t.co/azo1AFXGNn"
2020-03-14 23:30:35+00:00,Unbelievable! https://t.co/XQvjFwKL7P,myownniche,"New Delhi, India","Eccentric | Idealistic | Socialist | Highly Opinionated | Music | Life | Personal Account, represents nobody/nothing.",763,533,43084,False,No Value Mentioned
2020-03-14 23:30:38+00:00,"RT @TeaPainUSA: Translated:  ""He's infected.""",BJresists,"Indiana, USA",🌊🌊🌊🌊🌊🇺🇸resists 🆘. SAVAGE,2310,2963,35684,False,"Translated:  ""He's infected."" https://t.co/gXHHdINI84"
2020-03-14 23:30:45+00:00,"RT @DrSwatiSathe: List of the #COVID19 Helpline numbers from various States / UTs of India. 
Via @MoHFW_INDIA

#SwasthaBharat #CoronavirusP…",RitasArtCafe,India,"Hi, Welcome to my Art Cafe. Grab a cup of coffee (or tea, or whatever) and look at my artworks. If you want to buy any, please tweet to me.",7033,3656,99440,False,"List of the #COVID19 Helpline numbers from various States / UTs of India. 
Via @MoHFW_INDIA

#SwasthaBharat #CoronavirusPandemic
#CoronaOutbreak #Coronavirusupdate
#coronavirus #IndiaVsCorona #Corona #COVID2019 #CoronaVirusPune #prevention #HealthTips #healthandsafety #Health https://t.co/rznoKbFbT8"
2020-03-14 23:31:16+00:00,"RT @TwitterMoments: VP Pence confirmed travel to the UK and Ireland will be restricted effective Monday at midnight ET.

President Trump an…",DreamzDrem,India,dreamer😊😊,126,278,49580,False,"VP Pence confirmed travel to the UK and Ireland will be restricted effective Monday at midnight ET.

President Trump announced he took the coronavirus test and is awaiting results. https://t.co/4rvwiNWLjP"
2020-03-14 23:31:29+00:00,@ANI I do not know why people are panic..comparing to other virus covid19 death rate is very minimum..I think it is an mafia..to bring our economy down somebody is playing..let us not go panic..educated should check and react..,anbhkasu,"Bengaluru South, India",No Value Mentioned,11,98,9,False,No Value Mentioned
2020-03-14 23:31:34+00:00,"RT @SalmanNizami_: Uighur Muslims were locked in China; Kashmiri Muslims were locked in India;

The world was mum, today the entire world i…",DrTahirZaidi,"Lucknow, India.","Eye surgeon, kavi, keen follower of Political entertainment , cricket and tennis. Founder n Managing member #AjKShbd",12102,666,112343,False,"Uighur Muslims were locked in China; Kashmiri Muslims were locked in India;

The world was mum, today the entire world is locked for the fear of Coronavirus started from CHINA.

God works in mysterious ways. May He forgive our sins. We pray for healing &amp; comfort of all suffering!"
2020-03-14 23:31:37+00:00,"RT @jdawsey1: Trump’s test is negative for coronavirus, per memo from White House physician.",EthanMayJ,"Indianapolis, IN","I do a bit of everything for @IndyStar digital. Previously edited, reported, designed for @CoMissourian. @mujschool alum. I accept pity likes.",776,575,9274,False,"Trump’s test is negative for coronavirus, per memo from White House physician."
2020-03-14 23:31:37+00:00,"RT @vikasF22: India quietly sent a C 17 full of aid to China, an unfriendly (if not hostile) country. While chinese are on full scale PR wh…",nehaharitas,"Punjab, India",No Value Mentioned,21,14,2916,False,"India quietly sent a C 17 full of aid to China, an unfriendly (if not hostile) country. While chinese are on full scale PR when the entire blame for this crisis should fall on them. https://t.co/mbco10Rtmc"
2020-03-14 23:31:38+00:00,RT @mikaylashocks: also psa to support small businesses more than ever right now. if there’s something you are in need of please shop small…,emilymaxwell5,"Indianapolis, IN",No Value Mentioned,122,229,674,False,"also psa to support small businesses more than ever right now. if there’s something you are in need of please shop small! it’s not always convenient, but people’s livelihoods depend on every day purchases from consumers &amp; i can’t imagine the panic they must feel at this time 💔"
2020-03-14 23:31:45+00:00,RT @Vijayabaskarofl: #CoronaVirusUpdates: The 4th virology lab  for #TN is approved by @MoHFW_INDIA at #Tirunelveli Med.Coll. Out of the 79…,bpvenesh,"Chennai, India","Being human, Engineer.",222,2881,2211,False,"#CoronaVirusUpdates: The 4th virology lab  for #TN is approved by @MoHFW_INDIA at #Tirunelveli Med.Coll. Out of the 79 samples tested for #COVIDー19, 78 are tested negative except 1 positive case reported last week.Pls Stay calm,we are monitoring the situation.Will keep informed"
2020-03-14 23:31:50+00:00,"RT @kim: Residents of Spain, applauding their frontline healthcare workers https://t.co/waFSw2fPE6 #COVIDー19",Beloved31075,Nap town/Indianapolis,Mom to Adam and Rachel. A #KidneyAndLungCancerWarrior 🧡🤍💪🏼🎗 fiancé to @kevinkevin70 . 🥰 Stay positive even when it feels like your life is falling apart”,778,753,26267,False,"Residents of Spain, applauding their frontline healthcare workers https://t.co/waFSw2fPE6 #COVIDー19"
2020-03-14 23:48:57+00:00,RT @VatsalTrivediMD: Intubated a ?COVID pt today with an anticipated difficult airway + HD instability. Thoughts I've reflected on after th…,claudiamedic,Indiana,"EMTP & ED RN emeritus. Interests:Emergency med, aviation, severe weather, Fragile X, autism, ALS. The Church of Jesus Christ of Latter-day Saints. #FOAMed #HEMS",964,1293,12620,False,"Intubated a ?COVID pt today with an anticipated difficult airway + HD instability. Thoughts I've reflected on after the fact: 
 
Before - role ID, plan for all contingencies (meds, rescue, resus), imagery of sequences, most experienced intubator, have filters/tubes/PPE ready"
2020-03-14 23:48:58+00:00,"RT @australian: Residents of Turin, #Italy, are making their own fun in coronavirus lockdown by dancing and singing to the #Macarena from t…",Brahamvakya,India/UK/Bharat Rakshak,"Swayamsevak!! Political animal,Behavioural Economist, Free enterprise absolutist.Creating solutions for bottom of the pyramid. Future is bright,future is RIGHT!",5873,442,151402,False,"Residents of Turin, #Italy, are making their own fun in coronavirus lockdown by dancing and singing to the #Macarena from their balconies 🇮🇹💃

Stay up to date with the latest #coronavirus information here: https://t.co/8V2wNqMge8

Credit: Lucrezia Calamusa via Storyful https://t.co/6b0uPytol8"
2020-03-14 23:48:58+00:00,"RT @EazeAli4: It wasn’t no corona till y’all started balancing brooms in the house, y’all let the devil in",tacosthepimp,"Indianapolis, IN",ig: tacosthepimp sc: iariarenee                    navy wife 🤞🏽💍,125,216,8255,False,"It wasn’t no corona till y’all started balancing brooms in the house, y’all let the devil in"
2020-03-14 23:49:02+00:00,RT @ShutUpAndrosky: jeff bezos/amazon owns whole foods. he could give every one of their 91 THOUSAND employees $10k and still maintain over…,JaredL_Smith,"Indiana, USA","Hasta la Victoria, Siempre || Your Friendly Neighborhood Marxist || 8/4/17 || Philosophy Grad Student || Existence Precedes Essence || Free 🇵🇸 || he/him/his",254,228,18138,False,jeff bezos/amazon owns whole foods. he could give every one of their 91 THOUSAND employees $10k and still maintain over 99% of his wealth. https://t.co/yeXbzSQRG7
2020-03-14 23:49:03+00:00,"RT @Lyricoldrap: Alright, everything’s gonna be okay now. #coronavirus https://t.co/cC5Mg4ld25",dianabeth306,griffith indiana,let him in I love wwe I love gts wrestling I’m 31years old @wwebraywyatt @matthardybrand @wwerollins,1120,5001,60702,False,"Alright, everything’s gonna be okay now. #coronavirus https://t.co/cC5Mg4ld25"
2020-03-14 23:49:12+00:00,"RT @Slappy_Kincaid: Disgraceful! 

Trump: Pelosi’s Coronavirus Bill Stuffed with Unrelated ‘Goodies’ for Democrats https://t.co/bg8eG7xlGG…",jonella_moore,Indiana ,"Patriot, Christian, Educated American #WWG1WGA #GreatAwakening. Isaiah 41:10-13. I believe in Truth and Justice 🇺🇸 Followed by @GenFlynn @Vincentcrypt46",15828,15479,180804,False,"Disgraceful! 

Trump: Pelosi’s Coronavirus Bill Stuffed with Unrelated ‘Goodies’ for Democrats https://t.co/bg8eG7xlGG via @BreitbartNews"
2020-03-14 23:49:32+00:00,"RT @Trey_VonDinkis: @DonaldJTrumpJr .
🇺🇸2A MATTERS

 - - ILLINOIS MAYOR uses 'COROAVIRUS' to TARGET 2A RIGHTS

Banning the Sale of Firearms…",jonella_moore,Indiana ,"Patriot, Christian, Educated American #WWG1WGA #GreatAwakening. Isaiah 41:10-13. I believe in Truth and Justice 🇺🇸 Followed by @GenFlynn @Vincentcrypt46",15828,15479,180804,False,"@DonaldJTrumpJr .
🇺🇸2A MATTERS

 - - ILLINOIS MAYOR uses 'COROAVIRUS' to TARGET 2A RIGHTS

Banning the Sale of Firearms and Ammunition Because of Wuhan Virus? 
An Illinois Mayor Just Signed an Executive Order to Do It

.
https://t.co/nG1PJASce1"
2020-03-14 23:49:37+00:00,"RT @JhaSanjay: India is at a crucial inflection point in the fight to stop the deadly #coronavirus. 

This is the time to put the usual acr…",virdikuldeep,"Ludhiana, Punjab, INDIA",Die hard Congress Supporter. Followed back by @INCIndia .,711,982,106062,False,"India is at a crucial inflection point in the fight to stop the deadly #coronavirus. 

This is the time to put the usual acrimonious slugfests behind us; all binary conflicts.  All of them.

This is a test of not just our political maturity but our national character.

Thanks!"
2020-03-14 23:49:38+00:00,RT @BoBundyy: Since dogs can’t get the Corona virus Mande a Firulais al jale https://t.co/E8RnaWa3k1,plaguehippie,"Indianapolis, IN",unknown man died eating library paste july 14 1908,258,621,55602,False,Since dogs can’t get the Corona virus Mande a Firulais al jale https://t.co/E8RnaWa3k1
2020-03-14 23:49:53+00:00,RT @mpopat: What happened to @khamenei_ir’s grand plan of isolating India from the Islamic world? Should us kaffirs extend help to the Isla…,SitanshuDesai,India ,"This Bird Tweets Less But , Likes Other Tweeting . #NaModified",534,1529,199762,False,"What happened to @khamenei_ir’s grand plan of isolating India from the Islamic world? Should us kaffirs extend help to the Islamist State of Iran in the face of US sanctions? 
#COVIDー19 https://t.co/M3aKU6OVBa https://t.co/J1JGZ3Kvxj"
2020-03-14 23:49:58+00:00,RT @esaagar: Chinese Tycoon Who Criticized Xi’s Response to Coronavirus Has Vanished https://t.co/A72RibZVw8,roentgens9,Indiana,"Let's Repeal and Replace the Republican Congress in 2018!
Proud member of #Resistance 
#BlueWave2018    #Impeach45   #FBR",3403,3706,61297,False,Chinese Tycoon Who Criticized Xi’s Response to Coronavirus Has Vanished https://t.co/A72RibZVw8
2020-03-14 23:50:01+00:00,"RT @Reuters: In a defiant response to the #coronavirus crisis, Italians stuck in their homes joined together to sing patriotic songs from t…",NIKHILD0802,"Jamui, India",Varun Dhawan,16,16,583,False,"In a defiant response to the #coronavirus crisis, Italians stuck in their homes joined together to sing patriotic songs from their balconies https://t.co/1RgqwqarQs https://t.co/fszJ1RTpkq"
2020-03-14 23:50:01+00:00,"RT @SenBobCasey: Right now in America, it is easier to get an AR-15 than a test kit for COVID-19.",500Rell,"South Bend, Indiana",#MoneyWorld🕊 #BAAB,897,501,13447,False,"Right now in America, it is easier to get an AR-15 than a test kit for COVID-19."
2020-03-14 23:50:15+00:00,RT @ScottMStedman: Question to readers: Is it irresponsible for journalists to report on matters *completely unrelated* to Coronavirus?,SolarSurvival,Indiana,"herbalist, environmentalist, survivalist, egalitarian, organic gardener,  #hemp #solar  #renewables #greennewdeal #freerealitywinner, biden/warren",2561,4906,45475,False,Question to readers: Is it irresponsible for journalists to report on matters *completely unrelated* to Coronavirus?
2020-03-14 23:50:20+00:00,"RT @smita_muk: 5 #COVIDー19 patients from nagpur missing 🙄

To control #CoronaVirus outbreak in India looks like much more challenging in re…",vks_gautam1,"Chandigarh, India","Mobile App developer.  Angular with Ionic, React Native, AngularJs. A Proud Indian

HomeTown-Kangra(Himachal)",262,497,19432,False,"5 #COVIDー19 patients from nagpur missing 🙄

To control #CoronaVirus outbreak in India looks like much more challenging in reality than it sounds!

Stern #CRPC provisions need to be passed thru Ordinance by govt

@PMOIndia"
2020-03-14 23:50:53+00:00,RT @CBP: CBP officers seized suspected counterfeit COVID-19 test kits. At-home COVID-19 test kits found online are fake. Authorized testing…,lisareid11,Indiana,No Value Mentioned,1685,408,115376,False,"CBP officers seized suspected counterfeit COVID-19 test kits. At-home COVID-19 test kits found online are fake. Authorized testing for COVID-19 is conducted in verified state &amp; local public health labs across the US. 
Read more: https://t.co/U9hdERABkN https://t.co/WeYKQfq3ES"
2020-03-14 23:51:13+00:00,"COVID-19 Community Plan Tip: Drive-thru student meal assistance available Monday, March 16 from 1-4 pm at Fishers High School, HSE High School, and Durbin Elementary. https://t.co/mxRl8ENHUG",FishersIN,"Fishers, Indiana","A smart, vibrant, and entrepreneurial Midwest city synonymous with growth, named 2017 #1 Best Place to Live by Money Magazine. Tweets by Communications Staff.",17057,1133,14950,False,No Value Mentioned
2020-03-14 23:51:18+00:00,Coronavirus Could Be The End Of China As A Global Manufacturing Hub https://t.co/7uSPGqy4n2,cyrushavo,"Mumbai, India","1966: REPUBLIC DAY parade: PROUD TO BE A VETERAN OF INDIAN ARMED FORCES: 
Honoured: President guard! Jai Hind!Exp:Aviation: maint! Mech/Electronic/Computers:",1056,1314,117071,False,No Value Mentioned
2020-03-14 23:51:29+00:00,"RT @smita_muk: also no scientific evidence tht what FSSAI says is true,wait letme share wt d most dangerous trend of #CoronaVirus strain. I…",vks_gautam1,"Chandigarh, India","Mobile App developer.  Angular with Ionic, React Native, AngularJs. A Proud Indian

HomeTown-Kangra(Himachal)",262,497,19432,False,"also no scientific evidence tht what FSSAI says is true,wait letme share wt d most dangerous trend of #CoronaVirus strain. It hs changed gene pattern 388 times in 3 months.Proven it came frm animals to humans so dont overload ur metabolism wt animal flesh further for time being https://t.co/RW7ILg7otD"
2020-03-14 23:51:31+00:00,"RT @sunandavashisht: Dear @Reuters : In middle of a pandemic, you really have a great sense of understanding what is newsworthy.Which Hindu…",S1ddhantKumar,India,Storyteller. Cinephile. Bibliophile. DC Fan. On my journey to die of exhaustion rather than boredom.,429,117,21089,False,"Dear @Reuters : In middle of a pandemic, you really have a great sense of understanding what is newsworthy.Which Hindu group is this? Who do they represent?Are they elected officials? Has any sensible Hindu heard their name before? We will be fine but this hatred will consume you https://t.co/elasKN1pl8"
2020-03-14 23:51:49+00:00,RT @JennPellegrino: BREAKING: President Trump tests negative for Coronavirus following announcement earlier today that he had taken the tes…,fmiller26,"Indiana, USA",Text Trump 88022,2598,123,183375,False,BREAKING: President Trump tests negative for Coronavirus following announcement earlier today that he had taken the test. @OANN https://t.co/9b9giqsjTA
2020-03-14 23:51:55+00:00,RT @biannagolodryga: It’s difficult to comprehend how ill-prepared this admin was &amp; is for this crisis. Even w/  everything that has alread…,TokerJosh,"Indiana, USA",FPS Genius - Anime/Manga Enthusiast - @Builds_io Partner!,1206,423,4778,False,"It’s difficult to comprehend how ill-prepared this admin was &amp; is for this crisis. Even w/  everything that has already been reported, this article is mind blowing. As brilliant &amp; esteemed as Drs. Fauci &amp; Blix are, this can’t &amp; shouldn’t all rest on them. https://t.co/ohjTy1fDoC"
2020-03-14 23:52:04+00:00,"RT @drharshvardhan: Wash hands many times a day 
To keep Corona virus at bay!

Do you know the science behind washing hands with soap &amp; wat…",ganeshmahnar,India भारत,"दो गज दूरी, बहुत है जरूरी। Working for Livelihood Enhancement in Rural India, Nationalist. RT and likes are not endorsement. Tweets are personal.",5844,940,114899,False,"Wash hands many times a day 
To keep Corona virus at bay!

Do you know the science behind washing hands with soap &amp; water to kill #coronavirus ?
The virus is a self-assembled nanoparticle with weakest link being the lipid bilayer
Soap dissolves the fat membrane, turns it inactive https://t.co/Ynl3ZbBKzf"
2020-03-14 23:52:12+00:00,"RT @jcourtsull: A dear friend of mine, an ICU doc, is treating a healthy woman in her 30s with Covid-induced respiratory failure. She had t…",vipertuff,"Indiana, USA & Planet Earth","I enjoy fishing, nature, animals, & honesty in people. (Sorry, no picture yet, but I am a real person who cares about our country!) I love my cats & my dog.",2024,4138,13063,False,"A dear friend of mine, an ICU doc, is treating a healthy woman in her 30s with Covid-induced respiratory failure. She had to be intubated/put on ventilator. My friend says, “It’s here &amp; it’s bad. Trump is trying to suppress it.” She advises following this: https://t.co/DN1tKJfYSI"
2020-03-14 23:52:18+00:00,"RT @CNBC: Trump tests negative for coronavirus, White House doctor says https://t.co/FUlwjAiIKs",Jaypandiyan1,"Tamil Nadu, India",#தமிழன்💪,46,178,17307,False,"Trump tests negative for coronavirus, White House doctor says https://t.co/FUlwjAiIKs"
2020-03-14 23:52:24+00:00,RT @sinhrann: @Ruthlessindia @shytigress Why suddenly China is destroying hospital after hospital? Are these really accidents?,desertfox61I,India,"Once a Soldier Always a Soldier
RT not endorsements",16392,2847,467011,False,@Ruthlessindia @shytigress Why suddenly China is destroying hospital after hospital? Are these really accidents?
2020-03-14 23:52:32+00:00,Apple shuts all stores around the world — except in China https://t.co/vX6azAs5PF https://t.co/FA8D8irsTd,imRaghubh,"Bengaluru, India",No Value Mentioned,34,35,3384,False,No Value Mentioned
2020-03-14 23:52:43+00:00,RT @BrandonBonta: And yeah they can just stay closed,A_Coates10,"Portage, Indiana",Take nothing for granted. Don’t Quit. Purdue Northwest Graduate. Medical Sales. IG: A_Coates10 SC: Avcoates10,710,479,33827,False,And yeah they can just stay closed https://t.co/UAMWIWLNey
2020-03-14 23:52:51+00:00,RT @BesuraTaansane: 🔔...must have been a Bill Clinton moment ...only instead of a Monica it was probably a ZooBear 🤣,ssingapuri,"Mumbai, India",Politically Active! I Social issues and National Security|Do public Interest litigations for Social causes|Entrepreneur|Director|H.R Consultant|,13658,755,223053,False,🔔...must have been a Bill Clinton moment ...only instead of a Monica it was probably a ZooBear 🤣 https://t.co/e629xvBYcl
2020-03-14 23:53:13+00:00,"RT @vijayanpinarayi: #COVID19 | Solving The Mask Problem 😷

In light of the shortage, directions were given to engage the prisons in the St…",ajityohannan,"Bangalore, India",Servant of God. Husband. Father. Marketer. Tweets are my own.,1480,637,6247,False,"#COVID19 | Solving The Mask Problem 😷

In light of the shortage, directions were given to engage the prisons in the State in manufacturing masks. It has commenced on a war footing basis.  Today, the Prison officials of Thiruvananthapuram Jail have handed over the first batch. https://t.co/QKgHWqYNOg"
2020-03-14 23:53:26+00:00,"RT @lifeofsoldiers_: 234 Indian nationals stranded in #Iran have now arrived in #India.

The batch consists of 131 students and 103 pilgrim…",AmitKMishra_19,India,"Love my Country  😎
Tweets/Retweets/likes are personal 😍
RT not endorsement.",45,597,6279,False,"234 Indian nationals stranded in #Iran have now arrived in #India.

The batch consists of 131 students and 103 pilgrims.

Commendable effort here by @MEAIndia, @DrSJaishankar and @India_in_Iran.

India has successfully reached out to its citizens in trying times.

#COVID19"
2020-03-14 23:53:28+00:00,@Asking1Chatterj Corona Badi Screen Pe Hein Woh Ya Left Mein Betha Hua 🐖 ? 😉,SitanshuDesai,India ,"This Bird Tweets Less But , Likes Other Tweeting . #NaModified",534,1529,199762,False,No Value Mentioned
2020-03-14 23:53:54+00:00,"RT @sudarsansand: My SandArt of Hon’ble PM @narendramodi Ji with message “Say Yes to #Namaste; Say No to Handshake”. Stay safe! 
#COVID19 h…",SURESHR38023477,"Ahore, India","BJP followed by
@Drrajpurohitbjp
@jantakiAwaz2019
@kanganaranaaut",204,468,4827,False,"My SandArt of Hon’ble PM @narendramodi Ji with message “Say Yes to #Namaste; Say No to Handshake”. Stay safe! 
#COVID19 https://t.co/IJcZ7xFGhq"
2020-03-14 23:54:07+00:00,RT @DannielB11: Corona Virus ain’t Shit my ex was more Toxic.,hrenae15,"Indiana, USA",No Value Mentioned,485,191,22761,False,Corona Virus ain’t Shit my ex was more Toxic.
2020-03-14 23:54:16+00:00,RT @Shyamanga: Teaching kids how to take precautions needs a little bit of magic. Kudos to the person who came up with this brilliant idea…,Indian100Times,India,senior citizen,104,384,3615,False,"Teaching kids how to take precautions needs a little bit of magic. Kudos to the person who came up with this brilliant idea
#CoronaOutbreak #COVIDー19 https://t.co/WZR4q6nE7e"
