created_at,full_text,screen_name,location,description,followers_count,friends_count,statuses_count,verified,full_retweet_text
2020-04-25 01:37:33+00:00,RT @pash22: How can one draw any clinical opinions on efficacy from 4 patients? @AnantBhan @d_s_thakur @PriyankaPulla . Isn't the @CMODelhi…,jamewils,"Kerala, India","Civil engineer, data analyst, my allegiance is to facts alone, highly opinionated, beware! Crushes? water, law, finance, policy, books & DSLR 🥂",49453,913,187965,False,How can one draw any clinical opinions on efficacy from 4 patients? @AnantBhan @d_s_thakur @PriyankaPulla . Isn't the @CMODelhi an @IITKgp graduate and supposed to be well-versed in science? @load_dependent https://t.co/s1lBMnSwJo
2020-04-25 01:37:34+00:00,"RT @katta_news: The Union Home Ministry allow the Following shops to operate,with 50% strengths of workers and Mandatory wearing of masks a…",garudrr,"Maharashtra, India",There is only one way to rise in life - FALL IN LOVE WITH IT.. 90s kid...,529,4391,37724,False,"The Union Home Ministry allow the Following shops to operate,with 50% strengths of workers and Mandatory wearing of masks and social distancing except contaminated zones. https://t.co/cNESuFI3QT"
2020-04-25 01:37:35+00:00,"RT @PomiBaruah: There are so many who are fighting this fight... I salute each one of them.
My contribution is a little drop in the ocean 🙏…",DevRaj85311285,"Dibrugarh, Assam, India","Student Activist ||
Politically Inclined ||
Follower of Gandhian Philosophy || 
#NLC
#Ex_Cottonian
#Dibrugarh_University || MA History || l",120,390,1166,False,"There are so many who are fighting this fight... I salute each one of them.
My contribution is a little drop in the ocean 🙏
#IndiaFightsCorona 
#COVID19 
#fightingcoronatogether https://t.co/rOjH8bSqcA"
2020-04-25 01:37:39+00:00,"RT @sandeep_cooks: 😂😂😂😂😂😂😂....  I’m laughing, coz some folks believe that Chinese Government would even acknowledge their SINS
#WuhanVirus…",Shilpa0226,India,"""The Earth is a grand oasis in the big vastness of space..""",558,688,33894,False,"😂😂😂😂😂😂😂....  I’m laughing, coz some folks believe that Chinese Government would even acknowledge their SINS
#WuhanVirus

Coronavirus: China rejects call for probe into origins of disease - BBC News https://t.co/BrcfBX4pUn"
2020-04-25 01:37:42+00:00,RT @scroll_in: A state-wise analysis of key indicators. https://t.co/pGvncJ0QBa,TheMoAbbas,"Uttar Pradesh, India",उम्मीद मत छोड़ना कल का दिन आज से बेहतर होगा।,10,113,39,False,A state-wise analysis of key indicators. https://t.co/pGvncJ0QBa
2020-04-25 01:37:44+00:00,"RT @ShefVaidya: Been seeing videos/pics of people moving around freely in certain specific areas of EVERY city in India, not wearing masks,…",peepal59,Hyderabad India,"Marketing consultant ,A political, admirer of modiji Honoured to be followed by sri Narendra modiji and sri Amit shah ji &Mr bill gates no DM s please",915,1015,338577,False,"Been seeing videos/pics of people moving around freely in certain specific areas of EVERY city in India, not wearing masks, not following social distancing, not following #lockdown. Are rules ONLY meant for Hindus in India?"
2020-04-25 01:37:45+00:00,RT @ANINewsUP: 111 new #COVID19 cases reported today till 6 pm in the state. Total cases rise to 1621 including 226 cured/discharged. 1370…,Cuteee_Kittu,"Lucknow, India","Proud Indian! 🇮🇳| Desh bhakt| Liberal dharmik| Rationalist|
Lucknow--kanpur",98,266,2124,False,111 new #COVID19 cases reported today till 6 pm in the state. Total cases rise to 1621 including 226 cured/discharged. 1370 are active cases and 25 deaths have been reported: State Health Department https://t.co/hwWgr3yfZi
2020-04-25 01:37:46+00:00,"RT @blsanthosh: 1. Tripura becomes 5th State after Goa , Sikkim , Manipur &amp; Arunachal Pradesh to become COVID-19 free as of now along with…",TenisMahato,"Kolkata, India","Kolkata Zone Vistarak, BJP
@BJP4Bengal",632,185,11640,False,"1. Tripura becomes 5th State after Goa , Sikkim , Manipur &amp; Arunachal Pradesh to become COVID-19 free as of now along with 2 UTs.
2.Recovery rate increases to 20.5% most confident building. 
3. Last 24 hours sees 1752 positive cases . 
#IndiaFightsCorona"
2020-04-25 01:37:46+00:00,"RT @SethAbramson: 37/ At a time Trump knew of the virus, per the senior White House correspondent at HUFFPOST China inserted in its trade n…",n8trlover,Indiana,"#BlackLivesMatter Mom, G’ma, BS Pre-Med/Psychology/Social Work, ND (Doctor Naturopathic Medicine)👩🏼‍🔬 #NastyWoman#TheResistance #WindmillCancerSurvivor😜",9095,7653,84936,False,"37/ At a time Trump knew of the virus, per the senior White House correspondent at HUFFPOST China inserted in its trade negotiation with him an exceedingly rare trade-deal clause that excused China from compliance in the event of—for instance—a pandemic. https://t.co/2dAyYggTJI"
2020-04-25 01:37:46+00:00,RT @sunandavashisht: As expected. I was amazed at ‘eminent people’ painting doomsday scenarios based on few flippant tweets. Geopolitics is…,kartheesanp,"Bengaluru, India",No Value Mentioned,89,334,47353,False,"As expected. I was amazed at ‘eminent people’ painting doomsday scenarios based on few flippant tweets. Geopolitics is lot more complicated than that. But in the era of 280 characters, everybody is an expert. https://t.co/RxIVY0g6Lf"
2020-04-25 01:37:47+00:00,RT @hrkbenowen: Melania Sends ‘Be Best’ Care Packages To Medical Professionals For Their ’Hard Work And Dedication’ During the Pandemic htt…,BFrey0,"Indiana, USA","I love our country, our flag, our president and the spirit of the people who support President Trump. God bless America.",808,1026,35423,False,Melania Sends ‘Be Best’ Care Packages To Medical Professionals For Their ’Hard Work And Dedication’ During the Pandemic https://t.co/EIuH3tXwCs
2020-04-25 01:37:48+00:00,"RT @narendramodi: The Epidemic Diseases (Amendment) Ordinance, 2020 manifests our commitment to protect each and every healthcare worker wh…",ManojKu13609137,"Karimnagar, India",digital marketing analyst,6,36,14,False,"The Epidemic Diseases (Amendment) Ordinance, 2020 manifests our commitment to protect each and every healthcare worker who is bravely battling COVID-19 on the frontline. 

It will ensure safety of our professionals. There can be no compromise on their safety!"
2020-04-25 01:37:49+00:00,"RT @ndtv: Centre allows shops to open with conditions, malls to remain closed https://t.co/5S4ReIxa4r

#CoronavirusLockdown https://t.co/uq…",indrajitip,"Asansol, India","I am a Maths / Physic teacher by profession for last 16 years. I am interested in Computer programming, blogging, content writting, History,KPastrology etc ...",113,892,2063,False,"Centre allows shops to open with conditions, malls to remain closed https://t.co/5S4ReIxa4r

#CoronavirusLockdown https://t.co/uqStusKhaC"
2020-04-25 01:37:50+00:00,"RT @htTweets: In midnight order, Home Ministry allows neighbourhood shops to reopen

https://t.co/wM9DgBG9kP https://t.co/pjybzNJHoH",ShubhSri95,India,"I am Good for Good People and Bad for Bad People
Thankful to the god that they gave me birth in 🚩 & in 🇮🇳
Communists and 🐷 🚫🚫",174,1604,2368,False,"In midnight order, Home Ministry allows neighbourhood shops to reopen

https://t.co/wM9DgBG9kP https://t.co/pjybzNJHoH"
2020-04-25 01:37:52+00:00,"RT @amitmalviya: You are 3 times more likely to die of Covid if in Bengal (data as of 24Apr)

WB
Covid +ve: 545
Covid +ve patients who died…",CeoChirag,India,Entertainment Government and Politics News Sports,64,257,3731,False,"You are 3 times more likely to die of Covid if in Bengal (data as of 24Apr)

WB
Covid +ve: 545
Covid +ve patients who died: 57
Fatality Rate: 10.5%

India
Covid +ve: 23,452
Covid +ve patients who died: 723
Fatality Rate : 3.08%

Explains why Mamata Banerjee has been fudging data!"
2020-04-25 01:37:55+00:00,RT @DeepikaBhardwaj: @GaPriyanka @SwatiJaiHind As per official statement by Cop : You left home on 17th April in their presence because u w…,ApBhagaur,india,No Value Mentioned,392,314,27030,False,@GaPriyanka @SwatiJaiHind As per official statement by Cop : You left home on 17th April in their presence because u wanted to. You had no physical injuries whatsoever. U decided to go stay at a friends place. U left kids with husband. There was no harassment for dowry. You told cops you want divorce.
2020-04-25 01:37:57+00:00,"RT @satyajeettambe: My wife Dr. Maithili is personally overlooking relief work in Sangamner. 
Jaihind Yuva Manch, Youth Cong &amp; NSUI is work…",csbprasad18,"Kolkata, India","CMA, Against Hatred, loves peace, tweets personal",8,37,162,False,"My wife Dr. Maithili is personally overlooking relief work in Sangamner. 
Jaihind Yuva Manch, Youth Cong &amp; NSUI is working tirelessly to help people here, as, our area is in the Red Zone. 
It is a complete lockdown, &amp; hence people need extra support. #CoronoCrisis @TambeMaithili https://t.co/EM1cjJHtnP"
2020-04-25 01:37:59+00:00,RT @mentalhealthind: We strive to bring you best-in-class knowledge on mental health that helps you make an informed decision. Be an empath…,ChakmaRoss,"New Delhi, India",No Value Mentioned,3,66,248,False,We strive to bring you best-in-class knowledge on mental health that helps you make an informed decision. Be an empathetic ally during the pandemic. Subscribe at https://t.co/4zdXqvUQtI  #EachOneReachOne #CopingWithCOVID19 with @YouthKiAwaaz @GiveIndia @orfonline &amp; @TwitterIndia https://t.co/yrqOcAbke8
2020-04-25 01:38:00+00:00,RT @desimojito: Entire world thought India was the best in handling Corona Pandemic and then came Ramadan where our government bowed down f…,reachswapnilm,India,भारतीय ; हिन्दू,94,263,3899,False,Entire world thought India was the best in handling Corona Pandemic and then came Ramadan where our government bowed down for appeasement just like what Congress did for years
2020-04-25 01:38:00+00:00,"RT @Rajatdelhi12: Let's take pledge to build New and Self dependent India after the end of lockdown
Are you with PM @narendramodi to make 1…",Rajatdelhi12,"New Delhi, India","Followed by-
@iSinghApurva
@AshokGoelBJP @iPuneetSharma @Tajinderbagga @NayaBharathoon
@Payal_Rohatgi @Kuljeetschahal @beingarun28 @DoctorRichaBjp",13341,8671,66935,False,"Let's take pledge to build New and Self dependent India after the end of lockdown
Are you with PM @narendramodi to make 1.3 billion lives prosperous &amp; happy?

Because ""It's the team work which makes dream work.""

@iSinghApurva @iPuneetSharma @AshokGoelBJP
#NewIndiaProsperousIndia https://t.co/BJCCYcoo9o"
2020-04-25 01:38:03+00:00,Maharashtra records 778 new cases; state COVID-19 tally 6427 - Economic Times https://t.co/ar0QtWU84Y,757LiveIN,India,"Top News Stories of the day, Latest News Headlines, News Specials, @757live  https://t.co/Tcyg4E61RP",488,85,141974,False,No Value Mentioned
2020-04-25 01:38:08+00:00,"RT @IndianExpress: France restricts sales of nicotine substitutes after coronavirus study
https://t.co/02bkvr6MMW",Palavanews,"Kalyan Dombivali, India","we curate news from automated feed in and around palava.

we are not associated with Lodha Group

RTs are not endorsements.

connect at https://t.co/MD9ICnUTb6",140,218,4942,False,"France restricts sales of nicotine substitutes after coronavirus study
https://t.co/02bkvr6MMW"
2020-04-25 01:38:09+00:00,"RT @maduro_en: Attention Venezuela! Starting tomorrow # 24Apr in the Patria System, a new necessary survey begins: ""Analysis of the Quarant…",EmbavenezIndia,"New Delhi, India","Embajada de la República Bolivariana de Venezuela en India, con sede en Nueva Delhi",3497,1241,29263,False,"Attention Venezuela! Starting tomorrow # 24Apr in the Patria System, a new necessary survey begins: ""Analysis of the Quarantine and the Situation of COVID-19"". A survey of 11 questions to answer as a family and that allows us to clarify the [...] https://t.co/ybc9uJzVUy"
2020-04-25 01:38:11+00:00,My dear friend tested positive for Covid-19 from one of these elderly communities that the Indiana has appointed &amp; her own doctor had to supply information to the health department because the place she works refused to. They also ask her to come back to work on Monday if no temp,Indysbest2,"Indianapolis, IN","#1 Colts Fan #Resist #VoteOutStupid2020 Dr. Fauci says “needless suffering and death, if we open to soon”. #resist",251,261,6070,False,No Value Mentioned
2020-04-25 01:38:11+00:00,RT @swapan55: The reality of the lockdown in Foreshore Road of Howrah (in the reddest of Red zones in West Bengal) this morning. Observe th…,rjndrmjh_india,"The temple city, India",Agripreneur // Pursuing law // ABVPian // Ex SM Incharge @abvpodisha & city Org Secy @abvpcuttack// I only endorse mother nature.,494,555,4878,False,The reality of the lockdown in Foreshore Road of Howrah (in the reddest of Red zones in West Bengal) this morning. Observe the role of the police as a spectator. Sent to me by a concerned citizen. https://t.co/6yHEoJvP8c
2020-04-25 01:38:11+00:00,RT @DirKrish: Accepted the challenge and sharing the workload sir... Will post the video tomorrow... 👍,Venkatesh_989,"Palakonda, India",Jai Janasena,68,417,13023,False,Accepted the challenge and sharing the workload sir... Will post the video tomorrow... 👍 https://t.co/CIS95eum1W
2020-04-25 01:38:11+00:00,RT @the_kbeat: #Covid19 | These girls from Kashmir are stranded in Delhi and are in desperate need of help! https://t.co/O3NSjjyG9i,NrcProtest,India,"One Stop Account to all information of Protests on CAA / NRC from all over India. Please keep on retweeting until its rolled back.
We are all in this together.",15226,41,2634,False,#Covid19 | These girls from Kashmir are stranded in Delhi and are in desperate need of help! https://t.co/O3NSjjyG9i
2020-04-25 01:38:15+00:00,"RT @notyet100: Just because life
Suddenly resembles a story
Walking out from a book
Each day I need few more words
To stay in my own home…",andylectablyme,"Bombay, INDIA",Goan-Bombayite / Married / Posting random thoughts / Poetry / Photography / Seeker /  I RT a lot / My forgotten tweets can be found here 👇🏻,3000,3107,37916,False,"Just because life
Suddenly resembles a story
Walking out from a book
Each day I need few more words
To stay in my own home

#amwriting #Quarantinelife"
2020-04-25 01:38:17+00:00,RT @BernieSanders: In this time of crisis it is up to us to stand up for working people everywhere. Join our virtual town hall with state a…,Shivam_pandey4,"New Delhi, India",No Value Mentioned,22,106,206,False,In this time of crisis it is up to us to stand up for working people everywhere. Join our virtual town hall with state attorneys general on how we must handle the coronavirus pandemic: https://t.co/oUAKAKusUv
2020-04-25 01:38:22+00:00,"RT @Darkwyr: 27 fishermen in Chennai wanted to return home to Odisha when India extended its lockdown. So they bought a boat, loaded it wit…",bhim123,"Delhi,India","Roots in the Abode of Gods -Uttarkhand,News Junkei,Cricket Fanatic, Amateur Photographer",663,748,32516,False,"27 fishermen in Chennai wanted to return home to Odisha when India extended its lockdown. So they bought a boat, loaded it with food, and sailed on with the stars and dolphins (and a mobile phone) | Subhashish Mohanty
https://t.co/xvv1r1SCTY"
2020-04-25 01:38:25+00:00,RT @leehsienloong: Spoke with PM @narendramodi on the phone this evening. We discussed the COVID-19 situations in our 2 countries &amp; agreed…,TenisMahato,"Kolkata, India","Kolkata Zone Vistarak, BJP
@BJP4Bengal",632,185,11640,False,"Spoke with PM @narendramodi on the phone this evening. We discussed the COVID-19 situations in our 2 countries &amp; agreed to work together on the challenges posed by the pandemic, keep supply chains intact, &amp; keep essential supplies flowing. – LHL https://t.co/PttU3IWzP8 https://t.co/stVpDSyL0u"
2020-04-25 01:38:25+00:00,"RT @SonyMusicSouth: Are you tuned into the @gvprakash exclusive live for @YouTubeIndia ?! 😍

Unplugged performances, memorable conversation…",Vickys35607377,"Karur, India",No Value Mentioned,108,762,4667,False,"Are you tuned into the @gvprakash exclusive live for @YouTubeIndia ?! 😍

Unplugged performances, memorable conversations and a lot more! ❤️🎼

Click play here ➡️ https://t.co/u7cOBWrdcK

#StayHome https://t.co/gV43lFtgDJ"
2020-04-25 01:38:25+00:00,"RT @thewire_in: With shuttered mosques, coronavirus curfews and bans on mass prayers from Senegal to Southeast Asia, some 1.8 billion Musli…",nijam_l,India,I am not a Actor but a genuine Re Actor,21,179,3951,False,"With shuttered mosques, coronavirus curfews and bans on mass prayers from Senegal to Southeast Asia, some 1.8 billion Muslims are facing a Ramadan like never before.

https://t.co/pdMG7Fx8qG"
2020-04-25 01:38:28+00:00,"RT @maduro_en: RT @laradiodelsur: 85% of venezuelans support the government response to the COVID-19 pandemic
https://t.co/e5hItS4s09 https…",EmbavenezIndia,"New Delhi, India","Embajada de la República Bolivariana de Venezuela en India, con sede en Nueva Delhi",3497,1241,29263,False,"RT @laradiodelsur: 85% of venezuelans support the government response to the COVID-19 pandemic
https://t.co/e5hItS4s09 https://t.co/BV0olMvIhx"
2020-04-25 01:38:29+00:00,RT @jgopikrishnan70: All shops to be opened from today - except in Malls - with 50% staff with Social Distancing norms + wearing masks....n…,sachanuj,"New Delhi, India","Nammo Buddhay 🙂
कर्म के फल से कोई नहीं बच सकता है।",374,683,38240,False,All shops to be opened from today - except in Malls - with 50% staff with Social Distancing norms + wearing masks....not allowed in Hot Spots classified by the States https://t.co/bk9NeThE63
2020-04-25 01:38:29+00:00,"Instead of Tackling Corona, BJP Spreading Virus of Hatred: Sonia  https://t.co/ZPoNq5FyTd .... Congress had already started spread of political virus which is more dangerous than Coronavirus. It's for the people to vaccinate the party so that country is safe.",ANDevendraKumar,"Hyderabad, India",😃,3,58,2806,False,No Value Mentioned
2020-04-25 01:38:31+00:00,"RT @AskAnshul: She's Savita Kovind, India's First Lady, stitching face masks for shelter homes

When President Kovind nominated ex CJI Gogo…",ndhanashekar,"Bengaluru, India",Nationalistic views,86,125,643,False,"She's Savita Kovind, India's First Lady, stitching face masks for shelter homes

When President Kovind nominated ex CJI Gogoi for Rajya Sabha, The Telegraph mocked with headline 'Kovind, not Covid, did it'

But Telegraph won't report how Savita Kovind is fighting against Covid-19 https://t.co/phfP07oXXv"
2020-04-25 01:38:32+00:00,RT @RMCpost: Interestingly... Numbskulls of MHA who are doing dances for Maulana Saad.. sometimes pretending they dont know where he is...…,kachoomar,"New Delhi, India",No Value Mentioned,846,449,146766,False,Interestingly... Numbskulls of MHA who are doing dances for Maulana Saad.. sometimes pretending they dont know where he is... want to ensure shops only operate at 50% strength.. all their Pandu Havaldars have been deployed to check this?.. #Comedians https://t.co/IgTFaHpXmW
2020-04-25 01:38:33+00:00,"@narendramodi Heavy crowd can be seen in Markets in Ramjan period, without having any social distensing, who will be responsible if there is even one corona case among the crowd. Isn't it a starting of community transfer of the disease. An attempt for mass murder of who are following lock down",yatesharm,"Bulandshahr, India","Yes, I am proud to be an Indian.",43,75,976,False,No Value Mentioned
2020-04-25 01:38:35+00:00,"@vivekagnihotri 1. MP: 34 policemen test +ve for COVID-19 in Bhopal.
Official said: Initial infections in police caused when cops went to search for Tablighi Jamaat attendees.

2. Rajasthan: Muslim Mochi Mohalla in Ajmer’s Dargah area becomes latest Covid-19 hotspot. 79 cases in last 24 hours.",AtulSisodiya3,"Mainpuri, Uttar Pradesh, India",Civil Engineer,613,577,2387,False,No Value Mentioned
2020-04-25 01:38:36+00:00,"RT @ishkarnBHANDARI: We are in Slog Overs, last 9 days. We can’t be careless &amp; lose all benefits given by early lockdown &amp; wash way efforts…",kartheesanp,"Bengaluru, India",No Value Mentioned,89,334,47353,False,"We are in Slog Overs, last 9 days. We can’t be careless &amp; lose all benefits given by early lockdown &amp; wash way efforts of Health Care professionals.

 https://t.co/sG1p50V17Y"
2020-04-25 01:38:40+00:00,"RT @askboomer1949: S T U P I D 
L E A D I N G 
I G N O R A N T

I voted for #HillaryClinton 
I did not vote for third party, republican or…",tbooker1,Indiana,"Ten year teacher then twenty year businessman, retired and trying to educate my conservative pals in the error of their thinking. #UniteBlue #CTL #P2 #RESIST",35302,34587,75837,False,"S T U P I D 
L E A D I N G 
I G N O R A N T

I voted for #HillaryClinton 
I did not vote for third party, republican or stay home and pout
My conscience is clear - is yours?
#COVID19
RT
After Trump's comments, Lysol maker warns of 'improper use' https://t.co/c6EWoT5GOU via @msnbc"
2020-04-25 01:38:43+00:00,"RT @plowmanj3: I don’t doubt that at all.
https://t.co/IBPfl3MjbS",MarkSho10009813,"Indiana, USA","Working man, Spec Ops Dad, Grandfather, Navy Brat",1099,898,29012,False,"I don’t doubt that at all.
https://t.co/IBPfl3MjbS"
2020-04-25 01:38:44+00:00,RT @s_szama: Good Morning Wish You Very Happy Healthy Joyful Weekend With all Happiness in your life #StayAtHome @rohanmintoo @TajendraRajo…,rajneesh350,"New Delhi, India","(っ◔◡◔)っ
मुसाफ़िरों की आँखों में रोपकर कल के ख़्वाब..
नामालूम वो रहबर कब रहजन बन गया..........!!
                                            (っ◔◡◔)っ",15989,810,179340,False,Good Morning Wish You Very Happy Healthy Joyful Weekend With all Happiness in your life #StayAtHome @rohanmintoo @TajendraRajora @rajneesh350 @vindhyachal_raj @DrSanjeevRajp4 @ranikhet @RiituS @Ritu25826785 @RituRahul @RiaRevealed @Jayrajraghavan https://t.co/tHcdB1wiUg
2020-04-25 01:38:45+00:00,"Bill Gates has been stockpiling food in basement for Pandemic 
https://t.co/U9A9RExkcW",igautambiswas,India,Logical/Tech and Science/Humanity first/ Some sense of humour/RT's are not endorsement/Air Veteran/Civil Aviation Maintenance/Satyameva Jayate 🇮🇳,391,3513,20283,False,No Value Mentioned
2020-04-25 01:38:46+00:00,"That $175 is FULL OF #COVID19.

Fact.

#livePD",MyHeartAmerica,"Indiana, USA ",🇺🇸#MAGA  🦅#KAG  🥇#AmericaFirst  🏆Trump  🙏🕯️Christian. PARLOR @AmericanHeart https://t.co/OJk4XyWFE6,22141,20796,72466,False,No Value Mentioned
2020-04-25 01:38:46+00:00,RT @narendramodi: Today’s discussion with Panchayat Sarpanchs was very insightful. They shared their strategies of fighting COVID-19. I sal…,Smartbidya,India,Work as a Young Professionals of BRLP_ World Bank Project I @brlps_jeevika l MBA Graduate @kiituniversity l Tribal Activist l RTs are not endorsement l,102,413,1477,False,Today’s discussion with Panchayat Sarpanchs was very insightful. They shared their strategies of fighting COVID-19. I salute all Sarpanchs for their hardwork and efforts in these extraordinary times. https://t.co/vXHQYPL7h6
2020-04-25 01:38:47+00:00,Fake https://t.co/ynoeFizkt6,neymardilip,"Chennai, India",தல/கோஹ்லி/நெய்மார்/@neymardilip177 BackUp Id  /,465,288,31835,False,No Value Mentioned
2020-04-25 01:38:47+00:00,"RT @imandi_sai: she is my own sister, who is stranded in kota rajasthan and suffering due to lockdown .. ..so please higher official do wat…",mathe_manoj,"Vijayawada, India",𝓛𝓸𝓿𝓮 𝓹𝓮𝓸𝓹𝓵𝓮 𝓶𝓪𝓴𝓮 𝓵𝓪𝓾𝓰𝓱 🖤,50,273,15,False,"she is my own sister, who is stranded in kota rajasthan and suffering due to lockdown .. ..so please higher official do watch this video and respond #SendUsBackHome @ysjagan @KTRTRS @MinisterKTR @APPOLICE100 @TimesNow https://t.co/fX6vf6sMHj"
2020-04-25 01:38:48+00:00,"RT @SCS_Disputes: “China’s deployment of research vessels, UUVs and submarines in the Indian Ocean Region, even when the Covid-19 virus was…",harsha7_c,"Hyderabad, India",Interested in Geopolitics | Nationalist | SwayamSevak | Entrepreneur | HEC MBA Grad | Ex-Prime Minister's Rural Development Fellow,83,354,7227,False,"“China’s deployment of research vessels, UUVs and submarines in the Indian Ocean Region, even when the Covid-19 virus was ravaging the country, has not shown any decline.” @orfonline https://t.co/C2iIrMYn78"
2020-04-25 01:38:52+00:00,"RT @dir_URJameel: As the holy month begins, may Allah accept all your prayers in this Ramadan &amp; bless the world during this time of crisis.…",Krishtamilan7,"Coimbatore, India",Doing engineering ECE,34,94,1556,False,"As the holy month begins, may Allah accept all your prayers in this Ramadan &amp; bless the world during this time of crisis.
Please stay at home and pray. 
Stay safe -U.R.J. @ihansika #Str #Simbu
#RamadanMubarak https://t.co/SjTeuumhkV"
2020-04-25 01:38:53+00:00,"RT @RTOBHADRAK: Due to some unavoidable issues the winners of Online Quiz of 23.4.2020 will be declared at 2 PM on 25.4.2020.
#StayHome",dharmendra_hota,"Bhadrak, India",My Life is bettar,59,323,1712,False,"Due to some unavoidable issues the winners of Online Quiz of 23.4.2020 will be declared at 2 PM on 25.4.2020.
#StayHome"
