created_at,full_text,screen_name,location,description,followers_count,friends_count,statuses_count,verified,full_retweet_text
2020-02-03 21:05:25+00:00,RT @timesofindia: Frantic Pakistani students in virus-hit Wuhan ask their government to follow India's example to evacuate them https://t.c…,varun18vijay,"Bengaluru, India","News-Curator Content-Curator Political-Analyst Patriot 
(Subliminal/Hidden Messages Decoder) Trend-Spotter
Retweets, Likes imply #interesting, NOT endorsements",1378,3937,557586,False,Frantic Pakistani students in virus-hit Wuhan ask their government to follow India's example to evacuate them https://t.co/7ppkT5PFXp via @TOIWorld
2020-02-03 21:05:32+00:00,A glittery image of horror https://t.co/Q8bQzCIPBV,RamShukla_,"Mumbai,India",Bed in the bush with stars to see...,101,317,3307,False,No Value Mentioned
2020-02-03 21:05:45+00:00,"RT @Forbes: As coronavirus impacts China’s economy, phase 1 trade deal purchases now at risk https://t.co/r2TQ2F0QeO https://t.co/ZR2lPqMHZS",MarkECraft,"Carmel, IN (Indianapolis)","#CorpComms #Marketing #Media #Tech #AI #AR #IoT; All things #TheHumanCondition🤷 Former TV anchor, reporter, producer; lobbyist; Opinions own; RTs🚫endorsements",3048,4977,42167,False,"As coronavirus impacts China’s economy, phase 1 trade deal purchases now at risk https://t.co/r2TQ2F0QeO https://t.co/ZR2lPqMHZS"
2020-02-03 21:05:47+00:00,RT @ExSecular: Hello @khanumarfa out of 324 people evacuated from China 124 are Muslims and all were chanting har har modi ghar ghar Modi .…,suraj_shashank,"India,up",I m a student of commerce,9,49,187,False,Hello @khanumarfa out of 324 people evacuated from China 124 are Muslims and all were chanting har har modi ghar ghar Modi .. am just saying
2020-02-03 21:05:58+00:00,"RT @JenniferHYChan: Alarming. One #coronavirus infected woman has spread to 25 others‼️

And, this is reported by #China state media. 

#Wu…",pink_lungi,കേരളം . India ,Proud Malayali . Football freak.  Chelsea FC. GKFC. Mogralian.,323,1016,58274,False,"Alarming. One #coronavirus infected woman has spread to 25 others‼️

And, this is reported by #China state media. 

#WuhanCoronavirus
#CoronavirusOutbreak
#2019_nCov https://t.co/X3OypWkRyD"
2020-02-03 21:06:08+00:00,"RT @Pun_Starr: China has built a 1000 bed hospital for Coronavirus patients in just 10 days.

Meanwhile, the govt of India hasn't been able…",SunnyBissu,"Mumbai, India",Impermanent.,509,635,28878,False,"China has built a 1000 bed hospital for Coronavirus patients in just 10 days.

Meanwhile, the govt of India hasn't been able to move anywhere for 2 months because of traffic jam at Shaheen Bagh."
2020-02-03 21:06:09+00:00,RT @MailOnline: Whistleblower arrested in China after secretly filming ‘piles of body bags at a hospital in coronavirus ground zero Wuhan’…,jcoplen1855,"Indiana, USA",Love USA! MAGA! Donald J Trump is my President!👏🇺🇸 Happily married.,3227,3972,44864,False,Whistleblower arrested in China after secretly filming ‘piles of body bags at a hospital in coronavirus ground zero Wuhan’ #CoronavirusOutbreak https://t.co/cz4hZhP95a
2020-02-03 21:06:11+00:00,"RT @AgentSaffron: No civilization can last 4000 years and constantly expand their lands and power without being as ruthless as the Hans.

S…",Yogi210875,"Faridabad, India",Lives in Greenfield colony Faridabad. From village Hathchhoya District Shamli UP,2055,5000,531783,False,"No civilization can last 4000 years and constantly expand their lands and power without being as ruthless as the Hans.

Sad for the boy tho. https://t.co/9ihfWmNrYW"
2020-02-03 21:06:18+00:00,"Fallow this to be away from the 
#corona virus 
 Masjid Imam' s should  make a routine of this on five times prayer https://t.co/CPkrMVeLL4",shaheen_bajad,Jammu And Kashmir india,"Government & Public Utilities social action
 president at JK TRIBAL YOUTH AND STUDENTS  ASSOCIATION  and state secretory at BAHRITYA GUJJAR PARISHED",81,95,913,False,No Value Mentioned
2020-02-03 21:06:23+00:00,"RT @timesofindia: UAE suspends all China flights, except Beijing, amid coronavirus outbreak https://t.co/y6jTpwlnAJ via @TOIWorld",varun18vijay,"Bengaluru, India","News-Curator Content-Curator Political-Analyst Patriot 
(Subliminal/Hidden Messages Decoder) Trend-Spotter
Retweets, Likes imply #interesting, NOT endorsements",1379,3937,557586,False,"UAE suspends all China flights, except Beijing, amid coronavirus outbreak https://t.co/y6jTpwlnAJ via @TOIWorld"
2020-02-03 21:06:32+00:00,"RT @INUnPlugged: This is Dr Jagdish (an ent surgeon &amp; a Stand up Comedian) on Corona virus :- Hilarious at the same time informative 😃😃
#co…",agrasen1,"Faizabad, Uttar Pradesh, India","“Hasratein. Hairatein. Tamannayein”

“Ek Duniyaa Mein, Kitni Duniyaaein” ツ









































Tweets and Retweet are my personal views 😉",222,2028,5072,False,"This is Dr Jagdish (an ent surgeon &amp; a Stand up Comedian) on Corona virus :- Hilarious at the same time informative 😃😃
#coronarivirus https://t.co/v2Iu7p24gE"
2020-02-03 21:06:44+00:00,"RT @NikunjGargN: LATEST #coronavirusindia : This morning's update
I98 samples tested:
195 negative , 3 positive ( one NEW one detected, als…",dksharma27,"Delhi, India","AAP Supporter, Engg, Wish to see a Corruption Free India",434,111,89889,False,"LATEST #coronavirusindia : This morning's update
I98 samples tested:
195 negative , 3 positive ( one NEW one detected, also medical student from Wuhan, from Kerala)..This Is Now The 3rd Case Of The Virus Detected In India."
2020-02-03 21:06:49+00:00,@BhaavnaArora Correct it please.. Directly to Wuhan,Prahladkp,"Hyderabad, India","Proud Indian, Sanatan Dharmi, Nationalist, X-Secularist.",87,254,13303,False,No Value Mentioned
2020-02-03 21:06:51+00:00,"@BhagwaGyani Any regime change within China rn would be catastrophic, I think the people who could do the coup understand this. Public anger is rising against the CCP tho.",JatNationalist,India,Traditional Conservative. Hardcore Nationalist. Currently focused on the Coronavirus (COVID-19).,1565,703,10609,False,No Value Mentioned
2020-02-03 21:06:53+00:00,"RT @htTweets: Outbreak diary: China lost crucial days, weeks in the fight against the Coronavirus

(report by @spatranobis)

https://t.co/B…",varun18vijay,"Bengaluru, India","News-Curator Content-Curator Political-Analyst Patriot 
(Subliminal/Hidden Messages Decoder) Trend-Spotter
Retweets, Likes imply #interesting, NOT endorsements",1379,3937,557586,False,"Outbreak diary: China lost crucial days, weeks in the fight against the Coronavirus

(report by @spatranobis)

https://t.co/BzYRSbjwFf https://t.co/JycIuWIKUg"
2020-02-03 21:06:57+00:00,"RT @ABC: China builds a makeshift hospital in 10 days in Wuhan, the epicenter of the coronavirus outbreak. https://t.co/KL16AkLqW7 https://…",Munendra100,"Gurgaon, India",My retweets are just proofs.,80,590,11293,False,"China builds a makeshift hospital in 10 days in Wuhan, the epicenter of the coronavirus outbreak. https://t.co/KL16AkLqW7 https://t.co/vjlezpusWO"
2020-02-03 21:07:02+00:00,"RT @realDonaldTrump: Republicans in Iowa, go out and Caucus today. Your great Trade Deals with China, Mexico, Canada, Japan, South Korea an…",amarendrahbti,"Soraon, Allahabad, India ","Dancer,Comedian,Performer,SDE,Writer,
Speaker,Founder,Innovator,Humanitarian,
Record Holder,All Achiever,Resillient,Die hard fan of @ihrithik,@michaeljackson",811,771,12566,False,"Republicans in Iowa, go out and Caucus today. Your great Trade Deals with China, Mexico, Canada, Japan, South Korea and more, are DONE. Great times are coming, after waiting for decades, for our Farmers, Ranchers, Manufacturers and ALL. Nobody else could have pulled this off!"
2020-02-03 21:07:13+00:00,"RT @CarlosdelRio7: The #2019nCoV update: 17,487 confirmed cases (17,308 in China).  26 countries reporting cases including 11 in US. 362 de…",mmcclean1,"Indianapolis, In","Internal Medicine @IUintmed, Chief Resident Eskenazi Hospital. Proud Hoosier. Future Infectious Diseases Fellow at @IUIDfellowship. Kid Wrangler.",93,246,162,False,"The #2019nCoV update: 17,487 confirmed cases (17,308 in China).  26 countries reporting cases including 11 in US. 362 deaths so far. No cases in Africa, Latin America or the Caribbean. Some estimates calculate there are already 100,000 infected."
2020-02-03 21:07:27+00:00,"RT @htTweets: ‘I salute you’: @ShatruganSinha's surprise tweet to PM Modi on Coronavirus

https://t.co/352MjbyeuX https://t.co/Z1vbjIbMGe",varun18vijay,"Bengaluru, India","News-Curator Content-Curator Political-Analyst Patriot 
(Subliminal/Hidden Messages Decoder) Trend-Spotter
Retweets, Likes imply #interesting, NOT endorsements",1379,3937,557586,False,"‘I salute you’: @ShatruganSinha's surprise tweet to PM Modi on Coronavirus

https://t.co/352MjbyeuX https://t.co/Z1vbjIbMGe"
2020-02-03 21:07:39+00:00,@Reality_Chaote @YouTube #CoronaVirus #mutiert in #Deutschland? / New #Form of #Transmission #found in #Germany [#FACT] #wuhan #china #wuhanv... https://t.co/MBU8oaeX1Z via @YouTube #AfD #AfDWirkt #politik #Corona #Epidemis #Epidemic #BioWar #WHO #Wuhanvirus #World #Healthy #China #EU #Brexit #Bayern https://t.co/tZFSFG1g8o,tripathipkhere,"Lucknow, India","Ex Signaler of Indian Army, Now Trader  of commodity market 
and Investor of Equity market",27,8,702,False,No Value Mentioned
2020-02-03 21:07:44+00:00,"RT @anandmahindra: Brent crude at $56,30! Clearly fallen due to the situation in China along with high US inventories. But what a great boo…",usha_ravi,"Tamil Nadu, India",A teacher and a proud bhakt. Proud of Hindu culture. carnatic music and temples.,180,805,9986,False,"Brent crude at $56,30! Clearly fallen due to the situation in China along with high US inventories. But what a great boon to India’s tough fiscal challenge. I hope we can do enough forward purchases to improve the deficit calculations!"
2020-02-03 21:08:12+00:00,"RT @samiir: Out of 324 Indians evacuated from China 124 are Muslims

As a track record Modi govt has never discriminated against any Indian…",Good74738318,India,"Nationaliist. Fiight Isssllllaammmism. Pro Modi. Pro Trump. Pro Brexxit. Retweet my tweet, don't like it. 💯% Follow back. I will unfolllow for non follow back.",3047,4093,73723,False,"Out of 324 Indians evacuated from China 124 are Muslims

As a track record Modi govt has never discriminated against any Indian National on basis of community

Be it Ujjwala, Ayushman, Mudra or any govt schemes

Has media ever highlighted this?

1/2"
2020-02-03 21:08:32+00:00,RT @scm_hubspot: How Will The Coronavirus Affect Supply Chain Operations Across The Globe? https://t.co/03HU7CPDq4 #SupplyChain #IoT #Logis…,IoT_Technojeder,India,Hi! I am TechnorIoT Bot. I will help you out in exploring the world of IoT!😎,1119,32,82586,False,How Will The Coronavirus Affect Supply Chain Operations Across The Globe? https://t.co/03HU7CPDq4 #SupplyChain #IoT #Logistics #Technology #Management
2020-02-03 21:08:54+00:00,"RT @htTweets: China lauds ‘iron ally’ Pakistan for not evacuating stranded from Wuhan

(report by @spatranobis)

https://t.co/KVdDTp6iit ht…",varun18vijay,"Bengaluru, India","News-Curator Content-Curator Political-Analyst Patriot 
(Subliminal/Hidden Messages Decoder) Trend-Spotter
Retweets, Likes imply #interesting, NOT endorsements",1379,3937,557586,False,"China lauds ‘iron ally’ Pakistan for not evacuating stranded from Wuhan

(report by @spatranobis)

https://t.co/KVdDTp6iit https://t.co/bJeovXOVkB"
2020-02-03 21:08:58+00:00,"RT @BBCWorld: Time-lapse video shows new hospital being built in China in just 10 days

Huoshenshan hospital in Wuhan has been built to hel…",rahulone8,India,Being broke is a part of journey.  Staying broke is a fucking choice.,14,260,599,False,"Time-lapse video shows new hospital being built in China in just 10 days

Huoshenshan hospital in Wuhan has been built to help deal with coronavirus patients

https://t.co/IBxpG8lIRt https://t.co/aXhiX7KqyT"
2020-02-03 21:09:00+00:00,RT @sanjeevsanyal: Real super heroes exist,ABHINANDHANS10,India,"Senior Front End Developer @ Infosys

LinkedIn: https://t.co/TPl0I9MrvQ",55,1068,722,False,Real super heroes exist https://t.co/8uhAVBU2A0
2020-02-03 21:09:13+00:00,😀😀😀 hame to aap par hasi aate hai 😂😂😂😂 man if you visit other country then only you can feel that https://t.co/X0OY38AmZc,PremHalder10,"Hyderabad, India",Prem,12,27,1086,False,No Value Mentioned
2020-02-03 21:09:27+00:00,RT @attomeybharti: Libtards and woke chomus who are amazed at the pace at which China built a new hospital are the same people who support…,AshwaniChowdhry,"Lucknow, India",A proud Indian. National interest supreme.,358,854,178649,False,Libtards and woke chomus who are amazed at the pace at which China built a new hospital are the same people who support PIL after PIL against infra projects in India. Matlab bachpan se itne bewakoof hote hain ya woke banNe ke chakkar mein ye sab karte hain?
2020-02-03 21:09:41+00:00,"RT @Ingenieurbiomed: Liang Wudong, who was treating patients with corona virus in Wuhan, became infected while treating his patients and be…",Kanhar_,"Orissa, India","Nothing special to know about me !!
ଖାଣ୍ଟି ଓଡ଼ିଆ 😍",75,293,4306,False,"Liang Wudong, who was treating patients with corona virus in Wuhan, became infected while treating his patients and becomes the first doctor to die for corona virus. A reminder that while everyone tries to avoid it, front line medical staff risk their lives to save others. https://t.co/wVNHLCKnFZ"
2020-02-03 21:09:58+00:00,RT @Editor_Orbat: This is not helpful: China accuses US of spreading panic about Coronavirus-2019. https://t.co/hYExDWJTim You have this fa…,IndiaAnalyst,India,"Pro-logic. Pro-Choice, Anti-Hypocrisy, India First. rt/follow is nt endorsement.
Profile Pic by domdeen / https://t.co/I3aK2xrCaz #CoronaVirus #WuhanVirus",2534,1933,175092,False,This is not helpful: China accuses US of spreading panic about Coronavirus-2019. https://t.co/hYExDWJTim You have this fatal airborne virus that is undetectable during incubation; 1 infected person can give it to 2-3 others; even face mask inadequate as it can be contracted
2020-02-03 21:10:00+00:00,"A new case, travel advisories, appeal: The latest on coronavirus in India

https://t.co/lnXhAlfbbz https://t.co/LsCXRJCkAx",htTweets,India,"One of India's largest media companies. Latest news from around the world. Retweets are not endorsements

Telegram: https://t.co/oRjuzAvYUY",7292931,128,691159,True,No Value Mentioned
2020-02-03 21:10:05+00:00,"RT @DrJagdishChatur: I am corona virus! I have a message for you on how to avoid me (in Hindi) 
Please make viral like me...hehehe

#corona…",pratikparthe,"Bengaluru, India",It's better to twitter than watching rubbish news channels.,66,139,928,False,"I am corona virus! I have a message for you on how to avoid me (in Hindi) 
Please make viral like me...hehehe

#coronavirus #coronavirusoutbreak #corona https://t.co/GcpbCDU268"
2020-02-03 21:10:12+00:00,RT @ExSecular: Hello @khanumarfa out of 324 people evacuated from China 124 are Muslims and all were chanting har har modi ghar ghar Modi .…,ayushgw,India ,NaMo-ed digital nomad 🌴 | Web Developer. Dogra. Yog & Code ultra.,69,284,1253,False,Hello @khanumarfa out of 324 people evacuated from China 124 are Muslims and all were chanting har har modi ghar ghar Modi .. am just saying
2020-02-03 21:10:21+00:00,RT @vijaita: Are Indians Guinea pigs?Who allowed a Wuhan based lab to conduct trials on Nagas last year? The lab in collaboration with the…,mayank1999s,India,"Sanatan believer.
Proud HINDU & INDIC civilization researcher.
Reject left historians
YouTube channel for fact check clips. Subscribe. 
https://t.co/HLKKvN0uPw",482,1521,171564,False,"Are Indians Guinea pigs?Who allowed a Wuhan based lab to conduct trials on Nagas last year? The lab in collaboration with the U.S  took blood samples from Naga bat hunters,in violation of all rules. A probe has now been ordered. Read this story by @BShajan
https://t.co/xe3zSO7jGu"
2020-02-03 21:10:38+00:00,"RT @TheCalmAadmi: While China is scaling new heights every day, BJP’s India is doing Hindu-Muslim. A 1000 bed hospital built in 10 days! vi…",epawitter1,"Bengaluru, India",rtd. PSU employee,166,45,32365,False,"While China is scaling new heights every day, BJP’s India is doing Hindu-Muslim. A 1000 bed hospital built in 10 days! via @ABC #AmitShahMustResign https://t.co/cSbaadZhx1"
2020-02-03 21:10:40+00:00,"RT @ABC: China builds a makeshift hospital in 10 days in Wuhan, the epicenter of the coronavirus outbreak. https://t.co/KL16AkLqW7 https://…",rahulone8,India,Being broke is a part of journey.  Staying broke is a fucking choice.,14,260,599,False,"China builds a makeshift hospital in 10 days in Wuhan, the epicenter of the coronavirus outbreak. https://t.co/KL16AkLqW7 https://t.co/vjlezpusWO"
2020-02-03 21:10:59+00:00,"RT @LibertyBelleCJL: Ladies and gentlemen, #YourTolerantLeft spreading their kindness and compassion.",AgnesClaire,Indiana,Followed by @HarrietBaldwin @RealJamesWoods @DineshDSouza @TedCruz 🚫 by @CAIRNational @MohamedElibiary #CancerSurvivor,6288,5956,164095,False,"Ladies and gentlemen, #YourTolerantLeft spreading their kindness and compassion. https://t.co/m5L3sBUdr7"
2020-02-03 21:11:02+00:00,"RT @arifaajakia: After India, Bangladesh &amp; Sri Lanka also sent special flights to #Wuhan to evacuate their children, stuck in virus infecte…",luckyfresh,India,"’I AM’ two of the most powerful words, for what you put after them shapes your reality.",463,1550,190380,False,"After India, Bangladesh &amp; Sri Lanka also sent special flights to #Wuhan to evacuate their children, stuck in virus infected city of China.
Pakistani bache bechaare laa waaris hain. Yateem hain. Desh maan hoti hai and our mother is slave of Pak Foj, the beghertest of all. https://t.co/LzulD44hFO"
2020-02-03 21:11:55+00:00,Novel Coronavirus: #Tripura sets up special isolation unit - https://t.co/RkNyktwxgo,promass_002,India,"ProMASS, a non-profit registered society is committed to excel community forum, community media, and community media contents.",124,116,11347,False,No Value Mentioned
2020-02-03 21:11:57+00:00,"RT @htTweets: Hong Kong to close ports, border checkpoints with China to contain coronavirus

https://t.co/Pr9ZBvI2Vb https://t.co/qnWi2SFM…",varun18vijay,"Bengaluru, India","News-Curator Content-Curator Political-Analyst Patriot 
(Subliminal/Hidden Messages Decoder) Trend-Spotter
Retweets, Likes imply #interesting, NOT endorsements",1379,3937,557586,False,"Hong Kong to close ports, border checkpoints with China to contain coronavirus

https://t.co/Pr9ZBvI2Vb https://t.co/qnWi2SFMXd"
2020-02-03 21:12:13+00:00,"@Gulalai_Ismail @ImranKhanPTI https://t.co/fVhRL4UMct 
I am very shocked to see the reaction of Pak Govt. They are disowning their citizens. I am very lucky that I wasn't born in Pakistan. A country which is unable to take the responsibility of its citizens is not a country.",rrohitroyr,"Kolkata, India","Student of Physics ,
Nationalist 🇮🇳 ,
Follower of Netaji and B.R Ambedkar ,
Against Gandhian Philosophy",30,610,411,False,No Value Mentioned
2020-02-03 21:12:28+00:00,#NovelCoronavirus: Tripura sets up special isolation unit - https://t.co/RkNyktwxgo,promass_002,India,"ProMASS, a non-profit registered society is committed to excel community forum, community media, and community media contents.",124,116,11347,False,No Value Mentioned
2020-02-03 21:12:42+00:00,"RT @OKarthik82: We handover de@d Pak soldiers with respect
We get back behe@ded mutiIated bodies of our soldiers

We allow Pak patients to…",AshwaniChowdhry,"Lucknow, India",A proud Indian. National interest supreme.,358,854,178649,False,"We handover de@d Pak soldiers with respect
We get back behe@ded mutiIated bodies of our soldiers

We allow Pak patients to be treated 
We get back incidents of min0r Hindμ girls abducted converted r@ped

We help Pak students get home
What are we getting back this time?
#Hypocrite https://t.co/aqaZZG8so4"
2020-02-03 21:12:53+00:00,"RT @yessirtns: Heard Bollywood movie is under production:

SRK is a college student ,whose girlfriend is touring in China. She gets infecte…",kwt_sandeep,India,"Tech savvy, severely allergic to bullshit",179,128,41048,False,"Heard Bollywood movie is under production:

SRK is a college student ,whose girlfriend is touring in China. She gets infected with coronavirus &amp; has been quarantined in a high security hospital in China..etc etc

The title of  movie is: 

CORONA PYAR HAI

😂🤣😂🤣
#coronarivirus"
2020-02-03 21:12:58+00:00,RT @iso30: Coronavirus: Can AI (Artificial Intelligence) Make A Difference? https://t.co/Nzbu4WhQhw,TechnoJeder,India,Hi! I am TechnorBot and i will help you out in exploring the world of #AI!😎,1274,48,92713,False,Coronavirus: Can AI (Artificial Intelligence) Make A Difference? https://t.co/Nzbu4WhQhw
2020-02-03 21:13:00+00:00,"RT @htTweets: Outbreak diary: China lost crucial days, weeks in the fight against the Coronavirus

(report by @spatranobis)

https://t.co/B…",varun18vijay,"Bengaluru, India","News-Curator Content-Curator Political-Analyst Patriot 
(Subliminal/Hidden Messages Decoder) Trend-Spotter
Retweets, Likes imply #interesting, NOT endorsements",1379,3937,557586,False,"Outbreak diary: China lost crucial days, weeks in the fight against the Coronavirus

(report by @spatranobis)

https://t.co/BzYRSbjwFf https://t.co/31qSbcpc1j"
2020-02-03 21:13:30+00:00,RT @detresfa_: Ambulance convoy videos shared out of #Wuhan suggest mass transportation of infected people to #Huoshenshan hospital have be…,avs_IND,"New Delhi, India","Biologically, Emotionally, Financially, Intellectually, N/E, Indian.........👽NationFirst | Himalaya | Parvati-Valley | Defence | Politics | MUFC | RT≠ENDT",4294,683,53023,False,Ambulance convoy videos shared out of #Wuhan suggest mass transportation of infected people to #Huoshenshan hospital have begun as authorities in #China ramp up efforts to battle the #WuhanCoronavirus #coronavrius #nCoV2020 https://t.co/Pqcc0Jslw5
2020-02-03 21:13:33+00:00,The latest MilkyDwarf! https://t.co/QmxwKOVeQB Thanks to @chip_dixon @Andy_B666 @MCIMENAOfficial #coronavirus #china,MilkyDwarf,"Kolkata, WB, India","Avataar @MilkyDwarf, world wide web Magazine, published 12 June, 2008.",250,430,4305,False,No Value Mentioned
2020-02-03 21:13:40+00:00,"RT @syedZn_Here: Turkey 🇹🇷 Has Sent Medical Aid To China 🇨🇳 And Told The World that
Islam Does not Respond To Evil With Evil. This is Beaut…",i_am_ahte,"Delhi, India",EnGinerD by profession | Professional procrastinator | Indian | Cricket lover |  SRK fan |  Kohli fan | Cinephile | Proud to be Jamian,157,491,4436,False,"Turkey 🇹🇷 Has Sent Medical Aid To China 🇨🇳 And Told The World that
Islam Does not Respond To Evil With Evil. This is Beauty of Islam
❤️ #coronaviruse https://t.co/Mf7tEzQuy5"
2020-02-03 21:13:45+00:00,"RT @CDCgov: Are you interested in gaining population health experience as an employee in public health, health care, and community health s…",indychristian,Indianapolis,"It is possible to express God’s love to every man, woman, young person in this city by the year 2020. #Love2020",3535,3900,40277,False,"Are you interested in gaining population health experience as an employee in public health, health care, and community health settings? Apply for the CDC Population Health Training In Place Program! Applications are open now through Feb. 29. https://t.co/ElglS9bJ8r https://t.co/kYI3Jd9rPC"
2020-02-03 21:13:45+00:00,"RT @UNICEFROSA: Help protect your children from #coronavirus:

💧 Encourage children to wash their hands with soap and water for at least 20…",tpramprasath,"Ramnad, Tamilnadu, India","Simple person. Dad is role model forever. Movies, Music & Sports loving Civil Er. APJ sir inspiration forever. Fav #Sachin #ThalaAjith #IR #ARR #U1 #Messi",694,3202,780,False,"Help protect your children from #coronavirus:

💧 Encourage children to wash their hands with soap and water for at least 20 seconds
😷 Keep children away from anyone coughing or sneezing
👩‍⚕️ Take your children to the doctor if they develop a fever or flu-like symptoms https://t.co/7wcQjvdBmt"
2020-02-03 21:13:49+00:00,"Apple Closes Chinese Stores, Corporate Offices Due to Coronavirus https://t.co/cNvPT1poi4 https://t.co/w09YkCuTSM",AjayStfc,india,Let’s follow each other!😉,281,156,9253,False,No Value Mentioned
2020-02-03 21:13:50+00:00,RT @noconversion: Converted RBC from Kerala ...She was a medical student in china .. she is already affected by the virus ...and she is ref…,pravin19o9,"Mumbai, India",No Value Mentioned,102,0,13294,False,"Converted RBC from Kerala ...She was a medical student in china .. she is already affected by the virus ...and she is refusing medical treatment ..
--- https://t.co/IBirUwOoi9"
2020-02-03 21:13:52+00:00,"RT @TomValletti: #Coronavirus On a train in Italy. A teenage Chinese boy boards the train. A woman comments loudly: “There you go, we are a…",shubhos,"New Delhi, India","Digital Marketer | Consult w Brands, Agencies, Government | Startup Co-Founder | Influencer | Columnist | First Indian to cycle Manali-Leh solo, July 2001",3721,2180,11595,False,"#Coronavirus On a train in Italy. A teenage Chinese boy boards the train. A woman comments loudly: “There you go, we are all going to be infected.” He replies in perfect Italian with a Roman inflection: “Ma’am, in my whole life I’ve seen China only on google maps.” 
Applauses."
