created_at,full_text,screen_name,location,description,followers_count,friends_count,statuses_count,verified,full_retweet_text
2020-04-04 14:43:25+00:00,"RT @ShefVaidya: 22,000 people quarantined, at tax payer’s cost. Can you imagine the massive manpower, efforts and expense involved in conta…",rahul_ccu,India,"(Machine ,Deep & Reinforcement) Learning enthusiast.
IEEE GLOBECOM 2019, accepted
Data Scientist 

RT , LIKE ≠ Endorsement",44,266,587,False,"22,000 people quarantined, at tax payer’s cost. Can you imagine the massive manpower, efforts and expense involved in contact tracing and isolating these people? 22,000 people. Let that sink in! https://t.co/Nyd1D8xuWm"
2020-04-04 14:43:26+00:00,"RT @MdFujailAhmed: #BJP MLA Gorak Pardung raped a doctor in Itanagar, the capital of #ArunachalPradesh.
Is this the real character of them?…",AfzalKazi15,Nasik india,No Value Mentioned,510,297,36678,False,"#BJP MLA Gorak Pardung raped a doctor in Itanagar, the capital of #ArunachalPradesh.
Is this the real character of them? They do not have time to look at the #corona epidemic, etc.! 
The victim filed a case against the accused at the local police station. https://t.co/dptupSAAPM"
2020-04-04 14:43:27+00:00,"Banoffee pie recipe post out tomorrow. Stay tuned and get your ingredients ready for some Sunday baking in your home! @ Navi Mumbai (New Mumbai), India https://t.co/wLNc9uth2f",hungrymonsters1,"Navi Mumbai, India",Navi Mumbai's first dessert truck. :D,74,283,92,False,No Value Mentioned
2020-04-04 14:43:28+00:00,"@narendramodi @realDonaldTrump If my family (country) suffers from Corona today, then who is responsible for it, the people who produced it or we who spend all our lives for two breads are punished for some mistake, why should China Not only the answer, it should also be punished",DeveshR43558868,"Greater Noida, India",The True Way Is The Way To Happiness Side Truth Bitter or Sweet Is Always Profitable/ वो महान आत्मा दूर रहे जो फ़ॉलो कर के अनफॉलो करते रहते है,139,426,111,False,No Value Mentioned
2020-04-04 14:43:29+00:00,Thank youuuu https://t.co/20GIbFgsTs,kuncheraghu,"HYDERABAD , INDIA ",MUSIC DIRECTOR | SINGER | ACTOR | PRODUCER | TRAVELLER,64292,123,6925,False,No Value Mentioned
2020-04-04 14:43:30+00:00,RT @NewsroomPostCom: #CoronaUpdate- First corona positive patient from Gujarat went back home and she welcomed with great enthusiasm by the…,mackarand,"Mumbai, India","Bibliophile, marketing and sales guy, High tech is the way forward.......",83,275,10511,False,#CoronaUpdate- First corona positive patient from Gujarat went back home and she welcomed with great enthusiasm by the residents of her building. https://t.co/jUsCNox2SM
2020-04-04 14:43:30+00:00,"RT @indscribe: *An IAS officer tests positive, is in hospital, an MLA had symptoms, CM in self quarantine but all these stories get buried.…",MSBABAR91,India,"cool ,",79,128,347,False,"*An IAS officer tests positive, is in hospital, an MLA had symptoms, CM in self quarantine but all these stories get buried. 
*Little media coverage, silence. No channels reporting. Others blamed even if just tested &amp; no report but termed 'Corona suspects' https://t.co/AA52iMtCXU"
2020-04-04 14:43:31+00:00,RT @ReallySwara: Yes thank you Sir !!!!!!!! 🙏🏿🙏🏿🙏🏿🙏🏿🙏🏿👏🏽👏🏽👏🏽👏🏽👏🏽🇮🇳🇮🇳🇮🇳🇮🇳🇮🇳🇮🇳 https://t.co/RlwMIo55RP,RR4900,India,RT is not endorsement,1948,428,143208,False,Yes thank you Sir !!!!!!!! 🙏🏿🙏🏿🙏🏿🙏🏿🙏🏿👏🏽👏🏽👏🏽👏🏽👏🏽🇮🇳🇮🇳🇮🇳🇮🇳🇮🇳🇮🇳 https://t.co/RlwMIo55RP
2020-04-04 14:43:31+00:00,"RT @AlwaysRamCharan: I am proud of everyone who has faithfully been abiding by the lockdown! My love to you all.

With the same spirit, let…",DurgaNarendra7,"Eluru, India",No Value Mentioned,24,41,1112,False,"I am proud of everyone who has faithfully been abiding by the lockdown! My love to you all.

With the same spirit, let's light up lamps and come together to spread awareness for 9 minutes at 9 pm this Sunday. Don’t forget! 🙏🤗
@NarendraModi #LightForIndia #IndiaFightsCorona https://t.co/p28rAwG8MP"
2020-04-04 14:43:32+00:00,"RT @ANI: 11 more #COVID19 cases reported in West Bengal in the last 24 hours, taking the total number of active coronavirus cases in the st…",imsjaiszz,"P Í P Ř Ã ,  B Î H Å Ř, INDIA",🎻M 🎤 Ū 🎧 Š 🎼 Í 🎹 C🎸 ŁØVÊŘ.  SÍÑGÊR🎙️WÂÑT PRÔFÉSSÎŌÑÅL.,86,3,18628,False,"11 more #COVID19 cases reported in West Bengal in the last 24 hours, taking the total number of active coronavirus cases in the state to 49: West Bengal Health Department"
2020-04-04 14:43:32+00:00,RT @_pallavighosh: There goes social  distancing — https://t.co/oSuUbBE166,Irbazure,Indian,No more #Hate,796,4061,25348,False,There goes social  distancing — https://t.co/oSuUbBE166
2020-04-04 14:43:33+00:00,"PM Narendra Modi, US President Donald Trump agree to deploy full strength of India-US partnership to fight COVID-19 | India News https://t.co/lEAuA0xH0L",newsbuddy16,"Bihar,india",No Value Mentioned,3,37,1077,False,No Value Mentioned
2020-04-04 14:43:33+00:00,"RT @billyperrigo: It was already dangerous to be Muslim in India. Then came the coronavirus.

My report on the rise of the #CoronaJihad nar…",rehmanshariff69,India,❤️ حَسْبُنَا اللَّهُ وَنِعْمَ الْوَكِيلُ ❤️,203,1194,628,False,"It was already dangerous to be Muslim in India. Then came the coronavirus.

My report on the rise of the #CoronaJihad narrative:

https://t.co/qAguM9Gc9k"
2020-04-04 14:43:33+00:00,"RT @delhichatter: Lockdown Day: 11 😢
#Lockdown21 https://t.co/hnJIW3l9JV",SoShalNitin,"New Delhi, India",I am absolutely unique ..Just like everyone else,9,191,216,False,"Lockdown Day: 11 😢
#Lockdown21 https://t.co/hnJIW3l9JV"
2020-04-04 14:43:34+00:00,"RT @kavita_krishnan: Just look at @ManojTiwariMP making a mockery of physical distancing, by TOUCHING people's faces to put masks on with h…",AdvocateReevant,India,"Lawyer 
RTs do not imply endorsement
Don't Ask Me Who I Am!",1287,1159,69244,False,"Just look at @ManojTiwariMP making a mockery of physical distancing, by TOUCHING people's faces to put masks on with his UNGLOVED hands, lowering his mask to speak to them and everything in a jostling CROWD. Any FIR against him? https://t.co/I2JvEBaeXy"
2020-04-04 14:43:37+00:00,Aaj #Business ke saath #Mahabharat #Lockdown = family time https://t.co/9LGfxIZEq6,nanditathhakur,"Nadiad, Gujarat, India",ll non political person in politics ll Love to interact with people in virtual worldll extrovert looking introvert ll,210510,460,352865,False,No Value Mentioned
2020-04-04 14:43:38+00:00,"RT @FanKxip: Best fans in the world. Roar loud #SaddeFans

Stay at home tho 🙏

It's always soothing to hear from #CaptainPunjab

#SaddaPunj…",akashcr699,"Chandigarh, India","MPFC fan @minervapunjabfc
KXIP 🔴🦁 @lionsdenkxip",419,972,549,False,"Best fans in the world. Roar loud #SaddeFans

Stay at home tho 🙏

It's always soothing to hear from #CaptainPunjab

#SaddaPunjab #IPL2020 🔴 https://t.co/riiuZXxUY9"
2020-04-04 14:43:39+00:00,"Looking at the positive impact on environment of lockdown, world environment day be celebrated as annual lockdown. Drop in carbon emission is remarkable. Kyoto Protocol and Paris convention couldn’t achieve it. @PMOIndia @narendramodi @UN @PrakashJavdekar @amritabhinder",gkofkrishnomics,"New Delhi, India",Lawyer | CA | Traveller | Seeker| Rotarian|Custodian-Krishnomics Legal |Author-Tax Prosecution under the Income Tax & GST; Practical Guide to Search & Seizure,423,788,3138,False,No Value Mentioned
2020-04-04 14:43:39+00:00,"RT @AashnaAhuja: Silver lining of the #lockdown? Bluer skies.

This is the view from my terrace in Delhi today. https://t.co/4Gh11tQFvY",pranav_ahuja,India,"Founder & CEO at @xenohq - @techstars 2018.

Purpose and people are my drivers. Happy to talk about culture, purpose and people for hours.",638,689,1860,False,"Silver lining of the #lockdown? Bluer skies.

This is the view from my terrace in Delhi today. https://t.co/4Gh11tQFvY"
2020-04-04 14:43:39+00:00,"RT @narendramodi: Had an extensive telephone conversation with President @realDonaldTrump. We had a good discussion, and agreed to deploy t…",BhavenduTrivedi,"Surat, India",વંદેમાતરમ,124,276,6645,False,"Had an extensive telephone conversation with President @realDonaldTrump. We had a good discussion, and agreed to deploy the full strength of the India-US partnership to fight COVID-19."
2020-04-04 14:43:40+00:00,Serious breach of global trust https://t.co/yULA2uFidJ,sdsatufl,India,No Value Mentioned,211,410,7154,False,No Value Mentioned
2020-04-04 14:43:40+00:00,"RT @majorgauravarya: A week back, most of India didn’t know what Tablighi Jamaat was. Today, everyone does. They are responsible for one-th…",vishalgaur111,"New Delhi, India",No Value Mentioned,1325,2029,107839,False,"A week back, most of India didn’t know what Tablighi Jamaat was. Today, everyone does. They are responsible for one-third of the Coronavirus cases in India (1000 out of approximately 3000 odd cases).

If that be so, how is calling out Jamaat communal? 

https://t.co/pXtwoZty5i"
2020-04-04 14:43:40+00:00,"RT @narendramodi: Had an extensive telephone conversation with President @realDonaldTrump. We had a good discussion, and agreed to deploy t…",manojgokak,India,"Manoj Kulkari--Software Sales Speci                                                  
Believes in Almighty Lord Jai Sri Ram***  
Jai Sri Ram Jai Sri Ram Jai....",2300,3711,100188,False,"Had an extensive telephone conversation with President @realDonaldTrump. We had a good discussion, and agreed to deploy the full strength of the India-US partnership to fight COVID-19."
2020-04-04 14:43:40+00:00,"RT @narendramodi: Had an extensive telephone conversation with President @realDonaldTrump. We had a good discussion, and agreed to deploy t…",fukugoodness,"Jhunjhunun, India","mediocrity is always going to be threatened by talent !
if you are the good one then let me love you otherwise fck off !
no need to be good if you are not mine.",279,380,23378,False,"Had an extensive telephone conversation with President @realDonaldTrump. We had a good discussion, and agreed to deploy the full strength of the India-US partnership to fight COVID-19."
2020-04-04 14:43:40+00:00,"RT @PplOfIndia: @MrsGandhi @TVMohandasPai Pretty Ji, They're protesting against #CAA_NRC_NPR by spreading coronavirus.  They're like suicid…",abhinav86sharma,INDIA,Who I am doesn't matter 🇮🇳🚩🚩🚩🇮🇳,149,427,17608,False,"@MrsGandhi @TVMohandasPai Pretty Ji, They're protesting against #CAA_NRC_NPR by spreading coronavirus.  They're like suicide bombs. 80% of cases are spread by Muslims, out of which 60% traces to #TablighiJamat and 10% who have had 'sampark' with Tablighi attendees."
2020-04-04 14:43:41+00:00,RT @ShakebaU: proud to be associated with Jamia!!,Sohail98967837,"Shevgaon, India",Sports Sports Sports,13,13,826,False,proud to be associated with Jamia!! https://t.co/Th4KGaRHnW
2020-04-04 14:43:41+00:00,RT @Hyundai_Global: #becauseofyou and because of all of us we must continue to play our part in maintaining #socialdistancing. Join the @BT…,LalSa_i,India,"💜 @BTS_twt 💜
I stan Bts&Bts only. 
Thank you 😊",599,612,68467,False,#becauseofyou and because of all of us we must continue to play our part in maintaining #socialdistancing. Join the @BTS_twt movement and remember that your contribution is as valuable today as it ever was. #staysafe #HyundaixBTS #BTSxHyundai #progressforhumanity https://t.co/NmAejkwdcs
2020-04-04 14:43:41+00:00,"RT @thecaravanindia: Going by the responses given by the editors, and their subsequent coverage of the COVID-19 pandemic, it appeared that…",skdblsr,"Balasore, Orissa, India ",My Work My Recognisation,160,616,957,False,"Going by the responses given by the editors, and their subsequent coverage of the COVID-19 pandemic, it appeared that the prime minister inspired most of them to abandon a basic tenet of journalism—to speak truth, not positivity, to power. https://t.co/fdJS3Jf2pJ"
2020-04-04 14:43:42+00:00,Covid-19 death toll nears 100-mark; govt says no need to panic as 30% infections linked to ??Tablighi centre | India News - Times of India https://t.co/9m3mmPlxBW,lawyerghani,India,Lawyer/Advocate  :,949,1272,4482,False,No Value Mentioned
2020-04-04 14:43:43+00:00,RT @Docsociology4: Excellent question about the firing of Intel IG Atkinson tonight. Whenever the dictator has a tantrum he placates himsel…,lizhump77,Indiana,"floating on this beautiful blue rock, trying to understand why we keep fighting the same wars. I wanna say proudly, fk trump!  #VoteNov3 #Biden",858,2067,24420,False,Excellent question about the firing of Intel IG Atkinson tonight. Whenever the dictator has a tantrum he placates himself with a good old-fashioned firing. Something's definitely fishy here. https://t.co/GIDZ7t6md8
2020-04-04 14:43:44+00:00,"No, US and UK have not selected PM Modi to lead a coronavirus task force https://t.co/BHxDVAJKA5",PatrioticIndia3,India,"Love to connect with people .Tweets are personal, love to see a clean ,green,corrupt free, crime free, reservation free , casteless and developed India.",1157,5001,29958,False,No Value Mentioned
2020-04-04 14:43:44+00:00,"@BrookeLeia @me0wmixalot Had a severe sinus and repository infection, double ear infection, and tendinitis in both elbows....no covid lol",Wook316,Northwest Indiana,"My Tweets sucks so urs doesn't have to.Twitter Candidate for POTUS 2020 W @delasoulless #WafflesSoulless2020 , cohost @DanniesTagTeam
 https://t.co/PXWqq4DEjy",8153,8433,135944,False,No Value Mentioned
2020-04-04 14:43:45+00:00,"RT @prabhu34: @PansariVinita @SenPrabina No yaar they are trending because Sidharth replied to a fan who is suffering from Corona 

#Sidhea…",Ayesha223355,India,No Value Mentioned,242,531,5146,False,"@PansariVinita @SenPrabina No yaar they are trending because Sidharth replied to a fan who is suffering from Corona 

#SidheartsProudOfSid
#SelfMadeShehnaaz"
2020-04-04 14:43:46+00:00,"RT @narendramodi: Had an extensive telephone conversation with President @realDonaldTrump. We had a good discussion, and agreed to deploy t…",SAJANBHARDWAJ7,"Jaipur, India","SAJAN BHARDWAJ :B.A.,https://t.co/gJ7wA49kq0.(International Law,Foreign Relations & Diplomacy)LL.B. Addl.TaxLaw, 
https://t.co/J2Xmv6LkBh.Principal,Juristic Scholar:Yoga & Spiritual Sc.ॐ",1191,4533,32692,False,"Had an extensive telephone conversation with President @realDonaldTrump. We had a good discussion, and agreed to deploy the full strength of the India-US partnership to fight COVID-19."
2020-04-04 14:43:47+00:00,"We are facing trouble here please solve this.hope after you see this attached image you will realise the importance of what complaint I am addressing @ArvindKejriwal
@narendramodi @realDonaldTrump
Please take it as serious note Sir and save us from corona https://t.co/h5brRIDXNG https://t.co/qQx5Uoqnuf",Shayeeque1,"New Delhi, India",No Value Mentioned,1,17,51,False,No Value Mentioned
2020-04-04 14:43:47+00:00,"@ANI Same secretary has little data on correlation of other events with corona... They concentrate on only one direction, it means all other direction (other source of corona)  are less noticed",prabustalin,"Tamil Nadu,India","agnostics, periyaar ideology and தமிழன்",64,452,2470,False,No Value Mentioned
2020-04-04 14:43:47+00:00,"I don't think I should visit in the middle of a global pandemic, particularly as someone w/ asthma and parents over 60. Dad disagrees, to say the least. So I'm curious: How have you navigated these decisions? And how have you handled convos with ""disappointed"" family members?",EDePompei,"Indianapolis, IN","@IndyStar multimedia reporter. @UofCincy Bearcat. Seeker of knowledge. Traveler of world. Formerly: @newsandtribune, @TheObserver, @NewsRecord_UC. Go @Browns.",1462,1975,11842,False,No Value Mentioned
2020-04-04 14:43:47+00:00,RT @BernieSanders: The coronavirus does not differentiate based on immigration status and our economic and health response must not either.…,PorlaLingappa,India,"National Secretary,Bahujan Mukthi Party ( BMP).Both Congress & BJP are tampering EVMs with understanding.Tweets are my personal views,RTs are my likes.",859,5000,24957,False,"The coronavirus does not differentiate based on immigration status and our economic and health response must not either. Guaranteeing all residents the assistance they need makes us safer, stronger, and is the morally right thing to do."
2020-04-04 14:43:47+00:00,"RT @ShivAroor: BREAKING: 525 new #Covid19 cases in India, biggest single day surge so far.",sathisbunny,"Pondicherry, India",#Potterhead #MarvelFanatic #Wanderlust✈️🚗,436,930,9080,False,"BREAKING: 525 new #Covid19 cases in India, biggest single day surge so far."
2020-04-04 14:43:50+00:00,"RT @mumbairailusers: India‘s confirmed #coronavirus cases climb to 3,072, death toll at 75 https://t.co/HwPBamevZL
🙏🙏🙏 #StayHomeStaySafe #S…",balansundarraj,"Mumbai Area, India","RTI Activist, Big fan of @rtiindia @ANILGALGALIRTI Views are personal, RTs not endorsements.(I've reached 5k following limit, hence unable to follow anyone now)",2048,4998,37018,False,"India‘s confirmed #coronavirus cases climb to 3,072, death toll at 75 https://t.co/HwPBamevZL
🙏🙏🙏 #StayHomeStaySafe #StayHomeSaveLives"
2020-04-04 14:43:50+00:00,"RT @DamniKain: THREAD :
Collection of Islamophobic fake news in the last few days -

Fake News 1: Muslim man spitting on fruits to spread C…",sidsays_,India,"Egalitarian. Here for Politics and Marketing. NIT, IIM alumnus. Rational Thinker. RTs are not endorsements.",804,1007,64352,False,"THREAD :
Collection of Islamophobic fake news in the last few days -

Fake News 1: Muslim man spitting on fruits to spread Corona -

https://t.co/afHBhhGFhB

Fake News 2: Muslims licking utensils to spread Corona -
https://t.co/Q5T5XCIOpR"
2020-04-04 14:43:51+00:00,"RT @CMOMaharashtra: Like Coronavirus there is another virus that is emerging which is threatening social harmony, the virus of fake news &amp;…",AzharAh12786752,"Hyderabad, India","ACTOR 
MODEL , SOCIAL WORKER😘PROUD TO BE 🇮🇳INDIAN MUSLIM😊😘",89,381,329,False,"Like Coronavirus there is another virus that is emerging which is threatening social harmony, the virus of fake news &amp; communal hatred."
2020-04-04 14:43:51+00:00,RT @smrutibombay: Who’d have thought that #UddhavThackeray would one day warn about communal virus? It’s like dystopia but in a nice warm w…,Shubham_RI,India,No Value Mentioned,8330,5267,240335,False,"Who’d have thought that #UddhavThackeray would one day warn about communal virus? It’s like dystopia but in a nice warm way. 

@OfficeofUT has been calm, collected, in control

“Maharashtra CM spotlights communal virus, then a warning on Covid-19 messages”
https://t.co/napCfoGmYP"
2020-04-04 14:43:51+00:00,RT @ANI: 74 #COVID19 positive cases reported in Tamil Nadu today out of which 73 had attended the Tableeghi Jamaat event at Markaz Nizamudd…,Raajpootana,"Hubli, India",😎,92,254,15733,False,"74 #COVID19 positive cases reported in Tamil Nadu today out of which 73 had attended the Tableeghi Jamaat event at Markaz Nizamuddin, Delhi: Beela Rajesh Tamil Nadu Health Secretary https://t.co/cpHHqoXOBO"
2020-04-04 14:43:53+00:00,RT @ReallySwara: This thread! #UddhavThackeray has emerged as one of the most able administrators we have in the  country today. Salute to…,Anonymo02011024,India,Software Programmer And Cyber squad Member,43,148,2697,False,This thread! #UddhavThackeray has emerged as one of the most able administrators we have in the  country today. Salute to the way he and his administration have handled this #coronavirus crisis. Kudos to you sir! 👏🏽👏🏽👏🏽👏🏽👏🏽👏🏽👏🏽 https://t.co/B1w5jRARRH
2020-04-04 14:43:56+00:00,"RT @MomsWhoSave: Pick up This #Free Kids’ Coloring Page — Thank You Health Care Workers!

&gt;&gt; https://t.co/9oIu25ZlS6

#thankanurse #thankad…",BookReviewTours,"Pune, India",#BookBlast #CoverReveals #Reviews #Giveaways #BookTour,1897,862,61597,False,"Pick up This #Free Kids’ Coloring Page — Thank You Health Care Workers!

&gt;&gt; https://t.co/9oIu25ZlS6

#thankanurse #thankadoctor #doctors #nurses #printables #healthcare #homeschool #education #covid19 #coronavirus https://t.co/SuUWfXbirt"
2020-04-04 14:43:58+00:00,RT @ANI: Efforts began at Tablighi Jamaat event in Delhi to spread #coronavirus throughout the country. Most of the attendees of that event…,advshivampandey,"Gorakhpur, India","advocate 
उठो जागो और लक्ष्य को प्राप्त करो_____ धन गया तो कुछ नहीं गया__ स्वास्थ्य गया तो कुछ गया__ चरित्र गया तो सब कुछ गया~~~🇮🇳",421,312,32290,False,"Efforts began at Tablighi Jamaat event in Delhi to spread #coronavirus throughout the country. Most of the attendees of that event are untraceable. There seems to be 'corona Jihadi plan' behind that meeting: BJP MP Shobha Karandlaje in Chikmagalur, Karnataka https://t.co/S8S4pwSbxx"
2020-04-04 14:43:59+00:00,"@ZeeNewsEnglish 1. Clapping ws dne to encourage dctrs and othr emrgncy service workers for their service 
2. Lighting candle are dne to get india united for hope and strength to fight against covid together
They (opposition) always light candle against sme happngs in country,  thn y nt ths tym",akkadhangar,India,"From Haryana, 🏘
Teacher by profession, 👨🏻‍🏫
Loves to travel.  😍",15,187,171,False,No Value Mentioned
2020-04-04 14:43:59+00:00,"RT @AngelAnjna: Yes #iSupportLampLighting 👍 because
-Lamp lighting purifies the environment.
-It also kills bacteria and viruses present in…",ManishKarakoti3,"New Delhi, India",Manoj.gosain,3,17,257,False,"Yes #iSupportLampLighting 👍 because
-Lamp lighting purifies the environment.
-It also kills bacteria and viruses present in the surroundings.
-Let's light lamps on 5th april together at 9 pm.
-Maintain social distancing while participating in this initiative.
@derasachasauda https://t.co/yndhcA1JIq"
2020-04-04 14:44:00+00:00,"RT @RealGsPatton007: HILARIOUS CONSEQUENCES of CORONAVIRUS 😳😳

Is Prevention worse than Disease?

KABOOM 👇👇👇👇👇👇👇👇
😂😂😂😂😂😂😂😂😂😂😂😂

https://t.c…",Jolyn66090714,"Indianapolis, IN","Mom, grandma, big mouthed, opinionated, fearless American. And my spider is not creepy, lol, she is beautiful.",4683,5092,51330,False,"HILARIOUS CONSEQUENCES of CORONAVIRUS 😳😳

Is Prevention worse than Disease?

KABOOM 👇👇👇👇👇👇👇👇
😂😂😂😂😂😂😂😂😂😂😂😂

https://t.co/4AjF0jxtGv"
2020-04-04 14:44:01+00:00,"RT @DrBeelaIAS: Virus can affect anyone, let’s be gentle and sensitive towards each other and wage a coordinated battle against Covid19.",shaaique,"Mumbai, India",We the people of Country 🇮🇳. Live for the Country & die for the country.Hungry for the Knowledge.!,98,170,1647,False,"Virus can affect anyone, let’s be gentle and sensitive towards each other and wage a coordinated battle against Covid19."
2020-04-04 14:44:01+00:00,"RT @DanielPipes: Yes, the official name of the virus is #COVID19. But that hides the Chinese government's responsibility.

Vote here for yo…",Ranjanchakrab20,"Guwahati, India",Nation First Self Last,543,318,13889,False,"Yes, the official name of the virus is #COVID19. But that hides the Chinese government's responsibility.

Vote here for your preferred name.

(CCP = Chinese Communist Party)"
2020-04-04 14:44:02+00:00,RT @Cristiano: Stay home and keep stylish 💇🏽‍♂️👩‍❤️‍💋‍👨 #stayhomestaysafe https://t.co/SkPiUwzCxn,unrealcoral,"Mumbai, India",Friendly music advocate. Avid alcohol specialist. Wannabe zombie fan. Beer aficionado. Hardcore introvert. Evil writer. #mufc,63,104,934,False,Stay home and keep stylish 💇🏽‍♂️👩‍❤️‍💋‍👨 #stayhomestaysafe https://t.co/SkPiUwzCxn
2020-04-04 14:44:02+00:00,"RT @narendramodi: Had an extensive telephone conversation with President @realDonaldTrump. We had a good discussion, and agreed to deploy t…",GourchandraJ,"Kolkata, India",Radhe Radhe,69,202,3343,False,"Had an extensive telephone conversation with President @realDonaldTrump. We had a good discussion, and agreed to deploy the full strength of the India-US partnership to fight COVID-19."
2020-04-04 14:44:04+00:00,"RT @AdityaMenon22: Lot of fake news doing on WhatsApp that Muslims run restaurants spit in food to spread Corona, or regarding Muslim run s…",salimclic1997,"Uttar Pradesh, India","Birth place ~ Earth : Race ~ Human : politics ~ freedom : Religion ~ love ,
Youth  Leader (AIASA) ,University President -(ANDUAT ) Ayodhya(Faizabad)
 🌱🌾🌱🌴🌾",188,195,211,False,"Lot of fake news doing on WhatsApp that Muslims run restaurants spit in food to spread Corona, or regarding Muslim run shops. This is exactly like the rumours before 1984 genocide that Sikhs had poisoned Delhi's water supply. Authorities need to act against fake news peddlers"
2020-04-04 14:44:04+00:00,RT @narendramodi: Your support towards the fight against COVID-19 is greatly cherished @saiprneeth92. #IndiaFightsCorona,Himanshu_Verma6,India,"Managing Director @Beinfinitive1 Financial Adviser, Equity and Mutual Fund analyst and BTST specialist.
News Government and Politics Government.",191,3405,6626,False,Your support towards the fight against COVID-19 is greatly cherished @saiprneeth92. #IndiaFightsCorona https://t.co/GwkQEh2YSO
