created_at,full_text,screen_name,location,description,followers_count,friends_count,statuses_count,verified,full_retweet_text
2020-04-22 01:10:04+00:00,"RT @AshokKhemka_IAS: .@PMOIndia Sir, instead of increasing Dearness Allowance to employees, please consider reducing it. States will follow…",abhialive11,"Bengaluru, India","India First, Nation First.
Director at #educatausallc, Traveller, Reader, Socialist.",303,908,8816,False,".@PMOIndia Sir, instead of increasing Dearness Allowance to employees, please consider reducing it. States will follow suit. Resultant savings can be more gainfully employed in COVID-19 relief, tests, treatment, R&amp;D for new drugs/vaccines."
2020-04-22 01:10:07+00:00,RT @TarekFatah: This is bad. Imagine the pain of these families. I'll be damned if I ever buy a Made-in-China product.,SSachin__,"Ayodhya, India","Engineer, Child Lover, Proud_¡🇮🇳 
                                                                            
 📝Everything is the function of Time. E=f(t)🕛",90,1039,5361,False,This is bad. Imagine the pain of these families. I'll be damned if I ever buy a Made-in-China product. https://t.co/tNEcY2VwUt
2020-04-22 01:10:08+00:00,Contribute to the task on MyGov. More details at https://t.co/kn8VkfTNRb,RajeevSouza,"Patna, India","शायरी का बादशाह हुं और कलम मेरी रानी, अल्फाज़ मेरे गुलाम है, बाकी रब की महेरबानी।",91,117,550,False,No Value Mentioned
2020-04-22 01:10:10+00:00,"RT @RonaldKlain: I made this point on @MSNBC @SRuhle this morning, and glad to see @TomBossert offering this data.  

Even if you think Tru…",adamwren,"Indianapolis, Indiana",Midwestern journalist. Contributing Editor @POLITICOMag & @indymonthly. Bylines @WashingtonPost & @thedailybeast. Buckeye-born Hoosier. Illo @alexfineillos.,18352,6660,29556,True,"I made this point on @MSNBC @SRuhle this morning, and glad to see @TomBossert offering this data.  

Even if you think Trump's ""re-opening plan"" is correct (and I don't) Georgia is NOT EVEN FOLLOWING IT. https://t.co/zgQy5HOOVk"
2020-04-22 01:10:10+00:00,"RT @AmeerRosic: Gates Foundation, WHO and Wuhan Labs just got hacked about an hour ago.  Massive data dump inbound.  Gonna be an interestin…",NameGSR,"Himachal Pradesh, India","Son of a war veteran , Grandson of a war veteran , Brother of a soldier , Nephew of a Soldier. PROUD INDIAN 🇮🇳Engineer by Profession . Universe is Hypocrite .",43,782,2117,False,"Gates Foundation, WHO and Wuhan Labs just got hacked about an hour ago.  Massive data dump inbound.  Gonna be an interesting day."
2020-04-22 01:10:15+00:00,"@WHO  I have a question.. Tell me why
Ain't nothin' but a heartache
Tell me why
Ain't nothin' but a mistake
Tell me why
I never want to hear you say
I want it that way... you better know, you got my feeling alright!",mr_msun,"Noida, India","Enthusiast for concept of economic growth & development, Free education, subsidized living standard for every human being, & stress free working system. 🌍🌎🌏",6,1,4,False,No Value Mentioned
2020-04-22 01:10:16+00:00,"Calcutta HC directs West Bengal govt to follow WHO, Centre guidelines for Covid-19 patients https://t.co/ma73QcUGd0",ApnaSmartphone,India,"https://t.co/C5IpISCu5J great place to find best and quality content about latest trending topics in your own language, Hindi & English.",34,0,26808,False,No Value Mentioned
2020-04-22 01:10:25+00:00,"RT @jones_jassi: @aajtak @patelanandk Sanitizers are for police,doctors ,nurses ,Common man , bankers,and frontline workers who are putting…",Kuldeep98831810,"Indore, India","24 single.....
wish me on 16 april.
it's not what u ride , it's your attitude that it counts .
#classic 350 ##royal enfield##",28,114,937,False,"@aajtak @patelanandk Sanitizers are for police,doctors ,nurses ,Common man , bankers,and frontline workers who are putting their life on line to protect the corona patients! Do you know how much sanitizer is needed in hospitals?"
2020-04-22 01:10:26+00:00,"RT @MoCharoliya: 30 Tablighi Jamaat Muslims, including a Professor, have been arrested in Allahabad, on the false pretext of Corona.
Police…",HammadMaknojiya,"Gujarat, India",student,5,37,404,False,"30 Tablighi Jamaat Muslims, including a Professor, have been arrested in Allahabad, on the false pretext of Corona.
Police also alleged that ""they had been indulging in propagating their religion"".
Being a Muslim in India is a crime #Islamophobia_In_India
 https://t.co/xVAUdQpEFk"
2020-04-22 01:10:27+00:00,RT @mygovindia: #CoronaWarriors: Salute to all the Civil Servants who are in the frontline in India’s fight against COVID-19. #IndiaFightsC…,Narasimha671,"Bengaluru South, India",🗺️ Save Earth/ @rallyforrivers /@Farmer / @Engineer / @Peace/ @Indian.,52,300,1057,False,#CoronaWarriors: Salute to all the Civil Servants who are in the frontline in India’s fight against COVID-19. #IndiaFightsCorona #CivilServicesDay @IASassociation @PIB_India @MIB_India @PMOIndia https://t.co/otOkBWuuhz https://t.co/rPkwwojmZN
2020-04-22 01:10:27+00:00,"RT @ABC: Global COVID-19 cases top 2.5 million as a U.N. agency warns the pandemic could cause famines of ""biblical proportions.""

Tracking…",DanishManzoor99,"Rampur, India",Reality seeker,20,90,12,False,"Global COVID-19 cases top 2.5 million as a U.N. agency warns the pandemic could cause famines of ""biblical proportions.""

Tracking the virus: https://t.co/XhbNcpxIZO https://t.co/V5NF6tMPKx"
2020-04-22 01:10:29+00:00,RT @satishacharya: 'Surplus rice' to be used for hand sanitizers! #lockdown https://t.co/Uu2mbnAXJs,sunnydass_,"New Delhi, India","Enjoy life as much as you can, before life starts to have fun with you.✍🏼.",466,57,586,False,'Surplus rice' to be used for hand sanitizers! #lockdown https://t.co/Uu2mbnAXJs
2020-04-22 01:10:31+00:00,RT @GHMansfield: A Disability Should Not Invalidate a Person's Worthiness—Especially During a Pandemic https://t.co/VSMEZmMGVL via @msmagaz…,Shalini50251722,India,Professor Of HRM& OB Authored : “HR Initiatives In Building Inclusive & Accessible Workplaces” Emerald Publishing(2/12/2019),100,327,1270,False,A Disability Should Not Invalidate a Person's Worthiness—Especially During a Pandemic https://t.co/VSMEZmMGVL via @msmagazine
2020-04-22 01:10:38+00:00,"@DrTedros Why did you ignore Taiwan? 
Why are you still ignoring it?",Moltenlava15,India,"не твоё дело😎🤙


DMs=BLOCK",189,757,15751,False,No Value Mentioned
2020-04-22 01:27:42+00:00,"RT @sonalgoelias: Compassion towards cattle &amp; all animals is required; especially during #Lockdown 
Support their feed &amp; welfare 🙏🏻
We doin…",chouhan_sumitra,"Sonipat, India",No Value Mentioned,1644,353,1893,True,"Compassion towards cattle &amp; all animals is required; especially during #Lockdown 
Support their feed &amp; welfare 🙏🏻
We doing our bit at Gaushalas 
#Gurugram https://t.co/d3fYvqNqXw"
2020-04-22 01:27:43+00:00,RT @_IndianMuslims: The titles of news segments screamed of the ‘Markaz disease’ and the ‘Tablighi Virus’. One channel called it ‘Tablighi…,___shahbaz,India,Indian National and Rational,244,534,6371,False,"The titles of news segments screamed of the ‘Markaz disease’ and the ‘Tablighi Virus’. One channel called it ‘Tablighi Jihad’, claiming Muslims were hell bent upon infecting ‘Bharat’.

#Islamophobia_In_India
#Islamophobic
#Islamophobia
https://t.co/eT7MKh9hsB"
2020-04-22 01:27:44+00:00,"RT @spectatorindex: JUST IN: Coronavirus deaths in the United States reach 45,000",PrasannaU2,India,#Optimist,75,684,3214,False,"JUST IN: Coronavirus deaths in the United States reach 45,000"
2020-04-22 01:27:45+00:00,"RT @CNBCTV18Live: #FacebookRelJiodeal | In the post-Corona era, I am confident of India’s economic recovery and resurgence in the shortest…",love2popeye,"Mumbai, India","Derivatives Trader - Crude Oil, Equities, Metals & FX, 
MBA Finance NMIMS, https://t.co/In7vBJVt1H Electronics VJTI,  CFA Charterholder",54,204,2843,False,"#FacebookRelJiodeal | In the post-Corona era, I am confident of India’s economic recovery and resurgence in the shortest period of time. The partnership will surely make an important contribution to this transformation, says Mukesh Ambani https://t.co/bZYUYoYNBN"
2020-04-22 01:27:47+00:00,"RT @TajinderBagga: Even Helper salary is more thn this, I request @capt_amarinder Ji to take decision and increase the Salary of MBBS inter…",samrat27,"Hyderabad, Telangana, INDIA.",No Value Mentioned,123,436,16529,False,"Even Helper salary is more thn this, I request @capt_amarinder Ji to take decision and increase the Salary of MBBS interns https://t.co/So1p0Hy3CR"
2020-04-22 01:27:47+00:00,Barcelona hands over Camp Nou title rights to raise money for fight against Covid-19 https://t.co/k56EkxFImV,Ritsvevo,"Madhya Pradesh, India",Hey this is Rits - Vocalist & Blogger,10,86,47651,False,No Value Mentioned
2020-04-22 01:27:49+00:00,"RT @swati_gs: Except that the family of the deceased has given a complaint to police accusing the ""five Muslim friends"" of lying to the med…",TarunChavali,"Vijayawada, India",@JanaSenaParty Forever. Proud Nationalist. @Bjp4india Since 2014. #FuckSecularism,154,91,33031,False,"Except that the family of the deceased has given a complaint to police accusing the ""five Muslim friends"" of lying to the media for publicity

Follow-up report tomorrow 👍 https://t.co/GSRzDo7Z2C"
2020-04-22 01:27:49+00:00,"🌾உழவில்லையேல் உலகில்லை🌍
All sectors are locked down due to COVID-19; but the only pride sector which always performing is AGRICULTURE.@narendramodi Pls do some favour to FARMERS.
@Actor_Vivek,@thondankani#agriculture,#farmers,#Covid_19india,#coronavirusinindia,#lockdown https://t.co/Wbqra2esdr",Gowtham_offi,"Cuddalore, India",😎Upcoming movie 🎥director 🎥.Moving towards cine🎬 industry.CSE Engineer. 🏑🏑Sports🏏 Lover😍. 💪தமிழன் 💕,20,115,94,False,No Value Mentioned
2020-04-22 01:27:51+00:00,"#COVIDー19 
Why vaccine take time and why shouldn’t we fast track them. 
#coronavirus #vaccine #virus #BeatCOVID19 # https://t.co/oAukL4JOnb",drgsreddy,"Hyderabad, India","MS MCh, Lead Ortho Surgeon, MBA (Hosp Admin), MD, Aster Prime hospital. eternal optimist. disgruntled citizen. contended human. long distance runner. loves beer",315,367,1131,False,No Value Mentioned
2020-04-22 01:27:51+00:00,"@sanzpreet The main reason for keeping people away from offices,Malls etc. Has already hit many industries, we have extension of lockdown announced here ,will be till June 1. Students who were supposed to appear for board exams, people who had to visit critical ill parents #uncertainty",explorediary,India,"Love my nation , believe in my dreams Love to explore the unexplored",1139,526,8305,False,No Value Mentioned
2020-04-22 01:27:52+00:00,RT @PTI_News: 6 state reserve police force jawans test positive for #coronavirus in Maharashtra's Hingoli district: Health official,PrasannaU2,India,#Optimist,75,684,3214,False,6 state reserve police force jawans test positive for #coronavirus in Maharashtra's Hingoli district: Health official
2020-04-22 01:27:52+00:00,RT @rohini_sgh: Kyun? Why shouldn’t politicians not talk about the poor or their plight?  What sort of ridiculous request is this?,wasi_ismail,"Kanpur, India",Simple living high thinking..,63,879,3751,False,Kyun? Why shouldn’t politicians not talk about the poor or their plight?  What sort of ridiculous request is this? https://t.co/8IbTMdvfg6
2020-04-22 01:27:54+00:00,RT @AyshaRenna: They are our leaders in the Anti CAA movement &amp; are being targeted by the Police by booking them with laws like #UAPA even…,sami4u_Ind,"Bangalore,India","Indian/Truth and rightness way of life/love and serve all/Engineer/Tech Architect. Likes and RTs are not endorsements, Stay home & Stay safe",306,692,5535,False,"They are our leaders in the Anti CAA movement &amp; are being targeted by the Police by booking them with laws like #UAPA even when the whole world is fighting #COVIDー19. 

We will overcome this too.. 
In Sha Allah

#Islamophobia_In_India https://t.co/lAzDZOKD2j"
2020-04-22 01:27:55+00:00,"RT @alsuwaifan: The failure of the #Indian health system to counter #coronavirus shouldn't be diverted to racist rhetoric towards Muslims
B…",arif7am_m,"New Delhi, India","A Medical student @ Jamia Hamdard University, New Delhi.Blogger & student of Islam",54,87,175,False,"The failure of the #Indian health system to counter #coronavirus shouldn't be diverted to racist rhetoric towards Muslims
Because the #pandemic does not differentiate between religions"
2020-04-22 01:27:56+00:00,"All's well with this cat unit, enjoying #homestay #StayHome 
Alpha, Beta, Gamma with mom, to mark #EarthDay2020 https://t.co/kU4l5Wlxxz",SanerDenizen,"Chennai, India","IAF 93-99. NAL 01-05.
Environment | Focus on local governance | Anti-consumerism | Defensive Driving | நம் குப்பை நம் பொறுப்பு | മലയാളം | Abhor दिखावा 🙂",272,725,11585,False,No Value Mentioned
2020-04-22 01:27:58+00:00,"RT @JeromeAdamsMD: Many know that I have asthma, &amp; still carry an inhaler.  Many may not know there’s been a shortage of life saving asthma…",mr_pappas,Indiana,"🙆  🙈🙉🙊  🙏
Public health, environmental science, sustainable science.
Be the change 🌎
Opinions expressed do not reflect those of my employer.",133,946,666,False,"Many know that I have asthma, &amp; still carry an inhaler.  Many may not know there’s been a shortage of life saving asthma medications during the #COVID19 crisis.  That’s why this is significant.👇🏽

FDA approves first Proventil HFA generic for bronchospasm https://t.co/Py6m8wuLDM"
2020-04-22 01:27:59+00:00,"RT @PMOIndia: PM ⁦@narendramodi⁩ pushes for use of technology in the 'era of Covid-19' 
https://t.co/ZUQR5EE3JU

via NaMo App https://t.co/…",ParthPa07241800,India,"Honored to be followed by @TcGehlotOffice, @Mohsinrazabjpup ,@Shehzad_Ind, @OfficeOf_MM ,@OfficeOfRKSingh and @VijayGoelOffice",2776,4619,976347,False,"PM ⁦@narendramodi⁩ pushes for use of technology in the 'era of Covid-19' 
https://t.co/ZUQR5EE3JU

via NaMo App https://t.co/OxdiFZA5gX"
2020-04-22 01:28:01+00:00,"RT @PMOIndia: PM ⁦@narendramodi⁩’s 5 ideas on how Covid-19 will redefine businesses and work culture. 
https://t.co/tkGGCoNafy

via NaMo Ap…",ParthPa07241800,India,"Honored to be followed by @TcGehlotOffice, @Mohsinrazabjpup ,@Shehzad_Ind, @OfficeOf_MM ,@OfficeOfRKSingh and @VijayGoelOffice",2776,4619,976347,False,"PM ⁦@narendramodi⁩’s 5 ideas on how Covid-19 will redefine businesses and work culture. 
https://t.co/tkGGCoNafy

via NaMo App https://t.co/cZXhi4vbGw"
2020-04-22 01:28:02+00:00,RT @MahantMochan: On occasion of #CivilServicesDay I do praise the civil servants of our country who r the real executers of the policies l…,IndreshSinghVns,"Varanasi, India","Air Traffic Controller, Airports Authority of India",190,369,2362,False,On occasion of #CivilServicesDay I do praise the civil servants of our country who r the real executers of the policies laid by the government.I praise their hardwork and risk to their own life particularly during #COVIDー19 #StayHome .
2020-04-22 01:28:06+00:00,Facebook releases COVID-19 symptom map in USA; plans to roll out in other regions https://t.co/8UrNxEh44I,sk__671,India,No Value Mentioned,694,1456,151659,False,No Value Mentioned
2020-04-22 01:28:07+00:00,"RT @ANI: US has recorded more than 8,00,000 confirmed cases of #COVID19 and 44,845 deaths so far. Nearly 40,000 new cases reported between…",Muthukumar2802,"Coimbatore, India",civil engineer,856,1517,100450,False,"US has recorded more than 8,00,000 confirmed cases of #COVID19 and 44,845 deaths so far. Nearly 40,000 new cases reported between Monday 8:30 pm local time, and Tuesday at the same time: AFP news agency quoting Johns Hopkins University"
2020-04-22 01:28:08+00:00,"RT @UN: School closures in 190+ countries due to #COVID19 have left more than 1.57 billion students out of school.

@UNICEF is teaming up w…",tayalchiku,"Sendhwa, India",Enjoy life as it comes,135,2176,758,False,"School closures in 190+ countries due to #COVID19 have left more than 1.57 billion students out of school.

@UNICEF is teaming up with @Microsoft on a new global learning platform to help children continue their education at home. 

https://t.co/BigSUXrZNl"
2020-04-22 01:28:08+00:00,RT @kagame: I lost my full time and part time job due to the pandemic. i have an auto immune disease so i can’t be an essential worker and…,plaguehippie,"Indianapolis, IN",unknown man died eating library paste july 14 1908,259,620,55774,False,I lost my full time and part time job due to the pandemic. i have an auto immune disease so i can’t be an essential worker and my parents just got laid off. i have 2 baby brothers. I am streaming and doing this to try and help. Thank you for your input though! https://t.co/U8be4u8XNo
2020-04-22 01:28:12+00:00,RT @mansikaushik: @SUNILYADAV_JPR @ashokgehlot51 #waiveoffschoolfees #KabSunegiYeSarkaar more than a month of lockdown and parents are stil…,lalit1806,"Jaipur, India",No Value Mentioned,95,34,2710,False,@SUNILYADAV_JPR @ashokgehlot51 #waiveoffschoolfees #KabSunegiYeSarkaar more than a month of lockdown and parents are still being unheard. This is how Rajasthan govt tends to act on the welfare of middle class. Please take concrete step for pvt school fees as all other businesses are also suffering.
2020-04-22 01:28:12+00:00,The latest Socialist Agenda - Daily! https://t.co/rmvOqCrYdh Thanks to @Ancientbob #hongkong #covid,USAsocialists,Indianapolis,American Socialists is America's Socialist Party. Take control of your destiny. Help grow socialism in your community.,1587,489,104505,False,No Value Mentioned
2020-04-22 01:28:15+00:00,RT @jbouie: reactionary finance capitalists astroturfing protests attended by petite bourgeoisie property owners who want the state to forc…,BeingAndyChen,"Indiana, USA","I call my own shots, largely based on an accumulation of data.",82,422,13386,False,reactionary finance capitalists astroturfing protests attended by petite bourgeoisie property owners who want the state to force laborers back to work. https://t.co/QAEVv9Q0dm
2020-04-22 01:28:17+00:00,RT @TarekFatah: This is bad. Imagine the pain of these families. I'll be damned if I ever buy a Made-in-China product. https://t.co/tNEcY2V…,BtKAS_,India,Follow #CoronaVirus prevention precautions.  Why not RT what one likes?  So I RT more .   My likes are my bookmarks- some tweet to be retrieved later and read.,153,1427,19880,False,This is bad. Imagine the pain of these families. I'll be damned if I ever buy a Made-in-China product. https://t.co/tNEcY2VwUt
2020-04-22 01:28:19+00:00,"RT @majorgauravarya: Since social distancing is the norm, I propose to celebrate Defensive Offence reaching 500K subscribers by tweeting a…",themukeshkumar1,"Mumbai, India","ॐ पूर्णमदः पूर्णमिदं पूर्णात्पूर्णमुदच्यते।
पूर्णस्य पूर्णमादाय पूर्णमेवावशिष्यते॥ॐ शान्तिः॥
https://t.co/wqleT6am5y",65,177,8332,False,"Since social distancing is the norm, I propose to celebrate Defensive Offence reaching 500K subscribers by tweeting a picture that has always motivated both @vaibhavUP65 &amp; I. May this picture be etched in the hearts of all citizens of the Indian sub-continent. 

#16December1971 https://t.co/WTsNSFl5DM"
2020-04-22 01:28:20+00:00,RT @HasibaAmin: HOW has Goa declared itself Corona free after having conducted just 800-odd tests with a population of 16L? Kya mazak hai?,aneeshvkoshy,India,"Trader , intrested in politics,economics,sports,nation and great peoples .in tweeter with broken english.",406,1427,31249,False,HOW has Goa declared itself Corona free after having conducted just 800-odd tests with a population of 16L? Kya mazak hai?
2020-04-22 01:28:20+00:00,"RT @B4Politics: Dr Uma Madhusudan, a Mysore origin doctor honoured this way infront of her house in USA In recognition for her extraordinar…",Srthchndra1,"Vijayawada, India","as of now, i am S/o KrishnaMurthy and F/o KrishnaNeeraj..
i have no idea, what exactly i am...",74,74,1823,False,"Dr Uma Madhusudan, a Mysore origin doctor honoured this way infront of her house in USA In recognition for her extraordinary service treating Corona patients in South Windsor Hospital,. You can see her recieving salute!! 👏🏼👏🏼 it's only a part of it .it goes on for longer https://t.co/tjknP1bH80"
2020-04-22 01:28:22+00:00,RT @ShefVaidya: In touch with a weaver from Bihar who weaves Bawanbooti sarees. He is facing a cash crunch. He is selling his cotton sarees…,k_krahul,"Kerala, India","Father, Hubby, NIT Rourkela alumnus,
Entrepreneur. Unapologetic NaMo fan. Jihadis and fiberals have ganged up against all good people, including Muslims.",364,344,52140,False,"In touch with a weaver from Bihar who weaves Bawanbooti sarees. He is facing a cash crunch. He is selling his cotton sarees first as low as 1600 rupees. You pay now, he will courier them after lockdown. Interested people, please reply, will DM his number. Posting some pics. https://t.co/S6nZ5Xobrr"
2020-04-22 01:28:22+00:00,"RT @ShefVaidya: We are NOT in it together @narendramodi sir. We are NOT the ones spitting at cops, we are not the ones hiding foreign natio…",Being_Paisa,India,"No Bio, Only Maths,...(PCM waala hu)",188,86,33055,False,"We are NOT in it together @narendramodi sir. We are NOT the ones spitting at cops, we are not the ones hiding foreign nationals in mosques. We are NOT the ones pelting stones at doctors. We are NOT the ones hiding travel history. THEY are. And THEY have a name, #TablighiJamaat https://t.co/rqQAmo0Pv7"
2020-04-22 01:28:25+00:00,RT @RanaAyyub: The pressure from UAE and other Islamic countries visible. https://t.co/44EptDIjs4,amerali12587,"Hyderabad, India",Incase No One Told Yu Today.! You're Awesome.,197,724,7763,False,The pressure from UAE and other Islamic countries visible. https://t.co/44EptDIjs4
2020-04-22 01:28:26+00:00,"RT @WHO: Avoid having coffee and tea with your meals since they contain some elements that can inhibit the absorption of iron in foods. 
Wa…",Sneha33298954,"New Delhi, India",No Value Mentioned,5,163,35,False,"Avoid having coffee and tea with your meals since they contain some elements that can inhibit the absorption of iron in foods. 
Wait 2 hours after your main meals to have your coffee or tea https://t.co/4LwpxjZJwK
https://t.co/s5tmoLYoW5"
2020-04-22 01:28:26+00:00,@DrKumarVishwas @ChouhanShivraj @MPDial100 This is totally wrong.please support Cops support lockdown and please support our prime minister Modi g.,NileshG239,India,writer,4,16,143,False,No Value Mentioned
2020-04-22 01:28:27+00:00,"RT @LadyVelvet_HFQ: Remember the names of the first three Doctors who died protecting British people from the COVID-19

Amged el-Hawrani
Ad…",AkRaMuZ74631966,"Jorhat, India ",I'm A BHMS student,363,697,7234,False,"Remember the names of the first three Doctors who died protecting British people from the COVID-19

Amged el-Hawrani
Adel el-Tayar
Habib Zaidi

#WeAreOneFamily #Islamophobia https://t.co/ezg75vdjRu"
2020-04-22 01:28:28+00:00,RT @samjawed65: Flags of several countries were projected on Switzerland's Matterhorn to show solidarity during the pandemic. Prasar Bharat…,Harshva44829186,India,"Secular Indian, Socialist, Liberal Hindu for Truth & Justice. RT stands solely for attention. #Humanrights.
परहित सरिस धरम नहीं भाई, परपीड़ा सम नहीं अधमाई.",1701,1669,225356,False,Flags of several countries were projected on Switzerland's Matterhorn to show solidarity during the pandemic. Prasar Bharati falsely reported that tricolour was projected after India supplied HCQ tablets. #AltNewsFactCheck | @HereisKinjal https://t.co/IaQANDqmlL
2020-04-22 01:28:28+00:00,RT @PMOIndia: India has perhaps the largest such infrastructure in the world. This infrastructure has helped us tremendously in transferrin…,ParthPa07241800,India,"Honored to be followed by @TcGehlotOffice, @Mohsinrazabjpup ,@Shehzad_Ind, @OfficeOf_MM ,@OfficeOfRKSingh and @VijayGoelOffice",2776,4619,976347,False,"India has perhaps the largest such infrastructure in the world. This infrastructure has helped us tremendously in transferring money directly and immediately to the poor and needy, benefiting crores of families, during the COVID-19 situation: PM @narendramodi"
2020-04-22 01:28:33+00:00,RT @PTI_News: Gauhati HC judges contribute Rs 4.51 lakh to fight COVID-19 outbreak.,ShantanuK_Nandi,"Bhubaneshwar, India","#Event_Management, #a_helping_hand, #a_proud #Navodayan, #ଡାକବାଲା",289,3342,7549,False,Gauhati HC judges contribute Rs 4.51 lakh to fight COVID-19 outbreak.
2020-04-22 01:28:33+00:00,"RT @rehydraters: Hydroxychloroquine does prevent Covid-19 sufferers from getting malaria, so it's not all bad news.",gutshot1,Indiana,Too Blessed to be Stressed #StayPositive,246,401,8919,False,"Hydroxychloroquine does prevent Covid-19 sufferers from getting malaria, so it's not all bad news."
2020-04-22 01:28:35+00:00,"#RonitRoy is surely winning hearts with his innovative style to keep one protected amid #coronavirus crisis
https://t.co/smoMkO422f",IndiaTVShowbiz,"Noida, India","Get your daily dose of entertainment here - Bollywood news, Hollywood gossip, and celebrity photos, videos – in a snap",2383,8,6745,False,No Value Mentioned
