created_at,full_text,screen_name,location,description,followers_count,friends_count,statuses_count,verified,full_retweet_text
2020-02-10 02:48:30+00:00,Coronavirus claims 97 lives in one day – but number of infections stabilises https://t.co/xlgPMHigHo https://t.co/hVbcxJM0Gl,BigMirrorNews,"Chennai, India",Stay Updated with https://t.co/HgrKi3hPmX. To be a part of The Big Mirror DM us and get exciting pay.,263,448,8016,False,No Value Mentioned
2020-02-10 02:48:31+00:00,"RT @TracyJan: Chen Qiushi, citizen journalist who covered coronavirus outbreak, disappears in Wuhan - The Washington Post https://t.co/K0ZL…",shannonkatt,"Indiana, USA","🌊#Resist
My Plan: Show every person what Trump is doing behind their backs on Medicare, Medicaid, Social Security and Cutting Pre existing conditions coverage.",3449,4993,34902,False,"Chen Qiushi, citizen journalist who covered coronavirus outbreak, disappears in Wuhan - The Washington Post https://t.co/K0ZLngJJyY"
2020-02-10 02:48:37+00:00,RT @detresfa_: One way to touch stuff while moving around in an epidemic zone #China #Coronavirus https://t.co/EpvAYM0XRL,s10boyal,"Bengaluru South, India","Centre-right , proud Indian, proud bengali 
RT's are not endorsement",605,3869,64633,False,One way to touch stuff while moving around in an epidemic zone #China #Coronavirus https://t.co/EpvAYM0XRL
2020-02-10 02:48:56+00:00,That stupid law of women to be arrested only by women police and timings happens only in India. https://t.co/JJtM66kN6k,bndarun,"Mumbai, India",No Value Mentioned,37,53,11711,False,No Value Mentioned
2020-02-10 02:48:56+00:00,RT @drkafeelkhan: This is Dr Sabista khan .I request all the Indians to come with me and speak up and take part in the protest today at 11…,nadeemazmi5678,"Azamgarh, India","बुलाती है मगर 
जाने का नही
दुर से आदाब .कर लेना 
गले लगा ने का नही.

#Covid_19",122,172,4212,False,"This is Dr Sabista khan .I request all the Indians to come with me and speak up and take part in the protest today at 11 AM Mandi House, Delhi #FreeDrKafeel #LiWenliang #coronavirus https://t.co/GOQ26p076T"
2020-02-10 02:48:56+00:00,"#India is buying 36 #Rafale jets from #France which r half-a-generation ahead of India's adversaries, #China &amp; #Pakistan

first batch of four planes would start arriving in May this year! 

Bcoz Precaution is better than cure !",narajesh,"Bengaluru, India","I stay @ Humour Lane, 69th cross, Lil info street ! Doors are always open ...!",127,603,3107,False,No Value Mentioned
2020-02-10 02:49:00+00:00,RT @IndianExpress: A team of experts led by the WHO left for Beijing to help investigate China’s #coronavirus epidemic as the death toll cl…,SyedMehaboob7,"koppal Karnataka, India",Ex vice President gavisiddeshwara cooperative urban Bank #Koppal,154,1498,9762,False,"A team of experts led by the WHO left for Beijing to help investigate China’s #coronavirus epidemic as the death toll climbed to 908 in the mainland 

Follow LIVE updates

https://t.co/gE1AsZgJVA"
2020-02-10 02:49:11+00:00,@ImtiazMadmood @ImranKhanPTI was aware of this reality but people criticized him on his decision of leaving #Pakistanistudents in #Wuhan,Bownesh1,India,Travel was my childhood passion & God took it seriously. Homeless Kashmiri Migrant searching for a place to lay anchor.,166,562,7770,False,No Value Mentioned
2020-02-10 02:49:17+00:00,RT @drkafeelkhan: This is Dr Sabista khan .I request all the Indians to come with me and speak up and take part in the protest today at 11…,ahmed_sf,"Bengaluru, India",I'm very simple person. i'm proud to be an indian. i'm proud to be a muslim. i support truth. i hate ISIS & RSS. I SUPPORT TO DESTROY ISIS RSS.,547,454,120090,False,"This is Dr Sabista khan .I request all the Indians to come with me and speak up and take part in the protest today at 11 AM Mandi House, Delhi #FreeDrKafeel #LiWenliang #coronavirus https://t.co/GOQ26p076T"
2020-02-10 02:49:20+00:00,RT @amygrl17: What is going on over there?!,kmos58,"Indiana, USA",married hunter fisherman,102,129,1166,False,What is going on over there?! https://t.co/5VuRmqwuyF
2020-02-10 02:49:26+00:00,RT @drkafeelkhan: This is Dr Sabista khan .I request all the Indians to come with me and speak up and take part in the protest today at 11…,Ayazmansoori11,"Mumbai, India",Mumbadevi president of Mahatma Phule Samata parishad . NGO of Chhangan Bhujbal saheb,37,1337,1113,False,"This is Dr Sabista khan .I request all the Indians to come with me and speak up and take part in the protest today at 11 AM Mandi House, Delhi #FreeDrKafeel #LiWenliang #coronavirus https://t.co/GOQ26p076T"
2020-02-10 02:49:31+00:00,"#NonVegetarians_Are_Killers
#MondayMotivation
It is a biggest sin to consume meat.
And it is proved that Corona virus is spreading because of meat.
So 
It's not an order of God
#NoMeat_NoCoronaVirus https://t.co/XnYNMo6HvE",Dhanesh26512921,"Chhattisgarh, India",Satbhakti is aim of life.,922,2526,3541,False,No Value Mentioned
2020-02-10 02:49:32+00:00,"RT @madhukishwar: While there are many instances of Islamists &amp;Christians committing genocides of non Muslims &amp;non Christians, only Communi…",RavindraJetty,"Bengaluru, India","As Isreal is to Jews, India to Hindus!
ॐ सर्वे भवन्तु सुखिनः सर्वे सन्तु निरामयाः ।
सर्वे भद्राणि पश्यन्तु मा कश्चिद्दुःखभाग्भवेत् ।",1531,4987,33705,False,"While there are many instances of Islamists &amp;Christians committing genocides of non Muslims &amp;non Christians, only Communists are known to commit genocides of their own countrymen. Lenin, Stalin,Mao,PolPot etc.outperformed Hitler in extent of mass slaughters of fellow citizens https://t.co/EbcMY4r8vv"
2020-02-10 02:49:34+00:00,"RT @Ingenieurbiomed: Liang Wudong, who was treating patients with corona virus in Wuhan, became infected while treating his patients and be…",BhaveshPadave,"India, Maharashtra, Mumbai","Indian 🇮🇳
Be Humble ❣️",76,265,116,False,"Liang Wudong, who was treating patients with corona virus in Wuhan, became infected while treating his patients and becomes the first doctor to die for corona virus. A reminder that while everyone tries to avoid it, front line medical staff risk their lives to save others. https://t.co/wVNHLCKnFZ"
2020-02-10 02:49:36+00:00,Coronavirus claims 97 lives in one day – but number of infections stabilises https://t.co/eb3BDAEwWO https://t.co/he86tjEkyC,jobgujnews3,India,No Value Mentioned,31,250,20272,False,No Value Mentioned
2020-02-10 02:49:38+00:00,RT @detresfa_: One way to touch stuff while moving around in an epidemic zone #China #Coronavirus https://t.co/EpvAYM0XRL,Nikitad99135138,"Mumbai, India",No Value Mentioned,58,10,4289,False,One way to touch stuff while moving around in an epidemic zone #China #Coronavirus https://t.co/EpvAYM0XRL
2020-02-10 02:49:42+00:00,RT @NHKWORLD_News: Experts warn coronavirus is hitting Japan's GDP https://t.co/r5ROyd9Cqh,Gravity_v20,"visakhapatnam, India",प्रान्तीय आर्थिक  उत्तेजक संस्था  Regional Economic Planning; tweets for #TheTechState @supercomp_india #IGES #NeoMacro Tweets by GKB,644,225,78870,False,Experts warn coronavirus is hitting Japan's GDP https://t.co/r5ROyd9Cqh
2020-02-10 02:49:45+00:00,"RT @madhukishwar: While there are many instances of Islamists &amp;Christians committing genocides of non Muslims &amp;non Christians, only Communi…",Andy48098477,India,भारतीय,112,1589,42792,False,"While there are many instances of Islamists &amp;Christians committing genocides of non Muslims &amp;non Christians, only Communists are known to commit genocides of their own countrymen. Lenin, Stalin,Mao,PolPot etc.outperformed Hitler in extent of mass slaughters of fellow citizens https://t.co/EbcMY4r8vv"
2020-02-10 02:49:49+00:00,"RT @AKSHAYINAMDAR: in light of Corona virus infections reaching 40+ cases in Singapore, I request you to provide full refund on our travel…",RightProceed,"Bangalore,India","A proud Indian first. Railfan, avgeek, nature lover, marathon runner, wanderlust next. All in all, I'm not just another brick in the wall :-)",473,493,724,False,"in light of Corona virus infections reaching 40+ cases in Singapore, I request you to provide full refund on our travel which is scheduled for tomorrow from Bangalore to Singapore on board Air India Express IX-486

@HardeepSPuri 
@AshwaniLohani 
@airindiaexpress"
2020-02-10 02:49:50+00:00,@CitizenDK We must respect the human rights of the coronavirus and allow it to travel wherever it pleases whenever it pleases,RedDiamondMP,"Chinese Bot Farm, Indiana","Marxist-Leninist ☭ - 20 - AVI/Banner: @Karidochi  

Vote for Gloria La Riva and reject fascism

Alts: @VoCrystalGems @comradepearl",713,523,12600,False,No Value Mentioned
2020-02-10 02:49:55+00:00,"Also, other states have out of wedlock babies, and they don’t have the violence epidemic we do. Indiana ranks 19th out of 50 states for the amount of people killed by guns. 

Other countries have single mothers, but because they have strict gun laws, they don’t have an epidemic.",goosenotter,"Indiana, USA",Teacher turned stay-at-home-Mom. Co-Lead for the Indiana Chapter of Moms Demand Action. Opinions are my own. #BeSMART She/Her/Hers,478,951,5048,False,No Value Mentioned
2020-02-10 02:49:56+00:00,"RT @ImtiazMadmood: With 636 deaths and 36000 victims of Corona virus, one fact has been overlooked.

None of the Muslim or Jew men is victi…",ShubhraBajpai4,"Pune, India","जो देश हित की बात करेगा,
वही देश पे राज करेगा।
सनातनी हिन्दू एवम देशभक्त",493,1347,7377,False,"With 636 deaths and 36000 victims of Corona virus, one fact has been overlooked.

None of the Muslim or Jew men is victim and it is because of circumcision. 

China is now secretly circumcising millions daily.

~ Dr Zakir Naik"
2020-02-10 02:49:57+00:00,"RT @smitaprakash: ""China has been lying...they said it originated from a seafood market...Wuhan has level 4 super-lab that works with world…",YogeshBugalia,"Rajasthan, India","घणी खम्मा माँ भवानी,

जय माँ वैष्णो",249,446,22122,False,"""China has been lying...they said it originated from a seafood market...Wuhan has level 4 super-lab that works with world's most deadly pathogens including caronavirus"" https://t.co/4sdMAmcwW1"
2020-02-10 02:50:00+00:00,"Coronavirus death toll rises to 908 in China

#CoronarvirusOutbreak #Coronavirus #China #ChinaVirus 

https://t.co/f5KAWqUxdj",JagranEnglish,"New Delhi, India",Jagran English the new age Trending News site. Check out https://t.co/UuzBHS8KDs for all latest & top trends across globe.,4637,33,125254,True,No Value Mentioned
2020-02-10 02:50:16+00:00,RT @JustinB84741875: #Coronavirustruth #coronavirus Please retweet this.https://t.co/i1qMhe2DxW,Abhishe17867060,"Navi Mumbai, India","Love the ideology of Sabka Sath, Sabka Vikas & Sabka Vishwas. Proud mumbaikar.",49,265,1966,False,#Coronavirustruth #coronavirus Please retweet this.https://t.co/i1qMhe2DxW
2020-02-10 02:50:18+00:00,RT @drkafeelkhan: This is Dr Sabista khan .I request all the Indians to come with me and speak up and take part in the protest today at 11…,iamnoorani,"Hyderabad, India",No Value Mentioned,115,382,33234,False,"This is Dr Sabista khan .I request all the Indians to come with me and speak up and take part in the protest today at 11 AM Mandi House, Delhi #FreeDrKafeel #LiWenliang #coronavirus https://t.co/GOQ26p076T"
2020-02-10 02:50:24+00:00,RT @drkafeelkhan: This is Dr Sabista khan .I request all the Indians to come with me and speak up and take part in the protest today at 11…,SeebuMerajSid,Kanpur (India),"https://t.co/yjE30lky6M media district co-ordinator NSUI Bundelkhand, Ex.Student Leader Bundelkhand University Jhansi, Social Activist, Pharmacist, Retweets r not endorsement",315,317,17952,False,"This is Dr Sabista khan .I request all the Indians to come with me and speak up and take part in the protest today at 11 AM Mandi House, Delhi #FreeDrKafeel #LiWenliang #coronavirus https://t.co/GOQ26p076T"
2020-02-10 02:50:46+00:00,"RT @MarkLevineNYC: In powerful show of defiance of #coronavirus scare, huge crowds gathering in NYC's Chinatown for ceremony ahead of annua…",shannonkatt,"Indiana, USA","🌊#Resist
My Plan: Show every person what Trump is doing behind their backs on Medicare, Medicaid, Social Security and Cutting Pre existing conditions coverage.",3449,4993,34902,False,"In powerful show of defiance of #coronavirus scare, huge crowds gathering in NYC's Chinatown for ceremony ahead of annual #LunarNewYear parade. Chants of ""be strong Wuhan!""

If you are staying away, you are missing out! https://t.co/NGBUAfHWpl"
2020-02-10 02:50:57+00:00,RT @drkafeelkhan: This is Dr Sabista khan .I request all the Indians to come with me and speak up and take part in the protest today at 11…,AbidaKh50863100,"Jaipur, India",No Value Mentioned,971,534,5618,False,"This is Dr Sabista khan .I request all the Indians to come with me and speak up and take part in the protest today at 11 AM Mandi House, Delhi #FreeDrKafeel #LiWenliang #coronavirus https://t.co/GOQ26p076T"
2020-02-10 02:50:59+00:00,"RT @Akashtv1Soni: FACTS ON #Coronavirus 1/3

Health Minister of Singapore to his Parliament.

Coronavirus spreads through droplets..like if…",raahulbansal,India,"Fitness enthusiast, YouTube-
https://t.co/UcLnfHjg6S
Instagram-
https://t.co/tiGY1SMkQs",1049,199,182314,False,"FACTS ON #Coronavirus 1/3

Health Minister of Singapore to his Parliament.

Coronavirus spreads through droplets..like if one sneezes..it settles on a chair/table..stays alive for several days. You touch that chair and then your face - YOU CAN GET AFFECTED.

@gauravcsawant https://t.co/OfnQMqhtUc"
2020-02-10 02:51:09+00:00,RT @drkafeelkhan: This is Dr Sabista khan .I request all the Indians to come with me and speak up and take part in the protest today at 11…,AjajAhm72820607,INDIA ,Just listen to yourself ✋✋,181,294,17396,False,"This is Dr Sabista khan .I request all the Indians to come with me and speak up and take part in the protest today at 11 AM Mandi House, Delhi #FreeDrKafeel #LiWenliang #coronavirus https://t.co/GOQ26p076T"
2020-02-10 02:51:10+00:00,"RT @JainKiran6: Meanwhile, in China....😟😩 https://t.co/IpZrQP0VpP",PayelDa56572248,India,self employed / b.j.p member/Koi congress ke chamche follow na kare/@ssrivastava78 follow him(kattar hindu),602,464,9601,False,"Meanwhile, in China....😟😩 https://t.co/IpZrQP0VpP"
2020-02-10 02:51:29+00:00,"I have been sad for more than a week and peole ask me why you are sad and when I tell them I am sad for people who are suffering and dying in China in such a large number for no fault . people say ,how r u connected ? its strange, but i do feel that entire human race is connected",Sinha_Nagmani,India,Senior Sales Professional. Lets make a new world of Safe & Sustainable Practice,842,2726,10989,False,No Value Mentioned
2020-02-10 02:51:30+00:00,RT @drkafeelkhan: This is Dr Sabista khan .I request all the Indians to come with me and speak up and take part in the protest today at 11…,abxtylish,"Gulbarga, India",proud to be a Dr❤️❤️,132,158,539,False,"This is Dr Sabista khan .I request all the Indians to come with me and speak up and take part in the protest today at 11 AM Mandi House, Delhi #FreeDrKafeel #LiWenliang #coronavirus https://t.co/GOQ26p076T"
2020-02-10 02:51:31+00:00,"RT @jaswant29: #MondayMotivation
Satbhakti can cure Corona virus transmitted disease. https://t.co/NQ19QRUp6x",rajeshmajumdark,"Gurgaon, India",18/01/1986,484,2401,9565,False,"#MondayMotivation
Satbhakti can cure Corona virus transmitted disease. https://t.co/NQ19QRUp6x"
2020-02-10 02:51:42+00:00,"Citi believes the worst is behind for Tata Steel, but expect Stock to be volatile pending visibility on the duration of disruption in China, target at Rs 550/Sh (Positive)",muralikumarje,"Tamil Nadu, India","Latest news updates.... Indian Stock markets NSE, BSE and World Stock markets related news and more.",4175,66,268219,False,No Value Mentioned
2020-02-10 02:51:46+00:00,"RT @CestMoiz: Even though many are talking about the impact of #CoronaVirus on Chinese economy, no one is talking about its impact on the C…",nmraval,India,No Value Mentioned,155,1113,74878,False,"Even though many are talking about the impact of #CoronaVirus on Chinese economy, no one is talking about its impact on the Communist Party of China as such.
So, I'll just leave the screenshot of these two tweets here without any further comment.
'Interesting' days ahead, I'd say https://t.co/KyUG0ARQQJ"
2020-02-10 02:51:46+00:00,RT @drkafeelkhan: This is Dr Sabista khan .I request all the Indians to come with me and speak up and take part in the protest today at 11…,RiyazAliIdrish1,"Ahmadabad City, India",All India  #SocialWorker (Samaaj Sevak) . #india 🇮🇳🇮🇳🇮🇳❤️❤️❤️,73,317,4861,False,"This is Dr Sabista khan .I request all the Indians to come with me and speak up and take part in the protest today at 11 AM Mandi House, Delhi #FreeDrKafeel #LiWenliang #coronavirus https://t.co/GOQ26p076T"
2020-02-10 02:51:50+00:00,RT @detresfa_: One way to touch stuff while moving around in an epidemic zone #China #Coronavirus https://t.co/EpvAYM0XRL,aksinhaster,India,No Value Mentioned,742,481,269786,False,One way to touch stuff while moving around in an epidemic zone #China #Coronavirus https://t.co/EpvAYM0XRL
2020-02-10 02:51:50+00:00,RT @EpochTimesChina: 9 members of a #HongKong family have been infected with the novel #Coronavirus after sharing a hotpot meal at a restau…,bharatjain1973,"Mumbai, India","Be Original Be Positive Life Is Beautiful
My Words Are My Own Thoughts I Am Not Afraid Of Any One.
I Write Wht Is Truth I Hate Fakes & Liars. Nation First",422,2946,25869,False,"9 members of a #HongKong family have been infected with the novel #Coronavirus after sharing a hotpot meal at a restaurant last month, officials confirmed.

Most of the people who ate the meal showed no symptoms, even minor ones, Chuang said. https://t.co/ZAD35W299e"
2020-02-10 02:52:02+00:00,"RT @Cernovich: There's just no way to know what is really happening with the Corona Virus.

Our own U.S. media is doing the bidding of thei…",psteph55,"Indiana, USA","#RRBC #RWISA Award winning author who has written his first novel, The Altar Boy.  Is now getting ready to publish his second, At the Edge of the Stairs.",845,994,10899,False,"There's just no way to know what is really happening with the Corona Virus.

Our own U.S. media is doing the bidding of their pharmaceutical advertising and plugging flu shots.

Chinese media is worse than American media.

Social media videos are impossible to authenticate."
2020-02-10 02:52:14+00:00,Coronavirus could ‘COLLAPSE’ UK travel firms leaving thousands out of jobs - The Irish Sun https://t.co/U0zTAc6iLj #UK #Travel,DirectTrip,"New Delhi, India",Your Trips. Your Way. Travel More. Save More. Enjoy More. With Direct Trip. No Middle Men. Just Fun & Memorable Trips. Book a DirectTrip! http://t.co/w3Zd7Inad3,335,24,32228,False,No Value Mentioned
2020-02-10 02:52:22+00:00,India expresses solidarity with China over Coronavirus outbreak; Offers assistance to deal with situation - https://t.co/WhEfo1Bvav,Indsamachar,India,"The absolute truth is ‘Aham Brahmasmi’ rest all is relative and NEWS. News is News.We are here to help Deliver it ,not Stop it .",7006,0,19897,False,No Value Mentioned
2020-02-10 02:52:45+00:00,"1. US indices closed slightly negative on Friday. Jobs data beaten estimates (225K added in Jan).
2. The death toll from the coronavirus outbreak(908), meanwhile, rose again over the weekend, passing the total killed by the SARS epidemic. 
3. Brent crude is struggling below 55 $",koushik_tweetin,"Trivandrum, India",|Indian_Markets|OPTIONS|TIME_is_myfriend|Believing only one edge/conviction that makes consistent profit in market is being humble and trying to catch same|,851,383,2977,False,No Value Mentioned
2020-02-10 02:52:45+00:00,RT @drkafeelkhan: This is Dr Sabista khan .I request all the Indians to come with me and speak up and take part in the protest today at 11…,b6e3dc6057014da,"Nawada, India",786,37,91,5974,False,"This is Dr Sabista khan .I request all the Indians to come with me and speak up and take part in the protest today at 11 AM Mandi House, Delhi #FreeDrKafeel #LiWenliang #coronavirus https://t.co/GOQ26p076T"
2020-02-10 02:52:46+00:00,"RT @MikeRiosNews: Chen Qiushi, a citizen journalist who had been doing critical reporting from #Wuhan, the epicenter of the #coronavirus ou…",0071Ajitesh,"जम्बुद्विपे ,भारतवर्षे ,India",जय श्री राम 👌,1115,4988,98349,False,"Chen Qiushi, a citizen journalist who had been doing critical reporting from #Wuhan, the epicenter of the #coronavirus outbreak, went missing on Thursday evening, just as hundreds of thousands of people in #China began demanding freedom of speech online. 

https://t.co/z1i87ZIjkS"
2020-02-10 02:52:54+00:00,RT @saviourishere4u: Report by Japan's leading think tank Japan Center for Economic Research (JCER) has predicted that the Indian economy w…,harshillukha,"Mumbai, India",Die hard fan of Joker..getting politically aware..Chai- Fan and Emraan Hashmi Fan Kohli Fan Rafa Fan,134,571,22265,False,"Report by Japan's leading think tank Japan Center for Economic Research (JCER) has predicted that the Indian economy will in the next 40 years see a fourfold increase and will, therefore, be the third leading economy in the world by 2060.

https://t.co/BlwZDBaEA4"
2020-02-10 02:52:55+00:00,Inhuman #China. Poor people who cannot afford masks are treated mercilessly by Police . Here the leftist intellectuals should be shown mirror @SanatanWomen @SitaramYechury @sagarikaghose @Aabhas24 #mondaythoughts #MondayMorning #coronaviruschina #Corona #coronavirus #XiJingping https://t.co/MAmuXmwfN2,sheetalm_b,India,"Student enrolled in college of 'Life'| London School of Economics @LSEalumni | PUMBA(Univ of Pune-MBA)| I follow @ShriguruPawanji -Change Yourself,Change Aeon|",264,844,1561,False,No Value Mentioned
2020-02-10 02:53:03+00:00,"RT @AKSHAYINAMDAR: in light of Corona virus infections reaching 40+ cases in Singapore, I request you to provide full refund on our travel…",Abhilash12841,"Bengaluru, India","Proud Indian, Hindu Nationalist, Believer in Centre-Right Wing Politics, Ferroequinologist (Railfan), Cricket Buff, Traveller, Avid Robin Cook Books' Fan",163,183,3703,False,"in light of Corona virus infections reaching 40+ cases in Singapore, I request you to provide full refund on our travel which is scheduled for tomorrow from Bangalore to Singapore on board Air India Express IX-486

@HardeepSPuri 
@AshwaniLohani 
@airindiaexpress"
2020-02-10 02:53:06+00:00,RT @suhasinih: Journalism in the time of an epidemic. Readers Editor @CholamandalPann weighs in on criticism @the_hindu story on the Ebola…,vaishnaroy,"Chennai, India","Associate Editor, The Hindu. 
Edits Sunday Magazine & Literary Review. All tweets are personal and do not represent the newspaper's views. RTs not endorsements.",5093,505,12414,False,"Journalism in the time of an epidemic. Readers Editor @CholamandalPann weighs in on criticism @the_hindu story on the Ebola study conducted by NCBS with funding from US DoD &amp; collaboration from Wuhan Institute of Virology
https://t.co/Isepqm4MhW"
2020-02-10 02:53:07+00:00,RT @NavroopSingh_: 'Enemy of mankind': Chinese Ambassador to Britain remarked on #CoronaVirus  https://t.co/WoxF0jSE8z,0071Ajitesh,"जम्बुद्विपे ,भारतवर्षे ,India",जय श्री राम 👌,1115,4988,98349,False,'Enemy of mankind': Chinese Ambassador to Britain remarked on #CoronaVirus  https://t.co/WoxF0jSE8z
2020-02-10 02:53:11+00:00,RT @ndtv: 9 of Hong Kong family infected with #coronavirus after sharing meal. https://t.co/t6vp4hjizh https://t.co/RSTm8HuSqf,but_bhakt,"Jorhat, India",No Value Mentioned,10,37,1304,False,9 of Hong Kong family infected with #coronavirus after sharing meal. https://t.co/t6vp4hjizh https://t.co/RSTm8HuSqf
2020-02-10 02:53:16+00:00,RT @detresfa_: One way to touch stuff while moving around in an epidemic zone #China #Coronavirus https://t.co/EpvAYM0XRL,jgujral11,"New Delhi, India","HR professional currently on sabbatical. Fauji daughter, mother of twins. RT not endorsements.☝🏻",297,1332,2438,False,One way to touch stuff while moving around in an epidemic zone #China #Coronavirus https://t.co/EpvAYM0XRL
2020-02-10 02:53:21+00:00,"The 2019 novel coronavirus outbreak has claimed over 900 lives in China, authorities said, while the number of confirmed cases has exceeded 40,000.

https://t.co/FdYToljEWS

#coronavirus #CoronavirusOutbreak #coronaviruschina #nCoV2019 #nCoV_2019 #WuhanVirus #WuhanCoronavius",_Indiaupdates,"New Delhi, India","India Updates is an independent news & Information Website. We provide Important updates, News that matters to you.",143,101,4324,False,No Value Mentioned
2020-02-10 02:53:22+00:00,RT @steve_hanke: #Chinese police forcefully detain a woman because she might have the #Coronavirus. China's #Censorship &amp; lies continue to…,OroraBorealis,India,Indian. Sanatani Hindu.RT does'nt mean endorsement.,305,685,33116,False,"#Chinese police forcefully detain a woman because she might have the #Coronavirus. China's #Censorship &amp; lies continue to encourage the spread of the disease. Don't believe a word coming out of the #Communist megaphones in  #Beijing.
https://t.co/Jd9oMeA015"
