created_at,full_text,screen_name,location,description,followers_count,friends_count,statuses_count,verified,full_retweet_text
2020-01-22 09:10:07+00:00,China issues travel advisory after deaths due to nCoV https://t.co/yBAmQqj5Ul,GetNewsd,"New Delhi, India","Newsd is a new age information, curation and dissemination platform. A one-stop shop for your daily news consumption. Send your write ups to social@newsd.in",18527,166,79182,True,No Value Mentioned
2020-01-22 09:26:45+00:00,RT @WHO: BREAKING: WHO Director-General @DrTedros will convene an Emergency Committee on the novel #coronavirus (2019-nCoV) under the Inter…,Rajs_gopinath,"Odisha, India","Fun loving, caring, respect to others feeling...ମାତୃଭୂମି ମାତୃଭାଷା ର ମମତା , ଯା ହୃଦେ ଜନମି ନାହିଁ,
ତାକୁ ଯଦି ଜ୍ଞାନୀ ଗଣରେ ଗଣିବା, ଅଜ୍ଞାନ ରହିବେ କାହିଁ ।",137,724,13066,False,"BREAKING: WHO Director-General @DrTedros will convene an Emergency Committee on the novel #coronavirus (2019-nCoV) under the International Health Regulations. 
The Committee will meet on Wednesday, 22 January 2020. https://t.co/w3w7ZuoTeG"
2020-01-22 09:56:34+00:00,"RT @WHO: Today, the #UnitedStates🇺🇸 reported its first case of novel #coronavirus (2019-nCoV) in a traveller recently returned from #Wuhan,…",pephelix,"India, Germany",Custom made Peptide array for infectious diseases|| Next generation Sequencing||BD,178,847,1371,False,"Today, the #UnitedStates🇺🇸 reported its first case of novel #coronavirus (2019-nCoV) in a traveller recently returned from #Wuhan, #China🇨🇳 https://t.co/zn8QmeQrt2"
