created_at,full_text,screen_name,location,description,followers_count,friends_count,statuses_count,verified,full_retweet_text
2020-02-07 17:34:02+00:00,"RT @OpIndia_com: While Pakistan ignored its citizens in coronavirus hit Wuhan, India had offered to evacuate them along with all neighbours…",RakeshU49020698, India,INDIA FOR INDIANS not for SICKULARS. RT and Likes are not endorsement.,143,216,14480,False,"While Pakistan ignored its citizens in coronavirus hit Wuhan, India had offered to evacuate them along with all neighbours: Foreign minister tells Rajya Sabha

https://t.co/teqI6InZQg"
2020-02-07 17:34:04+00:00,RT @LiYuan6: The Chinese public have staged what amounts to an online revolt last night after the death of Dr. Li Wenliang.Government offic…,Christiya6,"Neyveli, India",Teacher,23,275,2685,False,"The Chinese public have staged what amounts to an online revolt last night after the death of Dr. Li Wenliang.Government officials,biz figures &amp; ordinary folks,have posted numerous messages expressing their grief and anger. It's sth I haven't seen in years https://t.co/zge4rVysB2 https://t.co/uL4JVd89u1"
2020-02-07 17:34:08+00:00,RT @EricCheungwc: Portraits of late Chinese doctor Li Wenliang - who was silenced by authorities after warning of the #NovelCoronavirus - c…,Christiya6,"Neyveli, India",Teacher,23,275,2685,False,Portraits of late Chinese doctor Li Wenliang - who was silenced by authorities after warning of the #NovelCoronavirus - circulating on Chinese social media platforms after his death last night: https://t.co/WWvJUDiLtT
2020-02-07 17:34:12+00:00,"RT @RealJamesWoods: When we speak of heroic whistle-blowers, it is men like Dr. Li Wenliang, who literally sacrificed his life to save the…",singhgpadam6,"Karnataka, India","HARDWORK WILL ALWAYS PAY ,SELFLESS SERVICE IS THE WAY FOR ME JAI HIND VANDE MATARAM",208,546,12409,False,"When we speak of heroic whistle-blowers, it is men like Dr. Li Wenliang, who literally sacrificed his life to save the world. Then, of course, there are those other kinds of whistle-blowers, like deep state Democrats, for example,  slithering in the swamp. https://t.co/maRkqHR5H0"
2020-02-07 17:34:12+00:00,"RT @janisfrayer: Scolded for warning of #coronavirus in #Wuhan, Li Wenliang told @Caixin, ‘A healthy society should have more than one voic…",Christiya6,"Neyveli, India",Teacher,23,275,2685,False,"Scolded for warning of #coronavirus in #Wuhan, Li Wenliang told @Caixin, ‘A healthy society should have more than one voice.’ That phrase creating a social media earthquake rarely seen here, with posts about lies, fury &amp; free speech. Predictably, #China censors busy too. @NBCNews https://t.co/tj2irFx0EE"
2020-02-07 17:34:19+00:00,"RT @OzraeliAvi: While Chinese students took to the streets of Melbourne today in protest of “Coronavirus related racism”.

This ad was play…",scaredcrow15,India,"AF veteran ,
RT not endorsement,
live and let live",173,183,47839,False,"While Chinese students took to the streets of Melbourne today in protest of “Coronavirus related racism”.

This ad was playing live back home. 

Who’s the real racists? https://t.co/qitMDdwJgL"
2020-02-07 17:34:20+00:00,"@retheeshraj10 Flag in your cover photo speaks alot about edu.. what communism has destroyed.. in USSR, China, Cuba,  Latin America to North Korea..to Marichhapi incident in Bengal where left goons killed 30,000 Bengali Hindus..how many lives Stalin Mao Kim Jong Un and your fav che guvera took.",madhursaxena39,"Kanpur, India","Indian, enthusiastic, curious, Bibliophile, Autodidact, Chartered Accountant, CFA Level II candidate

#Enroutenobodytosomebody",130,1695,2123,False,No Value Mentioned
2020-02-07 17:34:25+00:00,Harvard Leads U.S. Colleges That Received $1 Billion From China. Hmmm. Didn’t Obama and the new Manchurian candidate Pet Buttgig go there? And Pocahontas.  https://t.co/P23r6X12y8,PatriotMarine4,"Indiana, USA",Conservative Christian. Truth seeker. Union Ironworker. Marine Corps Veteran.,128,317,226,False,No Value Mentioned
2020-02-07 17:34:28+00:00,RT @ZeeNews: India's offer of evacuating people from China's Wuhan was extended to all its neighbours: S Jaishankar https://t.co/MBfM2lIrvQ,bitts4ever,India,INDIA FIRST /LAPSY BOY/ YOGA LOVER,183,121,51626,False,India's offer of evacuating people from China's Wuhan was extended to all its neighbours: S Jaishankar https://t.co/MBfM2lIrvQ
2020-02-07 17:34:30+00:00,Quarantine or death chamber? https://t.co/s1Cga8KRLR,RajeshUPandit,"Odisha, India","EDM, Pop, Country, Jazz, History, Movies, Books. Climate change. Gypsy. RTs not endorsements; tweets are personal.",1663,1085,14193,False,No Value Mentioned
2020-02-07 17:34:37+00:00,#China watch US official has aggressive plan to fight Huawei https://t.co/fyNv3suKlk,MajorGeneralPC,India,"Major General PC SEN, (6 Aug 1954) Senior Indian Army officer, completed his Bachelor of Engineering (Electronics) Dec 1980.",22,32,2856,False,No Value Mentioned
2020-02-07 17:34:40+00:00,RT @Thomas1774Paine: ICYMI - Did China’s Tencent Accidentally Leak The True Terrifying Coronavirus Statistics https://t.co/cipQ3wfo2S,MaheshC15143297,"Rewa, India",No Value Mentioned,3074,4076,213546,False,ICYMI - Did China’s Tencent Accidentally Leak The True Terrifying Coronavirus Statistics https://t.co/cipQ3wfo2S
2020-02-07 17:34:42+00:00,"RT @ProsaicView: If it was one of the poorest countries during Mughal rule, why did the Brits want to colonise it? 🤔🤔",dhyatrvizrava,India,स्वाधीनता | तथ्य | सुभगता,30,510,5853,False,"If it was one of the poorest countries during Mughal rule, why did the Brits want to colonise it? 🤔🤔 https://t.co/iOxEqbBKRn"
2020-02-07 17:34:43+00:00,RT @NavroopSingh_: Coronavirus cure found by Indian Scientist; team leader at CSIRO cultured the first viable batch https://t.co/ezLnI51wR8,RaulParody,India,Dynast to the core. Parody of the biggest dynast in the world.,519,2662,60686,False,Coronavirus cure found by Indian Scientist; team leader at CSIRO cultured the first viable batch https://t.co/ezLnI51wR8
2020-02-07 17:34:47+00:00,RT @TarekFatah: Islamic cleric discovers a cure for #CoronaVirus by mixing fresh camel piss and cow's milk and drinking it straight while i…,AyushAg02789154,"Bewar, India","1st country
2nd Indian army lover
3rd मोदी फैन
चंदन है इस देश की माटी तपोभूमि हर ग्राम है बाला बाला देवी की प्रतिमा बच्चा बच्चा राम है।🇮🇳
rt=no endorsement",528,658,13041,False,Islamic cleric discovers a cure for #CoronaVirus by mixing fresh camel piss and cow's milk and drinking it straight while its desert warm. #CoronavirusOutbreak https://t.co/GyPIs0Z1WF
2020-02-07 17:34:48+00:00,RT @RamyInocencio: NEW: Remember the name Dr. Li Wenliang. Anger and grief are rocking China after the #coronavirus whistleblower died from…,RAHULPANGAONKA4,"Pune, India",Emerging Investor,2,21,40,False,"NEW: Remember the name Dr. Li Wenliang. Anger and grief are rocking China after the #coronavirus whistleblower died from the virus he first warned the country of. Authorities accused him of spreading rumors. 31,000 have been infected. More than 600 have died. @CBSNews is here. https://t.co/E6PIsdmVV9"
2020-02-07 17:34:51+00:00,"RT @free_thinker: A video of an exotic meat market in Indonesia is viral as a 'dirty' market in Wuhan, China, the epicentre of coronavirus…",gmk_86,"Navi Mumbai, India",No Value Mentioned,206,107,128757,False,"A video of an exotic meat market in Indonesia is viral as a 'dirty' market in Wuhan, China, the epicentre of coronavirus outbreak.

WATCH #AltNewsFactCheck

https://t.co/dfpUjBkAJE"
2020-02-07 17:34:51+00:00,RT @TwitterMoments: Wuhan Central Hospital said Li Wenliang is in critical condition and denied reports of his death. The doctor is one of…,kamalkapoor049,"delhi, India","Nation first,Proud Indian,Punjabi, Punjabi bolo 
अश्क  आँख  में  कब  नहीं  आता  
लहु  आता  है  जब  नहीं  आता",582,910,28748,False,Wuhan Central Hospital said Li Wenliang is in critical condition and denied reports of his death. The doctor is one of eight coronavirus whistleblowers who tried to warn others about the outbreak in December. https://t.co/pzHmBvGgnH
2020-02-07 17:34:51+00:00,RT @drharshvardhan: .@WHO has declared #NovelCoronavirus outbreak as a “Public Health Emergency of International Concern”  on 30th January…,JainBibhu,"Bihar, India","ward parshad ara nagar nigam 22,bihar,bhojpur,194ara vidhan sabha parbhari it cell BJP",605,1199,20669,False,".@WHO has declared #NovelCoronavirus outbreak as a “Public Health Emergency of International Concern”  on 30th January 2020.

@MoHFW_INDIA @PMOIndia  #nCoV #nCoV19 @WHOSEARO https://t.co/3vOLMdYqB1"
2020-02-07 17:34:52+00:00,RT @LiYuan6: The Chinese public have staged what amounts to an online revolt last night after the death of Dr. Li Wenliang.Government offic…,Celestia_Benita,"Chennai,India",No Value Mentioned,97,44,35,False,"The Chinese public have staged what amounts to an online revolt last night after the death of Dr. Li Wenliang.Government officials,biz figures &amp; ordinary folks,have posted numerous messages expressing their grief and anger. It's sth I haven't seen in years https://t.co/zge4rVysB2 https://t.co/uL4JVd89u1"
2020-02-07 17:34:55+00:00,"RT @desimojito: India ready to evacuate Pakistani students from Wuhan: MEA

Unpopular opinion : I am against this decision. 

https://t.co/…",Rajkamalpandey7,"New Delhi, India","HardCore Ultra Nationalist😎             Indian🇮🇳
🚩🚩मंदिर वहीं बनाएंगे 🚩🚩",147,2169,12654,False,"India ready to evacuate Pakistani students from Wuhan: MEA

Unpopular opinion : I am against this decision. 

https://t.co/wGBVMELDLJ"
2020-02-07 17:35:01+00:00,Vaccinations: Coronavirus outbreak – Why does it take so long to make a vaccine?  https://t.co/qdiqLaf4oW,mirzhaywire,India,Very unprofessional and often jumping to conclusions,5660,69,68821,False,No Value Mentioned
2020-02-07 17:35:03+00:00,"RT @sushantsareen: We never learn. If we think a good gesture to an enemy will change their attitude &amp; behaviour, then we neither know the…",Opportunis_T,"Bhawanipatna, India",A centrist liberal with left leaning before CAA protest .After CAA protests far right with all d roads 2 d center blocked for life. Not a secular anymore ..,93,241,8372,False,"We never learn. If we think a good gesture to an enemy will change their attitude &amp; behaviour, then we neither know the enemy nor have we learnt anything from our history. https://t.co/ETgFYnco3V"
2020-02-07 17:35:03+00:00,RT @NavroopSingh_: Coronavirus cure found by Indian Scientist; team leader at CSIRO cultured the first viable batch https://t.co/ezLnI51wR8,bhim123,"Delhi,India","Roots in the Abode of Gods -Uttarkhand,News Junkei,Cricket Fanatic, Amateur Photographer",677,662,32270,False,Coronavirus cure found by Indian Scientist; team leader at CSIRO cultured the first viable batch https://t.co/ezLnI51wR8
2020-02-07 17:35:04+00:00,RT @ihucash: Is it on tour?,AdiAPC,"Kolkata, India",Keep on scrolling...,67,399,5830,False,Is it on tour? https://t.co/PNwFacMEMI
2020-02-07 17:35:04+00:00,RT @shegotdapower: Look at Korea's crown Prince and China's Male God. We love to see it https://t.co/4fG3jtRA7W,itisalllight,India,"Stan Astro, Stan Talent.",254,583,6217,False,Look at Korea's crown Prince and China's Male God. We love to see it https://t.co/4fG3jtRA7W
2020-02-07 17:35:09+00:00,RT @palkisu: Chinese censors are scrubbing the internet clean of any references to Xi. Media reports make no mention of him re #coronavirus…,Indira19240204,India,PROUD HINDU,1240,940,66076,False,Chinese censors are scrubbing the internet clean of any references to Xi. Media reports make no mention of him re #coronavirus. People can slam local officials but not mention the Prez. Survey in a govt mouthpiece says people unhappy with provincial govts but have faith in Xi 🙄 https://t.co/7ucIJCGEyB
2020-02-07 17:35:10+00:00,RT @VPSecretariat: Many compliments to the 34-member Team Air INDIA for flying into #coronavirus-hit Wuhan city &amp; evacuating more than 600…,PtAshokkiradoo,"Kolkata, India🇮🇳",#Astrologer,3811,2606,135612,False,Many compliments to the 34-member Team Air INDIA for flying into #coronavirus-hit Wuhan city &amp; evacuating more than 600 Indians onboard two special flights. https://t.co/6qyrbRbBOD
2020-02-07 17:35:18+00:00,"[2/7/2020 12:34 PM]  
Woman uses remote control car to buy steamed buns amid coronavirus outbreak in China https://t.co/3O1MqWytoa",TomLittlejohn3,"Indianapolis, IN",Still learning after all these years. Re-tweets do not imply agreement.,55,290,101,False,No Value Mentioned
2020-02-07 17:35:18+00:00,"RT @TIinExile: Wrong.

2000 years ago, long before a single rat eating Mughal invader stepped on Indian soil, India was world's richest cou…",shakthigj,"Tamil Nadu, India","I was born as Hindu 
I am living as Hindu and 
I will die as Hindu",2327,2341,208957,False,"Wrong.

2000 years ago, long before a single rat eating Mughal invader stepped on Indian soil, India was world's richest country with 32.5% of World's GDP.

By the end of Mughal rule (1820 CE), India became one of the world's poorest countries. Its GDP was half that of China https://t.co/XcvA2eeyJm https://t.co/wQkh1hqgw3"
2020-02-07 17:35:23+00:00,RT @ANI: EAM Dr S Jaishankar in Rajya Sabha: We were prepared to bring back not only our people but also those from all our neighbourhood w…,atultyagi10,"Bengaluru South, India",No Retweet is Endorsement. PM Modi Fan 🤘🤘,97,147,19055,False,EAM Dr S Jaishankar in Rajya Sabha: We were prepared to bring back not only our people but also those from all our neighbourhood who would have liked to. This was an offer which was made to all our neighbours but only 7 nationals of Maldives chose to avail the offer. #Coronavirus https://t.co/S2lquD7ykm
2020-02-07 17:35:26+00:00,RT @TarekFatah: Islamic cleric discovers a cure for #CoronaVirus by mixing fresh camel piss and cow's milk and drinking it straight while i…,sme1965,India,"#MSMEs- Create jobs for people #Revenue for govts ,Grow entrepreneurship ,Helps local NGOs by donations ,Brings economic equilibrium among population",773,1513,43571,False,Islamic cleric discovers a cure for #CoronaVirus by mixing fresh camel piss and cow's milk and drinking it straight while its desert warm. #CoronavirusOutbreak https://t.co/GyPIs0Z1WF
2020-02-07 17:35:26+00:00,"RT @OmarMushfique: After removing the mask, how doctor and nurse look.
 doctors have to use the mask for more than 12 hours to serve the co…",PspkJanasena1,"Bengaluru, India",INDIAN🇮🇳 || Hindu || PawanKalyan || MS Dhoni || Trivikram || FuckTheLeftIdeology,37,360,37158,False,"After removing the mask, how doctor and nurse look.
 doctors have to use the mask for more than 12 hours to serve the corona virus patients.

 Love and respect for all the great doctors who are always involved in the service of humanity.

#corononavirus #CoronaOutbreak https://t.co/iTAASzybCe"
2020-02-07 17:35:28+00:00,RT @tw_bhav: The reason why Kerala has confirmed #Coronavirus cases is becoz their system is geared to quickly detect n quarantine affected…,rukhsarsaleem,"Gurgaon, India","Writes average, Speaks better, best @ storytelling. Social Activist to the core. Founder - Mother Digest https://t.co/kodaqTOqzo
RTs are not endorsements.",903,314,7292,False,"The reason why Kerala has confirmed #Coronavirus cases is becoz their system is geared to quickly detect n quarantine affected folks. 

Others are busy doing jugaad n believing some miracle will protect them. https://t.co/IsbrYgf9mF"
2020-02-07 17:35:30+00:00,RT @ihucash: Is it on tour?,SharonyaTrivedi,"Kolkata, India",No Value Mentioned,185,505,11990,False,Is it on tour? https://t.co/PNwFacMEMI
2020-02-07 17:35:31+00:00,91-Year-Old Coronavirus-infected Patient Cured in Hubei https://t.co/v99xvM9M0A,Rexcharlesnews,India,"Fbb Femina Miss India World 2017 | Future doctor | Model | Artist | Dreamer & Achiever
.",430,0,12658,False,No Value Mentioned
2020-02-07 17:35:31+00:00,"RT @Shawna_7777: I would question what the hell is IN the mist that they are spreading all over the city?? 

They could actually be spreadi…",dbuttonredhead,"Indiana, USA","Wife, Mother, Nana and Registered Nurse.
🇺🇲🇺🇲🇺🇲🇺🇲🇺🇲🇺🇲🇺🇲🇺🇲🇺🇲🇺🇲
#PATRIOT #KAG #Trump2020",2079,2125,8833,False,"I would question what the hell is IN the mist that they are spreading all over the city?? 

They could actually be spreading the virus or something worse. Not a good feeling about it, that’s just me. https://t.co/9XiQcrXCbN"
2020-02-07 17:35:34+00:00,RT @drharshvardhan: In a suo-moto statement in #RajyaSabha today regarding outbreak of #NovelCoronavirus disease in #China and some other c…,dilipjain1979,"Bengaluru, India",Entrepreneur ● Love Cooking ● Blessed To Be Followed By PM Narendra Modi & Sh Amit Shah ● #JaiHind 🇮🇳,13573,414,278872,False,"In a suo-moto statement in #RajyaSabha today regarding outbreak of #NovelCoronavirus disease in #China and some other countries &amp; the steps taken by our Govt, I said that as on 6th February, a total of  31161 confirmed cases &amp; 636 deaths have been reported in China @MoHFW_INDIA https://t.co/zKX9mCXcgt"
2020-02-07 17:35:34+00:00,RT @ihucash: Is it on tour?,jaspreet_saini_,"Chandigarh, India","Inhale Waheguru Exhale Worries❤
6.2'↕ | 5 March🎂| Dream To Join IAF✈ | Chandigarh🏡 | 
IG- therealjaspreetsaini | I wish i could write 'writer' here but nah✍",165,607,17075,False,Is it on tour? https://t.co/PNwFacMEMI
2020-02-07 17:35:34+00:00,"RT @AltNews: A video of an exotic meat market in Indonesia is viral as a 'dirty' market in Wuhan, China, the epicentre of coronavirus outbr…",Iamshiyad,India,Precious Metals Trader.,635,151,251589,False,"A video of an exotic meat market in Indonesia is viral as a 'dirty' market in Wuhan, China, the epicentre of coronavirus outbreak.

WATCH #AltNewsFactCheck

https://t.co/wUGYLQenlb"
2020-02-07 17:35:41+00:00,RT @LiYuan6: The Chinese public have staged what amounts to an online revolt last night after the death of Dr. Li Wenliang.Government offic…,Kalyan3639,"Khammam, India",CA Student!! In the process of turning dreams into reality.,57,217,482,False,"The Chinese public have staged what amounts to an online revolt last night after the death of Dr. Li Wenliang.Government officials,biz figures &amp; ordinary folks,have posted numerous messages expressing their grief and anger. It's sth I haven't seen in years https://t.co/zge4rVysB2 https://t.co/uL4JVd89u1"
2020-02-07 17:35:44+00:00,"RT @TIinExile: Source: ""The World Economy"" by British economist Angus Maddison.

India was an agricultural economy. 2000 years ago, India h…",shakthigj,"Tamil Nadu, India","I was born as Hindu 
I am living as Hindu and 
I will die as Hindu",2327,2341,208957,False,"Source: ""The World Economy"" by British economist Angus Maddison.

India was an agricultural economy. 2000 years ago, India had 32.5% of World GDP, which was higher than Han China.

By the time of Mughal emperor Akbar Shah (1820), India's GDP was 16% and half that of China . https://t.co/DqdpLYqk9b"
2020-02-07 17:35:47+00:00,"RT @GOPLeader: In the last 10 days, President Trump:
• Worked on a Middle East peace plan
• Stood up to China with a landmark trade agreeme…",RobinCasselman,"Indiana, USA",No Value Mentioned,34,329,3233,False,"In the last 10 days, President Trump:
• Worked on a Middle East peace plan
• Stood up to China with a landmark trade agreement
• Signed #USMCA to level the playing field for American workers

Here's what Dems have been working on:
• Impeachment
• Impeachment
• Impeachment"
2020-02-07 17:35:49+00:00,"RT @JenniferHYChan: #ChinaCommunistParty would never hesitate to silence Whistleblowers/Activists.

#LiWenliang died in the hospital, kille…",MaheshC15143297,"Rewa, India",No Value Mentioned,3074,4076,213546,False,"#ChinaCommunistParty would never hesitate to silence Whistleblowers/Activists.

#LiWenliang died in the hospital, killed by #CCP or #coronavirus?

#HongKongProtesters, many had similar fate. Silenced by #PoliceBrutality.

By the same Brutal Commies regime.

#CCP_kills_activists https://t.co/1jCYpbIO32"
2020-02-07 17:35:50+00:00,RT @AltNews: An article from a website that routinely publishes 'junk news stories' is viral. It spreads the false claim that the Chinese g…,daaktardush,"New Delhi, India",Narcissist. . .loud . . .spontaneous ...crazy about  dogs. . .Ex-Actor and doctor by profession !!!,294,179,184726,False,"An article from a website that routinely publishes 'junk news stories' is viral. It spreads the false claim that the Chinese government has sought the court's approval to put down 20,000 coronavirus patients. #AltNewsFactCheck | @ArchitMeta 

https://t.co/KdRc2xKwAb"
2020-02-07 17:35:52+00:00,"RT @GovMikeHuckabee: Proving he doesn't hold grudges, @realDonaldTrump just announced he's sending a delegation immediately to China consis…",John_2020KAG,"Indiana, USA ","just your average American citizen,U.S. NAVY  veteran,#MAGA,#KAG, #CodeOfVets,#BuildTheWall,#NAVY, IFBP",14221,14172,74642,False,"Proving he doesn't hold grudges, @realDonaldTrump just announced he's sending a delegation immediately to China consisting of Mitt Romney, Nancy Pelosi, Adam Schiff, and Jerry Nadler."
2020-02-07 17:35:54+00:00,RT @drharshvardhan: In a suo-moto statement in #RajyaSabha today regarding outbreak of #NovelCoronavirus disease in #China and some other c…,ribadiyadipen,"Veraval, India","#bjp gir Somnath Veraval it sm incharge web management  #sacular stay away,,all RT is not endorsements....#follo_to_follow
@narendramodi",1107,3292,95790,False,"In a suo-moto statement in #RajyaSabha today regarding outbreak of #NovelCoronavirus disease in #China and some other countries &amp; the steps taken by our Govt, I said that as on 6th February, a total of  31161 confirmed cases &amp; 636 deaths have been reported in China @MoHFW_INDIA https://t.co/zKX9mCXcgt"
2020-02-07 17:35:57+00:00,"The government is constantly monitoring the coronavirus situation and is taking all necessary steps to avoid the spread of the virus, Union Health Minister Harsh Vardhan told Rajya Sabha on Friday.
https://t.co/5ipeKBVTci",dt_next,"Chennai, India",English language newspaper by the Daily Thanthi Group,5585,408,113218,True,No Value Mentioned
2020-02-07 17:36:00+00:00,RT @stratisplatform: Universities are still struggling to meet the need for #blockchain #education as they grapple with teaching other emer…,stylist_crypto,UAE & india,"#crypto #invester #business #bitcoin #altcoin #youtube #blockchain #cryptocurrancy #pundiX #xvg  #indiawantscrypto #holo 
i am what i am
i am just me",929,1816,29896,False,"Universities are still struggling to meet the need for #blockchain #education as they grapple with teaching other emerging technologies, such as #AI. So why not join the #StratisAcademy? https://t.co/w3KflOOsFF
https://t.co/tuaejPzaEA"
2020-02-07 17:36:02+00:00,"RT @drginareghetti: Li Wenliang, Chinese doctor who sounded alarm on coronavirus, dies from virus https://t.co/4maAo9DLtF via @nypost",josekammca,Kerala India,"Blessed 36 yrs with wife.A daughter& a son&3 grands; Follows Bible & CCC, Faith in God's mercy &grace through Jesus,Holy Spirit ,&Church. Humble catechist.",2201,3700,38990,False,"Li Wenliang, Chinese doctor who sounded alarm on coronavirus, dies from virus https://t.co/4maAo9DLtF via @nypost"
2020-02-07 17:36:04+00:00,"RT @ParuChirps: Finally, the #Coronavirus affected @airindiain got an antidote in @RNTata2000 !! 

@Swamy39 @narendramodi @TVMohandasPai @n…",gsarin,"Mumbai, India","Love music, books, chess, tennis, hockey, badminton. RT ≠ endorsements. Personal A/c.",2700,2108,93965,False,"Finally, the #Coronavirus affected @airindiain got an antidote in @RNTata2000 !! 

@Swamy39 @narendramodi @TVMohandasPai @nsitharaman"
2020-02-07 17:36:06+00:00,"Great Wall from China @ India Expo Centre &amp; Mart, Greater Noida https://t.co/ltiQwoX1G7",somaet,"New Delhi,India","Exec Director Energy Infrastructure CII. Author The Disrupter https://t.co/RqvDa819y5. Was national economics editor, The Economic Times. Tweets personal",4271,1579,4380,False,No Value Mentioned
2020-02-07 17:36:08+00:00,"RT @BJPLive: India was prepared to bring back not only its own people but also from neighboring countries. 

We offered it to everyone but…",SalamJoySingh4,"Imphal, India","Former MLA of Manipur Legislative Assembly & Vice President,BJP Manipur Pradesh",427,923,21471,False,"India was prepared to bring back not only its own people but also from neighboring countries. 

We offered it to everyone but only Maldives availed to it: EAM @DrSJaishankar on India’s evacuation efforts in China after Coronavirus outbreak. https://t.co/iLYLWDWE67"
2020-02-07 17:36:08+00:00,"""Chinese rage after the death of the doctor who tried to warn the world about coronavirus""  https://t.co/gA5LBXOlt5",bhataamir19019,Indian occupied Kashmir,"bhataamir19019||
muslim||
crickter🏏🏏🏏

Tweeting since 2015🗓

The Rays of Light comming from her eyes gets reflected from the convex mirror of my heart❤.....",489,558,3933,False,No Value Mentioned
