created_at,full_text,screen_name,location,description,followers_count,friends_count,statuses_count,verified,full_retweet_text
2020-03-24 23:36:31+00:00,RT @MinhazMerchant: India records slowest increase in new cases (20) in the last 24 hours and thankfully no new deaths #COVID19,MumbaiAmchi,India,"Tweets are personal views. Not a bhakt, but an ordinary Indian. Basically a person who wants answers.",476,1644,227181,False,India records slowest increase in new cases (20) in the last 24 hours and thankfully no new deaths #COVID19
2020-03-24 23:36:34+00:00,RT @JoyAnnReid: This man is a danger to the public health. https://t.co/b7J3tVuHsf,rogamorris,"Indiana, USA",No Value Mentioned,107,581,6278,False,This man is a danger to the public health. https://t.co/b7J3tVuHsf
2020-03-24 23:36:43+00:00,RT @GovWhitmer: I am working relentlessly to secure what our health care workers need so they can continue to fight the spread of #COVIDー19…,bcloud1967,"Indiana, USA","Engineer, musician, fisherman. Lover of the outdoors, fine beer & family (not necessarily in that order).  Anti-Trump Republican (❤️ Constitution & Rule of Law)",71,92,28833,False,"I am working relentlessly to secure what our health care workers need so they can continue to fight the spread of #COVIDー19. If you or your business are able to donate essential items to meet our medical providers’ needs, we’d love your help."
2020-03-24 23:36:43+00:00,"RT @narendramodi: By converging around shops, you are risking the spread of COVID-19.

No panic buying please.

Please stay indoors. 

I re…",manishpal_,"Uttar Pradesh, India 🇮🇳","Proud of Indian Army🇮🇳
Hindu Nationalist,Nation First,RSS Ideology,
Tweets Are Based On Facts & Opinions,Views Are Personal.
Followed By Many Hon'ble persons.",7536,539,206855,False,"By converging around shops, you are risking the spread of COVID-19.

No panic buying please.

Please stay indoors. 

I repeat- Centre and State Governments will ensure all essentials are available. https://t.co/bX00az1h7l"
2020-03-24 23:36:43+00:00,2. about the Kashmir lock down. Mandir wahi ban raha hai. A thing that we can't even see with our eyes except via a microscope has shown us that arrogance/over confidence/pride/ego can all be crushed together in a second. We call the unknown God.,ugiboogie2,India,"Live, uncut walkthroughs of games, new and old, with commentary in Hindi and English.",71,159,9848,False,No Value Mentioned
2020-03-24 23:36:47+00:00,"RT @narendramodi: Doctors, nurses and lab technicians shared their insights and experiences of tackling COVID-19. 

What was heartening was…",PravinAlai,"Nashik, Mumbai, India",State Head - IT & Social Media @BJP4Maharashtra | Karyakarta,8242,1171,19168,True,"Doctors, nurses and lab technicians shared their insights and experiences of tackling COVID-19. 

What was heartening was their unwavering determination to ensure care for every citizen.  

India salutes them for everything they are doing for the nation."
2020-03-24 23:36:52+00:00,RT @DanCrenshawTX: Oh you’ve got to be kidding me,WilliSwihart,Northeastern Indiana,"Pro Trump, Pro Life, Pro God, America and Family.  Amateur Photographer.",267,168,27989,False,Oh you’ve got to be kidding me https://t.co/zYhSpkyyOf
2020-03-24 23:36:52+00:00,"RT @ShashiTharoor: @OmarAbdullah Good to have you back on @twitter &amp; I hope soon amongst us, Omar, #covid19 permitting! Glad to sense that…",SuhailNayyar,"Mumbai, India","Actor- Udta Punjab, Life Sahi Hai, The Test Case, Hotel Mumbai. Latest - Hasmukh streaming on NETFLIX",973,429,997,False,"@OmarAbdullah Good to have you back on @twitter &amp; I hope soon amongst us, Omar, #covid19 permitting! Glad to sense that you’re in good spirits, your sense of humour is intact &amp; feistiness undiminished. There’s a battle to be fought against two viruses, the other being the communal contagion."
2020-03-24 23:36:53+00:00,"RT @RinkuDa56322508: #DiseaseFree_With_TrueWorship
Due to the spiritual power of Great Saint Rampal Ji Maharaj, severe diseases of millions…",SangalPravesh,"Kangra, India",Kabir is god,366,2412,9355,False,"#DiseaseFree_With_TrueWorship
Due to the spiritual power of Great Saint Rampal Ji Maharaj, severe diseases of millions of people have also ended. Today, the country and the world if facing a formidable problem like coronavirus. https://t.co/aaKm1DF9WJ"
2020-03-24 23:36:55+00:00,RT @RealClassKlown: For you dummies that don’t under what the CDC is saying. Here’s a cartoon https://t.co/yWyonehNbW,olijv,"Indianapolis, IN","That's right kids...mondo nsfw

Cis-male-english-person",112,941,59028,False,For you dummies that don’t under what the CDC is saying. Here’s a cartoon https://t.co/yWyonehNbW
2020-03-24 23:36:58+00:00,"RT @UN: Handwashing is key to stopping the spread of #COVID19.

@UNDP is working to help ensure some of the world's most vulnerable people…",imjkzone,"Mumbai, India",A secular means i have faith in and practice my religion Islam and respect others.There have always been #TheGoodTheBadAndTheUgly in all communities #OverAndOut,2231,1920,16815,False,"Handwashing is key to stopping the spread of #COVID19.

@UNDP is working to help ensure some of the world's most vulnerable people have access to clean, reliable water for better health. https://t.co/tRWnmxg2ZL

https://t.co/93LrsSYgJ9"
2020-03-24 23:36:59+00:00,"RT @republic: 'Don't We Have Any Responsibility?': Lata Mangeshkar Questions Citizens Defying Curfew

https://t.co/z8JCIk5OBd",BrittoIvor,"Mumbai, India.",Hindustani Christian/Vande Mataram/India First/I Believe In Religion Of Humanity/Live&Let Live/Animal&Nature Lover/#NaMo Admirer-Supporter. RT's Not Endorsement,215,670,78923,False,"'Don't We Have Any Responsibility?': Lata Mangeshkar Questions Citizens Defying Curfew

https://t.co/z8JCIk5OBd"
2020-03-24 23:37:09+00:00,"RT @narendramodi: My fellow citizens, 

THERE IS ABSOLUTELY NO NEED TO PANIC.

Essential commodities, medicines etc. would be available. Ce…",ajayjib77,"Ahmadabad City, India","“व्यक्ति अपने गुणों से ऊपर उठता है । 
ऊँचे स्थान पर बैठ जाने से ही ऊँचा नहीं हो जाता है ।",87,501,169,False,"My fellow citizens, 

THERE IS ABSOLUTELY NO NEED TO PANIC.

Essential commodities, medicines etc. would be available. Centre and various state governments will work in close coordination to ensure this.

Together, we will fight COVID-19 and create a healthier India. 

Jai Hind!"
2020-03-24 23:37:11+00:00,"Me: Ugh. I do not like my alma mater. Booo Harding!

Pandemic Me: *YouTubes old Spring Sing clips in isolation* For UNITED we STAND! DIVIDED we FALL! And if our backs should ever... 🎶",AngelaDeCamp,Indianapolis,☀️ Local Artist. Cycling Novice. Cat Lady. Greek Yogurt Enthusiast. ☀️,388,275,9063,False,No Value Mentioned
2020-03-24 23:37:15+00:00,"RT @EdLatimore: In 2 years, ""Corona"" is going to be the most popular girl's name because they were conceived during the quarantine.

In 20…",TW_Beckett,"Indianapolis, IN","Thoughts on a Midlife Journey to Find Purpose, Meaning, and Myself. Entrepreneur, Happily Divorced.  Single Father.  Man

IG:  twbeckettafj
YouTube: TW Beckett",10260,333,42811,False,"In 2 years, ""Corona"" is going to be the most popular girl's name because they were conceived during the quarantine.

In 20 years, it will be the new basic bitch name and stripper alias."
2020-03-24 23:37:17+00:00,"RT @narendramodi: Doctors, nurses and lab technicians shared their insights and experiences of tackling COVID-19. 

What was heartening was…",PukhrambamI,"Imphal, India",BJP Nambol Mandal Enrollment In Charge,30,334,676,False,"Doctors, nurses and lab technicians shared their insights and experiences of tackling COVID-19. 

What was heartening was their unwavering determination to ensure care for every citizen.  

India salutes them for everything they are doing for the nation."
2020-03-24 23:37:17+00:00,"RT @NicholsUprising: “What you’re seeing in the UK, in other countries, is the (government) saying to employers: if you retain your workers…",itsSeaBee,"Indianapolis, IN",Purdue Alum | Indy Sports Fan #IndyForever |  Hufflepuff | Player for @Atletico_CH | he/his | 🍞🌹| #BLM | @ShelbySaid💍 | ↙️↙️↙️ | Register to Vote ⬇️,304,413,8772,False,"“What you’re seeing in the UK, in other countries, is the (government) saying to employers: if you retain your workers—even if you furlough them, even if they’re working from home—they’re going to continue to get the paycheck...”
— ⁦@BernieSanders⁩
 https://t.co/a0UYwpwrQx"
2020-03-24 23:37:20+00:00,@ConsciousSent @peterbakernyt @PreetBharara You are the one losing battles here. How is coronavirus situation in west though? Heard they can't contain it with their advanced technology. Lol,subhammishra191,"New Delhi, India",No Value Mentioned,16,125,2208,False,No Value Mentioned
2020-03-24 23:37:32+00:00,"RT @sachin_rt: Simple things are often the hardest to do, because they require consistent discipline &amp; determination.

Hon‘ble PM @narendra…",BeingPandey123,"Ranchi, India",Salman Khan/Rohit Sharma Die Hard Fan,52,63,436,False,"Simple things are often the hardest to do, because they require consistent discipline &amp; determination.

Hon‘ble PM @narendramodi ji has asked us to #StayHomeStaySafe for 21 days. This simple task can save millions of lives.

Let’s all unite in this war against #COVID19."
2020-03-24 23:37:40+00:00,"RT @oliverdarcy: Two things that happened today: 

1.) WHO says the United States has the ""potential"" to become next epicenter of coronavir…",FKAkwigs,"Franklin, Indiana",UE’19 🏳️‍🌈,1081,900,2070,False,"Two things that happened today: 

1.) WHO says the United States has the ""potential"" to become next epicenter of coronavirus pandemic. 

2.) Trump says goal is to open up country ""as we near the end of our historic battle"" and that there is ""light at the end of the tunnel."""
2020-03-24 23:37:40+00:00,RT @ashoswai: China was making half of world's mask before #CoronaVirus - China increased its production 12 times more after #CoronaCrisis.…,awaldilse,"West Bengal, India",Assalaamu ‘alaykum.(Peace be upon you!!) May Allah (SWT) return your kindness🌸🇮🇳,115,165,10279,False,"China was making half of world's mask before #CoronaVirus - China increased its production 12 times more after #CoronaCrisis. If Americans are hoarding China-produced masks, why India failed to produce its own masks in the last 3 months. What happened to Modi's #MakeinIndia?"
2020-03-24 23:37:42+00:00,"RT @Shanthi423: I'm 7 months pregnant, came to E.G.Dt, AP for an emergency. I have my scan scheduled on 28-Mar at Rainbow hospital, Hyderna…",nomulatharun9,"Hyderabad, India","Back up Account @nomulatharun1... 
// #Prabhas fan \\ #Prabhas... Prabhas##",1112,2294,89033,False,"I'm 7 months pregnant, came to E.G.Dt, AP for an emergency. I have my scan scheduled on 28-Mar at Rainbow hospital, Hydernagar. But with lockdown till 14-Apr it's not possible for me to reach Hyd and I will miss 2 scans.
@KTRTRS Sir, can you please help me reach Hyd safely."
2020-03-24 23:37:45+00:00,RT @SachinPilot: I support the PM’s decision to implement a 21 day lockdown across India. Rajasthan was among the first states to implement…,omprakash9561,"Nanded-Waghala, India","Yesterday is history.
Tomorrow is a mystery.
Today is a gift.
That's why it's called the PRESENT.🎁 😊",50,1244,824,False,"I support the PM’s decision to implement a 21 day lockdown across India. Rajasthan was among the first states to implement a lockdown. We will ensure that public is not put to inconvenience during this period &amp; essentials are supplied.
United in this fight against #COVID19"
2020-03-24 23:37:54+00:00,"Coronavirus isn't mutating fast, long lasting vaccine protection could be possible: Study https://t.co/Q82A0f8EhW",republic,"Mumbai, India","Official handle of the Republic Media Network.
DIGITAL. TV. MEDIA
https://t.co/jpp32jhq3d",1370187,3,311160,True,No Value Mentioned
2020-03-24 23:37:56+00:00,"RT @ANI: PM Narendra Modi today had a telephonic conversation with Ursula Von Der Leyen, President of the European Commission. The two lead…",ChaudhuriAbir,"New Delhi, India",Barça || ICT || Messi FC || Sports Enthusiast || Random Retweets || Previously: @abirchaudhuri5,129,2801,20341,False,"PM Narendra Modi today had a telephonic conversation with Ursula Von Der Leyen, President of the European Commission. The two leaders discussed the global situation in the context of ongoing #COVID19 pandemic: Prime Minister's Office (File pic) https://t.co/KcrWNwigfY"
2020-03-24 23:37:57+00:00,"Most coronavirus deaths reported in a day:

- Italy: 793

- Spain: 680

- China: 254
#coronavirus",prashant_r_mali,India,#farmer,18,24,231,False,No Value Mentioned
2020-03-24 23:38:00+00:00,"RT @MrMerrillsClass: School closed due to #COVID19? @Buncee has stepped up to help out. 🙌🏻

Create a Classroom account for 💥FREE💥 for the d…",maestraw,"Indiana, USA",#BookJunkies book expedition group 8th grade language arts and MS ESL teacher. My tweets are my own.,1575,2379,34844,False,"School closed due to #COVID19? @Buncee has stepped up to help out. 🙌🏻

Create a Classroom account for 💥FREE💥 for the duration of the closure: https://t.co/c7ssSTzN0w

Want ideas on how it all works? Join us tonight: https://t.co/7IuIPlGUZ6

#remotelearning #remoteteaching https://t.co/0TKizZCfen"
2020-03-24 23:38:11+00:00,"RT @INCManipur: Hon'ble @RahulGandhi predicted the outcome of COVIC 19 PANDEMIC

#AbKaroDeshKiRakhwali https://t.co/8FKpi64AIL",KhuraijamTombi,"Imphal, Manipur, India","Secy.(Adm), Patsoi Block Congress Committee",190,807,3624,False,"Hon'ble @RahulGandhi predicted the outcome of COVIC 19 PANDEMIC

#AbKaroDeshKiRakhwali https://t.co/8FKpi64AIL"
2020-03-24 23:38:18+00:00,"RT @ANI: France #Coronavirus death toll jumps 240 to 1100, reports AFP news agency quoting official",12_desai,India,Indian,57,43,8325,False,"France #Coronavirus death toll jumps 240 to 1100, reports AFP news agency quoting official"
2020-03-24 23:38:21+00:00,"RT @FLOTUS: As the days go by, isolation can be challenging. But if we make social distancing &amp; personal hygiene a priority, we will get th…",_makeinindia,India,"Come Make In India|||||
Aahar Investment
Abu Dhabi!!!",4167,895,25083,False,"As the days go by, isolation can be challenging. But if we make social distancing &amp; personal hygiene a priority, we will get through this faster. We can stop #COVID19 but only if we all commit to following the rules. Be safe, be healthy!"
2020-03-24 23:55:32+00:00,"RT @cjwerleman: Wow - instead of buying urgently needed medical supplies and equipment to save India from COVID-19, he’s buying $116 millio…",Greenpolygame,India,Playing game and making Pranks,16,27,1623,False,"Wow - instead of buying urgently needed medical supplies and equipment to save India from COVID-19, he’s buying $116 million worth of weapons from Israel to further repress and kill Muslims in Kashmir."
2020-03-24 23:55:32+00:00,RT @arianaeunjung: The coronavirus isn’t mutating quickly. There are only about four to 10 genetic differences between the strains that hav…,sndhsharma737,"Bengaluru, India",follow @kala_kritika on Instagram 💜,12,220,146,False,The coronavirus isn’t mutating quickly. There are only about four to 10 genetic differences between the strains that have infected people in the United States and the original virus that spread in Wuhan. https://t.co/2EM3SzxhVR
2020-03-24 23:55:34+00:00,Please stay at home and support our country in fighting this #Covid_19india https://t.co/QV4P6anFgl,vijjitweety,India,"Stubborn, brave, sensitive... I am a mixture of many qualities",50,49,131,False,No Value Mentioned
2020-03-24 23:55:37+00:00,"RT @BangadAnuj: CONGRESS RULED INDIA
-In 2009 during SWINE-FLU outbreak Indian scientists got vaccine out in 17-18 days of first death in I…",Nir0909,India,“I stopped explaining myself when I realized other people only understand from their level of perception.Thanks for whoever friends follow me.,13523,11352,133389,False,"CONGRESS RULED INDIA
-In 2009 during SWINE-FLU outbreak Indian scientists got vaccine out in 17-18 days of first death in India.

BJP RULED INDIA
-Today it's over 16 dead in past 20 days due to #COVID19outbreak but no progress in test kit mfg at first &amp; treatment later."
2020-03-24 23:55:44+00:00,RT @ashokgehlot51: I am glad that #Rajasthan was the first state to announce complete lock down. I support 21 days of lock down announce by…,vishnu_sharma94,"Delhi,India","Preparing to serve this great nation ""BHARAT""",213,2285,3701,False,"I am glad that #Rajasthan was the first state to announce complete lock down. I support 21 days of lock down announce by PM Mr Modi. Together Lets  fight and defeat #Corona 
#राजस्थान_सतर्क_है"
2020-03-24 23:55:44+00:00,RT @swapan55: This is a health emergency. Without any delay the WBengal govt must allow the aayushman Bharat scheme to be introduced in the…,catlover_ind,India,No Value Mentioned,45,87,14491,False,This is a health emergency. Without any delay the WBengal govt must allow the aayushman Bharat scheme to be introduced in the state. This is no time for personal vanity to subvert the united fight against coronavirus. @narendramodi @SuPriyoBabul @MamataOfficial
2020-03-24 23:55:56+00:00,"RT @narendramodi: My fellow citizens, 

THERE IS ABSOLUTELY NO NEED TO PANIC.

Essential commodities, medicines etc. would be available. Ce…",thiya_pillai,"Kumbakonam, India","இன்றைய நிஜம் எல்லாம் நாளைய
நினைவாகலாம்!
ஆனால் இன்றைய நினைவெல்லாம்
ஒரு நாளும் நிஜமாகாது!",110,440,821,False,"My fellow citizens, 

THERE IS ABSOLUTELY NO NEED TO PANIC.

Essential commodities, medicines etc. would be available. Centre and various state governments will work in close coordination to ensure this.

Together, we will fight COVID-19 and create a healthier India. 

Jai Hind!"
2020-03-24 23:55:58+00:00,"RT @SethAbramson: 22/ And that's why Trump is talking about ""reopening"" America *now*—before those numbers hit. Right now, he can point to…",jackhammer3853,Indiana,"“Whether You Like It Or Not  You’re Gonna Hear From Me. A Dem. And A Life,Liberty And A Pursuit Of Happiness Patriot",1736,5004,129469,False,"22/ And that's why Trump is talking about ""reopening"" America *now*—before those numbers hit. Right now, he can point to the nation's coronavirus deaths (around 600) and imply that that number is not just low but will *stay low* no matter what we do. But it won't—and he knows it."
2020-03-24 23:56:07+00:00,Ok museum money is really the definition of pork right?  We can argue over corporate bailouts or employee stipends but dumping cash on a museum in the middle of a pandemic? https://t.co/VWPbZyQghQ,daltonsbriefs,Northwest Indiana,"@cendercompany Principal Partner, Registered MA, Indiana #municipalgov, #muniland, #Purdue, #ValpoCross from #Valpo, #NWindiana Jesus follower, husband, father",8120,8952,21211,False,No Value Mentioned
2020-03-24 23:56:09+00:00,"RT @rabishchandra: Ranchi District Administration joins with Big Bazaar to provide door step delivery of essential items.
#lockdownindia #2…",NitirAseem,"Gumla, India","नितिर असीम : Non-alcoholic😇, Optimistic 🤓, Melodist 🎹, Fond of reading, Driving, Music, Gadgets...",31,69,179,False,"Ranchi District Administration joins with Big Bazaar to provide door step delivery of essential items.
#lockdownindia #21days https://t.co/jgThAz2OMm"
2020-03-24 23:56:12+00:00,"RT @silverado1954: Jerry you already spent the money, my advice start charging to go to museums.
 A total of $11,520,368 — the cost of impe…",frthalk,"Corydon, Indiana","Blessed Husband, Father and Grandfather of 7.   Find me on Parler: B_thalken",723,994,109104,False,"Jerry you already spent the money, my advice start charging to go to museums.
 A total of $11,520,368 — the cost of impeaching Trump. https://t.co/hI0VaRzyUy"
2020-03-24 23:56:16+00:00,"RT @ndtv: How 1 lakh cameras are playing critical role containing virus in Moscow.
https://t.co/rDwDljg9ct https://t.co/UfjvhD2YaU",Manik4500,"New Delhi, India",No Value Mentioned,65,1344,7414,False,"How 1 lakh cameras are playing critical role containing virus in Moscow.
https://t.co/rDwDljg9ct https://t.co/UfjvhD2YaU"
2020-03-24 23:56:16+00:00,"RT @rajeev_mp: Please please dont shout n threaten policemen n others enforcing #Lockdown. 

Not a good idea to try n intimidate those on f…",premgundecha,"Mumbai, India",No Value Mentioned,16,120,659,False,"Please please dont shout n threaten policemen n others enforcing #Lockdown. 

Not a good idea to try n intimidate those on frontline of #IndiaFightsCoronavirus. 

Dont be a #COVIDIOTS   Be responsible n #StayHome 

 https://t.co/IHzJ6VkDrz"
2020-03-24 23:56:18+00:00,"RT @UnSubtleDesi: Chinese man’s death by Hantavirus causes furore. 

HPS has a mortality rate of 38%. The incubation period of the virus is…",bharat3785,"Pune, India","IndiaFirst, RTs not endorsement, Views Personal",106,249,23413,False,"Chinese man’s death by Hantavirus causes furore. 

HPS has a mortality rate of 38%. The incubation period of the virus is not known due to the rarity of the disease.

Here is all you need to know about the virus because Coronavirus was just not enough

https://t.co/5vOPIY9ECx"
2020-03-24 23:56:19+00:00,@ErikSTownsend any thoughts on this considering your @MacroVoices video podcasts (from last July and August) about a Global Digital Reserve currency? https://t.co/0GLhm47lH2,codyhall11,"Indiana, USA","Not that I have already obtained this or am already perfect, but I press on to make it my own, because Christ Jesus has made me his own. Philippians 3:12",197,329,4397,False,No Value Mentioned
2020-03-24 23:56:27+00:00,"RT @Vijayabaskarofl: #Update:The #covid19 +ve Pt at MDU,Rajaji Hosp is not responding well to treatment since evening &amp; is deteriorating no…",sweetrascal_07,"Chennai, India",I Just find myself happy with the simple things. Appreciating the blessings God gave me.,9,469,3026,False,"#Update:The #covid19 +ve Pt at MDU,Rajaji Hosp is not responding well to treatment since evening &amp; is deteriorating now.He has a medical history of prolonged illness with steroid dependent COPD, uncontrolled Diabetes with Hypertension. Our team is striving hard to stabilise.#CVB"
2020-03-24 23:56:29+00:00,"RT @cjwerleman: Wow - instead of buying urgently needed medical supplies and equipment to save India from COVID-19, he’s buying $116 millio…",imoinkhan,"Bengaluru, India",A human being who is being human :-),168,1632,3940,False,"Wow - instead of buying urgently needed medical supplies and equipment to save India from COVID-19, he’s buying $116 million worth of weapons from Israel to further repress and kill Muslims in Kashmir."
2020-03-24 23:56:39+00:00,RT @AartiTikoo: Basically Xi gave 2 choices to the world—death by #Coronavirus or economic depression. All in the hope that the world will…,prashant_pmo,"New Delhi, India","भारतीय जनता पार्टी वोलेंटियर
मोदी भक्त 🙏🙏🙏🙏",385,339,43103,False,Basically Xi gave 2 choices to the world—death by #Coronavirus or economic depression. All in the hope that the world will kneel before him while China continues to produce &amp; everyone stays dependent. Quite like Hitler who continued production while carrying out Jewish Holocaust.
2020-03-24 23:56:39+00:00,RT @Ivanhoes1965: Just wanted to let everyone know that we are open for carry out. Just give us a call at 765-998-7261 and we’ll take your…,happenstanceho,Indianapolis IN US,I've recently been described as cat-like but without the grace.,160,491,1085,False,"Just wanted to let everyone know that we are open for carry out. Just give us a call at 765-998-7261 and we’ll take your order and have it ready when you get here!
Please be safe and if your sick stay home and take care of yourself. 
Thank You"
2020-03-24 23:56:45+00:00,RT @jsolomonReports: Fauci wants Trump to be flexible on Easter deadline to restart America from coronavirus shutdown. https://t.co/z6cRfIa…,Sunnyc4u,"Indiana, USA","Patriot! #MAGA, #KAG! Animal lover! Gun owner! Pilot! Pianist! Know a thing or two because I’ve seen a thing or two.",413,790,43923,False,Fauci wants Trump to be flexible on Easter deadline to restart America from coronavirus shutdown. https://t.co/z6cRfIaB9L
2020-03-24 23:56:49+00:00,RT @NabilahforGA07: Quid pro quo with the American people during a pandemic?,lads04,"Indiana, USA","Liberal Dem. mother of two beautiful daughters. Huge lover of animals. Love music, reading, and am a crime tv buff ( love the forensics part)",675,357,43055,False,Quid pro quo with the American people during a pandemic? https://t.co/tPvSdPiNMx
2020-03-24 23:56:55+00:00,"RT @monicamody: #Coronavirus: #India #lockdowns put 450 million informal workers in dire straits https://t.co/1umgxwBGph 

#covid19 #equity",Ad_shah90,India,#Advocate #Socialist #Tweets are personal,267,275,7041,False,"#Coronavirus: #India #lockdowns put 450 million informal workers in dire straits https://t.co/1umgxwBGph 

#covid19 #equity"
