created_at,full_text,screen_name,location,description,followers_count,friends_count,statuses_count,verified,full_retweet_text
2020-05-26 05:00:00+00:00,"RT @poojakamboz: Helping someone in need is the easiest way to get the blessings from God.
Dera Sacha Sauda disciples who are always ready…",this_isharman,"Bathinda, India",🙏ਧੂੜ ਹਾਂ ਤੇਰੇ ਚਰਨਾ ਦੀ🙏,159,21,29368,False,"Helping someone in need is the easiest way to get the blessings from God.
Dera Sacha Sauda disciples who are always ready  #ServingHumanitySelflessly
&amp; collecting countless blessings in lockdown by donating blood for each &amp; everyone who are in trouble. https://t.co/k1bHeh4ztI"
2020-05-26 05:00:00+00:00,"RT @realDonaldTrump: Great reviews on our handling of Covid 19, sometimes referred to as the China Virus. Ventilators, Testing, Medical Sup…",being_sanatni,"Delhi, India","🇮🇳वंदे मातरम🇮🇳🇮 मोदी समर्थक, राष्ट्र समर्थक 🙏🙏",2844,3180,17357,False,"Great reviews on our handling of Covid 19, sometimes referred to as the China Virus. Ventilators, Testing, Medical Supply Distribution, we made a lot of Governors look very good - And got no credit for so doing. Most importantly, we helped a lot of great people!"
2020-05-26 05:00:03+00:00,RT @stpiindia: #STPIPulse: Startups can learn how the lethal combination of creativity &amp; innovation would lead to visible success during cr…,GuruprasadK_,"Bengaluru, India",Retweets are not endorsements,202,280,47642,False,#STPIPulse: Startups can learn how the lethal combination of creativity &amp; innovation would lead to visible success during crisis like #COVID19 pandemic from Shri Rajiv Chilaka &amp; Shri Sridhar Muppidi at the 6th session. Register now: https://t.co/MAop6xsZe1 #STPIINDIA #STPIIdeaHub https://t.co/L7J2mCrmgl
2020-05-26 05:00:03+00:00,"RT @timesofindia: #JustIn 

7 RPF personnel posted at Ludhiana railway station have tested positive for #COVID19 and around 100 personnel q…",mohta_jayesh,"Bhatapara, India","News junkie, reading news, watching and playing cricket.",83,412,2694,False,"#JustIn 

7 RPF personnel posted at Ludhiana railway station have tested positive for #COVID19 and around 100 personnel quarantined: Director General (DG), Railway Protection Force (ANI)"
2020-05-26 05:00:03+00:00,RT @NavenduSingh_: Gujarat has the second highest cases of coronavirus &amp; has completely exposed its failed healthcare system and still oppo…,daaktardush,"New Delhi, India",Narcissist. . .loud . . .spontaneous ...crazy about  dogs. . .Ex-Actor and doctor by profession !!!,309,186,212921,False,"Gujarat has the second highest cases of coronavirus &amp; has completely exposed its failed healthcare system and still opposition hasn't managed to convey this to its very own audience  forget about the rest. Meanwhile, Delhi &amp; Mumbai (MH) CM's are being abused day &amp; night."
2020-05-26 05:00:04+00:00,"RT @desertfox61I: 2nd Wave ❓

Mysterious new coronavirus outbreak hits China 

- 108 MILLION now back into lockdown

https://t.co/Jqx1xVZSt6",HaryanaAbhishek,"Haryana, India","Jai Hind
🇮🇳",88,1440,4786,False,"2nd Wave ❓

Mysterious new coronavirus outbreak hits China 

- 108 MILLION now back into lockdown

https://t.co/Jqx1xVZSt6"
2020-05-26 05:00:04+00:00,"SingularityU Gurgaon Chapter brings together a panel of industry diverse leaders on May 30, 5-6 pm.
These are the select visionaries who pivoted their business in the times of Corona.
Join us along to seek insights on their vision and #businessresilience: https://t.co/BEtlGLIljz https://t.co/4x1P1z5nLr",thoughtworksIN,India,"Get the latest updates on events, trends, news and more from @ThoughtWorksIN.",752,42,869,False,No Value Mentioned
2020-05-26 05:00:05+00:00,"RT @_sayema: A 46yrs old labourer died in a train coz he had nothing to eat or drink for 60hrs!!!!
Matlab har tarah se maar do! Kya yaar! K…",umarShaik15,India,.....!,80,152,12378,False,"A 46yrs old labourer died in a train coz he had nothing to eat or drink for 60hrs!!!!
Matlab har tarah se maar do! Kya yaar! Kaise possible hai kisi ko maar ke jeena! https://t.co/T7hbkF66AN"
2020-05-26 05:00:05+00:00,Super https://t.co/QUgpffi70i,kathannanK1,Tambaram Channai India,Social Service and Rural development,34,240,49,False,No Value Mentioned
2020-05-26 05:00:06+00:00,"RT @Dr_Me_Shi: Like senior healthcare workers, are younger healthcare workers with comorbidities, like heart or kidney disease or uncontrol…",DoctorLFC,India,Healthcare | Humor | Words | Numbers | Storytelling via Doctor-Patient conversations | @Diabetes_Index | #COVID19India updates,8454,507,16761,False,"Like senior healthcare workers, are younger healthcare workers with comorbidities, like heart or kidney disease or uncontrolled diabetes or blood pressure, exempted from covid duties as well? 

@mybmc"
2020-05-26 05:00:06+00:00,"RT @Runjhunsharmas: AIIMS sanitation chief Heera Lal dies of #COVID19 
Even though he was not provided protective gear by the government, h…",tweet2kishore,India,Proud Hindu Nationalist.  Hate Congress & AAP party. Hate terrorist apologists. Hate Presstitutes. Love Modi. Idealize Subramanian Swami & Rajeev Malhotra.,340,352,53560,False,"AIIMS sanitation chief Heera Lal dies of #COVID19 
Even though he was not provided protective gear by the government, he never missed a single day of duty.
Rest in peace, Hero. https://t.co/pcgb9h0vCV"
2020-05-26 05:00:06+00:00,"@TheOfficialSBI 
i am not able to use the covid refund amount from that is under the lien.
why have u refunded the emi if you want it to be frozen?
none of ur portals have Virtual Card creating options nor does your customer care is helping.
@RBI
please look in such refund issues",StarLordBB,"Maharashtra, India",| INDIAN | Dog Parent | Business Analyst | Foodie | Traveller | Politicial Analyst | Influencer | Agile Coach |,1,46,77,False,No Value Mentioned
2020-05-26 05:00:06+00:00,RT @stpiindia: #STPIPulse: Startups can gain insights from the thought-stirring deliberations by industry stalwarts like Shri Rajiv Chilaka…,GuruprasadK_,"Bengaluru, India",Retweets are not endorsements,202,280,47642,False,"#STPIPulse: Startups can gain insights from the thought-stirring deliberations by industry stalwarts like Shri Rajiv Chilaka &amp; Shri Sridhar Muppidi, and learn how to become resilient during severe crisis triggered by #COVID19 at the 6th session. Register: https://t.co/MAop6xsZe1 https://t.co/MTqO0Cgy65"
2020-05-26 05:00:07+00:00,"RT @Kanagalogy: Dear @myogiadityanath instead of thinking about creating jobs in ur state ur engaged in some BS.

Dear @BSYBJP its an wonde…",kskiyer,"Bengaluru, India",No Value Mentioned,1149,800,89777,False,"Dear @myogiadityanath instead of thinking about creating jobs in ur state ur engaged in some BS.

Dear @BSYBJP its an wonderful opportunity for us to bring in a rule that anyone coming to work in Karnataka should learn Kannada before they enter the state. https://t.co/cOfvsa1Jl8"
2020-05-26 05:00:08+00:00,"75% of survey respondents believed their firms were better than moderately prepared to handle a crisis, but only 16% felt their response plan actually worked well. Read @DeloitteInsight's new article to learn more in the wake of #COVID19. https://t.co/a263ToXw5M",garvit200,"Hyderabad, India",Knowledge Management Professional | Sports Enthusiast | Member of Toastmasters International,268,378,11797,False,No Value Mentioned
2020-05-26 05:00:08+00:00,RT @kavitharao: AIIMS sanitation chief did not have PPE. Died.,ruchi_marshal,India,I've a curious tongue. You are what you eat & do. Writer/Editor for hire. Food Culture & Environmental nerd. BLM ✊🏽 Intersectional Feminist. Leftist. She/her.,482,1236,14682,False,AIIMS sanitation chief did not have PPE. Died. https://t.co/R3qqoLEZV2
2020-05-26 05:00:10+00:00,RT @TajinderBagga: Deal Done. Decide the Date and Venue after Lockdown I will come. Dekhde aa Ek Sikh ch jyada dm hai ya Rajiv Gandhi de Ch…,UltraCommunal,India,Keep calm and trust Shri Ram 🚩,312,344,12837,False,Deal Done. Decide the Date and Venue after Lockdown I will come. Dekhde aa Ek Sikh ch jyada dm hai ya Rajiv Gandhi de Chamchya Vich https://t.co/K7cHQXW72M
2020-05-26 05:00:10+00:00,"RT @NANDANPRATIM: Assam registers highest #Covid_19 spike. Mahendra Mohan Choudhury Hospital Guwahati, where Covid-19 cases are being treat…",TreeAtrayee,"Assam, India",Embracing myself 💙,63,709,120,False,"Assam registers highest #Covid_19 spike. Mahendra Mohan Choudhury Hospital Guwahati, where Covid-19 cases are being treated, has already run out of beds. Here is a glimpse of covid patients of MMCH
#AssamCovidCount https://t.co/WwKBZOEYlc"
2020-05-26 05:00:10+00:00,"COVID-19: 'Why No Word About Flights To Mumbai?,' Asks Vile Parle Local

Via. Hemal Ashar 

https://t.co/y95CVwocwj",mid_day,"Mumbai, India","Get all the Latest City & National News, Best Entertainment and Sports Stories on https://t.co/MNVrLYAQvZ #MaximumCityMaximumEntertainment",667148,128,130025,True,No Value Mentioned
2020-05-26 05:00:13+00:00,"RT @rdivia: Surprisingly a bulk of Ayurveda drugs are also registered for trials for Covid-19. The Kashayam/kadi, chyawanprash are to name…",Bhavya_ET,"Mumbai, India","Journalist covering the metals and mining sector @economictimes I
ACJ alum",226,551,659,False,"Surprisingly a bulk of Ayurveda drugs are also registered for trials for Covid-19. The Kashayam/kadi, chyawanprash are to name a few."
2020-05-26 05:00:14+00:00,"Fever? Cough? Sore throat? Headache? Fatigue? All of these are signs of #coronavirus. Speak to a doctor right away to determine whether you should get yourself tested or not for symptoms. To speak to a doctor from your home, click here: https://t.co/ge6ZuYBpWz",CareClues,India,Little Doses Of Great Health! Get daily #health & #fitness #tips from CareClues. Follow us @ https://t.co/RKrqWCIvuN. Download app: https://t.co/eAbhtZYf72,244,108,1295,False,No Value Mentioned
2020-05-26 05:00:14+00:00,Nd why no proper planning implementation like no strict lockdown nd no curfew in Mumbai. We have followed all rules and why you all are taking us taken for granted.Plz do strict action and implementation here for those who has followed rules till date and they are at home.@mybmc,NikhilDkadam,"Mumbai, India",No Value Mentioned,4,17,220,False,No Value Mentioned
2020-05-26 05:00:15+00:00,@NikhilThorat @JayitaP @SmithAndrewR @SahyadriFarms @maithilijhav @Archana_Mirajka @jasvinder1979 @Bernard_Francis @AnnieFDube @Jonkupi @arbulu_rojas @RuzanZDesai @sabhatt_ @therkt @VanessFerns During my #covid19 self-isolation lockdown I have eaten way too much of my own cooking . Really missing my cook and my favourite restaurants🍱🍔🍟🍕🌮🥘🍥,SimonilBamji,"Mumbai, India","Mom, Proud EDC’er ,BFF, Foodie, Movie Buff, Travel Enthusiast. Views expressed are my own . Retweet is not necessarily an endorsement",185,272,270,False,No Value Mentioned
2020-05-26 05:00:15+00:00,RT @BSYBJP: Bengaluru has set an example &amp; is the model for entire country on how to effectively manage the pandemic &amp; gradually restart th…,ganesh_jayavelu,"Bengaluru South, India",Aquasip - key to health,8,122,35,False,"Bengaluru has set an example &amp; is the model for entire country on how to effectively manage the pandemic &amp; gradually restart the economy. Well done #NammaBengaluru! Salute to all Corona warriors for their tireless efforts in this battle against COVID19.
@PMOIndia @narendramodi https://t.co/0HtTmBb3Qa"
2020-05-26 05:00:16+00:00,RT @INCIndia: BJP Govt needs to do much more to provide immediate relief to people bearing the economic brunt of this pandemic. https://t.c…,AsitRai72553953,"Ghazipur, U.P, India",congressmen,84,142,9904,False,BJP Govt needs to do much more to provide immediate relief to people bearing the economic brunt of this pandemic. https://t.co/zvjYAJHeIJ
2020-05-26 05:00:16+00:00,"ETHealthworld | AI can help doctors, governments fight Covid-19 pandemic https://t.co/wsdygnkrdl",ETHealthWorld,"Noida, India",One stop platform that tracks all breaking news & analysis of the pulsating healthcare industry.,5479,886,41872,True,No Value Mentioned
2020-05-26 05:00:16+00:00,"RT @TweetinderKaul: More terrible news. We really can't measure how much we owe to our #CoronaWarriors
https://t.co/SLgLMM8YpP",gmkrishna,hyderabad India,"Promoting Nutrigenomics Technology - for protecting all bio spheres-agriculture,livestock n human-for healthy food-RT's are not necessarily my endorsements",2939,4990,180016,False,"More terrible news. We really can't measure how much we owe to our #CoronaWarriors
https://t.co/SLgLMM8YpP"
2020-05-26 05:00:17+00:00,"RT @SonuSood: Thank u so much my brother.❣️India knows when @SDhawan25 is at cease “WE ARE HOME”. I promise, I will stay at this crease til…",entrpankajyadav,"Lucknow Utterpradesh, India","#Social_worker..👳
#engineer👷
#future_Entrepreneur🤵
#true_Nationalist🇮🇳",76,0,1003,False,"Thank u so much my brother.❣️India knows when @SDhawan25 is at cease “WE ARE HOME”. I promise, I will stay at this crease till the end and make sure that every migrant well say “ WE ARE HOME “ ❤️ https://t.co/WhRNkjg7cb"
2020-05-26 05:00:17+00:00,"For all the latest developments related to COVID-19 outbreak, watch our special broadcast 'Tracking COVID-19' on @DDIndialive at 10:30 am

LINK: https://t.co/nIaBFokyfs",DDIndialive,"New Delhi, India","Official account of DD India, English News TV Channel of Doordarshan(Prasar Bharati-India’s Public Broadcaster)Follow us on https://t.co/C55s7Mms3d",27205,529,34733,True,No Value Mentioned
2020-05-26 05:00:17+00:00,"RT @RailMinIndia: Please do not spit openly.

It may lead to spreading of Covid-19 disease. 

Be a responsible citizen.

#IndiaFightsCorona…",Ashishg1101,"Modinagar, India",Member of ICAI|| Analyst || Motivator || Partner and founder of A G A R and Associates || Team Leader || Devotional|| Bhartiya ||,30,124,448,False,"Please do not spit openly.

It may lead to spreading of Covid-19 disease. 

Be a responsible citizen.

#IndiaFightsCorona https://t.co/9jqGCwagd1"
2020-05-26 05:00:18+00:00,"“I’m proud to connect brilliant minds from India and Israel so they can jointly develop life changing solutions for the whole world, and especially in fighting the Covid-19 pandemic,’’ @DrRonMalka tweeted. #IndiaFightsCOVID19
https://t.co/3nbUNbzDUW",ketan72,India,Political & Social Analyst. #IndiaFirst Privilege - PM @narendramodi ji follows me. All views are Strictly Personal. RTs are not endorsements #VandeMataram,8263,172,265886,False,No Value Mentioned
2020-05-26 05:00:19+00:00,"RT @t_d_h_nair: 130 huts belonging to 600 migrant workers from Kalaburgi burned to ashes in Bangalore in the cover of lockdown.
The culprit…",ZHKindia,"Mumbai, India","Think out of d box!Twts persnl in National Interest; Believe in ""Fundamental-rights 4every Lives!! Anyay ke khilaaf aawaz uthana Janm Sidh Adhikar. Jai Hind!! """,77,411,6533,False,"130 huts belonging to 600 migrant workers from Kalaburgi burned to ashes in Bangalore in the cover of lockdown.
The culprits allegedly told the eyewitnesses that they have been asked to do so https://t.co/wNqa6v9tbE"
2020-05-26 05:00:19+00:00,"RT @Nidhi: If there is one institution that has seen a complete breakdown in recent years, it is the judiciary. Imagine not even hearing ba…",Raj5576,India,My Tweets are just general observations & personal views . Retweets & Likes are not endorsements at all & are not my views..Jai Hind,439,635,18482,False,"If there is one institution that has seen a complete breakdown in recent years, it is the judiciary. Imagine not even hearing bail pleas. Next time “Your Honours” give high flying lectures on democracy, remember how they failed citizens today https://t.co/Nmac3bk9nw"
2020-05-26 05:00:21+00:00,"Guess who's the happiest person right now?
The one who hires air hostess for @airindiain 😂😂😂
#AirIndia #aviation #airhostess #CoronavirusIndia #PPEs #mask #FlyAI #COVIDー19",say_yesssssss,"Goa, India",bio ghov.,77,105,116,False,No Value Mentioned
2020-05-26 05:00:22+00:00,RT @anandmahindra: I have never seen a better occasion to apply the adjective ‘Ironic!’,ISRabriyawas,"Jodhpur, India",No Value Mentioned,5,111,64,False,I have never seen a better occasion to apply the adjective ‘Ironic!’ https://t.co/EwOWairLbs
2020-05-26 05:00:22+00:00,"RT @RanaAyyub: Flights are cancelled, trains are diverted.  The incompetence of this regime has been brutally exposed through the pandemic.",mctavish2191,India,"First Cry on 2nd of Jan 😀. Yes I am weird, weird is good. Normal is overrated.",102,1264,22688,False,"Flights are cancelled, trains are diverted.  The incompetence of this regime has been brutally exposed through the pandemic. https://t.co/YKNCsXprHB"
2020-05-26 05:00:22+00:00,RT @sonaliranade: Modi-Shah took the world’s fastest growing economy and turned it into a basket case even before the Covid-19 virus struck…,buoyant_smirk,"Mumbai, India",No Value Mentioned,24,159,173,False,"Modi-Shah took the world’s fastest growing economy and turned it into a basket case even before the Covid-19 virus struck.  They meticulously shed every talented economic manager &amp; policy maker from the top.

After 6 years of ruin, the virus had shattered the economy. https://t.co/49lIs5Jfbw"
2020-05-26 05:00:22+00:00,RT @enigma_timorous: Shooting abroad may be impossible for the next 6 months atleast looking at the Covid19 situation so I guess #Valimai e…,manudavid826,"Kerala, India","............🔥 Thala Veriyan 🔥............. Addicted to  💗💗 THALA AJITH 💗💗 He is My Role Model, Happiness & Inspiration | Movie Fanatic | Dada & Ikka Army",105,113,12049,False,Shooting abroad may be impossible for the next 6 months atleast looking at the Covid19 situation so I guess #Valimai entire shoot may be completed in india(Shoot may get over faster than anticipated).
2020-05-26 05:00:23+00:00,"RT @_YogendraYadav: Three steps to make MNREGS help during pandemic:
* Open work in every village
* Provide work to everyone who shows up
*…",Bi98402954,"Chhattisgarh, India",Proud  Ambedkarite..Jai Bheem.. Jai Savidhan.. here exists Rationality,35,119,628,False,"Three steps to make MNREGS help during pandemic:
* Open work in every village
* Provide work to everyone who shows up
* Go back to cash payment
Read this in-depth analysis by Ritika Khera.
https://t.co/ss54G2cvEv"
2020-05-26 05:00:23+00:00,RT @SubhashCM26: The outbreak of locusts in various districts of Rajasthan has now become  a matter of severe concern . Farmers and other r…,BNagrana,"Jaipur, India",https://t.co/LykfRu58CA ag.,261,111,4044,False,"The outbreak of locusts in various districts of Rajasthan has now become  a matter of severe concern . Farmers and other residents are facing the menace of #locusts.

State Govt should immediately initiate all the necessary steps. 

 #Agriculture_Supervisor_Justice https://t.co/CAKDssTEJG"
2020-05-26 05:00:23+00:00,"#ICYMI

Here's a farmer from Shikohabad explaining the on-going agrarian crisis in UP. With no wholesale markets, the farmers are finding it difficult to sell their yields. #CoronaCyclips

BLOG: https://t.co/xOecB9j2XH https://t.co/GWfodQYnNg",AsiavilleNews,India,"A next-generation multi-lingual, multimedia and multi-platform digital news venture. 👉🏼 Instagram: @asiavillenews 👉🏼 Youtube: https://t.co/d27ARXNU8g",2677,48,8550,True,No Value Mentioned
2020-05-26 05:00:24+00:00,RT @ExSecular: What is Rana saba and arfa doing there ?,sagar_mndl,"New Delhi, India",joy east bengal 🔥🔥,332,1196,109510,False,What is Rana saba and arfa doing there ? https://t.co/iUvTsibiCd
2020-05-26 05:00:24+00:00,#SSSSOIndia #SriSathyaSaiCentralTrust With the Divine Blessings of #BhagawanBaba 205sevadal and 180students of WestBengal from #SSPN #Brindavan  #Muddanahalli and #NurisngCollege reached their homes safely.We express our sincere thanks to @CMOfficeWB @WBPolice #Covid19,ssssoindia,India,Official Twitter Handle of the Sri Sathya Sai Seva Organisations India | Our Motto: Transforming self to transform the world,4765,14,7660,False,No Value Mentioned
2020-05-26 05:00:25+00:00,"RT @otvnews: #Odisha conducts 3819 #COVID19 RT-PCR tests in last 24 hours 

Cumulative tests till date: 131595
Total positive cases: 1517
A…",TejNarang,"Mumbai, India",Interested in Politics & Economics,481,2502,39053,False,"#Odisha conducts 3819 #COVID19 RT-PCR tests in last 24 hours 

Cumulative tests till date: 131595
Total positive cases: 1517
Active cases: 861 
Recovered: 649
Deaths: 7  

#COVID19Pandemic #coronavirus https://t.co/9gNT5EqvbE"
2020-05-26 05:00:25+00:00,"RT @BoycottHegemony: CCPChina will claim everything except the Wuhan Virus.
https://t.co/j1cYdPBVH1",spectrum_seven,"Delhi, India",Law grad CLC DU | Startup-Entrepreneur  Education | RT are not endorsements,240,1712,22344,False,"CCPChina will claim everything except the Wuhan Virus.
https://t.co/j1cYdPBVH1"
2020-05-26 05:00:26+00:00,"Stuck in the cycle of fake news, Indians are abondoning their pets with fears of contracting the Covid-19
https://t.co/hLQassjwFL",qzindia,India,Quartz: Global news and insights for a new generation of business leaders.,31662,41,44171,True,No Value Mentioned
2020-05-26 05:00:26+00:00,"RT @Nidhi: If there is one institution that has seen a complete breakdown in recent years, it is the judiciary. Imagine not even hearing ba…",umarShaik15,India,.....!,80,152,12378,False,"If there is one institution that has seen a complete breakdown in recent years, it is the judiciary. Imagine not even hearing bail pleas. Next time “Your Honours” give high flying lectures on democracy, remember how they failed citizens today https://t.co/Nmac3bk9nw"
2020-05-26 05:00:26+00:00,Covid-19: TN CM calls for important meet with health experts - https://t.co/ChDUa4HDJY #Chennaivision https://t.co/WJUFcxE89D,chennaivision,"Chennai, India","#Chennaivision News brings the Latest Chennai & India Political News, Gold Rate & Power Shutdown in Chennai and Details about Southern Railway Special Trains",10218,1008,189730,False,No Value Mentioned
2020-05-26 05:00:27+00:00,RT @NallappanarG: This is a very valid demand as the nurses are working day and night to save the life the corona patients!They need a bett…,NallappanarG,"Tamil Nadu, India","Honest citizen. IITian. Industrial Engineer. Problem solver. Social worker. Positive thinker.
AGAINST: political corruption, exploitation, social discrimination",1271,4897,32792,False,This is a very valid demand as the nurses are working day and night to save the life the corona patients!They need a better treatment and a better salary!Is not the health minister taking note of their services to give some extra payments either as salary or as a bonus! https://t.co/SjWmgSzYkW
2020-05-26 05:00:27+00:00,"RT @priyaakulkarni2: Barkha Dutt is praising RSS Volunteers' efforts in this pandemic. 

We need many helping hands to serve India's popula…",manindraharsha,"Bengaluru, India",Irrational Exuberance,44,264,973,False,"Barkha Dutt is praising RSS Volunteers' efforts in this pandemic. 

We need many helping hands to serve India's population

@TarekFatah https://t.co/sxUgZCSjeG"
2020-05-26 05:00:28+00:00,RT @DrRPNishank: I am proud to share with everyone that a talented team of researchers at IIT Goa has initiated a process to find a potenti…,kalyani_jgd,"Bengaluru, India","Meditator,  Art of Living Teacher and Volunteer,  Committed to spread smiles n inspire people through my Guru Sri Sri Ravi Shankar's knowledge..😊",62,145,1745,False,"I am proud to share with everyone that a talented team of researchers at IIT Goa has initiated a process to find a potential drug against #COVID19!
All the best team, we are counting on you!👍
https://t.co/4iNFDu0Cww https://t.co/poFDNmFKnM"
2020-05-26 05:00:28+00:00,@shxbhxm Did both. Still this lockdown isn’t getting over fml,sagarism1,"Pune, India",don’t need alcohol to post tweets i regret,75,603,425,False,No Value Mentioned
2020-05-26 05:00:28+00:00,"#SalmanKhan has been continuously helping needy peoples as well as working hard upon his fitness during this pandemic.

Beside this, to entertain his eternal fan following he's making/releasing songs &amp; giving a fruitful message by them.

Proud to be his Fan.

#BhaiBhaiHits1MLikes https://t.co/Wp5oXYcv3s",HiranmoyHR,"West Bengal, India","DentisT In ProcesS ⚕💉
SALMANIAC Forever 😎",509,104,43607,False,No Value Mentioned
2020-05-26 05:00:30+00:00,"RT @TheVikasKhanna: Can someone help me find this HERO. 
#MiragicKid. 
I’m planning a big surprise for him. ❤️
Info@",jigneshvyas5572,"Ahmedabad, Gujarat, India","Loves Cricket, Die Heart fan of shri Narendra Modi ji",428,2031,11034,False,"Can someone help me find this HERO. 
#MiragicKid. 
I’m planning a big surprise for him. ❤️
Info@ https://t.co/l2U9s4yywX"
2020-05-26 05:00:31+00:00,"Former SC judge Gopala Gowda in @DeccanHerald says the #ADMJabalpur verdict is no longer the SC's darkest moment. Its apathy towards the migrant workers' plight during the pandemic shows how ""poor migrant workers have become invisible in plain sight"" 

https://t.co/6Gu87Vizuy",riotsjain,"New Delhi, India","journalist-photographer-journalist. Writer, part-time dreamer and full-time procrastinator. retweets are not endorsements.",1855,400,2266,False,No Value Mentioned
