created_at,full_text,screen_name,location,description,followers_count,friends_count,statuses_count,verified,full_retweet_text
2020-01-27 14:59:15+00:00,"RT @AndreasSteno: Wuhan vs. previous outbreaks (market patterns) 😱

Equities are likely to sell off temporarily, while long bonds could per…",n_ramnath,"Bengaluru, India",God; Country; Family | Trinity rules | Low tolerance - Hypocrisy & Opportunism |,66,197,4044,False,"Wuhan vs. previous outbreaks (market patterns) 😱

Equities are likely to sell off temporarily, while long bonds could perform. Risk off moves in FX space to be limited, while Gold performed in commodity space.

Cross asset chart-pack  -&gt; https://t.co/24sy9kaMAp https://t.co/48vXWmPrvJ"
2020-01-27 14:58:39+00:00,RT @Jkylebass: A husband and wife Chinese spy team were recently removed from a Level 4 Infectious Disease facility in Canada for sending p…,VasudevRahul,"New Delhi, India","Advocate, Legal consultant",474,180,24994,False,A husband and wife Chinese spy team were recently removed from a Level 4 Infectious Disease facility in Canada for sending pathogens to the Wuhan facility. The husband specialized in coronavirus research. #coronaviruschina #CoronaOutbreak  https://t.co/f2MpCZgkHX
2020-01-27 14:58:08+00:00,"India busy in pitty politics, China built 269000 sq ft, 1000 bed hospital in just 6 days for quarantine patient due to coronavirus in wuhan. We need job, infrastructure, economy firing all cylinders but to achieve all dis democracy not right form of govt in most populous country",frieeend2010,India,"Professional, driving enthusiasts, community serving, chess favourite sport, interest in exploring ancient monuments. RT/Likes not necessarily endorsement.",106,58,19842,False,No Value Mentioned
2020-01-27 14:58:18+00:00,"RT @frieeend2010: India busy in pitty politics, China built 269000 sq ft, 1000 bed hospital in just 6 days for quarantine patient due to co…",frieeend2010,India,"Professional, driving enthusiasts, community serving, chess favourite sport, interest in exploring ancient monuments. RT/Likes not necessarily endorsement.",106,58,19842,False,"India busy in pitty politics, China built 269000 sq ft, 1000 bed hospital in just 6 days for quarantine patient due to coronavirus in wuhan. We need job, infrastructure, economy firing all cylinders but to achieve all dis democracy not right form of govt in most populous country"
2020-01-27 14:58:18+00:00,"RT @spectatorindex: BREAKING: 5 million people left Wuhan, the epicentre of the coronavirus outbreak, before the lockdown went into effect.",LK_SATAP,INDIA,mechanical engineer by profession,350,1876,64773,False,"BREAKING: 5 million people left Wuhan, the epicentre of the coronavirus outbreak, before the lockdown went into effect."
2020-01-27 14:57:38+00:00,"RT @NavroopSingh_: Lethal Viruses have been stolen by China from Canada, for Bio Weapon researcher in 2019 in Wuhan Lab. There are reports…",sehramanraman,india,No Value Mentioned,244,99,2357,False,"Lethal Viruses have been stolen by China from Canada, for Bio Weapon researcher in 2019 in Wuhan Lab. There are reports abt it. Those tests have gone, viruses mutated and gone out of control. This is the crux of #Coronavirus !! Rest all is CCP propaganda to cover it up."
2020-01-27 14:57:44+00:00,RT @YaxueCao: In late Dec a Wuhan doctor said in a WeChat group that there were 7 cases of SARS connected to the seafood market. He was the…,sgekar,India,"Scientist, Analyst, Catalyst --- On and Off twitter till he gets better at life... ""Bestest Appa in the world!""",402,522,70398,False,"In late Dec a Wuhan doctor said in a WeChat group that there were 7 cases of SARS connected to the seafood market. He was then scolded by the party disciplinary office, and made to sign a “I’m wrong” statement w police. He’s still in critical condition. https://t.co/0Usemu6Zh5"
2020-01-27 14:57:45+00:00,RT @airnewsalerts: #CoronaVirus🦠 :It was decided that steps may be taken to prepare for possible evacuation of Indian nationals in Wuhan. M…,hisandeepshere,"New Delhi, India",No Value Mentioned,246,541,45072,False,#CoronaVirus🦠 :It was decided that steps may be taken to prepare for possible evacuation of Indian nationals in Wuhan. MEA will make a request to China.Civil Aviation Ministry &amp; Health Ministry will make arrangements for transport and quarantine facilities respectively.
2020-01-27 14:57:47+00:00,RT @Jkylebass: A husband and wife Chinese spy team were recently removed from a Level 4 Infectious Disease facility in Canada for sending p…,indiatothepoint,"Delhi, India","TO THE POINT, NO B$LL SH$T.",409,784,67213,False,A husband and wife Chinese spy team were recently removed from a Level 4 Infectious Disease facility in Canada for sending pathogens to the Wuhan facility. The husband specialized in coronavirus research. #coronaviruschina #CoronaOutbreak  https://t.co/f2MpCZgkHX
2020-01-27 14:57:34+00:00,"RT @NavroopSingh_: Lethal Viruses have been stolen by China from Canada, for Bio Weapon researcher in 2019 in Wuhan Lab. There are reports…",vinayakiya,India,No Value Mentioned,245,443,29998,False,"Lethal Viruses have been stolen by China from Canada, for Bio Weapon researcher in 2019 in Wuhan Lab. There are reports abt it. Those tests have gone, viruses mutated and gone out of control. This is the crux of #Coronavirus !! Rest all is CCP propaganda to cover it up."
2020-01-27 14:57:02+00:00,"RT @PDChina: #Update: After 16 hours of construction, the 1st building of Huoshenshan Hospital in #Wuhan has completed on Monday. The hospi…",MohanKu37166575,"Kolkata, India","DOCTOR BY PROFESSION 
KEJARIWAL FOLLOWER BY  PASSION 
MAKING INDIA CORRUPTION FREE IS MY AIM. 😎😎😎",816,1066,154251,False,"#Update: After 16 hours of construction, the 1st building of Huoshenshan Hospital in #Wuhan has completed on Monday. The hospital is expected to be handed over to the military on Feb 2 upon completion and put into use for #coronavirus patients. https://t.co/ino3U8vW0H"
2020-01-27 14:57:05+00:00,"RT @PDChina: Timelapse video showing the 4th day of constructing Huoshenshan Hospital, a new facility providing 700 to 1,000 beds for #coro…",MohanKu37166575,"Kolkata, India","DOCTOR BY PROFESSION 
KEJARIWAL FOLLOWER BY  PASSION 
MAKING INDIA CORRUPTION FREE IS MY AIM. 😎😎😎",816,1066,154251,False,"Timelapse video showing the 4th day of constructing Huoshenshan Hospital, a new facility providing 700 to 1,000 beds for #coronavirus patients in #Wuhan. The hospital is expected to complete on Feb 2. https://t.co/tMdoVXtd1O"
2020-01-27 14:55:59+00:00,"Government decides to prepare for evacuation of Indians from coronavirus-hit Wuhan in China

https://t.co/GEyHM14PxQ https://t.co/LacdEcaDNz",htTweets,India,"One of India's largest media companies. Latest news from around the world. Retweets are not endorsements

Telegram: https://t.co/oRjuzAvYUY",7256602,126,688651,True,No Value Mentioned
2020-01-27 14:56:07+00:00,"RT @NavroopSingh_: Lethal Viruses have been stolen by China from Canada, for Bio Weapon researcher in 2019 in Wuhan Lab. There are reports…",JasbirRathi2,"Gurgaon, India",Krishan kripa,248,726,18456,False,"Lethal Viruses have been stolen by China from Canada, for Bio Weapon researcher in 2019 in Wuhan Lab. There are reports abt it. Those tests have gone, viruses mutated and gone out of control. This is the crux of #Coronavirus !! Rest all is CCP propaganda to cover it up."
2020-01-27 14:56:12+00:00,RT @businessinsider: Starbucks shares plunge after company shutters China locations near coronavirus outbreak https://t.co/AI7ETqJMqL,YogeshYoYo007,India,Meditation 🧘‍♂️ https://t.co/gGBIniXgzP #Shiva we are the world 🗺 🌍🪐 (letest update of the world).  #Norelegation,1100,1823,43872,False,Starbucks shares plunge after company shutters China locations near coronavirus outbreak https://t.co/AI7ETqJMqL
2020-01-27 14:56:20+00:00,"RT @NavroopSingh_: Lethal Viruses have been stolen by China from Canada, for Bio Weapon researcher in 2019 in Wuhan Lab. There are reports…",ksharm64,India,"Inquisitive, keen interest in our scriptures, want to unlearn, PhD. Views are personal.",82,373,11114,False,"Lethal Viruses have been stolen by China from Canada, for Bio Weapon researcher in 2019 in Wuhan Lab. There are reports abt it. Those tests have gone, viruses mutated and gone out of control. This is the crux of #Coronavirus !! Rest all is CCP propaganda to cover it up."
2020-01-27 14:55:43+00:00,"RT @Chellaney: ""In 2004, a SARS virus 'leaked' from a lab in Beijing. And when China set up a lab in Wuhan in 2017 to study some of the mos…",_ankitG,"Jaipur, India",Entrepreneur II Digital India II भारतवषॆ II,1047,3430,17883,False,"""In 2004, a SARS virus 'leaked' from a lab in Beijing. And when China set up a lab in Wuhan in 2017 to study some of the most dangerous pathogens, U.S. scientists warned of a similar leak from Wuhan."" https://t.co/Jap6MtIkKp via @IndoPac_Info"
2020-01-27 14:55:45+00:00,"In the face of adversity, the strength of humanity becomes visible. #coronavirus #wuhan https://t.co/6KmFeUaAle",ashishrajput151,India,"Thinking what humans do and why they do it.  
Founder https://t.co/qZDdIAttQa, IIT KGP",422,226,666,False,No Value Mentioned
2020-01-27 14:55:49+00:00,RT @XHNews: Chinese Premier Li Keqiang calls for speeding up construction of a makeshift hospital for treating patients infected with the n…,vinodm_85,India,A proud Indian!!!! You get what you see..My tweets are my views & RT's not endorsement!!!,1706,3256,269271,False,Chinese Premier Li Keqiang calls for speeding up construction of a makeshift hospital for treating patients infected with the novel coronavirus in his inspection to Wuhan https://t.co/YqnuxOYIhZ https://t.co/s3eRz3Ikmb
2020-01-27 14:55:51+00:00,RT @Jkylebass: A husband and wife Chinese spy team were recently removed from a Level 4 Infectious Disease facility in Canada for sending p…,Karmic_Slave,India,No Value Mentioned,295,698,16152,False,A husband and wife Chinese spy team were recently removed from a Level 4 Infectious Disease facility in Canada for sending pathogens to the Wuhan facility. The husband specialized in coronavirus research. #coronaviruschina #CoronaOutbreak  https://t.co/f2MpCZgkHX
2020-01-27 14:55:53+00:00,RT @NPRGoatsandSoda: How do viruses like the Wuhan coronavirus emerge? This helpful piece looks at the history of outbreaks -- and identifi…,rashwet,"Ranchi, India","Asst. Prof (CUJ) LL.M.(BHU)M.Phil/Ph.D (JNU), ,RT not endorsement न हार में न जीत में,किञ्चित नहीं भयभीत मैं.. कर्त्तव्य पथ पर जो भी मिले..यह भी सही..वह भी सही",202,525,7951,False,"How do viruses like the Wuhan coronavirus emerge? This helpful piece looks at the history of outbreaks -- and identifies three big reasons why they start: 

🌳🌳Deforestation
🌱🌱Farming 
🧳✈️Tourism  

https://t.co/lJxLMWciql"
2020-01-27 14:55:55+00:00,"RT @NavroopSingh_: Lethal Viruses have been stolen by China from Canada, for Bio Weapon researcher in 2019 in Wuhan Lab. There are reports…",iMeghh,"Lucknow, India",Current Focus- #COVIDINDIA #IndiaFightsCoronaVirus,66,208,3693,False,"Lethal Viruses have been stolen by China from Canada, for Bio Weapon researcher in 2019 in Wuhan Lab. There are reports abt it. Those tests have gone, viruses mutated and gone out of control. This is the crux of #Coronavirus !! Rest all is CCP propaganda to cover it up."
2020-01-27 14:55:28+00:00,"RT @NavroopSingh_: Lethal Viruses have been stolen by China from Canada, for Bio Weapon researcher in 2019 in Wuhan Lab. There are reports…",hbalajirao,"Bengaluru, India","Big fan of thala,writer sujatha,sourav ganguly,love iranian movies..AIADMK",3762,135,29839,False,"Lethal Viruses have been stolen by China from Canada, for Bio Weapon researcher in 2019 in Wuhan Lab. There are reports abt it. Those tests have gone, viruses mutated and gone out of control. This is the crux of #Coronavirus !! Rest all is CCP propaganda to cover it up."
2020-01-27 14:54:52+00:00,"RT @NavroopSingh_: Lethal Viruses have been stolen by China from Canada, for Bio Weapon researcher in 2019 in Wuhan Lab. There are reports…",shrasiro,India,The most important thing is to enjoy your life – to be happy – it’s all that matters. Audrey Hepburn,140,125,34385,False,"Lethal Viruses have been stolen by China from Canada, for Bio Weapon researcher in 2019 in Wuhan Lab. There are reports abt it. Those tests have gone, viruses mutated and gone out of control. This is the crux of #Coronavirus !! Rest all is CCP propaganda to cover it up."
2020-01-27 14:55:04+00:00,"RT @Chellaney: ""In 2004, a SARS virus 'leaked' from a lab in Beijing. And when China set up a lab in Wuhan in 2017 to study some of the mos…",Saffron108,India,Followed by Prime Minister Narendra Modi ji ~ NaMo fan. Chelsea F.C. fan,959,108,24591,False,"""In 2004, a SARS virus 'leaked' from a lab in Beijing. And when China set up a lab in Wuhan in 2017 to study some of the most dangerous pathogens, U.S. scientists warned of a similar leak from Wuhan."" https://t.co/Jap6MtIkKp via @IndoPac_Info"
2020-01-27 14:55:06+00:00,"RT @XHNews: Entrusted by Xi Jinping, Premier Li Keqiang arrived in Wuhan to inspect and direct the novel coronavirus control work. Read mor…",YogeshYoYo007,India,Meditation 🧘‍♂️ https://t.co/gGBIniXgzP #Shiva we are the world 🗺 🌍🪐 (letest update of the world).  #Norelegation,1100,1823,43872,False,"Entrusted by Xi Jinping, Premier Li Keqiang arrived in Wuhan to inspect and direct the novel coronavirus control work. Read more : https://t.co/1MEd10eGgD https://t.co/t3KWsg1quK"
2020-01-27 14:55:13+00:00,"RT @the_ice_man_24: @jessicadrun @tomgrundy @icao @UN The Secretary General of the @icao is Fang Liu, former Deputy Director of the General…",SaurabhJoshi,"New Delhi, India","Editor, @StratPost & @DelhiDurbar. Sciency. Lapsed lawyer. Fascinated by flight. Lucky. Not normally a nice guy. Tweets are mine. Retweets are somebody else's.",6295,2222,64277,True,"@jessicadrun @tomgrundy @icao @UN The Secretary General of the @icao is Fang Liu, former Deputy Director of the General Administration of Civil Aviation of China (CAAC). So, presumably a CCP lackey. 

Incidentally, originally from #Wuhan. https://t.co/Kawo9FmvPI"
2020-01-27 14:54:36+00:00,"RT @NavroopSingh_: Lethal Viruses have been stolen by China from Canada, for Bio Weapon researcher in 2019 in Wuhan Lab. There are reports…",DT_13491,"Gujarat, India","Engineer, MBA, Lefty ....best of all... A TENNIS PLAYER..!!!! *Spiritual Salty *",388,1268,18829,False,"Lethal Viruses have been stolen by China from Canada, for Bio Weapon researcher in 2019 in Wuhan Lab. There are reports abt it. Those tests have gone, viruses mutated and gone out of control. This is the crux of #Coronavirus !! Rest all is CCP propaganda to cover it up."
2020-01-27 14:54:41+00:00,"RT @EvanFeigenbaum: Wuhan virus: Singapore to impose 14 days leave of absence for those in schools, healthcare and eldercare who travelled…",Atharva15585874,"Coimbatore, India",அரசியல் மாற்றம் ஆட்சி மாற்றம் ...Thalaivar follower Cool dude 😎Politics ...Travel 🌍...Cricket 🏏Thala Dhoni...Fitness ...இதுவும் கடந்து போகும்,587,1380,33513,False,"Wuhan virus: Singapore to impose 14 days leave of absence for those in schools, healthcare and eldercare who travelled to China, Singapore News &amp; Top Stories - The Straits Times https://t.co/giYHI2OZHd"
2020-01-27 14:54:46+00:00,"RT @NavroopSingh_: Lethal Viruses have been stolen by China from Canada, for Bio Weapon researcher in 2019 in Wuhan Lab. There are reports…",INA99thBrigade,"West Bengal, India","Truth is bitter, knowledge is gold learn one to gain the other. Armchair analyst, conspiracy theory nut (specially ufo's), s/w, h/w tech addict & a history buff",917,740,24871,False,"Lethal Viruses have been stolen by China from Canada, for Bio Weapon researcher in 2019 in Wuhan Lab. There are reports abt it. Those tests have gone, viruses mutated and gone out of control. This is the crux of #Coronavirus !! Rest all is CCP propaganda to cover it up."
2020-01-27 14:54:22+00:00,"RT @NavroopSingh_: Lethal Viruses have been stolen by China from Canada, for Bio Weapon researcher in 2019 in Wuhan Lab. There are reports…",Singh_0502,INDIA,"Know Nothing, Procrastinator, Belives in life",323,601,20774,False,"Lethal Viruses have been stolen by China from Canada, for Bio Weapon researcher in 2019 in Wuhan Lab. There are reports abt it. Those tests have gone, viruses mutated and gone out of control. This is the crux of #Coronavirus !! Rest all is CCP propaganda to cover it up."
2020-01-27 14:54:27+00:00,"RT @indiatvnews: Coronavirus outbreak update: MEA to request China for evacuation of Indians from Wuhan

#coronavirus #CoronavirusOutbreak…",VishnuS47793080,"Udaipur, India","#हिंदू राष्ट्रवादी# राष्ट्रवाद चाणक्य का ओर हिन्दू स्वामी  विवेकानंद का ,कट्टर राष्ट्रवादी है ओर मजबूती से लड़ेंगे।
#Electrical Engineer#
vishnujsuthar@gmail.com",1489,883,221331,False,"Coronavirus outbreak update: MEA to request China for evacuation of Indians from Wuhan

#coronavirus #CoronavirusOutbreak 

https://t.co/GZLKuUUbAs"
2020-01-27 14:53:41+00:00,"Govt decides to prepare for evacuation of Indians from coronavirus-hit Wuhan in China
https://t.co/zuvJAP6FlW",HindustanTimes,"New Delhi, India",One of India's largest media companies. Latest news from around the world. Retweets are not endorsements.,11440,65,116154,True,No Value Mentioned
2020-01-27 14:53:52+00:00,"RT @nytimes: In Opinion

Howard Markel writes, ""With the Wuhan coronavirus, as with other epidemics past, quarantine measures may be too mu…",YogeshYoYo007,India,Meditation 🧘‍♂️ https://t.co/gGBIniXgzP #Shiva we are the world 🗺 🌍🪐 (letest update of the world).  #Norelegation,1100,1823,43872,False,"In Opinion

Howard Markel writes, ""With the Wuhan coronavirus, as with other epidemics past, quarantine measures may be too much too late""
https://t.co/lcL3atOYEa"
2020-01-27 14:53:59+00:00,RT @Jkylebass: A husband and wife Chinese spy team were recently removed from a Level 4 Infectious Disease facility in Canada for sending p…,Nidhipa,"Raipur, India","Accept the way I am or else go to Hell... Loves to Cook and Bake....Interested in Movies, cricket and Politics...Ex Techie... Currently Running Own School.",750,121,23172,False,A husband and wife Chinese spy team were recently removed from a Level 4 Infectious Disease facility in Canada for sending pathogens to the Wuhan facility. The husband specialized in coronavirus research. #coronaviruschina #CoronaOutbreak  https://t.co/f2MpCZgkHX
2020-01-27 14:54:02+00:00,RT @timesofindia: Meeting on coronavirus decides that steps may be taken to prepare for possible evacuation of Indians from Wuhan: Official…,YogeshYoYo007,India,Meditation 🧘‍♂️ https://t.co/gGBIniXgzP #Shiva we are the world 🗺 🌍🪐 (letest update of the world).  #Norelegation,1100,1823,43872,False,Meeting on coronavirus decides that steps may be taken to prepare for possible evacuation of Indians from Wuhan: Officials (PTI)
2020-01-27 14:54:03+00:00,"Feel outraged, u have a right to. But the fact remains many species on d verge f extinction, quite a few due #Chinese appetite. Ppl undetake unlawful activities to smuggle such species out fm many cntrys.
#China #coronavirus #WuhanCoronovirus #Wuhan https://t.co/Q0eQ4FOkn3",CaptAKJ,"Surat/Pipavav/Bihar, India","Sailor, moved ashore in '05. Failed entrepreneur. Life journey fm a remote village to Lancaster MBA 07-08. Int in Def/Pol/Cur Aff. RT nt endorsement, views pers",553,666,10926,False,No Value Mentioned
2020-01-27 14:53:35+00:00,RT @kpopstarz: A Chinese Fanclub for BTS Jungkook Sent Donations And Supplies In Advance For Wuhan Epidemic Outbreak https://t.co/dJDP7rYCm…,decaljeonk,India,Just here to support Jungkook| Jungkook Go Solo,520,712,14801,False,A Chinese Fanclub for BTS Jungkook Sent Donations And Supplies In Advance For Wuhan Epidemic Outbreak https://t.co/dJDP7rYCmj https://t.co/vL3GFXkODw
2020-01-27 14:53:01+00:00,"RT @NavroopSingh_: Lethal Viruses have been stolen by China from Canada, for Bio Weapon researcher in 2019 in Wuhan Lab. There are reports…",Gunwagh,"Maharashtra, India",एक भारतीय ! राष्ट्रवादी विचारो का स्वागत हे । नरेंद्र मोदी एवं भाजपा समर्थक !,480,724,91483,False,"Lethal Viruses have been stolen by China from Canada, for Bio Weapon researcher in 2019 in Wuhan Lab. There are reports abt it. Those tests have gone, viruses mutated and gone out of control. This is the crux of #Coronavirus !! Rest all is CCP propaganda to cover it up."
2020-01-27 14:53:16+00:00,"RT @CNN: How to protect yourself from Wuhan coronavirus:

- Avoid close contact with anyone showing symptoms of respiratory illness
- Cook…",YogeshYoYo007,India,Meditation 🧘‍♂️ https://t.co/gGBIniXgzP #Shiva we are the world 🗺 🌍🪐 (letest update of the world).  #Norelegation,1100,1823,43872,False,"How to protect yourself from Wuhan coronavirus:

- Avoid close contact with anyone showing symptoms of respiratory illness
- Cook food thoroughly
- Wash your hands
- Cover your mouth and nose when you cough or sneeze
- Wear a surgical mask

https://t.co/Hh2vvu5PnZ"
2020-01-27 14:52:38+00:00,"RT @htTweets: Chinese Premier Li Keqiang visits Wuhan province, takes charge to contain Coronavirus outbreak

(report by @spatranobis)

htt…",varun18vijay,"Bengaluru, India","News-Curator Content-Curator Political-Analyst Patriot 
(Subliminal/Hidden Messages Decoder) Trend-Spotter
Retweets, Likes imply #interesting, NOT endorsements",1382,3932,555497,False,"Chinese Premier Li Keqiang visits Wuhan province, takes charge to contain Coronavirus outbreak

(report by @spatranobis)

https://t.co/FRVC8cYTox https://t.co/XWOIUO5aIL"
2020-01-27 14:52:18+00:00,"RT @NavroopSingh_: Lethal Viruses have been stolen by China from Canada, for Bio Weapon researcher in 2019 in Wuhan Lab. There are reports…",VAJatt,"Haryana, India","Call a spade a spade
गलत को गलत और सही को सही बोलना",229,531,24431,False,"Lethal Viruses have been stolen by China from Canada, for Bio Weapon researcher in 2019 in Wuhan Lab. There are reports abt it. Those tests have gone, viruses mutated and gone out of control. This is the crux of #Coronavirus !! Rest all is CCP propaganda to cover it up."
2020-01-27 14:52:21+00:00,RT @NavroopSingh_: Virus-hit Wuhan has two laboratories linked to Chinese bio-warfare program https://t.co/LnnGfNlraU,amrud_aadmi,India,Optimist. Nationalist. Observer.,42,9,48182,False,Virus-hit Wuhan has two laboratories linked to Chinese bio-warfare program https://t.co/LnnGfNlraU
2020-01-27 14:52:02+00:00,RT @cnni: Scientists at Imperial College London have estimated that each person infected with the Wuhan coronavirus has gone on to infect t…,YogeshYoYo007,India,Meditation 🧘‍♂️ https://t.co/gGBIniXgzP #Shiva we are the world 🗺 🌍🪐 (letest update of the world).  #Norelegation,1100,1823,43872,False,"Scientists at Imperial College London have estimated that each person infected with the Wuhan coronavirus has gone on to infect two to three people, according to a report released Saturday. https://t.co/BsV2ZXSCWR"
2020-01-27 14:52:04+00:00,RT @republic: Govt decides to prepare for evacuation of Indians from coronavirus-hit Wuhan in China https://t.co/vx1WieyE26,dilipjain1979,"Bengaluru, India",Entrepreneur ● Love Cooking ● Blessed To Be Followed By PM Narendra Modi & Sh Amit Shah ● #JaiHind 🇮🇳,13514,413,278478,False,Govt decides to prepare for evacuation of Indians from coronavirus-hit Wuhan in China https://t.co/vx1WieyE26
2020-01-27 14:52:10+00:00,"RT @NavroopSingh_: Lethal Viruses have been stolen by China from Canada, for Bio Weapon researcher in 2019 in Wuhan Lab. There are reports…",theoneabhi,India,"Seeker. Right-wing. Modi-fied.
Congis and Leftists beware",112,741,20387,False,"Lethal Viruses have been stolen by China from Canada, for Bio Weapon researcher in 2019 in Wuhan Lab. There are reports abt it. Those tests have gone, viruses mutated and gone out of control. This is the crux of #Coronavirus !! Rest all is CCP propaganda to cover it up."
2020-01-27 14:51:38+00:00,"RT @ISCResearch: #Wuhan has more than 25,000 confirmed cases &amp; more than 43,000 infections, according to Hong Kong researchers. They claim…",Vinayohara,"Bengaluru, India","Money is not the Goal. Goal is to live life the way I want to. 
A learning Investor.
Digital Design is what I do earn my bread.",268,359,11446,False,"#Wuhan has more than 25,000 confirmed cases &amp; more than 43,000 infections, according to Hong Kong researchers. They claim that confining Wuhan does not stop the #coronavirus. They expect major epidemics in major Chinese cities by April / May 2020
#nCoV2019
https://t.co/7nF7SzHESK"
